가게ID,가게명,업종,평점,날짜,리뷰내용
1495465182,연제네 반포점베트남음식,태국음식,,10.8,"반포 연제네에서 맛본 특별한 조합! 곱창쌀국수는 진하고 칼칼한 국물에 곱창의 고소한 풍미가 가득 배어있어 정말 매력적이었어요. 쫄깃한 곱창과 부드러운 쌀국수 면의 조화가 일품이었습니다. 함께 시킨 나시고랭은 달콤 짭짤한 소스가 밥알에 잘 코팅되어 감칠맛을 더했고, 아삭한 채소와 계란 프라이가 어우러져 풍성한 맛을 완성했습니다. 한국적인 칼칼함과 동남아의 이국적인 맛을 동시에 느낄 수 있어 더욱 특별한 식사였어요. 꼭 한번 드셔보세요!"
1495465182,연제네 반포점베트남음식,태국음식,,10.8,점심에 방문예약 없이 이용대기 시간 바로 입장친목친구
1495465182,연제네 반포점베트남음식,태국음식,,10.7,점심에 방문예약 없이 이용대기 시간 바로 입장데이트연인・배우자
1495465182,연제네 반포점베트남음식,태국음식,,10.7,점심에 방문예약 없이 이용대기 시간 바로 입장일상혼자
1495465182,연제네 반포점베트남음식,태국음식,,10.4,"점심에 방문예약 없이 이용대기 시간 바로 입장가족모임연인・배우자, 아이"
1495465182,연제네 반포점베트남음식,태국음식,,10.2,저녁에 방문예약 없이 이용대기 시간 바로 입장일상부모님
1495465182,연제네 반포점베트남음식,태국음식,,10.11,점심에 방문예약 없이 이용대기 시간 바로 입장데이트연인・배우자
1495465182,연제네 반포점베트남음식,태국음식,,10.11,점심에 방문예약 없이 이용대기 시간 바로 입장일상아이
1495465182,연제네 반포점베트남음식,태국음식,,10.1,저녁에 방문예약 없이 이용대기 시간 바로 입장데이트연인・배우자
1495465182,연제네 반포점베트남음식,태국음식,,10.1,점심에 방문예약 없이 이용대기 시간 바로 입장데이트연인・배우자
1495465182,연제네 반포점베트남음식,태국음식,,10.1,점심에 방문예약 없이 이용대기 시간 바로 입장데이트연인・배우자
1495465182,연제네 반포점베트남음식,태국음식,,10.1,점심에 방문예약 없이 이용대기 시간 바로 입장일상혼자
1495465182,연제네 반포점베트남음식,태국음식,,10.1,점심에 방문예약 없이 이용대기 시간 바로 입장일상혼자
1175045399,카사이이자카야,사시미,,7.11,교대 근처 지하에 있는 이자카야다. 카운터 형식의 바와 일단 테이블 자리가 있다. 키오스크로 요리 주문이 가능하다.
1175045399,카사이이자카야,사시미,,6.7,일단 음식이 다 맛있고 분위기까지 있어서 특별한 날 가기에 너무 좋았어요!
1175045399,카사이이자카야,사시미,,5/5,인테리어도 이쁘고 분위기도 차분하니 대화하기도 너무 좋아요 예약없이 방문해서 테이블자리 앉았었는데 주방 구경하는 재미도 쏠쏠했습니당👍🏻
1175045399,카사이이자카야,사시미,,5.14,"최근 방문한 이자카야 중에서 제일 맛있었어요. 모든 메뉴 구성이 무척 좋았지만, 그 중에서도 특히 프로슈토 마구로가 잊을 수 없을 정도로 최고였습니다.. 이거 먹고 싶어서 재방문하려구요. 신선한 음식뿐만 아니라 분위기, 인테리어 그리고 친절함까지 모든 방면으로 100프로 만족스러웠습니다!"
1175045399,카사이이자카야,사시미,,4.1,"여럿 요리를 먹어봤는데, 토마토 해산물 앙쿠르트스프와 베이컨 포테이토 사라다!"
1175045399,카사이이자카야,사시미,,24.9,첫방문인데 너무너무 만족했어요. 남편도 너무 좋다해서 다음번 재방문 의사 100프로랍니다! 메로구이 진쨔 미쳤어요~^^
1175045399,카사이이자카야,사시미,,24.8,"고등어 초밥을 목적으로 방문했지만, 전복내장 파스타랑, 미트볼도 맛있었어요. 처음에 안내부터, 주문 방법 설명 너무 친절하게 잘해주셔요✨️"
1175045399,카사이이자카야,사시미,,24.7,교대근처로 가게되면 자꾸 방문하게 되네요^^ 대화하면서 맛있는 음식 먹기 너무 좋았어요~ 매니저님 친절하시고 분위기도 좋아요~ 교대갈일 있으면 또 방문할게요^^
1175045399,카사이이자카야,사시미,,24.7,저녁에 방문예약 후 이용대기 시간 바로 입장친목지인・동료
1175045399,카사이이자카야,사시미,,24.7,"진짜 국내에서, 특히 서울에서 이렇게 신선한 우니 먹을 수 있어서 너무 좋았어요ㅠㅠㅠ 우니가 잘못하면 진짜 비리고 맛 없는데, 홋카이도에서 먹었던 우니와 동일한 맛이 나서 너무 좋았습니다=)"
1175045399,카사이이자카야,사시미,,24.6,밤에 방문예약 후 이용대기 시간 바로 입장친구
1175045399,카사이이자카야,사시미,,24.6,저녁에 방문예약 후 이용대기 시간 10분 이내 친목지인・동료
1175045399,카사이이자카야,사시미,,24.6,저녁에 방문예약 후 이용대기 시간 바로 입장친목친구
1175045399,카사이이자카야,사시미,,24.5,모든 메뉴를 맛 볼 수 없던 위를 원망할 정도로 시킨 모든 메뉴가 맛있었습니다! 해산물이 주가 되는 메뉴들이 특히 맛있었어요!!
1175045399,카사이이자카야,사시미,,24.5,일본 소주 한 병 시켜서 정말 맛나게 먹었습니다~
1175045399,카사이이자카야,사시미,,24.4,서초구 근처 카사이라는곳을 방문했습니다 간단하게 2차로 하려 했었는데 이소베마키 모모니쿠카라아게 이거 2개 먹고 바로 주문 폭주 냅다 해버렸네요 특히 장어 핸드롤은 3번이나 추가 주문해서 먹었어요!! 마지막 해장겸 바지락술찜 이거 먹고 술1병 더시켰어요 위험한 메뉴입니다...다음에도 약속은 여기서 할만큼 기억에 남는곳입니다
1175045399,카사이이자카야,사시미,,24.3,저녁에 방문예약 없이 이용대기 시간 바로 입장일상기타
1175045399,카사이이자카야,사시미,,24.3,전갱이 사시미라는거 처음 먹어봤는데 너어무 맛있어요! 전복내장 파스타도 맛있고 마구로마키도 한 입 가득 꽉차게 먹으면 부드럽고 맛납니다
1175045399,카사이이자카야,사시미,,24.2,저녁에 방문예약 없이 이용대기 시간 바로 입장일상친구
1175045399,카사이이자카야,사시미,,24.2,집앞에 도산공원 청담같은 느낌의 업장이 생겨 너무 좋네요! 9시 이후 방문객들에겐 10프로 할인까지ㅜㅜ
1175045399,카사이이자카야,사시미,,24.12,밤에 방문예약 없이 이용대기 시간 바로 입장데이트연인・배우자
1175045399,카사이이자카야,사시미,,24.12,밤에 방문예약 후 이용대기 시간 바로 입장친목지인・동료
1175045399,카사이이자카야,사시미,,24.12,이동네에서 제일 깔끔하고 맛있게 잘 하는 일식다이닝바. 메뉴가 다양해서 올때마다 새로운 메뉴 시키는데 다 맛있어요. 친절하시고 분위기도 좋아요. 임산부라 술 못먹는데 무알콜 맥주있어서 기분냈네요. 멘치카스 이소제마키 에비산도 등등 다 맛있어요 굳굳!!
1175045399,카사이이자카야,사시미,,23.9,계절메뉴 신메뉴를 패드로 보니 눈에 안띠어서 못시킨거 억울해요. 좀더 잘보이게 홍보해주세요>_<
1175045399,카사이이자카야,사시미,,23.9,포테이토사라다랑 카라아게 맛있어요! 삿포로랑 같이 먹기 좋았어요. 토마토 해산물 스프는 쏘쏘. 분위기는 좋고 친절해요. 재방문하고 싶어요.
1175045399,카사이이자카야,사시미,,23.8,남자친구와 4주년 기념으로 방문했어요
1175045399,카사이이자카야,사시미,,23.7,캐치테이블에서 예약하고 방문했슴다 역시 시그니처답게 해산물앙쿠르트스프 진~~~짜 맛있음 꼭 시키시길 ㅠㅠ 빵이 미쳣어요.. 그리고 사시미 기대 안하고 시켰는데 핵맛있는데유???? 서비스로 프로슈토마구로 주셨는데 너무 감사함니당 🩷🩷 직원분들도 친절하시고 매장 인테리어 넘 예뻐요 번창하세요!!!!
1175045399,카사이이자카야,사시미,,23.6,다만 안주가 다 너무 좋아서 다양한 술을 즐길 수 있게 잔소주와 그라스와인(하우스와인으로 샴페인/화이트)정도만 구비해주시면 더 좋을 듯 합니다. 정말 오래오래 잘 되길 바라요~~
1175045399,카사이이자카야,사시미,,23.5,-토마토해산물 앙쿠르트스프: 토마토 스튜에 카레가루랄까요(갠적생각) 암튼 약간의매콤한이 안물리고 맛있어요.! 위에있는 페스츄리같은건 얆아서 식감도 좋고 같이먹으니 훨 맛있네요.
1175045399,카사이이자카야,사시미,,23.5,가위랑 집게는 얼마나 귀여운지 ㅋㅋ소품같아요 ㅋㅋ
1175045399,카사이이자카야,사시미,,23.5,"교대에 새로운 맛집 발견했다고 친구가 추천해줘서 깄는데 둘이서 매뉴 5개먹고옴.. 분위기&메뉴구성&맛대비 가격도 착하게 느껴져서 다음주에 친구들이랑 또 가기로함,, 저 고등어초밥 진짜 도른놈,,"
1175045399,카사이이자카야,사시미,,23.5,동네에 새로 오픈했길래 가봤는데 분위기가 ㄷ ㄷ ㄷ
1175045399,카사이이자카야,사시미,,23.5,동네에 새로 오픈했길래 가봤는데 분위기가 ㄷ ㄷ ㄷ
1175045399,카사이이자카야,사시미,,23.5,동네에 새로오픈했다고 해서 가봤는데 진짜 맛도리.. 고등어봉초밥 좋아해서 가봤는데 그건 품절이라 못먹어봤어요ㅠㅠㅠ 아쉬운데로 고등어볶음밥 먹었는데 이게 무슨... 너무 맛있어서 봉초밥 못먹은거 아쉽지않았어여 해산물나베였나 저것랑 궁합이 아주 .. 찰떡😆 매장도 깨끗하고 바 형식으로 되어서 오픈주방이라 요리하는거 보는 재미도 있었네요! 다음엔 봉초밥 먹으러 가볼게요!
1175045399,카사이이자카야,사시미,,23.5,마구로슈토치즈아에는 치즈와 계란의 조화..거기에 김으로 화룡점정…대단원의 끝을 알리듯 입을 깔끔하게 마무리하기에 너무나 적절했다..프로슈토 마구로늠 친구가 오기 전 너무 맛있어서 몰래 먹고 아보카도크림으로 현장 덮으려고 시도했으나 너무 맛있어서 하나 더 먹음..
1175045399,카사이이자카야,사시미,,23.5,분위기 좋고 직원분들도 친절하셔서 기분 좋은 식사했어요ㅎㅎ 맛도 있어요
1175045399,카사이이자카야,사시미,,23.5,"분위기 좋은 술집 찾다가 가봤는데 완전 만족했습니다. 일단 분위기가 일반 술집이랑 달랐어요. 가게가 지하여서 프라이빗하고 조명도 적당하고 노래도 볼륨은 크지만 잔잔하게 흘러나와서 상대방과 대화하기에 딱 좋았어요. 오픈주방이라 주방 청결도 다보여서 좋았습니다. 음식도 다 맛있었고, 좋았어요!"
1175045399,카사이이자카야,사시미,,23.5,"분위기 좋은 술집 찾다가 가봤는데 완전 만족했습니다. 일단 분위기가 일반 술집이랑 달랐어요. 가게가 지하여서 프라이빗하고 조명도 적당하고 노래도 볼륨은 크지만 잔잔하게 흘러나와서 상대방과 대화하기에 딱 좋았어요. 오픈주방이라 주방 청결도 다보여서 좋았습니다. 음식도 다 맛있었고, 좋았어요!"
1175045399,카사이이자카야,사시미,,23.5,분위기 진짜 짱이고 음식도 너무 맛있었어요 ㅠㅠ신랑이랑 다음에 또 갈게요~!
1175045399,카사이이자카야,사시미,,23.5,분위기 진짜 짱이고 음식도 너무 맛있었어요 ㅠㅠ신랑이랑 다음에 또 갈게요~!
1175045399,카사이이자카야,사시미,,23.5,생소한 메뉴엔 상세설명이 있고 물어보면 친절하고 상세히 알려주셔서 더 좋았어요
1175045399,카사이이자카야,사시미,,23.5,"어느하나 부족함없는 식사(?)겸 술자리였습니다 ,"
1175045399,카사이이자카야,사시미,,23.5,우연히 알게되었는데 너무 만족했고 해산물 러버로써 행복했어요 ㅎㅎ 이번에 친구들이랑 왔는데 다음번엔 남자친구랑 와야겠어요 너무 분위기 좋아요! 잘먹었습니당
1175045399,카사이이자카야,사시미,,23.5,음식류 너무 맛있고 분위기 너무 좋아서 또 올게요
1175045399,카사이이자카야,사시미,,23.5,음식류 너무 맛있고 분위기 너무 좋아서 또 올게요
1175045399,카사이이자카야,사시미,,23.5,인테리어가 너무 멋져서 솔직히 음식맛보다는 분위기 즐기러 간거였는데 음식에 반하고왔어요!!!
1175045399,카사이이자카야,사시미,,23.5,인테리어가 너무 멋져서 솔직히 음식맛보다는 분위기 즐기러 간거였는데 음식에 반하고왔어요!!!
1175045399,카사이이자카야,사시미,,23.5,일단 계단을 내려가자마자 분위기가 너무 좋아 한번 놀라구 직원분들이 너무 친절하셔서 두번 놀라구 음식과하이볼이 너무 맛있어서 총 3번놀란 가게입니다 음식이 너무 맛있어서 다음주에도 지인들과 한번 더 갈 예정입니다넌
1175045399,카사이이자카야,사시미,,23.5,"정말 기념일에 가기 최고인 곳입니다.!!! 무엇보다 음식이 너무 맛있고요.!! 가격보면 분위기나 음식 퀄리티, 서비스 등에 비해서 가성비 너무 좋은 것 같아요… 새로 오픈했을 뿐 좀만 더 유명해지면.. 예약하기도 쉽지 않을 듯 ㅠㅠ 기념일로 오기 최고의 플레이스인 거 같아요.!! 사시미는 진짜 입에서 녹구요 ㅠ 에피타이저로 나온 식전 음식도 너무 맛있었습니다.!! 다음엔 여자친구와 룸에서 한 번 먹어보려구요! 충분히 또 갈 집! 입니다!!!"
1175045399,카사이이자카야,사시미,,23.5,중요한날이나 소중한 사람들과 함께하고싶은날에 꼭 다시 와야겠어요
1175045399,카사이이자카야,사시미,,23.5,추가로 오픈기념 5월까지는 전체금액에 일정부분 할인해주시니 방문하실 분은 빨리 방문해보시는걸 추천해요~
1175045399,카사이이자카야,사시미,,23.5,추가로 오픈기념 5월까지는 전체금액에 일정부분 할인해주시니 방문하실 분은 빨리 방문해보시는걸 추천해요~
1175045399,카사이이자카야,사시미,,23.5,칭구들이랑 또 가기로 했오요~ 완전완전 강추에요 테이블 간격도 넓고 너무 깨긋해여~ 설명도 너무 잘햐주셔서 대접받는 느낌이랄까요?? 우선 재료 신선함이 느껴져서 좋아요
1175045399,카사이이자카야,사시미,,23.5,퇴근하고 집가는길에 새로 생긴곳 오픈한지 일주일 됐다고 한다 별 생각없이 시킨 에비산도 👍
1175045399,카사이이자카야,사시미,,23.5,퇴근하고 집가는길에 새로 생긴곳 오픈한지 일주일 됐다고 한다 별 생각없이 시킨 에비산도 👍
1175045399,카사이이자카야,사시미,,23.5,"회식겸 생일파티하려고 방문했는데 음식,분위기 맛까지 다 한번에 잡으신거같아요 너무 너무 맛있고 즐거운 시간보내다 갑니다😊"
1175045399,카사이이자카야,사시미,,23.4,교대역 근처에 분위기좋은 이자카야가 생겨서 너무 좋아요😆😆 오픈주방이라 위생도 더 신경쓰시는것 같고 맛도 엄청 맛있습니다. 지인들이랑 자주 방문해서 여기있는 메뉴들을 다 먹어보고싶네요🍣🍤🦪
1175045399,카사이이자카야,사시미,,23.4,교대역 근처에 분위기좋은 이자카야가 생겨서 너무 좋아요😆😆 오픈주방이라 위생도 더 신경쓰시는것 같고 맛도 엄청 맛있습니다. 지인들이랑 자주 방문해서 여기있는 메뉴들을 다 먹어보고싶네요🍣🍤🦪
1175045399,카사이이자카야,사시미,,23.12,저녁에 방문예약 후 이용대기 시간 바로 입장데이트연인・배우자
1175045399,카사이이자카야,사시미,,23.12,저녁에 방문예약 후 이용대기 시간 바로 입장친목친구
1175045399,카사이이자카야,사시미,,23.11,저녁에 방문예약 없이 이용대기 시간 바로 입장데이트지인・동료
1175045399,카사이이자카야,사시미,,23.10,전어스시는 비렸고 밥의 양도 너무 많았어요. 그렇다고 가격이 스시 전문점보다 저렴한 것도 아닌데 퀄리티 차이는 크네요. 네기토로 핸드롤은 그나마 맛있었지만 또 갈 정도는 아니었구요. 프로슈토 마구로도 그냥 붉은 참치살에 프로슈토로 한번 휘감은 맛 그게 다에요. 전체적으로 신선도를 좀 올려야할 것 같아요.
1175045399,카사이이자카야,사시미,,2.17,"이자카야에서 먹는 음식의 품격을 높여준 곳입니다. 오픈키친의 쉐프들은 분업이 잘 되어 있고 음식은 손님과 한 호흡으로 준비되어 딱 먹기가 좋습니다. 비슷한 메뉴도 굽기 정도, 간, 소스에 따라 다른 맛을 내죠~ 여기 훌륭합니다. 지인들과 대화하면서 좋은 시간 보낼 수 있어요. 사진은 못 찍었는데 술찜도 아주 시원하고 칼칼하니 굿! 서초-교대에서는 계속 방문하고 싶은 곳이네요~"
368880338,쿤쏨차이태국음식,태국음식,,9.4,주차불편.. 직원 불친절.. 사진은 맛있게 나왔는데 음식까지 맛없음.. 두번째 방문인데 이제 못오겠네요..
368880338,쿤쏨차이태국음식,태국음식,,9.20,음식이 현지 느낌 나고 맛있어요. 나무젓가락을 씨어서 제공하는데 위생상 안좋은데 쇠젓가락도 같이 제공되면 좋겠어요
368880338,쿤쏨차이태국음식,태국음식,,9.18,점심에 방문예약 없이 이용대기 시간 바로 입장
368880338,쿤쏨차이태국음식,태국음식,,8.17,제대로 큼직한 새우가 들어간 똠양꿍(꿍=새우)과 뿌팟뽕커리.. 뿌팟뽕커리는 준비되어 있는 새콩 소스를 살짝 올려 먹으니 세상 행복한 맛이다.
368880338,쿤쏨차이태국음식,태국음식,,8.12,"점심에 방문예약 없이 이용대기 시간 바로 입장친목, 일상지인・동료"
368880338,쿤쏨차이태국음식,태국음식,,7.7,서초살때도 이사가서도 꼭 일부러 찾아오는 맛집이에요! 점심시간에 오면 항상 웨이팅이 있어서 이번에도 있겠구나 하고 마음 먹고 왔는데 다행히 바로 들어왔어요!🥰 오늘도 맛있게 먹고갑니다〰️
368880338,쿤쏨차이태국음식,태국음식,,7.19,"태국 쌀국수에 빠져서 찾은 집인데 또왔어요~ 여긴 쌀국수는 물론 볶음밥,. 볶음면 모두 엄청 맛있어요. 똠양치킨은 진짜 안느끼하고 새콤달콤 코코넛 맛도 나고 맛있어요 저녁에 안주로 먹어도 짱일듯"
368880338,쿤쏨차이태국음식,태국음식,,6.17,메뉴 두개 주문해서 맛있게 먹었는데..뭐가 허전한 느낌이네요
368880338,쿤쏨차이태국음식,태국음식,,5.12,오랜만에 태국 음식 땡겨서 다녀왔어용 종류도 많고 핫한 것 같아요? 메뉴 하나하나 비주얼이 좋구 맛있어요 다만 양이 조금 적은 편 같아요
368880338,쿤쏨차이태국음식,태국음식,,5.11,전체적으로 양은 많지 않은 편이지만 맛은 있어요. 뿌팟퐁 커리는 게가 부드럽고 맛있게 잘 튀겨져서 좋았어요 커리 소스도 매콤하니 맛있었어요.
368880338,쿤쏨차이태국음식,태국음식,,4.23,"주문도 누락되어서, 저보다 늦게 온 팀 3곳 음식 다 나가고... 20분 지나서 겨우 음식을 받았어요. 태국 음식 생각나면 종종 들렸는데 실망스럽습니다ㅜ"
368880338,쿤쏨차이태국음식,태국음식,,4.2,저녁에 방문예약 없이 이용대기 시간 바로 입장데이트
368880338,쿤쏨차이태국음식,태국음식,,3.28,예전방문때보다 푸팟퐁커리 양이 현저히 줄었어 많이 아쉬웠어요 갈비쌀국수 맛있어요
368880338,쿤쏨차이태국음식,태국음식,,3.18,소갈비쌀국수와 에그롤 주문했는데 향이 강하지 않고 누구나 다가가기 좋은 맛입니다
368880338,쿤쏨차이태국음식,태국음식,,3.15,식초를 적절히 쓴 맛. 너무 시큼하지도 않은게 딱 식욕 돋구는 맛. 안에 갈비도 잘 익어서 질기지 않고 잘 발라짐. 독특해서 자주 먹고 싶음.
368880338,쿤쏨차이태국음식,태국음식,,3.11,평소 태국음식을 너무 좋아하는데 여기 똠얌꿍과 뿌팟봉커리 아주 맛있어요. 특히 똠얌꿍이 현지맛에 더 가까워요. 코코넛 치킨3조각도 시켰었는데 코코넛맛도 전혀 안나고 너무 평범한 그렇다고 맛있지는 않은 치킨였어요.
368880338,쿤쏨차이태국음식,태국음식,,3.0,여기 사장 바뀜? 예전에 참 맛나게 먹어서 회식까지 여기로 잡았었는데. 사진으로 올린 1년 전에 먹었던 갈비 바베큐(3.0만원)가 기억나서 다시 왔더니 ㅋㅋㅋㅋ
368880338,쿤쏨차이태국음식,태국음식,,24.9,고기국물이 느끼하지않고 약간 새콤한 맛이 느껴지는데 그게 느끼함을 잡아줘요~ 테이블 위의 소스도 곁들어먹으면 짱맛! 닭고기튀김도 맛있게 잘먹었습니다^^
368880338,쿤쏨차이태국음식,태국음식,,24.9,밤에 방문예약 없이 이용대기 시간 바로 입장일상혼자
368880338,쿤쏨차이태국음식,태국음식,,24.9,점심에 방문예약 없이 이용대기 시간 바로 입장일상연인・배우자
368880338,쿤쏨차이태국음식,태국음식,,24.9,"점심에 방문예약 없이 이용대기 시간 바로 입장친목연인・배우자, 친구"
368880338,쿤쏨차이태국음식,태국음식,,24.8,뿌팟퐁커리 주문했어요! 커리가 좀 달달했지만 방해될만큼 단 건 아니라서 맛있게 먹었어요 😆 게튀김이 정말 정말! 바삭해서 좋았어요 같이 나온 국물도 좋았고요 👍 다만 커리가 좀 묵직하고 기름지니까 피클 같은 초절임 야채가 사이드메뉴로 있었으면 완벽할 것 같아요!
368880338,쿤쏨차이태국음식,태국음식,,24.8,"서초동 아크로비스타 옆 골목에 숨어있는 미슐랭 맛집,, 작은 가게에서 이런 내공의 태국음식을 먹을 수 있다니 놀랍다, 뿌팟퐁커리 맛있었고 퍼사오, 팍붕파이댕, 쏜땀 하나 하나 맛있었다. 분위기도 좋아서 다시 오고 싶은 집"
368880338,쿤쏨차이태국음식,태국음식,,24.7,소스위에 게가 얹어져 나와 바삭바삭한 식감을 온전히 느끼기 좋고 커리에 단맛만 나는게 아니라 매콤한 맛도 같이 나서 태국 음식 별로 안 좋아하는 사람도 호불호 없이 먹기 좋은 스타일
368880338,쿤쏨차이태국음식,태국음식,,24.7,점심에 방문예약 후 이용대기 시간 바로 입장데이트친구
368880338,쿤쏨차이태국음식,태국음식,,24.6,예약하지않고 가서 살짝 대기하긴했어요! 뿌팟뽕커리는 강추입니다! 코코넛밥 추가해서 비벼먹으니 진짜 맛있어요~ 고기 쌀국수도 맛있었고 마지막 새우튀김 텃만꿍 새우가 알차고 꿀맛! 세메뉴 모두 굿굿입니다~ 재방문의사 있어요!
368880338,쿤쏨차이태국음식,태국음식,,24.6,운좋게 바로 들어가서 식사할 수 있었어요!!! 맛있어서 기분 좋았던 식사~
368880338,쿤쏨차이태국음식,태국음식,,24.6,저녁에 방문예약 없이 이용대기 시간 바로 입장데이트연인・배우자
368880338,쿤쏨차이태국음식,태국음식,,24.6,저녁에 방문예약 없이 이용대기 시간 바로 입장친목친척・형제
368880338,쿤쏨차이태국음식,태국음식,,24.6,점심에 방문예약 없이 이용대기 시간 바로 입장일상혼자
368880338,쿤쏨차이태국음식,태국음식,,24.5,음식은 기대를 많이해서 그런지 맛있다는 느낌은 아니였습니다. 강렬한 첫느낌은 서빙하시는 여자분이 매우 불친절하다... 음식두고 쌩~ 입맛떨어짐..주방직원분들은 친절하심
368880338,쿤쏨차이태국음식,태국음식,,24.5,조금만 매워도 맵다고 하는 초등 둘째가 뿌팟봉커리 한입 먹고는 소갈비비비큐 열심히 먹은 덕에
368880338,쿤쏨차이태국음식,태국음식,,24.4,"런치에 사람 많습니다 친절함과 불친절함 그사이 묘한 불쾌스러운 응대방식에 왕갈비쌀국수와 푸팟퐁커리,치킨3조각 음료2개 주문했습니다. 셰프님의 애인분혼자 홀을보시던데 혼자 감당하지 못하시더군요 음식 나온지가언젠데 음료는 안나오고 말씀드리려해도 자기할일하느라 바빠서 보시지도 않고 직접가서 음료 누락된것 다시말씀드리고 받았습니다. 음식맛은 그냥 동네 태국음식점에서 맛볼수있는 평범하고 흔한맛이였어요 테이블위에 소스는 뚜껑없이 방치됐는데 어디에 어떻게 먹는지도모르겠고 공기중에 날아다니는 먼지가 많은데 비위생적으로 방치돼있어서 안먹었습니다"
368880338,쿤쏨차이태국음식,태국음식,,24.4,뿌팟뽕커리가 정말 맛있었고 소고기 쌀국수는 좀 싱거운 맛이었어요
368880338,쿤쏨차이태국음식,태국음식,,24.4,생각나서 또 갔죠!😎 근데 입덧이 시작되어서.. 많이 못먹고 왔어요😭 입덧 끝나면 다시 가야겠어요
