가게ID,가게명,업종,평점,날짜,리뷰내용
1326338352,소이연남 파미에스테이션점태국음식,태국음식,,2.13,점심에 방문예약 없이 이용대기 시간 바로 입장일상부모님
1326338352,소이연남 파미에스테이션점태국음식,태국음식,,2.12,똠양궁쌀국수도 맛있고 뽀빠이는 고소해요. 자주 찾는집이에요.직원이 조금만 친절하면 더 좋겠어요
1326338352,소이연남 파미에스테이션점태국음식,태국음식,,2.10,저녁에 방문예약 없이 이용대기 시간 바로 입장일상친구
1326338352,소이연남 파미에스테이션점태국음식,태국음식,,10.8,저녁에 방문예약 없이 이용대기 시간 바로 입장일상연인・배우자
1326338352,소이연남 파미에스테이션점태국음식,태국음식,,10.8,점심에 방문예약 없이 이용대기 시간 바로 입장데이트연인・배우자
1326338352,소이연남 파미에스테이션점태국음식,태국음식,,1.30,2층에 있는데 자리도 많고 음식이 전반적으로 괜찮아서 잘 먹고 왔습니다.
1326338352,소이연남 파미에스테이션점태국음식,태국음식,,1.30,똠얌 쌀국수는 처음 시켜봤는데 국물이 좀 걸쭉하고 매콤하고 묵직한 맛이었어요. 탄탄면에 신 맛이 더해지고 고수향이 추가된 느낌. 고기고명 없이 느타리버섯은 안 어울렸어요.
1326338352,소이연남 파미에스테이션점태국음식,태국음식,,1.30,저녁에 방문예약 없이 이용대기 시간 바로 입장일상혼자
1326338352,소이연남 파미에스테이션점태국음식,태국음식,,1.29,"리뷰 1,144사진 168팔로워 18"
1326338352,소이연남 파미에스테이션점태국음식,태국음식,,1.26,"사장님께서 엄청 친절하세요. 맛있게 먹었는지 확인 해 주시고 스몰토크도 같이 해 주십니다. 음식도 맛있어요. 고수를 취향에 따라 추가 할 수 있어서 현지 음식처럼도 먹을 수 있고, 한국화 된 음식처럼 먹을 수도 있어요."
1326338352,소이연남 파미에스테이션점태국음식,태국음식,,1.26,"사장님께서 엄청 친절하세요. 맛있게 먹었는지 확인 해 주시고 스몰토크도 같이 해 주십니다. 음식도 맛있어요. 고수를 취향에 따라 추가 할 수 있어서 현지 음식처럼도 먹을 수 있고, 한국화 된 음식처럼 먹을 수도 있어요."
1326338352,소이연남 파미에스테이션점태국음식,태국음식,,1.26,점심에 방문예약 없이 이용대기 시간 바로 입장일상혼자
1326338352,소이연남 파미에스테이션점태국음식,태국음식,,1.26,점심에 방문예약 없이 이용대기 시간 바로 입장일상혼자
1326338352,소이연남 파미에스테이션점태국음식,태국음식,,1.25,저녁에 방문예약 없이 이용대기 시간 바로 입장데이트연인・배우자
1326338352,소이연남 파미에스테이션점태국음식,태국음식,,1.25,저녁에 방문예약 없이 이용대기 시간 바로 입장데이트연인・배우자
1326338352,소이연남 파미에스테이션점태국음식,태국음식,,1.24,저녁에 방문예약 없이 이용대기 시간 바로 입장친목친구
1326338352,소이연남 파미에스테이션점태국음식,태국음식,,1.24,저녁에 방문예약 없이 이용대기 시간 바로 입장친목친구
1326338352,소이연남 파미에스테이션점태국음식,태국음식,,1.23,저녁에 방문예약 없이 이용대기 시간 바로 입장일상
1326338352,소이연남 파미에스테이션점태국음식,태국음식,,1.23,저녁에 방문예약 없이 이용대기 시간 바로 입장일상
1326338352,소이연남 파미에스테이션점태국음식,태국음식,,1.22,점심에 방문예약 없이 이용대기 시간 10분 이내 일상혼자
1326338352,소이연남 파미에스테이션점태국음식,태국음식,,1.22,점심에 방문예약 없이 이용대기 시간 10분 이내 일상혼자
1326338352,소이연남 파미에스테이션점태국음식,태국음식,,1.22,점심에 방문예약 없이 이용대기 시간 30분 이내친목친구
1326338352,소이연남 파미에스테이션점태국음식,태국음식,,1.22,점심에 방문예약 없이 이용대기 시간 30분 이내친목친구
1326338352,소이연남 파미에스테이션점태국음식,태국음식,,1.21,점심에 방문예약 없이 이용대기 시간 바로 입장친목친구
1326338352,소이연남 파미에스테이션점태국음식,태국음식,,1.19,점심에 방문예약 없이 이용대기 시간 바로 입장일상연인・배우자
1577034698,스미로우,사시미,,9.9,남은 여름기간 즐겁게 보내시고 가을쯤에 다시 뵐 수 있기를 간절히 바라고 있겠습니다~☺️
1577034698,스미로우,사시미,,9.6,저희 스미로우 요리에 만족하셨길 바라며 오는 주말 즐겁게 보내시길 바래요~❣️❣️
1577034698,스미로우,사시미,,9.5,감바스랑은 비슷한 듯 다른 느낌의 요리이지만 새우 좋아하시는 분들에겐 취향저격인 요리!! 인 마늘새우찜을 추천해주셔서 고맙습니다ㅎㅎ
1577034698,스미로우,사시미,,9.5,제가 테이블을 착각하는 바람에 리뷰를 작성하게 된 손님들이시군요ㅠ 저의 실수에도 흔쾌히 리뷰를 남겨주시겠다고 해주셔서 정말 감사하고 죄송합니다🥹🫶❤️🫶❤️ 좋은 리뷰와 따뜻한 손님 두분의 배려에 다시 한 번 감사드립니다!☺️
1577034698,스미로우,사시미,,9.3,추천추천~리뷰를 작성해주셔서 정말 감사드립니다🥹❤️ 편안하게 한 잔 하고 싶을 때 방문해주시면 맛난 요리로 대접해드리겠습니다!🥰🥰
1577034698,스미로우,사시미,,9.3,추천추천~리뷰를 작성해주셔서 정말 감사드립니다🥹❤️ 편안하게 한 잔 하고 싶을 때 방문해주시면 맛난 요리로 대접해드리겠습니다!🥰🥰
1577034698,스미로우,사시미,,9.28,토마토소스와 가지를 좋아하시는 분이라면 선택하기 딱인 메뉴입니다ㅎㅎ
1577034698,스미로우,사시미,,9.27,저희 스미로우 요리를 맛있게 즐겨주셔서 다시 한 번 감사드리며 즐거운 명절 보내시길 바라겠습니다!🥰🫶🫶
1577034698,스미로우,사시미,,9.26,와 아는 언니 통해서 왓는데 개맛도리입니다. 우왁우왁하면서 먹엇어요 진짜. 만석이라 웨이팅 오뷴 햇어요
1577034698,스미로우,사시미,,9.26,즐거운 명절 연휴 보내시길 바라며 스미로우를 방문해주셔서 다시 한 번 감사합니다❣️🥰🥰
1577034698,스미로우,사시미,,9.21,밤에 방문예약 없이 이용대기 시간 바로 입장친목연인・배우자
1577034698,스미로우,사시미,,9.2,밤에 방문예약 없이 이용대기 시간 바로 입장회식지인・동료
1577034698,스미로우,사시미,,9.2,밤에 방문예약 없이 이용대기 시간 바로 입장회식지인・동료
1577034698,스미로우,사시미,,9.2,저희 가게에서 맛있게 드시고 즐거운 시간을 보내신 것 같아서 기쁘고 다음에 오실 때도 좋은 인상을 드릴 수 있도록 노력하겠습니다!🥰🫶🫶
1577034698,스미로우,사시미,,9.2,저희 가게에서 맛있게 드시고 즐거운 시간을 보내신 것 같아서 기쁘고 다음에 오실 때도 좋은 인상을 드릴 수 있도록 노력하겠습니다!🥰🫶🫶
1577034698,스미로우,사시미,,9.19,저희 스미로우에 자주 방문해주셔서 정말 감사드립니다!!🥰 항상 요리에 최선을 다하며 방문하셨을 때 좋은 시간을 보내실 수 있도록 노력하는 가게가 되겠습니다☺️☺️ 그리고 즐거운 한가위 보내시길 바라겠습니다:-)❣️❣️
1577034698,스미로우,사시미,,9.16,너무 과찬의 말들을 리뷰에 남겨주셔서 정말 감사드리며 지나가는 여름 마무리 잘 하시고 다가오는 가을겨울도 즐거운 날들이 되셨으면 좋겠습니다!❣️🫶❣️🫶
1577034698,스미로우,사시미,,9.15,교대에 방문예정일 때 분위기 괜찮은 이자카야 생각나시면 스미로우를 떠올려주시길🥹❤️ 바라겠습니다ㅎㅎ 다시 한 번 방문해주셔서 고맙습니다:-)❣️
1577034698,스미로우,사시미,,9.15,스미로우(숯을 다루는 사내) 가게 이름이 꼬치와 연관되어 있다보니 손님들께서 꼬치가 맛있다고 해주실 때 더욱 기쁜 마음이 듭니다ㅎㅎ
1577034698,스미로우,사시미,,9.14,저희 가게에서 행복한 시간을 보내셨다니..! 너무 감동적인 리뷰 작성해주신 것과 저희 스미로우에 자주 방문해주신 것 모두 정말 정말 감사드립니다🥹🥰🥰❣️❣️ 항상 만족을 드릴 수 있도록 노력하는 가게가 되겠습니다!!🤩🫡🫡
1577034698,스미로우,사시미,,9.14,저희 나베와 함께 찍힌 손가락 브이가 너무 깜찍합니다ㅎㅎ🥰 좋은 리뷰 남겨주셔서 다시 한 번 감사드리고 지나가는 올해의 마지막 여름도 즐겁게 보내시길 바라겠습니다:-)❣️❣️
1577034698,스미로우,사시미,,9.14,저희 측 실수로 일부 주문이 누락되었던 점 정말 죄송하다고 한 번 더 전해드리며ㅠㅠ 저희 실수에도 너그럽게 넘어가 주신 점도 정말 감사합니다🥹❣️❣️
1577034698,스미로우,사시미,,9.11,항상 맛있는 요리를 제공해드릴 수 있도록 노력하는 스미로우가 되겠습니다!!🙌🙌🥰
1577034698,스미로우,사시미,,8.9,분위기듀 좋고! 맛도 너무 있구~~~~ 짱짱이에요!!! 생맥두 너무 맛잇어오! 사케종류도 많아유 ㅎㅎ
1577034698,스미로우,사시미,,8.9,분위기듀 좋고! 맛도 너무 있구~~~~ 짱짱이에요!!! 생맥두 너무 맛잇어오! 사케종류도 많아유 ㅎㅎ
1577034698,스미로우,사시미,,8.8,사진 속에서 맛있게 드시고 있는 거 같아 보여 기쁩니다ㅎㅎ 방문해주셔서 다시 한 번 감사드리며 즐겁고 시원한 여름 되시길 바라겠습니다:-)❣️
1577034698,스미로우,사시미,,8.8,사진 속에서 맛있게 드시고 있는 거 같아 보여 기쁩니다ㅎㅎ 방문해주셔서 다시 한 번 감사드리며 즐겁고 시원한 여름 되시길 바라겠습니다:-)❣️
1577034698,스미로우,사시미,,8.5,저녁에 방문예약 없이 이용대기 시간 바로 입장데이트연인・배우자
1577034698,스미로우,사시미,,8.5,저녁에 방문예약 없이 이용대기 시간 바로 입장데이트연인・배우자
1577034698,스미로우,사시미,,8.4,먹음직스러운 나베 사진과 함께 리뷰 작성해주셔서 감사드립니다❤️😍😍
1577034698,스미로우,사시미,,8.4,먹음직스러운 나베 사진과 함께 리뷰 작성해주셔서 감사드립니다❤️😍😍
1577034698,스미로우,사시미,,8.29,"넓고 쾌적한 매장에 내부 화장실까지 갖춰져 있어 단체 모임하기에 좋고, 다양한 메뉴들이 대부분 수제로 준비되어 있어 하나하나 정성이 느껴졌던 곳이에요. 새벽 4시까지 영업해서 늦은 시간에도 든든하게 즐길 수 있어 퇴근 후 가볍게 들르기에도, 주말에 여유롭게 들르기에도 딱 맞는 곳입니다."
1577034698,스미로우,사시미,,8.25,꼬치를 고민하지 않아도 된다는 오마카세의 장점을 잘 알고 계시는 손님이시군요❤️ 리뷰에 언급까지 해주시는 센스👍👍
1577034698,스미로우,사시미,,8.25,꼬치를 고민하지 않아도 된다는 오마카세의 장점을 잘 알고 계시는 손님이시군요❤️ 리뷰에 언급까지 해주시는 센스👍👍
1577034698,스미로우,사시미,,8.24,"시시미 2인 세트랑 후토마끼 한 줄 주문했는데, 회가 두툼하고 신선해서 만족스러웠어요. 특히 참치랑 광어는 잡내 없이 깔끔했고, 후토마끼도 재료가 가득 들어가서 한 입마다 꽉 찬 맛이 좋았습니다."
1577034698,스미로우,사시미,,8.24,"시시미 2인 세트랑 후토마끼 한 줄 주문했는데, 회가 두툼하고 신선해서 만족스러웠어요. 특히 참치랑 광어는 잡내 없이 깔끔했고, 후토마끼도 재료가 가득 들어가서 한 입마다 꽉 찬 맛이 좋았습니다."
1577034698,스미로우,사시미,,8.23,일본의 맛을 재현하려고 노력하는 스미로우입니다ㅎㅎ 소중한 리뷰 남겨주셔서 감사드리며 즐거운 주말 저녁 되시길 바랍니다~❤️❤️🥰
1577034698,스미로우,사시미,,8.23,일본의 맛을 재현하려고 노력하는 스미로우입니다ㅎㅎ 소중한 리뷰 남겨주셔서 감사드리며 즐거운 주말 저녁 되시길 바랍니다~❤️❤️🥰
1577034698,스미로우,사시미,,8.20,곱창 전골은 국물이 깔끔하면서도 깊은 감칠맛이 최고였습니다. 특히 기름지지 않고 담백한 소곱창이 시오 베이스 국물과 잘 어울려서 술이 끝없이 들어갑니다.
1577034698,스미로우,사시미,,8.20,곱창 전골은 국물이 깔끔하면서도 깊은 감칠맛이 최고였습니다. 특히 기름지지 않고 담백한 소곱창이 시오 베이스 국물과 잘 어울려서 술이 끝없이 들어갑니다.
1577034698,스미로우,사시미,,8.20,칭찬이 가득한 리뷰를 작성해주셔서 정말 감사합니다:-)❣️ 항상 요리와 서비스에 최선을 다하며 기본을 잘 지키는 가게가 될 수 있도록 하겠습니다😄❤️❤️
1577034698,스미로우,사시미,,8.20,칭찬이 가득한 리뷰를 작성해주셔서 정말 감사합니다:-)❣️ 항상 요리와 서비스에 최선을 다하며 기본을 잘 지키는 가게가 될 수 있도록 하겠습니다😄❤️❤️
1577034698,스미로우,사시미,,8.2,아마 네 다섯번째 방문인데 리뷰는 처음 쓰네요ㅎㅎ 보통 금요일 새벽 1시쯤 방문하는데 사시미는 거의 항상 재료소진이라 너무 아쉬워요ㅠㅠ 그만큼 사시미가 신선하고 맛있습니다. 사시미 먹고 꼬치구이 먹으면 제일 좋은데 소진돼서 못 먹어서 아쉬웠어요ㅠㅠ 그치만 모듬꼬치가 정말 맛있어서 만족했습니다ㅎㅎ 요즘 아사히 맥주 3+1해서 너무 좋아요! 늦게까지 장사해주셔서 감사합니다. 계속 갈게용!!
1577034698,스미로우,사시미,,8.2,아마 네 다섯번째 방문인데 리뷰는 처음 쓰네요ㅎㅎ 보통 금요일 새벽 1시쯤 방문하는데 사시미는 거의 항상 재료소진이라 너무 아쉬워요ㅠㅠ 그만큼 사시미가 신선하고 맛있습니다. 사시미 먹고 꼬치구이 먹으면 제일 좋은데 소진돼서 못 먹어서 아쉬웠어요ㅠㅠ 그치만 모듬꼬치가 정말 맛있어서 만족했습니다ㅎㅎ 요즘 아사히 맥주 3+1해서 너무 좋아요! 늦게까지 장사해주셔서 감사합니다. 계속 갈게용!!
1577034698,스미로우,사시미,,8.19,교대역 이자카아 추천 맛집 스미로우! 제 최애 안주는 츠쿠네! 꼬치도 다 맛있고 안주 하나하나 다 실패 없는 술집이에요.
1577034698,스미로우,사시미,,8.19,교대역 이자카아 추천 맛집 스미로우! 제 최애 안주는 츠쿠네! 꼬치도 다 맛있고 안주 하나하나 다 실패 없는 술집이에요.
1577034698,스미로우,사시미,,8.19,아사히 생맥주 너무너무 맛있네요. 더위를 싹 잊게하는 맛이에요. 꼬치요리들도 다 맛있고 츠쿠네라는 요리는 처음 먹어봤는데 맛있더라구요. 재료도 다 신선하고 음식도 맛있습니다!
1577034698,스미로우,사시미,,8.19,아사히 생맥주 너무너무 맛있네요. 더위를 싹 잊게하는 맛이에요. 꼬치요리들도 다 맛있고 츠쿠네라는 요리는 처음 먹어봤는데 맛있더라구요. 재료도 다 신선하고 음식도 맛있습니다!
1577034698,스미로우,사시미,,8.19,"안주랑 술이 너무 맛있어서 친구랑 먹다보니 둘이서 10만원 가까이 먹었네요^^; 모듬꼬치에 게내장파스타, 타코와사비까지 완벽했어요 아사히 생맥주 3+1 이벤트 중이라 다섯잔이나 마셨네요 분위기가 좋아서 소개팅이나 데이트로도 최고예요"
1577034698,스미로우,사시미,,8.19,"안주랑 술이 너무 맛있어서 친구랑 먹다보니 둘이서 10만원 가까이 먹었네요^^; 모듬꼬치에 게내장파스타, 타코와사비까지 완벽했어요 아사히 생맥주 3+1 이벤트 중이라 다섯잔이나 마셨네요 분위기가 좋아서 소개팅이나 데이트로도 최고예요"
1577034698,스미로우,사시미,,8.18,"리뷰 1,682사진 3,873팔로워 147테마 4"
1577034698,스미로우,사시미,,8.18,"리뷰 1,682사진 3,873팔로워 147테마 4"
1577034698,스미로우,사시미,,8.15,"샤브샤브 메뉴는 한 번 드셔본 손님들이 꾸준히 찾는 메뉴 중 하나인만큼 육수와 야채와 고기가 조화로운 요리입니다, 부타샤브 추천까지 해주셔서 정말 고맙습니다ㅎ🥰 저희 스미로우에서 즐거운 시간되셨길 바랍니다❣️"
1577034698,스미로우,사시미,,8.15,"샤브샤브 메뉴는 한 번 드셔본 손님들이 꾸준히 찾는 메뉴 중 하나인만큼 육수와 야채와 고기가 조화로운 요리입니다, 부타샤브 추천까지 해주셔서 정말 고맙습니다ㅎ🥰 저희 스미로우에서 즐거운 시간되셨길 바랍니다❣️"
1577034698,스미로우,사시미,,8.14,양이 산더미라 평소 이자카야에서 시키는 양보다 많아 진짜 배터지게 맛있게 먹었어요! 특히 마라 전골 나베는 맛있게 맵고 아프게 맵지 않아서 술을 부르는 맛ㅎㅎ분위기도 좋고 친절해서 즐겁게 있다 가서 다음엔 더 여럿이서 먹어서 다양하게 시켜먹어보려고요👍😆
1577034698,스미로우,사시미,,8.14,양이 산더미라 평소 이자카야에서 시키는 양보다 많아 진짜 배터지게 맛있게 먹었어요! 특히 마라 전골 나베는 맛있게 맵고 아프게 맵지 않아서 술을 부르는 맛ㅎㅎ분위기도 좋고 친절해서 즐겁게 있다 가서 다음엔 더 여럿이서 먹어서 다양하게 시켜먹어보려고요👍😆
1577034698,스미로우,사시미,,8.14,저희 스미로우에서 기분 좋은 시간이 되셨길 바랍니다!!:-)
1577034698,스미로우,사시미,,8.14,저희 스미로우에서 기분 좋은 시간이 되셨길 바랍니다!!:-)
1577034698,스미로우,사시미,,8.12,"비오는날에 대창나베가 이렇게 환상의 궁합인 줄은 몰랐습니다,,, 넘무 맛있었어요🫶 특히 시오육수는 다른 곳에서는 잘 접해보지 못했던 맛이었는데, 굉장히 깔끔해서 사케랑 아주 잘어울렸습니다!! 그리고 대창 양도 상당해요 ㅋㅋㅋㅋ"
1577034698,스미로우,사시미,,8.12,"비오는날에 대창나베가 이렇게 환상의 궁합인 줄은 몰랐습니다,,, 넘무 맛있었어요🫶 특히 시오육수는 다른 곳에서는 잘 접해보지 못했던 맛이었는데, 굉장히 깔끔해서 사케랑 아주 잘어울렸습니다!! 그리고 대창 양도 상당해요 ㅋㅋㅋㅋ"
1577034698,스미로우,사시미,,8.12,저희 가게에서 음식도 맛나게 드시고 좋은 시간이 되신 것 같아 기쁩니다☺️ 저희 직원에 대한 칭찬글도 너무 감사드립니다!!😄 항상 좋은 요리와 서비스를 제공할 수 있도록 노력하는 가게가 되겠습니다❣️❣️
1577034698,스미로우,사시미,,8.12,저희 가게에서 음식도 맛나게 드시고 좋은 시간이 되신 것 같아 기쁩니다☺️ 저희 직원에 대한 칭찬글도 너무 감사드립니다!!😄 항상 좋은 요리와 서비스를 제공할 수 있도록 노력하는 가게가 되겠습니다❣️❣️
1577034698,스미로우,사시미,,8.10,남편이랑 오븟하게 스시랑 깔끔하게 한잔 하러 들렸어요 :) 분위기도 좋고 음식도 맛있어서 다음번엔 친구들과 꼭 또가고싶어요 :)
1577034698,스미로우,사시미,,8.10,남편이랑 오븟하게 스시랑 깔끔하게 한잔 하러 들렸어요 :) 분위기도 좋고 음식도 맛있어서 다음번엔 친구들과 꼭 또가고싶어요 :)
1577034698,스미로우,사시미,,8.10,항상 맛있는 요리와 좋은 분위기에서 요리를 즐길 수 있도록 최선을 다하는 가게가 되도록 하겠습니다~🤩🤩❤️❤️ 방문해주셔서 감사드립니다😊
1577034698,스미로우,사시미,,8.10,항상 맛있는 요리와 좋은 분위기에서 요리를 즐길 수 있도록 최선을 다하는 가게가 되도록 하겠습니다~🤩🤩❤️❤️ 방문해주셔서 감사드립니다😊
1577034698,스미로우,사시미,,7.9,이번 여름동안 아사히 이벤트를 진행할 예정이니 방문 시에 참고 부탁드립니다ㅎㅎ
1577034698,스미로우,사시미,,7.6,사시미도 싱싱하고 두꺼워서 넘 맛있고 고등어 봉초밥도 진짜 맛있어요~~ 모찌리도후도 완전 쫀득쫀득 모든 음식을 순삭했습니다😆 가게도 넓고 쾌적하고 재방문의사 100프로입니다.
1577034698,스미로우,사시미,,7.6,사진은 못찍었는데 먹어본 모찌리도후 중에서 제일 맛있었어요. 우니도 정말 맛있구요. 시킨메뉴들 모두 맛있었고 직원분들도 친절하세요
1577034698,스미로우,사시미,,7.6,잊지않고 찾아주신 점 다시 한 번 감사드리며 항상 좋은 음식을 대접해드릴 수 있더록 최선을 다하겠습니다!!🫡🫡❣️
1577034698,스미로우,사시미,,7.6,저희 가게 요리를 맛있게 드셔주시고 리뷰까지 남겨주셔서 정말 감사드립니다!🫶🫶❣️
1577034698,스미로우,사시미,,7.5,저희 스미로우에서 즐거운 시간을 보내신 것 같아 기쁩니다ㅎㅎ 소개해주신 지인분들께도 감사하다고 꼭 전해주시길 부탁드립니다:-)🫶
1577034698,스미로우,사시미,,7.5,칭찬을 너무 크게 해주셔서 쑥쓰럽기도 하고 기쁘기도 합니다☺️❣️ 항상 맛있는 요리와 주류를 제공해드릴 수 있도록 최선을 다해 노력하겠습니다!!❤️❤️😍
1577034698,스미로우,사시미,,7.4,항상 맛있는 요리를 제공할 수 있도록 노력하는 스미로우가 되겠습니다:-)❣️❣️
1577034698,스미로우,사시미,,7.31,고등어봉초밥과 후토마끼 요리시간을 기다려주셔서 감사드립니다🥹❣️(주문이 밀려 꽤 오래 걸렸던 걸로 기억합니다ㅠㅠ) 맛있게 드셔주시고 재방문 의사까지..!❤️❤️❤️ 다음에 오셔도 맛있게 드실 수 있도록 최선을 다하겠습니다!!🔥🔥🔥
1577034698,스미로우,사시미,,7.31,고등어봉초밥과 후토마끼 요리시간을 기다려주셔서 감사드립니다🥹❣️(주문이 밀려 꽤 오래 걸렸던 걸로 기억합니다ㅠㅠ) 맛있게 드셔주시고 재방문 의사까지..!❤️❤️❤️ 다음에 오셔도 맛있게 드실 수 있도록 최선을 다하겠습니다!!🔥🔥🔥
1577034698,스미로우,사시미,,7.31,사시미가 품절이라 딱 한 판 남은 민어사시미를 주문하신 두 분 이시군요!!🤩 리뷰까지 남겨주셔서 정말 감사드리고 자주 방문해주셔서 다시 한 번 감사드립니다❣️❣️ 오랜만에 웨이팅 팀들이 생겨 뿌듯하고 머쓱합니다ㅎㅎ 항상 좋은 요리를 대접하는 가게가 되도록 노력하겠습니다 🔥🔥🥰
1577034698,스미로우,사시미,,7.31,사시미가 품절이라 딱 한 판 남은 민어사시미를 주문하신 두 분 이시군요!!🤩 리뷰까지 남겨주셔서 정말 감사드리고 자주 방문해주셔서 다시 한 번 감사드립니다❣️❣️ 오랜만에 웨이팅 팀들이 생겨 뿌듯하고 머쓱합니다ㅎㅎ 항상 좋은 요리를 대접하는 가게가 되도록 노력하겠습니다 🔥🔥🥰
1577034698,스미로우,사시미,,7.26,지인이 꼬치구이 맛집이라고 추전해서 왔는데 음식이 전반적으로 다 맛있어요! 아사히생맥주도 3+1 행사해서 저렴하게 마실수 있어서 좋았습니다~
1577034698,스미로우,사시미,,7.26,지인이 꼬치구이 맛집이라고 추전해서 왔는데 음식이 전반적으로 다 맛있어요! 아사히생맥주도 3+1 행사해서 저렴하게 마실수 있어서 좋았습니다~
1577034698,스미로우,사시미,,7.25,"숙성회 퀄리티가 정말 훌륭했어요. 참치,도미,광여,연어 등이 깔끔하게 플레이팅되어 있고 입안에서 사르르 녹는 식감이 일품이었습니다! 신선하면서도 깊은 감칠맛이 살아있어서 청주와의 조합이 특히 좋았어요❤️"
1577034698,스미로우,사시미,,7.25,"숙성회 퀄리티가 정말 훌륭했어요. 참치,도미,광여,연어 등이 깔끔하게 플레이팅되어 있고 입안에서 사르르 녹는 식감이 일품이었습니다! 신선하면서도 깊은 감칠맛이 살아있어서 청주와의 조합이 특히 좋았어요❤️"
1577034698,스미로우,사시미,,7.24,밤에 방문예약 없이 이용대기 시간 바로 입장데이트연인・배우자
1577034698,스미로우,사시미,,7.24,밤에 방문예약 없이 이용대기 시간 바로 입장데이트연인・배우자
1577034698,스미로우,사시미,,7.23,추천으로 인해 방문까지 해주셔서 고맙습니다:-)
1577034698,스미로우,사시미,,7.20,아사히 맥주 3+1 행사는 여름내내 진행될 예정이니 언제든 한 잔 드시고 싶으실 때 방문해주시면 시원~하게 한 잔 내어드리겠습니다🫶❣️❣️
