가게ID,가게명,업종,평점,날짜,리뷰내용
1480588852,비노 탭 시에나,양식,,,압구정로데오역 2번 출구 방향에 있는 청담 와인바 [비노탭시에나] 다양한 와인을 글라스로 즐길수 있을뿐만 아니라 와인과 곁들일수 있는 음식들이 다양하고 맛있어요 웰컴 드링크도 고급지고 이국적 분위기가 물씬 풍기는 인테리어도 멋진곳이라 저녁 데이트 장소로 추천해요.
1480588852,비노 탭 시에나,양식,,,언니와 행복하고 즐거운 시간 가질 수 있어사 행복!! 디어만테 방문할 때는 항상 즐겁네요! 담에는 신랑이랑 방문해야겠어요
1480588852,비노 탭 시에나,양식,,,"여러가지 와인들을 잔으로 먹을 수 있어 좋았는데, 제가 갔을 땐 모엣샹동도 글라스로 마실 수 있더라구요. 동생에게 개인적으로 축하할 일이 있는데 보틀러 시키기에는 좀 부담스럽던 차에 샴페인을 글라스로 먹을 수 있어 넘 좋았습니다."
1480588852,비노 탭 시에나,양식,,,"오늘의 메뉴는 런치셋트메뉴A를 선택했습니다. 큐민향 곡물과 야채, 아보카도가 함께 어우러진 샐러드와 짭조롬한 엔쵸비 오일파스타, 관자게살볶음밥 등 한번에 다양한 메뉴를 맛볼 수 있었습니다. 런치세트A의 메뉴들과 상큼한 화이트와인과의 조화는 두말하면 입아프구요. ^ ^ 가성비 좋은 청담동 레스토랑이었습니다. 식사를 하는 동안 도성욱 작가의 작품을 마음껏 볼 수 있다는 것 또한 기쁨이었답니다~"
1480588852,비노 탭 시에나,양식,,,오픈시간보다 일찍 도착했는데 먼저 자리에 앉을수 있게 안내해주셔서 감사했어요~웰컴드링크로 주신 디톡스칵테일도 상큼하니 좋았구요. 음식들도 너무 맛있었어요! 양이 얼마 안되어 보이지만 고기라 먹고나니 배부르더라구요. 우대갈비 갈빗대고기는 잘라달라고 요청하니 먹기좋게 분리해주셨어요~알쓰라 와인은 못마셨지만 블라인드테스트도 7시부터 있다고 하시더라구요. 와인 좋아하시는분들은 참여해보셔도 좋을거 같아요:)
1480588852,비노 탭 시에나,양식,,,오픈시간보다 일찍 도착했는데 먼저 자리에 앉을수 있게 안내해주셔서 감사했어요~웰컴드링크로 주신 디톡스칵테일도 상큼하니 좋았구요. 음식들도 너무 맛있었어요! 양이 얼마 안되어 보이지만 고기라 먹고나니 배부르더라구요. 우대갈비 갈빗대고기는 잘라달라고 요청하니 먹기좋게 분리해주셨어요~알쓰라 와인은 못마셨지만 블라인드테스트도 7시부터 있다고 하시더라구요. 와인 좋아하시는분들은 참여해보셔도 좋을거 같아요:)
1480588852,비노 탭 시에나,양식,,,와인 디스펜서에서 와인 골라서 마시는 것도 재미있었어요! 모든 와인을 다 맛보고 싶어지는 압구정 청담 최고 와인바였어요! 와인 가격대도 정말 다양해서.. 부담없이 즐길 수 있었답니다!
1480588852,비노 탭 시에나,양식,,,와인 초보 입문자인데 어떤 와인이 나에게 맞을지 궁금하다면 비노탭시에나에 계신 소뮬리에 분께 추천 받아도 좋아요.
1480588852,비노 탭 시에나,양식,,,와인디스펜서가 많았고 레드 화이트 와인 종류가 굉장히 많았어요 다양하게 맛볼수 있어서 넘 좋았어요 와인 취향을 말씀드리면 직원분께서 친절하게 설명해주시면서 추천해주셨어요!
1480588852,비노 탭 시에나,양식,,,와인디스펜서로 원하는 와인을 골라서 직접따라먹는게 굉장히 색달라요. 음식 하나하나가 다 너무 맛있고 양도 꽤나 많은편입니다! 디저트까지 있어서 한곳에서 후식까지 가능해서 좋아요~ 디저트도 고급스러운 맛이라 꼭 시켜드시길 추천합니다!
1480588852,비노 탭 시에나,양식,,,와인바 인데 파스타랑 음식들이 넘사벽으로 맛있는 곳! 로제 진짜 맛있어요. 입가심으로 먹은 한라봉 아이스크림로 최고! 특별한 날 방문하기 좋아요!!
1480588852,비노 탭 시에나,양식,,,와인을 잘 모르더라도 탭카드로 충전한 다음 한잔씩 마셔볼 수 있어서 좋았습니다. 테이스팅 가이드를 보고 자기 취향의 와인을 찾는 재미도 있었고요
1480588852,비노 탭 시에나,양식,,,"완전...최고최고!! 모임장소로 정한 비노탭시에나 너무 만족이었습니다. 압구정로데오역 근처 와인바, 단체모임하는 장소로 추천이고요. 음식도 전무 너무 맛있더라고요!! 식전빵부터...완전 존맛임~~!!! 세상에나 문어는 야들야들 에피타이저로 입맛 확돋우고요. 크림파스타 완전꾸덕 고소 그자체!! 게다가 진갈비살 최고였습니다. 진짜 진갈비살 여기 꼬옥 먹어보세여 완전완전 추천!!! 너무 맛있게 잘먹었습니다."
1480588852,비노 탭 시에나,양식,,,요즘 친구가 많이 지쳐 있기에 분위기에 맛까지 좋은 곳이 어디일까 고민하다 찾게 된 와인바!!!
1480588852,비노 탭 시에나,양식,,,"웰컴드링크 비주얼도 넘 예쁘고 상콤하게 입맛을 돋우며 식사할 수 있어 좋았고 따뜻한 식전 빵, 고급스런 분위기도 좋았어요 부드럽고 향긋한 포항문어도 부라타 치즈 샐러드는 신선하니 부드럽게 입에서 녹았고 해산물 칠리 쌀국수 그리 맵지않고 해산물 가득하니 딱 좋았고 진갈비살 로스트 비프는 지방이랑 살코기 조화가 아주 적절하니 씹을수록 녹진 고소하고 향긋하게 마리네이드도 좋았어요 또생각나네요 와인이랑 잘어울릴 듯 해요 🍷 다양한 와인과 주류도 다양해서 저녁 샤퀴테리 무제한 이벤트 넘 혜자인거같아요 다양한 디저트 메뉴까지 원큐에 가성비좋고 만족스럽게 식사 했네요 ㅎㅎ"
1480588852,비노 탭 시에나,양식,,,"웰컴드링크로 입맛 돋구고, 식전빵+요리 4가지+ 와인+ 커피 모두 너무 맛있어요."
1480588852,비노 탭 시에나,양식,,,"웰컴드링크로 입맛 돋구고, 식전빵+요리 4가지+ 와인+ 커피 모두 너무 맛있어요."
1480588852,비노 탭 시에나,양식,,,음식 맛도 좋고 조용하고 친구들과 너무 좋은 시간 보내고 왔어요!!
1480588852,비노 탭 시에나,양식,,,음식 맛도 좋고 조용하고 친구들과 너무 좋은 시간 보내고 왔어요!!
1480588852,비노 탭 시에나,양식,,,의도치않은 타인 합석으로 인해 불쾌했는데 죄송하다며 술값을 받지 않으시네요 고객에 대한 세심한 배려가 느껴졌습니다
1480588852,비노 탭 시에나,양식,,,의도치않은 타인 합석으로 인해 불쾌했는데 죄송하다며 술값을 받지 않으시네요 고객에 대한 세심한 배려가 느껴졌습니다
1480588852,비노 탭 시에나,양식,,,이런 아늑하고 맛있는데 가격 좋은 곳을 알고 있다는 것만으로 행복하네요ㅎㅎ 점심 메뉴 알차고 4개나 시켜서 이 가격이라는 게…🥹 와인탭 카드 1만원 증정 이벤트도 해서 참여하고 왔어요 (플친 추가) 재방문 의사 백프로 있습니다~~~~ 점심이라 붐비지도 않고 점심 즐기다가 왔어요! 웰컴 드링크로 주신 에이드도 상큼하니 너무 좋았습니다. 술 못 마시는 사람들에게 좋은 것 같아요
1480588852,비노 탭 시에나,양식,,,저녁에 방문예약 없이 이용대기 시간 바로 입장일상친구
1480588852,비노 탭 시에나,양식,,,"저녁에 방문예약 후 이용대기 시간 바로 입장가족모임연인・배우자, 아이"
1480588852,비노 탭 시에나,양식,,,저녁에 방문예약 후 이용대기 시간 바로 입장가족모임친척・형제
1480588852,비노 탭 시에나,양식,,,"저녁에 방문예약 후 이용대기 시간 바로 입장데이트, 나들이친척・형제"
1480588852,비노 탭 시에나,양식,,,저녁에 방문예약 후 이용대기 시간 바로 입장데이트연인・배우자
1480588852,비노 탭 시에나,양식,,,저녁에 방문예약 후 이용대기 시간 바로 입장데이트연인・배우자
1480588852,비노 탭 시에나,양식,,,저녁에 방문예약 후 이용대기 시간 바로 입장비즈니스지인・동료
1480588852,비노 탭 시에나,양식,,,저녁에 방문예약 후 이용대기 시간 바로 입장비즈니스지인・동료
1480588852,비노 탭 시에나,양식,,,저녁에 방문예약 후 이용대기 시간 바로 입장친목친구
1480588852,비노 탭 시에나,양식,,,저는 점심먹으러 다녀왔지만 와인너리도 있어 와인한잔하기 좋을것같아요. 와인 종류도 되게 많았어요! 그리고 화장실이 너무 고급지고 예쁘니 화장실도 꼭 다녀오세요 😄
1480588852,비노 탭 시에나,양식,,,점심 타임으로 예약해서 모임하기 좋아요. 음식도 맛있어요 ㅎㅎ
1480588852,비노 탭 시에나,양식,,,점심 타임으로 예약해서 모임하기 좋아요. 음식도 맛있어요 ㅎㅎ
1480588852,비노 탭 시에나,양식,,,점심에 가신다면 후토마끼 튀김은 꼭 드셔보시기 바래요!! 재료도 풍성하게 들어갔고 전체적으로 음식이 고급지도 깔끔한 맛이예요.
1480588852,비노 탭 시에나,양식,,,점심에 방문예약 없이 이용대기 시간 10분 이내 일상지인・동료
1480588852,비노 탭 시에나,양식,,,점심에 방문예약 없이 이용대기 시간 10분 이내 일상지인・동료
1480588852,비노 탭 시에나,양식,,,점심에 방문예약 없이 이용대기 시간 10분 이내 일상친구
1480588852,비노 탭 시에나,양식,,,점심에 방문예약 없이 이용대기 시간 바로 입장친목지인・동료
1480588852,비노 탭 시에나,양식,,,"점심에 방문예약 후 이용대기 시간 바로 입장데이트연인・배우자, 아이"
1480588852,비노 탭 시에나,양식,,,"점심에 방문예약 후 이용대기 시간 바로 입장친목, 나들이지인・동료"
1480588852,비노 탭 시에나,양식,,,"점심에 방문예약 후 이용대기 시간 바로 입장친목, 나들이지인・동료"
1480588852,비노 탭 시에나,양식,,,점심에 방문예약 후 이용대기 시간 바로 입장친목친구
1480588852,비노 탭 시에나,양식,,,점심에 방문예약 후 이용대기 시간 바로 입장친목친구
1480588852,비노 탭 시에나,양식,,,점심에 방문했습니다. 런치세트 메뉴가 있어서 세트메뉴와 와인을 함께 먹었어요. 음식들 모두 맛있고 신선한 재료를 사용하는게 느껴졌어요. 와인도 추천받아서 입맛에 맞는 걸로 한잔씩 구매 할 수 있어서 같이간 지인들과 모두 원하는 와인을 먹을 수 있었어요. 음식양도 많고 와인도 잔으로 먹을 수 있어 청담에서 가성비가 좋다는 생각이 들었습니다. 매장도 깔끔하고 분위기고 너무 좋았어요. 재방문 의사 있습니다^^
1480588852,비노 탭 시에나,양식,,,점심에 방문했습니다. 런치세트 메뉴가 있어서 세트메뉴와 와인을 함께 먹었어요. 음식들 모두 맛있고 신선한 재료를 사용하는게 느껴졌어요. 와인도 추천받아서 입맛에 맞는 걸로 한잔씩 구매 할 수 있어서 같이간 지인들과 모두 원하는 와인을 먹을 수 있었어요. 음식양도 많고 와인도 잔으로 먹을 수 있어 청담에서 가성비가 좋다는 생각이 들었습니다. 매장도 깔끔하고 분위기고 너무 좋았어요. 재방문 의사 있습니다^^
1480588852,비노 탭 시에나,양식,,,"좋아하는 사람과 함께하고 싶은 곳을 찾다가 방문하게 된 [비노탭시에나] 정말, 같이 간 일행이 너무 행복해해서 저도 행복했던 시간이었습니다. 인테리어 멋지지, 매콤한 칠리 볶음 쌀국수와 마라 치킨 윙. 안주 도 다 성공적이고 추천해주시는 와인과 함께 먹었는데 직원분들 모두 너무 친절하시고... 진짜 모든게 완벽했던 시간이었습니다 🥹 와인 한 병 다 마시기에는 부담스러울 수 있는데 100ml단위로 맛 볼 수있고 화이트/레드 각 각 랜덤와인이 있는데 마시고 무슨 와인인지 맞추면 그 와인잔은 무료인 재미있는 이벤트도 하더라구용ㅋㅋㅋㅋㅋ 와인 잘 아시는 분들은 맞춰보는 재미도 있을 것 같습니당! 강추해요 ❤️"
1480588852,비노 탭 시에나,양식,,,좋은 사람들과 분위기뿐 아니라 맛과 가성비까지 두루 갖춘 곳이라 자주 방문하게 되네요
1480588852,비노 탭 시에나,양식,,,"좌석도 넓고 창이 보이는 위치로 안내해 주셨고, 서비스도 분위기도 음식도 와인도~ ~ ~ 너무나 만족스러웠어요*^^*"
1480588852,비노 탭 시에나,양식,,,"주말에 신랑이랑 청담동에 갔다가 전에 맛있게 먹었던 비노탭시에나가 생각나서 또 방문 했어요. 메뉴가 많이 업그레이드 되었더라구요. 런치 세트메뉴도 준비되어있어 가성비 좋게 점심을 즐길수 있어요. 전에 맛있게 먹었던 시칠리아식 포항문어. 문어 사이즈가 엄청 컸어요. 식감은 더 좋아지고… 산뜻하니 에피타이저로 너무 잘 어울려요. 고소하고, 담백한 게살볶음밥은 부드러운 관자가 킥이에요. 요거요거 강력 추천해요 . 어마어마한. 우대갈비! 부드럽고 익힘 정도가 딱 좋았어요! 오늘은 비노탭에서 후식까지 야무지게 먹었어요. 고급스러운 크림치즈맛이 일품인 티라미수에 커피.. 와인맛집으로도 유명하지만 데이트하기좋은 레스토랑으로도 완벽한 비노탭시에나 강려크 추천해요!!"
1480588852,비노 탭 시에나,양식,,,"지인들과 오랜만에 모이는 자리였는데 비노탭시에나 덕분에 좋은 추억 만들고 갑니다. 분위기도 너무 좋고 직원분들도 모두 친절하셔서 편안하게 즐길 수 있었어요. 특히 원하는 와인을 선택하여 먹을 수 있어 좋았어요! 부드러운 진갈비살, 깊은 풍미의 크림 파스타도 너무 맛있게 먹었습니다."
1480588852,비노 탭 시에나,양식,,,"지인들과 오랜만에 모이는 자리였는데 비노탭시에나 덕분에 좋은 추억 만들고 갑니다. 분위기도 너무 좋고 직원분들도 모두 친절하셔서 편안하게 즐길 수 있었어요. 특히 원하는 와인을 선택하여 먹을 수 있어 좋았어요! 부드러운 진갈비살, 깊은 풍미의 크림 파스타도 너무 맛있게 먹었습니다."
1480588852,비노 탭 시에나,양식,,,"지인들과 오랜만에 모이는 자리였는데 비노탭시에나 덕분에 좋은 추억 만들고 갑니다. 분위기도 너무 좋고 직원분들도 모두 친절하셔서 편안하게 즐길 수 있었어요. 특히 원하는 와인을 선택하여 먹을 수 있어 좋았어요! 부드러운 진갈비살, 깊은 풍미의 크림 파스타도 너무 맛있게 먹었습니다."
1480588852,비노 탭 시에나,양식,,,처음 입장하면서 분위기가 참 좋다고 생각했는데 생각해보니 조명이 잘 되어있어 그렇게 느낀 것 같아요 덕분에 음식 사진뿐 아니라 인물 사진도 잘 나오더라구요 질문하는 것마다 친절하게 대답해주셔서 편하게 식사했는데요 가져다주신 웰컴 드링크 상콤하니 맛있게 마셨습니다 소개 받는 자리라 조금 어색할 수 있었는데 드링크 얘기 음식 얘기 하면서 자연스럽게 대화 틀 수 있었어요 세트로 시켰는데 전반적으로 음식 맛이 다채롭게 어우러져 좋았어요 우대갈비는 추가로 시킨 건데 좋은 선택이었습니다 고기가 입에서 녹는 기분이었어요 😄 세팅되어 나온 고기 먹고 나니 갈비살 잘라주셔서 쫄깃쫄깃 씹는 맛도 있어 맛나게 먹었습니다 소스가 2가지라 좋았어요 이번에는 런치로 가면서 가볍게 맥주만 했는데요 다음번에 가면 와인도 꼭 즐겨보려고요
1480588852,비노 탭 시에나,양식,,,"친절하고 따뜻하게 맞이해 주셔서 감사합니다. 직장 상사분 모시고 다녀온 곳이라 와인 셀프 디스펜싱 시스템이 불편할 수 있었는데, 셀렉션에도 도움 주셔서 어렵지 않게 저녁 식사 마무리 할 수 있었습니다. 조만간 또 찾아서 방문할 예정입니다."
1480588852,비노 탭 시에나,양식,,,"친절하고 따뜻하게 맞이해 주셔서 감사합니다. 직장 상사분 모시고 다녀온 곳이라 와인 셀프 디스펜싱 시스템이 불편할 수 있었는데, 셀렉션에도 도움 주셔서 어렵지 않게 저녁 식사 마무리 할 수 있었습니다. 조만간 또 찾아서 방문할 예정입니다."
1480588852,비노 탭 시에나,양식,,,크리스마스 장식과 따뜻함으로 개방 했을때랑은색다른 분위기 다 좋아요 ❤️🧡💛💚💙💜
1480588852,비노 탭 시에나,양식,,,특별한 곳에서 점심을 먹고 온 기분이라 너무 좋았어요. 주변이 시끄럽지 않아서 대화나누기 참 좋은 장소로 추천해요**
1480588852,비노 탭 시에나,양식,,,특별한 곳에서 점심을 먹고 온 기분이라 너무 좋았어요. 주변이 시끄럽지 않아서 대화나누기 참 좋은 장소로 추천해요**
1480588852,비노 탭 시에나,양식,,,"파스타 피자, 샐러드 다 어느정도 이상 수준을 맞춘 미뉴들입니다. 청담인데 와인탭으로 마실 수 있는 가격도 좋고 분위기도 괜찮아 와인 모임 하기 좋아요"
1480588852,비노 탭 시에나,양식,,,"파스타 피자, 샐러드 다 어느정도 이상 수준을 맞춘 미뉴들입니다. 청담인데 와인탭으로 마실 수 있는 가격도 좋고 분위기도 괜찮아 와인 모임 하기 좋아요"
1480588852,비노 탭 시에나,양식,,,"파스타, 진갈비, 김치볶음밥 등 다양하게 먹었는데 다 너무 맛있었고 디저트도 너무 맛있어요"
1480588852,비노 탭 시에나,양식,,,평일 런치메뉴 가성비 좋고 포함 커피가 라떼도 되서 더 좋아요. 직원분들 친절도 100점^^
1138363160,서울양어장,회,,,"고객님, 저희 서울양어장에서 만족스러운 식사 경험을 하셨다니 정말 기쁩니다! 😊 싱싱한 새우와 회, 정갈한 반찬들까지 맛있게 드셨다니 저희도 덩달아 기분이 좋아지네요. 특히 음식 하나하나에 담긴 정성을 알아주셔서 정말 감사합니다. 아늑한 분위기에서 친절한 직원들의 서비스와 함께 즐거운 시간을 보내신 것 같아 다행입니다. 👍 다음 방문 시에도 변함없는 맛과 서비스로 고객님을 맞이할 수 있도록 최선을 다하겠습니다. 친구분들과 함께 오셔서 좋은 추억 많이 만드시길 바랍니다! ❤️"
1138363160,서울양어장,회,,,"고객님, 저희 서울양어장을 찾아주시고 만족스러운 경험을 해주셔서 정말 감사합니다! 😊 모듬회 소자의 푸짐한 양과 신선함에 만족하셨다니 정말 기쁩니다. 특히 후라카케밥과 김에 회를 싸먹는 조합이 최고죠!👍 스끼다시까지 칭찬해주시니 더욱 힘이 납니다. 조만간 또 방문해주신다는 말씀에 🙇‍♀️ 감동했어요. 앞으로도 변함없이 맛있는 음식과 최고의 서비스로 고객님을 맞이하겠습니다. ❤️"
1138363160,서울양어장,회,,,"고객님, 저희 서울양어장을 찾아주시고 칭찬까지 해주시니 정말 감사합니다! 😊 양도 넉넉하게 드리고, 넓고 쾌적한 공간을 유지하려고 노력하는데 고객님께서 좋게 봐주셔서 뿌듯하네요. 무엇보다 맛있게 드셨다니 정말 기쁩니다! 앞으로도 친절함과 맛으로 고객님들을 맞이할 수 있도록 최선을 다하겠습니다. 👍"
1138363160,서울양어장,회,,,"고객님, 저희 서울양어장의 향어회를 맛있게 드셨다니 정말 기쁩니다! 😊 지방에 가지 않고도 저희 가게에서 맛있는 향어회를 즐기실 수 있다니, 저희도 덩달아 기분이 좋아지네요. 앗, 감사하다는 말씀과 함께 칭찬까지 해주시니 몸 둘 바를 모르겠습니다! 🙇‍♀️ 고객님의 칭찬에 힘입어 더욱 맛있는 음식과 최고의 서비스로 보답하는 서울양어장이 되겠습니다. ❤️"
1138363160,서울양어장,회,,,기본으로 상에 나오는 것도 푸짐하고 너무 맛있어요 생새우 회 먹으러 왔는데 다 나갔다해서 아쉬운대로 회라도 먹자 해서 먹었는데 맛있어요 플레이팅도 예쁘게 나오고 사장님도 친절하세요 기본으로 쌈장주는 곳 처음봐서 너무 좋아요 진짜 이벤트 회도 적을 줄 알았는데 생각보다 꽤 양도 많고 귀여워요~!!
1138363160,서울양어장,회,,,데이트로 방문했는데 서비스가 너무좋고 다음엔 모임하러 단체방문하고 싶어요 회도 싱싱하고 맛있네요 무엇보다 친절함에 반했습니다 강남 역삼 맛집 추천합니다
1138363160,서울양어장,회,,,안녕하세요! 서울양어장을 찾아주시고 소중한 리뷰까지 남겨주셔서 정말 감사합니다 😊 저희 서울양어장의 신선한 회와 푸짐한 스끼다시에 만족하셨다니 정말 기쁩니다. 👍 앞으로도 변함없이 신선하고 맛있는 메뉴로 고객님들을 맞이할 수 있도록 최선을 다하겠습니다. 다음에 또 방문해 주세요! ❤️🙇‍♀️
1138363160,서울양어장,회,,,"안녕하세요! 서울양어장을 찾아주시고 소중한 리뷰까지 남겨주셔서 정말 감사합니다. 😊 저희 가게의 신선한 재료와 맛에 만족하셨다니 정말 기쁩니다! 역삼에서 신선한 해산물을 찾으신다면 저희 서울양어장을 잊지 말아주세요. 새우회와 오징어회도 맛있게 드셨다니 저희도 기쁩니다! 👍 앞으로도 신선하고 맛있는 음식과 멋진 인테리어, 깨끗한 매장으로 고객님들을 맞이할 수 있도록 최선을 다하겠습니다. 다음에 또 방문해 주세요! ❤️🙇‍♀️"
1138363160,서울양어장,회,,,안녕하세요! 서울양어장을 찾아주시고 칭찬까지 해주시니 정말 감사합니다! 저희 가게 우럭과 묵사발이 마음에 드셨다니 정말 기쁘네요 😊 역삼역 맛집으로 기억해주셔서 더욱 뿌듯합니다. 앞으로도 맛있는 음식과 훌륭한 서비스로 고객님들을 만족시켜드릴 수 있도록 최선을 다하겠습니다. 다음에 또 방문해주세요! 👍❤️
1138363160,서울양어장,회,,,"안녕하세요! 서울양어장을 찾아주시고, 소중한 후기까지 남겨주셔서 정말 감사합니다 😊 저희 서울양어장의 신선한 회와 푸짐한 양에 만족하셨다니 정말 기쁩니다! 회식 자리에서 부족함 없이 즐거운 시간을 보내셨다니 저희도 덩달아 기분이 좋아지네요. 앞으로도 변함없이 신선하고 맛있는 회로 고객님들을 맞이할 수 있도록 최선을 다하겠습니다. 자리 문제로 불편을 드린 점 죄송하며, 방문 전에 예약해 주시면 더욱 편안하게 이용하실 수 있도록 준비해 드리겠습니다. 다음에 또 찾아주세요! 👍❤️"
1138363160,서울양어장,회,,,"안녕하세요! 소중한 후기 남겨주셔서 정말 감사합니다 😊 저희 서울양어장에서 맛있는 제철 해산물과 함께 즐거운 시간을 보내신 것 같아 기쁩니다. 특히 전어와 새우를 맛있게 드셨다니 정말 뿌듯하네요! 저희 서울양어장은 고객님들께 신선하고 다양한 해산물을 제공하기 위해 항상 노력하고 있습니다. 시끌벅적한 분위기 속에서도 즐거운 시간을 보내셨다니 다행입니다. 앞으로도 저희 서울양어장 많이 찾아주시고, 더욱 만족스러운 경험을 드릴 수 있도록 최선을 다하겠습니다. 👍❤️"
1138363160,서울양어장,회,,,여기 향어회 너무 신선하고 맛있어요!! 서울 유일한 곳. 여기만 자주옵니다~ 안 먹어봤으면 강추~!
1138363160,서울양어장,회,,,저녁에 방문예약 없이 이용대기 시간 바로 입장데이트연인・배우자
1138363160,서울양어장,회,,,정말 맛있습니다~~^^ 좋은안주에 술 한잔 하니 정말 행복하네요!!!
32692582,오징어세상 삼성점,회,,,47000원 세트인데 가성비 미쳤어요 사장님 남는게 뭐가 있으신가 궁금할 정도였구요 가성비가 대단해서인가 회사 퇴근하고 오신분들 소모임 회식 대단히 많아서 예약 필수입니다! 안그럼 무기한 웨이팅하셔야겟어요 잘먹었습니당
32692582,오징어세상 삼성점,회,,,7시 이전에 오면 고등어구이도 주어서 가성비 갑이네용! 코엑스 근처 맛집입니다!!
32692582,오징어세상 삼성점,회,,,7시 이전에 오면 고등어구이도 주어서 가성비 갑이네용! 코엑스 근처 맛집입니다!!
32692582,오징어세상 삼성점,회,,,고등어랑 미역국도 많이 주셔서 애들 밥 주기도 좋고 무엇보다 직원분들이 정말 얼굴에 웃음 장착하셨어요 ㅋㅋㅋ 이런집은 돈쭐나야합니닷!
32692582,오징어세상 삼성점,회,,,"넓은 좌석과 넉넉한 양, 합리적인 가격까지 회식과 모임으로 최적의 장소로 만ㄷ르 수 있도록 최선을 다하고 있어요^^ 무엇보다 맛있다고 해주셔서 정말 감사합니다💕"
