가게ID,가게명,업종,평점,날짜,리뷰내용
1862233893,동두천솥뚜껑삼겹살 신사점,고기,,,특히 삼겹살이 너무 맛있어요. 꽃게 된장째개는 가격도 저렴한데 너무 맛있고 퀄리티도 높아요. 단골예약 입니다.
1862233893,동두천솥뚜껑삼겹살 신사점,고기,,,힙한 분위기와 유머가 마음에 드셨다니 다행이에요! 신사역맛집으로서 맛있는 고기와 술이 찰떡인 조합으로 친구들과 다시 오고 싶게 만들어 드리겠습니다. 다음에 또 와서 즐겁게 드세요!
1862233893,동두천솥뚜껑삼겹살 신사점,고기,,,"😍 솥뚜껑 덕분에 따뜻하게 즐기셨다니 저희도 설레네요! 신사역맛집답게 룸도 준비되어 있어 회식이나 모임 때도 편하게 즐기실 수 있습니다. 다음번에도 따끈한 고기와 미나리, 김치 기대해주세요! 🥩✨"
65729586,루위중식당,중식,,,#협찬 기념일에 방문하는 거 추천. 강남에 주차 가능한 중식당임!! 연예인들이 왜 오는지 알거같음!
65729586,루위중식당,중식,,,"강남 압구정에 있는 중식당 루위에 다녀왔어요. 연예인맛집으로 유명해서 기대하고 갔는데, 분위기부터 서비스, 음식 맛까지 정말 만족스러웠답니다. 사품냉채는 해파리, 새우, 전복, 오리알 등 재료가 다양하고 신선해서 입맛을 확 살려줬고, 중식안심스테이크는 육즙 가득하고 부드러워 고급스러운 맛을 제대로 느낄 수 있었어요. 유니짜장면은 고기와 채소가 듬뿍 들어간 진한 소스로 감칠맛이 풍부했어요. 조용한 분위기에서 여유롭게 식사할 수 있어 더욱 좋았고, 다음에는 베이징덕도 꼭 먹어보고 싶어요."
65729586,루위중식당,중식,,,강남에서 이 가격에 북경오리 먹을수있다니 진짜 럭키비키랍니당♡
65729586,루위중식당,중식,,,"강남중식 맛집 루위! 상견례 , 생일 모임, 소개팅 장소로도 너무 좋은 곳, 고기도 진짜 질좋고 부드럽고 양도 많고!! 사품냉채는 입맛 돋우는데 진짜 쵝오!!!"
65729586,루위중식당,중식,,,그리고 식사류도 양많은거에 비해 가격도 저렴해서 남기더라도 시키길 잘했다는 생각이드네요😋
65729586,루위중식당,중식,,,"기본찬부터 간이 과하지 않고 담백해 입맛을 깨워줬고, 사품냉채는 새우·전복·편육·피단까지 네 가지가 어우러져 여름철 입맛을 제대로 살려주더라구요. 소고기 안심 스테이크는 부드럽게 썰리는 결감과 고소한 육즙이 살아있어 감탄! 마지막 잡탕밥까지 푸짐하게 마무리해 모임이 잦고 연예인들이 찾는 이유는 충분히 알겠던 압구정중식당이네요."
65729586,루위중식당,중식,,,"루위는 유명한 맛집이라 연예인 셀럽들이 많이 가는 곳이라 기대하고 갔어요~북경오리먹으러 갔는데 분위기랑 서비스 다 감동이에요~ 베이징덕 육즙이 풍성하고 식감이 촉촉해서 씹을때 마다 입안에 육즙풍미가득이에요~ 껍질을 잘 안 먹는데 바삭해서 다 먹었어요~ 야빙에 싸먹으면 담백하게 즐길수있고 춘장소스, 오이, 파랑 곁들여먹으면 더 맛있게 즐길 수있었어요~ 계속 알아서 오이랑 짜차이, 파를 리필해주셔서 따로 주문할 필요없이 편하게 먹었어요~ 루이보스티를 같이 나왔는데 임산부,아이까지 먹을 수 있어서 루이보스로 준비했다고 하셨어요~단체룸이 커서 돌잔치, 칠순, 회식, 동창회 등 모임하기 좋아요~ 강남고급중식레스토랑 으로 루위 추천이요~"
65729586,루위중식당,중식,,,"루위에 다녀간 연예인 사진만 보아도 한국 영화 힛트작 10편 이상이 될 정도로 인지도가 높은 강남맛집입니다. 기념일에 방문했는데, 분위기도 좋고 요리도 맛있어 모두가 만족한 곳이었어요. 주차 서비스도 곳이었어요"
65729586,루위중식당,중식,,,루위에서 가족과 우아한 저녁식사를 했습니다. 해외에서는 북경오리를 먹었지만 한국에서는 처음 먹었어요. 중국 북경오리 전문점보다 훨씬 맛있어요. 겉바삭 속촉의 정석의 북경오리. 루이스보스 차로 속을 달래주고 고급지고 우아하게 식사 잘 했습니다. 반찬도 계속 리필해주고 후식인 딸기샤베트로 깔끔하게 마무리했습니다. 귀한 사람과 소중한 시간을 보내기에 좋은 음식점 루위. 추천합니다.
65729586,루위중식당,중식,,,"메뉴 예약 후 방문한거라 자리에 앉으니 북경오리가 바로 나왔어요. 기다리지않아서 참 좋았습니다. 직접 눈 앞에서 손질해주시는 귀한모습도 아이들과 함께 볼 수 있어서 신기하고 재밌었어요.^^ 전병에 싸먹는 오리요리 아이들과 참 맛있게 먹었고, 향이전혀안나서 북경오리가 처음이신 분들도 거부감없이 접근하기 좋을것같아요. 마무리 샤베트도 참 맛있었어요! 완전추천합니다.^^"
65729586,루위중식당,중식,,,"버섯, 브로콜리 등 다양한 채소들이 고기 옆에 한가득 들어가 있었어요"
65729586,루위중식당,중식,,,북경오리 먹으러 루위에 방문했는데요. 와 진짜 너무 맛있더라고요. 겉은 바삭 속은 촉촉한데 전병과 함께 먹으면 그 맛이 배가 되서 씹을때마다 고소함 때문에 행복했습니다!! 무조건 사전예약해야 하니 드시고 싶으시다면 예약해서 꼭 드셔보세요!! 맛있습니다!
65729586,루위중식당,중식,,,"북경오리 처음 먹어봤는데 생각보다 훨씬 부드럽고 촉촉하더라구요! 껍질은 바삭하고 속살은 기름지지 않아서 계속 집게 돼요ㅎㅎ 밀전병에 오리, 오이, 파 넣고 소스 살짝 찍어 먹으니까 진짜 별미였어요 비린내 하나 없이 깔끔하게 즐길 수 있었어요 👍👍"
65729586,루위중식당,중식,,,북경오리를 눈앞에서 손질해주시고 완전 퍼포먼스 최고입니다!! 매장분위기는 고급스러운분위기에요 아주 데이트와 모임장소로 딱이에요🫶 메뉴도 다양하고 아주 맛있어요!!👍 그리고 직원분들도 너무 친절하십니다~ 북경오리먹는법 설명까지 완벽해서 기분좋게 먹고 나올수있었어요🥰
65729586,루위중식당,중식,,,"압구정 루위에서 북경오리와 짬뽕을 먹었어요. 겉은 바삭, 속은 촉촉한 오리를 얇게 썰어 밀전병에 싸 먹으니 고급 중식의 진수를 느낄 수 있었어요. 짬뽕도 해산물 가득, 얼큰하고 깊은 맛이라 감탄했답니다. 분위기 좋고 서비스도 세심해서 기념일이나 가족 모임 장소로도 딱이에요."
65729586,루위중식당,중식,,,"압구정 중식당 루위에서 베이징덕 먹고 감탄했어요✨ 오리를 테이블 앞에서 직접 썰어주시는데, 껍질은 바삭하고 속은 촉촉~ 야빙에 파채, 오이, 춘장 올려 싸먹는 그 맛이 진짜 최고였어요😋 껍질에 설탕 살짝 찍어 먹는 것도 별미! 분위기도 세련되고 고급스러워서 데이트 장소로도 완전 추천💑 짬뽕도 해산물 듬뿍에 국물 진하고 깔끔해서 마무리로 딱! 서비스도 친절해서 기분 좋은 식사였어요👍 다음엔 가족이랑 룸 예약해서 또 가보려구요😊"
65729586,루위중식당,중식,,,압구정에서 모임할 때 가기좋은 중식당! 양식 스테이크와는 완전 다른 스타일의 중식 안심 스테이크 꼭 먹어보세요. 부드러우면서 소스까지 맛있어서 역시 일품요리 라는 소리가 절로 나와요.
65729586,루위중식당,중식,,,여직껏 먹어본 탕수육중 가장 맛있는 탕수육 !디저트도 맛있고 중국냉면도 너무 맛있어요 !꼭다시올게요. !완전 빠짐. ~여긴 가족단위 연인 친구들 다 올수 있는곳. 일하시는분들 너무 친절하고 너무 맛있어서 또 생각나는 맛집이에욮
65729586,루위중식당,중식,,,"역시 믿고 먹는 북경오리맛집이죠. 루위 분위기도 고급스럽고 서비스도 친절해서 가족모임때 자주 찾게 되네요:) 식사양도 푸짐하고 신선한 해산물 재료도 아낌없이 주시는데 진짜 맛있어요. 해물짬뽕, 게살xo볶음밥 꼭 드셔보세요!"
65729586,루위중식당,중식,,,"예약 후 방문하면 기다림없이 북경오리가 바로 준비되며, 둘이서 한마리 양이 많아 충분히 즐길 수 있어요"
65729586,루위중식당,중식,,,예약 후 방문했습니다 북경오리는 겉바속촉 너무 맛있고 야빙도 리필이 됩니다. 짬뽕은 해산물 아주 풍부하고 면에 간이 잘 베어있고 시원하고 얼큰해요. 직원분들 모든 분들 다 미소가득에 친절하셔서 저도 미소짓게 되는 곳이였어요. 강남 부근 중식당 모임하실 분들은 친절함과 맛을 겸비한 루위를 강추드립니당
65729586,루위중식당,중식,,,"와, 살도 야들야들 겉 껍질은 진짜 기름이 파바박 터지듯이 흩날리는데 진짜 맛있습니다 !! 같이먹는 조합도 훌륭했고 술한잔이랑 기울이시는거 강력추천드려요 !"
65729586,루위중식당,중식,,,완벽한 저녁식사입니다. 음식이 맛있어도 서비스가 좋지 않거나 서버분들이 불친절하면 돈을 내잡기에도 난감한데 루위는 직원분들 다 친절한 데다가 기본적으로 중국어하는 분들이 많으시네요! 북경오리는 먹어본 중에 최고예요. 잡내도 없고 밀전병을 하나씩 종이에 싸서 준비한 정성도 돋보이고 특히 오리껍질.. 바삭하니 고소함이 녹아내립니다. 음식만큼 분위기도 좋고 직원분들 서비스도 좋아서 거래처 미팅장소로도 훌륭합니다!
65729586,루위중식당,중식,,,왜 연예인들이 자주 가는 맛집인지 알 거 같은 곳. 최근 짬뽕에 빠진 남자친구가 여태 먹어본 짬뽕 중 가장 맛있다고 아주 극찬을 함. 국물이 다른 곳과는 차원이 다른 맛이 남.. 진짜 미침 해물이 무엇보다 정말 많음 짬뽕 가격도 착함
65729586,루위중식당,중식,,,유명한 압구정 중식당이라 늘 궁금했는데 분위기가 너무 좋고 예약필수인 북경오리는 생각보다 양도 많았고 퍼포먼스와 식감 모두 너무 만족스러웠다. 💕껍질의 바삭함과 촉촉헌 속살이 끝내주고 무엇보다 직원분들 사비스가 너무 친절하셔서 중요한 미팅이나 모임 가질때 식사대접하기에도 너무 좋을듯싶다😍
65729586,루위중식당,중식,,,유명할수밖에 없는 이유가 있는 맛이에요! 북경오리는 처음이었는데 양도 많고 정말 맛있어요 ㅎㅎ 특별한날 방문하셔도 좋고 압구정 중식당 중에서도 고급스러운 분위기 찾으신다면 강추입니당 ~! 같이 먹은 마파두부도 정말 맛있었어요! 잘먹었습니다 :)
65729586,루위중식당,중식,,,이야 왜 연예인분들도 찾아가시는 맛집인지 알겠더라구요. 베이징덕도 아주 크고 먹음직스럽고요. 잘라주시는 그 과정도 이벤트 같아 특별한 날 예약하고 먹으러 가기 좋을 것 같아요. 식사메뉴들도 대체적으로 양이 적당해서 그리고 그냥 양만 많은게 아니라 재료도 좋은 것들을 써주시는 것 같아서 아주 만족스러웠어요.
65729586,루위중식당,중식,,,"익힘정도 바삭함, 촉촉함 그리고 가게 홀 내부 분위기까지 뭐하나 흠잡을때가 없습니다 .특히 가게 홀 분위기가 고즈넉한데요. 은은한 조명이 분위기를 내서 그런지 오리의 상태가 더 먹음직스럽게 보이는 효과도 내는것 같습니다 . 제생각엔 결혼기념일이나 연인과의 기념일, 귀빈대접을 할때 방문하면 줗겠습니다"
65729586,루위중식당,중식,,,저녁에 방문예약 후 이용대기 시간 바로 입장데이트부모님
65729586,루위중식당,중식,,,"저희가 먹은 건 북경오리인데요, 이건 예약을 해야 먹을 수 있는 메뉴예요! 저희는 이게 메인이라 미리 캐치테이블로 예약하고 먹었는데..진짜 정말 맛있게 먹었어요. 오리껍질도 이렇게 고소하고 담백하게 만들어줄 수 있는 곳은 여기뿐 일거예요. 같이 싸먹는 밀전병도 최고였구요. 직원분들이 너무 친절하셔서 더 맛있게 먹을 수 있었던 것 같아요 ✨❤️"
65729586,루위중식당,중식,,,"저희가 먹은 사품냉채는 새우, 해파리, 소고기 편육, 송로버섯이 한 접시에 담겨 식감과 맛의 조화가 훌륭했고, 상큼한 소스가 확 입맛을 돋구더라구요."
65729586,루위중식당,중식,,,점심에 방문예약 없이 이용대기 시간 바로 입장일상아이
65729586,루위중식당,중식,,,점심에 방문예약 없이 이용대기 시간 바로 입장친목지인・동료
65729586,루위중식당,중식,,,점심에 방문예약 후 이용대기 시간 바로 입장데이트연인・배우자
65729586,루위중식당,중식,,,점심에 방문예약 후 이용대기 시간 바로 입장데이트연인・배우자
65729586,루위중식당,중식,,,"정말 북경오리부터 짜장면까지, 한 상 가득 맛있게 즐기고 나니 식사를 마칠 무렵, 예상치 못했던 후식 오렌지 샤베트가!"
65729586,루위중식당,중식,,,"제대로 된 베이징덕 사전예약하고 먹고 왔어요! 외국 분위기 물씬 나는 인테리어부터 고급진 서비스까지, 기념일이나 특별한 날 딱 어울리는 곳이에요. 베이징덕은 겉은 바삭하고 속은 촉촉~ 고기 잡내 없이 깔끔하고, 함께 나오는 밀전병, 채소, 소스 조합이 완벽했어요. 가격대는 좀 있지만, 그만큼 퀄리티가 좋아 만족스러웠어요. 다 먹고 나니 뒷맛도 개운하고 기름지지 않아서 좋았어요. 고급 중식 제대로 즐기고 싶다면 추천합니다!"
65729586,루위중식당,중식,,,"직원분이 바로 앞에서 먹기 좋게 썰어주고, 또띠아에 오리와 채소, 소스를 넣어 싸 먹으니 조화가 딱이었습니다."
65729586,루위중식당,중식,,,차돌짬뽕 먹는순간 많은 사람들이 생각났어요. 정말 정말 맛있고 해물도 같이 들어가 있고 군만두랑 환상의 궁합이에요. 연예인들 많이 오는 이유가 있엇네요. ~정말 정말 누구랑 와도 뭘 시켜도 실패없는 맛집 !최고 에요 !!!
65729586,루위중식당,중식,,,해파리냉채도 고량주페어링하기 매우 좋은 요리였구요 ✔️ 야들야들하면서 시원한 촉감에 적당히 가미된 겨자향에 감칠맛까지 별미 같은 메뉴 ☺️ 재방문하고 싶어요 !
1893046652,루프탑 바 디아만테,양식,,,5월 행사로 여성분들께 드린다며 릴렛토닉도 서비스로 주시는데 산뜻한 맛에 추가주문하고 싶을 정도였음!
1893046652,루프탑 바 디아만테,양식,,,5층 루프탑바 디아만테 좋았던 기억으로 4층도 방문했습니다~!
1893046652,루프탑 바 디아만테,양식,,,❣️ 맛：현재 시그니처 메뉴가 1+1 행사중이었는데 양이 너무 많고 너무 맛있어서 이렇게 행사를 해도 되나 할 정도로 최고였습니다. 특히 킹크랩 로제 소스 링귀니가 정말 맛있더라고요. 킹크랩이 제대로 들어 있어요.
1893046652,루프탑 바 디아만테,양식,,,굿이었겠지만요 바람이 불고 햇빛은 따가워서 오픈안되어서 오늘은 더 굿이었네요^^; 음식도 깔끔에 맛나고 음식전달해주시는 분들의 친절함까지 캬~~~ 굿굿굿재방문도 있고요
1893046652,루프탑 바 디아만테,양식,,,"금요일 당일 기념할 분위기 있는 곳 찾다가 밤10시 넘어서 급하게 예약함에도 불구하고 , 발렛 당연히 됨!"
1893046652,루프탑 바 디아만테,양식,,,"날씨 좋고 분위기 끝장나요~ 적당한 바람, 좋은 음악, 친절한 서비스, 인테리어가 아주 고급스럽고 세련됐어요 데이트, 모임 강력추천합니다. 음식 다 맛있었어요 최고에요!! 잠시 어느 고급 리조트에 놀러갔다온 느낌 ㅎㅎ 대 힐링 시간이었습니다. 웰컴드링크도 한잔씩 주고 하니 기분이 좋았어요 진갈빗살 스테이크 짱 맛있고,, 깔라마리 오징어가 진짜 부드러워요 양도 많아요 한우라구리가토니는 다른 어느집보다도 여기가 제일 맛있었어요"
1893046652,루프탑 바 디아만테,양식,,,날씨가 좋아서 루프탑 온 기분 내기 정말 좋았어요. 웰컴 칵테일을 무료로 주셔서 기분이 엄청 좋았어요. (여성의날이벤트래요)~ 음식 맛은 진짜 최고예요 플라워칵테일 세트주문으로 여러가지 맛을 다양하게 마셔볼 수 있어서 좋았어요. 요즘 날씨에 루프탑바 꼭 가보세요.
1893046652,루프탑 바 디아만테,양식,,,"남편회사가 압구정인데 저도 강남쪽에 볼일이 있어서 점심을 함께 먹기로 하고 어디서 먹을까 검색해보던중 밤에만 가봤던 루프탑바가 런치에도 운영한다고 하여 방문했습니다~ 같은 건물에 있는 비노탭에서 파스타 맛있게 먹었던 기억에 저는 하이볼도 먹고 싶었는데 정말 안성맞춤이였어요. 밤에 가면 천장도 열려서 분위기 넘나 좋은데, 낮시간에도 햇살이 들어오는 화이트인테리어가 꼭 휴양지온 기분이더라구요. 샐러드와 파스타 주문했는데.. 정말 신선하고 맛있었어요! 하이볼도 맛있었는데 웰컴이벤트로 주신 웰컴칵테일도 정말 맛있었어요. 메뉴화 기대할께요~~ 시에나 라운지의 레스토랑들은 누구든 함께가면 기분좋게 먹고 칭찬받는곳인거 같아요. 가성비도 좋고!! 정말 추천합니다."
1893046652,루프탑 바 디아만테,양식,,,넘넘 좋아하는 청담동 루프탑바인데 아롱사태스튜 처음 보는 메뉴라 요번에 츄라이해 보았어용 먹어보고 반했다는 ㅎㅎ 진짜 넘 맛있고 고기도 많고 가성비 너무 좋은 메뉴였어요
1893046652,루프탑 바 디아만테,양식,,,데이트로 왔는데 분위기도 좋고 음식 맛도 맛있어요! 진갈비살 꼭드세요 고기 넘 부드러워요!! 데이트 아니여도 모임으로오고 담소 나누기에도 좋을 것 같아요.
1893046652,루프탑 바 디아만테,양식,,,"런치 오픈해서 12시에 6명이서 갔는데 자리도 넓고 의자도 편했습니다. 내부 공간이 싱그럽고 예뻐요! 건물이 웅장해서 멀리서도 잘 보이는데 청담 주변 음식점들보다 싼 것 같아요. 6명이서 4메뉴 12만원 나왔어요. 하이볼 시켜도 인당 4만원이 안나온다니 놀랐어요, 음식도 맛있어요. 특히 포항문어와 엔쵸비 파스타 별미네요^^ 이벤트로 인당 한 잔씩 칵테일 주셨는데 정성...👍회식장소로 추천합니다~! 다음엔 노을질 때쯤 한 번 와봐야겠어요. 루프탑 뚜껑 열렸을 때 가보고 싶네요. 잘먹었습니다~~"
1893046652,루프탑 바 디아만테,양식,,,루프탑 디아만테 2차로 선택한 장소였는데 정말 탁월한 선택이었다고 생각합니다^^ 원래는 날씨가 좋을거라고 생각하고 폴딩도어 열어주시려나 했는데 비가 너무 많이 왔어요 ㅋㅋ 근데... 빗소리가 정말 분위기를 더 운치있게 만들어줬어요♡ 언제 가도 분위기가 좋아서 다 만족할 것 같습니다. 그리고 술 종류가 다양해서 각자 취향껏 선택할 수 있는점도 강점인 것 같아요. 하이볼 종류도 많고 칵테일부터 위스키까지 많아서 함께 간 일행들도 너무 좋아했어요! 히비스커스 하이볼은 주문할때 도수 낮춰달라고 요청드려서 입맛에 맞게 마실 수 있었고 상큼달달한 맛 최고였습니다. 칵테일과 위스키도 대만족😍😍 그리고 기본 안주 계속 채워주시는 센스와 친절함 최고에요♡ 1차를 먹고 가서 안주로 샤퀴테리 주문했는데 페어링이 완벽했어요💜
1893046652,루프탑 바 디아만테,양식,,,루프탑바 디아만테에서 소개팅 데이트라니 선택 잘하셨다 싶더라구요!👍💜
1893046652,루프탑 바 디아만테,양식,,,"루프탑바라 천장이 뚫려있어 분위기가 진짜 끝내줍니다💕 테이블마다 미리 화로도 있어서 따뜻해서 좋구요, 약간 썰렁하다 싶을때 직원분께서 센스있게 담요도 가져다주셔서 넘 기분좋은 시간 보내고왔어요. 루프탑바 디아만테 최고 장점은 역시 위스키, 하이볼, 칵테일을 한 테이블에서 즐길 수 있는 것 같습니다 ㅋㅋㅋ"
1893046652,루프탑 바 디아만테,양식,,,"맛있는 음식먹을 때, 좋은 곳에 갈때 생각나는 사람들이 있어요. 결혼후 육아에 바쁘게 지내고 있을 동생과 분위기 좋은 곳에서 점심약속을 합니다. 디너에만 2번 방문했었는데 알고보니 5월부터 런치타임이 생겨서 너무 신났어요. 더 시에나 라운지 음식 다 맛있는데 새로운 메뉴들로 주문해 봅니다. 저는 야채, 동생은 고기와 해산물을 좋아해 타이스타일 누들샐러드, 포항문어, 진갈비 그리고 오랜만에 기분도 내고 싶다며 히비스커스 하이볼, 모히또를 주문합니다."
1893046652,루프탑 바 디아만테,양식,,,매니저님께서 달모어 12년산 추천해주셔서 쉐리랑 비교하면서 마셔봤어요! 향과 맛이 정말 깊고 좋더라구요!
1893046652,루프탑 바 디아만테,양식,,,머무는 내내 섬세한 체킹에 감동이였습니다 꼭 또 방문하고싶은 곳이에요🤍
1893046652,루프탑 바 디아만테,양식,,,바텐더님의 위스키 추천도 넘 좋았고 기본안주도 다양한 메뉴 선택할수 있는 점도 좋았어요!
1893046652,루프탑 바 디아만테,양식,,,바텐더님이 친절하시고 재밌으셔서 시간 가는지 몰랐네요 ㅋㅋㅋㅋㅋ 덕분에 얼마나 마셨는지ㅋㅋㅋㅋㅋ❤️
1893046652,루프탑 바 디아만테,양식,,,브런치 먹으려다 로스트비프를 시켰는데요. 같이 간 분이 극찬ㅋㅋㅋ 칠리해산물 볶음쌀국수 합이 너무 맛있었어요:) 티라미수도 녹진하니 굿굿! 하이볼도 맛있었고 위스키도 궁금해서 저녁에 즐기러 또 갈꺼예요!
1893046652,루프탑 바 디아만테,양식,,,"아롱사태는 같이간 친구가 치즈를 못먹어서 빼달라했는데, 요청사항도 잘들어주시고 아롱사태도 정말 연하고 맛있었습니다."
1893046652,루프탑 바 디아만테,양식,,,아직 쌀쌀한 날에 가서 루프탑과 통창 개방이 안됐는데 날 좋은 날에 개방되면 진짜 예쁘겠더라구요. 재방문 하려구요! 그리고 칵테일 하이볼 등등 술 종류가 많아서 좋았어요~~
1893046652,루프탑 바 디아만테,양식,,,"아침에 방문예약 후 이용대기 시간 바로 입장친목, 기념일친척・형제"
1893046652,루프탑 바 디아만테,양식,,,"예전에 친구따라 갔다가 좋아서 이번에 제가 예약해서 다른 친구들을 데려갔는데, 친구들 모두 엄청 만족해서 너무 다행이었던 곳이에요!! 음식이 맛있고 재료가 진짜 신선해요. 특히 파스타랑 스테이크가 진짜 맛있었요. 분위기도 좋고 엄청 깔끔해서 다음엔 남친이랑 재방문하려구요 ㅎㅎ"
1893046652,루프탑 바 디아만테,양식,,,오랜만에 만난 회사 동료들이랑 방문했는데 다들 대만족하셨어요. 까다롭기 이루말할 수 없는 분들이라 고르고 골라 방문했는데 걱정은 기우였습니다.
1893046652,루프탑 바 디아만테,양식,,,오랜만에 친구만나허 청담다녀왔어요 이곳은 작년에 모임하면서 가봤던곳인데 런치메뉴가 생겼더라고요 날도 좋고 하늘보면서 맛있는밥 먹으니까 기분도 좋았어요 테이블은 많지않으니 방문전 꼭 예약 후 방문하세요 새로나온 메뉴 너무다 맛있더라고요 부리타치즈랑 샐러드 넘 신선했고 메밀소바는 자극적이지않고 시원하게먹었어요 튀김 정말 예술이에요 그리고 우대갈비는 꼭 먹아줘야하는 거 아시죠? 런치도 부담없이 즐길수 있고 맛있는 칵테일도 이벤트로 받을수 있었답니다! 청담에서 모임하실 예정이라면 이곳 추천 드려요~
1893046652,루프탑 바 디아만테,양식,,,요즘같은 날씨좋은날에 생각나는곳. 루프탑 지붕을 여니까 더 운치있고 너무 좋네요. 해지는 시간에 가니까 넘 예쁘구요. 칵테일도 너무 다 맛있고 추천도 잘 해주셔서 어렵지 않고 넘 좋았어요. Non알콜 칵테일도 넘넘 예쁘고 맛있었음. 굳굳~!!!밥을 먹고가서 메뉴 선택가볍게 했는데 마라윙과 나초도 넘 맛있었어요. 좋아여 저장~
1893046652,루프탑 바 디아만테,양식,,,웰컴 드링크로 주시는 칵테일이 정말 맛있으니 차는 두고오시는걸 추천합니다ㅎㅎ 저는 인생 칵테일이었어요
1893046652,루프탑 바 디아만테,양식,,,음식도 맛있고 분위기도 좋았습니다. 비가 올 수도 있는 날이라 루프탑이 열려있지 않아 아쉬웠지만 한승현 매니저님이 친절해서 밥 먹는 내내 기분이 좋았습니다!
