가게ID,가게명,평점,날짜,리뷰내용
1999173747,모리향,,,점심에 방문예약 없이 이용대기 시간 10분 이내 일상아이
1999173747,모리향,,,점심에 방문예약 없이 이용대기 시간 바로 입장가족모임지인・동료
1999173747,모리향,,,점심에 방문예약 없이 이용대기 시간 바로 입장데이트
1999173747,모리향,,,"점심에 방문예약 없이 이용대기 시간 바로 입장비즈니스, 회식친구, 지인・동료"
1999173747,모리향,,,점심에 방문예약 없이 이용대기 시간 바로 입장일상
1999173747,모리향,,,점심에 방문예약 없이 이용대기 시간 바로 입장일상연인・배우자
1999173747,모리향,,,점심에 방문예약 없이 이용대기 시간 바로 입장친목친척・형제
1999173747,모리향,,,점심에 방문예약 없이 이용대기 시간 바로 입장친목친척・형제
1999173747,모리향,,,정말 작은 포인트지만 밑반찬으로 나오는 짜샤이(?)도 맛있었어요(엄청 짠 곳도 있어서)
1999173747,모리향,,,주차도 가능해서 단체회식이나 모임하기도 너무 좋은것같아요!!
1999173747,모리향,,,"중국집인데 매장 정말 깔끔하고, 직원분들도 친절하시고 무엇보다 음식이 맛있고 양 진짜 많음. 자스민차 최고에요 입 싸악 헹궈줌,, 많이 파세요!!!!"
1999173747,모리향,,,"짬뽕 국물이 정말 깔끔하고 해산물,야채 듬뿍 맛있었어요!!!!!"
1999173747,모리향,,,짬뽕이 너무 맛있는집이에요 ㅠ 밥까지 말아먹고싶었는데 배가 불러서 못말아먹은게 아쉽네요 ㅠ
1999173747,모리향,,,처음 방문인데 동네 맛집 발견입니다! 탕수육 특히 대박 ㅎㅎ 튀김옷 적당하고 고기도 실하고요. 소스가 과하지 않고 딱이에요. 요즘 쫀득한 찹쌀탕수육같은 거 유행이지만 오히려 정통이면서 퀄리티가 좋은 탕수육이라 더 좋은 것 같아요. 사진은 못찍었는데 짜장면도 아이가 너무 잘 먹어서 ㅎㅎ 주변에 중국집 찾으면 마라밖에 안나오는데.. 제대로 잘 찾은 듯 해요 ㅎㅎ 재방문 의사 120%네요!
1999173747,모리향,,,"탕수육은 너무 쫄깃하고 소스도 적당히 달달, 새콤 했습니다. 차돌짬뽕은 불향과 차돌의 진한 고기 육수가 너무 최고였어요! 맛있게 먹었습니당~"
1999173747,모리향,,,특히 탕수육이 바삭하고 맛있어요!! 쟁반짜장도 양 많고 매콤하니 맛있습니다!
1999173747,모리향,,,항상 배달로만 먹었는데 가게에 와서 먹으니 더 맛있네요!
1999173747,모리향,,,해물 듬뿍인 삼선짬뽕밥에 서비스 만두까지 너무 맛있어요~ 사진에는 없지만 여기 탕수육 맛집입니다! 탕수육에 비계없이 살코기만 있어서 호불호 없이 먹을 수 있는 고급탕수육의 맛이에요~~
1999173747,모리향,,,혼자 두가지 메뉴 먹고싶은데 양때매 못먹잖아요ㅠㅠ 모리향은 다 먹을 수 있어서 자주옵니다!
1999173747,모리향,,,회사 앞 소문난 중식당 모리향에 왔어요! 삼선짬뽕과 삼선쟁반짜장 미니모리향탕수육을 주문했는데 둘이 와서 먹기 너무 좋고 (약간 많지만 나는 대식가!) 국물도 얼큰해서 너무 좋네요!! 걸어서 십분이나 와야하지만 재방문 의사 있습니다! 내돈내산임!!!
1044096368,무탄 압구정 본점,,,"The food was not only delicious but also came with great service. The portions were very generous, and the price was reasonable. I brought my parents here, and everyone was very satisfied."
1044096368,무탄 압구정 본점,,,"시즌 한정이라 호기심에 주문한 구룡포오징어 특선짬뽕, 기대 이상이었습니다. 🦑오징어가 통통하고 큼직해서 씹는 맛이 정말 좋고, 국물은 깔끔하면서도 은근한 매콤함이 있어 숟가락을 멈출 수 없었어요. 건더기가 넉넉해 면을 다 먹고도 공기밥까지 말아 먹으니 제대로 든든했습니다. 함께 주문한 고추유린기는 신의 한 수. 산더미 같은 고추가 올라와도 맵지 않고 오히려 아삭한 식감과 향긋함이 느끼함을 싹 잡아줍니다. 상큼하게 마무리하기에 딱이었어요. 기본 반찬들도 정갈하고 맛있어 전체적으로 만족도가 높았습니다. 👍🏻☺️ 무탄 엠버서더 탐나네요. 기회가 되면 자주 오겠습니다 🔥"
1044096368,무탄 압구정 본점,,,"안녕하세요, Kjs2445고객님 압구정 무탄입니다🤗무탄과의 만남!반갑습니다 💕저희 무탄은 방문해주시는 고객님들께 당연 약속드린 최상의 음식과 함께, 색다른 기쁨과 추억을 더해 드리고자 다양한 이벤트를 준비하고 있습니다!🤗 이를 알아주시고 정성스러운 리뷰를 남겨주시니 정말 보람차고 기쁘네요. 앞으로도 여러 이벤트로 고객님의 만족에 한 발짝 더 다가가는 압구정 무탄이 되겠습니다!❤️‍🔥 감사합니다."
1044096368,무탄 압구정 본점,,,"안녕하세요, aa****고객님 압구정 무탄입니다🤗 기대하고 고대하시던 무탄와의 첫 만남!반갑습니다 고객님의 기대에 응하고자 준비한 음식들을 맛있게 드셨다고 하니 넘 뿌둣하네요.💕저희 무탄은 방문해주시는 고객님들께 당연 약속드린 최상의 음식과 함께, 색다른 기쁨과 추억을 더해 드리고자 다양한 이벤트를 준비하고 있습니다!🤗 이를 알아주시고 정성스러운 리뷰를 남겨주시니 정말 보람차고 기쁘네요. 앞으로도 여러 이벤트로 고객님의 만족에 한 발짝 더 다가가는 압구정 무탄이 되겠습니다!❤️‍🔥 감사합니다."
1044096368,무탄 압구정 본점,,,"안녕하세요, ms9****고객님 압구정무탄 본점입니다🤗 근사한 맛이었다는 극찬의 말씀, 정말 감사드립니다! 이렇게 정성이 느껴지는 후기를 남겨주시는 고객님을 뵐 때마다 무탄는 고객님이 있기 덕분에 존재하고 고객님 덕분에 발전할 수 있다고 생각하고 다시 한 번 다짐하게 되는 것 같아요😭고객님이 보내주신 사랑을 잊지 않고 항상 만족스러운 식사 한 끼를 즐기실 수 있도록 매일 매 시간 발전하는 무탄이 되겠습니다 💖 오늘도 즐거운 하루 보내시고 소중한 후기 너무너무 감사드립니다💗"
1044096368,무탄 압구정 본점,,,"안녕하세요,쟌쟌엠고객님 압구정 무탄입니다🤗 기대하고 방문한 무탄와의 첫 만남!반갑습니다 💕저희 무탄은 방문해주시는 고객님들께 당연 약속드린 최상의 음식과 함께, 색다른 기쁨과 추억을 더해 드리고자 다양한 이벤트를 준비하고 있습니다!🤗 이를 알아주시고 정성스러운 리뷰를 남겨주시니 정말 보람차고 기쁘네요. 앞으로도 여러 이벤트로 고객님의 만족에 한 발짝 더 다가가는 압구정 무탄이 되겠습니다!❤️‍🔥 알찬 추석 연휴되세요~~감사합니다."
1044096368,무탄 압구정 본점,,,"안녕하세요. 맑음7226고객님 압구정무탄 본점입니다💕 고객님의 극찬의 말씀, 정말 감사드립니다! 저희 무탄은 언제나 고객님의 건강과 만족을 가장 먼저 생각합니다. 이 점 알아주시고 칭찬해주시니 고객님께서 안심하시며 편안하게 식사하신 것 같아 정말 뿌듯합니다.🤗 고객님께서 언제까지나 아무 걱정 없이 맛있는 한 접시를 즐기실 수 있도록, 앞으로도 건강한 재료만을 약속하는 무탄이 되겠습니다.😉 오늘도 좋은 하루 되세요!"""
1044096368,무탄 압구정 본점,,,안녕하세요~ cho****고객님 압구정 무탄 본점입니다.저희 무탄에서 새로 출시된 🎀🎀🎁비밀이야 시그니처 세트를 맛있게 드시고 예쁜 사진도 남겨주셔서 감사합니다✨🧡. 고객님분들이 격려의 말씀 너무 감사드리며 항상 변함없이 노력하는 무탄이 되겠습니다💦. 다시 방문하는 그날을 기대하면서 감사 인사올립니다.즐거운 연휴 되세요.💕💓
1044096368,무탄 압구정 본점,,,안녕하세요~ dudnwl804고객님 압구정 무탄 본점입니다. 저희 무탄에서 시그니처 세트를 즐기시고정성스러운 후기 감사드립니다. 💕 고객님들께서 방문하셔서 항상 정성 가득 맛난음식🍜 칭찬 많이 해주시고 가십니다. 이런 후기를 볼때마다 저희 직원들은 보람을 느낍니다.💌 오늘도 방문해주신 고객님께 감사인사 드립니다. 항상 좋은 일만 있기를 기원합니다.😍😍
1044096368,무탄 압구정 본점,,,안녕하세요~ enEn고객님 압구정 무탄 본점입니다. 맛있게 드시고 예쁜 사진도 남겨주셔서 감사합니다✨🧡. 고객님분들이 격려의 말씀 너무 감사드리며 항상 변함없이 노력하는 무탄이 되겠습니다💦. 다시 방문하는 그날을 기대하면서 감사 인사올립니다. 기분 좋은 하루 되세요.💕💓
1044096368,무탄 압구정 본점,,,안녕하세요~ godmeil고객님 압구정 무탄 본점입니다. 정성스러운 후기 감사드립니다💝. 고객님께서 맛있게🍜 드셨다니 정말 다행입니다. 저희 무탄을 방문 해주시고 행복한 기억이 되신 것 같아서 너무 뿌듯하네요. 앞으로도 만족스러운 음식과 서비스로 다시 방문하는 그날을 기대하면서 감사 인사 올립니다 💕. 오늘도 좋은 하루 되세요.(❁´◡`❁)
1044096368,무탄 압구정 본점,,,안녕하세요~ skykmk고객님 압구정 무탄 본점입니다. 🍀🍀즐거운 추석 연휴 잘 보내셨나요? 정성스러운 후기 감사드립니다💝.고객님께서 저희가 준비한음식들을 맛있게🍜 드셨다니 정말 다행입니다. 저희 무탄을 방문 해주시고 행복한 기억이 되신 것 같아서 너무 뿌듯하네요. 앞으로도 만족스러운 음식과 서비스로 다시 방문하는 그날을 기대하면서 감사 인사 올립니다 💕. 오늘도 좋은 하루 되세요.(❁´◡`❁)
1044096368,무탄 압구정 본점,,,안녕하세요~ suzy투티고객님 압구정 무탄 본점입니다. 정성스러운 후기 감사드립니다💝. 추천받고 방문하신 🎀저희 무탄에서 고객님께서 맛있게🍜 드셨다니 정말 다행입니다. 저희 무탄을 방문 해주시고 행복한 기억이 되신 것 같아서 너무 뿌듯하네요. 앞으로도 만족스러운 음식과 서비스로 다시 방문하는 그날을 기대하면서 감사 인사 올립니다 💕. 오늘도 좋은 하루 되세요.(❁´◡`❁)
1044096368,무탄 압구정 본점,,,안녕하세요~ wjd****고객님 압구정 무탄 본점입니다. 🎀뜻깊은 날에 저희 무탄을 찾아주시고 정성스러운 후기📧 남겨주셔서 감사드립니다💝. 고객님께서 맛있게🍜 드셨다니 정말 다행입니다. 저희 무탄을 방문 해주시고 행복한 기억이 되신 것 같아서 너무 뿌듯하네요. 앞으로도 만족스러운 음식과 서비스로 다시 방문하는 그날을 기대하면서 감사 인사 올립니다 💕. 오늘도 좋은 하루 되세요.(❁´◡`❁)
1044096368,무탄 압구정 본점,,,안녕하세요~ 어디든쩝쩝박사고객님 압구정 무탄 본점입니다. 정성스러운 후기 감사드립니다💝. 고객님께서 맛있게🍜 드셨다니 정말 다행입니다. 저희 무탄을 처음방문 해주시고 행복한 기억이 되신 것 같아서 너무 뿌듯하네요. 앞으로도 만족스러운 음식과 서비스로 다시 방문하는 그날을 기대하면서 감사 인사 올립니다 (❁´◡`❁) 즐거운연휴 보내세요.💖💖💦
1044096368,무탄 압구정 본점,,,안녕하세요~ 콘브레드고객님 압구정 무탄 본점입니다. 맛있게 드시고 예쁜 사진도 남겨주셔서 감사합니다✨🧡. 고객님분들이 격려의 말씀 너무 감사드리며 항상 변함없이 노력하는 무탄이 되겠습니다💦. 다시 방문하는 그날을 기대하면서 감사 인사올립니다. 기분 좋은 하루 되세요.💕💓
1044096368,무탄 압구정 본점,,,안녕하세요~ 햇님6고객님 압구정 무탄 본점입니다. 맛있게 드시고 예쁜 사진도 남겨주셔서 감사합니다✨🧡. 고객님분들이 격려의 말씀 너무 감사드리며 항상 변함없이 노력하는 무탄이 되겠습니다💦. 다시 방문하는 그날을 기대하면서 감사 인사올립니다. 기분 좋은 하루 되세요.💕💓
1044096368,무탄 압구정 본점,,,안녕하세요~Oo뱃살부자oO고객님 압구정 무탄 본점입니다. 🎀고객님분들께서 만족스러운 시간을 보내신 후기들을 📆📧읽을때마다 저희들의 노력응답을 받은것 같아서 감사인사 올립니다. 🥦좋은 재료로 좋은 맛으이 나온다는 🧡믿음과 함께 저희직원들이 정성껫 준비한 음식으로 충분히 즐기시고풍성한 📸사진들도 올려주셔서 더욱 감사합니다. 언제나 편안하게 오셔서 좋은시간을 가질수 있도록저희 직원분들 모두 한마음으로 최선을 다하겠습니다. 💟오늘도 기분 좋은 하루 보내세요.
1044096368,무탄 압구정 본점,,,안녕하세요~Vpiop고객님 압구정 무탄 본점입니다. 🎀고객님분들께서 만족스러운 시간을 보내신 후기들을 📆📧읽을때마다 저희들의 노력응답을 받은것 같아서 감사인사 올립니다. 🥦좋은 재료로 좋은 맛으이 나온다는 🧡믿음과 함께 저희직원들이 정성껫 준비한 음식으로 충분히 즐기시고풍성한 📸사진들도 올려주셔서 더욱 감사합니다. 언제나 편안하게 오셔서 좋은시간을 가질수 있도록저희 직원분들 모두 한마음으로 최선을 다하겠습니다. 💟오늘도 기분 좋은 하루 보내세요.
1044096368,무탄 압구정 본점,,,안녕하세요~맛집찬양고객님 압구정 무탄 본점입니다. 🎀고객님분들께서 만족스러운 시간을 보내신 후기들을 📆📧읽을때마다 저희들의 노력응답을 받은것 같아서 감사인사 올립니다. 🥦좋은 재료로 좋은 맛으이 나온다는 🧡믿음과 함께 저희직원들이 정성껫 준비한 음식으로 충분히 즐기시고풍성한 📸사진들도 올려주셔서 더욱 감사합니다. 언제나 편안하게 오셔서 좋은시간을 가질수 있도록저희 직원분들 모두 한마음으로 최선을 다하겠습니다. 💟오늘도 기분 좋은 하루 보내세요.(❁´◡`❁)
1044096368,무탄 압구정 본점,,,안녕하세요~박띠니고객님 압구정 무탄 본점입니다. 🎀고객님분들께서 만족스러운 시간을 보내신 후기들을 📆📧읽을때마다 저희들의 노력응답을 받은것 같아서 감사인사 올립니다. 🥦좋은 재료로 좋은 맛으이 나온다는 🧡믿음과 함께 저희직원들이 정성껫 준비한 음식으로 충분히 즐기시고풍성한 📸사진들도 올려주셔서 더욱 감사합니다. 언제나 편안하게 오셔서 좋은시간을 가질수 있도록저희 직원분들 모두 한마음으로 최선을 다하겠습니다. 💟오늘도 기분 좋은 하루 보내세요.
1044096368,무탄 압구정 본점,,,안녕하세요~샤샤샤아야고객님 압구정 무탄 본점입니다. 🎀고객님분들께서 만족스러운 시간을 보내신 후기들을 📆📧읽을때마다 저희들의 노력응답을 받은것 같아서 감사인사 올립니다. 🥦좋은 재료로 좋은 맛으이 나온다는 🧡믿음과 함께 저희직원들이 정성껫 준비한 음식으로 충분히 즐기시고풍성한 📸사진들도 올려주셔서 더욱 감사합니다. 언제나 편안하게 오셔서 좋은시간을 가질수 있도록저희 직원분들 모두 한마음으로 최선을 다하겠습니다. 즐거운 연휴 보내시고💟오늘도 기분 좋은 하루 보내세요.
1044096368,무탄 압구정 본점,,,"지인이랑 둘이가서 인기메뉴인 트러플 자장면, 마카롱 멘보샤, 고추 유린기를 한번에 먹을 수 있는 커플 시그니처 A세트 주문! 트러플향이 나고 스테이크 고기가 든 트러플 자장면도 좋고 새우가 꽉차있는 마카롱 멘보샤도 맛있었지만 개인적으로는 고추유린기가 원탑이었습니다♡ 강추!"
1901891528,보보식당 압구정,,,"✅ 메뉴 : 버터탕슉, 마라가지, 동파육, 깐풍아귀, 작장면, 콜라, 노아주스, 진저에일"
1901891528,보보식당 압구정,,,계산하고 나올때도 우리 아이가 계산대에 있는 1회용 치실을 5개 챙겼더니 직원이 제앞에서 아이를 나무라더군요.3명이서 5개 정도는 쓸 수 있잖아요. 그 맛없는 음식 군소리없이 먹고 그런 소리 들으니 다신 가기는 커녕 뭐 이런 식당이 있나싶네요. 제 기준에 워스트중 1곳으로 저장했습니다.
1901891528,보보식당 압구정,,,기념일 맞이해서 갔는데 친절하시고 음식도 맛있게 잘 먹었어요!!
1901891528,보보식당 압구정,,,너무 맛있었어서 사진을 이쁘게 못찍었네요. 일단 저 오이 진짜 기절할 맛이고 가지 꼭 시켜야하고 면류는 다 다 맛있어요. 정말 몇번째 재방문인지 모르겠네요. 최고!!
1901891528,보보식당 압구정,,,너무 좋아하는 식당이라 임신하고도 자주 갔었다 확장하고 불친절해졌다는 얘기를 많이 들었지만 옛날 생각하며 아이와 갔다 돼지고기 탕수육을 시켰는데 고기튀김 몇개위에 사진과 같이 검정색이 묻어있어사 직원을 불렀다 주방에 확인해서 오겠다며 다녀오더니 하는말.. 이물질도 아니고 탄것도 아니래요 그럼 이건 무엇이란 말인가.. 먹어도 된다는건가.. 찝찝해서 띄어내고 먹으려는데도 잘 안되서 그냥 두고 나왔다 정상적이지 않은음식에 사과도 없이 이래도 되는건가 싶다 자주 가던 식당에 대한 배신감 확장하고 직원 매니저 다 바뀌었던데 관리가 좀 되야할듯
1901891528,보보식당 압구정,,,마파두부는 마라향이 좀 더 셌으면 더 좋을것 같긴한데 기본적으로 다 맛있었음!!
1901891528,보보식당 압구정,,,메뉴들 다 맛있네요. 마파두부가 새로웠는데 마라 맛도 나고 괜찮았습니다
1901891528,보보식당 압구정,,,"버터탕수육, 마라가지튀김, 오이샐러드 까지는 괜찮았어요. 그런데 식사로 시킨 지스량미엔과 기스면, 새우볶음밥은 정말 최악의 짠맛..요즘 식당에서 이렇게 짜게 음식나온집 처음입니다. 일행들이 얘기하자고 하는데 그냥 남기고 나왔습니다. 음식값이 저렴한 곳도ㅜ아닌데 정말 개선되어야 할 점입니다. 하나의 메뉴만 짰다면 이런 리뷰 남기지 않습니다."
1901891528,보보식당 압구정,,,보보식자작면은 좀 짜니깐 소스를 덜고 기호껏 추가하시라는 안내를 듣고 장을 거의 빼고 비볐지만 그래도 많이 짰어요.. 고기 고명 양을 조금 조절해서 주시면 더 좋을거같아요 :)
1901891528,보보식당 압구정,,,예약을 안하고 갔는데..자리를 마련해주셨어요. 나중에 한명이 더 와서 자리를 더 제공해주셨네요. 감사합니다 ^^
1901891528,보보식당 압구정,,,오랜만에 들른 보보식당 입니다. 계절 메뉴를 맞보려다가도 늘 검증된 메뉴만 맛보는 게 함정 입니다. 새로운 메뉴 시도 때마다 아쉬워서 주저하는데 오늘 역시 새로운 시도의 메뉴는 아쉬웠습니다. 다소 특색있는 메뉴와 신선한 재료 (특히 고수) 그리고 친절함까지 삼박자를 잘 갖춘 작은 규모지만 큰 임팩트가 있는 추천 식당 입니다. 오늘 탕수육은 유난히 좋았던 것 같습니다. 잘 먹었습니다. 또 뵐게요.
1901891528,보보식당 압구정,,,"오이, 가지튀김, 동파육, 아귀 이렇게 3명이서 먹었는데 배부르게 잘 먹었어요! 하나하나 다 맛있네요…!! 가지튀김 소스에 밥 비벼먹으니 그것 또한 맛있어요"
1901891528,보보식당 압구정,,,"오이, 가지튀김, 동파육, 아귀 이렇게 3명이서 먹었는데 배부르게 잘 먹었어요! 하나하나 다 맛있네요…!! 가지튀김 소스에 밥 비벼먹으니 그것 또한 맛있어요"
1901891528,보보식당 압구정,,,음식 맛있어요~소스가 맛있고 재료도 신선하고 시그니처 메뉴들이 맛이 좋습니다! 대응도 친절하고 꼭 한번 와보면 좋을꺼 같아요!
1901891528,보보식당 압구정,,,음식 맛있어요~소스가 맛있고 재료도 신선하고 시그니처 메뉴들이 맛이 좋습니다! 대응도 친절하고 꼭 한번 와보면 좋을꺼 같아요!
1901891528,보보식당 압구정,,,음식은 맛있고 좋았습니다만 총 3개 메뉴 시켰는데 하나가 누락되었습니다. 종업원 분께 확인하니 주문이 밀려 늦는다고 하시더군요. 그래서 더 기다렸는데 추가주문 안 하셨냐고 다른 분이 오셔서 물어보십니다. 다 먹었는데 왜 안 일어나고 앉아있냐는 질문이겠죠. 그 질문을 받고도 마파두부면이 나오기까지 20분이 더 걸렸습니다. 마파두부면이 그렇게 오래 조리해야 하는 주문인줄 몰랐네요.
1901891528,보보식당 압구정,,,이게 주기적으로 보보식당을 찾게 되는 가장 큰 이유 아닐까요?
1901891528,보보식당 압구정,,,이게 주기적으로 보보식당을 찾게 되는 가장 큰 이유 아닐까요?
1901891528,보보식당 압구정,,,"이전에 너무 맛있게 먹은 경험이 있어 어르신분을 모시고 방문했습니다! 어르신분들도 맛있으시다구 너무 만족해하셨어요!!직원분들께서도 다들 너무 친절하게 응대해주셔서 감사했습니다. 맛은 말해뭐해,,,,깐풍아귀, 동파육, 가지튀김 전부 맛있었어요💗 버터탕수육 맛있는데 못시커서 다음에 또 갈거애요!! 보보식당 아끼는 식당,,🫶🏻"
1901891528,보보식당 압구정,,,"이전에 너무 맛있게 먹은 경험이 있어 어르신분을 모시고 방문했습니다! 어르신분들도 맛있으시다구 너무 만족해하셨어요!!직원분들께서도 다들 너무 친절하게 응대해주셔서 감사했습니다. 맛은 말해뭐해,,,,깐풍아귀, 동파육, 가지튀김 전부 맛있었어요💗 버터탕수육 맛있는데 못시커서 다음에 또 갈거애요!! 보보식당 아끼는 식당,,🫶🏻"
1901891528,보보식당 압구정,,,저녁에 방문예약 후 이용대기 시간 바로 입장
1901891528,보보식당 압구정,,,저녁에 방문예약 후 이용대기 시간 바로 입장일상연인・배우자
1901891528,보보식당 압구정,,,"저녁에 방문예약 후 이용대기 시간 바로 입장친목연인・배우자, 친구"
1901891528,보보식당 압구정,,,저녁에 방문예약 후 이용대기 시간 바로 입장친목친구
1901891528,보보식당 압구정,,,저녁에 방문예약 후 이용대기 시간 바로 입장친목친구
1901891528,보보식당 압구정,,,저녁에 방문예약 후 이용대기 시간 바로 입장친목친구
1901891528,보보식당 압구정,,,"점심에 방문예약 없이 이용대기 시간 바로 입장일상아이, 연인・배우자"
1901891528,보보식당 압구정,,,점심에 방문예약 후 이용대기 시간 바로 입장가족모임아이
1901891528,보보식당 압구정,,,"점심에 방문예약 후 이용대기 시간 바로 입장친목연인・배우자, 친척・형제"
1901891528,보보식당 압구정,,,점심에 방문예약 후 이용대기 시간 바로 입장친목지인・동료
1901891528,보보식당 압구정,,,점심에 방문예약 후 이용대기 시간 바로 입장친목친구
1901891528,보보식당 압구정,,,"제일 많이 시키는 메뉴 3가지 주문했는데 다 맛있었어요🩷 특히 버터탕수육이 1등!! 매장 분위기도 좋고, 테이블 간격도 넓고 직원분들도 친절하셔서 재방문 하고 싶어요 🫶"
1901891528,보보식당 압구정,,,"주말 가족 외식으로 딱 좋네요. 건강한 맛 채소(청경채,브로콜리,마늘쫑)로 스타트. 시그니처 버터탕수육,사이드메뉴 입가심 오이무침,화자오향 얼얼한 마파두부 맛있네요"
1901891528,보보식당 압구정,,,중국음식점 중에 제일 맛있어요. 일반 생선요리들 특히 맛있고 재료를 아끼지 않고 사용해서 좋아요. 와인과 곁들여서 즐기기 좋은 집이에요.
1901891528,보보식당 압구정,,,직원들과의 회식이었습니다. 이날의 베스트는 깐풍아귀 였습니다. 선택지에 점점 마라가 들어가는 요리가 많아집니다. 마라향과 맛을 좋아하진 않는데 선택지가 줄어들고 있는 느낌이 다소 아쉽습니다. 그럼에도 조리 수준은 기가 막힙니다. 특히나 튀김류는 튀김피가 얇은데도 충분히 바삭합니다. 부담 없이 즐기고 독특한 메뉴를 고민한다면 추천할 만한 좋은 식당 입니다. 잘 먹었습니다. 또 뵐게요.
