가게ID,가게명,평점,날짜,리뷰내용
1901891528,보보식당 압구정,,,직원들과의 회식이었습니다. 이날의 베스트는 깐풍아귀 였습니다. 선택지에 점점 마라가 들어가는 요리가 많아집니다. 마라향과 맛을 좋아하진 않는데 선택지가 줄어들고 있는 느낌이 다소 아쉽습니다. 그럼에도 조리 수준은 기가 막힙니다. 특히나 튀김류는 튀김피가 얇은데도 충분히 바삭합니다. 부담 없이 즐기고 독특한 메뉴를 고민한다면 추천할 만한 좋은 식당 입니다. 잘 먹었습니다. 또 뵐게요.
1901891528,보보식당 압구정,,,진짜 맛있어요❤️ 분위기도 좋아요!!
1901891528,보보식당 압구정,,,진짜 맛있어요❤️ 분위기도 좋아요!!
1901891528,보보식당 압구정,,,처음 먹어보는 메뉴들이었는데 거부감없이 누구나 다 맛있게 먹었다
1901891528,보보식당 압구정,,,첫번째 방문 하고 음식이랑 분위기 모두 만족해서 재방문 했습니다. 우설 메뉴 시도해봤는데 역시 맛있었어요!
1901891528,보보식당 압구정,,,"최근 다녀온 보보식당, 솔직히 제 입맛에는 너무 느끼하고 기름진 느낌이 강했어요.특히 거의 모든 음식에 고추기름이 과하게 들어가 있어서 먹는 내내 부담스럽더라고요. 식사 후에는 몸 상태가 너무 안 좋아져서 결국 병원까지 다녀올 정도였고 하루 종일 컨디션이 바닥이었습니다. 물론 사람마다 입맛은 다르겠지만 저로선 다시 방문하고 싶은 마음은 없네요. 음식의 맛과 조합, 조금 더 다양하고 덜 자극적으로 개선되면 좋을 것 같다는 생각이 들었습니다."
1901891528,보보식당 압구정,,,"최근 다녀온 보보식당, 솔직히 제 입맛에는 너무 느끼하고 기름진 느낌이 강했어요.특히 거의 모든 음식에 고추기름이 과하게 들어가 있어서 먹는 내내 부담스럽더라고요. 식사 후에는 몸 상태가 너무 안 좋아져서 결국 병원까지 다녀올 정도였고 하루 종일 컨디션이 바닥이었습니다. 물론 사람마다 입맛은 다르겠지만 저로선 다시 방문하고 싶은 마음은 없네요. 음식의 맛과 조합, 조금 더 다양하고 덜 자극적으로 개선되면 좋을 것 같다는 생각이 들었습니다."
1901891528,보보식당 압구정,,,추천 받아 방문한 식당 너무 맛있게 먹고갔어요 보보식당먹으러 서울 다시 오고싶을정도에 만족감
1901891528,보보식당 압구정,,,"친구들과 모임하러 방문했습니다 . 내부가 깔끔해서 일단 기분이 좋았고, 주문한 음식들도 각자 특색있고 맛있었고 그중 마라 가지튀김이 가장 맛있었습니다~"
1901891528,보보식당 압구정,,,"탕수육은 양념에 볶아서 나오는데도 바삭한 식감이 살아있고, 마파두부는 간이 셌지만 마라맛이 적당하고 맛있었어요. 오이도 양념 독특하고 매력 있었어요."
1901891528,보보식당 압구정,,,"탕수육은 양념에 볶아서 나오는데도 바삭한 식감이 살아있고, 마파두부는 간이 셌지만 마라맛이 적당하고 맛있었어요. 오이도 양념 독특하고 매력 있었어요."
1901891528,보보식당 압구정,,,"테이블 배치를 지나치게 욕심냈음. 일부 테이블은 칸막이로 나눠놨는데, 가운데 자리에 걸리면 마치 독서실 책상에서 밥 먹는 기분. 더 황당한 건, 단골 아닌 손님에게 그런 자리를 먼저 권유한다는 점. 우리도 컴플레인을 해서 겨우 다른 자리로 옮김. 그런데 그다음 들어온 손님에게 또 그 자리를 앉히고, 와인병 놓을 자리조차 없어 컴플레인 하니 그제야 칸막이를 치움. 매출을 생각해 테이블 수에 민감할 수는 있으느 선을 넘음. 이건 서비스 정신이 결여됐다고밖에 볼 수 없음. 가격을 올리더라도 이런 운영 방식은, 결국엔 그 테이블을 묵묵히 받아주는 ‘호구’ 손님만을 기다리는 것 같음."
1901891528,보보식당 압구정,,,포스에계신분께 잔 교체 요청했는데 맥주잔만 교체해주시고 이부분에 대해 아무대처는 없고 끝이더군요
1901891528,보보식당 압구정,,,포스에계신분께 잔 교체 요청했는데 맥주잔만 교체해주시고 이부분에 대해 아무대처는 없고 끝이더군요
18505540,홍명중식당,,,"17:03 즈음 방문했는데 벌써 대기줄이 있더라. 블루리본이고 코카콜라와 어울리는 레드리본 가게이기도 한데, 수제만두는 17시 이후에 요리와 함께 주문해야지만 먹어볼 수 있다대? 그것두 모르고 대기명부에 ‘군만두‘ 적어 놓았다가 취소했더니 지배인 얼굴이 엄청 쎄해지던데… 간짜장 2인분 시켜놓구 받아드는 순간, 하얀 양파 가장자리로 반짝이며 묻어난 춘장에 기대감 급상승이었으나, 너무 짜서 급비호감됐다. 간을 보며 장을 넣으라는 조언을 무시한 결과이기도 하지만, 정상적인 가게라면 장 한 그릇의 간은 일반적인 수준에서 적정해야 하는 것 아닐까? 게다가 양파는 아주 살짝만 볶아져 불맛도 덜했고 매운 맛이 가시지도 않았다. 고기는 꽤 태웠던데… 솔까 성시경 맛집이라기에 기대했지만 내 맛집은 아닌 걸루~"
18505540,홍명중식당,,,5시 브레이크 타임 끝나는 시간 맞춰서 갔는데 웨이팅 없이 들어갔어요! 간짜장 진짜 맛있고 군만두랑 넘 잘어울렸어요 굳굳
18505540,홍명중식당,,,간짜장 맛집이나 양은 매우적음. 그리고 탕수육은 시키지마세요. 실망합니다. 마트에서 파는 탕수육인줄
18505540,홍명중식당,,,간짜장 맛집이나 양은 매우적음. 그리고 탕수육은 시키지마세요. 실망합니다. 마트에서 파는 탕수육인줄
18505540,홍명중식당,,,간짜장 맛집이라고 해서 간짜장을 시켜보았습니다 양파가 많고 거의 생양파예요 독특했습니다
18505540,홍명중식당,,,간짜장은 간이 쎘는데 이런 짜게 만들어주는 음식점 너무 좋다
18505540,홍명중식당,,,간짜장이 정말 너무너무 맛있어요 지인분 데리고 갔는데 정말 맛있게 먹었다고했습니다 ㅎㅎ
18505540,홍명중식당,,,"난자완스, 간짜장, 탕수육, 가지, 양장피에 유연고량주를 먹고왔습니다. 다음엔 이외 요리와 짬뽕을 먹어보려고 합니다. 점심이나 저녁이나 웨이팅이 있어 미리 오시기를 강추합니다."
18505540,홍명중식당,,,논현동에서 검색하니 이곳이 나와 들렸습니다. 오~~ 그런데 정말 맛있네요. 완전 강추합니다. 논현동에서 가장 맛있는 중국집이지 않을까 합니다~
18505540,홍명중식당,,,"리뷰 1,868사진 465팔로워 18"
18505540,홍명중식당,,,"매장 안이 아주 넓은건 아니지만 깨끗하고 쾌적합니다. 직원분들이 커버 가능하게 인원을 조절하며 손님을 응대하시는 것 같아요! 서버의 능력 또한 훌륭하신것 같애요. 그래서 더 맛있는 식사를 할 수 있었습니다. 오늘 처음 방문했는데요, 다른 메뉴를 먹으러 갈 날들이 기대되네요💕"
18505540,홍명중식당,,,"먹기 매울 정도라서 위 안 좋은 사람은 모르고 먹었다간 난리나겠어요. 다른 재료라도 조금 있음 모르겠는데 새우 1개, 고기 조금에 양파 잔뜩입니다. 소스 맛은 괜찮은 편인데 보통 간짜장은 재료가 좀 더 풍부한 편인데 여긴 그냥 생양파라고 보면 될 거 같습니다."
18505540,홍명중식당,,,면발에 간짜장이 코팅 되는 것 부터 진짜 감동적이에요😍 비비면서도 감탄했어요… 너무 맛있었고 양파도 적당히 매콤하고 단내나면서 좋았습니다!! 제가 조금 잘 먹는 편이라 양이 살짝 모잘라 담엔 곱빼기로 무조건 시켜야겠어요! 잘드시는 분들은 꼭 곱빼기로 시켜드세요!!! 가짜장에 지치신분들 한번쯤 꼭 방문하시길 바라겠습니다
18505540,홍명중식당,,,면이 좀 적어서 공기밥 추가 주문했는데 결제 시 서비스로 빼주셨어요ㅎㅎ 담에 친구들이랑 와서 요리 좀 더 시켜보려구요 잘 먹고 갑니다!!
18505540,홍명중식당,,,"미리 주문 해놓은 음식은 자리에 앉았더니 바로 나와서 좋았습니다. 근데 2가지 주문했는데 1가지만 나오고 그 이후에는 따로 말씀이 없으셔서... 뭔가 처음에 같이드린다거나, 따로 주신다거나 하는 안내가 있었음 좋았겠다 싶어요. 간짜장도 시켰는데 양은 좀 적었지만 진짜 인생간짜장이었습니다. 너무 맛있게 잘먹었어요. 모든 메뉴가 훌륭하고 이모님들도 친절하셨어요. 마지막에 계산할땐 남자 알바분인지 직원분은 한손에 뭔갈 들고 계셨었는데.. 영수증 달라고하니까 검지,중지 손가락에 끼워서 주시더라고요....? 잘먹고 나오면서 그건 좀 마음이 걸렸습니다. 어쨌든 음식은 맛있게 잘먹었어요."
18505540,홍명중식당,,,"미리 주문 해놓은 음식은 자리에 앉았더니 바로 나와서 좋았습니다. 근데 2가지 주문했는데 1가지만 나오고 그 이후에는 따로 말씀이 없으셔서... 뭔가 처음에 같이드린다거나, 따로 주신다거나 하는 안내가 있었음 좋았겠다 싶어요. 간짜장도 시켰는데 양은 좀 적었지만 진짜 인생간짜장이었습니다. 너무 맛있게 잘먹었어요. 모든 메뉴가 훌륭하고 이모님들도 친절하셨어요. 마지막에 계산할땐 남자 알바분인지 직원분은 한손에 뭔갈 들고 계셨었는데.. 영수증 달라고하니까 검지,중지 손가락에 끼워서 주시더라고요....? 잘먹고 나오면서 그건 좀 마음이 걸렸습니다. 어쨌든 음식은 맛있게 잘먹었어요."
18505540,홍명중식당,,,"성시경 먹을텐데에 등장한 중식당 홍명, 평일 저녁 20분정도 대기 후 입장. 입장 전 대기시 어떤메뉴를 주문할지 대기노트에 적어두면 되는데 그래서 그런지 음식이 아주 빨리 나온다. 면발은 쫄깃하고 볶은 춘장 소스가 진했던 간짜장은 고소하면서도 짠맛의 밸런스가 좋아 추천하고 싶은 메뉴다. 다른중식당에서는 못봤던 짬뽕수제비는 신기해서 주문, 국물이 얼큰하면서 시원했고 직접 빚은 수제비도 쫀득해 식감이 좋았다. 가장 맛있게 먹은 메뉴는 이집의 시그니처 난자완스. 아주 부드럽게 튀겨졌고 소스는 새콤달콤한데 소스 안에 돼지고기 식감이 잘살아있었다. 전반적으로 음식이 빨리 나오고 양이 넉넉했고 재료들도 신선하고 맛도 안정적이라 가성비가 좋았다. 다음에는 일반군만두가 아닌 수제군만두를 꼭 맛보고싶어 재방문하고싶은 맛집"
18505540,홍명중식당,,,"성시경님 맛집이라고 해서 기대하고 방문했고, 웨이팅이 꽤 있었습니다. 저는 오픈한지 얼마안되 조금 기다린후 바로 들어갔고 간짜장을 주문했는데 주문을 하자마자 1분 만에 나와서 미리 만들어둔 듯한 느낌이었고, 볶음밥은 간이 너무 약해 아쉬웠습니다. 함께 나온 짜장도 무난한 편이었어요. 오히려 전 신맛도 났던것 같아요ㅠ 근데 그것보다는 요리로서 먼저 나와야 할 탕수육이 밥을 다 먹고 나서야 나와서 배가 불러 제대로 먹지 못했습니다. 고기는 괜찮았지만 소스는 특별하진 않았습니다. 전체적으로 줄 서서 먹을 정도는 아니었던 것 같아요."
18505540,홍명중식당,,,솔직히 친절하다고 말하긴 아쉽네요. 그래도 맛은 있으니 다음엔 대표음식인 간짜장 난자완스 먹으로 가보려구요!
18505540,홍명중식당,,,솔직히 친절하다고 말하긴 아쉽네요. 그래도 맛은 있으니 다음엔 대표음식인 간짜장 난자완스 먹으로 가보려구요!
18505540,홍명중식당,,,수요일 17:50분 부터 입장까지 1인 대기 약 45분 소요.
18505540,홍명중식당,,,"어쩌다보니(?) 오늘도 홍명에 왔습니다. 일반으로 드시면 양이 좀,,적어요 곱배기 추천추천^^;;"
18505540,홍명중식당,,,오후내내 차를 많이 마셨더니 기름진 음식이 땡겨서 찾은 곳이에요. 흔한 중식당인줄 알았더니 엄청 유명한 집이었나봐요. 다 먹고 나올 때 보니 웨이팅이~
18505540,홍명중식당,,,음식은 맛있는데 여자들끼리 온테이블이 엄청 시끄러움. 귀가 먹었는지 소리를 꽥꽥 지르고
18505540,홍명중식당,,,음식은 맛있는데 여자들끼리 온테이블이 엄청 시끄러움. 귀가 먹었는지 소리를 꽥꽥 지르고
18505540,홍명중식당,,,일찍 갔는데도 30분이상 웨이팅 했지만... 중간에 기다리는 손님분들을 위해 시원한 차를 제공해주셔서 흔쾌히 기다릴 수 있었다.
18505540,홍명중식당,,,자극적인 불향 좋아하는 분들은 불호일수도! 처음엔 잉? 싶은데 먹을수록 맛있는 깔끔하고 깊은 국물
18505540,홍명중식당,,,자극적인 불향 좋아하는 분들은 불호일수도! 처음엔 잉? 싶은데 먹을수록 맛있는 깔끔하고 깊은 국물
18505540,홍명중식당,,,"저녁에 방문예약 후 이용대기 시간 바로 입장친목, 회식, 비즈니스지인・동료, 친구"
18505540,홍명중식당,,,저번에 참 맛있게 먹었는데 .. 오늘은 기름 특유의 기분나쁜 맛이 입안을 맴돌았어요 ㅜㅜ 그래도 배고파서 다 먹긴했습니다 담엔 정상 컨디션의 짜장을 접할 수 있길 바랍니다
18505540,홍명중식당,,,점심에 방문예약 없이 이용대기 시간 10분 이내 데이트연인・배우자
18505540,홍명중식당,,,점심에 방문예약 없이 이용대기 시간 10분 이내 데이트연인・배우자
18505540,홍명중식당,,,점심에 방문예약 없이 이용대기 시간 10분 이내 데이트연인・배우자
18505540,홍명중식당,,,점심에 방문예약 없이 이용대기 시간 10분 이내 일상지인・동료
18505540,홍명중식당,,,점심에 방문예약 없이 이용대기 시간 30분 이내
18505540,홍명중식당,,,점심에 방문예약 없이 이용대기 시간 30분 이내
18505540,홍명중식당,,,점심에 방문예약 없이 이용대기 시간 30분 이내일상지인・동료
18505540,홍명중식당,,,점심에 방문예약 없이 이용대기 시간 30분 이내일상지인・동료
18505540,홍명중식당,,,점심에 방문예약 없이 이용대기 시간 30분 이내일상지인・동료
18505540,홍명중식당,,,점심에 방문예약 없이 이용대기 시간 30분 이내일상지인・동료
18505540,홍명중식당,,,점심에 방문예약 없이 이용대기 시간 바로 입장나들이혼자
18505540,홍명중식당,,,정말 맛있는 학동역 중식 맛집! 주말 저녁에도 대기 많아요~ 간짜장 양념 너무 맛있고 볶음밥이랑 같이 나오는 잡채밥도 너무 맛있는 학동역 맛집~간짜장은 소스 너무 맛있어서 꼭 밥 같이 비벼서 드세요!
18505540,홍명중식당,,,정말 맛있는 학동역 중식 맛집! 주말 저녁에도 대기 많아요~ 간짜장 양념 너무 맛있고 볶음밥이랑 같이 나오는 잡채밥도 너무 맛있는 학동역 맛집~간짜장은 소스 너무 맛있어서 꼭 밥 같이 비벼서 드세요!
18505540,홍명중식당,,,중식의 기본인 간짜장과 짬뽕을 주문했는데 짬뽕의 깔끔한 국물과 신선한 작은 문어 한마리가 들어가 있어서 좋았고 간짜장은 면이 적당하게 잘익고 탄력있어서 불지않아서 좋았다
18505540,홍명중식당,,,짬뽕이 땡기는 날. 국물이 생각나서 먹었습니다. 간짜장에 가려져(?) 다소 빛을 보지 못한 녀석이라 생각합니다. 간이 쎄지 않은듯 하지만 국물맛은 진합니다. 면이 국물에 베인 정도도 적당해서 좋습니다. 면은 호로록 먹어버리니 공기밥 정도 추가하면 좋을 듯 하네요^^
18505540,홍명중식당,,,토요일 점심에 빙문했어요. 웨이팅 길까봐 걱정했는데 오픈 시간에 맞춰 갔더니 거의 바로 들어갔어요.
18505540,홍명중식당,,,"표고향이 좋구, 고기 처음 베어 물때 겉에 입혀진 전분옷(?) 식감에서 한번 육향에서 한번 감탄사가 나옵니다"
18505540,홍명중식당,,,"학동역 근처 중국집 간짜장 보통(11,000원) 맛은 있으나 웨이팅해서 먹을정도는 아니라고 생각함니다 양파가 많고 짜장소스는 거의 없었어요🥲"
18505540,홍명중식당,,,홍명 간짜장 최근 기복이 심했는데 오늘은 괜찮았네요ㅎㅎ
