가게ID,가게명,평점,날짜,리뷰내용
1285186695,트리오드,,,"강남에 일정있어서 왔다가 트리오드라는 카페가있어서 이번에 처음 와봤는데 다양한 디저트도 원하는 그램대로 골라서 먹을 수 있고 자리도 넉넉하고 너무너무 쾌적해서 친구랑와도, 혼자와도 너무너무 좋을것 같아요! 직원분들도 다 너무 친절하시고 좋았습니다! 레몬치즈는 꼭 드셔보세요!!"
1285186695,트리오드,,,강남에서 유명할대로 유명한 ✨트리오드✨ 그램으로 케이크를 판다고 해서 궁금해서 와봤는데 분위기도 아늑하고 케이크도 맛있어서 다음에 또 올 것 같아요! 무엇보다 원하는 만큼 그램 수로 먹을 수 있어서 양도 적당히 먹을 수 있어서 좋았습니다🥹
1285186695,트리오드,,,고구마 신메뉴 나왔대서 먹는데 진짜 너무너무 맛있습니당.... 초코는 늘 진하고 최고고 티라미수도 근본 맛이라 맛나요 짱
1285186695,트리오드,,,그램수로 케익양을 정할 수 있는 카페가 있다고 하길래 찾아서 들려봤는데 눈 앞에서 그램수를 보여주시고 추가로 조금 더 얹어주셔서 좋았어요 !!! 수플레같은 느낌으로 엄청 부드러운 케익인데 티라미수가 특히 맛있어요 ! 케익맛집 인정합니다 ㅎㅎ
1285186695,트리오드,,,그램으로 파는 형식이라 재밌고 케이크는 고구마랑 초코케이크 했는데 초코 케이크 엄청 진하고 낫있어요 단 거 좋아하는 분들 만족하실듯 아바라도 진하고 달달하네요 인테리어도 깔끔하고 자리도 낭낭해요 다음에 다른 맛 먹ㅇ
1285186695,트리오드,,,"기똥찬 티라미수 푸는 기술을 가진 친철한 직원분과,,너무 맛있는 디저트랑 음료가 완벽한 조화를 이루는 카페였습니다..🌝🫶🏻 티라미수 과들이 원래 부드럽지만 여긴 정말 부드르르르해요"
1285186695,트리오드,,,"다양한 티라미수를 내가 원하는 양으로 먹을 수 있는 곳!! 몇 년 전에 방송에 나와서 와봤던 곳인데 오랜만에 다시 방문했어요. 몇 년이 지나도 여전히 대기가 있는 핫 한 카페 ㅎㅎ 티라미수, 고구마, 블루베리 주문햇는데 셋 다 넘 맛나요^_^ 100g부터 주문이되서 120그람씩 했는데 양이 딱 좋아요. 요새 케익 값 무서운데 이 곳은 여전히 가격이 좋아요!!"
1285186695,트리오드,,,둘 다 맛있는데 블루베리는 데코가 특히 예쁘고 초코는 진한 초콜렛무스 맛에 위에 초콜렛까지 갈려올라가 맛있어요
1285186695,트리오드,,,디저트도 맛있고 커피도 풍미가 깊어요 ㅎㅎ 다시 올 카페에요
1285186695,트리오드,,,레몬치즈케이크 상큼하고 맛있어요 단맛이 강하지 않아서 많이 먹을수있어요ㅋㅋ
1285186695,트리오드,,,몇년 전에 오고 정말 오랜만에 왔는데 더 맛있어진 것 같아요!!! 강남오면 자주와야겠어요 특히 초코케익…짱입니다🥰 크레마가 너무 예쁜 아메리카노와 함께 먹으니 천국이에요!!
1285186695,트리오드,,,"분위기:⭐️⭐️⭐️⭐️(고즈넉한 분위기를 선호한다면 약간 아쉽, 그치만 전반적으로 차분한 분위기라 좋음)"
1285186695,트리오드,,,분위기가 너무 좋고 사진이 잘나와서 조만간 또 올려고요 💟. .♥
1285186695,트리오드,,,블루베리 케이크도 인위적인 맛 없이 산뜻하니 맛있었어요
1285186695,트리오드,,,블루베리 케이크도 인위적인 맛 없이 산뜻하니 맛있었어요
1285186695,트리오드,,,스쿱으로 퍼서 그램수대로 가격을 매기는 시스템이 독특한데 퍼올렸음에도 생각보다 비주얼이 예쁘고 맛도 괜찮아요
1285186695,트리오드,,,"신기하게도 케이크를 g에 맞춰서 결제를 해주시는데, 눈앞에서 그램을 보여주셔서 정말 좋았어요!"
1285186695,트리오드,,,"신기하게도 케이크를 g에 맞춰서 결제를 해주시는데, 눈앞에서 그램을 보여주셔서 정말 좋았어요!"
1285186695,트리오드,,,여러 번 왔었는데 사람이 많아서 못와서 이번에는 꼭 먹고싶었는데 다행히 먹을수 있었어요!! 케이크랑 음료 다 기다린 보람이 있었어용 고구마랑 티라미수케이크 둘다 예쁘고 맛있습니다😍 다음에 또 올께요!!
1285186695,트리오드,,,완전 대만족! 떠먹는 케이크 처음 먹어보는데 주문방법도 재밌고 케이크도 너무 부드럽고 맛있어요ㅠㅠ
1285186695,트리오드,,,자몽에이드가 생각보다 맛있었고 그리고 무엇보다 의자가 편해서 여행 중 피로가 싹 풀렸답니다 ~~
1285186695,트리오드,,,저번에 한번 방문하고 분위기도 좋고 맛닜어서 친구랑 또 방문했어요!
1285186695,트리오드,,,전부터 와보고 싶었던 트리오드!! 올때마다 항상 웨이팅이 많아가지구 지쳐서 돌아가다가 오늘 드뎌 와보고 아 웨이팅 기다려서 들어올만하구나 했어요 떠먹는케이크도 이때까지 먹었던 케이크랑은 전혀다르고 커피도 넘 맛있었어요
1285186695,트리오드,,,전부터 와보고 싶었던 트리오드!! 올때마다 항상 웨이팅이 많아가지구 지쳐서 돌아가다가 오늘 드뎌 와보고 아 웨이팅 기다려서 들어올만하구나 했어요 떠먹는케이크도 이때까지 먹었던 케이크랑은 전혀다르고 커피도 넘 맛있었어요
1285186695,트리오드,,,점심에 방문예약 없이 이용대기 시간 바로 입장데이트연인・배우자
1285186695,트리오드,,,점심에 방문예약 없이 이용대기 시간 바로 입장데이트연인・배우자
1285186695,트리오드,,,점심에 방문예약 없이 이용대기 시간 바로 입장데이트연인・배우자
1285186695,트리오드,,,점심에 방문예약 없이 이용대기 시간 바로 입장친목친구
1285186695,트리오드,,,제 반려동물(언니)와 함께 왔는데 너무 느좋이네요~~~~😍😍😍♨️♨️케이크를 그램으로 측정해서 먹는다니 아이스크림같고 신기해요!! 추천드립니당 ㅎㅎ
1285186695,트리오드,,,주문하면 바로 무게를 재서 주는 케이크라서 굉장히 신기했어요. 둘다 기대안하고 먹은 건데 고구마랑 티라미수 둘다 굉장히 부드럽고 맛있었네요! 특히 티라미수는 다음에 또 먹고 싶을 정도로 살살 녹더라구요 ㅎㅎ
1285186695,트리오드,,,"커피도 원두향이 고소해서 좋았고, 케이크는 보통 초코를 더 좋아하는데 블루베리가 생과일 토핑이 올라가서 더 맛있었어요. 초코맛도 물론 촉촉하니 넘 맛있었습니다. 마침 딱 크림이 많거나 시트가 촉촉한 케이크가 땡겼는데 대만족이예요! 다음에 꼭 다른맛도 먹어보러 올 예정입니다😋"
1285186695,트리오드,,,"커피도 원두향이 고소해서 좋았고, 케이크는 보통 초코를 더 좋아하는데 블루베리가 생과일 토핑이 올라가서 더 맛있었어요. 초코맛도 물론 촉촉하니 넘 맛있었습니다. 마침 딱 크림이 많거나 시트가 촉촉한 케이크가 땡겼는데 대만족이예요! 다음에 꼭 다른맛도 먹어보러 올 예정입니다😋"
1285186695,트리오드,,,케이크 너무 맛있어요. 레몬치즈케이크 상큼하면서 부드럽고 토핑 씹히는 재미도 있고~ 초코케이크도 부드럽고 달달하니 당충전되요!!
1285186695,트리오드,,,"케이크 중량에 따라 가격이 달라지는 독특한 시스템의 카페 <트리오드>에 다녀왔어요. <레몬 치즈 케이크>와 <아인슈페너>를 맛봤는데, 재료 아낌없이 들어간 진한 맛에 한입 먹고 감탄 나왔어요. 매장도 넓고 깔끔해서 군더더기 없이 정말 잘 정돈된 공간이라는 느낌! 특히 치즈케이크 러버인 저에게는… 진심 올해 먹은 치즈케이크 중 단연 최고였어요🧀 점심시간이 되면 직장인들로 붐비니까, 여유롭게 감성 충전하고 싶다면 점심 전 시간대에 들르는 걸 추천드려요."
1285186695,트리오드,,,케이크는 블루베리 먹었는데 플레이팅도 예쁘고 먹을 때 마카롱 꼬끄도 같이 뿌려져서 다양하게 맛볼 수 있었어용
1285186695,트리오드,,,케이크는 블루베리 먹었는데 플레이팅도 예쁘고 먹을 때 마카롱 꼬끄도 같이 뿌려져서 다양하게 맛볼 수 있었어용
1285186695,트리오드,,,케이크를 그람으로 주문할 수 있어서 원하는 만큼 먹을 수 있어서 좋았어요!
1285186695,트리오드,,,케이크를 원하는 만큼 쌓아먹을 수 있어서 신기했고 맛도 정말 좋았어요. 특히 티라미수는 연속으로 시켜먹을 정도로 맛있었네요!
1285186695,트리오드,,,"케이크의 그램수를 결정할 수 있다는 점에서 특이했고, 너무 촉촉하고 부드러워서 만족스러웠습니다. 많이 달지 않아서 너무 맛있게 먹었고, 음료도 모두 맛있습니다!"
1285186695,트리오드,,,"케이크의 그램수를 결정할 수 있다는 점에서 특이했고, 너무 촉촉하고 부드러워서 만족스러웠습니다. 많이 달지 않아서 너무 맛있게 먹었고, 음료도 모두 맛있습니다!"
1285186695,트리오드,,,케익을 그람수로 주문할 수 있어서 신기하고 먹을양만큼만 주문해서 맛있게 먹었습니다! 매장도 넓고 깔끔해요~ 맛있게 잘 먹었습니다😋 감사합니다💕
1285186695,트리오드,,,케익을 몇그람 필요한지 물어보면 그에 맞게 스쿱으로 떠서 주시고 데코까지해서 주시는데
1285186695,트리오드,,,"케잌도 그람으로 판매해서 원하는 만큼 먹을 수있는데, 게다가 맛있어요!"
1285186695,트리오드,,,"트리오드에서 블루베리 케이크그람과 초코 케이크그람, 아이스 아메리카노를 주문했어요. 블루베리 케이크는 상큼한 베리와 부드러운 크림이 조화를 이루어 산뜻했고, 위에 올라간 마카롱까지 비주얼이 너무 예뻤어요. 초코 케이크는 진한 다크 초콜릿 풍미가 느껴지면서도 무겁지 않아 커피랑 잘 어울려요. 아메리카노는 산미가 은은하게 있어 케이크 단맛과 균형이 좋았어요."
1285186695,트리오드,,,"트리오드에서 블루베리 케이크그람과 초코 케이크그람, 아이스 아메리카노를 주문했어요. 블루베리 케이크는 상큼한 베리와 부드러운 크림이 조화를 이루어 산뜻했고, 위에 올라간 마카롱까지 비주얼이 너무 예뻤어요. 초코 케이크는 진한 다크 초콜릿 풍미가 느껴지면서도 무겁지 않아 커피랑 잘 어울려요. 아메리카노는 산미가 은은하게 있어 케이크 단맛과 균형이 좋았어요."
1285186695,트리오드,,,평일 저녁 7시경 레몬 블루베리 말고는 전부 솔드아웃이라 인기 있는 매장임을 알 수 있었고
1285186695,트리오드,,,평일 저녁 7시경 레몬 블루베리 말고는 전부 솔드아웃이라 인기 있는 매장임을 알 수 있었고
1285186695,트리오드,,,회사근처라 눈팅만 하다가 친구랑 방문했는데 맛있어요. 여기 케잌맛집임. 커피랑도 잘 어울리고.. 분위기도 좋아요!! 맛집!!❤️❤️
1285186695,트리오드,,,회사근처라 눈팅만 하다가 친구랑 방문했는데 맛있어요. 여기 케잌맛집임. 커피랑도 잘 어울리고.. 분위기도 좋아요!! 맛집!!❤️❤️
1285186695,트리오드,,,"🍋레몬치즈케이크 100g(6,030원) 달달하고 상큼해요! 크럼블 바삭해서 식감이 좋고 케이크 시트는 없고 무스로만 있는 거 같은데 묘하게 시트 있는 느낌이 듭니다ㅎ시트대신 바나나푸딩처럼 부드러운 쿠키 섞여있는 느낌!!! 블루베리랑 고민하다 레몬 먹었는데 레몬 선택하길 잘한 거 같아요👍🏻"
