가게ID,가게명,평점,날짜,리뷰내용
1812494362,남소관 우육도삭면중식당,,,1시이후에 갔더니 ㅇ대기 없이 바로 자리 안내 받아서 앉았어요! 주문하고 10분? 15분?도 안되어서 나왔구요 딤서만 찌는 시간때문에 조금 걸려서 나왔습니다!
1812494362,남소관 우육도삭면중식당,,,1층에서 직접 딤섬을 만드는 모습을 보며 더욱 믿음이 가고 방문할때마다 지인들이 맛있다며 만족하는 맛집입니다
1812494362,남소관 우육도삭면중식당,,,♧ 2층 더워도 2인석에 앉아야해서 더웠어요.에어컨 너무 절약하시는듯..선풍기있는 시원한 쇼파 안쪽자리는 직원분들 휴식장소더라구요..ㅠ저희다음 손님분도 더워서 주문전 이리저리 자리이동ㅜ
1812494362,남소관 우육도삭면중식당,,,가지덮밥도 맛이 좋았는데 소스가 조금 더 있었음 하는 아쉬움이...밥을 남겼어요;;
1812494362,남소관 우육도삭면중식당,,,강남 물가 치고 가성비 좋은 것 같아요!! 음식도 넘 맛있습니다아
1812494362,남소관 우육도삭면중식당,,,강남에서 이국적인 맛을 즐길 수 있는 것 자체로 매리트가 있어요. 다만 소룡포는 육즙이 거의 없어서 별로더라고요. 새우만두는 완전 추천!
1812494362,남소관 우육도삭면중식당,,,"강남역 근처에 있고 2층에서 식사, 가지튀김, 어향육슬덮밥,쇼마이, 우육도삭면, 쇼룽포오 주문."
1812494362,남소관 우육도삭면중식당,,,강남역 모임 하기 좋은곳..! 도삭면이 너무 맛있어서 중독되는 곳이에요! ㅎㅎ 그리고 우육면도 볶음면도 딤섬도 다다 좋았어요!!👍친구들이랑 간만에 맛나게 먹었네요!!❤️
1812494362,남소관 우육도삭면중식당,,,그리고 결제할 때 1층 직원도 굉장히 불친절하네요. 입을 뻥긋도 안하고 중국말로 다른 직원이랑 얘기하더니 인사도 없고 결제 금액 안내도 없고 영수증 필요한지도 안물어보고 주지도 않더라구요.
1812494362,남소관 우육도삭면중식당,,,그중 마라두부랑 소고기 볶음밥이 젤 마음에 들었어요 둘이 잘어울리기도 하고
1812494362,남소관 우육도삭면중식당,,,느낌 처음먹는 음식이라 코멘트를 못하겠음
1812494362,남소관 우육도삭면중식당,,,"다음에 와도 또 이거 시킬 것 같아요~ 면이 쫄깃하면서도 부드럽고, 다진고기와 고추로 양념된 비빔면이라 너무 맛있었습니다! 너무 자극적이지 않아서 좋았어요❤️"
1812494362,남소관 우육도삭면중식당,,,다음엔 마라향 나는 비빔도삭면이나 가지볶음 같은 사이드도 곁들여보고 싶네요.
1812494362,남소관 우육도삭면중식당,,,"대만현지인들이 운영하는 중식당입니다.직원분들이 우리말로 응대해주십니다.테이블 키오스크로 주문하고 음식은 나오는 순서대로 세팅되어집니다.강남에서 맥주 소주 5,000원에 즐길 수 있어요~육즙가득 딤섬~ 입구에서 만드는 퍼포먼스를 볼 수 있어요 외국인 손님들도 많은 명소입니다~:)"
1812494362,남소관 우육도삭면중식당,,,"덮밥 이름이 기억이 안 나는데 이거 진짜 맛있어요🫶🏻 여기 우육도삭면은 국물이 다른 식당과 달라서 특이하고 맛있습니다. 쇼롱포오도 육즙 가득하고, 바로 옆에서 딤섬 만들고 계셔서 구경하는 재미도 있었네요 ㅎㅎ"
1812494362,남소관 우육도삭면중식당,,,도삭면 맛집 남소관에 방문했어요! 대표메뉴인 우육도삭면은 맑고 진한 소고기육수가 굉장히 시원했고요! 일행이 주문한 유발도삭면도 맛있어보였어요! 사이드로 주문했던 쇼룽포오는 국물 때문에 입천장 데이기 쉬운 메뉴인데 과하게 뜨겁지 않아 한입에 먹을 수 있을 정도여서 넘 좋았네요! 당연히 맛도 있었습니다👍🏻 또 방문할게요!
1812494362,남소관 우육도삭면중식당,,,"마라두부도 매콤한데 맵찔이들이 먹기 좋아요. 생각 외로 얼얼한 느낌이 강한데, 아프게 얼얼한 느낌이 아니라 슈팅스타의 혀 톡톡튀는 느낌같아요. 첫 맛은 마파두부같은 맛 나면서도 뒷 맛은 이 집만의 마라향이 입에 강하게 감돌아요. 맛은 무난하 맛나고, 이국적인 음식 느낌이 확실히 강해요."
1812494362,남소관 우육도삭면중식당,,,소룡포가 맛있는 집.분위기가 좋은 집.도삭면이 맵지 않은 김치칼국수맛이 나는 개운한 맛이라 종종 생각납니다.여긴 민생소비쿠폰 사용이 안되더라구요.
1812494362,남소관 우육도삭면중식당,,,"어향육슬 맵찔이분들도 몇 입 찬스쓰면 먹을 만한 맵기고, 사진대로 직관적인 맛납니다. 간이 적절해서 괜찮아요."
1812494362,남소관 우육도삭면중식당,,,오늘 처음으로 도삭면을 먹으러 이곳에 왔습니다. 처음 먹어본 음식들이 많았는데 깔끔하고 가지볶음밥도 맛있었고 도삭면도 되게 맛있었습니다. 만두도 맛있었고 오늘 우육도상면 사천시 도삭면 수성 달만두 어망가지 덮밥 소고기볶음밥 경장 육수 많이 시켰네 오늘 좋은 지인분들하고 맛있게 잘 먹었습니다. 감사합니다. 다음에 다시 한번 오고 싶습니다.
1812494362,남소관 우육도삭면중식당,,,우연히 방문했는데 너무 맛있어서 리뷰남겨요. 볶음면이 마라맛이 강하고 면이 쫄깃해서 너어무 맛있어요! 그리고 딤섬도 고기잡내 안나고 진짜 맛있구요. 전체적으로 다 간이 되어있는 편이라 조금 짜다고 느낄수도 있을거같은데 주류랑 같이 먹거나 공깃밥이랑 같이 먹어도 너무 맛있을거같아요. 저는 배가 불러서 밥은 못먹었지만 또 올거같아요!
1812494362,남소관 우육도삭면중식당,,,우욱면 맛있어요! 반찬도 피클은 새콤하고 땅콩은 짭잘해서 잘 어울렸어요 ㅎㅎ
1812494362,남소관 우육도삭면중식당,,,우육도삭면 면은 맛있었고 국물은 김치칼국수 같은 특이한 맛이었습니다
1812494362,남소관 우육도삭면중식당,,,"우육도삭면 식당은 맛뿐만 아니라 서비스에서도 높은 만족을 주었습니다. 직원들이 항상 손님을 먼저 챙기며 세심하게 응대해 주셔서 편안하게 식사할 수 있었습니다. 주문 후 음식이 나오는 속도도 빨라서 기다림이 지루하지 않았고, 필요한 요청에도 즉시 반응해 주어 배려심이 느껴졌습니다. 깔끔한 홀 관리와 정돈된 분위기 속에서 친절한 서비스가 더해져 더욱 기분 좋은 시간을 보낼 수 있었습니다. 다음에도 안심하고 찾고 싶은 집이었습니다."
1812494362,남소관 우육도삭면중식당,,,"우육도삭면은 국물이 진하고 담백해서 부담 없이 먹기 좋았습니다. 기름져 보이지만 실제로는 깔끔한 맛이었고, 고기가 핵부드러워요. 면발은 도삭면 특유의 쫀득함이 살아있어 식감이 좋았습니다. 일반 면과는 확실히 다른 매력이 느껴짐! 9,800원 정도면 강남역 기준으로는 무난한 어쩌면 가성비 있는 편입니다. 양도 적지 않아 한 끼로 충분~! 테이블마다 태블릿으로 주문하는 시스템이라 편리했고, 음식은 중구난방으로 나와요 다음엔 다른 메뉴도 시도해볼 생각이에용. 전체적으로 과한 기대 없이 가면 만족할 만한 대만식 면요리집입니다. 아주 특별하진 않지만 한번쯤 가기엔 아주 괜찮다고 생각합니다"
1812494362,남소관 우육도삭면중식당,,,유명한 중식 맛집인 남소관에 다녀왔는데 서비스가 정말 좋았습니다. 주문부터 음식이 나오기까지 직원분들이 친절하게 안내해주시고 필요한 것도 바로 챙겨주셔서 편안하게 식사할 수 있었어요. 따뜻한 국물 맛도 훌륭했지만 세심한 서비스 덕분에 더욱 만족스러운 시간이었습니다. 👍
1812494362,남소관 우육도삭면중식당,,,"유발면은 짭짤하니 맛있었고, 딤섬은 쇼롱포오가 먼저 나오고 쇼마이가가 뒤에 나왔는데, 쇼마이 자체에서 나는 건지 나무 찜기에서 나는 건지, 올라오는 김에서 살짝 과장하면 ‘행주 빠는’ 냄새가 나 불쾌했지만, 맛은 괜찮아 다 먹었고 찜기를 치우니 조금 나아졌습니다."
1812494362,남소관 우육도삭면중식당,,,"저녁에 방문예약 없이 이용대기 시간 바로 입장나들이, 여행, 일상, 기념일, 회식친구, 지인・동료"
1812494362,남소관 우육도삭면중식당,,,저녁에 방문예약 없이 이용대기 시간 바로 입장데이트연인・배우자
1812494362,남소관 우육도삭면중식당,,,"저녁에 방문예약 없이 이용대기 시간 바로 입장일상, 기념일지인・동료"
1812494362,남소관 우육도삭면중식당,,,"저녁에 방문예약 없이 이용대기 시간 바로 입장일상, 여행지인・동료"
1812494362,남소관 우육도삭면중식당,,,저녁에 방문예약 없이 이용대기 시간 바로 입장일상혼자
1812494362,남소관 우육도삭면중식당,,,저녁에 방문예약 없이 이용대기 시간 바로 입장일상혼자
1812494362,남소관 우육도삭면중식당,,,저녁에 방문예약 없이 이용대기 시간 바로 입장친목친구
1812494362,남소관 우육도삭면중식당,,,저번엔 그냥 우육면을 먹고 이번엔 사천우육면을 먹었어요! 카레향같은게 살짝 나는 뜨끈짭짤한 맛..😚 짠 거 안 좋아하지만 여긴 그게 본토맛이다! 이런 느낌이라 국물까지 원샷 가능 맛남 다른 곳보다 저렴한데 재료 신선하고 양도 딱 맞아요 가게도 이쁘고 직원분들도 친절해요! 또 올 수 있는 기회가 있으면 좋겠네요
1812494362,남소관 우육도삭면중식당,,,전체적인 음식은 짠맛이 강했어요. 본인이 원래부터 짠걸 좋아하시는 분들에겐 맛있을수 있다 하실거 같긴한데 제 입맛에서는 많이 짰어요. 같이 간 여친도 엄청 짜다고 하더라고요. 웨이팅도 있는거 같은데 글쎄요.. 다시 가보고 싶은 집은 아녔습니다. 제 개인적인 주관 이니 참고 하시고 더 맛있는 곳은 엄청 많은거 같습니다☺️
1812494362,남소관 우육도삭면중식당,,,점심에 방문예약 없이 이용대기 시간 바로 입장나들이혼자
1812494362,남소관 우육도삭면중식당,,,"점심에 방문예약 없이 이용대기 시간 바로 입장데이트, 친목, 나들이, 여행, 일상연인・배우자, 친구, 지인・동료, 부모님, 혼자"
1812494362,남소관 우육도삭면중식당,,,점심에 방문예약 없이 이용대기 시간 바로 입장일상지인・동료
1812494362,남소관 우육도삭면중식당,,,점심에 방문예약 없이 이용대기 시간 바로 입장일상혼자
1812494362,남소관 우육도삭면중식당,,,"주말 점심 5분정도 대기하고 들어갔어요! 음식은 빨리 나오는 편이고, 우육면은 향이 강하지 않고 왠지 익숙한 맛! 딤섬도 여러종류 시켜서 먹었는데 내용물 알차고 특육즙도 가득해요~~ 가지딤섬도 생긴것보다 훨씬 맛있어요🍆 제일 만족했던 딤섬"
1812494362,남소관 우육도삭면중식당,,,"주문할 때도 메뉴에 대해 친절히 설명해주셨는데, 처음 방문한 저희가 어떤 걸 먹어야 할지 고민하는 걸 보고 추천 메뉴까지 알려주셔서 선택 하기 훨씬 편했습니다. 음식이 나오는 시간도 빠르고, 무엇보다 서빙 하면서 하나하나 설명해주셔서 처음 먹는 사람도 편하게 즐길 수 있었 습니다."
1812494362,남소관 우육도삭면중식당,,,지금까지 먹은 음식 모두 실패가 없어서 어떤걸 먹어도 맛있을거라 생각하지만 우육도삭면과 쇼마이는 꼭 추천해드리고 싶어요♡
1812494362,남소관 우육도삭면중식당,,,지난 번 강남 갔다 맛있게 먹고 또 방문한 맛집! 가지튀김덮밥이 진짜 맛있는 곳이에요! 딤섬도 왜 이리 맛있는 거에요~진짜 맛있게 먹고 왔네요! 또 방문하고 싶은 곳~
1812494362,남소관 우육도삭면중식당,,,직접 1층에서 만두 빚는 모습을 볼 수 있어서 더더 매력적인 공간이었어요
1812494362,남소관 우육도삭면중식당,,,짜사이를 재주문하려고 테이블 옆 기계로 호출을 2번 하였으나 직원분이 오지 않아 지나가시는 직원분께 말씀 드렸습니다.
1812494362,남소관 우육도삭면중식당,,,"최근에 딤섬 먹고 싶었는데 넘넘 맛있는 집을 발견…! 우육면도 오랜만에 먹어보고, 소롱포까지 알차게 먹었어요 ㅎㅎ 소롱포에 육즙도 많고 많이 뜨겁지도 않아서 좋더라구요~"
1812494362,남소관 우육도삭면중식당,,,친구들이랑 같이 갔는데 음식도 맛있고 직원분들도 친절하셔서 좋았어요!
1812494362,남소관 우육도삭면중식당,,,허니차슈는 차슈가 햄(?)맛이 나서 별루였고 가지덮밥은 제가 좋아하는 겉바속촉 느낌도 아니고 튀김옷도 약간 두껍게 느껴지는 감이있어서 아쉬웠어요~
1254124036,도야짬뽕 역삼직영점,,,2인 기준 볶음밥+깐풍새우 조합이 아주 좋았어요.
1254124036,도야짬뽕 역삼직영점,,,"✔️무엇보다도 위생이 넘 좋아서 안심하고 먹을 수 있음!! 사실 중식은 위생때문에 먹고 싶어도 잘 못먹는데,, 안심하고 먹을 수 있는곳 찾아서 기쁩니다👍🥰"
1254124036,도야짬뽕 역삼직영점,,,겸사겸사 간곳인데 저녁에 간단한 맥주 한잔하기 너무 괜찮았어요! 그리고 여기는 커피도 무료로 주는데 점심에 왜 사람이 많은지 알거 같네욤 ㅋㅋㅋ
1254124036,도야짬뽕 역삼직영점,,,깔끔한 채수 배이스의 담백하지만 너무 묽지 않은 도야짬뽕은 양이 진짜 푸짐! 밥은 셀프라 푸짐하게 먹기 딱 좋은 역삼역 중식 밥집! 갓 튀거 나온 깐풍기는 달달한 소스랑 잘 어울리고 쫀득한 튀김옷이 인상적이에요!
1254124036,도야짬뽕 역삼직영점,,,"리뷰 895사진 1,321팔로워 33"
1254124036,도야짬뽕 역삼직영점,,,"리뷰 895사진 1,321팔로워 33"
1254124036,도야짬뽕 역삼직영점,,,매장도 넓고 저녁 늦은시간에도 손님이 많더라구요!!
1254124036,도야짬뽕 역삼직영점,,,"매장이 엄청 넓고 쾌적해요. 테이블도 메뉴도 단체회식하기 매우 좋습니다. 칠리새우와 칭따오 먹었는데, 칭따오 오늘 처음 먹어봤는데 완전 깔끔하고 부드럽네요ㅎㅎ 새우가 먹고싶어서 크림새우, 깐풍새우, 칠리새우 중 고민하다 골랐어요~ 새콤달콤 중에 달콤에 더 가까워요^^ 양상추랑 아몬드 곁들여있어 좋네요~ 물론 식사도 좋지만 회식이나 술모임 장소찾을땐 여기 먹고 대화하고 모이기 좋네요~ 역삼역에서 가까워요"
1254124036,도야짬뽕 역삼직영점,,,"볶음짬뽕은 좀 뿔었지만 양이많고 간이 쎄지않아 맛 좋게 먹엇고, 탕수육 튀김은 맛있는데 후추향이 쎄서 좀 짰어요. 짬뽕이 유명하다는데 다음에가게 되면 짬뽕을 즐겨보기로"
1254124036,도야짬뽕 역삼직영점,,,사장님 넘나 친절하시구 짬뽕맛은 말해모해 탕수육도 쫀맛입니당👍🏻👍🏻
1254124036,도야짬뽕 역삼직영점,,,생각보다 고기도 두껍고 국물도 얼큰하고 지금 이 날씨에 너뮤 잘어울려서 맛있게먹었습니다! 다만 배달이 너무 많아서 음식이 조금 늦게나온건 아쉽네요
1254124036,도야짬뽕 역삼직영점,,,수제비짬뽕의 특별한 매력을 알아주셔서 감사해요. 탕수육의 부드러운 고기도 마음에 드셨다니 정말 기쁘고요! 저희는 항상 고객님들께 최고의 경험을 제공하기 위해 청결과 정성을 다하고 있습니다.
1254124036,도야짬뽕 역삼직영점,,,언제든 편안한 마음으로 방문해주시면 최선을 다해 준비하겠습니다.
1254124036,도야짬뽕 역삼직영점,,,역삼역에서 술마시기 너무나도 좋은 #역삼역술집 도야짬뽕 역삼점의 요리와 술맛은 정말 기가 막힙니다~! 고기에 소주한잔이 질린다면 풍미 가득한 중식요리와 칭따오 生맥주 한잔에 소주 한잔 마시면 하루의 고단함이 싹 날라가네요~~!! 강력 추천하는 역삼역술집 도야짬뽕 완전 강추합니다!!!^^😍🌸🥩🩷😋❤️🙏🏻🌼😎💯🔥💖♨️😘👏🏻🥰👍🏻
1254124036,도야짬뽕 역삼직영점,,,오랜만에 회사막내랑 같이 신나눈 수다 타임하면서 보냈어용ㅎㅎ잘먹고갑니다~
1254124036,도야짬뽕 역삼직영점,,,저녁에 방문예약 없이 이용대기 시간 바로 입장가족모임부모님
1254124036,도야짬뽕 역삼직영점,,,저녁에 방문예약 없이 이용대기 시간 바로 입장나들이부모님
1254124036,도야짬뽕 역삼직영점,,,저녁에 방문예약 없이 이용대기 시간 바로 입장데이트연인・배우자
1254124036,도야짬뽕 역삼직영점,,,저녁에 방문포장·배달 이용대기 시간 30분 이내일상아이
1254124036,도야짬뽕 역삼직영점,,,저녁에 방문해서 시원한 맥주에 누룽지탕 먹고 왔습니다! 직원 분이 너무 친절하고 밥도 무료로 리필 가능한 곳이에요ㅎㅎ 후식으로 매실. 아이스티. 아이스컵 커피도 있어서 너무 좋습니다!
1254124036,도야짬뽕 역삼직영점,,,저희 가게는 항상 깔끔한 매장 유지와 철저한 준비로 고객님께 좋은 경험을 드리려 노력합니다.
1254124036,도야짬뽕 역삼직영점,,,저희는 2인세트 시켰는데 탕수육까지 가성비있게 즐길 수 있어 괜찮더라구요.자리도 넓고 해서 그런지 단체로 오시는분들도 많더라구요. 또 올께요.
1254124036,도야짬뽕 역삼직영점,,,점심에 방문예약 없이 이용대기 시간 10분 이내 일상지인・동료
1254124036,도야짬뽕 역삼직영점,,,점심에 방문예약 없이 이용대기 시간 10분 이내 일상지인・동료
1254124036,도야짬뽕 역삼직영점,,,점심에 방문예약 없이 이용대기 시간 10분 이내 일상지인・동료
1254124036,도야짬뽕 역삼직영점,,,점심에 방문예약 없이 이용대기 시간 30분 이내지인・동료
1254124036,도야짬뽕 역삼직영점,,,점심에 방문예약 없이 이용대기 시간 바로 입장나들이혼자
1254124036,도야짬뽕 역삼직영점,,,점심에 방문예약 없이 이용대기 시간 바로 입장여행연인・배우자
1254124036,도야짬뽕 역삼직영점,,,점심에 방문예약 없이 이용대기 시간 바로 입장일상아이
1254124036,도야짬뽕 역삼직영점,,,점심에 방문예약 없이 이용대기 시간 바로 입장일상지인・동료
1254124036,도야짬뽕 역삼직영점,,,점심에 방문예약 없이 이용대기 시간 바로 입장일상지인・동료
1254124036,도야짬뽕 역삼직영점,,,점심에 방문예약 없이 이용대기 시간 바로 입장일상지인・동료
1254124036,도야짬뽕 역삼직영점,,,점심에 방문예약 없이 이용대기 시간 바로 입장일상지인・동료
1254124036,도야짬뽕 역삼직영점,,,점심에 방문예약 없이 이용대기 시간 바로 입장일상지인・동료
1254124036,도야짬뽕 역삼직영점,,,점심에 방문예약 없이 이용대기 시간 바로 입장일상지인・동료
1254124036,도야짬뽕 역삼직영점,,,점심에 방문예약 없이 이용대기 시간 바로 입장일상친구
1254124036,도야짬뽕 역삼직영점,,,점심에 방문예약 없이 이용대기 시간 바로 입장친목지인・동료
1254124036,도야짬뽕 역삼직영점,,,좋아요 공간이 넓어서 좋네요 메뉴도 다양해서 괜찮아요
1254124036,도야짬뽕 역삼직영점,,,지인의 맛집으로 함께 방문하게 된 #역삼맛집 도야짬뽕 역삼직영점은 강남에서 짜장면이 가장 맛있는집인거 같아요!^^ 특히 역삼역 주변에서 이런 짜장면은 여기가 유일무이 합니다! 짬뽕집인데 짜장이 더 맛있는 집 도야짬뽕 역삼직영점 매우 강력 추천합니다!^^👏🏻❤️🌼🥩😉💖😍♨️💯🙂🌸😘😎🥰🙏🏻😋🍎🔥👍🏻🩷
1254124036,도야짬뽕 역삼직영점,,,칠리새우에 맥주한잔 하니 하루 피로가 싹 사라지네요 맥주 이벤트해서 저렴하게 잘먹었고
1254124036,도야짬뽕 역삼직영점,,,칭따오 맥주 너무너무너무 맛있어요 원래 병맥 좋아하는데 생맥은 진짜 넘 맛잇어요 짱짱
1254124036,도야짬뽕 역삼직영점,,,칭따오 병맥말고 생맥이 있어요 맛있어요 여름엔 역시 맥주? 요리도 가성비 좋아요 맛있고 가성비 가격! 고기 베이스(?) 짬뽕도 맛있고 공기밥을 공짜로 줘서 좋아요
1254124036,도야짬뽕 역삼직영점,,,칭따오 생맥 파는곳 처음봐요! 짬뽕도 넘 맛나고 깐풍 새우도 ㅋㅋㅋㅋ정말 맛있습니다 밥도 무한 먹을 수 있는데 커피도 무료로 주고..여기 넘 가성비 좋네요!!! 넘 맛있게 잘 먹고 나왔어요 ㅋㅋ가성비 짱!
1254124036,도야짬뽕 역삼직영점,,,평상시 점심으로도 방문했던 곳인데 저녁에 한잔하기에도 너무 좋은 곳이예요
1254124036,도야짬뽕 역삼직영점,,,항상 깨끗한 환경과 꼼꼼한 준비로 고객님께 좋은 경험 드릴 수 있도록 최선을 다하겠습니다.
1254124036,도야짬뽕 역삼직영점,,,항상 청결과 준비에 신경 써서 고객님께 최상의 환경을 제공하려 노력하고 있답니다.
1604806023,따롱이훠궈 강남점,,,"“현지의 그 맛”이라 표현해 주시고 홍탕과 토마토탕 모두 맛있게 즐겨주셔서 정말 기쁩니다 🥰 매장뿐 아니라 화장실까지 깔끔하게 관리되는 부분도 좋게 봐주셔서 감사드리며, 앞으로도 강남 맛집으로서 언제 오셔도 만족스러운 훠궈 경험을 드릴 수 있도록 최선을 다하겠습니다 🍲 자주 찾아주세요!"
1604806023,따롱이훠궈 강남점,,,"“현지의 그 맛”이라 표현해 주시고 홍탕과 토마토탕 모두 맛있게 즐겨주셔서 정말 기쁩니다 🥰 매장뿐 아니라 화장실까지 깔끔하게 관리되는 부분도 좋게 봐주셔서 감사드리며, 앞으로도 강남 맛집으로서 언제 오셔도 만족스러운 훠궈 경험을 드릴 수 있도록 최선을 다하겠습니다 🍲 자주 찾아주세요!"
1604806023,따롱이훠궈 강남점,,,"간만에 고등학교 때 친구 모임 장소를 또 이곳으로 ㅎㅎ 이번엔 홍탕 제일 순한맛, 버섯탕 그리고 사골탕으로... 중국 출장 오래다녀서 훠궈 익숙한 친구 녀석 포함해서 친구들도 만족하고 오늘도 이것저것 시켜서 배뻥 ㅎ 역시나 강남역에서 최고의 훠궈집을 꼽으라면 여기다 ㅋ 여름 가기 전에 한번 더 와야지 ㅎㅎ"
1604806023,따롱이훠궈 강남점,,,"간만에 고등학교 때 친구 모임 장소를 또 이곳으로 ㅎㅎ 이번엔 홍탕 제일 순한맛, 버섯탕 그리고 사골탕으로... 중국 출장 오래다녀서 훠궈 익숙한 친구 녀석 포함해서 친구들도 만족하고 오늘도 이것저것 시켜서 배뻥 ㅎ 역시나 강남역에서 최고의 훠궈집을 꼽으라면 여기다 ㅋ 여름 가기 전에 한번 더 와야지 ㅎㅎ"
1604806023,따롱이훠궈 강남점,,,강남역 또롱이훠궈 4인 모임으로 방문했습니다! 자리 간격 넉넉해 대화하기 편했어요^^ 국물은 칼칼하면서도 깔끔해 부담 없이 즐기기 좋았네요🔥 재료 퀄리티 좋아서 다음 모임도 여기로 예약하고 싶습니다~ㅎㅎ
1604806023,따롱이훠궈 강남점,,,강남역 또롱이훠궈 4인 모임으로 방문했습니다! 자리 간격 넉넉해 대화하기 편했어요^^ 국물은 칼칼하면서도 깔끔해 부담 없이 즐기기 좋았네요🔥 재료 퀄리티 좋아서 다음 모임도 여기로 예약하고 싶습니다~ㅎㅎ
1604806023,따롱이훠궈 강남점,,,"강남점 직원들의 친절함과 넓고 쾌적한 매장 분위기까지 만족해 주셔서 기쁘고, 똠얌꿍탕을 맛있게 즐겨주셔서 더욱 뿌듯합니다 🥣✨"
1604806023,따롱이훠궈 강남점,,,"강남점 직원들의 친절함과 넓고 쾌적한 매장 분위기까지 만족해 주셔서 기쁘고, 똠얌꿍탕을 맛있게 즐겨주셔서 더욱 뿌듯합니다 🥣✨"
1604806023,따롱이훠궈 강남점,,,"강남점의 넓은 매장과 멋진 인테리어, 그리고 훠궈 맛까지 만족해주셔서 정말 기쁩니다! 또 찾아주신다고 해주셔서 큰 힘이 됩니다."
1604806023,따롱이훠궈 강남점,,,"강남점의 넓은 매장과 멋진 인테리어, 그리고 훠궈 맛까지 만족해주셔서 정말 기쁩니다! 또 찾아주신다고 해주셔서 큰 힘이 됩니다."
