가게ID,가게명,평점,날짜,리뷰내용
1109024709,반티엔야오 카오위 강남점,,,다른지점에서 먹고 맛있어서 왔는데 별로네요 직원들도 불친절하고 생선도 약간 비린내나서 먹다 멈칫했네요 다른곳으로 가는거 추천드려요
1109024709,반티엔야오 카오위 강남점,,,둘이서 생선 1마리에 이것저것 추가해서 배터지게 먹고 왔네요 ㅎㅎㅎ
1109024709,반티엔야오 카오위 강남점,,,"마라 + 닝보어로 먹어보았는데, 마라향이 되게 강하더라구요! 마라를 좋아하는 분들에게는 극호, 그렇지 않다면 불호일 수 있는 메뉴같아요. 덜 맵게 해달라고 했는데도 얼얼한 맛이 있었어요!"
1109024709,반티엔야오 카오위 강남점,,,마라맛 강하고 맛있었어요! 근데 너어어어무 짰어요ㅠㅠ 양꼬치도 메뉴판에 있는 그 비주얼 아니고 육수를 아무리 추가해도 생선도 너어어무 짰어용…
1109024709,반티엔야오 카오위 강남점,,,마라카오위. 신라면보다 조금 더 맵다고해서 한단계 낮춰달라고 부탁...결론은 너무 맛있었어요
1109024709,반티엔야오 카오위 강남점,,,맛이 특이하고 여러가지 내 입맛에 맞는 사리를 넣어 먹을수 있어서 좋았습니다.
1109024709,반티엔야오 카오위 강남점,,,"몇 번 왔었는데, 정말 맛있습니다~ 다양하게 넣어먹는 재미도 있어요~ㅎㅎ 다음에는 마라로 도전..!"
1109024709,반티엔야오 카오위 강남점,,,민물고기에 흙냄새는 조금 나지만 마라가 쎄서 덜 나는거 같고 매운거 좋아하는데 고추가 많아서 넘 좋았습니다😇
1109024709,반티엔야오 카오위 강남점,,,부모님 좋아해서 몇개월에 한번씩 방문하는데 …여전히 가시가 적고 향신료 강하지 않고 맛있어요. 양이 많아서 이것저것 먹으려면 3명 정도 와서 토핑 추가 하면 좋을같아요. 최고 !!!
1109024709,반티엔야오 카오위 강남점,,,비린맛 전혀 없고 원하는 여러 재료넣고 먹으니 풍족한 맛과 양으로 잔뜩 즐기고 올 수 있었습니다^^
1109024709,반티엔야오 카오위 강남점,,,"상하이에서 찐찐찐 맛있게 먹었는데 한국에도 카오위 생겨서 행.벅👹 일요일 오후 4시에 가니까 빈 자리 많았는데 5시부터 사람들 몰려와서 꽉 찼어요. 상하이에서는 튀긴 생선이었는데 여긴 그냥 찜이에요. 그래도 맛있어요!!! 제대로 마라맛이라 밥도둑!!! 천원에 공기밥, 탄산음료 무제한이라 마음도 넉넉해져요."
1109024709,반티엔야오 카오위 강남점,,,"생선 살은 아주 부드럽고 담백해서 매운 국물과 정말 잘 어울렸고, 함께 추가한 두부, 버섯, 각종 채소가 국물을 한층 더 풍부하게 만들어줬어요. 마라의 얼얼함을 좋아하는 분들이라면 만족하실 것 같고, 밥이나 면과 곁들이면 국물까지 완벽하게 즐길 수 있습니다."
1109024709,반티엔야오 카오위 강남점,,,생선이 처음 먹어보는 생선인데 아주 부드러웠어요. 하지만 그 중국스러운 강렬한 마라맛과 향이 제 취향은 아니네요. 또 갈 것 같진 않아요.
1109024709,반티엔야오 카오위 강남점,,,양꼬치는 진심 맛없으니 시키지 마세요 레전드 양냄새였어요 ㅋㅋㅋㅋㅋㅋㅋ
1109024709,반티엔야오 카오위 강남점,,,와 너어어무 맛있어요!!! 진짜 기대 안했는데 생선이 너무맛있고 생선자체가 넘 부드럽고 행복해요 금요일저넉 무조건
1109024709,반티엔야오 카오위 강남점,,,음식은 맛있어서 자주 가는 편인데 발렛 불친절해서 다시는 안가요.
1109024709,반티엔야오 카오위 강남점,,,"이번엔 청강어 마늘맛을 먹었어요! 하도 지인이 청강어 청강어 해서 먹었는데, 다른 게 더 좋았어요 저는ㅎㅎ 아무튼 맛있게 잘 먹었습니다!"
1109024709,반티엔야오 카오위 강남점,,,저녁에 방문예약 없이 이용대기 시간 바로 입장일상친구
1109024709,반티엔야오 카오위 강남점,,,"저녁에 방문예약 없이 이용대기 시간 바로 입장친목, 여행, 일상친구"
1109024709,반티엔야오 카오위 강남점,,,저녁에 방문예약 없이 이용대기 시간 바로 입장친목친구
1109024709,반티엔야오 카오위 강남점,,,저녁에 방문예약 후 이용대기 시간 30분 이내친목친구
1109024709,반티엔야오 카오위 강남점,,,저녁에 방문예약 후 이용대기 시간 바로 입장데이트지인・동료
1109024709,반티엔야오 카오위 강남점,,,저녁에 방문예약 후 이용대기 시간 바로 입장일상친구
1109024709,반티엔야오 카오위 강남점,,,저녁에 방문예약 후 이용대기 시간 바로 입장일상친구
1109024709,반티엔야오 카오위 강남점,,,저녁에 방문예약 후 이용대기 시간 바로 입장친목지인・동료
1109024709,반티엔야오 카오위 강남점,,,저녁에 방문예약 후 이용대기 시간 바로 입장친목친구
1109024709,반티엔야오 카오위 강남점,,,점심에 방문예약 없이 이용대기 시간 바로 입장일상지인・동료
1109024709,반티엔야오 카오위 강남점,,,점심에 방문예약 후 이용대기 시간 바로 입장데이트연인・배우자
1109024709,반티엔야오 카오위 강남점,,,점심에 방문예약 후 이용대기 시간 바로 입장친목친구
1109024709,반티엔야오 카오위 강남점,,,점심에 방문예약 후 이용대기 시간 바로 입장친목친구
1109024709,반티엔야오 카오위 강남점,,,정말 너무너무 맛있었습니다. 매운 것 보다 얼얼해서 더 맛있게 먹었던 거 같아요. 생선에서 잡내도 안 나고 너무 맛있게 먹었습니다! 다들 너무 친절하셔서 더 좋았습니다.
1109024709,반티엔야오 카오위 강남점,,,조릴수록 생선에 마라가 스며들어서 더 맛있어져요~~
1109024709,반티엔야오 카오위 강남점,,,주말 점심에 방문했는데 1시 정도에는 좌석이 거의 만석이네요. NEW 마늘향으로 주문했는데 크게 맵지 않고 알리오올리오와도 비슷한 느낌이었습니다. 생선은 닝보어와 청강어 중에서 고를 수 있는데 저희는 가시가 적다는 닝보어를 선택했습니다. 민물고기 특유의 향이 아주 가볍게 남아있긴 하지만 살이 많아서 먹기 편하고 양념과도 잘 어울렸습니다. 야채는 기본으로 포함되어 있지 않은 대신 취향에 따라 사리를 추가로 주문하실 수 있고 식사 중에도 추가가 가능합니다. 셀프바를 함께 주문하시면 음료와 밥을 무제한으로 드실 수 있고 주류 가격도 합리적인 편이라 가볍게 반주를 즐기기에도 좋습니다.
1109024709,반티엔야오 카오위 강남점,,,중국 인연들과 모임을 갖을 때 주로 가는 곳 ㅎㅎ 중국에서 먹던 카오위 맛이 그리울 때 딱이에요 ㅎㅎ
1109024709,반티엔야오 카오위 강남점,,,중국에서 맛본 카오위가 너무 맛있어서 방문했는데... 중국에서 먹었던 농어 카오위랑은 조금 달랐어요 (물고기 살이 느끼하고 뼈가 많고 잘 으스러진달까요?) 마라향이 너무 맵게 강해서 맵고 마라향 좋아하시는 분은 진짜 좋아하실거 같아여!!
1109024709,반티엔야오 카오위 강남점,,,진짜 맛있었어요!!! 폭력적인 비쥬얼에 비해 엄청 자극적이지 않고 감칠맛 폭발입니다. 고봉밥 두그릇 뚝딱 할 정도로 밥도둑이에요
1109024709,반티엔야오 카오위 강남점,,,첫방문과처음먹어보는카오위...우와아아아~~~마라를좋아하는편! 생선살도너무나부드럽고!왕크고사리추가하여맛난게먹었습니다아:)
1109024709,반티엔야오 카오위 강남점,,,청강어 선택이 안돼서 아쉬웠는데 처음 먹으러 함께 간 지인이 맛있게 먹어줘서 기뻤어요
1109024709,반티엔야오 카오위 강남점,,,친구들과 중국유학시절을 추억하며 방문했는데 들어가는 순간부터 그리운 기억들이 떠오르고 너무 반가운 느낌이었어요! 직원분들과 사장님 모두 친절하시고 음식도 넘 맛있고 카오위 너무 밥도둑이에요!! 다음에 또 갈게요!!
1109024709,반티엔야오 카오위 강남점,,,카오위 처음 먹어봤는데 생선살 부드럽고 완전 맛있었어요
1109024709,반티엔야오 카오위 강남점,,,"푸주, 건두부 꼭 추가해주세여제발.. 밥도 무한리필이고.. 생선 자체가 커서 3인분 정도되는거같아여 여자3명 갓는데 엄청 배부르게 잘먹엇네여 💓❤️❤️ 조만간 또가려구요 ㅎㅎ"
1109024709,반티엔야오 카오위 강남점,,,한달새 두번이나 방문했어요. 요즘 중국음식에 빠져있는데 완전 현지식이랑 너무 비슷하고 감자를 많이 시켜서 넣어 먹으면 정말 진짜진짜 너무너무너무너무 맛있어요!!! 감자사리를 무려 8개나 시킴 ㅎㅎㅎ◡̈ 정말 강추입니다!!!중국 못가서 아쉬울땐 여기에 와서 카오위를 먹어야겠어요 :)
1109024709,반티엔야오 카오위 강남점,,,항상 둘이와서 많이 남겼었는데 여자 5명에 사리 많이 시키면 딱맞는거 같아요 마라맛 맛있습니다
1109024709,반티엔야오 카오위 강남점,,,회사 동생이 중국어 선생님한테 소개받았다고 해서 방문했는데 진짜 너무너무너무 맛있었어요!!!!!!!상해에서 카오위 정말 너무 맛있게 먹었었는데 한국에도 생기다니!!!정말 너무 좋아요 :) 여기저기 엄청 소문내고 다녔어요 ◡̈ 감자를 많이 시켜서 넣어먹으면 다른 사리 필요없더라구요 정말 강추추!!!
1109024709,반티엔야오 카오위 강남점,,,"훠궈와 비슷하면서도, 생선 위주라 부드럽고 또 다른 맛이에요!"
1991865352,봉게짬뽕,,,24시간 꽃게로 육수를 내어 시원하고 칼칼하게 제공하고있습니다. 짬뽕이 땡기실땐 봉게짬뽕을 찾아주세요. 오늘도 즐거운 하루되세요.
1991865352,봉게짬뽕,,,24시간 꽃게로 육수를 내어 시원하고 칼칼하게 제공하고있습니다. 짬뽕이 땡기실땐 봉게짬뽕을 찾아주세요. 오늘도 즐거운 하루되세요.
1991865352,봉게짬뽕,,,24시간 꽃게로 육수를 내어 시원하고 칼칼하게 제공하고있습니다. 짬뽕이 땡기실땐 봉게짬뽕을 찾아주세요. 오늘도 즐거운 하루되세요.
1991865352,봉게짬뽕,,,24시간 꽃게로 육수를 내어 시원하고 칼칼하게 제공하고있습니다. 짬뽕이 땡기실땐 봉게짬뽕을 찾아주세요. 오늘도 즐거운 하루되세요.
1991865352,봉게짬뽕,,,24시간 꽃게육수로 정성껏 조리합니다. 재료 아끼지 않고 만들고있습니다. 언제든지 편하게 드시고가세요
1991865352,봉게짬뽕,,,24시간 꽃게육수로 정성껏 조리합니다. 재료 아끼지 않고 만들고있습니다. 언제든지 편하게 드시고가세요
1991865352,봉게짬뽕,,,24시간 꽃게육수로 정성껏 조리합니다. 재료 아끼지 않고 만들고있습니다. 언제든지 편하게 드시고가세요
1991865352,봉게짬뽕,,,3년 전부터 꾸준히 다니는 짬뽕집입니다. 우선 맛있어요!!!!
1991865352,봉게짬뽕,,,4시간 꽃게육수로 정성껏 조리합니다. 재료 아끼지 않고 만들고있습니다. 언제든지 편하게 드시고가세요
1991865352,봉게짬뽕,,,4시간 꽃게육수로 정성껏 조리합니다. 재료 아끼지 않고 만들고있습니다. 언제든지 편하게 드시고가세요
1991865352,봉게짬뽕,,,4시간 꽃게육수로 정성껏 조리합니다. 재료 아끼지 않고 만들고있습니다. 언제든지 편하게 드시고가세요
1991865352,봉게짬뽕,,,가게가 전반적으로 넓고 깔끔했으며 짬뽕이 되게 맛있었으며 메뉴 이름처럼 게가 들어가있어서 그런지 더욱 더 맛있었습니다
1991865352,봉게짬뽕,,,가게가 전반적으로 넓고 깔끔했으며 짬뽕이 되게 맛있었으며 메뉴 이름처럼 게가 들어가있어서 그런지 더욱 더 맛있었습니다
1991865352,봉게짬뽕,,,가게가 전반적으로 넓고 깔끔했으며 짬뽕이 되게 맛있었으며 메뉴 이름처럼 게가 들어가있어서 그런지 더욱 더 맛있었습니다
1991865352,봉게짬뽕,,,감사드립니다.ㅎㅎㅎ 언제든 중식이 드시고 싶을때 봉게 잊지말고 오세요.
1991865352,봉게짬뽕,,,바삭바삭 탕수육과 불맛 제대로 들어간 볶음밥은 최애입니다..♡ 벌써 두손가락 다 쓸 정도로 방문한듯 합니다.
1991865352,봉게짬뽕,,,비도 오고 하는데 해장겸 한그릇 하러왔어요 ㅎㅎ 확실히 해산물이라 맛이 칼칼하니 맛있고 파김치가 킥입니다! 드셔보셔요 😄😄😄
1991865352,봉게짬뽕,,,여기진짜맛잇어요!!!!자주오는집인데계속일반봉게짬뽕만먹다가저번에수타조개짬뽕시켜서먹었는데너무맛잇는거에요ㅋㅋㅋ그래서오늘도수타조개짬뽕으로달렸습니다ㅋㅋ역시나너무맛잇더군여ㅋㅋ진짜강추합니당!!넘맛잇어요ㅠㅠㅋㅋ
1991865352,봉게짬뽕,,,오늘 드디어 잡채밥을 시켰다! 잡채에 짜장도 주고 계란후라이라니! 혜자다 혜자야!!!
1991865352,봉게짬뽕,,,오늘 시킨 메뉴들 다 맛있어요!! 탕수육도 바삭하면서 고기가 부드럽고~ 조개짬뽕은 첫 입에 캬아~~ 진한 조개육수가 제대로 느껴지네요~ 볶음밥도 느끼하지 않고 새우가 실하게 들어있어 좋아요~~ 잘먹었습니다
1991865352,봉게짬뽕,,,작년에 몇번 왔었는데 드디어 강남올일있어서 방문했습니다. 너무너무 맛있고 알차네요❤️
1991865352,봉게짬뽕,,,작년에 몇번 왔었는데 드디어 강남올일있어서 방문했습니다. 너무너무 맛있고 알차네요❤️
1991865352,봉게짬뽕,,,작년에 몇번 왔었는데 드디어 강남올일있어서 방문했습니다. 너무너무 맛있고 알차네요❤️
1991865352,봉게짬뽕,,,재료를 아끼지않는 봉게짬봉입니다. 오늘도 방문 감사드립니다.
1991865352,봉게짬뽕,,,재료를 아끼지않는 봉게짬봉입니다. 오늘도 방문 감사드립니다.
1991865352,봉게짬뽕,,,재료를 아끼지않는 봉게짬봉입니다. 오늘도 방문 감사드립니다.
1991865352,봉게짬뽕,,,저녁에 방문예약 없이 이용대기 시간 바로 입장데이트연인・배우자
1991865352,봉게짬뽕,,,저녁에 방문예약 없이 이용대기 시간 바로 입장일상지인・동료
1991865352,봉게짬뽕,,,"저녁에 방문예약 없이 이용대기 시간 바로 입장친목친구, 지인・동료"
1991865352,봉게짬뽕,,,"저녁에 방문예약 없이 이용대기 시간 바로 입장친목친구, 지인・동료"
1991865352,봉게짬뽕,,,"저녁에 방문예약 없이 이용대기 시간 바로 입장친목친구, 지인・동료"
1991865352,봉게짬뽕,,,점심에 방문예약 없이 이용대기 시간 바로 입장일상혼자
1991865352,봉게짬뽕,,,"점심에 방문예약 없이 이용대기 시간 바로 입장친목, 일상지인・동료, 친구"
1991865352,봉게짬뽕,,,"점심에 방문예약 없이 이용대기 시간 바로 입장친목, 일상지인・동료, 친구"
1991865352,봉게짬뽕,,,"점심에 방문예약 없이 이용대기 시간 바로 입장친목, 일상지인・동료, 친구"
1991865352,봉게짬뽕,,,정말 맛있어요. 보통은 짬뽕을 먹지만 잡채밥도 보통이 아닙니다. 먹어보세요. 매콤하면서 짜장소스 같이 부니 여러가지 맛을 먹을 수 있어요. 정말 정말 맛있어요. 강추!!
1991865352,봉게짬뽕,,,정말 맛있어요. 보통은 짬뽕을 먹지만 잡채밥도 보통이 아닙니다. 먹어보세요. 매콤하면서 짜장소스 같이 부니 여러가지 맛을 먹을 수 있어요. 정말 정말 맛있어요. 강추!!
1991865352,봉게짬뽕,,,정말 맛있어요. 보통은 짬뽕을 먹지만 잡채밥도 보통이 아닙니다. 먹어보세요. 매콤하면서 짜장소스 같이 부니 여러가지 맛을 먹을 수 있어요. 정말 정말 맛있어요. 강추!!
1991865352,봉게짬뽕,,,즉시조리 정성 다하는 봉게짬뽕입니다. 맛있게 드셔주셔서 감사드립니다.
1991865352,봉게짬뽕,,,즉시조리 정성 다하는 봉게짬뽕입니다. 맛있게 드셔주셔서 감사드립니다.
1991865352,봉게짬뽕,,,즉시조리 정성 다하는 봉게짬뽕입니다. 맛있게 드셔주셔서 감사드립니다.
1991865352,봉게짬뽕,,,즉시조리 정성 다하는 봉게짬뽕입니다. 맛있게 드셔주셔서 감사드립니다.
1991865352,봉게짬뽕,,,즉시조리 정성 다하는 봉게짬뽕입니다. 맛있게 드셔주셔서 감사드립니다.
1991865352,봉게짬뽕,,,짬뽕 국물 진짜 대박이네요;; 짜장면도 바로 볶아주셔서 너무 맛이 좋았습니다 면도 특이해서 넘 맛있어요 사천탕수육도 야채를 같이 볶아?주셔서 향긋하고 맛있었어요 맵기도 적당했어요
1991865352,봉게짬뽕,,,짬뽕이 먹고 싶을 때 항상 옵니다! 오늘 혼술이 땡겨 급하개 왔는데 역시 맛있네요!
1991865352,봉게짬뽕,,,칼칼하고 뜨끈한 국물이 너무 매력적인 짬뽕입니다ㅎㅎ지난번에 맛보고 못잊어서 다시왔네요ㅎㅎ특히 오늘은 비가 내렸는데 이런 날 먹으니 더 좋네요👍 크림새우랑 사천탕수육도 시켰는데 요런 사이드조차도 너무 맛있어요💕 강남역 부근 올때마다 찾을것같아요💕
1991865352,봉게짬뽕,,,항상 애용하는 곳이에요. 짬뽕맛이 조금 더 부드러워져서 부담없이 먹을 수 있어요 만두도 맛있습니다
1991865352,봉게짬뽕,,,해장으로 너무나도 딱인 짬뽕입니다. 밑반찬으로 파김치나오는데 이게 또 꿀맛입니다❤️💚
1991865352,봉게짬뽕,,,회사 점심 시간에 자주 오는데 진짜 넘 맛있어요! 면이랑 밥이 같이 나오는 구성도 좋고 밥 종류 시키면 나오는 파김치도 맛있어요ㅎㅎ 친절하시고 매장도 깨끗해서 자주 오게 됩니다👩‍🍳 해장 점심무조건 봉게짬뽕 추천이여!
35553533,아방궁,,,24시간 영업해서 언제든지 편하게 식사할 수 있는 강남역 중국집 양 많고 해장하기 좋아요
35553533,아방궁,,,"Delicious jajangmyeon, quick service, and super friendly staff. great spot overall. ☺️"
35553533,아방궁,,,"간짜장 짬뽕 탕수육 모두 기본에 충실한 맛입니다👍 간짜장 양파 매운기 없이 아삭한게 맛있었고, 사천탕수육도 튀김바삭하고 소스에 야채 많이 들어서 맛있게 먹었어요🫶🏻 위치 좋고 24시간 연중무휴라 종종 가게될 것 같아요😆"
35553533,아방궁,,,간짜장은 춘장을 아낌없이 넣으셔서 완전 진해서 밥을 부르는 맛이엿어요!!탕수육 고기가 질이 정말 좋다는게 느껴졌어요 간만에 중국집 맛집 찾았습니다 가족들이나 모임으로 오기에도 좋을 거 같아요!!
35553533,아방궁,,,"강남에 있는 중식당 아방궁 다녀왔습니다. 오랜만에 제대로 된 중식을 맛보고 싶어 방문했는데 만족스러웠어요. 간짜장은 불향이 은은하게 느껴지면서 면발이 쫄깃하고 소스도 짜지 않고 깊은 맛이 나더라고요. 탕수육은 중자 사이즈로 주문했는데 겉은 바삭하고 속은 촉촉해 고기 식감이 살아있었고, 소스가 새콤달콤해 입맛을 살려줬습니다. 차돌짬뽕밥도 건더기가 풍성하게 들어 있어 든든했고, 국물은 얼큰하면서도 부담스럽지 않았습니다. 오래된 중식당이라 그런지 전통적인 맛이 그대로 살아 있는 느낌이었어요. 강남에서 정통 중식을 찾으신다면 추천할 만한 곳입니다."
35553533,아방궁,,,강남에서 젤 좋아하는 중국집이에요^^ 양많고 맛있어요!
35553533,아방궁,,,"강남역 중국집 맛집이에요~! 단체모임 하기 좋게 룸이 있고, 매우매우 음식들이 맛있어요! 다음이 다시 방문할게요~!"
35553533,아방궁,,,강남역 회식장소나 단체모임으로 좋은 룸&칸막이 테이블로 되어 있어서 프라이빗하게 즐길 수 있고 무엇보다 맛있고 서비스가 좋은 중국집이었어요
35553533,아방궁,,,"다른 메뉴도 수준이 높지만, 그 중에서도 짬뽕이 정말 맛있네요! 차돌짬뽕 추천드립니다!"
35553533,아방궁,,,다음에도 방문주실때 말씀주신것처럼 맛있고 넉넉한 음식과 좋은 시간되실수있도록 맞이하겠습니다. 오늘도 시원한 하루되세요 감사합니다!
35553533,아방궁,,,돈주고 음식시키니 욕하는 중국집 진짜 중국집하면 여기무조건인데 원래있던 젊은 사장님이 아니라 나이있으신분이던데 안가고싶어요^^ 불친절 머달라해도 대꾸없고 잘못들은건지 몰라도 욕하신거같은데 ^^ 오지말라는거죠 뭐 젊은 사장님이계셨으면 항상친절하시고 차분하시고 좋았는데 다른 중국집 갈게요
35553533,아방궁,,,룸으로 되어있어서 private 하고 대화하기 좋았습니다. 간자장.삼선볶음밥.찹쌀탕수육 시켰는데 찹쌀탕수육이 먼저 나왔어요.
35553533,아방궁,,,룸이 많아서 모임하기에 딱 좋을 것 같아요~ 쟁반짜장과 탕수육 모두 깔끔하게 맛있어서 재방문할게요!
35553533,아방궁,,,"리뷰 968사진 1,985팔로워 53테마 3"
35553533,아방궁,,,"말씀처럼 작은 모임에도 , 조용하고 프라이빗 하게 시간 보내실수 있도록 룸을 제공하고 있답니다. 맛있는 음식과 맛있는 시간 되실수있도록 노력하겠습니다! 좋은하루되세요!"
35553533,아방궁,,,맛있게 드시고 좋은 시간 되신거같아 저희도 기분이 좋습니다^^ 저희 아방궁은 24시간 운영되오니 언제든 방문주시면 항상 따뜻하고 맛있는 메뉴로 보답드리겠습니다. 더운날씨지만 항상 시원한 하루되세요^^
35553533,아방궁,,,몇주 전 주말 이벤트인 네이버 예약해서 선착순 5명에게 탕수육이 제공되는 이벤트로 탕수육 받았었는데 모임에도 너무 좋을 거 같아서 이번에도 예약했어요 일요일 네이버 예약시 선착순으로 5명에게 탕수육이 제공되니 참고하시면 좋을 거 같아요
35553533,아방궁,,,밥이 머슴밥처럼 많이 나와요ㅋㅋ 강남에서 부담없이 약속잡기 좋은 맛집입니다!!♡
35553533,아방궁,,,방이 여러개 있어 조용히 이야기 하기 좋아요. 음식도 실패할게 없네요. 가성비도 나쁘지 않은듯하고요
35553533,아방궁,,,사장님의 기억력이 어마무시하셔서 오랜만에 와도 반갑게 맞이해주시는게 너무 좋아요
35553533,아방궁,,,"살면서 먹었던 중국집 중 1등이에요 ,, 대충 짜장 따로 주고 간짜장이라고 돈 더 받는 식당도 있는데 오래만에 제대로 된 간짜장 근본을 맛봤어요 ㅠㅠ 간짜장 말고도 바닷가재도 정말 맛있어서 다른 메뉴들도 궁금해졌는데 무조건 맛있을 것 같아요 !! 무조건 재방문이고 단골 될 것 같아요 .. 사장님이랑 친해지고 싶을 지경임 .."
35553533,아방궁,,,"어향동고는 깊은 맛이 잘 살아있고, 간짜장은 면발이 쫄깃하고 소스도 맛있었어요."
35553533,아방궁,,,언제든 방문주시면 올여름 가장 시원한 메뉴로 보답드리겠습니다 시원한 하루되세요^^
35553533,아방궁,,,여기 완전 탕수육 맛집입니다 튀김옷도 얇고 소스 맛 딱 좋고 사천짜장은 상당히 칼칼해요 매운거 좋아하는분들한테 딱일듯 !
35553533,아방궁,,,오늘은 유산슬밥! 뭘 먹어도 다 맛있는 곳이에요☺️
35553533,아방궁,,,요리가 너무 맛있어서 혹시 만두도 직접 빚으시는지 여쭤보니 그렇다고 하셔서 주문하고 놀랐습니다.
35553533,아방궁,,,유린기는 고추와 마늘의 콜라보로 적당히 매콤한데 완전 바삭하고 맛있어요~~~또 오겠습니다!
35553533,아방궁,,,음식 다 맛있었는데 특히 짬뽕이 맛있었어요! 탕수육도 소자 시켰는데 댑따 많이 나옴.
35553533,아방궁,,,저녁에 방문예약 없이 이용대기 시간 바로 입장일상연인・배우자
35553533,아방궁,,,저녁에 방문예약 없이 이용대기 시간 바로 입장친목친구
35553533,아방궁,,,저녁에 방문예약 후 이용대기 시간 바로 입장데이트연인・배우자
35553533,아방궁,,,저녁에 방문예약 후 이용대기 시간 바로 입장친목친구
35553533,아방궁,,,저녁에 방문예약 후 이용대기 시간 바로 입장친목친구
35553533,아방궁,,,저녁에 방문예약 후 이용대기 시간 바로 입장회식지인・동료
35553533,아방궁,,,점심에 방문예약 없이 이용대기 시간 바로 입장비즈니스지인・동료
35553533,아방궁,,,점심에 방문예약 없이 이용대기 시간 바로 입장일상지인・동료
35553533,아방궁,,,점심에 방문예약 없이 이용대기 시간 바로 입장일상혼자
35553533,아방궁,,,점심에 방문예약 없이 이용대기 시간 바로 입장친목친구
35553533,아방궁,,,"점심에 방문예약 없이 이용대기 시간 바로 입장친목친구, 지인・동료"
