가게ID,가게명,평점,날짜,리뷰내용
1303929477,상록회관연탄구이 문래점,,,"안녕하세요! 😊 상록회관연탄구이 문래점을 찾아주시고, 맛있는 후기까지 남겨주셔서 정말 감사합니다! 소고기도, 대하도 너무 맛있게 드셨다니 정말 뿌듯해요! 특히 머리 버터구이는 정말 꿀조합이죠! 👍 오랜만에 친한 분들과의 모임, 저희 상록회관연탄구이 문래점에서 좋은 시간 보내신 것 같아 기쁩니다! 🙇‍♀️ 다음에 또 방문해 주시면 더 맛있는 음식으로 보답할게요! ❤️"
1303929477,상록회관연탄구이 문래점,,,"안녕하세요! 😊 상록회관연탄구이 문래점을 찾아주시고, 소중한 리뷰까지 남겨주셔서 정말 감사합니다! 저희 고기가 맛있다고 말씀해주시니 너무 기쁘네요! 특히, 냉동이 아닌 점을 좋게 봐주셔서 뿌듯합니다. 넓은 공간에서 즐거운 시간 보내셨다니 다행이에요. 다음에 또 오셔서 맛있는 고기 드시고, 저희 상록회관연탄구이 문래점에서 좋은 추억 많이 만들어가세요! 👍❤️🙇‍♀️"
1303929477,상록회관연탄구이 문래점,,,"안녕하세요! 😊 상록회관연탄구이 문래점을 찾아주시고, 소중한 리뷰까지 남겨주셔서 정말 감사합니다! 저희 고기가 맛있다고 말씀해주시니 너무 기쁘네요! 특히, 냉동이 아닌 점을 좋게 봐주셔서 뿌듯합니다. 넓은 공간에서 즐거운 시간 보내셨다니 다행이에요. 다음에 또 오셔서 맛있는 고기 드시고, 저희 상록회관연탄구이 문래점에서 좋은 추억 많이 만들어가세요! 👍❤️🙇‍♀️"
1303929477,상록회관연탄구이 문래점,,,여기가 K-서프앤 터프를 파는 곳인가요? 고기와 해산물을 동시에 즐길 수 있는 이런 곳은 흔치 않습니다! 가성비 너무 좋고 직원분들도 친절하셔서 좋은 시간 보냈습니다
1303929477,상록회관연탄구이 문래점,,,"올해 첫 대하구이를 저희 상록회관연탄구이 문래점에서 즐겨주셔서 정말 감사합니다! 😊 대하가 크고 맛있었다니, 정말 다행이에요! 바닷가 근처에 가지 않아도 될 만큼 맛있다는 칭찬, 정말 감동입니다! 🙇‍♀️ 앞으로도 변함없는 맛과 서비스로 고객님들을 맞이할 수 있도록 노력할게요. 소중한 후기 정말 감사합니다! 👍❤️"
1303929477,상록회관연탄구이 문래점,,,일단 대하구이 먹을곳을 찾았는데! 영등포 신도림 구로 주변에는 여기 밖에 없더라구요 그리고 고기도 1인분씩 주문 가능한데 가격도 저렴하고 고기 상태도 좋구요! 메뉴도 다양해서 너무너무 좋네여!! 다음에는 도보로 와서 술 한잔 하겠습니다!
1303929477,상록회관연탄구이 문래점,,,저녁에 방문예약 없이 이용대기 시간 바로 입장데이트연인・배우자
1303929477,상록회관연탄구이 문래점,,,"저녁에 방문예약 없이 이용대기 시간 바로 입장일상친구, 연인・배우자, 아이"
1303929477,상록회관연탄구이 문래점,,,"저희 상록회관연탄구이 문래점의 가장 큰 장점인 연탄에 구워 먹는 고기의 매력을 알아봐 주시고, 노포 감성까지 즐기셨다니 너무 뿌듯합니다! ❤️ 맛있게 드셨다니 저도 기분이 좋네요. 다음 방문 시에도 최고의 서비스와 맛으로 보답할 수 있도록 노력하겠습니다. 다음에 또 오시면 더 맛있는 메뉴로 기다리고 있을게요! 🙇‍♀️"
1303929477,상록회관연탄구이 문래점,,,"친구분과 저녁 식사, 저희 상록회관연탄구이 문래점에서 즐겁게 보내셨다니 정말 다행이에요! 😊 가리비, 대하구이, 소고기, 항정살까지 모두 드시고 싶으셨다니, 저희 메뉴가 딱이었네요! 주말 늦은 저녁까지 운영해서 데이트에 💖 즐거움을 더해드린 것 같아 뿌듯합니다. 저희 상록회관연탄구이 문래점에 방문해 주셔서 감사합니다! 다음에 또 오셔서 맛있는 식사 하세요! 👍🙇‍♀️"
1303929477,상록회관연탄구이 문래점,,,"토요일 8시쯤 방문했는데 대기1번이였고 10분도 안되서 들어갔어요! 친구가 고기를 잘 구워서 육즙이 지대로 살아있었고 항정살 무조건 드세요... 고기먹고 아쉬워서 고기추가 할까 새우먹을까 하다가 대하 철이여서 500g 추가했는데 제 손바닥만한 새우ㅋㅋㅋㅋㅋㅋㅋㅋㅋ 미쳤습니다 그냥. 단맛 미쳤구요 새우 껍질까지 연하더라구요? 원빈 빙의해서 대가리 빼고 모조리 씹어먹었습니다ㅎ 일단 직원분들 친절해서 재방문의사 무조건 있구요 입맛 까다로운 친구도 다시 데려올 생각입니다. 고기 질 좋으니까 가성비, 분위기, 맛 따지실분들은 그냥 여기로 오세요 ㅎ 맛있게 잘 먹고 갑니다!!"
1303929477,상록회관연탄구이 문래점,,,"하.. 가성비랑 맛이랑 최고입니다👍🏻 맛있어서 먹는데 정신 팔려서 다 먹고 사진 찍었네요,,, 여기는 안 올 하등의 이유가 없어요 무조건 먹어야해요 ㅠㅠ"
1303929477,상록회관연탄구이 문래점,,,핫한 문래답게 적당한 10분 웨이팅 후에 이용할 수 있었어요🫶🏻 연탄불에 구어먹는 고기 너무 맛있어요
1803680429,솥돈 문래점,,,가게가 좀 좁지만 쾌적한 편이에요. 고기는 질 좋고 양 많은편이에요! 묵은지가 같이나와서 좋아요. 후식으로 칼국수도있는데 별미에요!
1803680429,솥돈 문래점,,,고기 구울 때는 안 튀게 철판이 있어서 좋아요! 고기를 구워주셔서 편합니다! 김치랑 두부랑 미나리까지!! 매장이 아주 넓고 깨끗합니다! 추천추천!!
1803680429,솥돈 문래점,,,고기 상당합니다 맛납니다 일단구워져나오고 편합니다 아주굿입니다 물이 헛개수 너무맛납니다.재방문각입니다 아주만족합니다
1803680429,솥돈 문래점,,,고기 생각보다 괜찮았고 김치맛있어요. 칼국수도 괜찮았음 다만 바닥이나 의자가 전체적으로 기름이너무많음 미끌미끌 청소열심히하셔야할거같아요
1803680429,솥돈 문래점,,,고기 정말 맛있어요~~!!! 직접 다 구워주셔서 기름튈 일도 없어서 더 맛있는거 같아요 ㅎㅎㅎㅎ
1803680429,솥돈 문래점,,,고기도 두껍고 너무 맛있어요 장도 다양하고 쩔깃쫄기솨니 너무 만족스럽습니다~!! 또올거같아요
1803680429,솥돈 문래점,,,"구워주시자마자 그저 말 없이 먹기만 했읍니다,,,🤤 남자친구랑 침묵하고 오랜만에 식사에 집중했어요ㅎㅎ !! 맛있게 먹었습니다🤍 또 올게요 사장님:)"
1803680429,솥돈 문래점,,,기름 튀지 않게 가림막 하고 직접 구워주셔서 누구 하나 고기 굽지 않고 먹어서 더 맛있습니다ㅋㅋㅋ
1803680429,솥돈 문래점,,,내일이 제 생일인데 남편이 근무라 오늘 남편하고 저녁 먹으러 왔어요 문래 주민이라 솥돈 지나가면서만보다가 오늘 첫 방문..삼겹 항정 목살 다 먹었는데 고기 겁나 맛있어요. 친구부부데꼬 또 와야겠어요
1803680429,솥돈 문래점,,,느낌좋고 맛좋고 기분좋고 근데 매장이 좀 많이 어두워여 클럽온 기분ㅋㅋㅋ그래도 맛있게 잘 먹고 갑니동
1803680429,솥돈 문래점,,,다른 지점 방문했을 때 실망했어서 오기 전 고민을 조금 했었는데 진짜 대만족이었어요🤤
1803680429,솥돈 문래점,,,다만 좌석이 조금 불편하고(쩍벌 해야함…) 매장 안이 좀 어둡긴 했습니다.. 그래도 매장이 깔끔하고 넓어서 좋아요
1803680429,솥돈 문래점,,,다음에 또 오고싶은 고기집이에요 우리동네에도 있음 좋겟다...ㅠㅠ
1803680429,솥돈 문래점,,,"맛도 좋고, 깔끔하고, 메뉴 구성이 고기랑 잘 어울리는 걸로 알차게 구성되어 있어 맛있게 먹었습니다^^"
1803680429,솥돈 문래점,,,맛있어서 재방문 했어요! 삼겹살 뿐만 아니라 부가적인 메뉴도 항상 맛있어요!!!
1803680429,솥돈 문래점,,,문래 데이트 왔는데 유명한 고기집이 있길래 와봤어요. 직원 분들 친절하시고 고기질 너무 좋아요!! 🙌☺️
1803680429,솥돈 문래점,,,문래동 맛집 솥돈❤️ 한번은 꼭 와 보고싶었는데 진짜 맛집 이에요
1803680429,솥돈 문래점,,,문래동 핫플이라는데 드디어 방문해보았습니다🥰 핫플일 만하네요.고기 진짜 맛있고 다 구워주셔서 편하고 너무 좋았습니다🥰🥰🥰🥰🥰 재방문 의사 10000%
1803680429,솥돈 문래점,,,문래오면 항상 오는 솥돈 !! 구어주는 고기 김치 여전히 맛있어요 구운김치에 두부 에피타이저로 먹어주고🤍 고기가 일단 너무 촉촉하고 두툼해서 맛잇어요 반찬도 잘나오고 누룽지국물도 서비스로 같이 나오니 속이 든든해요 마지막은 꼭 고기기름에 끓인 김치칼국수를 먹어줘야함💗💗
1803680429,솥돈 문래점,,,비오는 날 삼겹살에 노릇노릇 구운 김치 먹고싶어서 찾아왔는데 너무 맛있어요 ㅜㅜ 김치에 미나리 두부까지
1803680429,솥돈 문래점,,,"사장님도 엄청 친절하시고, 바로 먹을 수 있게 맛있게 구워주셔서 너무 좋네요! 고기 맛있어서 두번째 방문인데 너무 맛있어요🤗"
1803680429,솥돈 문래점,,,"삼겹살이 먹고 싶어서 힙의 성지 문래로 먹으러 왔어요. 솥뚜껑에 구워주는 삼겹살이라니 ~~~~ 완전 최고입니다. 삼겹살에 찍어먹을 수 있는 소스 종류가 5개나 되다니 완전 ... 소스 러버들은 행복합니다. 고기도 직접 다 구워주고 솥뚜껑에 구우니까 맛은 말해 뭐해 ., 완전 짱 🥹 삼걉살 최고 ~~"
1803680429,솥돈 문래점,,,"솥돈 문래점에서 삼겹살을 먹었는데 고기 질이 훌륭하고 두툼하게 잘라내 육즙이 가득했어요쫄깃하면서도 촉촉한 식감이 일품이었고, 사이드 반찬도 깔끔하게 잘 어울렸습니다. 분위기도 깔끔해 친구들이랑 다시 오고 싶네요."
1803680429,솥돈 문래점,,,솥돈은 고기를 구워주기도하고 가운데 야채랑 김치 볶아 주는게 대박인것같아요 ㅋㅋ 푸짐하고 맛잇어서 문래 고기먹고싶을때는 항상 방문합니다!!
1803680429,솥돈 문래점,,,애초에 고기가 초벌이 되서 나옵니다. 그래서 그런지 고기맛이 좋고 계란 후라이 무료에
1803680429,솥돈 문래점,,,"여기 고기 맛있어서 가끔와요! 이른 저녁에 오니 대기없이 다로 들어왔고, 고기 질이 좋은데 솥에 직접 구워주셔서 육즙이 살아있고 부드러운게 더 맛있어요. 김치도 같이 구워먹어서 맛있어요~~"
1803680429,솥돈 문래점,,,여름이라 더우면 어쩌나 했는데 실내도 시원해서 즐기는 데 문제 없어서 좋았습니다👍👍
1803680429,솥돈 문래점,,,"오랜만에 기름칠해야할 거 같아서 요며칠 생각나던 솥돈 방문했어요💕 역시나 고기 두툼하고 너무 맛있어서 흡입했습니다...👍 곁들여진 미나리, 깻잎 야채들도 최고🙂😍🫶 곧 또올게요☀️"
1803680429,솥돈 문래점,,,오랜만에 와도 여전히 맛있습니다! 직접 구워주시는 친절함도 여전하고 김치도 진짜 최고 맛있어요. 이 동네에 오래 살았는데 자리를 지키고 있는 얼마 안 되는 맛집이라 소중합니다😊 고기 맛있고 야채 신선하고 친절해서 돼지고기는 솥돈에서만 먹어요!
1803680429,솥돈 문래점,,,음식이 너무 맛있고 사장님이 너무 친절하시고 직접 구워주셔서 너무편했습니당 치즈랑 볶음밥은 꼭 추가해드시길바랍니당 내돈내산 맛집 추천합니다❤❤❤❤❤
1803680429,솥돈 문래점,,,저녁에 방문예약 없이 이용대기 시간 30분 이내데이트연인・배우자
1803680429,솥돈 문래점,,,저녁에 방문예약 없이 이용대기 시간 30분 이내데이트연인・배우자
1803680429,솥돈 문래점,,,저녁에 방문예약 없이 이용대기 시간 바로 입장가족모임연인・배우자
1803680429,솥돈 문래점,,,"저녁에 방문예약 없이 이용대기 시간 바로 입장나들이, 일상연인・배우자, 아이"
1803680429,솥돈 문래점,,,저녁에 방문예약 없이 이용대기 시간 바로 입장데이트연인・배우자
1803680429,솥돈 문래점,,,저녁에 방문예약 없이 이용대기 시간 바로 입장데이트연인・배우자
1803680429,솥돈 문래점,,,저녁에 방문예약 없이 이용대기 시간 바로 입장데이트연인・배우자
1803680429,솥돈 문래점,,,저녁에 방문예약 없이 이용대기 시간 바로 입장데이트연인・배우자
1803680429,솥돈 문래점,,,저녁에 방문예약 없이 이용대기 시간 바로 입장데이트연인・배우자
1803680429,솥돈 문래점,,,저녁에 방문예약 없이 이용대기 시간 바로 입장데이트연인・배우자
1803680429,솥돈 문래점,,,저녁에 방문예약 없이 이용대기 시간 바로 입장일상지인・동료
1803680429,솥돈 문래점,,,저녁에 방문예약 없이 이용대기 시간 바로 입장친목친구
1803680429,솥돈 문래점,,,저번에 방문했다가 맛있어서 또 방문했어요~ 사장님이 직접 구워주시고 야채들도 신선하고 가성비도 좋아서 좋아요 ㅎㅎ
1803680429,솥돈 문래점,,,점심에 방문예약 없이 이용대기 시간 바로 입장일상아이
1803680429,솥돈 문래점,,,점심에 방문예약 없이 이용대기 시간 바로 입장친목연인・배우자
1803680429,솥돈 문래점,,,정처없이 걷다가 배고파서 냄새에 이끌려 들어왔는데 정말 맛있고 감동이었습니다 다 구워주시고 좋았어요
1803680429,솥돈 문래점,,,창작촌 삼겹살 원티어!!! 김치도 맛있고~ 무엇보다 삼겹살이 두껍고 양도많고 지인짜 부드럽고 맛있습니다… 구워주셔서 먹기만 하는 되는..진짜 창착촌 찐맛집 추천!👍
1803680429,솥돈 문래점,,,처음에 고기 한입먹고 너무 맛있어서 깜짝놀랐어요!!! 구울필요없이 다 구워나와서 깔끔하고 편했습니다🧡 김치도 많이나와서 센스 감다살;;;
1803680429,솥돈 문래점,,,"칭구,지인,가족까지 델고와서 모두의 최애 맛집이 된 저의 최애 삼겹살 맛집 .."
1803680429,솥돈 문래점,,,"🔘솥 삼겹살은 고기 육질이 부드러우면서도 쫄깃한 맛이 깊이가 있고, 👨‍🍳직원분께서 솥뚜껑에 직접 🔥그릴링 해주셔서 편하게 먹을수 있어 좋았고, 🙌직접 담근 전라도식 🥬김치가 고기에 스며들고 미나리, 두부까지 함께 구워 먹으니 😆독특하면서 깊은 맛의 풍미를 느껴볼수 있었고, 🥣다양한 소스까지 곁들여 먹으니 정말 짱맛도리였어요😋"
1311289417,영등포꽃삼,,,"고기도 구워주시고, 심지어 선택이 가능함. 같이 나온 서비스 김치찌개가 너무 맛났어요. 해외여행 다녀와서 김치찌개 땡겼는데. 완전 충족!!! ㅋㅋ 그냥 김치 아니구 열무김치어서 또 색다른느낌!!"
1311289417,영등포꽃삼,,,"벌써 4번째 방문입니다 영등포 올때마다 꼭 오는 것 같아요 !고기가 정말 신선하고 육즙이 가득해서 너무 맛있습니당 🩷불판 관리도 잘 해주시고 고기도 잘 구워주셔서 끝까지 맛있게 먹을 수 있었고, 사이드 반찬도 정갈하고 다양해서 고기랑 같이 먹기 딱 좋았습니다. 직원분들이 친절해서 편하게 식사할 수 있었고, 분위기도 깔끔하고 쾌적해서 가족 모임이나 친구랑 오기에도 최고예요. 또 오고 싶은 맛집이에여 !! 🩷"
1311289417,영등포꽃삼,,,생맥있는 고기집! 근본있는 고기집!! 쉽지 않은거 알죠??🥰 일단 생맥에 한번 감동! 고기맛에 감동!😂자리도 칸마다 나눠져있어서 데이트나 소개팅하기에도 넘넘 죠아요! 구워주셔서 편하게 잘 먹었습니다~🩷
1311289417,영등포꽃삼,,,안녕하세요. 영등포맛집 꽃삼입니다. 고기 질이 좋아야 최고의 맛이 난다고 믿고 있습니다. 항상 좋은 고기 드릴 수 있도록 노력하겠습니다. 다음에 방문해주세요~!
1311289417,영등포꽃삼,,,안녕하세요. 영등포맛집 꽃삼입니다. 김치찌개가 입에 맞으셨다니 다행입니다. 항상 맛있는 김치찌개 준비 해 놓겠습니다. 생각나실 때 언제든 방문해주세요~!
1311289417,영등포꽃삼,,,안녕하세요. 영등포맛집 꽃삼입니다. 김치찌개가 입에 맞으셨다니 다행입니다. 항상 맛있는 김치찌개 준비 해 놓겠습니다. 생각나실 때 언제든 방문해주세요~!
1311289417,영등포꽃삼,,,안녕하세요. 영등포맛집 꽃삼입니다. 김치찌개가 입에 맞으셨다니 다행입니다. 항상 맛있는 김치찌개 준비 해 놓겠습니다. 생각나실 때 언제든 방문해주세요~!
1311289417,영등포꽃삼,,,안녕하세요. 영등포맛집 꽃삼입니다. 김치찌개가 입에 맞으셨다니 다행입니다. 항상 맛있는 김치찌개 준비 해 놓겠습니다. 생각나실 때 언제든 방문해주세요~!
1311289417,영등포꽃삼,,,안녕하세요. 영등포맛집 꽃삼입니다. 김치찌개가 입에 맞으셨다니 다행입니다. 항상 맛있는 김치찌개 준비 해 놓겠습니다. 생각나실 때 언제든 방문해주세요~!
1311289417,영등포꽃삼,,,안녕하세요. 영등포맛집 꽃삼입니다. 김치찌개가 입에 맞으셨다니 다행입니다. 항상 맛있는 김치찌개 준비 해 놓겠습니다. 생각나실 때 언제든 방문해주세요~!
1311289417,영등포꽃삼,,,"안녕하세요. 영등포맛집 꽃삼입니다. 매장 분위기가 마음에 드셨다니 다행입니다. 지인, 친구, 가족분들 자신있게 모셔올 수 있도록 항상 좋은 분위기와 맛 유지하겠습니다. 감사합니다!"
1311289417,영등포꽃삼,,,"안녕하세요. 영등포맛집 꽃삼입니다. 매장 분위기가 마음에 드셨다니 다행입니다. 지인, 친구, 가족분들 자신있게 모셔올 수 있도록 항상 좋은 분위기와 맛 유지하겠습니다. 감사합니다!"
1311289417,영등포꽃삼,,,"안녕하세요. 영등포맛집 꽃삼입니다. 매장 분위기가 마음에 드셨다니 다행입니다. 지인, 친구, 가족분들 자신있게 모셔올 수 있도록 항상 좋은 분위기와 맛 유지하겠습니다. 감사합니다!"
1311289417,영등포꽃삼,,,"안녕하세요. 영등포맛집 꽃삼입니다. 매장 분위기가 마음에 드셨다니 다행입니다. 지인, 친구, 가족분들 자신있게 모셔올 수 있도록 항상 좋은 분위기와 맛 유지하겠습니다. 감사합니다!"
1311289417,영등포꽃삼,,,"안녕하세요. 영등포맛집 꽃삼입니다. 매장 분위기가 마음에 드셨다니 다행입니다. 지인, 친구, 가족분들 자신있게 모셔올 수 있도록 항상 좋은 분위기와 맛 유지하겠습니다. 감사합니다!"
1311289417,영등포꽃삼,,,안녕하세요. 영등포맛집 꽃삼입니다. 이곳에서의 식사가 마음에 드셨다니 다행입니다. 항상 맛있는 음식 제공해 드릴 수 있도록 노력하겠습니다. 다음에 또 방문해주세요~
1311289417,영등포꽃삼,,,안녕하세요. 영등포맛집 꽃삼입니다. 이곳에서의 식사가 마음에 드셨다니 다행입니다. 항상 맛있는 음식 제공해 드릴 수 있도록 노력하겠습니다. 다음에 또 방문해주세요~
1311289417,영등포꽃삼,,,안녕하세요. 영등포맛집 꽃삼입니다. 이곳에서의 식사가 마음에 드셨다니 다행입니다. 항상 맛있는 음식 제공해 드릴 수 있도록 노력하겠습니다. 다음에 또 방문해주세요~
1311289417,영등포꽃삼,,,안녕하세요. 영등포맛집 꽃삼입니다. 이곳에서의 식사가 마음에 드셨다니 다행입니다. 항상 맛있는 음식 제공해 드릴 수 있도록 노력하겠습니다. 다음에 또 방문해주세요~
1311289417,영등포꽃삼,,,안녕하세요. 영등포맛집 꽃삼입니다. 저희 매장 서비스에 만족하셨다니 다행입니다. 앞으로도 손님들께 최선을 다하는 영등포 꽃삼이 되겠습니다. 다음에도 방문해주세요!
1311289417,영등포꽃삼,,,안녕하세요. 영등포맛집 꽃삼입니다. 저희 매장 서비스에 만족하셨다니 다행입니다. 앞으로도 손님들께 최선을 다하는 영등포 꽃삼이 되겠습니다. 다음에도 방문해주세요!
1311289417,영등포꽃삼,,,안녕하세요. 영등포맛집 꽃삼입니다. 정성스럽게 준비한 음식이 입맛에 맞으신다니 다행이네요! 앞으로도 변함 없는 맛으로 맞이하겠습니다! 또 방문해주세요~!!
1311289417,영등포꽃삼,,,안녕하세요. 영등포맛집 꽃삼입니다. 정성스럽게 준비한 음식이 입맛에 맞으신다니 다행이네요! 앞으로도 변함 없는 맛으로 맞이하겠습니다! 또 방문해주세요~!!
1311289417,영등포꽃삼,,,안녕하세요. 영등포맛집 꽃삼입니다. 정성스럽게 준비한 음식이 입맛에 맞으신다니 다행이네요! 앞으로도 변함 없는 맛으로 맞이하겠습니다! 또 방문해주세요~!!
1311289417,영등포꽃삼,,,안녕하세요. 영등포맛집 꽃삼입니다. 항상 초심 잃지 않겠습니다! 언제나 좋은 기억 가지고 가실 수 있도록 변함없는 모습으로 기다리고 있겠습니다. 다음에 또 이용해주세요~
1311289417,영등포꽃삼,,,안녕하세요. 영등포맛집 꽃삼입니다. 항상 초심 잃지 않겠습니다! 언제나 좋은 기억 가지고 가실 수 있도록 변함없는 모습으로 기다리고 있겠습니다. 다음에 또 이용해주세요~
1311289417,영등포꽃삼,,,안녕하세요. 영등포맛집 꽃삼입니다. 항상 초심 잃지 않겠습니다! 언제나 좋은 기억 가지고 가실 수 있도록 변함없는 모습으로 기다리고 있겠습니다. 다음에 또 이용해주세요~
1311289417,영등포꽃삼,,,안녕하세요. 영등포맛집 꽃삼입니다. 항상 초심 잃지 않겠습니다! 언제나 좋은 기억 가지고 가실 수 있도록 변함없는 모습으로 기다리고 있겠습니다. 다음에 또 이용해주세요~
1311289417,영등포꽃삼,,,여기 식당에서 삼겹살이 정말 두툼하고 신선해서 너무 맛있었어요! 기본 반찬도 다양하게 잘 나와서 고기랑 같이 먹으니 조화가 딱 좋았습니다. 특히 김치찌개가 깊고 얼큰한 맛이라 고기 다 먹은 후에도 술술 들어가더라고요. 직원분들도 친절해서 편하게 즐길 수 있었습니다. 재방문 의사 100%!
1311289417,영등포꽃삼,,,"영등포 꽃삼 영등포역 바로 앞에 위치하고, 매장이 넓고 깨끗해서 방문했어용! 세트도 있고, 기본안주가 그냥 김치찌개 하나를 주십니다 짱짱 맛도 맛있고, 고기도 다 구워주셔서 저녁 모임이나 데이트로도 좋을 것 같아요!! 다시 또 올 것 같습니다~🩷👍❤️"
1311289417,영등포꽃삼,,,영등포 돼지고기 맛집 영등포꽃삼에 오랜만에 왔습니다! 찬도 여러가지로 많이 챙겨주셨고 김치찌개도 나옵니다!! 그리고 고기는 고기굽기 자격증 보유 중이신 직원분께서 직접 구워주셔서 맛있게 잘 먹을 수 있었습니다! 감사합니다
1311289417,영등포꽃삼,,,예전부터 눈여겨보다 영등포근처 오자마자 냅다 방문해본 영등포꽃삼 ! 기대했던만큼 고기진짜 맛있게 구워주셨어요ㅠㅠㅠㅠ 반찬구성도 알차고 다맛있었고 같이나오는 김치찌개도 칼칼해서 고기랑 먹기 너무 좋았어요 근처에 올 일 있으면 또올거에요! 잘먹었습니다💕
1311289417,영등포꽃삼,,,완벽한 그릴링 서비스: 직원이 직접 처음부터 끝까지 가장 맛있는 상태로 구워줘서 편하게 식사할 수 있습니다. 태울 걱정 없이 전문가가 구워준 고기를 맛볼 수 있는 게 가장 큰 장점입니다.
1311289417,영등포꽃삼,,,"친구들과 모임으로 갔는데 고기 질이 너무 좋아 다들 감탄했어요. 특히 목살이 육즙이 풍부하고 부드러워 최고였습니다. 김치찌개 서비스도 인상적이었고, 영등포 타임스퀘어 근처라 약속 장소로 정하기도 좋습니다."
1090062206,초량생갈비,,,B세트 먹었는데 양념갈비가 너무 맛있어서 추가했습니다. 직접 갈아 만든 특제 마소스랑 잘어울렸어요. 고기도 다 구워주셔서 편하게 먹고 갑니다~!!!
1090062206,초량생갈비,,,B세트 먹었는데 양념갈비가 너무 맛있어서 추가했습니다. 직접 갈아 만든 특제 마소스랑 잘어울렸어요. 고기도 다 구워주셔서 편하게 먹고 갑니다~!!!
1090062206,초량생갈비,,,고기 부위 하나씩 설명해주시면서 찍어 먹을 소스 까지 추천해주셔서 맛있게 잘 먹었습니다흐흐흐 된장 술밥 존맛탱이고 사이드 치즈계란찜 ㄹㅈㄷ술안줃ㄷㄷㄷ 꼭오셔요🤤🧡
1090062206,초량생갈비,,,고기 직접 구워주셔서 부모님과 편하고 맛있게 먹었어요 ㅎㅎ 고기도 신선하고 너무너무 맛있어요
