가게ID,가게명,평점,날짜,리뷰내용
1090062206,초량생갈비,,,고기 직접 구워주시고 고기 쫀득하고 맛있어요 계란찜도 치즈 계란침이라 더 좋은듯 생갈비에 파김치 올려먹는거 추천드립니다 가족끼리 오신 분들 꽤 계신데 너무 시끄럽지 않아서 친구랑 오거나 데이트하러 와도 괜찮을거같아요
1090062206,초량생갈비,,,고기 질이 좋고 맛있습니다!! 젓갈 직접 담그신다는데 같이 먹으면 맛있구 계란찜도 부들부들 조아요 ㅎㅎㅎㅎ
1090062206,초량생갈비,,,고기 질이 좋고 맛있습니다!! 젓갈 직접 담그신다는데 같이 먹으면 맛있구 계란찜도 부들부들 조아요 ㅎㅎㅎㅎ
1090062206,초량생갈비,,,고기랑 파김치도 맛있고 직원분들도 친절하셔서 좋았습다! 재방문 의사 1000000%이에요💖
1090062206,초량생갈비,,,고기랑 파김치도 맛있고 직원분들도 친절하셔서 좋았습다! 재방문 의사 1000000%이에요💖
1090062206,초량생갈비,,,근처에서 고기먹으려고 그냥 와봤는데 사장님 너무 친절하시고 고기 진짜 너무 맛있어요!!! 그리고 다 구워주셔서 너무 좋습니당! 김치찌개도 엄청 맛있어용!
1090062206,초량생갈비,,,남자친구 회사 근처라 주말에 퇴근하고 같이 방문했는데 고기 퀄리티가 미쳤어요 ㅋㅋㅋㅋ 생갈비가 이렇게 맛있었나....!!! 고기가 진짜 부드러워요. 그리고 직접 맛있게 구워주셔서 넘 좋았음 ㅜㅠ!
1090062206,초량생갈비,,,너무 맛있어서 흡입하느라 사진을 제대로 못찍었어요...ㅎㅎ올 때 마다 항상 맛있게 고기 구워주시고 서비스도 좋아서 꼭 오게돼요!!! 생갈비 삼겹살 늑간살 김치볶음밥 냉면 다 먹어봤는데 진짜 다 맛있어요!!! 자주 올게요~~~!!!
1090062206,초량생갈비,,,"노릇노릇 구워주시며 젓갈과 소금, 수제소스와 함께 맛있게 먹는 방법까지 알려주시네요."
1090062206,초량생갈비,,,"노릇노릇 구워주시며 젓갈과 소금, 수제소스와 함께 맛있게 먹는 방법까지 알려주시네요."
1090062206,초량생갈비,,,다른 고기집만 다니다가 내부가 깔끔해서 들어오게 됐어요!! 고기 질도 대박이고 벌써 3번째 방문입니다ㅎㅎㅎㅎ된장술밥은 꼭 시켜드세요!!!
1090062206,초량생갈비,,,된장술밥 먹고싶어서 들어왔는데 고기질이 너무 좋아서 맛있게 먹었어용!!!!! 기대한것보다 반찬도 맛있고 바로바로 구워주시는 고기도 세트메뉴가 너무 잘되어있어서 엄청 먹게되는 ㅎㅎㅎ
1090062206,초량생갈비,,,된장술밥 먹고싶어서 들어왔는데 고기질이 너무 좋아서 맛있게 먹었어용!!!!! 기대한것보다 반찬도 맛있고 바로바로 구워주시는 고기도 세트메뉴가 너무 잘되어있어서 엄청 먹게되는 ㅎㅎㅎ
1090062206,초량생갈비,,,반찬도 깔끔하고 고기 질도 좋구 매장도 깔끔해서 좋아요! 직접 구워서 주는거라서 먹기도 편해요~
1090062206,초량생갈비,,,"생갈비가 정말 신선하고 육즙이 가득했어요. 고기 두께도 도톰해서 씹는 맛이 살아있고, 숯불 향이 은은하게 배어 훨씬 맛있습니다. 반찬도 깔끔하게 잘 나오고 직원분들 서비스도 친절해서 만족스러웠습니다."
1090062206,초량생갈비,,,생갈비는 진리입니다 ㅅ쉽게 찾지 못하는 맛집 음식 깔끔하고 가장 나이스한건 사장님이 너무 친절흐십니다 !! 또갈스있는집 추천입니다 !!!
1090062206,초량생갈비,,,생갈비집은 처음인거 같은데 친척들이랑 와서 잘먹었습니다! 고기도 직접 구워주셔서 정말 편안하게 굽는 거에 쫓기지 않고 먹었어요 된장술밥이랑 냉면도 맛있더라구요
1090062206,초량생갈비,,,생갈비집은 처음인거 같은데 친척들이랑 와서 잘먹었습니다! 고기도 직접 구워주셔서 정말 편안하게 굽는 거에 쫓기지 않고 먹었어요 된장술밥이랑 냉면도 맛있더라구요
1090062206,초량생갈비,,,서울에서 생갈비 먹기 힘든데 이제야 맛있는집을 찾았네요 생갈비 인생고깃집ㅠㅠ! 고기질이 정말 좋고 맛있게 구워주셔서 고기맛이 극대화된것같아요! 생갈비랑 직접만드셨다는 가리비젓갈의 궁합도 너무 좋아요! 양념갈비도 뒤지지않게 맛있었는데 특히 양념갈비와 마로 만든 수제소스와의 궁합이 미쳐떠여...ㅠㅠ 오래오래 장사해주세욤 ! 아 김치찌개도 제가 집에서 만든것보다 맛있어요 케켘ㅋㅋ
1090062206,초량생갈비,,,영등포 맛도리 발견해서 넘 죻아요 담에 또 올 거 같아요❤️‍🔥생갈비 고기 질이 너무 좋고 기본 반찬 구성도 좋고 가리비젓갈이랑 페어링 미춌네요🫢🥹
1090062206,초량생갈비,,,영등포구청 맛집이라고 듣고 찾아왔는데 우선 고기 질이 너무 좋고요 구워줘서 같이 온 사람이랑 대화하면서 먹을 수 있어서 좋네요✌🏻✌🏻🤭👍
1090062206,초량생갈비,,,"오랜만에 와도 친절한건 둘쨋치고 너무 맛나요🤭😝😝🥩 고기 진짜 미쳤어요…! 친구랑 초량생갈비 다녀왔는데 입에서 살살 녹음😭 반찬도 다 맛있고, 분위기까지 완벽💯 ! 누구랑 와도 완벽한 고깃집!! #초량생갈비 #맛집추천 #고기맛집"
1090062206,초량생갈비,,,일단 다 구워주셔서 좋았고 육즙이 팡팡 터져서 너무 맛있었어요 고기의 신선함도 느껴지고 김치찌개에도 고기랑 김치 많이 들어있어서 좋았고 양념갈비는 수제소스랑 먹는데 그게 킥! 어디서도 맛보지 못한 맛 짱맛!
1090062206,초량생갈비,,,일단! 고기 질이 너무 좋아요 메뉴 다 먹었는데 뻑뻑하지않고 맛있었어요 직접구워주셔서 편하게 먹었구 세트로 시켜서 계란찜 된장술밥 미쳤구요 술도 막 탁탁 쳐서 주셔서 제 ㅊ ㅣ향저격입니다♡ 그냥 미친 집입니다🩷
1090062206,초량생갈비,,,저녁에 방문예약 없이 이용대기 시간 30분 이내친목지인・동료
1090062206,초량생갈비,,,저녁에 방문예약 없이 이용대기 시간 바로 입장데이트연인・배우자
1090062206,초량생갈비,,,저녁에 방문예약 없이 이용대기 시간 바로 입장데이트연인・배우자
1090062206,초량생갈비,,,저녁에 방문예약 없이 이용대기 시간 바로 입장데이트연인・배우자
1090062206,초량생갈비,,,저녁에 방문예약 없이 이용대기 시간 바로 입장데이트연인・배우자
1090062206,초량생갈비,,,저녁에 방문예약 없이 이용대기 시간 바로 입장데이트연인・배우자
1090062206,초량생갈비,,,"저녁에 방문예약 없이 이용대기 시간 바로 입장여행, 일상, 나들이, 가족모임연인・배우자, 부모님"
1090062206,초량생갈비,,,"저녁에 방문예약 없이 이용대기 시간 바로 입장일상아이, 연인・배우자"
1090062206,초량생갈비,,,저녁에 방문예약 없이 이용대기 시간 바로 입장일상연인・배우자
1090062206,초량생갈비,,,"저녁에 방문예약 없이 이용대기 시간 바로 입장일상지인・동료, 친구"
1090062206,초량생갈비,,,"저녁에 방문예약 없이 이용대기 시간 바로 입장친목친구, 지인・동료"
1090062206,초량생갈비,,,저녁에 방문예약 후 이용대기 시간 바로 입장나들이친구
1090062206,초량생갈비,,,"저녁에 방문예약 후 이용대기 시간 바로 입장데이트, 친목, 여행, 일상, 회식, 가족모임연인・배우자, 친구, 지인・동료, 아이, 부모님, 친척・형제"
1090062206,초량생갈비,,,"저녁에 방문예약 후 이용대기 시간 바로 입장데이트, 친목, 여행, 일상, 회식, 가족모임연인・배우자, 친구, 지인・동료, 아이, 부모님, 친척・형제"
1090062206,초량생갈비,,,"저번에 친구랑 방문하고 넘 맛있어서 재방문 했어요! 바쁜데도 직원분들 다 너무 친절하시고 고기 짱 잘 구워주십니다 ㅎㅎ 이 집은 김치찌개가 별미입니당,,🤤🖤🖤"
1090062206,초량생갈비,,,직원분도 친절합니다!! 유명해지지 않길 바라는 맘도 크지만!!!!! 그래도 오래오래 장사가 잘 되길 바라는 마음으로 리뷰씁니다👍🏻
1090062206,초량생갈비,,,직접 담근다고 하셨는데 레시피 훔쳐가고 싶습니당 ㅎㅎ 서비스로 나오는 김치찌개도 넘 맛있어영
1090062206,초량생갈비,,,직접 담근다고 하셨는데 레시피 훔쳐가고 싶습니당 ㅎㅎ 서비스로 나오는 김치찌개도 넘 맛있어영
1090062206,초량생갈비,,,항상 먹어도 맛있습니다~ 양념갈비는 꼭 드셔보세요~ 특제 마 소스가 진짜 잘어울리고 맛있습니다~!
1090062206,초량생갈비,,,항상 먹어도 맛있습니다~ 양념갈비는 꼭 드셔보세요~ 특제 마 소스가 진짜 잘어울리고 맛있습니다~!
1090062206,초량생갈비,,,후 진짜 너무맛있어요 !! 생갈비 양념갈비 다 너무 맛났어요 밑반찬도 너무 맛있었구요
