가게ID,가게명,평점,날짜,리뷰내용
597569164,문래 골목집,,,2인세트로 주문했는데 양도 푸짐하고 밑반찬 구성이 너무 좋았아요!! 다들 너무 친절하시고 평일 저녁인데도 북적북적 하더라구여 그래도 다행히 웨이팅 없이 들어올수 있었어요! 잘먹겠습니당
597569164,문래 골목집,,,3명이서 오리야채불고기 2인분에 볶음밥 먹었어요. 양이 많아서 인원수만큼 시키지 않아도 충분합니다. 치즈날치알볶음밥도 엄청 맛있어요! 서비스로 국밥도 주셨는데 국물이랑 같이 먹으니 더 맛있게 먹었네요.
597569164,문래 골목집,,,가성비 미친 문래 맛집..✨ 방송출연도 많이 하고 이근처에서 넘 유명해서 항상 가보고 싶었는데 드디어 가봤어요 둘이 이인세트 먹었는데 양도 진짜 많고 무엇보다 넘 마싯어요 오감탕은 소주를 계속 시키게 하는 맛 ㅠㅠ ㅋㅋㅋㅋ 볶음밥 치즈추가는 무조건이에여 치즈 지인짜 많이 주십니다 밑반찬고 하나하나 다 맛있고 문래 골목집에서만 마셔볼 수 있는 쌀소주 오늘도 꼭 드셔보세요 은은한 단맛이 너무 좋았어요 ㅎㅎ 매장도 넓어서 회식하기 좋아서 담에 또 갈예정~~ 직원분들도 사장님도 짱짱 친절하세요❣️
597569164,문래 골목집,,,고향집에서 맛볼수있는 파김치와 맛잇는 반찬들 넉넉한 임심까지 추천합니다!! :)
597569164,문래 골목집,,,고향집에서 맛볼수있는 파김치와 맛잇는 반찬들 넉넉한 임심까지 추천합니다!! :)
597569164,문래 골목집,,,"그 이야기를 들은 지인분이 본인도 자주 오는 집이라고 강추하셔서 매일 가봐야지 가봐야지 하고 있던 차에, 남편과 데이트 겸 드디어 와보았네요."
597569164,문래 골목집,,,그리고 맛집에만 있다는 ‘오늘’ 쌀소주 처음 마셔봤는데 알콜향이 엄청 쎄지않고 부드러워서 두병 마시고 왔어요😆
597569164,문래 골목집,,,그리고 맛집에만 있다는 ‘오늘’ 쌀소주 처음 마셔봤는데 알콜향이 엄청 쎄지않고 부드러워서 두병 마시고 왔어요😆
597569164,문래 골목집,,,마지막에 날치알 볶음밥에 치즈는 꼭 추가해서 먹어야 합니다. 진짜 치즈 이렇게 듬뿍주는 곳은 또 처음!!!
597569164,문래 골목집,,,몇년만에 다시 찾은 곳이에요! 세트메뉴가 있어서 한번에 여러가지 맛볼 수 있어서 좋네요 >__<
597569164,문래 골목집,,,"몸보신을 원하는데 장어는 너무 헤비하고, 닭은 좀 라이트할 때 먹기 딱! 좋은 음식들이었습니다 ㅎㅎ 오리불고기는 양이 아주 많았고, 맛도 있었어요! 소불고기에서 더 깔꼼해지는 느낌이랄까?? 그리고 오감탕은 국물이 거의 남원 추어탕처럼 짙어서 아주 좋았습니다 ㅋㅋㅋㅋ 몸보신 잘하고가요!!!"
597569164,문래 골목집,,,"몸보신을 원하는데 장어는 너무 헤비하고, 닭은 좀 라이트할 때 먹기 딱! 좋은 음식들이었습니다 ㅎㅎ 오리불고기는 양이 아주 많았고, 맛도 있었어요! 소불고기에서 더 깔꼼해지는 느낌이랄까?? 그리고 오감탕은 국물이 거의 남원 추어탕처럼 짙어서 아주 좋았습니다 ㅋㅋㅋㅋ 몸보신 잘하고가요!!!"
597569164,문래 골목집,,,"문래 맛집 인정하고 갑니다. 2인세트 먹었는데 오리로스+오감탕+날치알볶음밥 까지 메뉴 구성 알차고 맛있어요! 오리로스 소스도 적당히 달큰하니 맛있고, 양도 푸짐하고, 특히 오감탕 완전 술안주 입니다! 들깨향 가득! 볶음밥도 철판에 오리기름에 볶아서 눌림 가득 맛😊💛"
597569164,문래 골목집,,,문래 맛집에 오려고 하는데 계속 골목집 오리가 떠서 어떤 곳인가 하며 방문했는데 정말 맛있네요! 평일 낮에도 주변에 거주하시는 분들이 많이 방문하신 거 보고 찐 맛집이라고 느꼈습니다ㅎㅎ 문래 오면 또 방문할게요! 잘 먹었습니다!
597569164,문래 골목집,,,세트메뉴에 불고기랑 탕이랑 볶음밥까지 다 나와서 구성이 너무 좋아요! 반찬도 다양하고 다 맛있어서 인기 많은 이유를 알거 같아요 ㅎㅎ
597569164,문래 골목집,,,세트메뉴인데 양도 많고 오리도 신선하고 반찬들도 너무 맛있어요!
597569164,문래 골목집,,,솔직히 오리고기? 정말 관심 밖인 음식이었는데 진짜 놀랬습니다 이렇게 맛있다니 ㅋㅋㅋ 닭이랑 비슷할 줄 알았는데 오히려 육고기랑 비슷한 느낌이고 엄청 담백해서 자주 찾을거같아요!
597569164,문래 골목집,,,아참 쌀소주 직접 만드신 거라던데 깔끔하고 정말 맛있으니 드셔보세요!!
597569164,문래 골목집,,,역시나 오늘도 너무 맛있어요! 이모님들도 친절하시고 이번에 치즈폭탄사리는 처음인데 왜 이제 했을까 싶네요ㅠ 진짜.... 맛있어요🤩
597569164,문래 골목집,,,"오감탕은 국물이 깊었고, 마지막 날치알 치즈볶음밥은 배부른데도 숟가락을 멈출 수 없었습니다 😋"
597569164,문래 골목집,,,"오감탕은 국물이 깊었고, 마지막 날치알 치즈볶음밥은 배부른데도 숟가락을 멈출 수 없었습니다 😋"
597569164,문래 골목집,,,"오늘 처음으로 2인세트 먹었는데 파김치, 양배추문어무침, 가자미무침 등 밑반찬도 겁나 맛있고 메인인 오리불고기 양도 푸짐하고 담백하니 진짜 맛있음😭👍 오감탕 같이 나오는데 오감탕이야 말모~ 감자탕 업그레이드 버전임. 마지막 날치알 볶음밥에 치즈까지 넣으면 엔돌핀 싹 도는 한상차림임🩷"
597569164,문래 골목집,,,오랫만에 방문했는데 2인세트는 가성비가 참 조아요…!!💜 오리불고기에 오감탕에 날치알 볶음밥까지..! 아는맛이 제일 무섭다구 먹으니까 또 입터지는 느낌.. ㅎㅎ 음식 모두 한결같이 맛있고 처음 먹어본 남편도 너무 맛있게 잘먹었어용 :-)
597569164,문래 골목집,,,오리 완전 최고!! 세트메뉴 먹으면 오리탕까지 나옵니다!! 직장인 분들 빨리 오셔서 자리 잡구 세트메뉴 드세요!!
597569164,문래 골목집,,,"오리야채불고기는 양념이 은은하게 배어 있으면서도 고기가 전혀 질기지 않아 먹기 좋았고, 신선한 채소가 함께 어우러져 풍미가 한층 살아났습니다. 특히 오리고기의 고소함과 양념의 조화가 인상적이었습니다."
597569164,문래 골목집,,,오리의 매력이 잘 살아있는 곳. 맛집이라 궁금했는데 납득가는 맛이었어요! 손님도 엄청 많은데도 친절하게 하나하나 잘 챙겨주셔서 감동받았습니다. 맛도 친절도 완벽👍
597569164,문래 골목집,,,"외관부터 맛집포스 뿜뿜!! 오리불고기 2인세트로 먹엇어요😋 밑반찬부터 엄청 다양하게 나와서 골라먹는 재미가 있고요!! 오리불고기도 양이 꽤 많아요🐷 무엇보다.. 오감탕이 정말 마싯..💓 오감탕 9,000원이던데 흑염소탕 안먹어도되겟어요 ㅋㅋㅋㅋ 건강해지는맛이에요!! 몸보신하고싶을 때 재방문할거같아요💓"
597569164,문래 골목집,,,우와 완전 핫플..! 제 입에 넣은게 소고기인지 오리인지 너무 맛있네요! 밑반찬 진짜 튼실하고 세트 구성 좋고 가성비도 좋고 역시 사람 많고 유명한데엔 이유가 있네 확신이 드는 곳이네요. 문래가 아니라 서울오리불고기맛집 찾는 분들이라면 추천하고 싶은 곳입니다.
597569164,문래 골목집,,,"음식도 너무 맛있고, 주말이면 매일 오전에 와서 먹는 맛집입니다 ❤️"
597569164,문래 골목집,,,"음식도 넘 맛있는데, 사장님들이 너무너무 친절하셔서 기분이 너무 좋은게...여기 식당은 진짜 가까웠으면 맨날맨날 왔을거에요ㅠㅠ💖💓"
597569164,문래 골목집,,,이모님들도 친절하시고 오리고기면 느끼할수도 있는데 느끼하지 않고 넘 맛있어요! 그리고 오감탕이 진짜 미친넘… 술을 부르는 맛입니다… 아주 몸보신 제대로 하고 갑니다… 이거 먹으러 문래 찾아올듯~!
597569164,문래 골목집,,,점심에 방문예약 없이 이용대기 시간 10분 이내 친목지인・동료
597569164,문래 골목집,,,점심에 방문예약 없이 이용대기 시간 10분 이내 친목지인・동료
597569164,문래 골목집,,,점심에 방문예약 없이 이용대기 시간 바로 입장가족모임부모님
597569164,문래 골목집,,,점심에 방문예약 없이 이용대기 시간 바로 입장데이트연인・배우자
597569164,문래 골목집,,,점심에 방문예약 없이 이용대기 시간 바로 입장데이트연인・배우자
597569164,문래 골목집,,,점심에 방문예약 없이 이용대기 시간 바로 입장데이트연인・배우자
597569164,문래 골목집,,,점심에 방문예약 없이 이용대기 시간 바로 입장데이트연인・배우자
597569164,문래 골목집,,,점심에 방문예약 없이 이용대기 시간 바로 입장데이트연인・배우자
597569164,문래 골목집,,,점심에 방문예약 없이 이용대기 시간 바로 입장데이트연인・배우자
597569164,문래 골목집,,,점심에 방문예약 없이 이용대기 시간 바로 입장일상혼자
597569164,문래 골목집,,,점심에 방문예약 없이 이용대기 시간 바로 입장일상혼자
597569164,문래 골목집,,,점심에 방문예약 없이 이용대기 시간 바로 입장친목친구
597569164,문래 골목집,,,진짜 사람 많아도 기다려서 먹을만한곳인데 오늘은 웨이팅없이먹었어요! 럭키비키
597569164,문래 골목집,,,진짜 사람 많아도 기다려서 먹을만한곳인데 오늘은 웨이팅없이먹었어요! 럭키비키
597569164,문래 골목집,,,평일 6시 전에 방문하니 웨이팅 없이 입장했어요 저의 또간집 골목집 여전히 넘 맛있구요 직원분들이 정말 친절하셔서 신나게 식사했어요!! 세트로 시켰는데 다음에 오면 오감탕 메인으로 시켜보고 싶습니다! 넘 맛있어여🥹👍👍👍
597569164,문래 골목집,,,풍자 또간집에 나왔던 집이라 와봤는데 일요일 저녁 다섯시반에 왔더니 웨이팅도 없고 바로 들어왔어요
597569164,문래 골목집,,,핫 플레이스라 대기가 좀 있었지만 친절하게 말씀해주셔서 기분좋게 기다렸구 맛나게 먹었습니다 ㅎㅎ
597569164,문래 골목집,,,핫 플레이스라 대기가 좀 있었지만 친절하게 말씀해주셔서 기분좋게 기다렸구 맛나게 먹었습니다 ㅎㅎ
18560835,"부일숯불갈비육류,고기요리",,,"2025년 9월 21일 저녁에 방문하여 1시간 30분 정도 기다린 후 입장하였습니다. 이 집은 돼지갈비(20,000원/300g)를 주문하면 된장찌개와 돼지껍데기를 서비스로 제공합니다."
18560835,"부일숯불갈비육류,고기요리",,,"2인분부터 주문이 가능하며, 고기 주문시 된장찌개와 껍데기가 서비스로 제공된다."
18560835,"부일숯불갈비육류,고기요리",,,6시도 안되고 평일인데 대기까지 하고 이렇게 유명할줄 몰랐어요^^고기가 달지도 않아 좋고 셀프바가 있어서 좋았어요 직원분들도 너무 친절해서 좋았어요 담에또가고싶어요 ^^
18560835,"부일숯불갈비육류,고기요리",,,가게가 진짜 바쁘고 정신없는데 다들 친절하세요!
18560835,"부일숯불갈비육류,고기요리",,,"고기 맛도 좋고, 반찬도 잘 나오고 부모님 모시고 또 오고 싶어요! 노포맛집 b"
18560835,"부일숯불갈비육류,고기요리",,,고기가 그리 특별하진 않습니다 근데 놀란건 이모님들 서비스! 고기 굽는 방법도 알려주시거 시범도 보여주십니다 그리고 차돌된찌 미쳤어요 밥말아서 드시길. 착한 금액에 여러 반찬 찌개 껍데기까지 나오니 인기 많을 수 밖에! 최근에 방송 나와사 줄이 더 길어진듯
18560835,"부일숯불갈비육류,고기요리",,,네시반에 맞춰가니 네시반에 대기 하러 오신 분들은 세시간 기다려야 한다고 돌려보내시더라구요.
18560835,"부일숯불갈비육류,고기요리",,,"넥플릭스 성시경, 마츠시게상 나온거보고 찾아갔어요 가게앞에 테이블링 있어서 걸고 1시간 대기한거 같습니다! 메뉴는 단일메뉴이고 1인분 2만원이예요 게장이랑반찬 서비스이고 반찬이 야채랑 퀄리티가 좋아요~! 냉면은 없고 공기밥 추가만 있구요, 불판은 고기 추가때문 갈아주시니 참고하세요! 친절 서비스에 굉장히 노력하시는거 같아요~~"
18560835,"부일숯불갈비육류,고기요리",,,"대기는 길었지만 친절하시고 양도 적당했어요 갈비맛은 특출난 맛은 아니지만 맛있는 맛이고, 서비스 된장찌개가 예술이에요 이렇게 건더기 알찬 된장찌개 서비스로 처음 받아봐요"
18560835,"부일숯불갈비육류,고기요리",,,"둘이서 돼지갈비 2인분 주문했는데 이모님이 껍데기 서비스 주신다고 해서, 껍데기 나오기 전에 갈비 1인분 더 추가!(부일숯불갈비는 껍데기 2장을 서비스로 줘요😊)"
18560835,"부일숯불갈비육류,고기요리",,,맛있어요 냉방이 잘안되서 좀더웠어요 직원분들 친절하셔셔 넘기분좋아요 ^^
18560835,"부일숯불갈비육류,고기요리",,,"미리 근처에서 테이블링 걸어두고 2시간 정도 기다렸어요. (주말, 토요일 4시 반에 테이블링 걸고 7시 즈음 들어 갔네요) 맛도 좋구, 껍데기, 차돌된찌가 서비스인것이 매우 가성비 좋아요. 집만 가까웠다면 자주 방문 했을텐데 거리가 있어 아쉬웠어요~"
18560835,"부일숯불갈비육류,고기요리",,,미리 예약 방문했어요 바로 불이앙 고기 내어주시고 굽는법도 설명해주셔서 맛있게 먹었습니다~
18560835,"부일숯불갈비육류,고기요리",,,부일갈비만의 비법. 반찬맛잇고 친절하여요. 웨이팅 심해서 두번은 못가겠지만 잘 머거씀니댱
18560835,"부일숯불갈비육류,고기요리",,,부일숯불갈비는 항상 맛있습니다! 달달한 돼지갈비에 된장찌개는 서비스임에도 퀄리티 좋고 술밥해먹으면 소주 한병 순식간에 비워요.
18560835,"부일숯불갈비육류,고기요리",,,서비스로 나오는 차돌 된장찌개는 고기가 듬뿍 들어가 된장찌개의 깊은 맛과 담백함을 느낄 수 있었으며 위에 올라간 냉이의 향긋함까지 느낄 수 있었던 환상적인 된장찌개 껍데기도 서비스로 주시는데 쫄깃쫄깃하면서도 쫀득쫀득한 이집 껍데기까지 모든 게 완벽 그 자체인 식당
18560835,"부일숯불갈비육류,고기요리",,,"성시경도 먹고간 웨이팅 맛집 부일갈비. 예약해서 대기없이 입장 돼지갈비를 시켜 숯불에 노릿노릿 구워요. 간이 딱 적당하게 맛있어요, 새콤 야채와 함께 먹다보면 고기가 순삭. 건더기 푸짐한 된장찌개는 써비스에요. 껍대기는 쫄깃쫄깃 식감 제대로네요 둘이 5인분 클리어했어요. 옛날식 건물이라 화장실은 공용이에요 ㅋ"
18560835,"부일숯불갈비육류,고기요리",,,"양념돼지갈비 숯불에 구운 요맛이 한달에 한번은 꼭 생각나는 맛인듯요 ㅎㅎ 밑반찬 겉절이 게장 다 맛있구요 차돌된찌에, 돼지껍데기까지 안올 이유가 없어서 웨이팅 있어도 영등포오면 먹구가야죠 ^^"
18560835,"부일숯불갈비육류,고기요리",,,여타 돼지갈비 대비 달지 않다는 점과 식어도 부드러움이 유지된다는 점
18560835,"부일숯불갈비육류,고기요리",,,웨이팅이 항상 길어서 정말 오랜만에 방문했어요! ㅠㅠ 여전히 대기는 길지만 항상 너무 친절한 서비스와 변함없는 맛 때문에 또 찾게 되는거같아요! 양념이 세지 않아서 계속 먹기 너무 좋아요! 반찬도 너무 잘나와서 만족스러운 곳입니댜 :)
18560835,"부일숯불갈비육류,고기요리",,,유명하다고 햐서 왓는데 웨이팅이 생각보다 길엇어오 한시간 반? 두시간정도 기다리고 먹엇어요
18560835,"부일숯불갈비육류,고기요리",,,저녁에 방문예약 없이 이용대기 시간 1시간 이상데이트연인・배우자
18560835,"부일숯불갈비육류,고기요리",,,저녁에 방문예약 없이 이용대기 시간 30분 이내데이트연인・배우자
18560835,"부일숯불갈비육류,고기요리",,,저녁에 방문예약 없이 이용대기 시간 30분 이내친목지인・동료
18560835,"부일숯불갈비육류,고기요리",,,저녁에 방문예약 없이 이용대기 시간 바로 입장데이트연인・배우자
18560835,"부일숯불갈비육류,고기요리",,,저녁에 방문예약 없이 이용대기 시간 바로 입장데이트연인・배우자
18560835,"부일숯불갈비육류,고기요리",,,저녁에 방문예약 후 이용대기 시간 1시간 이상나들이연인・배우자
18560835,"부일숯불갈비육류,고기요리",,,"저녁에 방문예약 후 이용대기 시간 2시간 이상데이트, 친목연인・배우자, 지인・동료"
18560835,"부일숯불갈비육류,고기요리",,,저녁에 방문예약 후 이용대기 시간 2시간 이상일상연인・배우자
18560835,"부일숯불갈비육류,고기요리",,,저녁에 방문예약 후 이용대기 시간 2시간 이상일상연인・배우자
18560835,"부일숯불갈비육류,고기요리",,,저녁에 방문예약 후 이용대기 시간 2시간 이상친목지인・동료
18560835,"부일숯불갈비육류,고기요리",,,저녁에 방문예약 후 이용대기 시간 30분 이내데이트연인・배우자
18560835,"부일숯불갈비육류,고기요리",,,저녁에 방문예약 후 이용대기 시간 30분 이내친목친구
18560835,"부일숯불갈비육류,고기요리",,,저녁에 방문예약 후 이용대기 시간 30분 이상일상부모님
18560835,"부일숯불갈비육류,고기요리",,,저녁에 방문예약 후 이용대기 시간 30분 이상일상친구
18560835,"부일숯불갈비육류,고기요리",,,저녁에 방문예약 후 이용대기 시간 바로 입장친목친구
18560835,"부일숯불갈비육류,고기요리",,,점심에 방문예약 없이 이용대기 시간 바로 입장데이트연인・배우자
18560835,"부일숯불갈비육류,고기요리",,,점심에 방문예약 후 이용대기 시간 10분 이내 일상친척・형제
18560835,"부일숯불갈비육류,고기요리",,,점심에 방문예약 후 이용대기 시간 30분 이내데이트연인・배우자
18560835,"부일숯불갈비육류,고기요리",,,점심에 방문예약 후 이용대기 시간 30분 이상데이트연인・배우자
18560835,"부일숯불갈비육류,고기요리",,,주말 오픈 전 미리 방문해서 10시에 웨이팅 거니까 1등이네요ㅋㅋ 11시 반 오픈인데 11시 25분쯤부터 대기번호 불렀어요! 첫 판은 바로바로 굴리면서 구워야해서 친절하게 설명해 주시더라구요. 된찌랑 돼지껍데기는 포함돼서 나오는데 돼지껍데기는 다 먹을때쯤 말하면됩니다!! 돼지갈비 뻔하겠지 생각했는데 여긴 정말 또 다른 맛이네여!! 되게 부드럽고 담백하고 반찬도 다 맛있어요!! 참을수없어서 낮부터 맥주도 한잔 했습니다^^ 넘 맛있어서 또 생각날거같아요ㅠ
18560835,"부일숯불갈비육류,고기요리",,,"지난 주 미친맛집 예고편 보고 매의 눈으로 찾아내 웨이팅 심해지기 전에 다녀오려 도전, 금요일 7:22 도착 24팀 대기 웨이팅 마감, 토요일 5:44 대기 50여팀 ㅎㄷㄷ"
18560835,"부일숯불갈비육류,고기요리",,,"지난번에 갔을 때 제대로 못 먹었는데 돼지갈비 생각나서 16시 30분 맞춰서 갔습니다. 도착은 15시 50분쯤 해서 대기 걸고 16시 45분쯤 입장했어요. 8팀이 앞에.. 나올 때는 31팀... 고기도 진짜 맛있고, 이모가 고기 어떻게 굽는지 친절하게 설명해 주셔서 더 맛있게 먹을 수 있었어요. 돼지껍데기 서비스도 진짜 고소하고~~ 차돌 된장찌개 차돌, 두부 듬뿍 들어가서 재료 아낌없이 넣어주셨더라고요 너무 잘 먹었어요 다음에 또 가야겠네요 #내돈내산"
18560835,"부일숯불갈비육류,고기요리",,,직원분들도 너무 친절하시고 고기부터 반찬 된찌 특히 강추!!! 너무 맛있어용
18560835,"부일숯불갈비육류,고기요리",,,직원분들이 고기 굽는 법을 알려주시고 수시로 잘 굽고 있는지 확인해주세요.
18560835,"부일숯불갈비육류,고기요리",,,"차돌 된장 뚝배기는 기본으로 1개 제공 되는데, 너무 맛있어서 하나 더 추가해서 먹었습니다."
18560835,"부일숯불갈비육류,고기요리",,,처음왔다고 말씀드리니까 구워주시면서 굽는 방법도 잘 알려주셨어요!!
18560835,"부일숯불갈비육류,고기요리",,,토요일 4시에 가게앞 현장 예약으로 38번째였고 하루종일 비가 와서 5시 10분쯤 생각보다 일찍 들어가게된거 같아요 구성부터 맛은 물론 접근성까지 뭐하나 빠짐없이 만족스러웠습니다! 두명이서 4인분에 서비스 껍데기 공기밥 3개까지 배불러도 계속 들어가는 맛이랄까.. 갈비랑 껍데기 게장양념에 찍어드시면 더 완벽하실테니 다들 경험해보세요🥹
18560835,"부일숯불갈비육류,고기요리",,,특히 저희 고기 꾸워주신 안경쓰신 분 하나부터 열까지 설명해주시고 친절하셔서 너무 좋았어요
18560835,"부일숯불갈비육류,고기요리",,,평일 4:30오픈인데 혹시 몰라서 테이블링 일찍(2:30) 등록했어요(2번째). 오픈시간10분전쯤 매장앞에 도착하니까 웨이팅 20팀 정도 있어서 거의 대부분 문 열자마자 입장 가능했던거같아요.
1303929477,상록회관연탄구이 문래점,,,다양하고 조금씩 시켜도 되니까 먹고싶은거 이것저것 다 먹을 수 있는게 너무나도 좋았습니다 굴 시즌되면 굴 뿌시러 오겠습니다 딱대
1303929477,상록회관연탄구이 문래점,,,대하철이라 대하 먹으러 왔는데 조금 웨이팅은 있었지만 고기랑 같이 먹을수 있어서 좋았어요!!
1303929477,상록회관연탄구이 문래점,,,대하철이라 대하 먹으러 왔는데 조금 웨이팅은 있었지만 고기랑 같이 먹을수 있어서 좋았어요!!
1303929477,상록회관연탄구이 문래점,,,돼지 600그램 한 판과 낙지 호롱이 먹고 넘 맛나서 돼지 부위별 추가하려구요 반찬도 넘 좋고 다 맛있네요 또또 오고싶어요
1303929477,상록회관연탄구이 문래점,,,문래에 친구추천으로 고기 먹으러 왔는데 완전 맛있어요~ 양도 많고 종류도 다양해서 이것저것 맛있게 먹었습니다 ! 또올게요 :)
1303929477,상록회관연탄구이 문래점,,,문래에 친구추천으로 고기 먹으러 왔는데 완전 맛있어요~ 양도 많고 종류도 다양해서 이것저것 맛있게 먹었습니다 ! 또올게요 :)
1303929477,상록회관연탄구이 문래점,,,밤에 방문예약 없이 이용대기 시간 바로 입장일상친구
1303929477,상록회관연탄구이 문래점,,,"안녕하세요! 😊 고객님, 저희 상록회관연탄구이 문래점을 방문해주시고 소중한 리뷰까지 남겨주셔서 정말 감사합니다! 연탄불 향 가득한 삼겹살과 쫄깃한 돼지껍데기를 맛있게 드셨다니 정말 기뻐요! 특히 파인애플과 다양한 소스를 곁들여 드시는 꿀팁까지 알려주셔서 감사합니다! 👍 저희 상록회관연탄구이 문래점의 노포 감성 분위기도 만족스러우셨다니 다행이에요! 앞으로도 맛과 서비스 모두 만족하실 수 있도록 최선을 다하겠습니다. 다음에 또 방문해주세요! ❤️"
1303929477,상록회관연탄구이 문래점,,,"안녕하세요! 😊 상록회관연탄구이 문래점에 첫 방문 해주셔서 정말 감사합니다! 저희 문래동 고깃집이 마음에 드셨다니 너무 기뻐요! 특히 소고기 가성비에 만족하셨다니 뿌듯하네요! 👍 다음 방문 의사 10000%라니, 감동이에요! 🙇‍♀️ 저희 상록회관 문래점은 언제나 최고의 맛과 서비스로 고객님들을 맞이할 준비가 되어 있답니다. 문래동에 오시면 꼭 다시 들러주세요! ❤️"
1303929477,상록회관연탄구이 문래점,,,"안녕하세요! 😊 상록회관연탄구이 문래점에 첫 방문 해주셔서 정말 감사합니다! 저희 문래동 고깃집이 마음에 드셨다니 너무 기뻐요! 특히 소고기 가성비에 만족하셨다니 뿌듯하네요! 👍 다음 방문 의사 10000%라니, 감동이에요! 🙇‍♀️ 저희 상록회관 문래점은 언제나 최고의 맛과 서비스로 고객님들을 맞이할 준비가 되어 있답니다. 문래동에 오시면 꼭 다시 들러주세요! ❤️"
