가게ID,가게명,평점,날짜,리뷰내용
1013298273,"한정선 더현대서울점카페,디저트",,,고객님께 맛있는 생과일 찹쌀떡을 제공드리기 위해 노력하고 있는 한정선의 노력을 알아주셔서 감사합니다.
1013298273,"한정선 더현대서울점카페,디저트",,,그런데 과일 상태가 매번 달라요 딱복일 때도 있고 물복일 때도 있어서 좀 아쉬워요
1013298273,"한정선 더현대서울점카페,디저트",,,"대기줄없길래 바로 구매했어요. 6구, 9구 세트로 패키지도 판매하시는데, 이건 맛은 정해져있다고 하더라고요. 먹어보니, 종류별 굵기 사이즈가 좀 차이가 있더라고요. 한입에 먹기 힘든 건 과일이 들어가 있는 것들이었어요. 제가 고른맛 딸기초코, 두바이, 골드망고 2개, 딸기 이렇게 5개 기준, 보냉백 소는 1500원 포함하여 3만원의 비용이 들어갔습니다."
1013298273,"한정선 더현대서울점카페,디저트",,,"대기줄이 있지만 금방빠져요! 두바이모찌, 초코딸기, 통귤모찌 3개 주문. 두바이모찌는 다 아는 그 맛. 초코딸기랑 통귤모찌는 과즙이 팡핑 상큼하게 터지는게 더 살걸 후회했답니다. 나중엔 숙떡딸기도 도전해봐야겠어요. 냠:)"
1013298273,"한정선 더현대서울점카페,디저트",,,두바이찹쌀떡 너무맛있는데요....미쳤어요💚
1013298273,"한정선 더현대서울점카페,디저트",,,"딸기모찌가 먹고 싶어서 줄서서 구매했어요. 주말이라 줄이 좀 있었지만 모두 포장이라 줄은 금방 빠지더라구요. 가격대는 조금 있지만, 딸기 모찌 종류가 다양해서 색다르더라구요. 특시 초코딸기모찌는 생각보다 많이 달지 않아서 꽤 맛있었어요!"
1013298273,"한정선 더현대서울점카페,디저트",,,"매 시즌 맛있으면서 다양한 제품을 제공하기 위해 노력하고 있으니, 이 다음에도 방문해주시면 똑같이 만족하실 수 있도록 신경쓰겠습니다."
1013298273,"한정선 더현대서울점카페,디저트",,,매번 줄을 서 있길래 한 번 구입 해 봤어요 포장이 엄청 고급스러워서 선물용으로 좋은거 같아요
1013298273,"한정선 더현대서울점카페,디저트",,,멜론은 안에 과육이 크게 들어있어서 좋았지만 찹쌀떡이랑은 조금 안 어우러지는 느낌이었어요
1013298273,"한정선 더현대서울점카페,디저트",,,벌써 세번째 방문인 한정선! 시즌별로 패키지가 달라저서 좋아요ㅎㅎ 어르신들 선물하기 딱 좋습니다!
1013298273,"한정선 더현대서울점카페,디저트",,,생과일이 들어 있는 찹쌀떡이예요. 앙금이 많이 달지 않아서 맛있었어요. 마침 줄이 짧아서 사먹을 수 있었어요.
1013298273,"한정선 더현대서울점카페,디저트",,,선물용으로도 손색없을 만큼 고급스러워 보여 9개 세트에 복숭아찹쌀떡을 추가로 구입했어요. 🍑
1013298273,"한정선 더현대서울점카페,디저트",,,소중한 고객님께서 마음을 담아 소중한 지인분께 드리는 선물인데 만족하셨다니 저희로서도 뜻깊은 칭찬임에 틀림없습니다.
1013298273,"한정선 더현대서울점카페,디저트",,,소중한 분에게 마음담긴 선물을 할 때에 무조건 한정선이 생각날 수 있도록 더 힘써보겠습니다.
1013298273,"한정선 더현대서울점카페,디저트",,,시즌 메뉴인 멜론 찹쌀떡이랑 망고 찹쌀떡 먹고 싶었는데 없어서 너무 아쉬웠다는 ㅠㅠ
1013298273,"한정선 더현대서울점카페,디저트",,,예쁘고 포장이 귀여워서 샀는데 맛있어서 깜짝 놀랐어요.
1013298273,"한정선 더현대서울점카페,디저트",,,저녁에 방문예약 없이 이용대기 시간 바로 입장일상연인・배우자
1013298273,"한정선 더현대서울점카페,디저트",,,저녁에 방문포장·배달 이용대기 시간 바로 입장일상혼자
1013298273,"한정선 더현대서울점카페,디저트",,,저녁에 방문포장·배달 이용대기 시간 바로 입장일상혼자
1013298273,"한정선 더현대서울점카페,디저트",,,점심에 방문예약 없이 이용대기 시간 10분 이내 데이트연인・배우자
1013298273,"한정선 더현대서울점카페,디저트",,,점심에 방문예약 없이 이용대기 시간 10분 이내 일상아이
1013298273,"한정선 더현대서울점카페,디저트",,,점심에 방문예약 없이 이용대기 시간 바로 입장데이트연인・배우자
1013298273,"한정선 더현대서울점카페,디저트",,,점심에 방문예약 없이 이용대기 시간 바로 입장일상아이
1013298273,"한정선 더현대서울점카페,디저트",,,"찹쌀과일모찌가 먹어보고 싶어서 포장해서 먹었어요. 딸기, 파인애플, 복숭아 3가지 맛 먹었는데 셋 다 모두 만족!! 떡과 앙금, 과일을 같이 맛 볼 수 있어서 좋습니다"
1013298273,"한정선 더현대서울점카페,디저트",,,한정선만의 노하우로 맛있는 재료들과 함께 만들어 맛이 없을 수가 없는 두바이st찹쌀떡이라고 자부할 수 있는 메뉴인데 다행히 고객님께서 만족하신 것 같아 저희도 정말 기쁩니다.
