가게ID,가게명,평점,날짜,리뷰내용
1987157240,고디바베이커리 더현대서울점초콜릿전문점,,,고디바 쪼꼬 맛난거야 다 알지만 베이커리도 맛집 인정입니다!
1987157240,고디바베이커리 더현대서울점초콜릿전문점,,,고디바 쪼꼬 맛난거야 다 알지만 베이커리도 맛집 인정입니다!
1987157240,고디바베이커리 더현대서울점초콜릿전문점,,,드디어 먹어본 고디바베이커리. 역시나 맛있는데 계산까지 오래 걸럈아요
1987157240,고디바베이커리 더현대서울점초콜릿전문점,,,드디어 먹어본 고디바베이커리. 역시나 맛있는데 계산까지 오래 걸럈아요
1987157240,고디바베이커리 더현대서울점초콜릿전문점,,,드디어 유명한 고디바 베이커리에 와봤어요!! 맛있습니다☺️
1987157240,고디바베이커리 더현대서울점초콜릿전문점,,,드디어 유명한 고디바 베이커리에 와봤어요!! 맛있습니다☺️
1987157240,고디바베이커리 더현대서울점초콜릿전문점,,,"빵은 익히 맛있는거 알지만, 냉장말고 그냥 진열된 빵에 초파리 3 마리나 날아다님... 쇼케이스 뚜껑 있었으면 좋겠어요!"
1987157240,고디바베이커리 더현대서울점초콜릿전문점,,,"빵은 익히 맛있는거 알지만, 냉장말고 그냥 진열된 빵에 초파리 3 마리나 날아다님... 쇼케이스 뚜껑 있었으면 좋겠어요!"
1987157240,고디바베이커리 더현대서울점초콜릿전문점,,,빵을 하나밖에 안 산게 아쉬울정도..다 먹어보고 싶어요!
1987157240,고디바베이커리 더현대서울점초콜릿전문점,,,아이스크림 소라빵 아이스크림은 맛있는데 소라빵은 그냥 그저 그랬어요. 초코크림이 빵이랑 따로 노는 느낌이었고 빵도 약간 메마른 느낌이었어요
1987157240,고디바베이커리 더현대서울점초콜릿전문점,,,여전히 인기많은 고디바베이커리. 케잌남은거 산걸로 만족
1987157240,고디바베이커리 더현대서울점초콜릿전문점,,,와웅~ 달지 않고 진한 초콜렛 맛이 좋아요~ 음료는 부숴 마실 수 있는 크랙으로 드세요! 소라빵 어나더레벨입니다 ^^
1987157240,고디바베이커리 더현대서울점초콜릿전문점,,,"요즘 베이커리는 잼이 속에서 겉으로 나오는 추세인데요. 노티드나 랜디스, 말똥 도넛 같은 속이 꽉찬 크림 도넛이 한풀 꺾이면서 타르트나 페스트리처럼 빵 자체로 승부하거나 빵 표면에 소스를 바르는 쪽으로 옮겨가고 있습니다."
1987157240,고디바베이커리 더현대서울점초콜릿전문점,,,저녁에 방문예약 없이 이용대기 시간 바로 입장일상혼자
1987157240,고디바베이커리 더현대서울점초콜릿전문점,,,점심에 방문예약 없이 이용대기 시간 10분 이내 친목친구
1987157240,고디바베이커리 더현대서울점초콜릿전문점,,,점심에 방문예약 없이 이용대기 시간 30분 이내친목친구
1987157240,고디바베이커리 더현대서울점초콜릿전문점,,,점심에 방문예약 없이 이용대기 시간 30분 이내친목친구
1987157240,고디바베이커리 더현대서울점초콜릿전문점,,,점심에 방문예약 없이 이용대기 시간 바로 입장나들이연인・배우자
1987157240,고디바베이커리 더현대서울점초콜릿전문점,,,점심에 방문포장·배달 이용대기 시간 10분 이내 데이트연인・배우자
1987157240,고디바베이커리 더현대서울점초콜릿전문점,,,"점심에 방문포장·배달 이용대기 시간 30분 이내데이트, 일상연인・배우자"
1987157240,고디바베이커리 더현대서울점초콜릿전문점,,,"점심에 방문포장·배달 이용대기 시간 30분 이내데이트, 일상연인・배우자"
1987157240,고디바베이커리 더현대서울점초콜릿전문점,,,"진짜 몇번이고 둘, 하나, 하나 포장 따로 해달라고 정중하게 부탁했는데… 제가 선물하는 거라 스티커를 떼고 다시 확인 할 수도 없었고 믿고 부탁드렸는데 ㅠㅠ 포장이 원하는 품목으로 안되어서 선물 망했습니다,,, 진짜 환불하고싶은 거 꾹 참았어요….. 포장 똑바로 해주세요…."
1987157240,고디바베이커리 더현대서울점초콜릿전문점,,,카운터 보시는 분 손이 조금만 더 빠르면 좋겠어요. 빵은 굿굿
1987157240,고디바베이커리 더현대서울점초콜릿전문점,,,카운터 보시는 분 손이 조금만 더 빠르면 좋겠어요. 빵은 굿굿
1998484910,런던베이글뮤지엄 여의도베이커리,,2025.07.13,"감자치즈베이글은 쫄깃하고 고소하고, 블루베리는 상큼함 가득! 치즈허니는 달콤하고 담백해서 입맛 저격했어요. 인테리어도 완전 런던 느낌 가득해서 눈도 즐거웠던 방문이었어요☺"
1998484910,런던베이글뮤지엄 여의도베이커리,,,(서울_더현대서울) “런던베이글” 왔으니 트러플머쉬룸스프를 먹어주는 것으로 첫끼!! 배고플때 먹었더니 짜니 안고 괜춘!! 베이글은 바질로.. 웨이팅을 계속 걸어 놓아서.. 후딱 후르륵 하고 이동!!
1998484910,런던베이글뮤지엄 여의도베이커리,,,2. 인테리어는 전점공통이지만 자세히보면 디테일이 달라요. 료대표님 👍
1998484910,런던베이글뮤지엄 여의도베이커리,,,가장 좋아하는 베이글 맛집!!!!🤎🤎 생각보다 웨이팅도 생각보다 빨리 줄어서 더현대 구경하다보면 금방 입장할 수 있어요 :) 감자치즈베이글 최애 원픽🥔🧀
1998484910,런던베이글뮤지엄 여의도베이커리,,,거의 포장하는 경우가 많아 샌드위치나 크림치즈든거보단 기본베이글 선호해서
1998484910,런던베이글뮤지엄 여의도베이커리,,,"금요일 다섯시쯤 방문해서 매장 취식 1시간 정도 웨이팅했습니다. 쪽파프레첼, 프레첼버터, 트러플버터베이글은 매장에서 먹고 소금빵베이글은 포장했어요. 세 가지 중에 프레첼버터 베이글이 가장 맛있었어요. 짭짤한 프레첼 베이글에 큼직한 버터가 아주 잘 어울렸습니다. 쪽파프레첼베이글을 가장 기대했는데 쪽파의 알싸한 맛이 전혀 없더라고요. 부추가 아닌가 싶은 생각이 듭니다. 트러플버터베이글은 트러플 러버가 아니라서 조금 어려운 맛이었습니다. 먹다 남은 거 포장도 가능해서 좋았어요. 베이글을 많이 먹어보진 않아서 모르겠지만 큼직하고 촉촉하고 쫀쫀해서 든든한 한끼로도 손색없을 것 같습니다."
1998484910,런던베이글뮤지엄 여의도베이커리,,,대기등록하고 1시간 40분정도 걸려서 입장한거 같아요. 기다리는동안 아이들과 점심 먹고 차한잔 마시니까 입장시간이 딱 맞았어요. 베이글 좋아하는 아이가 있어 이거 저거 담았는데 못 담아온 베이글이 생각 나네요~^^ 저희는 만장일치로 올리브베이글 진짜 맛있게 먹었어요.
1998484910,런던베이글뮤지엄 여의도베이커리,,,더 현대 평일 폐점 시간 8시 무렵 포장만 가능 조건으로 웨이팅 없이 입장!!
1998484910,런던베이글뮤지엄 여의도베이커리,,,런베뮤 런베뮤하도 유명해서 더현대 온 김에 방문 포장웨이팅만해도 1시간반이 걸림🤣 이것 저것 담다보니 5만원이 훌쩍 넘음😅 토마토 허브 베이글이랑 베이컨 포테이토 샌드위치 먼저 먹었는데 너무 맛있다❤️ 트러플크림치즈도 트러플향 엄청 나서 좋고 웨이팅하길 잘한듯ㅎㅎ 포장웨이팅도 기니 웨이팅 걸어놓고 구경다니는거 추천~
1998484910,런던베이글뮤지엄 여의도베이커리,,,맛있네요 쪽파 베이클도 맛있고 햄들어 있는 것도 맛있고 4개 사왔는데 다음에 가도 꼭 들러 사올 것 같아요. 종류별로 다 먹어보고 싶네요~~
1998484910,런던베이글뮤지엄 여의도베이커리,,,맨날 가보고 싶다고 생각만 했다가 드디어 방문했어요!! 일요일애 갔는데 예약 걸고 더현대 두시간 정도 돌아다니다가 들어갔습니당ㅎㅎㅎ
1998484910,런던베이글뮤지엄 여의도베이커리,,,베스트메뉴인 감자치즈베이글이랑 시나몬 피칸 베이글 + 메이플 피칸 크림치즈 조합으로 먹었는데 둘다 맛있었어요! 커피랑도 잘 먹었습니다~
1998484910,런던베이글뮤지엄 여의도베이커리,,,"베이글 맛집이죠 ! 캐치테이블 등록까지 20분 대기, 입장은 약 40분 대기후 가능 했습니다, 대기중 외국분들도 제법 계셔서 뿌듯(?) 했어요 ㅎㅎ 오늘 먹은 아이중 팥앙금이랑 버터 들어간 게 가장 맛있었습니다, 오전에 가면 그나마 대기가 이정도는 아니예요, 그래도 대기 걸고 다른 일 보고 알람 참고하면 되니 뭐 기다릴 만 합니다, 제주 보다는 매장이 작더라구요, h 포인트 적립은 안됩니다 ! 다음에 또 갈거예요~"
1998484910,런던베이글뮤지엄 여의도베이커리,,,"월요일 점심쯤 방문했더니 대기가 길지 않았어요. 포장이라 그런지 캐치테이블 걸어두고 10분 후 쯤 입장했습니다. 개인적으로 기본 베이글 종류가 맛있어서 올리브, 어니언, 소금빵이랑 스프레드 구입하였는데 맛있습니다!"
1998484910,런던베이글뮤지엄 여의도베이커리,,,웨이팅 등록하는 줄이랑 등록후에 서는 줄이 따로 있어서 줄 잘 보구 등록 먼저 해야 합니다!
1998484910,런던베이글뮤지엄 여의도베이커리,,,"웨이팅이 길다는 이야기를 듣고 주말 오픈런으로 일찍 다녀왔는데, 포장주문하는데 30분정도 기다렸습니다. 앞에 50명정도 있었는데 포장줄은 대기가 생각보다 금새 빠지더라구요 ㅎㅎ"
1998484910,런던베이글뮤지엄 여의도베이커리,,,이번애는 처음으로 토마토 수프도 포장했는데 따뜻한 스프+ 치즈+ 과자까지 잘 챙겨주어서 매장에서와 동일한 맛으로 먹을수 있는듯합니다~~~!!
1998484910,런던베이글뮤지엄 여의도베이커리,,,"잠봉 버터 샌드위치, 쪽파 프레첼 샌드위치, 프레첼 버터 솔트 베이글, 감자 치즈 베이글, 플레인 베이글, 어니언 베이글, 무화과 베이글 샀어요!! 다 맛있습니다 ㅎㅎ 그리거 크림은 메이플 피칸 크림치즈랑 레몬커트 크림치즈로 샀는데, 함께 먹으면 더 맛있어요!! 참고하세요!!"
1998484910,런던베이글뮤지엄 여의도베이커리,,,"전국에서 가장유명한 런던베이글 평일낮에 포장으로 방문했습니다. 앞에 100팀있었는데 50분만에 들어갈수있었어요. 정말 너무너무 맛있었고요, 쪽파 베이글 강추드립니다. 기다리는동안 어디가야할지, 그리고 런던베이글 포장후에 어디가야할지 고민이시라면 코스로 행2PM8PM 을 추천드립니다. 베이글 음식싸가져갈수도있고, 간단히 기다리면서 맥주나 음료한잔할수도 있고 공간도 넓어서 좋았어요"
1998484910,런던베이글뮤지엄 여의도베이커리,,,점심시간에 매장 내 취식으로 13번째 뜨길래 곧 들어가겠지 싶었는데..80분 후에 들어갔습니다. 역시 쉽지않은 런베... 하지만 남편이랑 귀여운 마굿간에서 폭신폭신한 베이글을 먹고 있자니 너무 좋으네요🐴🌿
1998484910,런던베이글뮤지엄 여의도베이커리,,,점심에 방문예약 없이 이용대기 시간 30분 이내나들이친척・형제
1998484910,런던베이글뮤지엄 여의도베이커리,,,"점심에 방문예약 없이 이용대기 시간 바로 입장일상, 여행혼자, 친구"
1998484910,런던베이글뮤지엄 여의도베이커리,,,점심에 방문예약 후 이용대기 시간 10분 이내 데이트연인・배우자
1998484910,런던베이글뮤지엄 여의도베이커리,,,주변 좀 돌고 오니 음료도 서비스해주고 직원들도 다 친절모드인듯~
1998484910,런던베이글뮤지엄 여의도베이커리,,,지방에서 여행온김에 유명한 런던베이글은 꼭 가봐야지 하고 와서 웨이팅 30분좀 넘게 하고 입장 했어요 내부 인테리어도 이쁘고 빵은 포장해서 나왔구요 소금빵베이글.어니언.치즈 그리고 크림치즈랑 구매했어요 쫀득쫀득 하고 넘 맛있어서 순삭해버렸어요🤎마켓컬리에도 있길래 여행다녀와서 시켜먹었는데 포장도 깔끔하고 동일한 맛이였어요🫶🏻
1998484910,런던베이글뮤지엄 여의도베이커리,,,직원들꺼까지 베이글셔틀 해서 다들 행복한 주말 될거같네요.
1998484910,런던베이글뮤지엄 여의도베이커리,,,"치즈감자, 브릭레인샌드위치, 치즈허니베이글, 머쉬룸스프는 매장에서 취식하고 플레인베이글은 포장했어요."
1998484910,런던베이글뮤지엄 여의도베이커리,,,캐치테이블로 매장취식 웨이팅 걸어서 2시간 좀 넘게 기다리다가 말씀드리고 포장으로 변경했더니 금방 들어갈 수 있었어요
1998484910,런던베이글뮤지엄 여의도베이커리,,,포장 웨이팅 걸고도 30분이상 기다렸지만 그만한 가치가 있는 곳.. 맛있게 잘 먹었어요^^
1998484910,런던베이글뮤지엄 여의도베이커리,,,포장은 대기없이 바로입장가능합니다ㅎㅎ
1350020939,리버브루카페,,,"가격이 합리적이고 음료도 괜찮아요 한강공원에서 마실 음료가 필요하거나, 간단하게 하이볼 한 잔 하고 싶으신 분들께 추천드리는 테이크아웃 음료가게예요!"
1350020939,리버브루카페,,,기분이 좋진 않았어요 바쁜데 친절하게 응대하는거 진짜 어려운거 아는데 그래도 다음번엔 친절하게 응대해주시면 좋겠어요 ! 그래도 음료맛은 맛있었으니깐 다음에 재방문할게요 ! 더운날씨 음료제조해주셔서 감사드려요 =)
1350020939,리버브루카페,,,날이 너무 좋아서 점심만 먹고 그냥 돌아가기 아쉬워서 산책 시작~~~
1350020939,리버브루카페,,,더현대 들렸다가 카페 알아보다가 우연히 알게 되었는데
1350020939,리버브루카페,,,"리버브루는 접근성이 좋아서 들르기 편했음. 아이스 아메리카노는 가격대비 깔끔했고 산미가 강하지 않아 부담 없이 마시기 좋았음. 매장 분위기는 단정하고 좌석 간격도 넉넉해 여유롭게 앉기 괜찮았음. 주문과 정리가 셀프 방식이라 간단하지만, 컵 분리배출은 조금 번거로웠음. 전체적으로 편하게 커피 한잔하기 좋은 공간이었음."
1350020939,리버브루카페,,,메뉴종류도 많고 알콜 논알콜도 있어서 죠아요
1350020939,리버브루카페,,,상하목장 아이스크림이라 오레오 아이스크림 주문해서 먹었는데 맛있어요 :)
1350020939,리버브루카페,,,아침에 방문예약 없이 이용대기 시간 바로 입장일상반려동물
1350020939,리버브루카페,,,아침에 방문예약 없이 이용대기 시간 바로 입장일상혼자
1350020939,리버브루카페,,,여의나루 한강공원 가기 전 마지막 카페~! 앉아있는 공간 널찍하고 깔끔해서 좋았어요 상하목장 아이스크림 주문해서 먹었는데 무난하니 맛있었습니다
1350020939,리버브루카페,,,"여의도 고구마런 뛰고 갔는데, 매장이 넓고 시원해서 좋았어요!!!"
1350020939,리버브루카페,,,저녁에 방문예약 없이 이용대기 시간 바로 입장
1350020939,리버브루카페,,,저녁에 방문예약 없이 이용대기 시간 바로 입장일상혼자
1350020939,리버브루카페,,,"저녁에 방문예약 없이 이용대기 시간 바로 입장친목연인・배우자, 아이"
1350020939,리버브루카페,,,점심에 방문예약 없이 이용대기 시간 바로 입장
1350020939,리버브루카페,,,점심에 방문예약 없이 이용대기 시간 바로 입장
1350020939,리버브루카페,,,"점심에 방문예약 없이 이용대기 시간 바로 입장나들이, 일상아이"
1350020939,리버브루카페,,,점심에 방문예약 없이 이용대기 시간 바로 입장데이트연인・배우자
1350020939,리버브루카페,,,점심에 방문예약 없이 이용대기 시간 바로 입장데이트연인・배우자
1350020939,리버브루카페,,,점심에 방문예약 없이 이용대기 시간 바로 입장데이트연인・배우자
1350020939,리버브루카페,,,점심에 방문예약 없이 이용대기 시간 바로 입장비즈니스지인・동료
1350020939,리버브루카페,,,점심에 방문예약 없이 이용대기 시간 바로 입장일상친구
1350020939,리버브루카페,,,점심에 방문예약 없이 이용대기 시간 바로 입장일상혼자
1350020939,리버브루카페,,,점심에 방문예약 없이 이용대기 시간 바로 입장친목친구
1350020939,리버브루카페,,,주문받는 직원 분 서비스 마인드가 아쉽네요. 서비스 교육을 받았는지 모르겠습니다. 동네주민인데 음료가 잘못나와 헛걸음을 했는데 ‘잠시만요 다시 해드릴게요’ 하시더니 다른 직원 시키더군요. 그럴땐 사과가 우선입니다. 원래 리뷰 안남기는데 어이가 없어서 남깁니다.
1350020939,리버브루카페,,,"처음 온 곳인데 커피 진짜 맛있음요,, 엄마는 디카페인 저는 라떼 마셨는데 둘 다 각자꺼 완전 만족했습니닼ㅋㅋㅋ ㅠㅠ 무인카페같은 느낌이예요"
1350020939,리버브루카페,,,커피 맛은 그럭저럭 가격대비 나쁘지않음. 커피 주문공간과 마시는 공간이 분리되어있어서 특이함. 직원들은 다소 불친절
1350020939,리버브루카페,,,타임스퀘어 가는 길에 사람이 많아서 아메리카노와 라떼를 테이크아웃 했어요.
1350020939,리버브루카페,,,헤이즐넛 아메리카노 맛있었어요. 취식공간이 따로 분리되어 있어서 특이하네요!
2047296622,멜로드도산 더현대 서울점,,,결혼축하케이크를 예약주문했는데 색상과 디자인이 너무 마음에 들어서 바로 예약했어요❣️
2047296622,멜로드도산 더현대 서울점,,,결혼축하케이크를 예약주문했는데 색상과 디자인이 너무 마음에 들어서 바로 예약했어요❣️
2047296622,멜로드도산 더현대 서울점,,,"그러다 멜로드 발견했는데, 비주얼 예쁘고 레터링 감성 제대로, 가격도 훨~씬 합리적이라 바로 주문했어요."
2047296622,멜로드도산 더현대 서울점,,,기념일 케이크 맛있게 먹겠습니다~~ 이쁜 케이크들이 많네요!!
2047296622,멜로드도산 더현대 서울점,,,기념일을 맞이하여 급하게 방문 했는데 멜로드도산 케이크가 생겨서 만족스럽게 구매하고 갑니다. 너무 큰 케이크는 한번에 다 못먹어서 작은크기의 케이크를 찾고 있었는데 크기도 딱이고 귀여워서 좋았어요! 안은 망고시트라고 하니 기대됩니다😁
2047296622,멜로드도산 더현대 서울점,,,기념일을 맞이하여 급하게 방문 했는데 멜로드도산 케이크가 생겨서 만족스럽게 구매하고 갑니다. 너무 큰 케이크는 한번에 다 못먹어서 작은크기의 케이크를 찾고 있었는데 크기도 딱이고 귀여워서 좋았어요! 안은 망고시트라고 하니 기대됩니다😁
2047296622,멜로드도산 더현대 서울점,,,너무 친절하시고 케잌도 예쁩니다!! 선물하기 좋아서 다시 올거 같아요 ㅎㅎ
2047296622,멜로드도산 더현대 서울점,,,너무 친절하시고 케잌도 예쁩니다!! 선물하기 좋아서 다시 올거 같아요 ㅎㅎ
2047296622,멜로드도산 더현대 서울점,,,부모님 생신케이크로 알아보다가 처음 주문했는데 케이크 디자인들이 흔하지 않고 이색적이라 선물로 준비하기 정말 좋은것같아요!
2047296622,멜로드도산 더현대 서울점,,,생신케이크 준비로 구매했습니다. 유기농밀에 우유생크림100프로라 믿음이 갑니다. 축하때 잘 사용하겠습니다.
2047296622,멜로드도산 더현대 서울점,,,생일케이크 샀어요 예쁜 케이크 많이서 기분 좋네요!
2047296622,멜로드도산 더현대 서울점,,,생일케이크 샀어요 예쁜 케이크 많이서 기분 좋네요!
2047296622,멜로드도산 더현대 서울점,,,생화케이크가 넘 예뻐요! 디자인도 다양하고 맛도 다양하네요. 선물 받은 사람이 정말 좋아 할 것 같아요.
2047296622,멜로드도산 더현대 서울점,,,아빠 환갑으로 케잌 구매했어요 ㅎㅎ 예뻐서 맘에 듭니다!!!!!
2047296622,멜로드도산 더현대 서울점,,,이 가격에 생과일까지 들어있는 예쁜 케이크를 발견했어요!
2047296622,멜로드도산 더현대 서울점,,,이 가격에 생과일까지 들어있는 예쁜 케이크를 발견했어요!
2047296622,멜로드도산 더현대 서울점,,,저녁에 방문예약 없이 이용대기 시간 바로 입장데이트연인・배우자
2047296622,멜로드도산 더현대 서울점,,,저녁에 방문예약 없이 이용대기 시간 바로 입장데이트연인・배우자
2047296622,멜로드도산 더현대 서울점,,,점심에 방문예약 후 이용대기 시간 바로 입장
2047296622,멜로드도산 더현대 서울점,,,점심에 방문예약 후 이용대기 시간 바로 입장기념일친구
2047296622,멜로드도산 더현대 서울점,,,점심에 방문예약 후 이용대기 시간 바로 입장기념일친구
2047296622,멜로드도산 더현대 서울점,,,점심에 방문예약 후 이용대기 시간 바로 입장기념일친구
2047296622,멜로드도산 더현대 서울점,,,점심에 방문예약 후 이용대기 시간 바로 입장데이트연인・배우자
2047296622,멜로드도산 더현대 서울점,,,점심에 방문예약 후 이용대기 시간 바로 입장데이트연인・배우자
2047296622,멜로드도산 더현대 서울점,,,점심에 방문예약 후 이용대기 시간 바로 입장친목친구
2047296622,멜로드도산 더현대 서울점,,,친구 브샤때 쓸 케이크 찾다 발견했는데 케이크 종류 다 너무 예뻐서 뭐 할지 고민이 많았네용! 이틀전에 예약되고 제가 무슨맛 할지 못골랐었는데 따로 연락주셔서 예약 잘하고 픽업 잘했습니다♡♡
2047296622,멜로드도산 더현대 서울점,,,케이크 너무 예쁘고 예약도 편리하고 직원분도 너무 친절하세요! 매달 다른 디자인 나오는 것도 좋아요
2047296622,멜로드도산 더현대 서울점,,,케이크 너무 예쁘고 예약도 편리하고 직원분도 너무 친절하세요! 매달 다른 디자인 나오는 것도 좋아요
2047296622,멜로드도산 더현대 서울점,,,특별한날 특별함 케익을 선물하고 싶어서 구매했어요 받는 사람이 기분 좋을 케익 같아요
2047296622,멜로드도산 더현대 서울점,,,특별한날 특별함 케익을 선물하고 싶어서 구매했어요 받는 사람이 기분 좋을 케익 같아요
1875023937,브로트아트 여의도 본점,,,"두 번째 방문이에요! 이번에도 사과파이를 노렸지만 실패했습니다ㅠ 다음주에 삼고초려 하러 갈 거예요ㅠ 마감 30분 전쯤 간 것 같은데, 그래도 리우에게 샌드위치가 두세개 남아있더라구요! 처음 먹어보는 리우에게.. 세상에 너무 맛있었어요!! 대파빵도 파 향 풍미 너무 좋고.. 무엇보다.. 아니 뇌물로 주신 브레첼 크기 좀 봐요!! 그리고 맛도 좋아서 깜짝놀랐잖아요?! 저 브레첼 안 좋아한다고 생각해서 아예 여기서도 사먹어볼 생각을 안 하고 있었는데, 그냥 제가 맛있는 브레첼을 못 먹어본 거였다... 이거.. 맛있는 빵이구나..."
1875023937,브로트아트 여의도 본점,,,"두번째 방문이고, 멀리서 찾아와서 빵 구매했습니다:)"
1875023937,브로트아트 여의도 본점,,,무화과 케이크가 유명해서 왔는데 복숭아도 너무 맛있어보이네요. 사장님이 독일빵 달인이시더라구요! 다음에는 빵도 사봐야겠어요
1875023937,브로트아트 여의도 본점,,,무화과 케이크가 유명해서 왔는데 복숭아도 너무 맛있어보이네요. 사장님이 독일빵 달인이시더라구요! 다음에는 빵도 사봐야겠어요
1875023937,브로트아트 여의도 본점,,,빵 종류도 많고 다 너무 맛있어보여요💕 매장도 깔끔하고 친절해서 좋습니당!!
1875023937,브로트아트 여의도 본점,,,빵 종류도 많고 다 너무 맛있어보여요💕 매장도 깔끔하고 친절해서 좋습니당!!
1875023937,브로트아트 여의도 본점,,,빵 종류도 많고 샌드위치도 있어서 사서 공원에서 먹기 딱이에요! 😛🥪
1875023937,브로트아트 여의도 본점,,,빵 종류도 많고 샌드위치도 있어서 사서 공원에서 먹기 딱이에요! 😛🥪
1875023937,브로트아트 여의도 본점,,,"빵이 담백 고소한게 많아서 좋아요. 휘낭시에, 컵케익도 디저트로 넘 맛있어요."
1875023937,브로트아트 여의도 본점,,,"빵이 담백 고소한게 많아서 좋아요. 휘낭시에, 컵케익도 디저트로 넘 맛있어요."
1875023937,브로트아트 여의도 본점,,,빵이 맛있구 직원분들이 친절해요 !! 여의도 더현대 카페 말구 여기로 왔는데 만족합니당 🩷 데이트나 친구들 만나는 데 좋을 것 같아요
