가게ID,가게명,평점,날짜,리뷰내용
1024716440,팡즈,,,항상 웨이팅길어서 쳐다만보다가 맘잡고 먹으러왔는데 너무맛있게 잘먹었습니다! 유포면도 무슨맛일까 항상 궁금했는데 진짜 맛있더라구요...근데 인스타에서처럼 기름 팔팔 끓는거 붓는 퍼포먼스 있는줄알았는데 없어서 아쉬웠습니다ㅠ
1024716440,팡즈,,,항상 웨이팅길어서 쳐다만보다가 맘잡고 먹으러왔는데 너무맛있게 잘먹었습니다! 유포면도 무슨맛일까 항상 궁금했는데 진짜 맛있더라구요...근데 인스타에서처럼 기름 팔팔 끓는거 붓는 퍼포먼스 있는줄알았는데 없어서 아쉬웠습니다ㅠ
1024716440,팡즈,,,항상 웨이팅길어서 쳐다만보다가 맘잡고 먹으러왔는데 너무맛있게 잘먹었습니다! 유포면도 무슨맛일까 항상 궁금했는데 진짜 맛있더라구요...근데 인스타에서처럼 기름 팔팔 끓는거 붓는 퍼포먼스 있는줄알았는데 없어서 아쉬웠습니다ㅠ
1024716440,팡즈,,,홍콩식 토스트는 싱가포르 현지에서 아침에 먹은 그 유명 맛집이 생각나요. 카야잼이 고소하고 연유가 달달한게 조합이 참 훌륭!
1787691072,한양중식 문정점,,,10주년 이벤트로 세트메뉴 시키면 이과도주 주고 차돌짬뽕이랑 쇠고기짜장이 진짜 여기 주변에서 탑3 듭니다.
1787691072,한양중식 문정점,,,또 방문해 주시길 기다리며 다시한번. 감사합니다!😘😘시원한 가을 보내시길
1787691072,한양중식 문정점,,,매우 맛있었어요!! 세트 메뉴 라서 혹시나 했는데 탕수육은 완전 바삭 육즙 가득 이었고!! 짬뽕은 차돌이랑 삼선 둘다 맛 있었요 ㅠㅠ 양이 많아서 다 먹는데 힘들었요!!!
1787691072,한양중식 문정점,,,"문정역 근처 한양중식 문정점에서 저녁 식사를 하고 왔는데요 😊 분위기 좋은 인테리어 덕분에 데이트하기도 좋고, 가족 모임하기에도 딱 알맞은 곳이었어요. 저희는 한양세트로 사천탕수육, 차돌짬뽕, 삼선짬뽕을 맛봤는데 모두 만족스러웠습니다. 사천탕수육은 바삭한 튀김에 매콤한 소스가 조화를 잘 이루었고, 차돌짬뽕은 불맛 가득한 국물에 차돌의 풍미가 더해져 국물 맛이 깊었어요. 삼선짬뽕은 푸짐한 해산물 덕분에 시원하면서 깔끔한 맛이 돋보였습니다. 룸 예약이 가능하고 당일 예약도 편리해서 단체 모임 자리에도 잘 맞겠더라구요. 주말에는 브레이크 타임 없이 운영해 언제든 방문하기 좋아서 문정역 중식 맛집으로 기억에 남을 만한 곳이었습니다 👍"
1787691072,한양중식 문정점,,,방문 감사드리며 다음에 재방문 해주시면 더욱 친절하고 맛있는 서비스 및 음식으로 준비해드리겠습니다^____^고객님 리뷰 정말 감사드립니다!정말 푸짐한 한양중식이죠 ㅎㅎ항상기본에 충실하도록 하겠습니다🥰🥰저희 한양중식은 항상 신선한 재료로 고객님이 주문하시는 즉시 조리합니다!항상 합리적인 가격으로 최고의 맛을 위해 노력하는 한양중식이 되겠습니다!앞으로도 많은 방문 부탁드려요~~6월
1787691072,한양중식 문정점,,,"서울 한양중식은 새우볶음밥, 크림새우, 짬뽕 등이 특히 맛있다는 평이 많으며 전반적으로 깔끔하고 모던한 분위기를 갖춘 중식당입니다. 양이 넉넉하고 가격 대비 만족도가 높아 점심 식사 장소로 인기가 있습니다. 친절한 서비스와 청결한 내부도 긍정적인 평가를 받습니다. 실제 먹어보니 리뷰보다 더 맛있어서 적극 추천합니다"
1787691072,한양중식 문정점,,,"소중한 시간에 저희 한양 중식을 선택해주신 마음에 보답할 수 있도록, 앞으로도 변함없이 맛과 정성을 담아 준비하겠습니다."
1787691072,한양중식 문정점,,,"소중한 시간에 저희 한양 중식을 선택해주신 마음에 보답할 수 있도록, 앞으로도 변함없이 맛과 정성을 담아 준비하겠습니다."
1787691072,한양중식 문정점,,,"소중한 시간에 저희 한양 중식을 선택해주신 마음에 보답할 수 있도록, 앞으로도 변함없이 맛과 정성을 담아 준비하겠습니다."
1787691072,한양중식 문정점,,,"소중한 시간에 저희 한양 중식을 선택해주신 마음에 보답할 수 있도록, 앞으로도 변함없이 맛과 정성을 담아 준비하겠습니다."
1787691072,한양중식 문정점,,,"소중한 시간에 저희 한양 중식을 선택해주신 마음에 보답할 수 있도록, 앞으로도 변함없이 맛과 정성을 담아 준비하겠습니다."
1787691072,한양중식 문정점,,,"소중한 시간에 저희 한양 중식을 선택해주신 마음에 보답할 수 있도록, 앞으로도 변함없이 맛과 정성을 담아 준비하겠습니다."
1787691072,한양중식 문정점,,,"소중한 시간에 저희 한양 중식을 선택해주신 마음에 보답할 수 있도록, 앞으로도 변함없이 맛과 정성을 담아 준비하겠습니다."
1787691072,한양중식 문정점,,,앞으로도 맛있는 식사와 친절한 서비스로 보답하도록 하겠습니다!
1787691072,한양중식 문정점,,,앞으로도 맛있는 식사와 친절한 서비스로 보답하도록 하겠습니다!
1787691072,한양중식 문정점,,,"이렇게 더운 날에 귀한 발걸음 해주시고, 정성스러운 리뷰까지 남겨주셔서 정말 감사합니다 :)"
1787691072,한양중식 문정점,,,저녁에 방문예약 없이 이용대기 시간 바로 입장데이트연인・배우자
1787691072,한양중식 문정점,,,저녁에 방문예약 없이 이용대기 시간 바로 입장친목연인・배우자
1787691072,한양중식 문정점,,,저번엔 친구랑 와서 잘 먹었는데 이번엔 가족끼리 방문했어요! 룸에서 대화하기도 편하고 음식도 맛있어서 좋은 시간 보내고 왔습니다! 음식이 하나하나 다 맛있고 푸짐해요👍🏻 특히 시리얼새우 진짜 맛있어요!! 또 먹고 싶어서 재방문 예정입니다 :) 인테리어도 이쁘고 사장님도 친절해서 기분 좋은 식사 시간이였습니다🫶🏻
1787691072,한양중식 문정점,,,전체적으로 깔끔한 맛이고 중식인데도 속이 더부룩하거나 느끼함이 전혀없어요!! 진짜 맛있게 먹었고 특히 씨리얼새우?? 너무맛있어요.. 시그니처메뉴같은데 다음에가면 저것만 메인으로 더 주문하려구요!!!!
1787691072,한양중식 문정점,,,항상 줄 서있고 햇는데 !! 추석연휴라 나이스하게 들어왔어요 먹어보고 존맛이네요 짬뽕국물 쌈뽕하고 짜장면도 짜지않고 맛있어요!!!
1573694859,형제애,,,고기짬뽕밥은 진한 국물과 부드러운 고기가 듬뿍 들어 있어 든든했습니다.
1573694859,형제애,,,"남자친구와 소문 듣고 찾아간 형재애는 정말 기대 이상이었어요! 저희가 시킨 짬뽕은 국물부터 달랐어요. 단순하게 맵기만 한 게 아니라, 깊고 시원하면서도 깔끔한 얼큰함이 일품이었습니다. 채소에서 우러나온 감칠맛이 정말 진해서, 남자친구랑 저랑 국물 한 방울도 남기지 않고 싹 비웠답니다. 면발도 불지 않고 끝까지 탱글탱글해서 식감이 너무 좋았고요. 매장 분위기도 깔끔하고 쾌적했고, 직원분들까지 친절하셔서 기분 좋은 데이트 식사를 마무리했습니다. 형재애는 단순한 중식당이 아니라, 푸짐하고 신선한 재료로 만든 훌륭한 한 끼를 경험할 수 있는 곳이에요! 다음번엔 꼭 간짜장도 먹어보자고 약속했어요! 강력 추천합니다! 👍🏻"
1573694859,형제애,,,닭고기인줄 알았어요 그만큼 너무 부드럽고 맛있었습니다ㅎㅎ 짜장면은 새우가 실하고 불향이 많이 나서 간이 잘되있습니다~ 또 방문할게요😊👍👍
1573694859,형제애,,,덜맵게부탁드린짬뽕은 전설의레전드 세계평화급이었고 가지만두는 우주정복급이었다 진짜 맛있다
1573694859,형제애,,,두번째 방문인데 남자친구랑 일주년기념으로 왔는데 두번째도 역시나 최고네요
1573694859,형제애,,,맛집이라고 오픈런햇어요 아입맛이 까탈스러워서 이거저거 요청햇는데 다들어주셧어요. 고기도 가득들어잇고 친절하시고 리뷰대로. 맛집이네요👍👍👍
1573694859,형제애,,,먼저 와본 남편이 맛집이라 해서 따라와봤는데;; 미쳤네요;;;; 너무 맛있어요. 요리 엄청 다양하고 다 맛있는데 가지만두는 진짜 꼭 시켜 드세요. 다만 바에 앉아서 먹었는데 오픈 키친이라 약간 정신은 없아요ㅜㅜㅋㅋㅋ 대신 맛이 다 용서되는 맛... JMT... 자주 올것 같아요
1573694859,형제애,,,메뉴 다 맛있고 넘 친절하시네요 매장이 깔끔해서 더 좋아요😉
1573694859,형제애,,,모든메뉴가 맛있지만 크림짬뽕+면추가 탕수육 집에가서도 생각나는 맛이에요! 예약하고 단체로 오기도 좋아서 모임 할 때 종종 오게되네요. 잘 먹고갑니다!
1573694859,형제애,,,모임자리로 너무 좋아요:) 음식도 매장도 깔끔해서 좋아요!!해물누룽지꼭시키세요 !!!
1573694859,형제애,,,"바 테이블 있어서 커플들 혹은 2,3인 방문하기 좋은거 같아요. 성업하세요!💍"
1573694859,형제애,,,방이동 최강요리집. 형재애 완전강추. 마파두부에 명품 연태고량 찐 맛집입니다. 줄서서 먹는 맛집이고 자주가는곳이라 찐강추합니다. 요리사 대여섯분 너무 대단해요
1573694859,형제애,,,방이동 최애 맛집이에용 ㅎㅎㅎ 이동네에 친구들 델꼬 올 때마다 항상 형재애를 소개시켜 줄 정도로 진짜 제가 자주오고 애정하는 곳입니다! 탕슉이랑 크림짬뽕탕은 꼭 드세요!
1573694859,형제애,,,방이동 최애 중식요리맛집. 그중에서도 xo팔보채 완전최애. 팔보채에 연태고량에 주말 부위기 완전 업됐습니다. 한달에 두번 반드시 오는 맛집
1573694859,형제애,,,방이동 혼술하기에도. 모임하기에도 대박좋은 중국요리 맛집. 엄청자주가는 술집입니다. 최고에요
1573694859,형제애,,,방이먹자에서 중식에 술 한 잔 땡길 때에는 여기가 최고입니다!! 당연 음식도 넘 맛있어요
1573694859,형제애,,,비오는 날에는 역시 뜨끈한 국물이죠 차돌이랑 불맛 가득 나는 짬뽕 아주 잘 먹고갑니다
1573694859,형제애,,,"소문듣고 방문했는데 정말 맛있네요. 짜장면, 짬뽕에 감동받을꺼라고 상상도 못했는데 정말 감동 그자체입니다!!! 조만간 다른 메뉴들도 맛보러 갈꺼예요🤗 강추👍🏻"
1573694859,형제애,,,어향동고도 먹고 싶었는데 ㅠㅠ 아숩... 분위기도 좋아서 그런지 음식이 더 맛있던 것 같아요!
1573694859,형제애,,,예약후 방문했습니다. 직원분들이 엄청 친절해서 대접받는 분위기이구요. 음식이 원래 맛있는데 더 맛있네요.. 오늘도 형제애~
1573694859,형제애,,,우연히 들른 곳이었는데 완전 맛집이었어요. 술을 부르는 집입니다. 분명 아는 메뉴인데 메뉴마다 이집만의 킥이 있어서 입맛을 당깁니다. 분위가도 좋고 직원분들도 너무 친절하셔서 덕분에 즐거운 시간 보냈습니다~~~
1573694859,형제애,,,일단 독특한 술이 너무 매력적이고 안주의 간이 너무 적절해요! 바 같지만 요리주점이면서도 요즘 핫한 플레이스 분위기 뿜뿜!! 또올래요~ 회식 장소 추천이요!!
1573694859,형제애,,,"자주찾는 방이동 최강 중국식 맛집. 형재애..오늘도 왔어요. 네번째방문인데 양장피, 팔보채, 짬뽕탕..모두 맛있어요. 가지튀김도 대박 맛돌이라 자주 찾는답니다."
1573694859,형제애,,,자주찾는 형재애. 방이동 최고맛집이라고 생각해요. 오늘도 중국술과 짬뽕탕으로 하루노고 씻어요. 늘 잘먹고갑니다
1573694859,형제애,,,저녁에 방문예약 없이 이용대기 시간 바로 입장데이트연인・배우자
1573694859,형제애,,,저녁에 방문예약 없이 이용대기 시간 바로 입장데이트연인・배우자
1573694859,형제애,,,저녁에 방문예약 후 이용대기 시간 10분 이내 데이트연인・배우자
1573694859,형제애,,,저녁에 방문예약 후 이용대기 시간 바로 입장친목지인・동료
1573694859,형제애,,,저녁에 방문예약 후 이용대기 시간 바로 입장친목지인・동료
1573694859,형제애,,,전에 지인이랑 오고 너무 맛있어서 남자친구랑 재방문 했어요! 처음으로 버크셔k탕수육이랑 쟁반짜장을 주문했는데 역시나 너무 맛있네요🤤 형제애 모임으로도 지인 대접으로도 짱 추천합니다!!👍🏻👍🏻
1573694859,형제애,,,"점심에 방문예약 없이 이용대기 시간 바로 입장가족모임아이, 연인・배우자"
1573694859,형제애,,,점심에 방문예약 없이 이용대기 시간 바로 입장데이트연인・배우자
1573694859,형제애,,,점심에 방문예약 없이 이용대기 시간 바로 입장데이트연인・배우자
1573694859,형제애,,,점심에 방문예약 없이 이용대기 시간 바로 입장데이트연인・배우자
1573694859,형제애,,,점심에 방문예약 없이 이용대기 시간 바로 입장비즈니스지인・동료
1573694859,형제애,,,점심에 방문예약 후 이용대기 시간 바로 입장데이트연인・배우자
1573694859,형제애,,,점심에 방문예약 후 이용대기 시간 바로 입장친목친구
1573694859,형제애,,,제가 고기 냄새에 파워 예민한 사람입니다. 살짝이라도 냄새나면 절대 입에도 안대는데 여긴 잡내 없이 맛있더라구요ㅠㅠ 제가 사실 여기 올려고 계속 지켜봤는데 사람이 많아서 못오다가 부모님 모시고 왔는데 정말 만족합니다! 미리 예약하시는거 추천드려요!
1573694859,형제애,,,중식 먹고싶을때마다 오는 곳..🖤 메뉴 하나하나 다 너무 맛있어요 ><
1573694859,형제애,,,"중식당치고 우선 음악도 좋고, 분위기가 좋음. 음식도 딱 좋음.. 쾌적한 식당 컨디션에 음식도 맛나고 너무 좋음. 바테이블에서 술한잔 하면 더 좋음. 미리 예약 필수요. 겨우 자리 잡음. 해물짬뽕탕 불향에 낙지 좋고, 탕수육도 고기가 실해요"
1573694859,형제애,,,진짜맛있음 진짜 리얼 모든거 다걸고진짜맛있음 어떻게 이렇게맛있지??? 할정도로 맛있음 암튼 맛있음 감동임
1573694859,형제애,,,추석연휴인데도 맛집인지 사람이 가득가득 했어요!! 고량주에먹으니까 진짜 찰떡궁합!! 🩷🧡🩷🧡 다음에 또 옹게요!!
1573694859,형제애,,,친구 추천 받고 왔는데 전화하고 와서 다행이에요! 다들 팔보채를 시켜서 먹어봤는데 정말 맛있어요 :) 사람이 많은데도 음식이 정말 빨리 나오고 그래서 식재료도 매우 신선하네요 앞에서 요리를 하니 위생적으로도 깨끗한게 눈에 보여서 너무 좋은거 같아요
1573694859,형제애,,,칼칼한 불맛 짬뽕에 육즙 가득한 탕수육까지 진짜 최고에요 강추합니당
1573694859,형제애,,,"탕수육, 쟁반짜장 둘다 양 넉넉하고 맛있습니다😋"
1573694859,형제애,,,퇴근 후 방이동 맛집 형제애에서 건두부양장피에 생맥주 한 잔 너무 잘 어울리고 맛있네요♡ 건강하고 가벼우면서도 맛까지있는 건두부양장피 안주로 추천합니다. 생맥주도 맛집이네요! 분위기 좋고 시원하고 친절해요🥰
1573694859,형제애,,,팔보채랑 가지요리 시켰는데요 개인적으로 가지요리가 마라맛이 나서 맛있게 잘 먹었습니당 연태고랑주 하이볼랑 같이 먹으면 꿀조합이에요
1573694859,형제애,,,"항상 맛있어요 회사 스트레스가 얼큰한 국물에 싹 풀리는 느낌입니다 불맛에 고기도 야들하고 고소해여 새우는 어찌나 많이 들어가는지, 항상 만족하게 먹고 있습니다 행복한 한끼 감사합니다"
1573694859,형제애,,,형제애 언제갈까 고민만하다가 부모님 올라오셔서 드디어 먹었는데 역시 예상했던거보다 훨씬 더 맛있습니다!!👍🏻👍🏻👍🏻
