가게ID,가게명,평점,날짜,리뷰내용
19500744,오향가중식당,,,저녁에 방문포장·배달 이용대기 시간 바로 입장일상연인・배우자
19500744,오향가중식당,,,저녁에 방문포장·배달 이용대기 시간 바로 입장일상연인・배우자
19500744,오향가중식당,,,저녁에 방문포장·배달 이용대기 시간 바로 입장일상연인・배우자
19500744,오향가중식당,,,점심에 방문예약 없이 이용대기 시간 바로 입장친목친척・형제
19500744,오향가중식당,,,점심에 방문예약 후 이용대기 시간 30분 이내일상연인・배우자
19500744,오향가중식당,,,점심에 방문예약 후 이용대기 시간 바로 입장데이트연인・배우자
19500744,오향가중식당,,,점심에 방문예약 후 이용대기 시간 바로 입장데이트연인・배우자
19500744,오향가중식당,,,점심에 방문포장·배달 이용대기 시간 30분 이내일상친구
19500744,오향가중식당,,,점심에 방문포장·배달 이용대기 시간 바로 입장일상부모님
19500744,오향가중식당,,,정말 오래된 식당으로 볶음밥이 먹고싶을때 항상 생각나는 곳. 고슬한 밥과 잘게썬 야채들에 불맛을 잘 입히고 새우를 넣어 풍성한 식감을 만들어낸 볶음밥이 시그니쳐. 요즘은 지나가면서 보면 웨이팅이 항상 있는 맛집으로 소문나 있어서 자주 들리지는 못하게 된다.
19500744,오향가중식당,,,제가 먹었던 탕수육이랑 짬뽕 중에 제일 맛있었어요. 양도 정말 많고 음식이 퀄리티가 좋아서 기다린 보람이 있어요. 앞으로 짬뽕이나 탕수육 먹을 때마다 여기가 생각날 것 같아요. 집에서 멀고 웨이팅 압박이 있지만 그래도 종종 찾아 갈 생각입니다. 정말 최고의 중국 요리였어요. 다음에는 마파두부랑 족발도 먹어볼게요.
19500744,오향가중식당,,,제일맛있어요 마파두부혼자거의다먹었네요.탕수육은제입에는심심한맛이엿는디 친구들은맛있대용
19500744,오향가중식당,,,제일맛있어요 마파두부혼자거의다먹었네요.탕수육은제입에는심심한맛이엿는디 친구들은맛있대용
19500744,오향가중식당,,,족발 윤기는 사진발이 아닙니다. 사진이 저 윤기를 다 담지 못했어요 진짜 너무 맛있었습니다.
19500744,오향가중식당,,,족발을 시키면 떡국떡이 들어간 들깨미역국이 나온다. 고소하다. 에피타이져와 안주 역할을 한다. 빈속을 달래준다.
19500744,오향가중식당,,,족발이쫀득쫀득하니 정말맛있어요 양배추랑 같이 먹으니 더 맛있어요
19500744,오향가중식당,,,"탕수육 먼저 나오고 짬뽕,볶음밥 순서로 나왔어요.탕수육 바삭하고 소스도 맛있어요."
19500744,오향가중식당,,,"탕수육 먼저 나오고 짬뽕,볶음밥 순서로 나왔어요.탕수육 바삭하고 소스도 맛있어요."
19500744,오향가중식당,,,탕수육도 맛있고 짬뽕도 해산물도 많고 고기도 올라가서 다 흡족하게 먹었습니다.
1214154710,진지아,,,너무 맛있어서 먹느라 정신이 팔렸습니다 뒤늦게나마 사진 샤샤샷 곱창 마라샹궈 어디에서도 본적 없어 기대하며 왓는데 넘 맛나요ㅠㅠ 철판에서 볶아 불맛 제대로에 재료도 풍성하고 술도 잘 들어가네요 👍🏻
1214154710,진지아,,,두번째 방문이에요. 첫방문때 마라탕과 가지볶음 먹고 맛있어서 이번에는 마라상궈 먹어보러 왔는데 역시 맛있네요. 단 개인적인 취향으로 단맛을 좋아하지 않아서 단건 조금 아쉽고 고수를 별도로 주문하는데 한접시에 3000원인데 좀 더 푸짐하게 주셨으면 좋겠어요. 매우 만족스런 식당입니다.
1214154710,진지아,,,마라 너무 좋아하는데 곱창과의 조화라니 ㅠㅠㅠ 너무 맛있고 꿔바로우도 바삭하니 진짜 강추입니다 !!!!!!
1214154710,진지아,,,마라곱창전골도 마라가 들어가도 그렇게 맵지 않고 곱창도 많이 들어가 있어요!
1214154710,진지아,,,마라랑 곱창 조합은 말모말모이죠! 마라맛이랑 안에 재료들이 조합이 너무 좋아요 건두부도 맛있구요
1214154710,진지아,,,마라맛 찐하고 빨리 나오고 진짜 맛있어요!! 마라 맛집이에용 ❤️❤️ 재방문의사 100퍼센트입니다아
1214154710,진지아,,,망고크림새우는 호불호없이 누구나 좋아할 맛이라 추천드립니다.
1214154710,진지아,,,명절음식의 느끼함을 내려주는 마라전골! ㅋㅋ 분위기도 좋고 음식도 맛있어요 🩷
1214154710,진지아,,,몇 년 전부터 자주 오는 송리단길 맛집이에요 가족들이랑 조은 날에 코스 예약해서 오기도 하구 데이터로 오기도 좋고... 😻😻 너무 맛있어용
1214154710,진지아,,,아버님 모시고 다녀왔어요. 평일 낮에만 가다가 처음 주말 방문이었는데 사람은 많았지만 시끄럽지 않아서 괜찮았어요. 코스요리 A 먹었는데 양이 많았지만 남자가 둘이니 안 남기고 다 먹었습니다. 따뜻한 차 맛이 좋으니 꼭 드세요. 볶음밥보다 탕면이 더 맛있어요.
1214154710,진지아,,,"안녕하세요! 소중한 리뷰 남겨주셔서 정말 감사합니다. 저희 진지아의 마라곱창전골, 만족스럽게 드셨다니 정말 기쁩니다! 자리가 꽉 찼음에도 불구하고 바로 식사하실 수 있도록 도와드릴 수 있어서 다행이네요. 음식 맛과 분위기 모두 만족하셨다니, 저희도 덩달아 기분이 좋아집니다. 앞으로도 고객님께 최고의 맛과 서비스를 제공하기 위해 더욱 노력하는 진지아가 되겠습니다. 또 오셔서 맛있는 음식 드시고 가세요!"
1214154710,진지아,,,"안녕하세요! 소중한 후기 남겨주셔서 정말 감사합니다. 언니분과 함께 오셔서 좋은 추억을 만드셨다니, 저희 가게도 덩달아 기쁘네요! 샹궈도 맛있게 드셨다니 정말 다행입니다. 저희 진지아의 샹궈는 직접만든 특별한 마라소스로 볶아 더욱 풍성한 맛을 자랑하죠. 가족분들과 또 방문해주시고, 소스까지 구매해주셔서 정말 감사합니다! 다음에 오시면 더욱 맛있는 음식으로 보답해 드릴게요."
1214154710,진지아,,,"안녕하세요! 소중한 후기 남겨주셔서 정말 감사합니다. 저희 진지아를 세 번이나 방문해주셨다니, 정말 감동이에요! 마라곱창전골과 해산물냉채, 쯔란등갈비까지 맛있게 드셨다니 정말 기쁩니다. 부모님과 함께 오셔서 만족하셨다는 말씀에 더욱 힘이 나네요. 앞으로도 변함없는 맛과 서비스로 고객님들을 맞이할 수 있도록 최선을 다하겠습니다. 다음에 또 뵙겠습니다!"
1214154710,진지아,,,"안녕하세요! 소중한 후기 남겨주셔서 정말 감사합니다. 저희 진지아에서 쉐프님의 집처럼 아늑한 분위기를 느끼셨다니 정말 기쁩니다. 가족분들과 함께 행복한 시간을 보내신 것 같아 저희도 덩달아 기분이 좋네요. 특히 마라곱창전골, 향라갈비, 꿔바로우를 맛있게 드셨다니 정말 다행입니다. 고객님의 칭찬에 저희는 큰 감동을 받았습니다. 앞으로도 변함없는 맛과 서비스로 고객님들을 만족시켜드릴 수 있도록 최선을 다하겠습니다. 다음에 또 방문해주시면 더욱 정성을 다해 모시겠습니다. 감사합니다!"
1214154710,진지아,,,"안녕하세요! 진지아를 오랫동안 애정해 주셔서 정말 감사합니다. 😊 몇 년 만에 방문하셨는데 맛이 그대로라니, 저희도 정말 기쁩니다! 오히려 더 맛있어졌다는 칭찬에 감동했어요. 코스 요리의 가성비, 완벽한 간, 그리고 마라곱창전골의 특별함까지 마음에 드셨다니 뿌듯합니다. 👍 앞으로도 변함없는 맛과 서비스로 고객님들께 보답할 수 있도록 최선을 다하겠습니다. 오래오래 저희 진지아와 함께해 주세요! ~~~"
1214154710,진지아,,,"안녕하세요! 진지아를 찾아주시고 이렇게 멋진 리뷰까지 남겨주셔서 정말 감사합니다. 저희 가게의 마라 맛에 만족하셨다니, 그리고 심지어 아버님까지 좋아하셨다니 정말 기쁩니다! 저희도 손님들께 술이 절로 당기는 맛을 선사해 드리고 싶었는데, 그 마음이 통했나 봅니다. 앞으로도 변함없는 맛과 서비스로 고객님들을 맞이할 수 있도록 최선을 다하겠습니다. 다음에 또 오셔서 저희 진지아의 맛을 즐겨주세요! 😊"
1214154710,진지아,,,어향가지랑🍆완탕면🦐도 너무 맛있어요 매장도 완전 느좋ㅎㅎㅎ 브레이크타임 없는것도 호감입니다☺️
1214154710,진지아,,,와 크림새우 진짜 바삭하고 맛나고 쯔란등갈비 진짜 잘안파는데 먹어서 감격스럽습니다 닭발도 맛있구 찐맛집 인정입니다....ㅠㅠㅠㅠㅠㅠ술을부르는맛입니다 다음에 친구들한테도 소개시켜주고싶은 곳!!!
1214154710,진지아,,,"이런 맛집을 이제 알다니 ,, 🤧 오랜만에 칭구들이랑 만나서 맛있는 음식 먹고 힐링 하고 갑니다앙 🩷"
1214154710,진지아,,,일반적인 중국집과는 다른 특별함이 있어요. 과하지않고 부담스럽지 않은 맛. 무난함에 특별함이 있네요
1214154710,진지아,,,저녁에 방문예약 없이 이용대기 시간 바로 입장일상친구
1214154710,진지아,,,저녁에 방문예약 없이 이용대기 시간 바로 입장친목친구
1214154710,진지아,,,"저녁에 방문예약 없이 이용대기 시간 바로 입장친목친구, 지인・동료"
1214154710,진지아,,,전골 사전보고 왔는데 먹어보니 너무 잘한 선택이었습니다. 완전 추천!! 나머지 음식들도 너무 맛있어요!
1214154710,진지아,,,점심에 방문예약 없이 이용대기 시간 바로 입장가족모임부모님
1214154710,진지아,,,점심에 방문예약 없이 이용대기 시간 바로 입장친목친구
1214154710,진지아,,,정지선의 칼있스마에서 진지아 메뉴 하나씩 추천해주는 영상 보고 바로 단톡방에 올려서 왔어요!! 후기대로 곱창이 엄청 부드러운게 곱창 평소에 안 먹는 친구도 이정도 곱창이면 좋다며 잘 먹었어요. 게살멘보샤도 티엔미미랑 대결해서 이긴 메뉴였나? 그랬는데 이것도 정말 맛있었고 비주얼도 훌륭했어요! 술도 논알콜이 있어서 못마시는 사람들도 와도 좋을 것 같아요ㅎㅎ 친구들이 또 올거라며 다들 네이버 지도에 저장하길래 오늘도 한건했다 굉장히 뿌듯했답니다😆😆 아 그리구 입장하자마자 최형진 셰프님 뵀는데 유튜브에서 10번
1214154710,진지아,,,"종종 배달시켜도 먹고 방문해서도 먹는 곳입니다. 마라를 여기만큼 잘하는 곳은 아직까진 못봤슴다 ㅎㅎ다른 마라탕집들은 다 비슷한 공장형 맛인데 여긴 찐이요. 특히 마라곱창전골 필수, 곱창이 불맛 제대로입니다. 특히 재료 좋은게 느껴져요. 부모님, 아이들 다 좋아해서 계속 방문 예정이요. 중딩 아이가 여기서 먹더니 ""지금까지 먹은 마라는 모두 짭이었어"" 라고 합니다 ㅋ볶음밥처럼 평범한 메뉴도 다른 곳과 달라요.무뼈닭발 넘 매운데 계속 생각나는 맛이에요.꿔바로우도 바삭바삭하고, 새우요리도 강추입니다."
1214154710,진지아,,,좋았아요! 맛있어보이는 메뉴가 너무 많아서 다음에 또 와서 메뉴 다 도전해보고싶아져요
1214154710,진지아,,,지금 같은 가을 날씨에 창쪽 자리 창문 열어두고 너무 좋아요 음식도 너무너무 맛있고 퀄리티가 좋아요 특별한 메뉴 있어서 좋습니다
1214154710,진지아,,,처음 방문해 봤는데 너무 맛있고 정갈하게 잘 나온거 같아요!!! 다음에는 가족들이랑 같이 오면 될거같아요!!😘🤩
1214154710,진지아,,,최형진 셰프님이 하시는 중식당이 집 근처에 있다고 해서 와봤어요 !
1214154710,진지아,,,"헉 진짜 맛있어요 매운맛 조절 가능하고, 마라맛이 되게 진해서 너무너무 좋았어요! 국물이 진한데 깔끔하고 재료도 되게 다양하고 푸짐하게 들어있어요! 몽골리안비프도 촉촉탱글한 버섯이랑 고기랑 너무 맛있게 잘어울리고 볶음밥도 질퍽하지 않고 고소하니 맛있어요!! 송리단길 맛집 인정입니당🥰"
1214154710,진지아,,,회식하려고 송리단길 맛집 찾아보던 중 리뷰보고 괜찮아서 부서분들과 함께 방문했습니다 ㅎㅎ 사진에 보이는 레몬크림새우 외에도 꿔라보루 완탕면 짜장면 너무 맛있게 먹었고 직원분들도 너무 친절해서 잘 먹고 답니다 ㅎㅎㅎ
1024716440,팡즈,,,4인 가족이 방문했는데 너무 맛잇어서 메뉴 4개로 시작해서 하나 더 시켰어요! ㅋㅋㅋㅋ
1024716440,팡즈,,,"너무 오고 싶었는데 드디어 처음 옵니다! 유포면이랑 중화 볶음밥 시켰어요! 제육 느낌의 중화 볶음밥은 처음이었는데, 생각보다 너무 취저였고, 유포면은 많은 분들이 칭찬하신만큼 또 와서 먹고 싶을 정도로 너무 맛있었습니다! 잠실오면 또 올게요!"
1024716440,팡즈,,,"도삭면 위에 뜨거운 기름을 부어 조리한 고소한 기름 향과 마늘, 파의 알싸함이 특징인 면 요리로, 면의 쫄깃함과 양념이 잘 어우러져 담백하지만 중독성 있는 맛"
1024716440,팡즈,,,"도삭면류 좋아해서 찾게 된 집인데, 도삭면인 유포멘보다 탄탄멘이랑 칠리새우를 정말 잘 먹고 왔습니다! 두 음식 소스가 다 기가 막히고, 탄탄멘은 양 추가해서 먹었는데 탈월한 선택이였어요! 유포멘은 기름 부어주는 퍼포먼스가 있는 영상을 보고 선택한 이유기도 한데, 아무래도 보기가 조금 어려웠던 것 같아요. 그래도 맛있었습니다! 다른 메뉴 먹으러 재방문 의사 있습니다!! 잘 먹었습니다~"
1024716440,팡즈,,,맛있다고 추천받아서 저장해놨던 곳인데 드디어 방문했어요. 웨이팅이 좀 있는 편이라 캐치테이블 미리 해놓고 오는게 좋을것같아요. 흔하지 않은 맛인데 엄청 맛있어서 다음에 다른 메뉴들도 먹으러 올 예정입니다!
1024716440,팡즈,,,매장이 넓진 않지만 청결하고 직원분들도 너무 친절하십니다!! 인테리어도 감각적이고!! 브레이크 타임에 1번으로 대기해서 바로 입장했는데 음식도 다 맛있고 팡즈 최고입니다!!
1024716440,팡즈,,,매장이 넓진 않지만 청결하고 직원분들도 너무 친절하십니다!! 인테리어도 감각적이고!! 브레이크 타임에 1번으로 대기해서 바로 입장했는데 음식도 다 맛있고 팡즈 최고입니다!!
1024716440,팡즈,,,매장이 넓진 않지만 청결하고 직원분들도 너무 친절하십니다!! 인테리어도 감각적이고!! 브레이크 타임에 1번으로 대기해서 바로 입장했는데 음식도 다 맛있고 팡즈 최고입니다!!
1024716440,팡즈,,,브레이크타임이 없어서 부담없이 언제나 방문하기 좋았고요
1024716440,팡즈,,,"송리단길 걸어가다 보면 눈길을 확 잡아끄는 중식당이 있는데 바로 팡즈예요. 들어서는 순간부터 힙한 분위기가 느껴지고, 작은 공간인데도 인테리어가 센스 있어서 친구랑 가도 좋고 데이트 장소로도 손색없더라고요. 메뉴는 흔히 보던 중식이 아니라 아메리칸 차이니즈 느낌이라 신선했어요. 제가 먹어본 차오멘은 불향이 확 살아 있어서 계속 젓가락이 가고 탄탄멘도 마제소바 스타일이라 특이하고 맛있어요. 제너랄쏘치킨은 꼭 드세요!ㅎ새로운 스타일의 중식을 찾는 분들께 꼭 추천하고 싶은 곳이에요."
1024716440,팡즈,,,"송리단길 걸어가다 보면 눈길을 확 잡아끄는 중식당이 있는데 바로 팡즈예요. 들어서는 순간부터 힙한 분위기가 느껴지고, 작은 공간인데도 인테리어가 센스 있어서 친구랑 가도 좋고 데이트 장소로도 손색없더라고요. 메뉴는 흔히 보던 중식이 아니라 아메리칸 차이니즈 느낌이라 신선했어요. 제가 먹어본 차오멘은 불향이 확 살아 있어서 계속 젓가락이 가고 탄탄멘도 마제소바 스타일이라 특이하고 맛있어요. 제너랄쏘치킨은 꼭 드세요!ㅎ새로운 스타일의 중식을 찾는 분들께 꼭 추천하고 싶은 곳이에요."
1024716440,팡즈,,,"송리단길 걸어가다 보면 눈길을 확 잡아끄는 중식당이 있는데 바로 팡즈예요. 들어서는 순간부터 힙한 분위기가 느껴지고, 작은 공간인데도 인테리어가 센스 있어서 친구랑 가도 좋고 데이트 장소로도 손색없더라고요. 메뉴는 흔히 보던 중식이 아니라 아메리칸 차이니즈 느낌이라 신선했어요. 제가 먹어본 차오멘은 불향이 확 살아 있어서 계속 젓가락이 가고 탄탄멘도 마제소바 스타일이라 특이하고 맛있어요. 제너랄쏘치킨은 꼭 드세요!ㅎ새로운 스타일의 중식을 찾는 분들께 꼭 추천하고 싶은 곳이에요."
1024716440,팡즈,,,에그누들은 면도 달걀이 들어갔는진 모르겠는데 달걀이랑 해산물 같이 볶은 간장 볶음면 같았어요! 개인적으로 유포멘이 맛있던 집인 것 같습니다!👍
1024716440,팡즈,,,여자친구랑 방문헀는데 브레이크타임없어 좋구 미뉴도 빨리나오고 맛있어요
1024716440,팡즈,,,여자친구랑 방문헀는데 브레이크타임없어 좋구 미뉴도 빨리나오고 맛있어요
1024716440,팡즈,,,여자친구랑 방문헀는데 브레이크타임없어 좋구 미뉴도 빨리나오고 맛있어요
1024716440,팡즈,,,우선 완탕멘 국물이 새우향이 강하게 나면서 간도 딱 맞고 너무 맛있었습니다 🤤 차오멘은 익숙한 중화면? 맛인데 아는 맛이 무섭다고 정말 맛있고 면도 꼬들하니 좋았습니다! 홍콩식토스트를 제일 기대하고 왔는데 너무 부드럽고 맛있고 커피랑 먹어도 정말 잘 어울릴거 같았어요 😆
1024716440,팡즈,,,"유포멘, 사천식닭날개, 홍콩식토스트 다 맛있게 잘 먹었어요! 유포멘은 느끼하다는 평이 있었는데 전혀 그런 느낌 없이 알리오올리오 같아서 너무 맛있게 잘먹었습니다.사천식닭날개, 토스트 다 강추해요!"
1024716440,팡즈,,,유포멘은 기름이 많아서 조금 느끼해서 탄산이랑 같이 먹으면 좋아요! 차오메는 짭짤한 계란 볶음면 느낌이고 토스트는 연유 뿌려져 있어서 촉촉하고 달고 맛있어요!!
1024716440,팡즈,,,유포멘은 기름이 많아서 조금 느끼해서 탄산이랑 같이 먹으면 좋아요! 차오메는 짭짤한 계란 볶음면 느낌이고 토스트는 연유 뿌려져 있어서 촉촉하고 달고 맛있어요!!
1024716440,팡즈,,,유표멘은 느끼하다는 후기를 보고 약간 걱정반 호기심반으로 주문했는데 딱히 거슬릴정도로 느끼하지 않고 특하게 맛있었습니다. 마라맛도 살짝 느껴지고 위에 올라간 고기와 같이 먹으니 나쁘지 않았습니다. 차오멘은 다른 테이블들이 다 시키길래 하나 주문해 봤는데 걍 도른맛입니다. 나오자마자 먹으니 너무너모 맛있더라구요. 면도 딱 맞게 삶아졌고 소스도 너무 맛있어서 밥이 있었으면 비벼먹고 싶었습니다. 소시지도 사이드로 같이먹기 딱 좋은 양이였고 고기의 함량이 높구나 딱 느껴지는 맛이였습니다. 마지막 홍콩식 토스트는 나오자 마자 바로 빵은 따뜻하고 위에 버터는 약간 차가울 상태일 때 바로 먹었는데 정말 올해 먹은 빵중 베스트였습니다 ㅠㅠ 다음번에 와도 꼭 시킬건데 주문하면 금방금방 나오니 다 먹어갈때 쯤 시켜야겠어요
1024716440,팡즈,,,음식도 깔끔하고 양도 많아서 여자 둘이 메뉴 두 개 다 먹으니 너무 배불렀어요!! 맛잇게 먹고 갑니다☺️
1024716440,팡즈,,,음식도 깔끔하고 양도 많아서 여자 둘이 메뉴 두 개 다 먹으니 너무 배불렀어요!! 맛잇게 먹고 갑니다☺️
1024716440,팡즈,,,음식도 깔끔하고 양도 많아서 여자 둘이 메뉴 두 개 다 먹으니 너무 배불렀어요!! 맛잇게 먹고 갑니다☺️
1024716440,팡즈,,,저녁에 방문예약 없이 이용대기 시간 바로 입장
1024716440,팡즈,,,저녁에 방문예약 없이 이용대기 시간 바로 입장
1024716440,팡즈,,,저녁에 방문예약 없이 이용대기 시간 바로 입장
1024716440,팡즈,,,저녁에 방문예약 후 이용대기 시간 10분 이내 데이트연인・배우자
1024716440,팡즈,,,"저번부터 오고 싶었는데 웨이팅 많아서 이제야 오게 되었네요 유포면, 차오멘, 토스트 시켰는데 유포면은 면이 독특하고 식감이 좋아서 맛있었어요 차오멘은 아는 맛인데 원래 에그누들 좋아해서 맛있었고요 토스트는 부드럽고 계란의 고소한 향, 달달함이 좋았어요"
1024716440,팡즈,,,젊은이들에 상당한 인기로 피크시간엔 대기가 있는곳입니다. 미국식 퓨전 중식으로 일반적인 중식당하곤 다른 메뉴가 눈에 띕니다 제너럴쏘치킨(흑초라조기?)이라던가 홍콩식 토스트(달아요) 유포멘(기름에 비빈)차오멘(야끼소바같음) 등등 전 맛있게 먹었는데 지인은 줄서서 먹을정도인가? 하는 의문을 ㅎㅎ
1024716440,팡즈,,,젊은이들에 상당한 인기로 피크시간엔 대기가 있는곳입니다. 미국식 퓨전 중식으로 일반적인 중식당하곤 다른 메뉴가 눈에 띕니다 제너럴쏘치킨(흑초라조기?)이라던가 홍콩식 토스트(달아요) 유포멘(기름에 비빈)차오멘(야끼소바같음) 등등 전 맛있게 먹었는데 지인은 줄서서 먹을정도인가? 하는 의문을 ㅎㅎ
1024716440,팡즈,,,젊은이들에 상당한 인기로 피크시간엔 대기가 있는곳입니다. 미국식 퓨전 중식으로 일반적인 중식당하곤 다른 메뉴가 눈에 띕니다 제너럴쏘치킨(흑초라조기?)이라던가 홍콩식 토스트(달아요) 유포멘(기름에 비빈)차오멘(야끼소바같음) 등등 전 맛있게 먹었는데 지인은 줄서서 먹을정도인가? 하는 의문을 ㅎㅎ
1024716440,팡즈,,,점심에 방문예약 후 이용대기 시간 30분 이내나들이친척・형제
1024716440,팡즈,,,"중국음식 러버로서,, 찐맛집을 영접하여 영광입니다😍 차오멘 스파이시 마파두부 유포멘 다 맛있었어요 둘이 와서 세개먹고 너무 배불러서 토스트 못 먹어본 게 아숩 ,, 다음에 또 올게요💗"
1024716440,팡즈,,,중화비빔밥은 제육이라더니 불고기처럼 얇은 고기를 써서 오히려 더 만족감이 있었습니다. 매콤합니다.
1024716440,팡즈,,,중화비빔밥은 제육이라더니 불고기처럼 얇은 고기를 써서 오히려 더 만족감이 있었습니다. 매콤합니다.
1024716440,팡즈,,,중화비빔밥은 제육이라더니 불고기처럼 얇은 고기를 써서 오히려 더 만족감이 있었습니다. 매콤합니다.
1024716440,팡즈,,,차오멘 탄탄멘 토스트 시켰는데요! 생각보다 엄청 자극적이지 않고 단짠단짠으로다가 잘 먹었습니다~ 특히 토스트 너무 맛있어요!!! 또 와서 다른 메뉴들도 도전해볼 예정입니다ㅎㅎ
1024716440,팡즈,,,차오멘 탄탄멘 토스트 시켰는데요! 생각보다 엄청 자극적이지 않고 단짠단짠으로다가 잘 먹었습니다~ 특히 토스트 너무 맛있어요!!! 또 와서 다른 메뉴들도 도전해볼 예정입니다ㅎㅎ
1024716440,팡즈,,,차오멘 탄탄멘 토스트 시켰는데요! 생각보다 엄청 자극적이지 않고 단짠단짠으로다가 잘 먹었습니다~ 특히 토스트 너무 맛있어요!!! 또 와서 다른 메뉴들도 도전해볼 예정입니다ㅎㅎ
1024716440,팡즈,,,차오면은 달큰하고 감칠맛 있어서 매콤한 마라 마파두부밥이랑 잘 어울려요. 매운 거 잘 못 먹는데도 먹을만 해요! 소스는 약간 묽은 편! 새콤달콤한 칠리새우도 곁들였더니 둘이 세 접시 푸짐하게 먹었어요.
1024716440,팡즈,,,친한 언니랑 점심 먹으러 옴. 저번에는 라스트오더에 걸려서 못 먹었는데 이번에는 웨이팅 없이 바로입장했습니다. 사천식 닭날개는 잡내없이 야들바삭해서 술안주로 좋고 완탕면은 살짝 짜긴 한데 새우완자가 맛있어요. 잘 먹고 갑니다~
1024716440,팡즈,,,칠리새우랑 마라마파 먹었는데 마라마파는 마라 좋아하시면 그으냥 ㄷ🐔드셔야하구
1024716440,팡즈,,,캐치테이블 미리 하면 웨이팅 없이 바로 입장할 수 있어요!! 차오멘 칠리새우 진짜 너무 맛있어요…. 다 맛닜어서 또 올거에요ㅎㅎ 굿👍🍀
1024716440,팡즈,,,평소 에그누들 특유의 식감을 선호하지 않는데 여기 차오멘은 좀 더 부드럽다고 해야 하나 아주 맛있게 먹었습니다. 스파이시도 맵지않고 그냥 맛있게 먹을 수 있는 정도예요ㅎㅎ
