가게ID,가게명,평점,날짜,리뷰내용
2080328345,"브루브루카페,디저트",,,"""업체로부터 일정 금액을 지원받아 체험 후 솔직하게 작성된 후기입니다"""
2080328345,"브루브루카페,디저트",,,"1층과 2층은 밝은 분위기에 자유롭게 대화할 수 있고, 지하는 컴퓨터 가지고 오신 분들이 다 조용히 작업하는 공간으로 되어있었어요. 컴퓨터 가지고 나가면 꽤 긴 시간 머물게 되는 경우가 있는데, 지하공간은 작업하기 너무 좋더라구요. 제가 간 2시-3시쯤은 자리가 조금 남아있었는데 조금 지나니 금방 자리 차더라구요. 좀 더 편한 자리 잡고 싶으시면 일찍 가시는거 추천드려요. 그리고 추가주문(아메리카노만 해당되는것 같아요) 30프로 할인해주는 프로모션도 있어서 좋아요!"
2080328345,"브루브루카페,디저트",,,24시 하는 카페가 요즘 잘 없는데 24시 오픈이라니 너무 좋아요!! 그리고 매장이 엄청 넓어요! 엘리베이터를 타고 윗층으로 갈 수있어서 편하네요^^ 지하는 스터디나 혼자 노트북하기에 좋게 되어있어서 자주 이용할것같아요^^ 음료랑 디저트도 너무 맛있고 특히 크로와플은 정말 맛있습니다! 꼭 드셔보세요!!! 좌석도 편해서 편하고 즐겁게 이용하다 갑니다^^
2080328345,"브루브루카페,디저트",,,24시간 영업하는 카페인만큼 사람이 많지만 그만큼 좌석도 많고 오래 있기도 좋은거같아요
2080328345,"브루브루카페,디저트",,,24시간 오픈카페라고 해서 방문했는데 생각보다 너무 쾌적하고 소파좌석이 많아서 진짜 편안하고 좋았어요. 커피랑 디저트 종류랑 요즘 유행하는 제로 음료도 많아서 메뉴보고 한참 골랐어요. 근데 주문한 커피와 디저트도 너무 맛있네요👍🏻 직원분도 너무 친절하셔서 기분좋게 이용하고 왔습니다~ 혼커나 공부하러 와도 분위기 너무 좋아요!🙂 #브루브루
2080328345,"브루브루카페,디저트",,,"24시간 운영이라니 정말 좋아요! 새벽에 급하게 작업할 일이 있어서 왔는데, 조용하고 편안해서 능률이 쑥쑥 올랐어요. 얼그레이 자몽케이크랑 카페라떼를 마셨는데, 케이크가 촉촉하고 부드러워서 맛있었고, 라떼도 부드러워서 좋았네요."
2080328345,"브루브루카페,디저트",,,24시간 카페가 없어진지 꽤 오랜만에 송파구에
2080328345,"브루브루카페,디저트",,,24시간 카페라니 정말 멋져요. 지하1에서 2층까지 멋진 공간에 시원한 뷰. 지하층은 카공족의 성지군요. 주차는 듣던디니로 만차네요.
2080328345,"브루브루카페,디저트",,,24시간 카페인데도 케이크 종류가 다양하고 특히 크로와플 위에 하겐다즈 아이스크림 올려 먹는 게 너무 맛있었어요 ㅋㅋ
2080328345,"브루브루카페,디저트",,,건물 통으로 사용해서 그런지 외부부터 내부까지 너무 감각적이고 좋아요~ㅎㅎ
2080328345,"브루브루카페,디저트",,,결론 : 매일 퇴근후에 가서 커피 한잔씩 하기에 좋은곳. 공부도 일도 휴식도 가능한곳.
2080328345,"브루브루카페,디저트",,,노트북하기 좋은 카페라고 들어서 와봤는데 진짜 넓구 좋네요! 지하에 다 일하는 분들 계셔서 넘 좋았어요..! 주말이라 사람이 많긴 한거같은데 평일에 와도 좋을 것 같네욥!
2080328345,"브루브루카페,디저트",,,대애박 송파에 너무 예쁘고 넓은 카페가 생겼어요!!! 좌석이 너무 편하고 지하는 공부존이고 메뉴도 다양한데 24시간 카페라니!!!! 빵도 맛있고 메로나스무디도 달달하니 좋아요🍈👍🏻
2080328345,"브루브루카페,디저트",,,두번째 방문하는곳인데 항상 사람이 많아요 핫플 인정👍🏻✨✨음료도 케이크 빵 피자 크로플 등등 종류도 다양하고 24시영업해서 방문하기 좋아요 인테리어도 멋있고 가구도 디자인이 다 달라서 보는 재미가 쏠쏠합니다
2080328345,"브루브루카페,디저트",,,디저트류나 식사류도 있어서 공부하시는 분들은 하루 종일 머무르기 좋아요
2080328345,"브루브루카페,디저트",,,마싯구 자리평하고 쏘긋 송파나루에 이렇게 맘편히 앉아서 놀곳이잇엇낭.. 아 아이스크림 하겐다즈라그런가 넘 마싯어요 아포가토 강추ㅋ
2080328345,"브루브루카페,디저트",,,매장앞에 주차공간이 있지만 10시가 넘은 시간에도 만차라서 뒷골목에다가 세우고 이용했어요
2080328345,"브루브루카페,디저트",,,"메로나 스무디 달달 시원, 제로 바닐라라떼 깔끔하고, 쑥고구마 케이크는 진한 쑥향+고구마 무스 조합 최고💛"
2080328345,"브루브루카페,디저트",,,"미팅하기도 괜찮을 것 같고, 24시간 연중무휴라 명절 같은 때 다른 곳 다 문닫으면 여기 와야겠어요."
2080328345,"브루브루카페,디저트",,,"버스타고 오면 바로 앞에 보여서 접근성이 정말 좋아요!! 들어오면 에어컨도 시원하고 의자도 편안하니 외삼촌네 놀러온 것 같아서 너무 안락했어요💜 주문이 엄청 몰리길래 주저했는데, 음료를 금방 만들어주셨어요! 딸기라떼...정말 맛있습니다....딸기청 완전 최고😭 자주 놀러갈게요 사장님!!"
2080328345,"브루브루카페,디저트",,,분위기 너무 좋고 커피 맛도 맛있어요!! 혼자 공부하러 와도 좋을 것 같고 데이트 하러 와도 좋을 것 같아요! 노래도 너무 제 취향이네요 다음에 또 방문할게요~!
2080328345,"브루브루카페,디저트",,,"불고기 피자를 먹으러 왔는데, 기대 이상으로 맛있어서 놀랐어요. 🍕 불고기가 푸짐하게 올라가 있고 치즈도 듬뿍이라 정말 맛있었어요. 따뜻한 아메리카노와 함께 먹으니 최고의 궁합이네요. 식사부터 커피까지 한 곳에서 해결할 수 있다니 정말 편한 곳이에요."
2080328345,"브루브루카페,디저트",,,브런치와 디저트 시켜서 작업하기 너무 좋고 소파가 많아서 데이트로도 좋음
2080328345,"브루브루카페,디저트",,,산미 약간있는 커피 맛있고 자석 편해요 주차5대정도 가게앞에 주차할수있어요
2080328345,"브루브루카페,디저트",,,생각보다 평일 오전(점심 이전) 시간에는 사람이 없어서 여유롭게 커피와 디저트를 즐길수있었어요! 지하는 공부하는 분들이 많고 어둡고 조용한 분위기가 있어 더 아늑해보였어요~ 2층은 사람이 없어서 아이와 편하게 음료를 즐길수있었어요😃 노키즈존이 아닌게 의외여서 (?) 저도 4살 아들과 오랜만에 느좋 카페에서 커피를 즐길수있었습니다 😆 다음에 다른 가족과 친구들도 데려오고싶은 좋은 곳이네요. 오래오래 가길 바래요!!!
2080328345,"브루브루카페,디저트",,,"송리단길에서는 살짝 떨어져 있지만, 대로변에있어서 위치상으로도 좋고, 걸어서도 충분히 이동 가능한 거리라 송리단길 구경 후에 들리기에도 딱!!"
2080328345,"브루브루카페,디저트",,,"송파 브루브루는 24시간 운영하는 카페라 언제 가도 편하게 쉴 수 있어서 좋아요. 아이스카페라떼는 진하고 깔끔했으며, 비스바스크치즈케이크는 꾸덕하면서도 달콤했고 밀크케이크는 부드럽고 담백해서 커피와 찰떡이었어요. 좌석도 넓고 소파가 편안해 오래 머물기에도 좋았습니다."
2080328345,"브루브루카페,디저트",,,"송파에 24시간 운영하는 카페 브루브루 다녀왔어요! 늦은 시간에도 푹신한 소파에서 편하게 쉴 수 있어서 너무 좋았어요. 아이스바닐라라떼랑 딸기요거트, 마들렌까지 주문했는데, 하나같이 다 맛있고 감성 가득한 공간이었어요."
2080328345,"브루브루카페,디저트",,,"송파에 몇 없는 24시 카페인데 대형에 분위기도 너무 좋아요! 커피랑 주류도 판매하고, 베이커리 디저트와 간단한 식사류들도 판매해용! 3층 규모라서 넓고 쾌적하고 지하는 카공하기에도 좋을 것 같아요 ✨ 저는 바스크치즈케이크랑 레몬마들렌 먹었는데 쫀맛탱이에요 💖"
2080328345,"브루브루카페,디저트",,,여기는 모든 좌석이 소파 자리인 게 최고의 장점 같아요. 딱딱한 의자가 아니라서 오래 앉아있어도 허리가 안 아프고 정말 편안해요. 푹신한 소파에 몸을 맡기고 책 읽으니 여기가 바로 천국이구나 싶었어요. 💖
2080328345,"브루브루카페,디저트",,,"와 송파에 이런 곳이 있었나요..? 🤯🤯🤯 24시간 운영에, 주차도 가능하고, 좌석도 편하고, 노트북작업하기도 좋고, 대형카페!! 짝꿍이랑 송파에 주차가능한 카페 찾다가 방문하게 된 곳인데, 넘 만족스러워서 두번 더 갔어요 ㅋㅋㅋ 커피 원두가 진짜 맛있나봐요, 바닐라라떼도 그렇고, 카페라떼도 그렇고 다 맛있었어용! ☕️☕️ 바스크치즈케이크도 제가 딱 원하는 폭신함, 차가움, 고소함이었어요! 커피랑 딱 잘 어울리는 그런 바치케~! 🧀 다른 것들도 먹어보고 싶어요! 근데 주차가 5대 정도 가능하긴 한데, 차가지고 가는 사람이 많아서 주차난이 좀 있습니다 ㅋㅋㅋ 참고하세용! 지하1층은 엄청 조용해서 공부나 책 읽어야할 거 같아요! 타자소리 내면 좀 민폐일듯 합니다! 🧑🏻‍💻"
2080328345,"브루브루카페,디저트",,,와플 맛집은 많지만 이렇게 조용하고 분위기 좋은 곳에서 맛있는 와플과 커피를 함께 즐길 수 있는 곳은 드물어요.
2080328345,"브루브루카페,디저트",,,인스타에서 보고 왔는데 실물도 감성 넘쳐요🥰 거의 모든 좌석이 소파좌석이라 너무 편하고 지하1층부터 2층까지 총 3개 층으로 이루어져있는데 지하1층은 공부하기도 넘 좋게 조용하고 집중잘되는 분위기입니다! 1층과 2층은 개방감있게 탁 트여서 넓게 인테리어되어있어서 최고에요! 주차도 건물앞에 7대 정도 할 수 있습니다 자주올게요
2080328345,"브루브루카페,디저트",,,저녁에 방문예약 없이 이용대기 시간 바로 입장친목지인・동료
2080328345,"브루브루카페,디저트",,,점심에 방문예약 없이 이용대기 시간 바로 입장데이트연인・배우자
2080328345,"브루브루카페,디저트",,,점심에 방문예약 없이 이용대기 시간 바로 입장비즈니스친구
2080328345,"브루브루카페,디저트",,,좌석 간 거리가 떨어져 있고 의자가 전 석 쇼파로 되어있어서 오래 머물기에 좋은 곳이에요.
2080328345,"브루브루카페,디저트",,,"주말 늦은 오후, 여유롭게 커피 한 잔의 행복을 느끼고 싶다면 브루브루를 추천합니다."
2080328345,"브루브루카페,디저트",,,지하 1층은 공부하는 공간으로 되어있어서 집중하기 좋아요!!!! 재방문했습니다ㅎ
2080328345,"브루브루카페,디저트",,,지하 자리는 작업하기 좋은 집중 잘 되는 분위기였어요 만족👍🥹😍
2080328345,"브루브루카페,디저트",,,지하에는 카공 할 수 있게 스터디자리가 있더라구요~! 카페에서 작업하기 좋아하시는 분들 여기 추천드립니다😄
2080328345,"브루브루카페,디저트",,,"집앞 항상 뭔가가 생겼다가 없어지곤 하는 자리에 24시간 카페가 오픈하였다. 지하부터 2층까지 세개층을 카페로 운영중인데, 지하 1층은 스터디카페형식으로 운영되어 매우 조용하며, 1층과 2층은 푹신한 소파와 의자들로 되어 있어, 편안하게 오래 머무르기 좋다."
2080328345,"브루브루카페,디저트",,,카페 규모도 크고 24시간 영업이라 언제든 방문 가능하니 좋은거 같아요!
2080328345,"브루브루카페,디저트",,,커피 맛도 좋고 분위기가 참 좋네요. 브루브루 너무 마음에 듭니다. 케익도 맛있었어요. 종업원들도 친절하시네요.
2080328345,"브루브루카페,디저트",,,쾌적하고 소파도 넓고 음료도 맛있는 카페였어요. 특히 지하 일층은 무슨 외국 도서관 같아요! 게다가 24시카페라 아무때나 가도 된다니 넘 좋네요!
2080328345,"브루브루카페,디저트",,,"키워드를 다섯 개만 꼽을 수 있는 게 아쉬울 정도로 멋진 공간이에요 없어지지 않았으면 해서 사진도 열심히 찍고 이렇게 리뷰 씁니다,,,"
2080328345,"브루브루카페,디저트",,,특히 의자가 엄청 편해보여서 수다떨기 좋을 것 같아요.
2080328345,"브루브루카페,디저트",,,"평일 오전에 4살 아들이랑 방문했는데, 노키즈존이 아니라서 정말 감사했어요. 2층에 사람이 없어서 편하게 디저트 먹으며 오랜만에 카페 데이트를 즐겼네요. 아이 엄마도 힐링할 수 있는 멋진 공간이에요! 😆"
2080328345,"브루브루카페,디저트",,,하겐다즈 카라멜라떼는 깔끔한 단맛과 함께 카라멜 향이 입안 가득 퍼져요.
2080328345,"브루브루카페,디저트",,,한 입 먹자마자 “아 이건 무조건 또 먹어야 한다” 싶었어요. 라떼랑 같이 먹었는데 조합이 정말 환상적!
1749434719,비터솔트카페,,,가구나 인테리어 색감이 이뻐서 사진찍으로도 많이 오세요. 브런치메뉴가 많으나 사람들이 많아 솔드아웃메뉴도 많으니 참고하세요.
1749434719,비터솔트카페,,,그리구 매장도 이쁘구~ 날 더 풀리면 얼른 야외테이블에서 먹구시포요 💖
1749434719,비터솔트카페,,,그리구 매장도 이쁘구~ 날 더 풀리면 얼른 야외테이블에서 먹구시포요 💖
1749434719,비터솔트카페,,,내부도 분위기가 좋지만 가을 저녁엔 야외 테라스석이 최고 입니다. 커피도 맛나구요. 디카페인도있어서 넘 좋네요~
1749434719,비터솔트카페,,,다들 인절미치아바타 드세요 두번 드세요...❣️크림이 완전 인절미 그 잡채..🫶🏻🫶🏻 빵이랑 어울릴까 싶지만 막상 먹으면 인절미 고소 달달함이랑 빵이랑 조합 최고입니당🤭 당도도 물리는 단맛 아니라서 부담없이 먹기좋아요 !!
1749434719,비터솔트카페,,,다른 치아바타 샌드위치 먹어뷰규 싶었는데 다 품절이라 담에 또 올게요:)
1749434719,비터솔트카페,,,다른 치아바타 샌드위치 먹어뷰규 싶었는데 다 품절이라 담에 또 올게요:)
1749434719,비터솔트카페,,,더울까봐 선풍기까지 따로 틀어주셔서 더 시원하게 잘 있었어요 :)
1749434719,비터솔트카페,,,더울때 아메리카노를 평소보다 많이 마시게 되는데 이부분이 흡족했습니다.
1749434719,비터솔트카페,,,더울때 아메리카노를 평소보다 많이 마시게 되는데 이부분이 흡족했습니다.
1749434719,비터솔트카페,,,무화과 빙수를 먹고싶었지만 품절이슈로 인해.. 복숭아 빙수 먹었는데 복숭아 진짜 맛있고 빙수랑 찰떡콩떡이더라구요🍑💗
1749434719,비터솔트카페,,,분위기 좋고 커피도 에이드도 맛있어요~! 블루베리치즈케이크 완전 제 취향💗 늦게오니 샌드위치는 없어서 아쉬웠어요 다음에 샌드위치먹으러 올게요
1749434719,비터솔트카페,,,분위기가 너무 좋네요 :) 비오는 날 와서 운치있는데 음식도 맛있구 커피도 맛잇어요!
1749434719,비터솔트카페,,,샌드위치 종류도 다양하고 커피도 맛있어요! 나중에는 브런치먹으러 와볼까 합니다. 재방문의사있음!
1749434719,비터솔트카페,,,"송리단길 놀러왔다가 지나는 길에 발견했는데 들어서자마자 악소리,,❣️ 매장 외부에서 사진 찍으면 테라스파티하는 느낌이에요,,🫧 거기다 내부 인테리어는 더 기절이에요 게다가 빵이 정말정말 맛있어요 레몬치아바타는 뭐지 했는데 안에 레몬크림까지 완벽해요 할마니의 당케도 완전 추천🤍 맑은 날 다시 오고 싶어요!"
1749434719,비터솔트카페,,,"식사 대용으로 먹을 만한 빵이 없어서 아쉽게도 스프만 먹었어요. 토마토스프가 맛있었고, 저녁도 다양해서 정말 매력있는 카페에요. 다음에는 조금 일찍 와서 다양한 샌드위치도 먹고 싶고, 다른 자리에서 앉아 보고 싶어요."
1749434719,비터솔트카페,,,앞으로 잠실에서 카페 한 곳만 가야한다고 하면 전 여기로 정착합니다. 인테리어 감각적이고 케이크도 맛있어요.
1749434719,비터솔트카페,,,앞으로 잠실에서 카페 한 곳만 가야한다고 하면 전 여기로 정착합니다. 인테리어 감각적이고 케이크도 맛있어요.
1749434719,비터솔트카페,,,여기 처음와봤는데 정말 하나하나 인테리어가 너무 멋져요
1749434719,비터솔트카페,,,옆가게에서 점심먹다가 우연히 2층이 눈에 띄어서 비도 피할겸 들어온 가게인데 북유럽풍 인테리어와 넓고 아늑한 공간에 반하게 됐습니다 베이커리도 다양하구요! 저희 동네에도 이런 카페가 있었으면 좋겠네요
1749434719,비터솔트카페,,,"요즘 옥수수 디저트가 마음에 들어 초당옥수수라떼를 주문했습니다. 옥수수의 식감과 구수한 구황작물의 향을 강조한 음료는 아니었고, 달달한 크림과 부드러운 음료가 단품으로 먹기 괜찮았어요."
1749434719,비터솔트카페,,,인터넷도 빨라서 일하기도 좋아서 중간에 밖에 일정 보고 또 와서 음료 마셨어요.
1749434719,비터솔트카페,,,인테리어 너무 이뻐서 어디서 사진찍어도 이쁘고 소파있는메인공간 최고로 감성뿜뿜 치아바타 진짜맛있어요! 블루베리 크림치즈 꼭같이먹기 !!
1749434719,비터솔트카페,,,인테리어가 멋진 비터솔트에 왔습니다~ 정원쪽 벤치도 좋고 2층에 실내도 인테리어 멋지고 좋아요~ 대화하기 참 좋은 분위기이고 강아지도 올 수 있어서 너무 좋습니다! 빵도 너무 맛있으니 꼭 주문해보세요~ 추천드립니다!
1749434719,비터솔트카페,,,일단 빵이 맛있어요….! 블루베리 크림치즈도 맛있어요! 그리고 라떼가 정말 맛있습니다 ! 인테리어도 멋지네요 가구에 신경쓰신게 느껴집니다!
1749434719,비터솔트카페,,,저녁에 방문예약 없이 이용대기 시간 바로 입장데이트연인・배우자
1749434719,비터솔트카페,,,저녁에 방문예약 없이 이용대기 시간 바로 입장데이트연인・배우자
1749434719,비터솔트카페,,,저녁에 방문예약 없이 이용대기 시간 바로 입장데이트연인・배우자
1749434719,비터솔트카페,,,"저녁에 방문예약 없이 이용대기 시간 바로 입장친목, 나들이, 일상친구"
1749434719,비터솔트카페,,,"저녁에 방문예약 없이 이용대기 시간 바로 입장친목, 나들이, 일상친구"
1749434719,비터솔트카페,,,"점심에 방문예약 없이 이용대기 시간 바로 입장데이트, 친목부모님, 연인・배우자"
1749434719,비터솔트카페,,,점심에 방문예약 없이 이용대기 시간 바로 입장데이트연인・배우자
1749434719,비터솔트카페,,,점심에 방문예약 없이 이용대기 시간 바로 입장데이트연인・배우자
1749434719,비터솔트카페,,,점심에 방문예약 없이 이용대기 시간 바로 입장일상연인・배우자
1749434719,비터솔트카페,,,점심에 방문예약 없이 이용대기 시간 바로 입장일상혼자
1749434719,비터솔트카페,,,점심에 방문예약 없이 이용대기 시간 바로 입장친목친구
1749434719,비터솔트카페,,,점심에 방문예약 없이 이용대기 시간 바로 입장친목친구
1749434719,비터솔트카페,,,점심에 방문예약 없이 이용대기 시간 바로 입장친목친구
1749434719,비터솔트카페,,,점심에 방문예약 후 이용대기 시간 10분 이내 일상연인・배우자
1749434719,비터솔트카페,,,"조금 일찍 도착했는데, 반갑게 맞에해주시고 친절하게해주셔서 송리단길의 이미지가 더 좋아지는 비터솔트네요 🤗 새로생겨서 항상 와보고 싶었는데"
1749434719,비터솔트카페,,,좌석도 많고 야외 테라스 자리도 요즘 날씨에 딱 좋네요ㅎㅎ 음료도 맛있어서 또 오고 싶어요!!
1749434719,비터솔트카페,,,좌석도 많고 야외 테라스 자리도 요즘 날씨에 딱 좋네요ㅎㅎ 음료도 맛있어서 또 오고 싶어요!!
1749434719,비터솔트카페,,,치아바타 특화 베이커리. 크림치즈랑 같이 먹을 수 있어요. 매장 인테리어가 아늑하고 작업하기 좋은 테이블도 많아요. 커피 빵 맛있게 먹으며 할일하기 좋네요
1749434719,비터솔트카페,,,치아바타도 맛있고 영수증 이벤트로 크림치즈도 잘먹었어요!
1749434719,비터솔트카페,,,"친구들과 함께 와서 대화를 나누기에도 좋고, 연인과 데이트 장소로 선택하기에도 손색이 없을 만큼 매력적인 카페인 것 같아요~"
1749434719,비터솔트카페,,,카페 찾는중 지나가다가 들른곳인데 너무 예뻐요! 잠실에 새로 생긴 카페라고 하던데 그래서 그런지 사람 많아요 테라스 진짜 예쁘구 카페 내부도 넘 분위기 좋고 은근 자리도 많아요 커피도 맛있고 디저트도 넘 맛있어요 🫶🏻
1749434719,비터솔트카페,,,"평일 12시 전에 도착했고, 자리도 많고 여유롭고 편안한 분위기라서 할 일을 빨리 끝낼 수 있었어요. 1시 이후부터는 사람들이 많이 오기 시작해서 여유 늒고 싶으시다면 12시 전에 방문하시면 좋을것같아요!"
1749434719,비터솔트카페,,,"평일 12시 전에 도착했고, 자리도 많고 여유롭고 편안한 분위기라서 할 일을 빨리 끝낼 수 있었어요. 1시 이후부터는 사람들이 많이 오기 시작해서 여유 늒고 싶으시다면 12시 전에 방문하시면 좋을것같아요!"
1749434719,비터솔트카페,,,힙하고 커피도 맛있어용👍🏻 테라스도 있어서 요즘 가기 딱이에요 이 근방에서 젤 힙한카페같아요 :)
1749434719,비터솔트카페,,,힙하고 커피도 맛있어용👍🏻 테라스도 있어서 요즘 가기 딱이에요 이 근방에서 젤 힙한카페같아요 :)
2062499486,아키비스트 송파점카페,,,"2. 영수증 리뷰를 남기면 주는 휘낭시에가 예상 외로 아주 맛있음. 단순히 덤으로 얹어주는게 아니라 ‘어이쿠. 내 누추한 후기에 이렇게 귀한 음식을’ 이란 느낌마저 들 정도로 처음 씹었을 때 딴딴, 두번째 씹었을 때 부드러운 식감의 단계가 완벽히 나눠져 있으며 무엇보다 애매하지 않은 제대로 된 단 맛이 날 사로잡음."
2062499486,아키비스트 송파점카페,,,3대 아인슈페너 맛집으로 이미 유명한 곳이지만 송파는 더 넓고 메뉴도 다양해요! 직원분들 친절하고 커피뿐만 아니라 빵도 너무 맛있어요!
2062499486,아키비스트 송파점카페,,,"3대 아인슈페너 맛집이라고 해서 커피만 마시러 방문했는데 괜히 입소문 난 게 아니네요. 아메리카노도 원두 선택 가능해서 좋고 시그니처인 아인슈페너도 맛있고 디저트 종류 중에선 바스크 치즈케이크! 강추합니다,,,최고,, 가격도 괜찮고 꼭 추가해서 커피랑 같이 드셔보세요!!! 직원분들도 친절합니다~!"
2062499486,아키비스트 송파점카페,,,"3번째 지점으로 오픈한 아키비스트인데 송파지점으로 처음 와봤어요. 우선 매장앞에 3대정도 주차가능한 곳이고, 지하1층부터 지상2층까지 꽤 많은 좌석이 있어요. 커피도 맛있고 직접 만드는 베이커리도 종류가 다양합니다. 다음에 또 오면 아인슈페너 먹어봐야겠네요!😀"
2062499486,아키비스트 송파점카페,,,"3층 규모의 널널한 공간, 인더스트리얼 감성이 감도는 감각적인 인테리어로 시그니처 아인슈페너와 함께 다양한 빵을 만나볼 수 있던 곳🥖"
2062499486,아키비스트 송파점카페,,,가오픈기간 두번왔다가 너무좋아서 본오픈하고 또왔어요! 근처에 이런 좋은 감성의 맛있는 커피를 먹을 수 있는 아키비스트 너무 소중해요... 커피는 말해뭐해요 진짜 맛있고 가오픈때는 지하가 있는줄 몰랐는데 지하에 베이킹룸이 있더라구요 아침일찍부터 사람 많은 곳.
2062499486,아키비스트 송파점카페,,,근처에 왔다가 책 읽기 좋은 카페를 찾아 방문했는데 매장도 넓고 커피도 맛있고 분위기도 너무 좋아서 좋은 시간 보내다가 갑니다! 뭐 하나 빠지는게 없는 카페이자 공간인 것 같아 자주 올 것 같아요
2062499486,아키비스트 송파점카페,,,근처에서 전시회 보고 석촌호수 근처 아인슈페너 맛집이 있다고 해서 놀러왔어요^^
