가게ID,가게명,평점,날짜,리뷰내용
1938060093,카페아일랜드&베이커리,,,"카페아일랜드&베이커리는 프랑스 포리쉐 밀가루와 레스큐어 AOP 버터로 만든다고 해서 정말 기대하고 왔는데, 과연 믿고 먹을 수 있는 베이커리맛집이었어요. 빵은 겉은 바삭하고 속은 촉촉해서 먹을 때마다 감탄했어요. 커피도 빵이랑 잘 어울리는 맛이라 완벽한 조합이었네요. 잠실나루역데이트할 때도 좋고, 혼자 와서 여유 부리기도 좋아서 앞으로 자주 찾게 될 것 같아요. 잠실나루역맛집 인정합니다!"
1938060093,카페아일랜드&베이커리,,,"카페아일랜드&베이커리는 프랑스 포리쉐 밀가루와 레스큐어 AOP 버터로 만든다고 해서 정말 기대하고 왔는데, 과연 믿고 먹을 수 있는 베이커리맛집이었어요. 빵은 겉은 바삭하고 속은 촉촉해서 먹을 때마다 감탄했어요. 커피도 빵이랑 잘 어울리는 맛이라 완벽한 조합이었네요. 잠실나루역데이트할 때도 좋고, 혼자 와서 여유 부리기도 좋아서 앞으로 자주 찾게 될 것 같아요. 잠실나루역맛집 인정합니다!"
1938060093,카페아일랜드&베이커리,,,"크루아상이 겹겹이 살아있고, 브리오슈도 포슬포슬해서 만족스러웠어요! 다시 방문할 것 같아요."
1938060093,카페아일랜드&베이커리,,,"판다 인테리어가 너무 귀엽고, 잠봉뵈르와 크루아상, 브리오슈 등 빵 종류가 정말 많아서 고르는 재미가 쏠쏠했어요. 월드타워몰 근처라 접근성도 좋네요~"
1938060093,카페아일랜드&베이커리,,,항상 깨끗하고 쾌적한 환경을 유지하기 위해 직원 모두가 꼼꼼히 준비하고 있어요.
1938060093,카페아일랜드&베이커리,,,"항상 청결하고 정성스럽게 준비하는 저희의 노력이 고객님께 전달된 것 같아 정말 보람차네요. 언제든지 달려오세요, 저희는 항상 준비되어 있습니다! 다음에도 더 좋은 경험을 드릴 수 있도록 노력하겠습니다."
1938060093,카페아일랜드&베이커리,,,휘낭시에의 달큰함과 치아바타의 담백함이 잘 어울리는 곳이에요! 덕분에 기분이 좋아졌답니다♥️
2009816333,테라로사 잠실한강공원점카페,,,강뷰.초록뷰. 뷰가조아요! 한강주차장을 이용하니 주차는 넓은편지이지만 주차지원은 불가해요.
2009816333,테라로사 잠실한강공원점카페,,,그런데 화장실 냄새가 너무 심해요.예쁜카페에 앉아 멋진 한강을 보는데 실내에서 화장실 냄새가 너무 납니다.
2009816333,테라로사 잠실한강공원점카페,,,로열얼그레이케이크와 카페라테~ 커피 한잔하면서 여유로움 느끼기 좋네요.😍
2009816333,테라로사 잠실한강공원점카페,,,로열얼그레이케이크와 카페라테~ 커피 한잔하면서 여유로움 느끼기 좋네요.😍
2009816333,테라로사 잠실한강공원점카페,,,"매장은 꽤 넓은 편이고, 저는 저녁에 방문해서 야경이 너무 예뻐서 좋았습니다. 한강이 보이는 좌석은 아무래도 인기좌석이라 못 앉았지만, 그 외 다른 자리들도 많아서 분위기는 충분히 좋았구요!"
2009816333,테라로사 잠실한강공원점카페,,,며칠 전 야경 보러 가서 넘 좋았는데 이번엔 오후에 방문^^
2009816333,테라로사 잠실한강공원점카페,,,비오는 한강 테라로사 분위기와 한강뷰도 좋고 9시 오픈인데 벌써 창가석은 만석 기분좋은 하루의 시작
2009816333,테라로사 잠실한강공원점카페,,,사람이 많은 주말은 만석이고 음료가 나오기까지 시간이 걸린다.
2009816333,테라로사 잠실한강공원점카페,,,아침에 방문예약 없이 이용대기 시간 10분 이내
2009816333,테라로사 잠실한강공원점카페,,,아침에 방문예약 없이 이용대기 시간 10분 이내
2009816333,테라로사 잠실한강공원점카페,,,아침에 방문예약 없이 이용대기 시간 바로 입장데이트연인・배우자
2009816333,테라로사 잠실한강공원점카페,,,아침에 방문예약 없이 이용대기 시간 바로 입장데이트연인・배우자
2009816333,테라로사 잠실한강공원점카페,,,아침에 방문예약 없이 이용대기 시간 바로 입장데이트연인・배우자
2009816333,테라로사 잠실한강공원점카페,,,아침에 방문예약 없이 이용대기 시간 바로 입장데이트연인・배우자
2009816333,테라로사 잠실한강공원점카페,,,일요일 1시 쯤 들어갈 때는 사람이 적었는데 비 그치고 나니 점점 사람이 늘어나네요. 바로 아래로 한강버스 들어오는 것도 보여요. 이날 이후로 한달간 운행 안 한다고 하니 좀 아쉬웠습니다. 그래도 산책 겸 커피 마시러 갈래요.
2009816333,테라로사 잠실한강공원점카페,,,"일요일아침 9시 반에 갔는데도 창가자리는 만석..ㅠㅠ 그래도 모든좌석들의 뷰가 좋아 창가자리가 아니어도 만족스러웠어요ㅎㅎ 산미와 과일향 가득한 콜롬비아 우일라와 풀문 블렌드, 가을 정취에 어울리는 낙엽향(?)이 진한 실론 시나몬 아이스라떼로 여유로운 일요일아침을 시작히 보아요:) 창가에 앉아 독서를 즐기시는분들도 많아 여유넘쳤던 곳"
2009816333,테라로사 잠실한강공원점카페,,,잠실 테라로사 한강뷰가 넘 멋지고 좋아요. 키오스크 주문으로 바껴서 원두 다양한 테라로사에서 직원분들한테 물어보면서 주문해볼수 없는게 아쉬워요. 그런것치고 가격이 더 오른거 같네요.
2009816333,테라로사 잠실한강공원점카페,,,저녁에 방문예약 없이 이용대기 시간 바로 입장데이트연인・배우자
2009816333,테라로사 잠실한강공원점카페,,,저녁에 방문예약 없이 이용대기 시간 바로 입장일상친구
2009816333,테라로사 잠실한강공원점카페,,,저녁에 방문예약 없이 이용대기 시간 바로 입장친목지인・동료
2009816333,테라로사 잠실한강공원점카페,,,"점심에 방문예약 없이 이용대기 시간 10분 이내 나들이연인・배우자, 아이"
2009816333,테라로사 잠실한강공원점카페,,,"점심에 방문예약 없이 이용대기 시간 10분 이내 나들이연인・배우자, 아이"
2009816333,테라로사 잠실한강공원점카페,,,점심에 방문예약 없이 이용대기 시간 바로 입장나들이연인・배우자
2009816333,테라로사 잠실한강공원점카페,,,점심에 방문예약 없이 이용대기 시간 바로 입장연인・배우자
2009816333,테라로사 잠실한강공원점카페,,,점심에 방문예약 없이 이용대기 시간 바로 입장일상반려동물
2009816333,테라로사 잠실한강공원점카페,,,점심에 방문예약 없이 이용대기 시간 바로 입장일상연인・배우자
2009816333,테라로사 잠실한강공원점카페,,,점심에 방문예약 없이 이용대기 시간 바로 입장일상친구
2009816333,테라로사 잠실한강공원점카페,,,점심에 방문예약 없이 이용대기 시간 바로 입장친구
2009816333,테라로사 잠실한강공원점카페,,,점심에 방문예약 없이 이용대기 시간 바로 입장친목지인・동료
2009816333,테라로사 잠실한강공원점카페,,,점심에 방문예약 없이 이용대기 시간 바로 입장친목지인・동료
2009816333,테라로사 잠실한강공원점카페,,,점심에 방문예약 없이 이용대기 시간 바로 입장친목친구
2009816333,테라로사 잠실한강공원점카페,,,주말에 창가에 앉기에는 쉽지 않을것 같지만 생각보다 붐비지는 않아서 좋은것 같습니다. 잠실한강공원에 방문하신다면 추천드려요🤩😄😃
2009816333,테라로사 잠실한강공원점카페,,,"커피와 티라미수, 마들렌도 정말 맛있고 장소도 넓고 쾌적해요!"
2009816333,테라로사 잠실한강공원점카페,,,컵휘는 내 취향은 아닌가봄 괜찮은 정도지 특히 맛나게 느껴지지는 않음
2009816333,테라로사 잠실한강공원점카페,,,컵휘는 내 취향은 아닌가봄 괜찮은 정도지 특히 맛나게 느껴지지는 않음
2009816333,테라로사 잠실한강공원점카페,,,테라로사가 오픈해서 방문해보았어요 새로 오픈한 곳이라 만석일 정도로 손님이 많았네요 테라로사 커피가 맛있는건 말모말모~
2009816333,테라로사 잠실한강공원점카페,,,테라로사가 최초로 한강뷰를 가진 곳이 오픈했어요
2009816333,테라로사 잠실한강공원점카페,,,테라로사가 최초로 한강뷰를 가진 곳이 오픈했어요
2009816333,테라로사 잠실한강공원점카페,,,편안하게 쉬면서 한강 풍경을 보니 너무 힐링이 됐네요 ㅎㅎ 대중교통을 타고 가면 접근성이 좋지 않다는 게 약간 아쉬웠어요
2009816333,테라로사 잠실한강공원점카페,,,"한강 산책하다가 새로 오픈한 테라로사 잠실한강공원점 다녀왔어요. 8월 27일에 문 연 따끈한 신상 카페라 기대하고 갔는데, 역시 한강뷰 최고였어요 🌉"
2009816333,테라로사 잠실한강공원점카페,,,한강버스 구경갔다가 맛잇는 커피 마셨어요 뷰도좋고 자리도 좋네요👍🏻
2009816333,테라로사 잠실한강공원점카페,,,한강버스 구경갔다가 맛잇는 커피 마셨어요 뷰도좋고 자리도 좋네요👍🏻
2009816333,테라로사 잠실한강공원점카페,,,"한강버스 잠실선착장 3층에 위치한 테라로사입니다. 한강버스 기다리면서 간단히 먹고 마실 수 있는 쾌적하고 전망좋은 곳입니다. 그냥 나들이 나와도 좋죠. 한강전망보이는 자리들은 늘 빌 틈이 없습니다. 하우스쥬스(사과+비트)를 처음 마셔봤는데, 건강하면서도 달콤한 맛이 나네요."
2009816333,테라로사 잠실한강공원점카페,,,한강버스를 타기 전에 남은 시간에 티라미수와 차한잔을 먹었어요.
2009816333,테라로사 잠실한강공원점카페,,,한강뷰 자리는 금방 만석이고 반대편 자리는 여유로운 편이나 2인석으로 다인원이 앉기에는 무리(테이블 이어서 착석가능). 아기의자 있음. 케이크 맛있고 아기음료는 따로 없으나 우유가 있어 같이 즐길 수 있음.
2009816333,테라로사 잠실한강공원점카페,,,한강뷰 자리는 금방 만석이고 반대편 자리는 여유로운 편이나 2인석으로 다인원이 앉기에는 무리(테이블 이어서 착석가능). 아기의자 있음. 케이크 맛있고 아기음료는 따로 없으나 우유가 있어 같이 즐길 수 있음.
2009816333,테라로사 잠실한강공원점카페,,,한강뷰는 좋은데…기대보다 내부 인테리어가 기존 테라로사 보다 좀 못한듯..약간 싼티 ㅎㅎ
2009816333,테라로사 잠실한강공원점카페,,,한강뷰는 좋은데…기대보다 내부 인테리어가 기존 테라로사 보다 좀 못한듯..약간 싼티 ㅎㅎ
2009816333,테라로사 잠실한강공원점카페,,,한강뷰를 보며 평소 애정하는 테라로사 커피를 마시다니~너무 좋네요. 집근처라 산책하며 가기 좋아요'◡'
