가게ID,가게명,평점,날짜,리뷰내용
36084392,스테이크하우스 로아,,,스테이크와 파스타가 소리가 날 만큼 뜨겁게 서빙되어서 바로 먹었을 때 식감이 아주 좋았어요! 피자도 쫀득하고 맛있었습니당 토마호그 스테이크 진짜 맛있었구 토마토 파스타는 소스가 너무 맛있어서 소스만 몇번 더 떠먹구 했네요~ 맛있는 식사했습니다 근처에 갈 일 있으면 또 찾으려구요
36084392,스테이크하우스 로아,,,스테이크의 질이 좋아서 기분좋게 먹었습니다! 또 파스타랑 샐러드도 맛있어서 다들 아주 맛있게 저녁식사했어요!! 다음에도 이쪽에서 모임을 해야 한다면 고민없이 로아를 찾을 것 같아요👍 친졸하게 안내해주시니 꼭 들려보세요!!
36084392,스테이크하우스 로아,,,스테이크하우스 로아는 정말 맛있는 파스타 피자 스테이크 와인을 즐길 수 있는 곳이에요! 음식들이 신선한 재료와 풍부한 소스가 어우러져 정말 맛있어요!! 분위기도 아늑하고 서비스도 친절해서 자주 찾게 되는 곳입니다. 강력 추천드려요!
36084392,스테이크하우스 로아,,,식전빵이 너무 맛있어요! 에이드 양도 먾고 잠봉샐러드도 소스가 독특해서 ㅁ너무 맛있어요 또 먹고 싶은 맛!! 전체적으로 양이 먾아서 또 오고 싶습니다
36084392,스테이크하우스 로아,,,여러 가지 음식 모두 다 개성 있고 맛있어서 정말 먹는 내내 입이 행복했어요d=(^o^)=b 앞으로 이 쪽 올 때마다 항상 방문하고 싶네요 :)
36084392,스테이크하우스 로아,,,"연어구이 크림 리조또는 아이가 가장 좋아하는 메뉴인데요, 잘 구워진 연어가 큼직해서 더 좋았고 진한 크림 소스도 맛있었어요."
36084392,스테이크하우스 로아,,,오랜만에 방문 했는데 역시나 맛있었어요! 스테이크 굽기도 좋았고! 뚝배기 파스타도 맛있었어요! 특히 누릉지 진짜체고오오오!!
36084392,스테이크하우스 로아,,,오랜만에 방문 했는데 역시나 맛있었어요! 스테이크 굽기도 좋았고! 뚝배기 파스타도 맛있었어요! 특히 누릉지 진짜체고오오오!!
36084392,스테이크하우스 로아,,,옥수수뇨끼 비주얼이 좋은편인데 뇨끼 반죽도 설익음없이 담백하면서 고소한 맛이라 느끼해보이는데 바질덕분에 느끼하지 않고 벨런스가 좋움
36084392,스테이크하우스 로아,,,옥수수뇨끼 비주얼이 좋은편인데 뇨끼 반죽도 설익음없이 담백하면서 고소한 맛이라 느끼해보이는데 바질덕분에 느끼하지 않고 벨런스가 좋움
36084392,스테이크하우스 로아,,,"음식도 맛있고 분위기도 좋은 곳이에요. 해산물 토마토 파스타는 국물이 진하고 푸짐했고, 리조또는 새우와 고기가 잘 어울려서 맛있었어요. 크림 파스타도 고소하고 부드러워 만족스러웠습니다. 샐러드와 식전빵까지 깔끔하게 나와서 전체적으로 기분 좋은 식사였어요."
36084392,스테이크하우스 로아,,,인스타에서 보고 왔는데 기대했던 것 보다 더 맛있고 양도 진짜 많아요! 이 크기의 스테이크가 3만5천원인데 굽기도 너무 좋고 엄청 비싼 스테이크집이랑 치이도 없어요. 오랜만에 진짜 요리 잘하는 양식집을 찾아서 좋아요!
36084392,스테이크하우스 로아,,,저녁에 방문예약 후 이용대기 시간 바로 입장가족모임부모님
36084392,스테이크하우스 로아,,,저녁에 방문예약 후 이용대기 시간 바로 입장가족모임연인・배우자
36084392,스테이크하우스 로아,,,저녁에 방문예약 후 이용대기 시간 바로 입장가족모임연인・배우자
36084392,스테이크하우스 로아,,,"저번에도 와서 너무 만족한 나머지 재방문했습니다!! 정말 분위기 좋은 파스타 맛집이에요. 크림 파스타는 고소하고 진해 만족스러웠고, 로제 파스타는 새우랑 해산물이 푸짐하게 들어가서 풍미가 좋았어요. 샐러드와 식전빵도 깔끔하게 나와서 시작부터 기분 좋았고 음료까지 상큼하게 마무리할 수 있었네요. 전체적으로 플레이팅도 예쁘고 맛도 좋아 만족스러운 식사였습니다."
36084392,스테이크하우스 로아,,,"점심에 방문예약 없이 이용대기 시간 바로 입장가족모임아이, 연인・배우자"
36084392,스테이크하우스 로아,,,점심에 방문예약 없이 이용대기 시간 바로 입장데이트연인・배우자
36084392,스테이크하우스 로아,,,"점심에 방문예약 없이 이용대기 시간 바로 입장일상, 여행, 친목혼자, 친구"
36084392,스테이크하우스 로아,,,점심에 방문예약 없이 이용대기 시간 바로 입장일상연인・배우자
36084392,스테이크하우스 로아,,,점심에 방문예약 후 이용대기 시간 바로 입장데이트연인・배우자
36084392,스테이크하우스 로아,,,조끔매콤한데 계속끌리는맛이에어♡게맛살좋아하는데 두툼하게제공되니 너무잘먹었어여:)
36084392,스테이크하우스 로아,,,"주말 저녁 5시 45분쯤 방문했는데, 테이블 자리는 다 예약되어있어서 바테이블에서 먹었어요! 전반적으로 다 맛있었는데 터키식피자 피테가 진짜진짜 맛있어요👍 화이트와인이랑 페어링하면 더 맛있어요!!! 샐러드도 너무 신선하고 고급진 맛이었어요! 다음에 또 올게용"
36084392,스테이크하우스 로아,,,채끝스테이크랑 뚝배기 누룽지 파스타 먹었는데 양이 많아서 든든하니 맛있어요! 파스타에 해물도 많이 들어가고 매콤해서 딱이네요. 스테이크랑 조합 은근 좋아요. 고기 질긴거 싫어하는데 요긴 굽기도 적당하고 다음에 또 먹고싶어요.!!
36084392,스테이크하우스 로아,,,티본 스테이크 너무 맛있게 먹었네요! 부모님 모시고 왔는데 잘 드셨어요😍 다음에 또 올게요♥️👍
36084392,스테이크하우스 로아,,,티본 스테이크 너무 맛있게 먹었네요! 부모님 모시고 왔는데 잘 드셨어요😍 다음에 또 올게요♥️👍
36084392,스테이크하우스 로아,,,파스타는 역시나 여전히 맛있고 피데는 전보다 훨씬 더 맛있어 졌네요ㅎㅎ가성비도 너무 좋고 맛은 말모..💓 앞으로도 오래 장사해주세요!
36084392,스테이크하우스 로아,,,"플레이팅도 예쁘고 깔끔하게 나와서 데이트나 친구, 가족모임으로 분위기있게 식사하기 좋아요 스테이크 맛집이라고 들었는데, 오늘은 파스타만 먹었는데도 만족스러워요😋 스테이크도 너무 먹고싶게생겨서 다음에는 티본스테이크 먹어보려구요!"
36084392,스테이크하우스 로아,,,"피데가 진짜 맛있습니다!!!!👍👍 치즈 풍미도 좋고 도우도 쫄깃하고 넘 맛있어요ㅠㅠㅠㅠ 티본 스테이크도 가성비로 목었고, 구성이 알차서 좋았어요!ㅎㅎㅎㅎ 샤로수길 오면 이곳 추천해용"
36084392,스테이크하우스 로아,,,"피데가 진짜 맛있습니다!!!!👍👍 치즈 풍미도 좋고 도우도 쫄깃하고 넘 맛있어요ㅠㅠㅠㅠ 티본 스테이크도 가성비로 목었고, 구성이 알차서 좋았어요!ㅎㅎㅎㅎ 샤로수길 오면 이곳 추천해용"
1708386763,아란,,,https://m.blog.naver.com/nostalsokei7/223621604271
1708386763,아란,,,https://m.blog.naver.com/nostalsokei7/223621604271
1708386763,아란,,,n번째 방문.. 몇번을 가도 처음에 감동했던 그 맛 그대로입니다 특히 크림파스타가 진짜 맛있어요.. 여기만큼 맛있는 파스타가 없어요ㅠ 이번에 갔을때 알배추라고 새로생긴 메뉴가 있었는데 이것도 진짜 맛있어요 크림 알배추 강추!!
1708386763,아란,,,거의다 먹어본 것 같네요! 저의 원픽은 리조또입니다! ㅎㅎ
1708386763,아란,,,남자친구가 굉장히 만족한 레스토랑이에요!!! 파스타 소스가 되게 맛있고 아란치니의 라구 소스도 훌륭해오☺️💗 봉천역파스타 레스토랑으로 추천합니다❣️❣️
1708386763,아란,,,남자친구가 굉장히 만족한 레스토랑이에요!!! 파스타 소스가 되게 맛있고 아란치니의 라구 소스도 훌륭해오☺️💗 봉천역파스타 레스토랑으로 추천합니다❣️❣️
1708386763,아란,,,"남자친구와 데이트하러 방문했어요! 보섭살 스테이크, 갈릭 크림 파케리랑 사이드로 아란치니 2피스도 주문했어요. 음식들 모두 맛있었고 특히 파케리의 크림소스가 진해서 좋더라구요😊 재료가 아낌없이 들어가 있는 것도 마음에 들었어요!"
1708386763,아란,,,냄새 때문에 고르곤졸라 싫어하시던 분들이 드셔도 충분히 싹싹 긁을 맛입니다..
1708386763,아란,,,"넷이서 3인 세트(샐러드, 리조또, 갈릭 크림 피케리, 큐브스테이크)와 아란치니, 페이스트리 피자 주문해서 1인당 2만원 조금 안 되는 가격으로 배부르게 잘 먹었어요."
1708386763,아란,,,데이트로 저녁을 먹으러왔어요. 샐러드는 정말 순수한(?) 샐러드였지만 드레싱이 매우 좋았어요. 안심스테이크는 정말정말 부드럽고 맛있어요. 파스타도 매우 맛있습니다.
1708386763,아란,,,"동네 마실 나갔다 발견한 맛집입니다. 메뉴 가격이 저렴해서 큰 기대를 안했는데, 일단 플레이팅에 정성드린 점에서 놀랐구요. 요리들이 하나같이 맛있어서 너무 만족했습니다. 가격 생각안하더라도 곧 재방문 하려구요. 레스토랑에서 오랜만에 쉐프님께 감사한 마음을 느꼈습니다. 강추드려요."
1708386763,아란,,,"동네 마실 나갔다 발견한 맛집입니다. 메뉴 가격이 저렴해서 큰 기대를 안했는데, 일단 플레이팅에 정성드린 점에서 놀랐구요. 요리들이 하나같이 맛있어서 너무 만족했습니다. 가격 생각안하더라도 곧 재방문 하려구요. 레스토랑에서 오랜만에 쉐프님께 감사한 마음을 느꼈습니다. 강추드려요."
1708386763,아란,,,"둘이서 5만원도 안되는 금액으로 고급스러운곳에서 진짜 맛있고 배부르게 잘먹었어요~ 요리들이 하나같이 다 맛있고, 이가격에 이퀄리티가 맞나 싶을정도로 감탄밖에 안나와요👍🏻 웨이팅이 있을 수 밖에 없는 가성비와 맛 둘다 잡은 아란 추천합니다!"
1708386763,아란,,,"둘이서 5만원도 안되는 금액으로 고급스러운곳에서 진짜 맛있고 배부르게 잘먹었어요~ 요리들이 하나같이 다 맛있고, 이가격에 이퀄리티가 맞나 싶을정도로 감탄밖에 안나와요👍🏻 웨이팅이 있을 수 밖에 없는 가성비와 맛 둘다 잡은 아란 추천합니다!"
1708386763,아란,,,매장에 연인들이 많아 아이와 입장하기 순간 민폐아닌가 했습니다. 그래도 입맛 까다로운 딸이 스파게티 맛집을 찾아 갔는데 굿초이스 맛도 양도 딱 적당 하고 가격도 부담되지 않았어요. 재방문 100%
1708386763,아란,,,매장이 환기가 잘 안됨 기름냄새가 옷에 심하게 남아요
1708386763,아란,,,"봉천동 가성비맛집 레스토랑, 아니 봉천에 이런곳이 있었다니 ㅋㅋㅋ 진짜 반전이다! 지나가다 오~~ 여기 뭐야 사람 왜이렇게 많아? 하고 봤는데 아란이었다 ㅋㅋㅋㅋㅋㅋㅋㅋ 가격도 너무 좋고 음식도 맛있고 데이트장소로 강추👍🏻"
1708386763,아란,,,봉천동에 이런 행운같은 식당을 발견하다니ㅠㅠ 남자친구가 한입 먹고선 3초 정적이길래 왜이러나 싶었더니 너무 맛있서 충격이라더군요 저도 이어서 먹었는데 이 가격에 강남 고급 레스토랑 맛과 퀄리티가 나오는게 정말 신기할 따름.. 모든 메뉴들이 훌륭했고 간도 알맞게 맛있었어요 직원분들도 친절하니 좋았습니다. 여기는 전메뉴 다 맛보고 싶을 만큼 너무 만족스러운 곳이었어요. 다음에도 재방문할게요!
1708386763,아란,,,봉천동에 이런곳이 있다는걸 이제야 알았다니 ㅠㅠㅠ 옆동네로 이사가기전에 알았다면 정말 자주 갔을거에여!!!! 진짜 비주얼도 미쳤는데 가격도 너무 착하고 무엇보다 음식 퀄리티가 너무 좋아서 기념일에 방문하면 너무 좋을 것 같은 공간이였습니다❤️‍🔥❤️‍🔥❤️‍🔥
1708386763,아란,,,봉천에 이렇게 고급진 식당이 있는지 몰랐어요! 맛있게 먹고 편하게 수다떨다가 왔습니다!
1708386763,아란,,,"분위기가 좋고 음식이 맛있어요! 봉천역 근처에 이런 맛집이 있는 줄 몰랐네요 ㅎㅎ 데이트하기 너무 좋고, 저녁에 오면 와인 한 잔 해도 좋을 것 같아유 관자파스타 추천! 🥰👍 주말 1시에 갔는데 웨이팅이 좀 있었어요!"
1708386763,아란,,,"분위기가 좋고 음식이 맛있어요! 봉천역 근처에 이런 맛집이 있는 줄 몰랐네요 ㅎㅎ 데이트하기 너무 좋고, 저녁에 오면 와인 한 잔 해도 좋을 것 같아유 관자파스타 추천! 🥰👍 주말 1시에 갔는데 웨이팅이 좀 있었어요!"
1708386763,아란,,,분위기도 고급스럽고 음식도 넘 고급스러운 곳이에요. 가격은 착해서 정말 만족스러운 식사 했네요!😀 오리 스테이크 정말 부드럽고 맛있어요. 바질파스타는 향도 넘 좋고 파스타도 두툼해서 존맛... 크림까지 싹 먹음.. 아란치니도 저 소스가 킥 이에요...최고입니다..
1708386763,아란,,,분위기도 고급스럽고 음식도 넘 고급스러운 곳이에요. 가격은 착해서 정말 만족스러운 식사 했네요!😀 오리 스테이크 정말 부드럽고 맛있어요. 바질파스타는 향도 넘 좋고 파스타도 두툼해서 존맛... 크림까지 싹 먹음.. 아란치니도 저 소스가 킥 이에요...최고입니다..
1708386763,아란,,,"생각날때마다 방문하는데, 언제 방문해도 어떤 메뉴를 먹어도 항상 맛있는거 같아요 :) 배민으로 주문해서도 먹어봤는데 홀에서 먹는게 제일 좋았어요ㅎㅎ 조만간 또 방문할게요~! ✨"
1708386763,아란,,,스테이크 맛집입니다. 파스타도 맛있었고 필라프도 너무 맛있었다..!전반적으로 모든음식이 맛도 좋았고 가성비도 너무 좋아요..🥹
1708386763,아란,,,스테이크 맛집입니다. 파스타도 맛있었고 필라프도 너무 맛있었다..!전반적으로 모든음식이 맛도 좋았고 가성비도 너무 좋아요..🥹
1708386763,아란,,,"스테이크 파스타 샐러드 정석적인 조합으로 먹었어요! 식전빵부터 샐러드 맛있었구요. 샐러드가 뭔가 부드러워서 맛있었어요! 스테이크는 부채살 무난하게 먹었고, 파스타가 짱신기했는데 갈릭크림파케리라는거였어요. 넓적대기파스타 느낌인데 은근 배부르더라구요. 포만감 짱짱! 스테이크파스타 조합에 샐러드추가 추천드립니다👍"
1708386763,아란,,,"스테이크부터 리조또, 파스타 거를 거 하나없이 전부 맛있게 먹고 왔어요 ㅠㅠㅠㅠㅠ 원래 리조또 그렇게 좋아하는 편이 아닌데 너무 맛있어서 싹싹 긁어먹고 왔네요 ㅎㅎ 양도 많고 가격도 합리적이라 또 방문할 거예요🥰"
1708386763,아란,,,"스테이크부터 리조또, 파스타 거를 거 하나없이 전부 맛있게 먹고 왔어요 ㅠㅠㅠㅠㅠ 원래 리조또 그렇게 좋아하는 편이 아닌데 너무 맛있어서 싹싹 긁어먹고 왔네요 ㅎㅎ 양도 많고 가격도 합리적이라 또 방문할 거예요🥰"
1708386763,아란,,,"아빠 생신 모임으로 갔는데 일단 들어가자마자 분위기가 너무 좋았고 일하시는 분들도 친절하셨습니다. 2인, 3인 세트 각각 시켜서 먹었는데 샐러드가 너무나 신선했고 이후에 나온 오리, 안심 스테이크, 트러플 파스타, 갈릭 크림 파케리, 라구, 나중에 추가한 리조또까지 다 너어어무 맛있었습니다! 한 가지 쪼금 아쉬웠던건 피클을 따로 내어주시진 않아서 나중에 리조또 시켜먹을 때쯤 부모님께서 나중에는 조금 느끼해하셨는데 처음에 파스타, 스테이크 먹을 때는 너무 맛있어서 아무 생각이 안 들었어요 ㅎㅎ 이사온지 얼마 안 됐는데 정말 애정하는 동네 맛집이 될 것 같아요 ㅎㅎ 나중에 무조건 또 방문하거나 배민으로 다른 메뉴들도 먹어보려고요. 특별한 날에 아란 강추합니다!"
1708386763,아란,,,저 멀리멀리 경기도에 사는데 나중에 이거 먹으러 또 봉천동에 오고 싶을만큼 맛있었어요👍식구들이 파스타를 좋아해서 아무 생각없이 다 파스타만 시켰는데 피자도 시킬걸 그랬네요🥺
1708386763,아란,,,저 멀리멀리 경기도에 사는데 나중에 이거 먹으러 또 봉천동에 오고 싶을만큼 맛있었어요👍식구들이 파스타를 좋아해서 아무 생각없이 다 파스타만 시켰는데 피자도 시킬걸 그랬네요🥺
1708386763,아란,,,저녁에 방문예약 없이 이용대기 시간 10분 이내 데이트연인・배우자
1708386763,아란,,,"저녁에 방문예약 없이 이용대기 시간 바로 입장데이트, 일상연인・배우자"
1708386763,아란,,,"저녁에 방문예약 없이 이용대기 시간 바로 입장데이트, 친목연인・배우자"
1708386763,아란,,,저녁에 방문예약 없이 이용대기 시간 바로 입장데이트연인・배우자
1708386763,아란,,,저녁에 방문예약 없이 이용대기 시간 바로 입장일상혼자
1708386763,아란,,,저녁에 방문예약 없이 이용대기 시간 바로 입장친목친구
1708386763,아란,,,저녁에 방문포장·배달 이용대기 시간 바로 입장데이트연인・배우자
1708386763,아란,,,점심에 방문예약 없이 이용대기 시간 바로 입장데이트연인・배우자
1708386763,아란,,,"점심에 방문예약 없이 이용대기 시간 바로 입장일상연인・배우자, 아이"
1708386763,아란,,,"주문량이 많아서 그런지 음식 나오는데 조금 오래 걸렸고, 알배추 샐러드는 오버쿡 되어서 저번보다 아쉬웠어요ㅠㅠ 단체 주문임에도 뚝딱뚝딱 잘 요리해주셨는데 소규모로 방문할 때가 더 인상적으로 맛있었던 것 같아요! 주문이 몰리니 내부도 환기가 덜 되어서 아쉬웠습니다! 최대 4인 방문이 좋을 것 같아요🙂"
1708386763,아란,,,중독성이 말도 안돼요... 잘먹고 쌀쌀한 날 좋은 분위기 즐기다가 갑니다 ~
1708386763,아란,,,중독성이 말도 안돼요... 잘먹고 쌀쌀한 날 좋은 분위기 즐기다가 갑니다 ~
1708386763,아란,,,크림파스타는 크림 풍미도 좋고 적당히 꾸덕하고 고소해서 정말 맛있었고요! 앤초비도 풍미가 좋아 정말 맛있게 먹었어요! 오리 스테이크는 소스가 양식+중식 풍이 섞인 느낌이고 와인향이 많이 나서 독특했어요! 아란치니도 겉에 완전 바삭하고 소스도 맛있었습니다! 이날의 원픽은 알배추였어요!!! 불맛도 나고 소스도 맛있고 완벽했습니다✨
1708386763,아란,,,패스... 아무튼 방문하면 돈이 전혀 아깝지 않은 경험을 하게 되실거에영 맛 보장 분위기 보장!
1708386763,아란,,,"👏 필라프와 쿰피르, 아란치니 모두 다른 곳에서 맛보지 못한 아란만의 매력이 돋보이는 메뉴였어요!"
1136183514,쥬벤쿠바 샤로수길 본점,,,9살 딸아이랑 3가족 외식 나왔어요. 개취겠지만... 투움바 지금까지 먹은 것 중 역대급으로 맛나게 먹었어요. 아이도 스테이크랑 감튀 순삭 해버렸네요 담에는 또 다른 메뉴 좀 먹어봐야겠어요. 직원분도 넘나 친절하심!
1136183514,쥬벤쿠바 샤로수길 본점,,,"• 폭립은 진짜 대박이었습니다! 겉은 바삭, 속은 촉촉해서 육즙 가득 터지고 양념도 달콤짭짤하니 딱 맛있었어요."
1136183514,쥬벤쿠바 샤로수길 본점,,,"낙성대 놀러갔다가, 파스타가 먹고 싶어 우연히 가본 음식점인데, 파스타도 굉장히 맛있고 샨드위치도 진짜 맛있었어요! 주말 오후에 맛있는 거 드시고 싶으면 추천해여~!"
1136183514,쥬벤쿠바 샤로수길 본점,,,남친 생일파티겸 점심데이트로 어디 갈지 찾다가 맛있어 보여서 와봤는데 정말 맛있었어요 고기랑 빵이 너무 부드럽고 파스타도 정말 맛있어요!! 양도 많아요 아주 배불리 먹었습니다
1136183514,쥬벤쿠바 샤로수길 본점,,,남친이랑 왔는데 넘 맛있어용~! 특히 쿠바 샌드위치 빵이 질기지 않고 바삭하고 따뜻해서 좋았어요!! 샐러드 드레싱이 진짜 상큼하고 맛있었어요🫶 엔초비봉골레 먹어보고 싶었는데 품절이래서 카리브 파스타 시켰는데 이것도 넘 맛있네용!!💕👍 담에 와서 봉골레 꼭 먹어보고 싶어용🤤
1136183514,쥬벤쿠바 샤로수길 본점,,,"다같이 나눠먹기에 너무 좋은 메뉴들이 많고, 세트 구성도 알차게되어있어서 선택 못하는사람들에게 최적....."
1136183514,쥬벤쿠바 샤로수길 본점,,,"따뜻한 음식은 아메리칸미트 라이스를 먹었는데, 뭐라고 표현해야 할지는 잘 모르겠지만(..) 맛있었어요 :)"
1136183514,쥬벤쿠바 샤로수길 본점,,,맛집에 진심인 지인 추천으로 방문하게 되었어요〰️ 감자튀김 바삭바삭하고 쿠바 샌드위치 너무너무 맛있어요~ 같이 나온 소스랑 곁들여 먹으니 짱짱✨ 투움바 파스타 시켜봤는데 두툼한 새우에 느끼하지 않게 살짝 매콤하니 맛있네요😘 식전 샐러드도 맛도리네요🩷 재방문 의사 100%입니당👏🏻
1136183514,쥬벤쿠바 샤로수길 본점,,,"메뉴 뿐만 아니라 분위기도 너무 좋고, 사장님도 친절하셔서 친구와 함께 하는 시간이 더욱 즐거웠습니당:)"
1136183514,쥬벤쿠바 샤로수길 본점,,,"봉골레 엔쵸비 파스타와 쿠바 샌드위치 세트를 먹었는데 정말 만족스러웠습니다. 파스타는 엔쵸비의 감칠맛과 봉골레의 시원한 맛이 잘 어울렸고, 샌드위치는 처음 먹어보는 맛이었는데 맛있었어요. 생맥도 맛있음 추천!"
1136183514,쥬벤쿠바 샤로수길 본점,,,"상큼한 유자 드레싱 베이스 샐러드, 파니니의 바삭함과 햄치즈의 조화가 어우러지는 샌드위치, 트러플 향이 가미된 녹진한 비프 크림리조또 어느하나 모자랄 것 없이 맛있었네요. 같이 곁들인 와인도 조화로웠습니다. 다음에도 또 오려구요!"
1136183514,쥬벤쿠바 샤로수길 본점,,,샌드위치가 먹고싶어서 방문했는데 샌드위치세트의 구성이 너무 알차서 좋았어요 감튀도 너무 맛있고 코울슬로랑 샐러드도 같이 시킨 투움바 파스타랑 딱 알맞았네요~ 투움바 파스타도 완전 강추입니다!!!새우도 튼실하고 너무 좋았어요 또 방문할게요~~
1136183514,쥬벤쿠바 샤로수길 본점,,,샌드위치는 바삭 콰삭해서 식감이 좋고 고기도 육즙이 좋았어요! 카리브 파스타도 적당히 매콤해서 샌드위치와의 조화가 좋구요! 전반적으로 런치세트 가성비가 좋은 것 같아요! 재방문의사 있습니다!
1136183514,쥬벤쿠바 샤로수길 본점,,,샌드위치도 기대 안하고 먹었는데 너무 맛있고 봉골레도 비리거나 그런거 하나도 없고 깔끔하고 너무 맛있고 잠발라야도 간도 적당하고 치킨도 엄청 큼직하게 들어가 있어서 맛있게 잘 먹었어요!
1136183514,쥬벤쿠바 샤로수길 본점,,,"샤로수길 맛집 쥬벤쿠바! 엄마 생일 기념으로 외식했어요. 엄마가 먹고싶다했던 폭립세트 시켰는데 구운 새우, 빵, 야채, 감튀, 닭고기에 폭립까지 대혜자.. 느끼하지도 않고 너무 맛있어서 다 먹었어요!! 샤로수길 맛집으로 추천합니다🥰"
1136183514,쥬벤쿠바 샤로수길 본점,,,샤로수길맛집 서울대맛집 쥬벤쿠바 다녀왔아요. 친구추천으로 왔는데 연휴인데도 사람이 가득찼어요! 파스타도맛있고 스테이크도 맛나요!!! 🫶🏻
1136183514,쥬벤쿠바 샤로수길 본점,,,서울대 부근 맛집으로 유명한 곳이라 들렀구요. 다행히 예약없이 바로 들어갈 수 있었어요. 인테리어도 멋스럽고 음식도 너무 맛있네요. 맛있다고 중학생 딸이 특히 너무 좋아했어요. 후기 많고 유명한 이유가 있네요~^^
1136183514,쥬벤쿠바 샤로수길 본점,,,아메리칸 라이스 상상했던것보다 맛이 복합적이고 좋네요 ㅎㅎ 라구는 타코같은 맛이 나고 야채는 불맛나는데 식감이 살아있어요! 아이도 좋아했어요 ㅋㅋ
1136183514,쥬벤쿠바 샤로수길 본점,,,엄마가 넘 맛있다고 추천하셔서 와봤는데 넘 기대이상으로 좋았어용. 솔직히 샌드위치 기대 일절 안했는데 너무 맛있었고 같이 나온 소스도 중독적이고 좋았습니당
1136183514,쥬벤쿠바 샤로수길 본점,,,엔쵸비봉골레는 ㅎ 최근 먹은 파스타 중 제일 맛있었어요 진짜 다들 먹어줬으면 좋겠다..... 에이드도 시럽 이런거 아니고 과즙 완전 잘 느껴져요 거의 뭐 제주도 온 기분
