가게ID,가게명,평점,날짜,리뷰내용
1136183514,쥬벤쿠바 샤로수길 본점,,,여긴 모든 메뉴가 다 맛있어요 ꒰ ⸝⸝ɞ̴̶̷ ·̮ ɞ̴̶̷⸝⸝꒱
1136183514,쥬벤쿠바 샤로수길 본점,,,연남동 점을 종종 방문했었는데 영업 종료로 본점을 찾아왔어요! 늘 먹던 샌드위치와 처음 먹어보는 메뉴도 시켜봤는데 리조토가 진짜 맛있었어요. 다음에는 또 색다른 메뉴를 시켜보겠습니다!
1136183514,쥬벤쿠바 샤로수길 본점,,,"예전에 학생 때 자주 가던 곳인데, 오랜만에 와보니 외관도 세련되고 분위기도 훨씬 좋아졌네요. 페퍼로니 쿠바 샌드위치와 엔초비 봉골레 파스타를 런치세트로 주문했는데, 맛과 양 모두 만족스러워서 기분 좋은 식사였습니다 :) 런치세트 추천드려요!"
1136183514,쥬벤쿠바 샤로수길 본점,,,"오늘 남자친구와 함께 오랜만에 양식을 먹으러 왔는데요, 제가 평소에 양식을 즐겨먹지 않지만 여긴 좀 다른 것 같아 와봤습니다! 우선 투움바파스타가 진짜 맛있었어요 그 아웃백보다도 맛있는게 맞는것 같아요ㅎㅎ쥬벤쿠바 런치세트를 시켰고 양이 적을까 살짝 걱정했는데 전혀 아니었구요! 쿠바샌드위치는 처음 먹어봤는데 다음에 이거 먹으러 남친이 또 오자고 하네요ㅎㅎ 전체적으로 정말 만족스러웠습니다! 또올집 강추!!👍👍"
1136183514,쥬벤쿠바 샤로수길 본점,,,"오늘 남편이랑 결기 2주년이라 분위기 낼 겸 샤료수길 왔다가 방문했어요 !! 폭립을 너무 좋아해서 파운드 폭립 플래터 주문했는데 폭립 지인짜 부드럽고, 구성이 좋아 푸짐하게 먹고 왔네요 ㅎㅎ 너무 자극적이지도 않고, 적당히 간이 좋아 맛있게 먹었어요~~ 사람이 많던데 먹고나니 왜 많은지 이해가 갔어요 ㅋㅋ다양한 메뉴가 많아서 여럿이서 와서 여러개 시켜 보고 싶어요^^ 잘 먹고 갑니당"
1136183514,쥬벤쿠바 샤로수길 본점,,,오랜만에 부모님이랑 점심 외식하려는데 아버지가 검색으로 찾으셔서 방문했어요! 사전정보 없이 왔는데 기대 이상으로 너무 맛있네용 폭립플래터 고기가 진짜 짱이에요 ....... 넘 부드럽고 살살 녹아요 🥹 아부지 입맛이 굉장히 까다로우신데 맛있다고 하셨어요 친절하시고 깔끔한 가게예요 번창하세요 ~~✨️
1136183514,쥬벤쿠바 샤로수길 본점,,,"음식은 하나하나 정성이 담긴 게 느껴졌습니다. 잠발라야는 풍미가 깊고 입안에서 조화롭게 어우러져 감탄이 절로 나왔고, 투움바 파스타는 크리미하면서도 느끼하지 않고 고소한 맛이 일품이라 여자친구도 특히 좋아했습니다. 함께 곁들인 오렌지주스와 아메리카노도 음식과 잘 어울려서 더 맛있게 즐길 수 있었어요."
1136183514,쥬벤쿠바 샤로수길 본점,,,이런 가격에 이렇게 훌륭한 음식을 먹을 수 있는 곳이 있어서 행복합니다 =]
1136183514,쥬벤쿠바 샤로수길 본점,,,"일단 매장 분위기가 너무나 좋습니다. 여자친구랑 일 끝나고 맛집 찾다가 우연히 발견했는데 왕대박 성공이었습니다. 샌드위치 너무 맛있구요, 투움바 ? 말할 것도 없습니다. 연인이나 가족끼리 특별한 추억을 남기고 싶다면 쥬펜쿠바 샤로수길점으로 오세요. 후식으로 주시는 티라미수도 JMT…"
1136183514,쥬벤쿠바 샤로수길 본점,,,자주 오는 곳 인데 여전히 맛있네요 🩷 직원분들도 너무 친절 하시고 음식도 너무 너무 맛있어요 탄단지 골고루 야채까지 있어 든든 하네요 🩷 특히 샌드위치 진짜 독보적이에요 소스랑🩷
1136183514,쥬벤쿠바 샤로수길 본점,,,잠발라야 리조또 폭립플래터 투움바 파스타 시켜 먹었는데 진짜 맛있어요!! 아x백보다 파스타가 맛있는거같아요 ㅋㅋㅋ 완전 갓성비 샤로수길 맛집입니당
1136183514,쥬벤쿠바 샤로수길 본점,,,저녁에 방문예약 후 이용대기 시간 바로 입장친목친구
1136183514,쥬벤쿠바 샤로수길 본점,,,"점심에 방문예약 없이 이용대기 시간 바로 입장일상, 친목친구"
1136183514,쥬벤쿠바 샤로수길 본점,,,주변 쿠바 2인세트를 시켰습니다. 샐러드의 유자 향이 은은한게 치즈와 함께 잘 어울렸습니다. 오렌지에이드도 과육이 들어가있어서 상큼한게 요리와 함께 먹기 좋았습니다. 샌드위치는 같이 나온 갈릭 소스를 찍어 먹으면은 정말 맛이 환상적이었고 감자튀김은 너무 바삭바삭해서 좋았습니다!! 투움바파스타는 안에 게살이 찢어져 들어가 있어서 면을 먹을 때 같이 들어와서 부드럽고 맛있었습니다. 살짝매콤해서 느끼하지 않게 즐길 수 있었습니다.
1136183514,쥬벤쿠바 샤로수길 본점,,,쥬벤쿠바 진짜 샤로수길에서 몇년동안 꾸준하게 가게되는곳 같아요. 특히 샌드위치가 아주 맛있고 파스타들도 다 메뉴들이 특이한데 아무거나 시켜도 실패가 없는 맛집이예요! 런치세트가 구성이좋습니다!
1136183514,쥬벤쿠바 샤로수길 본점,,,쥬벤쿠바 쿠바샌드위치 너무너무 맛있어요ㅠㅠ 아메리칸 라이스는 진짜 대박이에요! 라구 소스도 듬뿍 들어서 고소하고 풍미가 진짜 좋아요. 쿠바 샌드위치랑 같이 먹으면 완전 든든하고 조합도 최고예요. 재방문 의사 100%!입니다!!
1136183514,쥬벤쿠바 샤로수길 본점,,,지인에게 추천받아 방문했습니다. 평소 스파게티를 좋아하는 편이 아닌데도 투움바 파스타 아주 맛있게 먹었습니다. 샌드위치도 샐러드도 맛있습니다. 런치 세트로 가성비있게 즐겼습니다. 재방문 의사 있습니다.
1136183514,쥬벤쿠바 샤로수길 본점,,,첫방문인데 바로 입장할수 있어서 좋았고 샌드위치 빵이 굽기가 딱이였어요 바삭하고 속은 촉촉해요ㅎㅎ투움바 좋아하는데 맛있게 잘 먹었습니다. 갈릭소스에 샌드위치 찍어먹어봤는데 맛있어요
1136183514,쥬벤쿠바 샤로수길 본점,,,"친구들이랑 청첩장 모임겸 만났는데 안쪽에 룸형식 공간도 있고, 이야기하기도 딱 좋아요!!"
1136183514,쥬벤쿠바 샤로수길 본점,,,"쿠바샌드위치와 파스타, 플래터 메뉴가 맛있는 식당입니다. 투움바파스타가 생각날때 종종 방문하는데 항상 기대를 충족시켜주어 맛있게 먹었습니다."
1136183514,쥬벤쿠바 샤로수길 본점,,,쿠바식 샌드위치를 파는 쥬벤쿠바!! 오늘은 파스타와 치킨 스테이크 필라프 볶음밥이 먹고 싶어서 왔는데 역시나 사람이 많은…🥺항상 인기가 많은 곳이에요!
1136183514,쥬벤쿠바 샤로수길 본점,,,쿠바요리 전문점 쥬벤쿠바! 샤로수길 데이트 나왔다가 검색해서 오게 된 집인데요 가게 분위기가 좋고 직원분이 친절했어요 잠발라야와 쿠바샌드위치 오리지널 세트 시켰고 맛있어서 대만족
1136183514,쥬벤쿠바 샤로수길 본점,,,파스타 하나로 조금 부족하셨다면 다음 방문때에는 샌드위치 없이 식사메뉴로만 구성된 '근사한 세트'는 어떠실까요??😄😄
1136183514,쥬벤쿠바 샤로수길 본점,,,"폭립세트의 구성이 알차고 양이 넉넉해서 좋았어요. 새우가 크고 폭립이 부드러우며 닭갈비, 양파볶음,소시지, 버섯구이가 좋네요. 무엇보다 크림리조또가 기대이상의 맛으로 큰 만족감을 주어서 재방문 하고 싶은 곳이에요"
1136183514,쥬벤쿠바 샤로수길 본점,,,"할머니,가족들이 먼저 와보시고 맛있는곳이라고 또 데리고와주셨어요!!! 세트랑 단품 다양하게 주문했는데 하나하나 너무 다 맛있어요! 오래된 음식점이라 더 믿음이 가요! 가족식사하기도 딱이네요!직원분들도 친절하시고 아주 추천합니다!"
1136183514,쥬벤쿠바 샤로수길 본점,,,항상 사람 많아서 못와보다가 예약해서 첨 먹어봤는데 진짜 무지하게 맛있으요!!!!! 샘드위치도 잠발라야도•• 특히 봉골레파스타거 진짜 개마싯어서 식사 대접하는데도 넘 좋았습니다!!!! 쿠바 음식 짱!!🤙🏻🤙🏻🤙🏻
1910675243,치즈메이트,,,“사육해주셔서 무럭무럭 크고 있다”는 표현에 웃음과 감동이 동시에 왔어요ㅋㅋ 고객님의 애정 어린 표현이 저희에겐 큰 힘이 됩니다💛
1910675243,치즈메이트,,,건강한음식 먹고싶었는데 스테이크랑 샐러드 정말 신선하고 맛있었구요!
1910675243,치즈메이트,,,"고민하다 세트메뉴로 주문했는데 메뉴 구성이 넘 좋았고, 스파클링 와인으로 금액추가하고 변경했는데 달달하니 넘 맛있어서 음식하고 잘 어울렸어요 👍🏻"
1910675243,치즈메이트,,,뇨끼 트러플이 진짜 너무 잘 어울림 그리고 뇨끼는 약간 다른 곳보다 더 부드러운 느낌이에요
1910675243,치즈메이트,,,뇨끼가 엄청 쫄깃하니 맛있고 초당옥수수크림도 중독적이였어요🥹 매콤한 페페로니아라비아따와 잘 어울렸어요! 꾸수한 치즈 좋아하면 완전 치즈치즈한 게살 맥앤치즈도 너무 취향저격이였어요. 인테리어도 톰과제리로 귀엽고 키치해요
1910675243,치즈메이트,,,뇨끼가 특히 눈에 띄는 메뉴입니다. 겉이 바삭하고 속은 부드러우면서 절묘하게 쫀득해요! 이 절묘함을 어떻게 만드시는 건지 감탄이 나와요 항상. 트러플머쉬룸뇨끼의 경우 크림소스를 안 좋아하는 사람들도 맛있다고 항상 말하네요 ㅎㅎ 짱!
1910675243,치즈메이트,,,"단호박 스프와 브레드부터 치즈세트메뉴(뉴욕스트립/트러플머쉬룸뇨끼/부라타치즈샐러드)에 라자냐 하프, 리뷰이벤트로 주신 서비스 메뉴로 든든하게 저녁 먹었습니다."
1910675243,치즈메이트,,,"대박맛있어용 식전빵도 주시고,,, 식후 디저트 티라미수까지 먹었는데 진짜 대박 맛있었어요 로투스와 조화가 미쳐써요.. 꼭 드셔보세요✨"
1910675243,치즈메이트,,,"둘이서 저만큼 먹었는데 3.6만원 밖에 안나온게 안믿겨요!! 기본으로 제공해주시는 스프와 빵(아주 훌륭한 애피타이저 였습니다!!!), 리뷰이벤트로 받은 아란치니(아주 클래식해서 맛있게 먹었어요) 뿐 아니라, 식후에 주신 서비스 소화효소까지... 정말 기분 좋은 한끼였습니다. 뇨끼알 사이즈가 작아서 자르지 않고 한입에 먹을 수 있어서 좋았어요! 뇨끼와 라자냐 모두 단 하나의 거슬림도 없이 먹었답니다ㅎㅎ"
1910675243,치즈메이트,,,디저트 티라미수가 진짜 캐맛있어서 포장하고 싶었는데 개수가 모자라 아쉬웠어용 다음에 또 오겠습니다
1910675243,치즈메이트,,,라자냐 뇨끼 티라미슈 아란치니 다 너무 맛있어요:) 단호박 크림 너무 부드럽고 뇨끼식감도 너무좋아요. 라자냐는 먹어본것중 젤맛있는것같아요.
1910675243,치즈메이트,,,라자냐 먹고 싶어서 친두랑 같이 갔는데 기대 이상이었습니다. 식전 스프와 빵도 주셨고 서비스로 받은 아란치니도 맛있어요! 뇨끼도 퐁신퐁신하고 라자냐의 라구 소스도 취저입니다! 다음에는 단호박 뇨끼도 먹어보려구요! 🤤
1910675243,치즈메이트,,,마지막에 먹은 티라미수도 넘무 맛있었습니다 🥹🧡
1910675243,치즈메이트,,,맛도 맛인데 먼저 분위기가 너무 좋아요!! 직원 분들도 친절하시고 메뉴 하나하나 다 예쁘게 담겨 나와서 좋았습니다. 그리고 베스트에 뇨끼가 있길래 먹어봤는데 진짜 맛있었어요. 다른 집들에서 뇨끼 먹었을 땐 엥 생각보다 맛있진 않네 했었는데 여긴 달랐습니다 ㅠㅠ... 덕분에 좋은 시간 보낼 수 있었습니당!!!
1910675243,치즈메이트,,,맛있어보이는 게 많아서 못 고르겠어서 어쩌다 보니 사이드를 조졌는데 다 맛있었어요! 특히 게살 마카로니ㅜㅜ 다음에는 파스타를 먹어보고 싶어요~ 매장 너무 예쁘구 직원분도 너무 친절하셨어요 감샵니당
1910675243,치즈메이트,,,맛집지도에 저장해두었다가 샤로수길 올릴있어서 바로 찾아와봤어요~♡ 치즈러버인 저는 넘나 만족하고 갑니다 ^^ 라자냐 넘 맛있구요~ 개살세우로제도 맛있었어요! 다음번엔 라자냐와 다른 파스타도 도전해보려구요 ^^
1910675243,치즈메이트,,,맨처음 나오는 단호박수프부터 치즈향이 진하게 나고 풍미가 깊어서 맛있었어요! 이어서 나온 메인디쉬들도 다 하나같이 깔끔하고 맛있었습니다. 특히 치즈 뇨끼… 쫀득한 맛에 최애메뉴였어요ㅎㅎ
1910675243,치즈메이트,,,"메뉴는 뭐 하나 빠지는 게 없이 다 맛있었고, 치즈와 다양한 재료들의 조화가 환상적이었어요. 가족 모두 입맛이 다른데도 전부 만족했을 정도니 말 다 했죠."
1910675243,치즈메이트,,,볼로네제 쟌슨빌 파스타는 소스가 진하고 쟌슨빌 소시지가 푸짐하게 들어가 있어서 한 그릇 먹고 나면 든든합니다. 🍝
1910675243,치즈메이트,,,"사장님도 친절하시구 메뉴도 다양하구 제가 여태까지 먹어본 뇨끼, 샐러드, 스테이크 중에 넘버원이에요ㅜㅜ🤍진짜 맛집 인정쓰..댕댕이 데리구 갔는데 브레이크타임 직전이라 손님없다구 잠시 꺼내놓아두 된다구 하시구 쏘스윗..음식맛도 쏘스윗..다음에 또 재방문 무조건입니다ㅜㅜㅜㅜ담에 도 또 맛있는 음식 기대할께요 그때는 예약후 더 기분좋게 뵈어요☺️😚"
1910675243,치즈메이트,,,샤로수길맛집 인정입니다 그냥 주시는 식전빵도 빠삭 쫄깃한데 옥수수 스프도 진짜 맛있어오!! 크림파스타 먹을때는 꼭 베이컨을 잘라서 한입에 한번씩 넣어서 먹어주세요.. 저는 크림파스타가 젤 맛있었는데 남자친구는 로제가 젤 맛있다고 합니다.. 걍 다 맛있는듯 담에 또 올게요 :)
1910675243,치즈메이트,,,"서울대입구역 샤로수길 데이트와 모임 모두 환영하는 저희 매장에 또 놀러오세요! 뇨끼, 라자냐, 파스타, 스테이크 등 시즌마다 바뀌는 메뉴도 준비하고 있답니다🍽💛"
1910675243,치즈메이트,,,서울대입구역맛집 치즈메이트! 라자냐랑 뇨끼 먹고왔는데 너무 맛있게 먹고 왔어요 치즈를 듬뿍 아끼지 않고 넣은게 느껴지는 맛이었습니다. 식전빵이랑 스프도 맛있었어요! 샤로수길 맛집 찾으신다면 강력추천드립니다👍🏻👍🏻
1910675243,치즈메이트,,,세트구성이 너무 알차고 좋아서 여기 오신다몀 세트 적극추천!! 파스타도 있옸는데 신나서 먹느라 못찍었네요 음식 하나하나 다 맛있고 사장님도 친절하세용
1910675243,치즈메이트,,,소스도 다양하고 재료도 신선하게 느껴져서 전반적으로 만족스러워요
1910675243,치즈메이트,,,"식전빵과 스프부터 샐러드, 파스타, 스테이크, 치즈볼, 디저트(피스타치오 치즈 바스크 꼭 드시길-추천⭐️)까지 메뉴 하나하나 정말 다 맛있어요!!ㅠㅠㅠ 호우를 뚫고 찾아간 보람 가득하고 궂은 날씨에도 사람들이 계속 찾아오는 이유가 있었어요🥹 정말 친절하시고 요청하기 전에 먼저 알아서 서비스해주셔서 기분 좋은 식사였어요~ 조만간 또 먹으러 갈게용❣️"
1910675243,치즈메이트,,,식전스프와 빵을 주시는데 스프가 시판이랑 비교도 안되게 맛있고 주기적으로 스프를 변경해서 다음에 방문할 따 다른 맛 맛볼 수 있고 좋더라구요
1910675243,치즈메이트,,,"오늘로 22번째 방문이에요 ㅎㅎ 뇨끼가 적당히 쫀득하면서 부드러워서 좋아요. 감자, 수분, 밀가루의 배합을 적절히 맞춰야 가능한 맛이죠. 제가 만들면 이렇게 안 나와서 더 신기해요 ㅋㅋ"
1910675243,치즈메이트,,,오늘로 23번째 방문! 오늘은 서비스로 와인을 주셔서ㅜㅜ 맛있었어요 ㅎㅎ 탄닌 맛이 많이 안 나서 제 취향이었습니다. 뇨끼를 포함해 다른 음식들도 다 맛있었어요! 항상 만족스럽습니다 :)
1910675243,치즈메이트,,,우선 사장님이 친절하세요! 빈 다른 테이블도 있었는데 예쁜 자리에 앉을 수 있게 빠르게 정리 후 안내해주셨어요. 음식 모두 맛있고 너무 예뻐요. 특히 라자냐랑 뇨끼 정말 맛있어요. 서비스로 먹은 어니언링이랑 티라미수도 정말 맛있어요. 인테리어도 너무 예쁘고 치즈 덕후 데이트 잘하고 갑니다🧀
1910675243,치즈메이트,,,이번이 아마 25번째 방문이에요! ㅋㅋㅋ 항상 똑같은 말만 하는 것 같지만…음식이 다 맛있어요! 품질을 유지하려고 사장님께 뚝심있게 노력하신다는 거죠~
1910675243,치즈메이트,,,"입맛이 예민한 신랑이 맛있다고 데려와서 먹었었는데, 지금은 자주 가는 맛집이에요~! 날이 갈수록 더 맛있어지는것 같습니다. 식전빵과 같이나오는 스프부터 파스타, 뇨끼, 스테이크, 디저트까지 뭐하나 거를게 없어요! 항상 싹싹 긁어먹고 옵니다. 오래오래 장사해주세요😄😄"
1910675243,치즈메이트,,,"자극적이지 않고 적당한 간에 모든 음식 궁합이 조화롭고 적당한 볼륨의 음악도, 넓지 않은 매장이지만 아늑한 기분이 들어 마지막까지 기분 좋은 식사를 할 수 있어 너무 행복했습니다🥺💜 좋은 음식을 만들어 주셔서 진심으로 감사드려요🙏🏻 더더 번창하세요!!!!!!💪🏻💪🏻"
1910675243,치즈메이트,,,자주오는 치즈메이트 오늘은 파스타 좋아하는 딸이랑 엄마랑 분위기 내고 싶어서 예쁘게 입고 다녀왔어요. 주차 너무 편하고 매장 넘 예쁘고 음식은 진짜 맛없없 단호박스프 레시피 너무너무너무 궁금하고 저희엄마혼자 라구파스타 다드셨어요. 너무 맛있다고 재차하시면서. 또 갈께요!
1910675243,치즈메이트,,,저녁에 방문예약 없이 이용대기 시간 바로 입장가족모임아이
1910675243,치즈메이트,,,저녁에 방문예약 없이 이용대기 시간 바로 입장데이트연인・배우자
1910675243,치즈메이트,,,저녁에 방문예약 후 이용대기 시간 바로 입장친목지인・동료
1910675243,치즈메이트,,,점심에 방문예약 없이 이용대기 시간 바로 입장가족모임부모님
1910675243,치즈메이트,,,"제 최애 맛집입니다. 특별한 음식이 생각나면 항상 여기로 오고는 해요. 관악 뇨끼 맛집을 찾으신다면 이곳입니다. 오늘은 피스타치오 바스크 케이크도 먹어봤는데, 어지간한 케이크집보다 훨씬 맛있네요. 시즌별로 메뉴가 바뀌니 빨리 방문하시길 바랍니다."
1910675243,치즈메이트,,,"지나가다 귀여운 외관에 항상 궁금했던 가게인데 만족스러운 식사 하고 왔습니다! 친절하시기도 하고, 노란색 포인트의 귀여운 인테리어 덕에 따뜻한 공간이었어요. 트러플 머쉬룸 뇨끼, 라자냐, 아란치니 먹었는데 셋다 간이 짜지않고 담백한 느낌이라 좋았습니다. 뇨끼는 쫀득쫀득보다 부드러운 스타일의 뇨끼였어요. 다음에 또 방문하고 싶어요. 잘 먹었습니다!"
1910675243,치즈메이트,,,"지나가다보면 항상 사람 많아서 한번 꼭 와보고싶었는데 너무 맛있어요! 이벤트 서비스도 많이하고 음식이 진짜 아무나 흉내낼수없는 맛..,🫶🏻🤍 단호박뇨끼가 진짜 단골되고싶은맛이에요"
1910675243,치즈메이트,,,지나갈때마다 사람이 많아서 언젠가 먹어보고싶던곳😍 역시나 넘 맛있고 플레이팅도 예뿌네오 :) 친구들 데려왓는데 다들 넘 맛잇어서 싹싹 긁어먹었다고 칭찬했습니다~ 담에 또 방문할거에요>__<
1910675243,치즈메이트,,,"지나다닐때마다 저 귀여운 벽화의 가게에선 뭘 파시나 늘 궁금했는데 오늘 드뎌 방문해봤어요! 들어가는 문도 신기하고 가게 안에 소품들이 너무 아기자기해서 너무 재밌었고, 음식도 다 맛있었어요. 브라타치즈 완전 신선했고 감튀는 맥주를 부르는 맛... ㅜㅜ 저녁에 차 놓고 가서 와인 마셔보고싶어요!"
1910675243,치즈메이트,,,직원분들도 굉장히 친절하고 음식도 매우 맛있어요 !! 내부 인테리어도 독특하고 이뿌네욤 ㅎㅎ 오랜만에 와이프랑 즐거운 시간 보앴어요 ~! 주차는 쬐~~끔 협소하긴 한데 주말엔 주차공간이 없을것 같기도하니 참고 !! 재방문 의사 있습니당 !
1910675243,치즈메이트,,,"톰과 제리 외관이 너무 독특해서 꼭 와보고 싶었는데, 왜 이제야 온 걸까 싶을 정도로 만족스러웠어요! 👍👍 분위기도 좋고, 세트메뉴를 시켰는데 양도 넉넉했습니다. 특히 뇨끼는 꼭 드셔보세요, 제 인생 뇨끼예요! 🥹🧡 라자냐도 정말 맛있고, 마지막으로 티라미수까지..! 완벽하게 마무리할 수 있었어요.🩷🩷 담에 또 갈게용"
1910675243,치즈메이트,,,"트러플 향 가득한 뇨끼와 라자냐, 마무리로 티라미수까지 풀코스로 즐겨주셨다니… 저희가 준비하는 정성과 감성이 제대로 전해진 것 같아 뿌듯해요! 특히 “뇨끼 미쳤구, 라자냐는 말 다했다”는 표현에 저희 셰프님도 큰 힘을 얻으실 것 같아요🙌"
1910675243,치즈메이트,,,특히 저와 남편의 최애픽은 뇨끼! 이 가격에 트러플까지 올려주시고 오일도 낭낭히 둘러주셔서 이렇게 파셔도 되나? 싶었어요. 리뷰가 왜 다 정성스러운지 알겠어요. 이렇게 팔다가 여기 사라질까봐 다들 필사적으로 적고 계신 듯요.. 저 또한 400자 채울 예정입니다.
1910675243,치즈메이트,,,티라미수는 네이버지도에 쿠폰이 있어서 사용했는데 여기 숨겨진 디저트 맛집인가요?? 커피향과 크림이 적당해서 조화롭게 맛있었어요
1910675243,치즈메이트,,,풍부하면서도 깔끔하고 깊은 맛이 나서 늘 좋아하는 곤입니다. 특히 라자냐가 넘 맛있어서 빠짐없이 시키는 메뉴입니다. 샐러드도 신선하고 소스랑 잘 어우러지고 아란치니도 바삭하면서 소스랑 잘 어울려요~~~
1303035400,파앤피파스타하우스 샤로수길점,,,"밤에 방문예약 없이 이용대기 시간 10분 이내 가족모임연인・배우자, 아이"
1303035400,파앤피파스타하우스 샤로수길점,,,"토핑도 과하지 않고, 재료 하나하나가 제자리에 있는 느낌이에요."
1303035400,파앤피파스타하우스 샤로수길점,,,피자는 치즈가 아낌없이 들어가 있고 스파이시 까르보나라는 매콤한 고추가 들어있어요
1381847057,피자파쪼 서울대입구 본점,,,#서울대입구역맛집 #서울대입구맛집 #5번출구 #피자맛집 #피자파쪼
1381847057,피자파쪼 서울대입구 본점,,,"30분 정도 웨이팅하고 들어갔어요..! 정말 배고팠는데, 한 입 먹자마자 치즈도 많고 무엇보다 도우가 쫀득하고 맛있어서 정신없이 흡입했네요.. 무화과 올라간 피자도 별미였습니다! 하지만 제 원픽은 근본 마르게리따 ㅎㅎ!! 집이랑도 가까워서 다음에 또 와야겠어요"
1381847057,피자파쪼 서울대입구 본점,,,"30분 정도 웨이팅하고 들어갔어요..! 정말 배고팠는데, 한 입 먹자마자 치즈도 많고 무엇보다 도우가 쫀득하고 맛있어서 정신없이 흡입했네요.. 무화과 올라간 피자도 별미였습니다! 하지만 제 원픽은 근본 마르게리따 ㅎㅎ!! 집이랑도 가까워서 다음에 또 와야겠어요"
1381847057,피자파쪼 서울대입구 본점,,,"계속 와보고 싶었는데 이번에 드디어 방문했어요! 매장이 넓진 않지만 인테리어와 음악이 세련되고 좋아요~! 메뉴들이 다 맛있어 보여서 고민하다가 피칸테, 마르게리따 시켰는데 대만족❤️❤️ 서울대입구역 맛집 특히 양식집 찾으신다면 여기 추천드려요 ㅎㅎ"
1381847057,피자파쪼 서울대입구 본점,,,관악구에서 제일 맛있는 피자&파스타 집인 것 같아요. 피자 도우 너무 쫄깃하고 향도 너무 좋네요! 파스타도 생면인 것 같아요. 진짜 이렇게까지 맛있는 화덕 피자와 파스타를 관악구에서 먹을 수 있다는 건 행운입니다!!
1381847057,피자파쪼 서울대입구 본점,,,"귀엽고 신기한 에피타이저부터 피자, 파스타까지 자극적이지 않고 담백해서 너무 좋았어요 ㅠㅠ 피자 고르다가 결정장애가 와서 풍기 크림 파스타 먹었는데 다음에는 풍기피자로 꼭 먹어보려고요 😋 아주 아주 잘먹었습니다~!"
1381847057,피자파쪼 서울대입구 본점,,,"금요일 점심시간대에 방문했는데 손님도 적당하고 요리도 금방나왔습니다! 다른 프렌차이즈 피자하고 비교하는 것도 뭐하지만,, 도우가 진짜 쫄깃하고 맛있어요. 피자종류도 많아서 너무 맛있게먹었습니다"
