가게ID,가게명,평점,날짜,리뷰내용
1889988592,황홀경,,,"봉천동 분위기좋은 카페네요! 이름부터 멋진! 황홀경~ 처음엔 그냥 지나쳤는데, 알고보니 금빛간판문으로 들어가는곳이 입구였다는! 어둑한 분위기에 은은한 조명, 부드러운 감각의 음악과 좋은향의 커피까지. 관악 서울대입구역 오면 또 들를 분위기 카페♡ 나만 알고싶어지는 그런 카페♡"
1889988592,황홀경,,,분위기 너무 좋은 카페라 재방문 의사 있어요!! 크로플 너무 맛있었습니다 ☺️ 담엔 프렌치 토스트도 먹어보려구용!
1889988592,황홀경,,,분위기가 너무 조코 음료랑 디저트까지도 완벽해여!!!🍀
1889988592,황홀경,,,분위기가 너무좋았어요 어둑어둑하고 카라멜마리아주는 진짜맛있네요 역시 시그니쳐메뉴네요! 사과에이드는 달달사고 상콤하네요!
1889988592,황홀경,,,분위기도 좋아서 소개팅이나 데이트 하기도 좋을거 같아요 강추 >.< 🩷🩷
1889988592,황홀경,,,"비주얼부터 완벽해서 나오자마자 사진 찍느라 바빴는데, 맛은 그 이상입니다. 디저트는 달콤하면서도 전혀 물리지 않고, 아메리카노랑 정말 잘 어울려요. 분위기도 아늑하면서 청결해서 오래 머무르고 싶을 정도였어요. 조용히 대화 나누기에도 좋고, 여자친구와 와서 여유롭게 디저트 즐기기에도 딱입니다.☕️🤎"
1889988592,황홀경,,,샤로수길 오면 항상 오는 카페인데 오랜만에 와도 분위기가 너무 좋고 음료도 맛있어요!!🥰
1889988592,황홀경,,,솔직히 이제 다른 카페는 잘 못 가요. 더치베이비랑 아메리카노 조합은 여기만한 곳이 없어요ㅜㅜ🤍
1889988592,황홀경,,,"여기 분위기도 너무 너무 차분하고 고풍스럽고 예쁘구요, 특히 크로플 진짜 짱짱 맛있어요~~~!💛"
1889988592,황홀경,,,예전부터 와보고 싶었는데 어둡고 분위기 좋네요~~ 커피맛도 맛있고 달달한 더치베이비시나몬 먹었어요~~ 역시 사람도 많고 단체석도 있고 편한 의자도 있어요!
1889988592,황홀경,,,"오늘 진짜 맛있는 음료먹고 왔어요! 😋 음식 맛은 물론이고, 분위기도 너무 좋아서 힐링 제대로 하고 왔지 뭐예요. 🤩 맛있는 음식 앞에서 사진도 엄청 찍고, 행복한 시간 보냈어요. 🥰 다음에도 꼭 다시 방문해서 맛있는 음식 먹고 싶어요! 👍 이런 곳을 발견해서 너무 기쁘고, 여러분에게도 강력 추천합니다! 😎 #맛집 #분위기깡패 #힐링 #먹스타그램 #강력추천"
1889988592,황홀경,,,와 더치베이비 첨먹어보는데 진짜 왐마 너무 맛있어요 많이 안달고 머랄까.. 그냥 꼭 드셔보세요!!
1889988592,황홀경,,,유럽풍 인테리어에 이끌려 방문했어요! 노란 조명이 눈을 편안하게 하고 커피도 제가 원하는 꾸덕한 크림의 조화가 너무 맛있었어요 데이트하기 딱 좋은 분위기💕
1889988592,황홀경,,,의자도 편한데 테이블 간격도 적당해서 대화하기 아주 좋아욘🧑‍🎤
1889988592,황홀경,,,이미 몇 번 방문한 곳인만큼 샤로수길에서 가장 먼저 생각나는 카페입니당ㅎㅎ 저 팬케이크가 막 달지도 않으면서 계속 생각나는 맛이에요! 제철 무화과는 말할 것도 없이 맛있구요
1889988592,황홀경,,,저녁에 방문예약 없이 이용대기 시간 바로 입장나들이연인・배우자
1889988592,황홀경,,,저녁에 방문예약 없이 이용대기 시간 바로 입장데이트연인・배우자
1889988592,황홀경,,,저녁에 방문예약 없이 이용대기 시간 바로 입장친목친구
1889988592,황홀경,,,"저녁에 방문예약 후 이용대기 시간 바로 입장데이트, 친목, 일상혼자, 연인・배우자"
1889988592,황홀경,,,저녁에 방문예약 후 이용대기 시간 바로 입장데이트연인・배우자
1889988592,황홀경,,,저녁에 방문예약 후 이용대기 시간 바로 입장데이트연인・배우자
1889988592,황홀경,,,점심에 방문예약 없이 이용대기 시간 바로 입장데이트연인・배우자
1889988592,황홀경,,,점심에 방문예약 없이 이용대기 시간 바로 입장데이트연인・배우자
1889988592,황홀경,,,점심에 방문예약 없이 이용대기 시간 바로 입장데이트친구
1889988592,황홀경,,,점심에 방문예약 없이 이용대기 시간 바로 입장일상혼자
1889988592,황홀경,,,"점심에 방문예약 없이 이용대기 시간 바로 입장친목, 나들이지인・동료"
1889988592,황홀경,,,점심에 방문예약 없이 이용대기 시간 바로 입장친목친구
1889988592,황홀경,,,점심에 방문예약 없이 이용대기 시간 바로 입장친목친구
1889988592,황홀경,,,"점심에 방문예약 후 이용대기 시간 바로 입장데이트친구, 지인・동료"
1889988592,황홀경,,,존맛탱입니다. 샤베드가 완전 새콤달콤해서 여름맛이 가득했어요.
1889988592,황홀경,,,지하여서 답답함이 있을까 걱정했는데 층고도 높고 벽면의 레이스 커튼과 우드 인테리어가 앤틱하여 분위기 좋네요
1889988592,황홀경,,,처음 와봤는데 너무 분위기 좋고 일하시는 분들도 너무 친절하세요!! 더치시나몬? 처음 먹어보는데 짱 맛있고 말차라떼도 적당한 당도와 말차농도 너무 맛있어요 ㅜㅠ 앞으로 단골 카페될 것 같습니다 !! 굳굳 강추
1889988592,황홀경,,,토스트가 진짜 정말 맛있어요!!! 바닐라 생크림에 메이플 시럽에.. 저 여기서 프랜치 토스트 먹고 그 맛이 아직까지 맴돕니다
1889988592,황홀경,,,편안하고 아늑한 분위기. 혼자 와도 어색하지 않고 좋아요. 처음 좀 크게 느껴지던 음악도 다른 손님들 소리를 잘 가려주네요. 아아와 폭신한 시나몬 더치베이비도 맛있어요. 15분의 기다림 끝에 따뜻한 팬케이크. 평일 오후 휴식을 주어서 고맙습니다.
1889988592,황홀경,,,"프렌치 토스트가 먹고 싶어서 추석 때 문 연 카페를 찾다가 오게 되었습니다. 너무너무 맛있고, 분위기도 좋아서 잘 쉬다가 가요."
1889988592,황홀경,,,프렌치토스트 먹고 반했어요. 겉바속촉에 크림도 너무 잘 어울려서 커피랑 찰떡 조합! 분위기도 정말 따뜻하고 조명 덕에 사진도 예쁘게 나와요📸 샤로수길 숨은 분위기 맛집✨ 다음엔 또 다른 메뉴 도전하러 갈게요!
1889988592,황홀경,,,"프토는 겉바속촉, 폭신한 식감에 직접 만든 생크림이랑 메이플시럽 조합이 일품이네요... 진심 순삭했어요. 그리고... 리치 샤베트 미친녀석이에요 진심 섞어 먹어야 하는데 지금 쓰면서도 침 고일 정도로 달달구리 맛있었습니다..."
1889988592,황홀경,,,혼자 왔는데도 너무 아늑하고 분위기있어서 잘 마시고 먹고 가요:) 노래들으면서 즐거운 연휴 즐기려고 프렌치토스트 주문했습니다♡
1889988592,황홀경,,,황홀경 항상 자리없어서 못왔었는데 드디어 왔어요! 어두운 느낌의 카페입니다! 커피 원두 맛있어용 ㅎㅎㅎ
1889988592,황홀경,,,"흑임자라떼와 아메리카노, 프렌치토스트 주문했어요! 흑임자라띠 크림은 진하고 꾸덕한 크림이 적당히 달달해서 맛있고 프렌치토스트는 겉바속촉 그 자체!! 시나몬 뿌려진 부분도 맛있고 크림과 함께 먹어도 맛있었어요!! 프렌치토스트 가격도 적당해서 부담없이 먹으러 오기 좋아여~"
