가게ID,가게명,평점,날짜,리뷰내용
1380382051,양산도 등촌점,,,💗 양산도 등촌점을 찾아 주셔서 감사합니다 . 고객님의 진심 가득 따뜻하고 상세한 리뷰에 저희의 하루가 반짝입니다 ✨️✨️ 최고의 식사가 되길 바라는 마음으로 신선한 재료로 정성껏 조리하고 있습니다. 그 마음이 잘 전달 된 거 같아 기분이 좋습니다. 👍🏻👍🏻 늘 건강과 행복만 가득하세요💗💗
1380382051,양산도 등촌점,,,💗 양산도 등촌점을 찾아 주셔서 감사합니다 . 고객님의 진심 가득 따뜻하고 상세한 리뷰에 저희의 하루가 반짝입니다 ✨️✨️ 항상 최고의 식사가 되길 바라는 마음으로 신선한 재료로 정성껏 조리하고 있습니다. 그 마음이 잘 전달 된 거 같아 기분이 좋습니다. 👍🏻👍🏻다음에도 찾아주시고 늘 건강과 행복만 가득하세요💗💗
1380382051,양산도 등촌점,,,💗 양산도 등촌점을 찾아 주셔서 감사합니다 . 고객님의 진심 가득 따뜻하고 상세한 리뷰에 저희의 하루가 반짝입니다 ✨️자녀분께서도 맛있게 드셨다니 더 보람 되고 기쁩니다 ✨️ 항상 최고의 식사가 되길 바라는 마음으로 신선한 재료로 정성껏 조리하고 있습니다. 그 마음이 잘 전달 된 거 같아 기분이 좋습니다. 👍🏻👍🏻 늘 건강과 행복만 가득하세요💗💗
1380382051,양산도 등촌점,,,💗 양산도 등촌점을 찾아 주셔서 감사합니다 . 너무~ 맛있고 친절하고 분위기 좋다고 칭찬해 주셔서 감사합니다. 가족분들과 즐거운 시간 보내신거 같아 저희도 기쁩니다 ✨️✨️ 👍🏻 비법 소스를 발라가며 3번 구운 장어는 고소하고 촉촉하고 자극적이지 않아 좋아해 주시더라고요. ✨️✨️높은 단백질과 미네랄 비타민을 골고루 섭취할 수 있는 장어 드시고 좋은 에너지만 가득 채우시고 늘 건강과 행복만 가득 하세요💗💗
1380382051,양산도 등촌점,,,💗 양산도 등촌점을 찾아 주셔서 감사합니다 . 먹음직스런 사진과 정성 가득 리뷰에 저희의 하루가 반짝입니다. 자녀분도 맛나게 드시고 즐거운 시간 보내셨다니 더 기쁩니다 ✨️✨️ 항상 최고의 식사가 되길 바라는 마음으로 신선한 재료로 정성껏 조리하고 있습니다. 그 마음이 잘 전달 된 거 같아 기분이 좋습니다. 👍🏻👍🏻다음에도 다시 찾아주시고 늘 건강과 행복만 가득하세요💗💗💗
1380382051,양산도 등촌점,,,💗 양산도 등촌점을 찾아 주셔서 감사합니다 . 몸보신 하기 좋고 야무지다는 감동 리뷰에 저희의 하루가 반짝입니다 ✨️✨️ 👍🏻 비법 소스를 발라가며 3번 구운 장어는 고소하고 촉촉하고 자극적이지 않아 좋아해 주시더라고요. ✨️✨️높은 단백질과 미네랄 비타민을 골고루 섭취할 수 있는 장어 드시고 좋은 에너지만 가득 채우시고 늘 건강과 행복만 가득 하세요💗💗
1380382051,양산도 등촌점,,,💗 양산도 등촌점을 찾아 주셔서 감사합니다 . 설명도 친절하고 기대 이상의 분위기와 맛에 만족하셨다는 감동 리뷰에 저희의 하루가 반짝입니다 ✨️✨️ 👍🏻 비법 소스를 발라가며 3번 구운 장어는 고소하고 촉촉하고 자극적이지 않아 좋아해 주시더라고요. ✨️✨️높은 단백질과 미네랄 비타민을 골고루 섭취할 수 있는 장어 드시고 좋은 에너지만 가득 채우시고 늘 건강과 행복만 가득 하세요💗다음에 또 뵐께요 💗
1380382051,양산도 등촌점,,,💗 양산도 등촌점을 찾아 주셔서 감사합니다 . 여전히 깨끗하고 너무너무 맛있다는 감동 리뷰에 저희의 하루가 반짝입니다 ✨️✨️ 👍🏻👍🏻👍🏻 비법 소스를 발라가며 3번 구운 장어는 고소하고 촉촉하고 자극적이지 않아 좋아해 주시더라고요. ✨️✨️높은 단백질과 미네랄 비타민을 골고루 섭취할 수 있는 장어 드시고 좋은 에너지만 가득 채우시고 늘 건강과 행복만 가득 하세요💗💗
1380382051,양산도 등촌점,,,💗 양산도 등촌점을 찾아 주셔서 감사합니다 . 음식도 정식으로 바로 나와서 맛있게 잘 드셨다는 리뷰에 저희의 하루가 반짝입니다 ✨️✨️ 👍🏻 비법 소스를 발라가며 3번 구운 장어는 고소하고 촉촉하고 자극적이지 않아 좋아해 주시더라고요. ✨️✨️높은 단백질과 미네랄 비타민을 골고루 섭취할 수 있는 장어 드시고 좋은 에너지만 가득 채우시고 늘 건강과 행복만 가득 하세요💗💗
1380382051,양산도 등촌점,,,💗 양산도 등촌점을 찾아 주셔서 감사합니다 . 일본에서 드신 듯 즐겁게 식사 하신 거 같아 저희도 기쁩니다. 매장도 고급지고 직원들도 친절하다 칭찬해 주시니 완전 감동 감동 입니다 ✨️✨️ 항상 최고의 식사가 되길 바라는 마음으로 신선한 재료로 정성 담아 만들고 있는데 그 마음이 잘 전달 된 거 같아 기쁩니다👍🏻👍🏻다음에 다시 찾아주시고 ~ 늘 건강과 행복만 가득하세요. 💗💗💗
1380382051,양산도 등촌점,,,💗 양산도 등촌점을 찾아 주셔서 감사합니다 . 장어 잔가시도 적고 가성비 좋고 맛있게 드셨다는 리뷰에 저희의 하루가 반짝입니다 ✨️✨️ 항상 최고의 식사가 되길 바라는 마음으로 신선한 재료로 정성껏 조리하고 있습니다. 그 마음이 잘 전달 된 거 같아 기분이 좋습니다. 👍🏻👍🏻 늘 행복만 가득하세요💗💗
1380382051,양산도 등촌점,,,💗 양산도 등촌점을 찾아 주셔서 감사합니다 . 장어덮밥 전문점이라 너무 맛있고 분위기 좋다는 리뷰에 저희의 하루가 반짝입니다 ✨️✨️ 항상 최고의 식사가 되길 바라는 마음으로 신선한 재료로 정성껏 조리하고 있습니다. 그 마음이 잘 전달 된 거 같아 기분이 좋습니다. 👍🏻👍🏻 환절기 건강 조심하시고 늘 행복만 가득하세요💗💗
1380382051,양산도 등촌점,,,💗 양산도 등촌점을 찾아 주셔서 감사합니다 .샐러드와 사이드 찬들의 구성도 좋고 장어와 오차즈케까지 만족스러우셨다는 상세한 리뷰로 저희 모두를 감동에 퐁당 빠지게 해주셔서 저희 모두 기분 최고 입니다 👍🏻👍🏻 ✨️✨️ 항상 최고의 식사가 되길 바라는 마음으로 신선한 재료로 정성껏 조리하고 있습니다. 그 마음이 잘 전달 된 거 같아 기분이 좋습니다. 늘 건강과 행복만 가득하세요 💗💗💗
1380382051,양산도 등촌점,,,💗 양산도 등촌점을 찾아 주셔서 감사합니다 언제나 기대 이상 만족하셨다는 상세한 리뷰로 저희 모두를 감동에 퐁당 빠지게 해주셔서 기분 최고 입니다 👍🏻👍🏻 서비스도 맛도 최고 양산도 등촌점 👍🏻👍🏻 ✨️✨️ 항상 최고의 식사가 되길 바라는 마음으로 신선한 재료로 정성껏 조리하고 있습니다. 소중한 가족과 음식을 나누며 행복을 느끼셨을 모습에 저희의 마음도 잘 전달 된 거 같아 기분이 좋습니다. 늘 건강과 행복만 가득하세요 💗💗💗
1380382051,양산도 등촌점,,,💗 양산도 등촌점을 찾아 주셔서 감사합니다 인생 육수 오차즈케와 함께 먹는 히츠마부시가 진짜 맛있다는 상세한 표현과 재방문 하고 싶은 맛집이라는 리뷰로 저희 모두를 감동에 퐁당 빠지게 해주셔서 저희 모두 기분 최고 입니다 👍🏻👍🏻 ✨️✨️ 항상 최고의 식사가 되길 바라는 마음으로 신선한 재료로 정성껏 조리하고 있습니다. 그 마음이 잘 전달 된 거 같아 기분이 좋습니다. 늘 건강과 행복만 가득하세요 💗💗💗
1380382051,양산도 등촌점,,,💗 양산도 등촌점을 찾아 주시고 너무 음식 맛있고 오래오래 있어 주셨으면 좋겠다는 칭찬 감사합니다✨️한결 같이 잘하고 있다는 고객님의 마음 같아서 더 뿌듯하고 보람 된 마음입니다 ✨️ 👍🏻👍🏻 다음에도 또 찾아주시고 늘 건강과 행복만 가득하세요 💗💗환절기 감기 조심하세요
1380382051,양산도 등촌점,,,💗💗💗 저희 양산도 등촌점을 자주 찾아주시는 단골 고객님 항상 감사합니다. 😍😍💪🏻💪🏻💪🏻 가지장어 덮밥의 건강해지는 가지볶음 비법 소스와 버터의 시너지가 크죠? ㅋㅋ 저도 아주 좋아 하는 맛입니다. 저희 음식 드시고 좋은 에너지만 가득 채우시고 더운 여름 늘 건강과 행복만 가득 하세요. 오늘도 화이팅 입니다 ^^ 💗💗
1533244797,옥소반 마곡본점,,,가게가 깔끔하고 음식도 정갈해서 친구들과 오기에도 연인이나 가족들과 오기에도 좋아용! 늘 스키야키 먹다가 샤브샤브 처음으로 먹어봤는데 이거도 깔끔 담백하니 맛있네요🤍
1533244797,옥소반 마곡본점,,,가족모님 하기 좋은 분위기에 아이들과 왔는데 음악도 좋고 공간도 새련되서 좋네요.
1533244797,옥소반 마곡본점,,,고기 야채 신선하고 분리 공간도 있어 대화하기 편해요
1533244797,옥소반 마곡본점,,,고기도 신선하고 맛있고 올때마다 느끼지만 직원들이 정말 친절합니다!또 오고 싶은 가게 옥소반 마곡본점 추천해요!! 기분좋게 밥먹고 갑니다!!
1533244797,옥소반 마곡본점,,,"고기도 채소도 신선하고, 채소는 무한리필이라 배불리 먹을 수 있었어요. 밑반찬도 깔끔하고 맛있어서 스키야키랑 찰떡궁합!"
1533244797,옥소반 마곡본점,,,고기와 채소가 신선하고 리필 가능해서 좋아요 어제에 이어 연속 방문했는데
1533244797,옥소반 마곡본점,,,리뉴얼 되고 처음 와보는데 가게 분위기도 너무 고급지게 멋져지고 스키야끼도 더 맛있어졌네요❣️ 주문하면 바로 썰어주는 고기부터 무한 리필되는 야채까지! 가성비 최고에요〰️여자들이 안좋아할 수 없는 곳이니 데이트로 왕 추천이에요!
1533244797,옥소반 마곡본점,,,리모델링하고 오랜만에 오는데 인테리어도 예쁘고 분위기 좋고 예뻐요~!!
1533244797,옥소반 마곡본점,,,리모델링하고 오랜만에 오는데 인테리어도 예쁘고 분위기 좋고 예뻐요~!!
1533244797,옥소반 마곡본점,,,리모델링하고 오랜만에 오는데 인테리어도 예쁘고 분위기 좋고 예뻐요~!!
1533244797,옥소반 마곡본점,,,"마곡 옥소반 본점에서 스키야끼를 먹었는데 정말 만족스러웠어요. 고기 질이 좋아서 국물에 살짝 익혀 한 점씩 먹는 재미도 있고, 진한 육수에 고기와 신선한 채소를 곁들이니 입안에서 풍미가 가득 퍼지더라고요. 특히 인테리어가 이국적이고 감각적으로 꾸며져 있어서 마치 해외에 온 듯한 기분이었어요. 분위기가 깔끔하고 세련돼서 데이트나 특별한 외식 장소로도 딱이에요. 직원분들도 코스 진행을 친절하게 도와주셔서 한 끼 제대로 대접받는 느낌이었고, 다음엔 꼭 친구들이랑 다시 방문하고 싶어요!"
1533244797,옥소반 마곡본점,,,"마곡 옥소반 본점에서 스키야끼를 먹었는데 정말 만족스러웠어요. 고기 질이 좋아서 국물에 살짝 익혀 한 점씩 먹는 재미도 있고, 진한 육수에 고기와 신선한 채소를 곁들이니 입안에서 풍미가 가득 퍼지더라고요. 특히 인테리어가 이국적이고 감각적으로 꾸며져 있어서 마치 해외에 온 듯한 기분이었어요. 분위기가 깔끔하고 세련돼서 데이트나 특별한 외식 장소로도 딱이에요. 직원분들도 코스 진행을 친절하게 도와주셔서 한 끼 제대로 대접받는 느낌이었고, 다음엔 꼭 친구들이랑 다시 방문하고 싶어요!"
1533244797,옥소반 마곡본점,,,"마곡 옥소반 본점에서 스키야끼를 먹었는데 정말 만족스러웠어요. 고기 질이 좋아서 국물에 살짝 익혀 한 점씩 먹는 재미도 있고, 진한 육수에 고기와 신선한 채소를 곁들이니 입안에서 풍미가 가득 퍼지더라고요. 특히 인테리어가 이국적이고 감각적으로 꾸며져 있어서 마치 해외에 온 듯한 기분이었어요. 분위기가 깔끔하고 세련돼서 데이트나 특별한 외식 장소로도 딱이에요. 직원분들도 코스 진행을 친절하게 도와주셔서 한 끼 제대로 대접받는 느낌이었고, 다음엔 꼭 친구들이랑 다시 방문하고 싶어요!"
1533244797,옥소반 마곡본점,,,무한리필! 샤브샤브 좋아하시면 강추강추 ! 사이드 메뉴도 맛있궁 음식이 깔끔해서좋아용
1533244797,옥소반 마곡본점,,,비와서 생각나서 왔어요! 분위기도 좋고 음악도 맘에 들어요~
1533244797,옥소반 마곡본점,,,스키야끼 먹으러 자주와요~~ 스키야끼 넘 맛나요 ㅎㅎ 이제 쌀쌀해져서 더 생각나는 음식 같아요. 항강 야채도 푸짐하게 먹을 수 있어서 좋아용. 끝나고 먹는 우동도 넘 맛남~~ 또 올게요!
1533244797,옥소반 마곡본점,,,스키야끼 먹으러 자주와요~~ 스키야끼 넘 맛나요 ㅎㅎ 이제 쌀쌀해져서 더 생각나는 음식 같아요. 항강 야채도 푸짐하게 먹을 수 있어서 좋아용. 끝나고 먹는 우동도 넘 맛남~~ 또 올게요!
1533244797,옥소반 마곡본점,,,스키야끼 먹으러 자주와요~~ 스키야끼 넘 맛나요 ㅎㅎ 이제 쌀쌀해져서 더 생각나는 음식 같아요. 항강 야채도 푸짐하게 먹을 수 있어서 좋아용. 끝나고 먹는 우동도 넘 맛남~~ 또 올게요!
1533244797,옥소반 마곡본점,,,스키야끼 좋아하는데 옥소반 음식이 정갈하구 맛있어요! 고기질도 좋네요 부드럽구 맛있어요. 야채 많이 줘서 더 좋아요 ㅎㅎ엄마랑 식사와서 잘먹었습니다.
1533244797,옥소반 마곡본점,,,스키야끼 좋아하는데 옥소반 음식이 정갈하구 맛있어요! 고기질도 좋네요 부드럽구 맛있어요. 야채 많이 줘서 더 좋아요 ㅎㅎ엄마랑 식사와서 잘먹었습니다.
1533244797,옥소반 마곡본점,,,스키야끼 좋아하는데 옥소반 음식이 정갈하구 맛있어요! 고기질도 좋네요 부드럽구 맛있어요. 야채 많이 줘서 더 좋아요 ㅎㅎ엄마랑 식사와서 잘먹었습니다.
1533244797,옥소반 마곡본점,,,"스키야키 먹었는데 채소도 싱싱하고, 여자 둘이서 먹기엔 양도 충분했어요! 직원분들이 계속 돌아다니며 부족한 부분 채워주셔서 먹는 내내 기분 좋게 먹을 수 있었구요!"
1533244797,옥소반 마곡본점,,,"스키야키, 샤브샤브류를 넘 좋아해서 갔는데 전문점은 역시 다르네용 ㅎㅎㅎ 일단 매장이 넓고 넘 예뻐서 놀랐구요!!! 예약하고 가길 잘한 것 같아용 ㅎㅎ"
1533244797,옥소반 마곡본점,,,"야채와 고기, 계란까지 조합이 정말 잘 어우러져서 한입 먹자마자 감탄 나왔어요. 짜지 않고 깊은 맛이라 끝까지 부담 없이 즐길 수 있었고, 고기도 부드럽고 질감이 좋았어요. 직원분이 친절하게 조리 방법도 안내해주셔서 처음 먹는 사람도 어렵지 않게 즐길 수 있었습니다. 마곡에서 따뜻한 스키야키 한 끼 찾는다면 옥소반 추천드려요!"
1533244797,옥소반 마곡본점,,,"야채와 고기, 계란까지 조합이 정말 잘 어우러져서 한입 먹자마자 감탄 나왔어요. 짜지 않고 깊은 맛이라 끝까지 부담 없이 즐길 수 있었고, 고기도 부드럽고 질감이 좋았어요. 직원분이 친절하게 조리 방법도 안내해주셔서 처음 먹는 사람도 어렵지 않게 즐길 수 있었습니다. 마곡에서 따뜻한 스키야키 한 끼 찾는다면 옥소반 추천드려요!"
1533244797,옥소반 마곡본점,,,"야채와 고기, 계란까지 조합이 정말 잘 어우러져서 한입 먹자마자 감탄 나왔어요. 짜지 않고 깊은 맛이라 끝까지 부담 없이 즐길 수 있었고, 고기도 부드럽고 질감이 좋았어요. 직원분이 친절하게 조리 방법도 안내해주셔서 처음 먹는 사람도 어렵지 않게 즐길 수 있었습니다. 마곡에서 따뜻한 스키야키 한 끼 찾는다면 옥소반 추천드려요!"
1533244797,옥소반 마곡본점,,,예전에 친구와 함께 스키야키를 먹었는데 너무 맛있어서 이번엔 가족들과 함께 다시 방문했습니다.
1533244797,옥소반 마곡본점,,,와.. 여기 찐맛집 입니다. 부모님 모시고 방문했던 마곡 맛집 옥소반 마곡본점 ! 스키야키를 먹을 수 있어서 가장 만족했습니다 음식이 깔끔하고 정갈해서 부모님도 너무 좋아하셨고 건강한 재료들이 많이 있어요 후식으로 김치볶음밥과 음료까지 .. 💘
1533244797,옥소반 마곡본점,,,와.. 여기 찐맛집 입니다. 부모님 모시고 방문했던 마곡 맛집 옥소반 마곡본점 ! 스키야키를 먹을 수 있어서 가장 만족했습니다 음식이 깔끔하고 정갈해서 부모님도 너무 좋아하셨고 건강한 재료들이 많이 있어요 후식으로 김치볶음밥과 음료까지 .. 💘
1533244797,옥소반 마곡본점,,,와.. 여기 찐맛집 입니다. 부모님 모시고 방문했던 마곡 맛집 옥소반 마곡본점 ! 스키야키를 먹을 수 있어서 가장 만족했습니다 음식이 깔끔하고 정갈해서 부모님도 너무 좋아하셨고 건강한 재료들이 많이 있어요 후식으로 김치볶음밥과 음료까지 .. 💘
1533244797,옥소반 마곡본점,,,"와..! 스키야끼 정말 좋아하는데 제대로 된 곳이라서 먹는 내내 너무 만족스러웠어요! 공간도 분리된 곳이 있어서 모임할 때도 좋을 것 같고, 고기 야채가 다 너무 신선하고, 스키야끼 소스가 쫙 배어들어서 짭짤하고 너무 맛있어요! 정말 원기회복할때도 찾아오고 싶어지는 스키야끼 맛집입니다! 샤브샤브, 스키야끼 선택도 되고, 고기무한리필도 가능한 메뉴로 선택할 수 있어서 좋은 것 같아요!"
1533244797,옥소반 마곡본점,,,음식도 깔끔하고 여러번 리필해서 불편햏을텐데 직원분들도 완전 친절하셔서 감동입니다.
1533244797,옥소반 마곡본점,,,자주 오는 곳인데 늘 올 때마다 만족하고 갑니다! 맛도 너무 맛있고 깔끔해서 좋아요 💓
1533244797,옥소반 마곡본점,,,자주 오는 곳인데 늘 올 때마다 만족하고 갑니다! 맛도 너무 맛있고 깔끔해서 좋아요 💓
1533244797,옥소반 마곡본점,,,자주 오는 곳인데 늘 올 때마다 만족하고 갑니다! 맛도 너무 맛있고 깔끔해서 좋아요 💓
1533244797,옥소반 마곡본점,,,"자주오는곳인데 항상 대우받는 느낌들고, 분위기도좋고 맛도있어서 자주오게되요! 스키야키도 맛있고 샤브샤브 둘다 먹어봤는데 속이편하고싶은날에는 샤브샤브 추천입니당💕"
1533244797,옥소반 마곡본점,,,"자주오는곳인데 항상 대우받는 느낌들고, 분위기도좋고 맛도있어서 자주오게되요! 스키야키도 맛있고 샤브샤브 둘다 먹어봤는데 속이편하고싶은날에는 샤브샤브 추천입니당💕"
1533244797,옥소반 마곡본점,,,"자주오는곳인데 항상 대우받는 느낌들고, 분위기도좋고 맛도있어서 자주오게되요! 스키야키도 맛있고 샤브샤브 둘다 먹어봤는데 속이편하고싶은날에는 샤브샤브 추천입니당💕"
1533244797,옥소반 마곡본점,,,점심에 방문예약 없이 이용대기 시간 바로 입장가족모임부모님
1533244797,옥소반 마곡본점,,,점심에 방문예약 없이 이용대기 시간 바로 입장가족모임부모님
1533244797,옥소반 마곡본점,,,점심에 방문예약 없이 이용대기 시간 바로 입장가족모임부모님
1533244797,옥소반 마곡본점,,,점심에 방문예약 없이 이용대기 시간 바로 입장가족모임연인・배우자
1533244797,옥소반 마곡본점,,,점심에 방문예약 없이 이용대기 시간 바로 입장가족모임연인・배우자
1533244797,옥소반 마곡본점,,,점심에 방문예약 없이 이용대기 시간 바로 입장가족모임연인・배우자
1533244797,옥소반 마곡본점,,,점심에 방문예약 없이 이용대기 시간 바로 입장친목친구
1533244797,옥소반 마곡본점,,,점심에 방문예약 후 이용대기 시간 바로 입장친목부모님
1533244797,옥소반 마곡본점,,,주말되면 외식 1순위로 항상 옥소반을 옵니다. 오늘도 아이가 옥소반 가자고 해서 바로 왔네요 ㅎ 맛있고 든든하고 가격도 합리적이고 여기만한데가 없습니다!!
1533244797,옥소반 마곡본점,,,직원 분들도 친절하시고 야채 떨어지면 바로바로 채워주세요! 점심시간에는 웨이팅 있을정도로 손님도 많아요~!
1533244797,옥소반 마곡본점,,,테이블 오더를 통해서 편하게 야채 리필 버튼을 누르면 직원분들이 바로 가져다 주시고 반찬이 비면 알아서 채워 주셔서 편하게 식사 할 수 있어요.
1533244797,옥소반 마곡본점,,,항상 지나만 가다가 이번에 처음 왔는데 너무너무 맛있어요! 야채도 신선하고 직원분들도 요청 안해도 계속 봐주시면서 육수 채워 주시고 너무 좋습니다 분위기도 좋아서 또 올 것 같아요 :) 맛있게 잘 먹고 갑니다!! 번창하세요❤️
1227293458,편편집 발산역점,,,고객님의 따듯한 리뷰 덕분에 오늘도 힘이 납니다! 저희가 하는 일이 보람차다고 느끼는 순간이네요.. 🤍
1227293458,편편집 발산역점,,,고객님의 따듯한 리뷰 덕분에 오늘도 힘이 납니다! 저희가 하는 일이 보람차다고 느끼는 순간이네요.. 🤍
1227293458,편편집 발산역점,,,고객님의 따듯한 리뷰 덕분에 오늘도 힘이 납니다! 저희가 하는 일이 보람차다고 느끼는 순간이네요.. 🤍
1227293458,편편집 발산역점,,,고기종류도 우삼겹/차돌양지 있는데 저는 고소한 우삼겹을 팠어요 ㅎㅎㅎ 잡채도 맛있었고 야채도 싱싱하고 고기도 질좋았어요! 다음번에 꼭 재방문 할게용~~
1227293458,편편집 발산역점,,,늘 좋은 재료로 정성껏 준비하는 이유는 바로 이런 순간 때문인 것 같아요.. ❤️ 언제 방문해주셔도 실망 없도록 정성을 다하겠습니다.
1227293458,편편집 발산역점,,,늘 좋은 재료로 정성껏 준비하는 이유는 바로 이런 순간 때문인 것 같아요.. ❤️ 언제 방문해주셔도 실망 없도록 정성을 다하겠습니다.
1227293458,편편집 발산역점,,,맛있어용~~!!! 친절하고 양도 많아요 완젼 강추 합니다!!! 채소도 많고 사이드 바도 있어서 완젼 좋아요!!
1227293458,편편집 발산역점,,,"매장이 넓고 고기, 야채가 신선합니다. 고기파. 야채파 모두 좋아해서 가족들, 친구들과 종종 방문하구요.. 직원분들도 친절하고 주차도 편리해서 👍."
1227293458,편편집 발산역점,,,"샤브샤브 편백찜 월남쌈과 요리까지 모두 무한리필이라니 발산필수방문맛집이네요!! 아삭한 야채와 담백한 우삼겹, 고소한 새우까지 입맛이 제대로 살더라구요~ 샤브샤브는 한쪽에는 채소를 한쪽에는 고기를 익혀먹으니까 더 맛있더라구요^^ 소스코너에서 파고추와 간장, 볶음밥용 참기름 넣어서 먹으니까 불호없을 완벽한 샤브소스 완성이였답니다!! 육수에 라이스페이퍼 담가서 신선한 야채와 무한리필이라 걱정없이 고기 담뿍 넣어서 돌돌말아 칠리소스 찍어먹으면 행복이 이거구나 싶었답니다!! 볶음밥용 계란도 가지고 와서ㅋㅋ 노른자는 간장소스에 흰자는 육수에 넣어서 먹으면 스키야키까지 완성ㅎㅎ 특히나 떡볶이맛집으로도 손색없는 떡볶이에 순대와 잡채, 볶음밥과 튀김까지 점심에는 더 착한가격이니까 발산 점심먹으러 편편집 추천합니다^^"
1227293458,편편집 발산역점,,,샤브샤브는 돌고돌아 결국 편편집입니다 편백도 맛있고 그 후에 먹는 샤브샤브도 굿... 사장님도 넘 친절하시고 매장도 넘 쾌적하고 좋아요!! 후식 아이스크림까지 짱!!!
1227293458,편편집 발산역점,,,소중한 방문 감사합니다. 🙏 발산역맛집 편편집 발산역점에서 즐겁고 맛있는 시간 보내셨나요~? 시간 내어 남겨주신 따듯한 리뷰도 감사해요..💛 항상 고객님께서 믿고 드실 수 있도록 최고의 재료들로 최상의 퀄리티를 보여드리겠습니다!!
1227293458,편편집 발산역점,,,식사후 깜박하고 그냥 나왔는데 남자 알바학생같은데 잠바를 가지고 일부러 뛰어와서 챙겨주셧어요.인상도 선하시고 맘도 고마웠어요
1227293458,편편집 발산역점,,,아이들과 함께 음식 먹으러 왔는데 딱 있어야 될 메뉴만 간결하게 있어요. 다양한 음식으로 건강하게 함께 먹어볼게요
