가게ID,가게명,평점,날짜,리뷰내용
1285687319,고메스퀘어 발산직영점,,,2번째방문인데 월요일 저녁 이른시간이라 지난번 방문보다 좌석여유가 있어 음식두 대기없이 바로 먹을수있어 좋았다.
1285687319,고메스퀘어 발산직영점,,,ㅋㅇㅋㅇ 같은 곳은 광어도 멍게도 초밥으로만 세팅되어 있으니까 많이 못먹거든요. 밥이 뱃속을 차지해서.
1285687319,고메스퀘어 발산직영점,,,고메스퀘어 가본뒤로는 초밥 하면 여기만 가게 되는거 같아요
1285687319,고메스퀘어 발산직영점,,,고메스퀘어 발산점💕 너무너무 반했어요!! 맛도 뷔페치고 자극적이지 않고 가짓수가 많고 신선합니다! 💕
1285687319,고메스퀘어 발산직영점,,,고메스퀘어 인스타 선전할때 호텔식 초밥뷔페라고 합니다 분위기나 인테리어 호텔처럼 고급스럽습니다
1285687319,고메스퀘어 발산직영점,,,"고메스퀘어를 다녀왔는데 가격 대비 아주 훌륭한 뷔페였습니다. 음식 종류가 정말 다양했고 특히 초밥과 회가 신선하고 질이 좋아 만족스러웠어요. 고기류도 종류가 많아 골라 먹는 재미가 있었고, 디저트도 다채롭게 준비되어 있어 마무리까지 완벽했습니다. 음료 종류도 다양해 선택의 폭이 넓어 좋았고, 전반적으로 가성비 훌륭한 뷔페라 다시 방문하고 싶은 곳이에요."
1285687319,고메스퀘어 발산직영점,,,"과일도 키위, 자몽, 파인애플 외에 잭프룻처럼 독특한 과일도 있어서 좋아요."
1285687319,고메스퀘어 발산직영점,,,"꿔바로우, 닭강정 같은건 조금 딱딱하고 별로였는데, 회가 싱싱하고 맛있었습니다"
1285687319,고메스퀘어 발산직영점,,,"디저트류가 특히 탁월함. 젤라또 아이스크림, 와플하고 같이 먹으니까 극락."
1285687319,고메스퀘어 발산직영점,,,"많은 사람이 이용하지만 초밥코너 깔끔하게 계속 유지되고 식사 내내 비슷한 다른 식당보다 훨씬 조용하고 북적이지 않아 좋았어요. 넓기도 하고 테이블마다 칸막이가 있어 오픈되지 않아 좋습니다. 다양한 종류의 음식이 있는데 초밥을 맛있게 먹어서인지 맛이 평이하게 느껴졌지만,"
1285687319,고메스퀘어 발산직영점,,,많이 들어는 봤는데 처음가본 곳이라 기대하고 갔는데....초밥이 상상이상으로 퀄리티가 좋네요~~^^
1285687319,고메스퀘어 발산직영점,,,"매장 인테리어 굉장히 세련되고 고급짐..🖤 공기가 쾌적하고, 산뜻하고 메뉴들이 정말 다양한데도 쉐프님이 수시로 체크해서 신경써주셔서 아쉬움이 없는듯 >.<"
1285687319,고메스퀘어 발산직영점,,,"발산역 근처에서 분위기 좋게 즐길 수 있는 고메스퀘어 발산직영점 다녀왔습니다. 무엇보다 생맥주를 무한으로 즐길 수 있다는 점이 매력적🍺 음식과 함께 곁들이니 더 만족스러웠고 이번에 나온 가을 신메뉴도 함께 주문했는데, 제철 재료가 들어가서 그런지 풍미가 진하고 계절감이 딱 느껴졌습니다. 매장은 깔끔하고 좌석도 편안해서 모임이나 데이트 모두 잘 어울릴 것 같아요. 맛, 분위기, 서비스 모두 만족스러운 방문이었습니다. 다음에 또 갈게요 😍😍"
1285687319,고메스퀘어 발산직영점,,,비어있는 음식도 바로 캐치해서 잘 채워주시고 접시도 빠르게 치워주셔서 너무 좋았어요.
1285687319,고메스퀘어 발산직영점,,,생선관련한건 전체적으로 다 맛있었던거 같은데 육류쪽은 좀 잡내 많이 났어요...육회도 그렇고 갈비같은것도....🥲
1285687319,고메스퀘어 발산직영점,,,아이들 데려와도 편하게 식사할 수 있어서 가족 외식 장소로도 추천할 만한 곳이에요.🫶🏻
1285687319,고메스퀘어 발산직영점,,,여러가지 메뉴가 다양해서 원하는대로 골라먹을 수 있어서 좋았어요 직원분들도 친절하게 대해주셔서 편안한 분위기였어요 샐러드바에서는 신선한 재료들로 입맛대로 즐기고 메인요리도 정말 맛있게 먹었어요
1285687319,고메스퀘어 발산직영점,,,여튼 지하철에서도 가깝고 지하1층 위치인데도 쾌적해서 당분간 요기서 모든 모임 할 계획 👅 🎉 🥳 🥰
1285687319,고메스퀘어 발산직영점,,,"예약을 안해서 대기1시간 했어요~ 예약을 하고가는게 좋을것같아요!! 군함.롤빼고 초밥만 24가지가 있었어요🤣 초밥만 다 먹어도 배부르더라구요~ 그외에 육류 양식.중식.샐러드.디저트.과일 까지 종류가 다양해요. 확실히 초밥뷔폐라 초밥이 강점인듯해요. 등갈비랑 돼지고기 종류는 좀 질기기도했고, 고기특유의 잡내도 좀 있었습니당~ 커피머신에 카푸치노. 라떼. 아메리카노 다양하고 퀄리티도 좋았어요~"
1285687319,고메스퀘어 발산직영점,,,음식 구성도 좋고 아이들이 있는 가족들이 오기에 좋은것 같아요! 아이 놀이방이 있어서 부모님들이 편하게 식사 가능! 게다가 생맥주 무한리필이라 방문하지 않을 이유가 없서용~
1285687319,고메스퀘어 발산직영점,,,음식 종류가 정말 풍부하고 전체적으로 맛있는 프리미엄 뷔페였어요. 고급스러운 분위기에서 여러 가지 음식을 편안하게 즐길 수 있어 좋았어요 ㅎㅎ 가족들과 방문했는데 다들 만족했으며 또 가고 싶다고 하더라고요
1285687319,고메스퀘어 발산직영점,,,"이날은 단체 예약 손님이 많아서 그런지, 그동안 느꼈던 불편함들이 거의 개선되어 있었습니다. 다만 일시적인 상황이었던 건지, 아니면 운영 방식이 아예 바뀐 것인지는 확실하지 않네요."
1285687319,고메스퀘어 발산직영점,,,입구가 지하주차장이랑 좀 희한하게 바로 연결되어있어요. 이게 입구야? 싶은 문이에요ㅋ
1285687319,고메스퀘어 발산직영점,,,자리도 넓고 룸도 있어서 모임하기 좋을거 같습니다! 다양한 종류의 음식들을 한 번에 먹을 수 있는것도 좋지만 뷔페인데도 간이 쎄지 않고 퀄리티가 상당해서 종종 초밥을 먹고 싶을때마다 방문할거 같습니다!
1285687319,고메스퀘어 발산직영점,,,"저녁에 방문예약 없이 이용대기 시간 바로 입장기념일연인・배우자, 부모님"
1285687319,고메스퀘어 발산직영점,,,저녁에 방문예약 후 이용대기 시간 10분 이내 일상친구
1285687319,고메스퀘어 발산직영점,,,저녁에 방문예약 후 이용대기 시간 바로 입장가족모임부모님
1285687319,고메스퀘어 발산직영점,,,저녁에 방문예약 후 이용대기 시간 바로 입장데이트연인・배우자
1285687319,고메스퀘어 발산직영점,,,점심에 방문예약 없이 이용대기 시간 바로 입장일상부모님
1285687319,고메스퀘어 발산직영점,,,"점심에 방문예약 없이 이용대기 시간 바로 입장일상연인・배우자, 부모님"
1285687319,고메스퀘어 발산직영점,,,점심에 방문예약 없이 이용대기 시간 바로 입장친목친구
1285687319,고메스퀘어 발산직영점,,,"점심에 방문예약 후 이용대기 시간 10분 이내 가족모임부모님, 아이, 연인・배우자"
1285687319,고메스퀘어 발산직영점,,,점심에 방문예약 후 이용대기 시간 바로 입장가족모임부모님
1285687319,고메스퀘어 발산직영점,,,점심에 방문예약 후 이용대기 시간 바로 입장연인・배우자
1285687319,고메스퀘어 발산직영점,,,점심에 방문예약 후 이용대기 시간 바로 입장친목친구
1285687319,고메스퀘어 발산직영점,,,초밥이 맛있다고해서 유심히 봤는데요. 초밥은 먹을만합니다. 사시미가 좀 별로였다고 생각이되네요. 특히 연어는 좀...아이들을 위한 음료수가 안보였고 맥주만 있어서 쫌 안타까웠네요.
1285687319,고메스퀘어 발산직영점,,,친절하십니당~ 식사하는 자리도 좋고 음식 종류가 많은 건 장점인듯요ㅎ초밥 밥이 적은 것도요ㅎ 첫방문이라 이것저것 하나씩 다 먹어보려 노력했지만 종류가 많아서 전부 다 먹지는 못했어요ㅋㅋ먹어본것들 중에는 제 입맛에 음식 간이 괜찮은 것도 있고 별로인 것도 있고 하네영~ 가성비로 한번쯤 먹기엔 괜찮은것같기도~
1285687319,고메스퀘어 발산직영점,,,쿠우쿠우 이런곳만가보다가 소문만듣고 처음 가보는 고메스퀘어 확실히 초밥뷔페매장들도 상향평준화되는듯하다 분위기도 좋고 맛도 나쁘지않아 즐기기좋다 주차공간 또한 대형건물주차장이라 번잡하지않으면 좋다 밥먹고 메가박스도 있어서 오늘 하루는 여서 보낸듯하다 굿굿
1285687319,고메스퀘어 발산직영점,,,"특히, 초밥에 비해 상대적으로 밀리는 롤, 군함 종류의 뚜렷한 개선 의지가 돋보였습니다"
1285687319,고메스퀘어 발산직영점,,,프리미엄 뷔페에서의 완벽한 만족감을 느꼈어요. 음식 종류가 다양해서 취향에 맞는 것들만 골라 먹을 수 있어서 좋았네요. 직원분들의 서비스도 친절했고 음식 맛도 기대 이상이었어요. 깔끔한 매장 분위기도 인상적이었고 음식이 자주 리필되어서 신선함을 유지했어요. ㅎㅎ
1657448449,더메이드뷔페,,,12시로 분명히 예약했는데 (둘이 같이 전화예약해서 확실함) 잘못 예약되어있었고 이에 그 직원분의 대응방식 및 말투가 굉장히 별로였음
1657448449,더메이드뷔페,,,4층 전체사용해서 넓고 초밥종류가 다른곳보다 3배더 많은듯 그 외에 디저트및 음식도
1657448449,더메이드뷔페,,,"가격이 크게 비싼건 아니지만, 좀더 저렴한 프렌차이즈 뷔페와 비교하게 되는건 어쩔수 없었다. 그래도 직접 구워먹는 그릴 코너와 직원분들의 친절한 서비스가 더해진 가격이라고 생각하니 납득되기도 했다."
1657448449,더메이드뷔페,,,가짓수만 많고 맛이 하나도 없고 특히 과일까지 못먹고 버릴 정도임^^ 입이 예민한편도 아닌데 여긴 진짜 최악이었음.
1657448449,더메이드뷔페,,,"같은 뷔페 3만원대 초반가격에 광어, 연어, 장어가 포함된 다양한 스시와 내부에 고기 뷔페를 그대로 옮겨놓음. 특히 중식의 경우는 계란볶음밥과 탕수육의 퀄이 상당히 높음. 직원들도 친절하고 분위기도 좋은데 가격대는 착한편이라 단체나 모임장소로도 손색없는곳."
1657448449,더메이드뷔페,,,고기도 구워먹고 종류가 다양해 먹기좋아요!! 두번째 방문인데 올때마다 배부르게먹고가는것 같아요!!! 음식들도 다 깔끔하고 좋네요~
1657448449,더메이드뷔페,,,고기와 관자를 를 직접 구워서 먹는건데 구운 관자를 먹으니 갑자기 쇠가 씹혀서 보니 그릴 닦는 쑤세미가..
1657448449,더메이드뷔페,,,골고루 다 ~ 맛있어서ᆢ 배터지게 먹고가네요~~^^ㅋ
1657448449,더메이드뷔페,,,기본적인 뷔페 메뉴는 다 있고 플러스 그릴에 구워 먹을 수 있는 돼지고기가 있어서 좋았어요 손님에 대한 접대가 빠르고 좌석이 널널해서 기다리지 않고 시간 제한한다고 꼴값 떠는뷔페들보다 훨씬 나았어요
1657448449,더메이드뷔페,,,"기존 우리가 아는 뷔폐 브랜드 + 고기, 장어 무한 버젼 입니다. 고기 굽는 곳 따로 있어서 냄새 없어서 좋았습니다. 스시, 디저트 종류도 훨씬 많고 맛있습니다. 돌잔치 할정도로 넓은 룸도 있어서 모임이나 행사할때도 좋을거 같습니다. 개인적으로 강추👍🏻"
1657448449,더메이드뷔페,,,다른 고기들은 그럭저럭... 양념구이들은 참소스 한번 더 발맀더니 내입에 딱!! 육질은 그럭저럭...가성비 생각함 이 또한 not bad!!
1657448449,더메이드뷔페,,,다른 음식들은 딱딱하고 맛없어서 잘 안먹는데 서브 메뉴인 새우튀김과 타코야끼를 아주 맛있게 먹었습니다.
1657448449,더메이드뷔페,,,더메이드오면 종일 아무것도 안먹어요 가짓수가 어찌나많은지 특히 초밥이 종류가 어마어마 해요 진짜 배터지는곳이예요 고기는 구워먹는 형식이라 바로바로 먹으니 따뜻하고 원하는만큼 구울수있어서 좋아요 매장도 크고 깔끔하고 일하시는분들도 많아서 바로바로 접시를 치워주시니 좋았어요 디져트도 어찌나 많은지 더메이드에서 수박을 올여름 처음으로 먹어보네요 ㅋㅋ 이모들 모시고 왔는데 다 좋아하셨답니다 특별한날 모임하기에도 좋을거같아요! 마곡 뷔페 추천드려요
1657448449,더메이드뷔페,,,"마곡역 초밥뷔페 [더메이드] 평일 디너 방문했어요. 자리가 넓어 웨이팅 없이 입장했고 초밥 종류는 물론 고기, 튀김, 디저트까지 종류가 정말 다양해요! 아이들과 함께 가기 좋은 분위기였고 특히 직접 고기 구워먹는 공간이 생겨서 좋았어요. 디저트 바도 알차고 만족스러웠습니다 :)"
1657448449,더메이드뷔페,,,"마곡역 회식장소 , 데이트 장소, 가족 모임 장소로 좋은 더메이드 뷔페에 다녀왔어요"
1657448449,더메이드뷔페,,,마곡초밥뷔페 찾다가 방문해봤는데 매장도 넓고 음식 종류가 진짜 많아요 !! 스시 종류가 너무 많아서 왠만한 초밥뷔페 이상인거 같습니다 ! 매장도 넓고 쾌적해서 좋습니다 한식양식일식 디저트까지 완전 구성 최곱니다
1657448449,더메이드뷔페,,,"매장 넓고, 인테리어 이쁘고 물 흐르고 음식들 맛있고, 셀프 구이음식 가능하고 너무 좋습니다."
1657448449,더메이드뷔페,,,매장도 넓고 항상 방문 할때마다 깨끗하게 관리가 잘 되어았어 믿음이 갑니다!
1657448449,더메이드뷔페,,,바베큐 코너가 따로 구비되어 있는게 확실한 차별점.
1657448449,더메이드뷔페,,,"별 기대 안하고 갔는데 정말 푸짐하고 맛있게 먹고왔어요. 멍게초밥은 비렸지만 초밥들 대체적으론 맛있었고 종류도 많아요. 한식, 양식, 중식, 디저트까지 한곳에서 해결할 수 있었고 평일 런치에 가니 만석이여도 조용히 대화하기 좋았어요. 한 곳에서 고기 구워서 갖다 먹는것도 이색적이였습니다. 고기는 몇개밖에 안먹었고 맛있지만 별도의 공간이라 그런지 몸과 손이 잘 안가더라구요. 계산해 주시는 직원분의 이번한주도 잘 보내라는 말에 기분도 좋았습니다 :)"
1657448449,더메이드뷔페,,,부모님과도 가끔씩 가는 곳인데 남자친구랑 같이 가니 또 다른 느낌이에요.
1657448449,더메이드뷔페,,,생일이라 방문했는데 메뉴도 다양해서 가격대비 맛있게 잘 먹고 왔어요. 예전에 왔을 때보다 맛있는 디저트가 많아져서 더 좋았어요~
1657448449,더메이드뷔페,,,"서울 강서구 마곡역, 발산역의 무한리필 뷔페, 부페 찾으시는 분들 <더메이드뷔페>로 오세요ㅠㅠㅠ 셀프직화구이 코너도 있고 초밥 퀄 미쳤구요 한식, 중식, 일식, 양식 다 있어서 진짜 맛있게 먹었습니다♡♡♡ 빠른 시일 내에 또 갈게요"
1657448449,더메이드뷔페,,,"아이스크림도 소프트 외에도 초코,바닐라, 녹차 같이 다양하고 빙수도 있어서 좋았어요"
1657448449,더메이드뷔페,,,여긴 무조건 가세요!! 얼마 안되는 금액으로 배터지게 먹을 수 있는곳이고 퀄리티도 좋아요
1657448449,더메이드뷔페,,,오랜만에 고퀄 뷔페 다녀왔어요❤️ 마곡역 근처 맛집으로 찾아서 갔는데 더메이드뷔페 엄청 넓고 가짓수 많더라구요! 이렇게 매장 큰 뷔페 처음 봐요ㅋㅋㅋ 스시부터 스시롤 튀김 고기류 후식까지 빼놓지 않고 다 좋았어요❤️ 그리고 직원 분들 다 엄청 친절하셔서 더 좋았습니다! 마곡 밥집이나 가족모임 장소 찾는 분들께 추천해요! 가성비 좋습니다❤️
1657448449,더메이드뷔페,,,"요즘 물가가 많이 올랐잖아요? 근데 이가격에 이정도 퀄리티라면 자주 올 것 같아요~ 재료 신선하고 맛있고 종류도 많고 정말 좋네요! 가족모임으로 예약했었는데, 모두 만족한 식사였습니다~"
1657448449,더메이드뷔페,,,월요일에 뷔페 이용한 건 첨인데 너무 한적해서 뷔페에서 느끼는 혼잡함이 조금은 그립던데?ㅋ
1657448449,더메이드뷔페,,,"음식들이 다 평타이상 넘 맛있습니다! 관리도 깨끗하게 잘 돼있고 초밥, 롤 가짓수 진짜 많아요 ㅋㅋ! 연탄에구워먹는 고기도 넘 맛있었어요! 담번에 가면 사과와플은 두번해먹을고에요!!"
1657448449,더메이드뷔페,,,이제 뷔페는 여기만 가려구요! 음식이 전부 맛있어요
1657448449,더메이드뷔페,,,자주 가는 곳인데 갈때마다 메뉴가 조금씩 바껴서 좋아요. 특히 육해진미 스페셜 코너는 1인화로에서 직접 직화로 구워먹을 수 있어서 원하는 구이를 따뜻하게 먹을 수 있어 좋습니다. 평일 런치로 가니 여유롭게 이용할 수 있어 좋았어요.
1657448449,더메이드뷔페,,,재미도있고~ 맛도 있고~ 메인부터 후식까지 모두 맛있게 먹을수 있는곳! 더메이드뷔페 추천합니다😃
1657448449,더메이드뷔페,,,저녁에 방문예약 없이 이용대기 시간 바로 입장나들이친구
1657448449,더메이드뷔페,,,저녁에 방문예약 없이 이용대기 시간 바로 입장데이트연인・배우자
1657448449,더메이드뷔페,,,저녁에 방문예약 없이 이용대기 시간 바로 입장데이트연인・배우자
1657448449,더메이드뷔페,,,"저녁에 방문예약 후 이용대기 시간 바로 입장가족모임연인・배우자, 아이, 부모님"
1657448449,더메이드뷔페,,,"저녁에 방문예약 후 이용대기 시간 바로 입장기념일, 가족모임부모님, 아이"
1657448449,더메이드뷔페,,,저녁에 방문예약 후 이용대기 시간 바로 입장데이트연인・배우자
1657448449,더메이드뷔페,,,점심에 방문예약 없이 이용대기 시간 바로 입장가족모임친척・형제
1657448449,더메이드뷔페,,,점심에 방문예약 없이 이용대기 시간 바로 입장데이트연인・배우자
1657448449,더메이드뷔페,,,점심에 방문예약 없이 이용대기 시간 바로 입장일상연인・배우자
1657448449,더메이드뷔페,,,점심에 방문예약 후 이용대기 시간 바로 입장친목지인・동료
1657448449,더메이드뷔페,,,직원분들도 너뮤 친절하시고 음식도 다 맛있었습니다! 또 올게요!
1657448449,더메이드뷔페,,,집 근처라면 자주 방문하고 싶을 만큼 전반적으로 완성도가 높은 곳이었다. 다음에는 친구들과 함께 다시 오고 싶은 뷔페다.
1657448449,더메이드뷔페,,,"초밥 종류도 다양해 아이들도 정말 잘 먹었고, 소고기, 돼지고기 직접 구워 먹는 코너도 있어 고기파도 만족! 요리류도 다양하고 다 맛있고, 여름인데 아이스크림과 빙수도 딱이예요."
1657448449,더메이드뷔페,,,"초밥도 맛나고, 육회도 추천👏🏻 피자는 솔직히 별로였어요.. 그리고 아이스크림은 꼭 드세요!! 엄청 진하고 맛있어요!!! 바닐라+녹차 조합 추천합니다용👏🏻"
1657448449,더메이드뷔페,,,초밥이랑 롤 종류가 엄청 나게 다양해서 종류별로 하나씩만 먹어도 배부를듯ㅋㅋ 그리고 고기랑 해산물 구워먹는 코너 있어서 좋았어요! 장어랑 야끼니꾸도 있고~~ 디저트는 크레이프 맛있네요!
1657448449,더메이드뷔페,,,친구들과 모임으로 어디를 가야하나 고민하다 가봤는데 들어가자마자 엄청 넓고 인테리어가 이뻐서 깜짝 놀랐어요! 음식 종류가 엄청 다양하고 맛있었어요. 심지어 화장실도 너무 이쁘더라고요.
1657448449,더메이드뷔페,,,한식 양식 중식 무엇보다 가장 중요한 건 초밥의 종류가 정말정말 많다는거예요!!! 해산물을 안 좋아하시는 분들도 함께 갈 수 있어요 왜냐하면 다양한 고기도 구워먹을 수 있거든여~~매장도 넓고 인테리어도 좋아서 가족모임이나 회식으로도 완전 추천합니다!
1003970565,뜨돈 마곡점,,,가게 사장님이라 주변분 칭찬으로 오늘 첫방문을 하게 되었는데 와 맛집인데는 다 이유가 있네요 재 방문 할거 같아요 정말 맛있게 잘먹었습니다 감사합니다😊
1003970565,뜨돈 마곡점,,,고객님 방문해 주셔서 감사합니다🤍 항상 초심 잃지 않고 조리하겠습니다~~~💛💛💛
1003970565,뜨돈 마곡점,,,고객님 방문해 주셔서 감사합니다🤍 항상 초심 잃지 않고 조리하겠습니다~~~💛💛💛
1003970565,뜨돈 마곡점,,,냉채돈까스 먹었습니다! 셀프바도 있어서 스프나 국물류 먹기에 좋았어요. 새콤한 맛이 강했는데 돈까스랑 같이 곁들여 먹으니 괜찮았어요. 직원분이 친절하셔서 맛있게 잘 먹고 갑니당.
1003970565,뜨돈 마곡점,,,돈가스 생각나면 옵니다 돈가스 외에 떡볶이. 스프. 빵. 우동국물. 아이스크림 있는데 전부 셀프로 먹을수있어요
1003970565,뜨돈 마곡점,,,돈까스 맛집은 뜨돈🔥 메뉴가 다양해서 올 때마다 다른 메유 시켜먹는 재미도 있어요 ㅎㅎ 셀프바에서 스프랑 떡볶이 등등 먹을 수 있고 아이스크림까지 베 터지고 갑니다 💖
1003970565,뜨돈 마곡점,,,"돈까스 맛집이에요, 콩국수도 너무 훌륭해요. 고구마치즈돈까스, 김치우동도 너무 맛있었어요. 냉모밀도 맛도리. 시킨 메뉴가 다 맛있었던걸로 미루어 짐작하건데 모든 메뉴가 맛있을꺼 같아요. 특히 셀프바가 정말 혜자에요. 모닝빵, 떡볶이, 샐러드 있어요. 떡볶이도 수제 떡볶이인가봐요 너무 맛있어요 후식 아이스크림까지 완벽하네요. 양도 적지 않아서 너무 배불러 떡볶이를 더 못먹고 나온게 아쉬울정도. 모든 면에서 만족스러워요 작은 키즈룸 있어서 아이들 데리고 가기도 너무 좋겠어요 단체석도 있고 매장 깨끗하고 청결합니다 친절하시고 주차도 편해요 아무튼 재방문 할 예정입니다."
1003970565,뜨돈 마곡점,,,뜨돈 마곡❤️ 재방문입니다^^ 아이와함께오기에 딱좋은 맛집이구요~ 메뉴 하나하나 다 맛있어요👍
1003970565,뜨돈 마곡점,,,뜨돈 마곡점 2번째 방문인데 마곡 근처에 Top 1 돈까스 집이라 생각합니다 직원분들도 다 친절하고 분위기도 편안해서 가족 친구 데이트 장소로도 좋지만 혼밥하기에도 강력추천 맛집입니다 다음에 또올게요
1003970565,뜨돈 마곡점,,,뜨돈 마곡점❤️ 소문대로 가성비갑의 맛있는 돈까스집이네요!! 한번오면 계속오게될것같아요^^ 메뉴도 다양하 고 셀프바에도 먹을게 많아서 만족스럽습니다! 가족외식으로 최고에요~ 놀이방도 있고 후식으로 아이스크림까지❤️👍👍 추천드립니다💕
1003970565,뜨돈 마곡점,,,뜨돈 첫 방문인데 너무 맛있어요!! 매장도 넓어서 친구랑 대화하기도 좋고 무엇보다 이 가격에 이런 돈가스 흔치 않은데 너무 좋네요 ㅠㅠ 앞으로 자주 올 거 같아요!!
1003970565,뜨돈 마곡점,,,마곡역 도보 5분 거리에 있고 위치도 딱 좋은 2층~ 밖에 바라보면서 먹으니 더욱 맛잇는거 같네요!! 번창하세요~
1003970565,뜨돈 마곡점,,,먹다가 찍어 조금 지저분 한데 유아식 하는 아기랑 오기도 너무 좋아요! 어른들 입맛에도 맞고 아기도 엄청 잘먹네요 ㅎㅎ 놀이공간도 있고 샐바도 너무 잘되어있어서 가성비굿이에요! 식물원 들렸다 온 곳인데 만족합니다❤️
1003970565,뜨돈 마곡점,,,메뉴 구성도 다양하고 셀프바에 다양한 게 준비되어 있어서 너무 좋아요!! 치킨가스랑 뜨돈돈까스도 맛있습니다!!
1003970565,뜨돈 마곡점,,,모닝빵에 칼집 내는게 품이 많이 들텐데.. 어찌보면 사소할지 모르겠지만 이런 소소한 부분에 감동받네요~
1003970565,뜨돈 마곡점,,,배달 주문도 꽤 들어오던데 이 정도 맛이면 배달로는 완전 고퀄이라 동네면 저도 종종 시켜먹을 거 같아요~
1003970565,뜨돈 마곡점,,,사이드도 완벽 떡볶이 스프 아이스크림 다 완벽합니다 🩵🩵 첨 오신분들은 무조건 고치돈 강추입니다 !!!!
1003970565,뜨돈 마곡점,,,사장님 일부러 오실 때 마다 매번 리뷰까지 써주시는데 기분 안좋게 식사하시고 가셔서 죄송합니다 마음이 하루 종일 찝찝하네요 이번 일로 홀 서빙에 더 신경쓰도록 하겠습니다 좋은 하루 보내세요~
1003970565,뜨돈 마곡점,,,사장님 포함 직원분들 너무 친절하시고 돈가스도 너무 맛있어요! 고기도 부드럽지만 소스 짱짱!
1003970565,뜨돈 마곡점,,,"사진만 보고 맛있어 보여서 방문했는데 주문한 돈까스, 짬뽕파스타도 엄청 맛있고"
