가게ID,가게명,평점,날짜,리뷰내용
1990307809,몽롱주점 마곡본점,,,"안녕하세요! 몽롱주점 마곡본점을 찾아주시고 좋은 시간 보내셨다니 너무 기뻐요! 😊 미월당 즉떡콘치를 맛있게 드셨다니 저희도 기분이 좋네요! 포토리뷰의 손하트까지! 😍 저희 몽롱주점의 맛있는 안주와 친절함에 만족하셨다니 정말 감사합니다. 다음에 또 오셔서 좋은 시간 보내시길 바라며, 좋은 하루 되세요! 👍❤️"
1990307809,몽롱주점 마곡본점,,,"안녕하세요! 몽롱주점 마곡본점을 찾아주시고, 머리가 띵할 정도의 시원한 맥주와 귀여운 캐릭터에 만족해주셔서 정말 감사합니다! 😊 안주 퀄리티도 좋게 봐주셔서 너무 기뻐요. 앞으로도 손님들의 입맛을 사로잡을 수 있도록 더욱 노력할게요! 다음에 또 오셔서 몽롱주점 마곡본점의 맛있는 안주와 생맥주를 즐겨주세요! ❤️👍"
1990307809,몽롱주점 마곡본점,,,"안녕하세요! 몽롱주점 마곡본점입니다 😊 저희 가게 분위기가 마음에 드셨다니 정말 기뻐요! ✨ 은은한 조명 아래에서 친구분들과 즐거운 시간 보내신 것 같아 저도 기분이 좋네요! 🤩 안주도 맛있게 드셨다니 다행이에요! 🍻😍 몽롱주점은 데이트 장소로도 좋으니, 소중한 분과 또 방문해주세요! 💖 항상 좋은 시간 보내실 수 있도록 노력하겠습니다! 👍"
1990307809,몽롱주점 마곡본점,,,"안녕하세요! 몽롱주점 마곡본점입니다 😊 저희 가게에서 즐거운 저녁 시간을 보내신 것 같아 정말 기뻐요! 바다로 간 유린기를 맛있게 드셨다니, 저희도 너무 뿌듯하네요! 쏘맥 업그레이드도 만족하셨다니 다행입니다 👍 앞으로도 몽롱주점 마곡본점은 분위기, 맛, 음악 모두 만족스러운 곳으로 기억될 수 있도록 노력할게요! 소중하고 정성스런 후기 정말 감사합니다 ❤️"
1990307809,몽롱주점 마곡본점,,,"안녕하세요! 몽롱주점 마곡본점입니다 😊 튀김족발과 반반전 맛있게 드셨다니 정말 기뻐요! 다음엔 다른 안주들도 꼭 드셔보세요! 추천 드리는 메뉴는 순살크림배추구이, 유린기, 오리냉채도 추천드린답니다! 저희 몽롱주점은 항상 맛있는 음식과 최고의 서비스로 고객님들을 맞이할 준비가 되어있으니, 또 방문해주세요! 👍❤️🙇‍♀️"
1990307809,몽롱주점 마곡본점,,,야외 느낌 나는 테라스는 비닐로 막혀 있어서 겨울에도 따뜻하게 즐길 수 있음
1990307809,몽롱주점 마곡본점,,,야장테라스 비닐로 감싸진 분위기 덕에 비오는 날 오면 더 운치있을 듯 해요
1990307809,몽롱주점 마곡본점,,,"언젠가 잠실에서도 뵐 수 있기를 바라며, 당분간은 발산마곡 몽롱주점에서 더 맛있고 즐거운 시간 만들어드릴게요!"
1990307809,몽롱주점 마곡본점,,,영상 찍으러 간 건데 분위기가 너무 좋아서 영상 나올 듯 잘 나왔어요
1990307809,몽롱주점 마곡본점,,,"와~ 몽롱주점 마곡본점에 방문해주시고, 좋은 말씀까지 남겨주셔서 정말 감사합니다! 😊 핫플 맛집이라는 칭찬에 벌써부터 기분이 좋아지네요! 몽롱주점의 감성적인 분위기가 마음에 드셨다니 정말 다행이에요. 친구분과 즐거운 시간 보내신 것 같아 저도 덩달아 기쁩니다! 다음에 또 몽롱주점에서 만나요! ❤️👍"
1990307809,몽롱주점 마곡본점,,,위치도 마곡발산역에서 도보 5분이라 접근성 좋고 안주가 맛있어서 또 갈게요
1990307809,몽롱주점 마곡본점,,,"이맛에 야장 돌아다니지요 잔디밭뷰라서 초록초록함 가득 우레탄비닐로되어있어서 바람도 막아주고추우면 담요도 덮을 수 있게 마련되어 있어요! 생맥주 원쁠원이라 시원하게 앉자마자 들이키고 안주가 너무 맛있어서 자리에 앉아서 소주 들이키다 보니, 한병두병세병.. 오랫만에 취했네요🤪"
1990307809,몽롱주점 마곡본점,,,"이쁜 음식 사진과 해시태그까지 잊지 않고 남겨주시고, lg회식맛집으로 꼽아주셔서 감격입니다! 다음에도 방문하실 땐 더욱 만족하실 수 있도록 노력하는 몽롱주점 마곡본점이 되겠습니다. 언제든지 힐링이 필요할 때 저희를 찾아주세요! ❤️"
1990307809,몽롱주점 마곡본점,,,저녁에 방문예약 없이 이용대기 시간 30분 이내일상연인・배우자
1990307809,몽롱주점 마곡본점,,,"저녁에 방문예약 없이 이용대기 시간 바로 입장가족모임, 친목친척・형제, 부모님"
1990307809,몽롱주점 마곡본점,,,저녁에 방문예약 없이 이용대기 시간 바로 입장기념일연인・배우자
1990307809,몽롱주점 마곡본점,,,"저녁에 방문예약 없이 이용대기 시간 바로 입장데이트, 여행연인・배우자"
1990307809,몽롱주점 마곡본점,,,"저녁에 방문예약 없이 이용대기 시간 바로 입장여행부모님, 연인・배우자"
1990307809,몽롱주점 마곡본점,,,"저녁에 방문예약 후 이용대기 시간 바로 입장기념일, 데이트친구"
1990307809,몽롱주점 마곡본점,,,전통주부터 하이볼까지 다양해서 주량 상관없이 즐기기 좋아요
1990307809,몽롱주점 마곡본점,,,지인소개로 가게된 몽롱주점 마곡본점입니다.내부 분위기도 좋고 신청곡 받아주시거든요~넘 좋았어요!!!안주도 맛있고 친구들이랑 얘기하면서 머무르기좋은곳이에요!!직원분들 친절하시고 빠르게 응대해주시는점 좋았어요👍
1990307809,몽롱주점 마곡본점,,,치즈 감자전이랑 마라 전골 너무 너무 너무너무 맛있어요! 사장님이랑 일하는 분들 다 너무 친절하시고 야장에 에어컨도 켜 주셔서 시원합니다! 발산에 오시는 분들은 꼭 여기로 가세요!
1990307809,몽롱주점 마곡본점,,,테라스에서 강아지 윰차와 함께해주시는 방문해주시는 모습 언제 만나보아도 저희 마음이 따뜻해집니다🐶💛
1990307809,몽롱주점 마곡본점,,,하이볼과 전통주 옵션이 다양해서 술 약해도 골라 마시기 좋아요
1990307809,몽롱주점 마곡본점,,,한식 요리주점 몽롱주점에서 맛있게 몸기운까지 회복하고 가셨다니 정말 기쁘네요! 💪😊
1990307809,몽롱주점 마곡본점,,,"항상 메뉴가 맛있어 보여서 찾아주셨다니 너무 감사하고, 친절한 사장님 칭찬까지… 저희 마음이 몽롱해집니다💚"
1598022305,심야회관요리주점,,,강서구청 먹자골목에 위치한 심야회관! 이 쪽에 올 일이 거의 없긴 하지만 너무 궁금해서 들러봤어요!! 일단 매장 넓고 깔끔~~ 반겨주는 밍키[ 강아지 입니다 ㅎㅎ] 저희는 갈비찜과 에그인헬 먹었는데 진짜 맷 있어요
1598022305,심야회관요리주점,,,"강아지랑 같이 갈 수 있는 술집이 흔치 않은데, 이곳은 애견 동반이 가능해서 분위기가 훨씬 편안했어요."
1598022305,심야회관요리주점,,,"강아지랑 같이 갈 수 있는 술집이 흔치 않은데, 이곳은 애견 동반이 가능해서 분위기가 훨씬 편안했어요."
1598022305,심야회관요리주점,,,"기본 반찬 엄청 나오네요^^ 김삼두, 매운갈비찜 정말 맛있어요👍 사장님께서 친절하고 매장도 깔끔하고 좋아요"
1598022305,심야회관요리주점,,,"다만, 반려동물 동반이라 가게에 리트리버가 있어서 무서워하시는 분들은 알고 방문 하시는게 좋을듯합니당ㅎ"
1598022305,심야회관요리주점,,,돼지갈비찜 먹고싶어서 왔는데 멍뭉이가 반겨주고..갈비찜도 맛있으면 어캄니까...밍키보러 또올거임
1598022305,심야회관요리주점,,,많이 안매운데 맛있어요! 가게 직원분들도 친절하시고 친구랑 맛있게 먹고 나왔어요~!
1598022305,심야회관요리주점,,,매운갈비 먹고 싶어서 갔는데 양도 엄청 많고 너무 많이 맵지 않고 맛있었어요!
1598022305,심야회관요리주점,,,매운갈비찜 먹으러 왔는데 진짜 맛있고 양도 많아요 다른 안주도 맛있어용 귀여운 강아지도 있어서 완전 힐링~ 직원분들도 상녕하샤서 즐거운 모임 했습니다!
1598022305,심야회관요리주점,,,매운갈비찜 먹으러 왔는데 진짜 맛있고 양도 많아요 다른 안주도 맛있어용 귀여운 강아지도 있어서 완전 힐링~ 직원분들도 상녕하샤서 즐거운 모임 했습니다!
1598022305,심야회관요리주점,,,매운갈비찜이 먹고싶어서 처음 와봤는데~ 대성공 지인분이 맛잇다고추천 해주셨는데 존맛탱~~다음에또올게용
1598022305,심야회관요리주점,,,매운맛도 맛있게 매운 정도라 속에 부담은 가지 않았고 토마토 파스탕도 진짜 술 쭉쭉 들어가는 안주라 강추추추추추 입니다!!
1598022305,심야회관요리주점,,,밑반찬 구성 좋고 매운갈비찜도 적당히 매콤하고 맛있어요. 주류 종류도 다양해서 좋네요. 다음에 또 올게요~
1598022305,심야회관요리주점,,,밤에 방문예약 없이 이용대기 시간 바로 입장데이트연인・배우자
1598022305,심야회관요리주점,,,밤에 방문예약 없이 이용대기 시간 바로 입장친목지인・동료
1598022305,심야회관요리주점,,,밤에 방문예약 없이 이용대기 시간 바로 입장친목지인・동료
1598022305,심야회관요리주점,,,밤에 방문예약 없이 이용대기 시간 바로 입장친목지인・동료
1598022305,심야회관요리주점,,,밤에 방문예약 없이 이용대기 시간 바로 입장친목지인・동료
1598022305,심야회관요리주점,,,분위기도 좋고 마스코트 밍키도 넘 귀엽고 넘 좋았어요~~~푸짐하고 가격대비 넘 좋아요
1598022305,심야회관요리주점,,,비주얼 대박이고 간도 너무 잘되어있어서 진짜 맛있었어요!! 🩷🩷🫶
1598022305,심야회관요리주점,,,비주얼 대박이고 간도 너무 잘되어있어서 진짜 맛있었어요!! 🩷🩷🫶
1598022305,심야회관요리주점,,,"사장님이 어머니레시피를 받아서 만드신다는데 역시 인위적인 갈비찜 맛이 아닌, 집에서 먹는 갈비찜 맛이었고 같이 나오는 찬과 쌈 친구들이 잘어울려용🐵"
1598022305,심야회관요리주점,,,세상에마상에 이런집이있다니!! 토마토도 서비스로 주시고 어묵탕도 시켰는데 너무 맛있어서 다 먹어지워서 사진이 없구여 파스타대박… 감칠맛미침…!!! 술이술술 넘 맛있어요ㅠㅠㅜ 여기서 1차하려고 왔는데 7시에와서 11시까지 죽치고 갑니닼ㅋㅋ
1598022305,심야회관요리주점,,,양도 많고 겁나 맛있어용🥰❤️ 다음에 또 올게용!!
1598022305,심야회관요리주점,,,양도 많고 밥이랑 잘 어울릴것 같아서 공기밥 시켰는데 고봉밥으로 주셔서 깜짝 놀랐어요👍🏻
1598022305,심야회관요리주점,,,여기 넘 맛있어요!!! 두번째 방문인데 고기도 너무 부드럽고 냄새도 하나도 안나고 감칠맛대박!! 다른 메뉴도 또 먹고싶은데 같은메뉴만 먹고있어용 ㅋㅋㅋ 🙈😍
1598022305,심야회관요리주점,,,이거 먹으려고 김포에서 찾아왔어요😍매장 넓고 쾌적하고 좋아요! 아이랑 같이와서 아이도 저녁밥 든든히 먹었어요! 🙂
1598022305,심야회관요리주점,,,이거 먹으려고 김포에서 찾아왔어요😍매장 넓고 쾌적하고 좋아요! 아이랑 같이와서 아이도 저녁밥 든든히 먹었어요! 🙂
1598022305,심야회관요리주점,,,"이차로와서 간단한 안주를 찾았는데 가벼운안주가 마땅치가않아서 먹태랑 감바쓰롱롱롱 사장님과 알바님이 친절하셨다 팝콘을 몇차례리필했는데도 친절히!! 베스트메뉴를못먹어서아쉽,마스코트친구DOG한바쿠도는데 구석자리까지 안와죠서아쉽"
1598022305,심야회관요리주점,,,"이차로와서 간단한 안주를 찾았는데 가벼운안주가 마땅치가않아서 먹태랑 감바쓰롱롱롱 사장님과 알바님이 친절하셨다 팝콘을 몇차례리필했는데도 친절히!! 베스트메뉴를못먹어서아쉽,마스코트친구DOG한바쿠도는데 구석자리까지 안와죠서아쉽"
1598022305,심야회관요리주점,,,재료들도 신선하고 넉넉하게 나오는게 친구랑 술마시면서 한입씩 하기 너무 좋았어요~ 기대이상의 비주얼에 처음 왔는데 단골될거같습니다
1598022305,심야회관요리주점,,,재료들도 신선하고 넉넉하게 나오는게 친구랑 술마시면서 한입씩 하기 너무 좋았어요~ 기대이상의 비주얼에 처음 왔는데 단골될거같습니다
1598022305,심야회관요리주점,,,저 갈비찜 하나만 보고 갔음 간도 딱 맞고 양도 잘 먹는 둘이서 배부르게 먹었음
1598022305,심야회관요리주점,,,저녁에 방문예약 없이 이용대기 시간 바로 입장데이트연인・배우자
1598022305,심야회관요리주점,,,저녁에 방문예약 없이 이용대기 시간 바로 입장데이트연인・배우자
1598022305,심야회관요리주점,,,저녁에 방문예약 없이 이용대기 시간 바로 입장데이트연인・배우자
1598022305,심야회관요리주점,,,저녁에 방문예약 없이 이용대기 시간 바로 입장데이트연인・배우자
1598022305,심야회관요리주점,,,저녁에 방문예약 없이 이용대기 시간 바로 입장데이트연인・배우자
1598022305,심야회관요리주점,,,저녁에 방문예약 없이 이용대기 시간 바로 입장데이트연인・배우자
1598022305,심야회관요리주점,,,저녁에 방문예약 없이 이용대기 시간 바로 입장데이트연인・배우자
1598022305,심야회관요리주점,,,저녁에 방문예약 없이 이용대기 시간 바로 입장친목연인・배우자
1598022305,심야회관요리주점,,,저녁에 방문예약 없이 이용대기 시간 바로 입장친목연인・배우자
1598022305,심야회관요리주점,,,저녁에 방문예약 없이 이용대기 시간 바로 입장친목친구
1598022305,심야회관요리주점,,,저녁에 방문예약 없이 이용대기 시간 바로 입장친목친구
1598022305,심야회관요리주점,,,저녁에 방문예약 없이 이용대기 시간 바로 입장친목친구
1598022305,심야회관요리주점,,,저녁에 방문예약 없이 이용대기 시간 바로 입장친목친구
1598022305,심야회관요리주점,,,저녁에 방문예약 없이 이용대기 시간 바로 입장친목친구
1598022305,심야회관요리주점,,,직원분들 모두 너무 친절하고 음식이 너무 맛있습니다!! 분위기도 좋구 맛도 좋구 가격도 저렴해요~~ 다음에 또 오겠습니당 :)
1598022305,심야회관요리주점,,,한상차림에 나오는 안주들도 딱 술안주로 좋아요b
1598022305,심야회관요리주점,,,한상차림에 나오는 안주들도 딱 술안주로 좋아요b
