가게ID,가게명,업종,평점,날짜,리뷰내용
35523842,바다회사랑2호점생선회,회,,,저녁에 방문예약 없이 이용대기 시간 바로 입장친목친구
35523842,바다회사랑2호점생선회,회,,,점심에 방문포장·배달 이용대기 시간 바로 입장가족모임부모님
35523842,바다회사랑2호점생선회,회,,,주말 4시반에 방문했는데 1호점 갔다가 3시간 이상 걸릴 것 같아서 빠르게 2호점으로 왔습니다. 그래도 2시간반은 걸리더라구요…😂 그래도 기름이 꽉찬 방어를 먹어서 기다린 시간이 아깝지 않았습니다! 너무 맛있고 추가로 매운탕을 주문해서 먹었는데 가성비가 너무 좋습니다. 꼭 시켜드세요! 다들 웨이팅 화이팅입니다👏🏻
35523842,바다회사랑2호점생선회,회,,,줄전갱이+붕장어 2인분짜리 주문해서 혼자 먹고 옴. 회무침 샐러드를 내어주심. 산낙지 좀 기대했는데 그건 안 주시더라고요. 막장도 잔멸치막장이 아니라 그냥 일반 막장이고. 좀 아쉽... 그치만 직원분들이 엄청 친절하셨고 회랑 백김치가 맛있었어요. 해물라면까지 먹을 생각으로 갔는데 그것까진 무리였음ㅋㅋㅋ
35523842,바다회사랑2호점생선회,회,,,줄전갱이+붕장어 2인분짜리 주문해서 혼자 먹고 옴. 회무침 샐러드를 내어주심. 산낙지 좀 기대했는데 그건 안 주시더라고요. 막장도 잔멸치막장이 아니라 그냥 일반 막장이고. 좀 아쉽... 그치만 직원분들이 엄청 친절하셨고 회랑 백김치가 맛있었어요. 해물라면까지 먹을 생각으로 갔는데 그것까진 무리였음ㅋㅋㅋ
35523842,바다회사랑2호점생선회,회,,,"평일 오픈 전인 1시에 도착했을 때 대기하는 사람 없었고, 2시정도에 메뉴 먼저 주문받고 오픈시간에 맞춰 입장했습니다."
35523842,바다회사랑2호점생선회,회,,,현장에서 테이블링으로 예약하고 홍대로 넘어가서 2시간 반 가량 시간 때우던 중 알림톡 받고 가게 앞 사람들 줄 서있는 곳에 가서 줄 섰는데 대기번호는 묻지도 않고 그냥 온 순서대로 들어가더라구요? 뭔가 시스템이 이상하네요.. 한 두팀 앞뒤가 섞이는건 이해하겠는데요 이런 식이면 테이블링 예약 안하고 그냥 줄서 있어도 모르겠는데요?! 왜냐하면 대기번호 확인을 아예 안하니까요~ㅎㅎ 암튼 2명이서 소자 먹으면 배불리 먹을 수 있어요 백김치 더 달라했는데 추가요금 천원 있었어요 반찬추가요금 안내에 대한걸 매장 안에 붙혀놓으면 좋겠네요 방어는 신선하고 맛있어요! 김에 방어와 백김치 밥 무순과 함께 먹으면 맛나요!!
18799565,바다회사랑생선회,회,,,"12시부터 1시간 40분정도 기다렸어요! 원래 2시오픈인데, 조금 일찍 준비되셨다셔서 조금 일찍 입장했습니다. 음식 맛있어요. 여자 둘이서 연어+대방어 소(小) 먹었고, 저번에 남친이랑은 같은메뉴 중(中)에 해물라면 먹었어요. 그정도가 딱 맞았습니다~ 근데 식당 내부 좀 추워요 ㅠㅠㅠㅠ 테이블은 10테이블 있습니다!"
18799565,바다회사랑생선회,회,,,"4시반에 웨이팅 했는데, 5시간 기다리고 마지막(9시반)에 입장 했습니다. 맛집으로 소문나면 기대가 큰 만큼 만족하기 힘든데, 제가 먹어 본 방어 중에 제일 맛있었습니다."
18799565,바다회사랑생선회,회,,,겨울하면 방어.. 방어하면 바다회사랑이라고 해서 와봤습니다 2명이서 중 시켰는데 엄청 두껍게 나와서 깜짝놀랐네요.. 전 느끼한걸 잘 못먹어서 많이 먹지 못하구 같이 간 남자친구가 다 먹었네요 ㅎㅎ.. 그래도 느끼한거 못먹는거 치곤 진짜 많이 먹었어요 2시 반에 도착했는데 들어갈땐 3시 조금 넘어서 들어갔어요! 해물라면은 엄청 칼칼할줄 알았는데 의외로 안매워서 먹기 좋았어요 ㅎㅎ 나중에 사람들 많이 모아서 다같이 와보고 싶네요
18799565,바다회사랑생선회,회,,,늦게 가서 그런지 머릿살 위주로 주셨어요. 뱃살은 거의 없고 부위가 고르지 않아 아쉬웠습니다. 그래도 두툼하게 썰어주셔서 식감은 좋았고 양도 푸짐 했습니다. 사이즈랑 소스류도 엄청 넉넉하게 넣어주셔서 굳이 추가 안해도 괜찮았어요! 그리고 여자 2명이서 소자 먹었는데 실컷 먹는 양이 었습니다. 담엔 좀 이른 시간에 가볼게요!
18799565,바다회사랑생선회,회,,,"대방어 대자, 모듬멍게, 전복구이, 개불, 해물라면이 어느하나 빠짐없이 다 너무 싱싱하고 양도 푸짐하고 맛있었어요!"
18799565,바다회사랑생선회,회,,,"만약 본인이 11번,12번째 순서라도 앞에 팀들이 몇명에 따라서 첫 타임에 들어갈지말지 결정됩니다."
18799565,바다회사랑생선회,회,,,목요일5시쯤 방문했었는데 운좋게 남은한자리 바로앉았네요ㅎㅎ 그후로 오시는분들은 조금씩 기다리셔야되는거같더라구요~ 그래도 식사시간이 두시간으로 제한되어있어 그렇게 많은게아니면 웨이팅해볼만하다 생각들었습니다ㅎ 방어는 역시 말해뭐해 너무맛있고요.. 회를 두툼하게 썰어주셔서 저한테는 좀 크긴했지만 진짜 맛있긴맛있더라고요🥹 회 좋아하는사람이면 꼭 한번 가볼만합니다 자꾸 아른아른 생각나요.. 근데 서빙하시는 이모님인지 사장님인지 좀 무섭긴 무서우세요..
18799565,바다회사랑생선회,회,,,바다회사랑 고민했는데 스끼다시 잘 나와서 여기서 포장하길 잘 한 거 같아요.
18799565,바다회사랑생선회,회,,,"방어 맛집 1티어인 바다회사랑,, 평일 4시에 방문했는데 줄이 있었지만 다행히 바로 입장했다, 2인 기준 방어회 소 주문했고 가격은 69000원 나쁘지 않은 가격이었다, 바다회사랑 특징이 회가 제법 두껍게 나와서 사람마다 호불호가 있을 것 같은데 좋아하는 사람들은 한 입 가득 씹히는 식감 때문에 계속 찾는 것 같다, 기본 셋팅에 산낙지까지 서비스로 나왔고 확실히 다른 곳이랑 비교했을 때 가성비는 좋은 것 같다, 방어가 어쩔 수 없이 기름이 많은 생선이라 금방 물리는데 소주랑 같이 먹으면 확실히 궁합이 좋았고, 야무지게 먹어서 당분간 방어 생각은 안 날 것 같다"
18799565,바다회사랑생선회,회,,,방어 맛집으로 유명해서 가 봤어요. 꽤 기다려야 했네요. 줄 서 있으면 미리 주문받고 세팅까지 한 후 불러요. 미리 메뉴 선정해 가세요. 둘이서 대방어(소) 매운탕 소주 두 병 마셨더니 딱 좋아요. 방어는 두툼하고 맛 좋은데 매운탕은 그냥 그랬네요. 산낙지 서비스로 주셨고요. 왜 인기 식당인지 알겠어요 😊
18799565,바다회사랑생선회,회,,,방어랑 연어 중자 85000원. 회가 두툼하고 양이 많아서 여자 3명이 먹어도 충분한 편. 포장해왔는데 김을 넉넉히 넣어줘서 좋았음 ☺️
18799565,바다회사랑생선회,회,,,"성인 3명이 대자(109,000원) 를 다 못 먹을 정도로 양이 푸짐해요. 남은 회는 이튿날 회덮밥 해 먹었어요. 수산시장처럼 찌개감을 별도 주거나 하진 않아요. 참고 하세요"
18799565,바다회사랑생선회,회,,,소자 시켰는데도 양이 많았고 두툼~해서 맛있게 잘 먹었어요! 전화 예약해서 바로 썰어 나오는 건 아닌 것 같고 미리 썰어 둔 것 냉장보관해 받았습니다
18799565,바다회사랑생선회,회,,,"여름에도 줄 선다는 바다회사랑입니다. 겨울 방어시즌에 두툼한 회를 한가득 내어주시는 걸로 유명하다고 원래 알고있었는데 이곳은 사시사철 제철회를 맛볼 수 있는 곳이었네요. 줄눈전갱이와 붕장어 2인 65,000원에 배터지게 먹고 왔습니다. 오늘은 붕장어의 기름이 한껏 올라 아주 만족스러운 식사할 수 있었습니다. 서비스로 나오는 산낙지도 맛있게 드셔보시죠."
18799565,바다회사랑생선회,회,,,"연남동에 위치한 ""바다회사랑"" 본점 다녀왔습니다. 드디어 또 방어철이 돌아왔네요. 저의 또간집 입니다. 본점과 2호점 두곳 다 가봤는데 맛은 어디가 좋다 얘기하기엔 별차이가 없습니다. 둘다 맛나요~ 2호점이 넓고 테이블이 많아서 그나마 웨이팅이 덜합니다. 물론 덜해도 굉장하쥬 ㅠㅠ 본점에 있으면 셔틀차량으로 2호점까지 모셔다드리기도해요~ 2호점이 웨이팅 없을경우만요~ 2호점은 모두의 주차에서 검색하면 주차장이 있었는데 없어졌네요. 주차 힘들어서 저는 평일낮 본점으로 갔어요. 바로 앞에 유료주차장있습니다. 평일낮도 웨이팅 있어요~ 저는 중짜리 주문하고 둘이가서 배터지게 먹었고요 산낙지 서비스에요~^^ 마무리로 해물라면은 필수요~ㅋ 올해도 역시두툼하고 맛납니다. 방어회 하면 바다회사랑 완전 강추입니다~^^"
18799565,바다회사랑생선회,회,,,올해는 포장이긴 하지만 30분 기다려서 포장으로라도 먹어 봤습니다♥️ 왜 대방어대방어 하는지 알 것 같았습니다 짱 맛있고 짱 도톰하고 이것저것 알차게 챙겨주셔서 너무 행복한 시간이었습니다
18799565,바다회사랑생선회,회,,,요기요기 갈 때마다 진짜 좋아하는 곳... 바다회사랑 ! 회가 너무 신선하고 맛있어요 >.< 이모들도 친절했어요! 회 구성을 알아서 고를 수 있어서 더욱 좋지요
18799565,바다회사랑생선회,회,,,웨이팅이 엄청나다는 리뷰들에 포장으로 사서 먹었는데 방어 한입에 와 소리 나옵니다
18799565,바다회사랑생선회,회,,,"작년 겨울에 2호점에서 방어 진짜 맛있게 먹었는데 한겨울에 2시간 웨이팅이 넘 힘들었어서 올해는 철 지나고 본점으로 방문했고 20분 기다렸다 들어갔어요! 확실히 철에 먹는 게 훨씬 기름지고 맛있긴 한데 그래도 신선하고 두껍게 썰어주는 바다회사랑 표 회가 넘 좋아요 .. 스끼다시도 잘 나오고 술자리 1,2차 둘 다 추천합니다!"
18799565,바다회사랑생선회,회,,,저녁에 방문예약 없이 이용대기 시간 30분 이내나들이친구
18799565,바다회사랑생선회,회,,,저녁에 방문예약 없이 이용대기 시간 30분 이내친목친구
18799565,바다회사랑생선회,회,,,저녁에 방문예약 없이 이용대기 시간 바로 입장데이트연인・배우자
18799565,바다회사랑생선회,회,,,저녁에 방문예약 없이 이용대기 시간 바로 입장데이트연인・배우자
18799565,바다회사랑생선회,회,,,저녁에 방문예약 없이 이용대기 시간 바로 입장일상혼자
18799565,바다회사랑생선회,회,,,저녁에 방문예약 없이 이용대기 시간 바로 입장친목친구
18799565,바다회사랑생선회,회,,,저녁에 방문포장·배달 이용대기 시간 30분 이내데이트연인・배우자
18799565,바다회사랑생선회,회,,,"점심에 방문예약 없이 이용대기 시간 30분 이내일상연인・배우자, 친구"
18799565,바다회사랑생선회,회,,,크리스마스 당일이라 직접 가게 안에사 먹는거는 꿈도 못꾸고 웨이팅 했는데도 한시간은 최소 기다려야 했습니다.
18799565,바다회사랑생선회,회,,,포장 한시간대기라길래 진짜 대긴가? 했는데 진짜 한시감이네요! ㅋㅋ 평일에만 와서 잘 몰랐다가 주말에 처음와서 인기를 실감했습니다 ㅋㅋ 싸먹을거 많이 챙겨주시고 방어회 두툼하니 맛있었어요!
18799565,바다회사랑생선회,회,,,횟감이 신선하고 무엇보다 한 점 한 점의 두께가 상당해서 씹는 맛이 좋아요. 방어 철이 지나고 방문해서 기름기가 덜 한점은 아쉬웠지만 올 겨울에 다시 방문하고 싶습니다.
18383378,서룡중식당,중식,,,"""상암동 최고 중식당 서룡!""이라는 말씀처럼, 등심찹쌀탕수육을 비롯해, 언제나 최상의 맛과 품질을 유지하기 위해 신선한 재료 선택부터 주문 즉시 조리하는 라이브 요리 시스템까지, 전 직원이 함께 심혈을 기울이고 있습니다. 앞으로도 저희는 지금처럼 변치 않는 맛과 서비스로 보답 드리기위해 신경쓰겠습니다.👏👏"
18383378,서룡중식당,중식,,,10년째 저희 서룡을 찾아주신 찐단골 고객님이시라니 정말 감동입니다🤩 저희 서룡을 너무 잘 알고 계시네요^^ 어향표고새우와 된장짜장을 맛있게 드셔주셨다니 정말 기쁩니다🥰 특히 된장짜장은 어르신들과 아이들까지 남녀노소 모두의 입맛에도 잘 맞아 가족단위 고객분들께서 많이 찾아주시는 특별한 메뉴이자 인기 메뉴인데요~ 앞으로도 맛있게 드리기위해 최선을 다하겠습니다.👏👏
18383378,서룡중식당,중식,,,17년 동안 이어온 자부심으로 주문 즉시 조리되는 LIVE 요리 시스템과 건강한 중식을 위한 3LOW 철학으로 언제나 신선하고 자극적이지 않으며 따뜻한 요리를 드리고자 항상 노력하고 있습니다.🙏
18383378,서룡중식당,중식,,,"DYNO3 고객님께서 지인분들과의 모임 후소중한 주말에 저희 서룡을 방문해주셨군요~정말 감사합니다.🙇🙇 저희 서룡은 주말에도 가족모임, 돌잔치, 백일잔치, 생일모임, 동호회 모임 등으로 많은분들께 방문해 주십니다.😁😁"
18383378,서룡중식당,중식,,,"가족 행사에 어울리는 넓고 깔끔한 공간과 최상의 서비스를 제공해드리고자 늘 노력하고 있는데, 이렇게 좋게 평가해주시니 뿌듯함을 느낍니다. 또한 주문하신 전가복, 등심찹쌀탕수육, 크림새우, 해물누룽지탕, 서룡짜장, 서룡짬뽕 등 저희 요리를 모두 맛있게 드셨다니 정말정말 기쁩니다!🥰🥰"
18383378,서룡중식당,중식,,,"가족분들과 함께 방문하셔서 넉넉한 식사 하셨다니 정말 기쁩니다.🥰 특히 서룡만의 특별한 메뉴인 된장짜장과 된장짬뽕을 맛있게 즐겨주셨다니 더할 나위 없이 행복합니다. 은은한 된장의 맛이 면발과 국물과 부드럽게 어우러져 남녀노소 부담없이 즐기실 수 있게 개발한 메뉴인데, 이렇게 긍정적인 말씀을 주시니 보람찹니다.🥰"
18383378,서룡중식당,중식,,,"국내산 생등심 살코기만을 남겨 손질하고 비법숙성한 등심탕수육은 바삭, 담백, 스윗해서 어른 뿐만 아니라 아이들에게도 인기 만점인 메뉴로 아이들이 맛있게 먹는 모습으로 많은 부모님들께서 특히 만족하시는 메뉴입니다🤗🤭"
18383378,서룡중식당,중식,,,"더욱이 등심찹쌀탕수육과 된장짜장, 서룡냉면을 주문해주시고 모든 메뉴를 맛있게 드셔주셨다니 정말 기쁩니다 🥰 특히나 된장짜장은 서룡만의 특별한 메뉴로, 그 맛을 알아봐주시고 추천까지 해주시니 그간의 노력에 자부심과 뿌듯함을 느낍니다.✨️"
18383378,서룡중식당,중식,,,"더욱이 음식에서도 만족감을 느끼셨다니 뿌듯함을 느낍니다. 탕수육은 국내산 돼지고기 생고기 등심 살코기만을, 매일 비법 숙성하여 사용해 부드럽고 잡내가 없어 많이 좋아해 주시는 인기 메뉴인데, 맛있게 드셔주셔서 감사합니다. 멘보샤 역시 빵 사이에 다진 새우살을 듬뿍 채워 담백하고 고소한 맛을 즐기실 수 있는데, 느끼함 없이 제대로 된 맛을 느껴주신 것 같아 기쁩니다.👏👏"
18383378,서룡중식당,중식,,,두툼한 고기 쫄깃한 탕수육 피의 등심탕수육과 신선한 해물과 채소가 듬뿍 들어간 서룡짬뽕을 맛있게 드셔주셨다니 정말 기쁩니다.🤗
18383378,서룡중식당,중식,,,등심탕수욱 꼭 드세요. 평소에 먹는 고기랑 급이 달라요. 힘줄같이 걸리는거 없이 역대급! 누룽지탕이랑 된장짬뽕밥 먹었는데 부모님 나이 대에 딱입니다. 보통 중식하면 기름지고 소화안된다고 생각하시는데 너무 좋아하셨어요. 단체로 앉을 넓은 공간이 많아서 모임이나 회식 장소 추천합니다! 상암 근처라 연예인들도 많이 온대요~
18383378,서룡중식당,중식,,,"또한 약 100평의 넓은 공간과 6.1m 통창의 시원한 인테리어로 고급스러운 분위기를 갖추고 있어 상견례, 가족 모임, 직장인 회식 등 각종 모임에도 최적화 되어있습니다.🤭"
18383378,서룡중식당,중식,,,"룸으로 예약하셔서 단체 모임 하시기 좋으셨다니 다행이에요. 말씀하신 양장피, 유산슬, 등심찹쌀탕수육, 어향표고새우 모두 저희 서룡의 인기 메뉴인데 입맛에 잘 맞으셨다니 정말 뿌듯합니다.😁 그 중에서도 특히 유산슬을 맛있게 드셨다니 기분이 좋구요~🥰"
18383378,서룡중식당,중식,,,"말씀하신 것처럼 블랙빈짜장면은 깔끔한 매운맛과 쫄깃한 면발이 일품이고, 짬뽕밥은 닭고기 육수 베이스에 푸짐한 해물과 신선한 야채에서 우러나는 시원한 국물 맛으로 많은 분들에게 사랑받고 있는 저희 서룡의 대표메뉴랍니다🥰 거기에 바삭한 등심탕수육까지 함께 맛있게 즐기셨다니 정말 최고의 조합으로 즐기신것 같습니다.👏👏"
18383378,서룡중식당,중식,,,말씀하신 것처럼 저희 서룡에서는 건강한 중식을 위해 msg사용을 최소화하고 있으며 특히나 모든 요리는 깨끗한 기름을 사용하여 주문하실때마다 바로바로 조리하고 있습니다.🤗
18383378,서룡중식당,중식,,,"말씀하신 것처럼 저희 서룡에서는 라이브요리를 통한 가치있는 중화요리로, 차별화된 맛과 퀄리티를 느끼실 수 있도록 최선을 다하고 있습니다. 또한 넓고 쾌적한 공간에서 각종 모임을 가지기에 손색이 없도록 준비하고 있구요~🤗"
18383378,서룡중식당,중식,,,말씀하신 것처럼 저희 서룡에서는 주문 즉시 조리되는 LIVE 요리 시스템을 통해 바로바로 조리한 신선하고 따뜻한 요리를 제공해드리고 있습니다. 고객님께서 드셨던 등심찹쌀탕수육은 국내산 돼지고기 생등심을 살코기만을 남겨 비법 숙성하여 사용하고있습니다. 그리고 주문후 바로바로 튀겨내어 신선하면서도 바삭한 식감을 즐기실 수 있습니다.✨️
18383378,서룡중식당,중식,,,말씀하신 것처럼 저희 서룡은 자극적이지 않으면서도 건강한 중식을 드리기위해 최선을 다하고 있습니다. 따라서 재료의 신선함과 주문 즉시 조리하여 최고의 맛을 드리기위해 항상 노력하고 있습니다. 특히나 꽃문어짬뽕의 문어는 최상의 익힘 정도를 유지하기 위해 많은 신경을 쓰고 있는데 그 정성이 잘 전달된 것 같아 기쁩니다 🤗
18383378,서룡중식당,중식,,,"말씀하신 것처럼 저희 서룡은 주문 즉시 바로바로 조리하는 LIVE 요리 시스템으로 바로바로 조리하여 신선하고 따뜻한 요리를 제공해드리고 있습니다. 또한, 건강한 중식을 위해 3LOW 철학(LOW MSG, LOW Transfat, LOW Cholesterol)을 지켜 소금 및 인공조미료를 최소화하고 깨끗한 기름과 신선한 식재료를 사용하고 있어서 간이 세지 않고 자극적이지 않은 건강한 중식을 제공해드리기위해 노력하고 있습니다🤗"
18383378,서룡중식당,중식,,,"말씀하신대로 저희 서룡은 주문 즉시 조리하는 ""LIVE 요리 시스템""으로 바로바로 조리한 신선하고 따뜻한 요리를 제공하고 있으며, 특히나 된장짜장이나 된장짬뽕처럼 다른 곳에서는 쉽게 접하기 힘든 독특하면서도 맛있는 메뉴들도 많이 준비되어 있어 한번 방문해주신 고객님들께서 계속해서 다시 찾아주고 계십니다👏👏"
18383378,서룡중식당,중식,,,먼저 이렇게 오랜만에 다시 찾아 주시고 즐거운 식사시간 되신 것 같아 정말 기쁩니다👏👏 아이들의 짜장도 고객님의 짬뽕도 좋으셨다는 말씀이 무엇보다도 의미있게 다가옵니다🙇🙇
18383378,서룡중식당,중식,,,"모든 음식을 주문 즉시 조리하여 신선하고 따뜻하게 제공해드리는 것이 서룡의 원칙인데, 그 원칙이 잘 전달된것 같아 뿌듯함을 느낍니다.🤗 또한 직원들의 친절한 서비스에도 만족하셨다니 사장인 저역시 더할 나위없이 기쁩니다🙏🏻🙏"
18383378,서룡중식당,중식,,,"무엇보다 모든 음식을 만족스럽게 드셨다니 사장인 제게도 완벽 그 자체인 칭찬이라서 정말 기쁩니다.🥰🥰 특히 등심탕수육의 바삭함, 유린기의 새콤달콤함, 된장짜장의 슴슴함, 된장짬뽕의 깔끔한 국물맛을 극찬해주시니 저희 서룡이 지향하는 모든 장점들이 전달된것 같아 이또한 감사한 마음입니다.💕💕"
18383378,서룡중식당,중식,,,무엇보다 아버님께서 꽃문어짬뽕을 맛있게 드시고 가족분들께서 특히 유린기와 다른 메뉴들도 맛있게 즐겨주셨다니 사장인 저역시도 정말 즐겁습니다🥰 서룡에서의 시간과 여러 경험들이 즐겁고 행복한 추억이 되신것 같아 행복하네요👨‍👩‍👧‍👦
18383378,서룡중식당,중식,,,"상암 터줏대감 맛집 서룡 중식당 방문했어요. 회사 근처라 선배들이 맛있다고 항상 얘기해줘서 가야지 가야지 하다가 드디어 찾아갔는데 와 진짜 너무 맛있네요!! 충격적으로 맛있어서 2명이서 갔는데 엄청 추가주문하면서 먹고 남은거 포장해갔어요.. 양장피 이렇게 맛있는곳 처음이고, 탕수육은 진짜 고기 리얼 부드럽고 겉 피도 엄청 쫀득했어요ㅠㅠ 그리고 특별한 메뉴가 있더라구요 된장짜장!! 여기가 원조래요 아니 직원분들이 다 너무 친절하셔서 엄청 자세히 설명해주셨어요.. 거기에 냉면 먹는데 중화권 냉면 향이 짱이었음 와 서룡 오려고 상암 다시 들리고 싶어요"
18383378,서룡중식당,중식,,,"상암동 서룡에서 가족들이랑 간소새우, 등심탕수육, 잡채밥, 서룡짬뽕을 먹었는데 다 같이 만족했어요. 짬뽕은 국물이 시원하고 깊었고, 등심탕수육은 바삭하면서도 쫄깃하고 고기가 두툼해서 좋았어요. 간소새우도 달달하니 맛있고 잡채밥은 고슬고슬한 밥에 소스가 잘 어울렸습니다. 납작당면으로 만든 잡채여서 독특했습니다. 전체적으로 깔끔하면서도 푸짐해서 가족 모임하기 좋은 중식당 같아요. 추천드립니다!"
18383378,서룡중식당,중식,,,"상암동에서 오랫동안 운영되어 온 만큼 믿고 찾을 수 있는 중식당이었어요. 가족모임으로 방문했는데 분위기도 차분하고 편안해서 대화하기 좋았습니다. 어향표고새우는 버섯과 새우가 조화롭게 어우러져 깊은 풍미가 느껴졌고, 문어짬뽕은 신선한 해산물이 가득 들어 있어 국물 맛이 시원하고 깔끔했습니다. 특히 블랙빈짜장은 일반 짜장과 달리 풍미가 고급스럽고 감칠맛이 진해 온 가족이 모두 만족했어요. 음식뿐만 아니라 직원분들의 친절한 서비스까지 더해져 기분 좋은 시간을 보낼 수 있었고, 다음에도 가족이나 지인 모임 장소로 다시 찾고 싶은 곳입니다."
18383378,서룡중식당,중식,,,"아이들과 함께 하는 식사라 더욱 신경 쓰이셨을 텐데, 짜장과 짬뽕, 유산슬밥 그리고 등심탕수육까지 맛있게 드셔주셨다니 정말 기쁩니다!🥰 우리 둘째가 맛나게 즐거운 시간이었기를 바래봅니다🙏"
18383378,서룡중식당,중식,,,앞으로도 더욱 꾸준히 노력하여 기대에 부응하는 맛과 서비스를 선사할 수 있도록 최선을 다하겠습니다. 다시 한번 저희 서룡에서의 추억을 되새겨주셔서 감사드립니다. 선생님과 동료분들과 특히나 웃음도도리표님의 일상에 늘 기쁨과 행운이 가득하길 기원하겠습니다🙏🙏
18383378,서룡중식당,중식,,,앞으로도 저희 임직원은 지금처럼 따뜻하고 맛있고 건강한 중식을 준비해 드리기 위해 항상 최선을 다하겠습니다. 다시한번 귀한시간 내셔서 방문해 주심에 감사드립니다. 항상 건강하고 즐거운 날들 되시길 기원하겠습니다.🙏🙏
18383378,서룡중식당,중식,,,"양장피, 등심찹쌀탕수육, 동파육, 깐풍기, 서룡짜장과 서룡핵짬뽕까지 다양한 요리를 주문하셨네요~넓고 쾌적한 매장 환경과 친절한 서비스로 고객님을 맞이하고자 늘 노력하고 있는데, 그 부분을 알아봐주시고 칭찬해주시니 뿌듯함을 느낍니다 😊 그리고 주문하신 여러 음식 중에서도 저희 서룡 인기메뉴 중 하나인 양장피를 특히 맛있게 드셨다니 또한 기쁩니다!"
