가게ID,가게명,업종,평점,날짜,리뷰내용
37112587,"동경암우동,소바",일식,,,마포구 최애 맛집입니다~ 사장님도 친절하시고 식후 제공되는 오렌지까지 완벽하네요!
37112587,"동경암우동,소바",일식,,,맛이 깔끔해요. 친절한 사장님 고맙습니다.
37112587,"동경암우동,소바",일식,,,모밀도 맛있고 새우튀김도 맛있네요. 후식으로 주신 자몽도 잘먹었습니다^^
37112587,"동경암우동,소바",일식,,,뭐랄까 집에서 만든 것 같은 맛? 세련되지는 않고 푸근하고 따뜻한 느낌의 음식입니다. 점심시간엔 자리가 없네요. 친절하시고 좋아요~
37112587,"동경암우동,소바",일식,,,밤에 방문예약 없이 이용대기 시간 바로 입장일상친척・형제
37112587,"동경암우동,소바",일식,,,양도 많고 주방장님과 홀매니저님이 항상 친절하십니다. 식전에 나오는 계란찜이 맛나요 ㅎ
37112587,"동경암우동,소바",일식,,,"우동세트 먹었습니다. 제가 원래 우동은 별로 안좋아하는데 이 집 우동은 면이 탱글탱글해서 깜짝 놀랐어요. 면도 맛있고, 오뎅도 일반적인 우동보다 탱글하고 살이 많아서 맛있더라구요."
37112587,"동경암우동,소바",일식,,,우동세트 최고입니다! 면도 쫄깃하고 국물도맛있어요! 같이나오는 알밥은 김치넣어 비벼먹는걸 추천!
37112587,"동경암우동,소바",일식,,,음식이 맛있고 너무 친절하셔서 재방문하고싶을정도로 좋았습니다.
37112587,"동경암우동,소바",일식,,,"이번에는 우동을 주문해보았는데, 뭔가 추억이 생각나는 맛이에요! 자극적이지 않고, 면도 부들부들하고, 오뎅은 특별하게 맛있고, 쑥갓이랑 파랑 같이 들어가서, 집에서 따뜻하게 만들어준 느낌이에요!"
37112587,"동경암우동,소바",일식,,,일본가정식 카레는 자극적이지 않고 담백해서 좋았어요 ㅎ
37112587,"동경암우동,소바",일식,,,저녁에 방문예약 없이 이용대기 시간 바로 입장일상혼자
37112587,"동경암우동,소바",일식,,,저의 최애 맛집 동경암 재재재방문입니다 사장님도 친절하시고 식후 챙겨주시는 과일은 매번 감동이네요
37112587,"동경암우동,소바",일식,,,점심 간단히 해결하다가 임신하고 든든하게 먹고 싶어서 여기저기 찾아다니며 먹는 중인데 만족해서 앞으로도 종종 올거에용🫶
37112587,"동경암우동,소바",일식,,,점심에 방문예약 없이 이용대기 시간 10분 이내 일상지인・동료
37112587,"동경암우동,소바",일식,,,점심에 방문예약 없이 이용대기 시간 10분 이내 친목친구
37112587,"동경암우동,소바",일식,,,점심에 방문예약 없이 이용대기 시간 바로 입장데이트연인・배우자
37112587,"동경암우동,소바",일식,,,점심에 방문예약 없이 이용대기 시간 바로 입장일상기타
37112587,"동경암우동,소바",일식,,,점심에 방문예약 없이 이용대기 시간 바로 입장일상기타
37112587,"동경암우동,소바",일식,,,점심에 방문예약 없이 이용대기 시간 바로 입장일상연인・배우자
37112587,"동경암우동,소바",일식,,,점심에 방문예약 없이 이용대기 시간 바로 입장일상지인・동료
37112587,"동경암우동,소바",일식,,,점심에 방문예약 없이 이용대기 시간 바로 입장일상지인・동료
37112587,"동경암우동,소바",일식,,,점심에 방문예약 없이 이용대기 시간 바로 입장일상지인・동료
37112587,"동경암우동,소바",일식,,,점심에 방문예약 없이 이용대기 시간 바로 입장일상지인・동료
37112587,"동경암우동,소바",일식,,,점심에 방문예약 없이 이용대기 시간 바로 입장일상지인・동료
37112587,"동경암우동,소바",일식,,,점심에 방문예약 없이 이용대기 시간 바로 입장일상지인・동료
37112587,"동경암우동,소바",일식,,,점심에 방문예약 없이 이용대기 시간 바로 입장일상지인・동료
37112587,"동경암우동,소바",일식,,,점심에 방문예약 없이 이용대기 시간 바로 입장일상혼자
37112587,"동경암우동,소바",일식,,,점심에 방문예약 없이 이용대기 시간 바로 입장일상혼자
37112587,"동경암우동,소바",일식,,,점심에 방문예약 없이 이용대기 시간 바로 입장일상혼자
37112587,"동경암우동,소바",일식,,,점심에 방문예약 없이 이용대기 시간 바로 입장일상혼자
37112587,"동경암우동,소바",일식,,,점심에 방문예약 없이 이용대기 시간 바로 입장일상혼자
37112587,"동경암우동,소바",일식,,,점심에 방문예약 없이 이용대기 시간 바로 입장일상혼자
37112587,"동경암우동,소바",일식,,,점심에 방문예약 없이 이용대기 시간 바로 입장일상혼자
37112587,"동경암우동,소바",일식,,,점심에 방문예약 없이 이용대기 시간 바로 입장일상혼자
37112587,"동경암우동,소바",일식,,,점심에 방문예약 없이 이용대기 시간 바로 입장일상혼자
37112587,"동경암우동,소바",일식,,,점심에 방문예약 없이 이용대기 시간 바로 입장일상혼자
37112587,"동경암우동,소바",일식,,,점심에 방문예약 없이 이용대기 시간 바로 입장친목지인・동료
37112587,"동경암우동,소바",일식,,,최애 맛집입니다 후식으로 챙겨주시는 과일도 달고 맛있어요!
1499118397,또보겠지떡볶이집 스마일보이점,분식,,,감자튀김이 정말 맛있어요. 매장이 넓진 않지만 아늑하고 인테리어가 예뻤어요. 웨이팅이 있었지만 춥지 않게 기다릴 수 있는 공간이 있어서 좋았어요.
1499118397,또보겠지떡볶이집 스마일보이점,분식,,,근처 공연보러 왔다가 들렀어요 딸이 소개해준 맛집입니다. 매장은 좁고 주말이라 좀 기다렸다 들어갔어요. 즉떡 먹고 싶었는데 맛있게 먹고갑니다^^ 진미채 날치알 볶음밥은 좀 달았어요. 진미채 때문인지~ 담엔 날치알만 넣을듯^^
1499118397,또보겠지떡볶이집 스마일보이점,분식,,,기대했던 버갈튀도 맛있었고 떡볶이 국물도 맛있어서 밥이랑 같이 먹으면 더 좋을 것 같아용 ‎꒰•ू꒪͒·̫̮꒪͒•ू꒱ 👍
1499118397,또보겠지떡볶이집 스마일보이점,분식,,,깔끔하고 편하게 접하는 즉석떡볶이는 또보겠지떡볶이 집이 원탑이라는 생각이 든다.
1499118397,또보겠지떡볶이집 스마일보이점,분식,,,다른 지점 먼저 갔었는데 줄이 너무 길길래 기겁 하고 바로 이쪽으로 이동 했습니다!
1499118397,또보겠지떡볶이집 스마일보이점,분식,,,다른지점은 영업시간이 짧아서 8시 이후에는 못먹는데 스마일보이점은 9시까지 라스트오더여서 넘 좋았어요 볶음밥이 지존마싯어요 또보겠지 떡볶이가 맞네용 또가고싶어요 ㅜ 지금도 생각남
1499118397,또보겠지떡볶이집 스마일보이점,분식,,,또보겠지 사랑해... 저의 또또또또간집인데요... 벌써 20번은 간 것 같아요...❤️ 홍대 갈 때마다 감 사실 성수점 강남점도 가봤어요 안 가본 곳이 없음 ㅜ 여기가 홍대 중 가장 늦게까지 하길래 가서 먹구 왔습니다. 항상 하는 말이지만 떡볶이 2인분+버터갈릭감자튀김+날치알치즈볶음밥 시켜 드십쇼.!
1499118397,또보겠지떡볶이집 스마일보이점,분식,,,또보겠지는 아마 단골이 많으시겠죠. 설명이 필요없는 즉석떡볶이 최강맛집.. 또먹고싶네요. 갈때마다 항상 잘 먹고 있습니다 맛있어요! 감사해요!
1499118397,또보겠지떡볶이집 스마일보이점,분식,,,리뷰 187사진 114팔로워 21테마 1
1499118397,또보겠지떡볶이집 스마일보이점,분식,,,맵찔이인 제 입엔 좀 맵지만 버갈감튀랑 먹으니 딱이었어요! 볶음밥 꼭 드세요ㅠㅠㅠ
1499118397,또보겠지떡볶이집 스마일보이점,분식,,,명불허전 깻잎 떡볶이와 버터갈릭감튀 그리고 마무리 날치알볶음밥(치즈토핑 추가) 까지 해서 두명이서 배터지게 먹었어요!😆
1499118397,또보겠지떡볶이집 스마일보이점,분식,,,버터갈릭감자튀김이 진짜 맛있으니까 꼭 드세요 볶음밥도요!
1499118397,또보겠지떡볶이집 스마일보이점,분식,,,"볶음밥 먹으러 가나?...줄서는 집으로 알고있어서 주말아침 인근 비누공방에서 수제비누만들기 수업을 끝내고 배가고파 오픈런으로 찾아간 곳. 테이블 다섯개 조그만 공간에 귀여운 캐릭터인형 가득 소녀소녀한 공간, 우리가 앉고 이십여분 후에 만석...포장도 해 가는 것이 보였고 주문즉시 거의바로 나왔다. 떡복기 2인분에 달걀,소세지,스팸 사리추가하고 버갈(버터갈릭 감튀) 주문, 버갈먹으러 간다는 후기 가 많아서 잔뜩 기대했는데 첫입에 우와.했다가 세개먹고 느끼... 내입맛은 아닌걸로. 아주잠깐 끓였는데 쫄면이 눌어붙어서 급히 불을 껐는데도 밀떡과 라면과 쫄면은 불어서 엉기기 시작했다. 아주얇게 슬라이스된 어묵이 잘 어울렸고 양념은 많이달지않고 칼칼한 편이었다. 날치알,진미채 볶음밥에 치즈추가 볶음밥이 최고였다."
1499118397,또보겠지떡볶이집 스마일보이점,분식,,,스마일보이점 왜이렇게 맛있죠..? 봉봉허니비가 제일이라고 생각했는데 스마일보이 이거 만만치않습니다? 진짜 대존맛이네요? 볶음밥은 연어알말고 소세지 넣어먹어보세요? 존@나 맛있으니까요 ㅋ
1499118397,또보겠지떡볶이집 스마일보이점,분식,,,오래전부터 단골인 집 외국인 지인들 데려오면 환장하고 먹음
1499118397,또보겠지떡볶이집 스마일보이점,분식,,,오랜만에 너무 먹고싶어서 처음으로 포장해왔어요! 집에 있는 재료 추가해서 넣어먹으니 더 편하고 좋네요. 종종 포장이용을 해봐야겠습니다*_*
1499118397,또보겠지떡볶이집 스마일보이점,분식,,,오랜만에 먹어도 역시나 맛있네요! 버터 갈릭 감자랑 볶음밥까지 최고입니다🖤
1499118397,또보겠지떡볶이집 스마일보이점,분식,,,저녁에 방문예약 없이 이용대기 시간 1시간 이상친목친구
1499118397,또보겠지떡볶이집 스마일보이점,분식,,,저녁에 방문예약 없이 이용대기 시간 30분 이내데이트연인・배우자
1499118397,또보겠지떡볶이집 스마일보이점,분식,,,저녁에 방문예약 없이 이용대기 시간 30분 이내일상친구
1499118397,또보겠지떡볶이집 스마일보이점,분식,,,저녁에 방문예약 없이 이용대기 시간 30분 이내친목친구
1499118397,또보겠지떡볶이집 스마일보이점,분식,,,저녁에 방문예약 없이 이용대기 시간 30분 이상데이트연인・배우자
1499118397,또보겠지떡볶이집 스마일보이점,분식,,,저녁에 방문예약 없이 이용대기 시간 바로 입장친목혼자
1499118397,또보겠지떡볶이집 스마일보이점,분식,,,저렴하지도 않고 매장이 넓지도 않아 대기해야 하지만.. 이곳만의 버터갈릭감튀와 즉떡이 있습니다. 즉떡+감튀 좋아하는 사람이라면 먹어볼 만한 가치가 있는 웨이팅이었다고 생각해요.
1499118397,또보겠지떡볶이집 스마일보이점,분식,,,점심에 방문대기 시간 30분 이상나들이친구
1499118397,또보겠지떡볶이집 스마일보이점,분식,,,점심에 방문예약 없이 이용대기 시간 10분 이내 일상친구
1499118397,또보겠지떡볶이집 스마일보이점,분식,,,점심에 방문예약 없이 이용대기 시간 1시간 이상친목친구
1499118397,또보겠지떡볶이집 스마일보이점,분식,,,점심에 방문예약 없이 이용대기 시간 30분 이내친목지인・동료
1499118397,또보겠지떡볶이집 스마일보이점,분식,,,점심에 방문예약 없이 이용대기 시간 30분 이내친목친구
1499118397,또보겠지떡볶이집 스마일보이점,분식,,,점심에 방문예약 없이 이용대기 시간 바로 입장
1499118397,또보겠지떡볶이집 스마일보이점,분식,,,점심에 방문예약 없이 이용대기 시간 바로 입장나들이친구
1499118397,또보겠지떡볶이집 스마일보이점,분식,,,점심에 방문예약 없이 이용대기 시간 바로 입장데이트
1499118397,또보겠지떡볶이집 스마일보이점,분식,,,"점심에 방문예약 없이 이용대기 시간 바로 입장데이트, 일상연인・배우자"
1499118397,또보겠지떡볶이집 스마일보이점,분식,,,점심에 방문예약 없이 이용대기 시간 바로 입장여행친구
1499118397,또보겠지떡볶이집 스마일보이점,분식,,,점심에 방문예약 없이 이용대기 시간 바로 입장친목지인・동료
1499118397,또보겠지떡볶이집 스마일보이점,분식,,,점심에 방문예약 없이 이용대기 시간 바로 입장친목지인・동료
1499118397,또보겠지떡볶이집 스마일보이점,분식,,,점심에 방문예약 없이 이용대기 시간 바로 입장친목친구
1499118397,또보겠지떡볶이집 스마일보이점,분식,,,점심에 방문예약 후 이용대기 시간 1시간 이상일상친구
1499118397,또보겠지떡볶이집 스마일보이점,분식,,,점심에 방문포장·배달 이용대기 시간 바로 입장일상연인・배우자
1499118397,또보겠지떡볶이집 스마일보이점,분식,,,정말 특색있는 즉떡 맛집이에요!!! 떡볶이 + 버갈감튀 + 볶음밥 코스로 꼭 드셔주세요. 그리고 아이들과 같이 먹기 좋습니다 (웨이팅만 좀 줄었으면 좋겠지만 ㅠㅠ). 사장님 종업원 분들 모두 친절하셨습니다!
1499118397,또보겠지떡볶이집 스마일보이점,분식,,,즉떡 사리로 숙주가 있는게 특이했어요 야채도 추가해서 더 맛있게 먹었습니다 현장에서는 웨이팅도 있더라고요 나중에는 가서 먹어볼게요
1499118397,또보겠지떡볶이집 스마일보이점,분식,,,친구 추천으로 왔는데 메뉴도 다 맛있고 감튀도 달달한데 갈릭소스 최고 어울리고 마지막에 떡볶이 국물에 볶음밥 해먹는거 진짜 최고였습니다.
1499118397,또보겠지떡볶이집 스마일보이점,분식,,,친구랑 일요일에 12:30분 즈음에 갔는데 다행히 웨이팅 없이 들어갔고 저희 다음부터는 웨이팅이 있었어요. 양 적당하고 맛은 적당히 매콤한 떡볶이에요. 사리 특별히 추가 하지 않고 기본으로 먹었는데도 푸짐했어요. 감자튀김도 시켰는데 덕분에 매운 떡볶이가 중화되서 더 맛있게 느껴졌습니다. 마지막으로 볶음밥!! 치즈 넣은 날치알 볶음밥 꼭 드세요!!!
1499118397,또보겠지떡볶이집 스마일보이점,분식,,,테이크아웃을 처음 해보게 되었는데 정말 만족 스럽네요! 매번 여기 와서 웨이팅을 했는데 이번에 2인 14000원 행복..! 여기 오신다면 포장도 추천
1499118397,또보겠지떡볶이집 스마일보이점,분식,,,포장 후 집을 도착하니 슬프게도 감자튀김이 눅눅해지는 건 막지 못했지만…
1499118397,또보겠지떡볶이집 스마일보이점,분식,,,"허겁지겁 먹어서 떡볶이 사진은 없고,, 매장 안에 있는 나무늘보 사진만 남았지만"
1499118397,또보겠지떡볶이집 스마일보이점,분식,,,홍대 떡볶이 맛집 또보겠지떡볶이집 ♥ 연령대 상관 없이 누구나 애정하는 맛집이에요
35523842,바다회사랑2호점생선회,회,,,겨울에 대방어 먹으러만 와봤는데 .. 계절 제철 생선 먹으러 오기도 너무 충분한 곳이었네요 신선하고 양도 많고 맛도 있도 모든게 풍족했습니다 특히 겨울철 대방어 시즌애 웨이팅이 극악무도하는데 지금 시즌에는 없어서 더 좋았어요
35523842,바다회사랑2호점생선회,회,,,겨울에 대방어 먹으러만 와봤는데 .. 계절 제철 생선 먹으러 오기도 너무 충분한 곳이었네요 신선하고 양도 많고 맛도 있도 모든게 풍족했습니다 특히 겨울철 대방어 시즌애 웨이팅이 극악무도하는데 지금 시즌에는 없어서 더 좋았어요
35523842,바다회사랑2호점생선회,회,,,"겨울에 방어 먹으려고 웨이팅 3시간 했을때는 그정도 맛 아니라고 생각했었는데 숙소 근처라 가서 모듬회 먹으니까 개맛있음 도라이,,,,,"
35523842,바다회사랑2호점생선회,회,,,"겨울에 방어 먹으려고 웨이팅 3시간 했을때는 그정도 맛 아니라고 생각했었는데 숙소 근처라 가서 모듬회 먹으니까 개맛있음 도라이,,,,,"
35523842,바다회사랑2호점생선회,회,,,그리고 남자친구가 '살면서 먹은 회 중 가장 맛있다'고 하면서 1시간 웨이팅이 후회되지 않는다고ㅋㅋ 데려가는 사람들마다 방어의 패러다임을 바꿨다 함ㅋ 나도 뭔가 작년보다 더 맛있게 먹은 것 같은 너낌😋
35523842,바다회사랑2호점생선회,회,,,"그리고 밑반찬이 잘 나와요 백김치, 김, 초밥, 생선까스, 콘샐러드, 새우, 메추리알 등등 근데 백김치 추가는 천원인게 약간 놀랐음ㅎ,, 매운탕 라면사리 넣으니 맛있음"
35523842,바다회사랑2호점생선회,회,,,"그리고 밑반찬이 잘 나와요 백김치, 김, 초밥, 생선까스, 콘샐러드, 새우, 메추리알 등등 근데 백김치 추가는 천원인게 약간 놀랐음ㅎ,, 매운탕 라면사리 넣으니 맛있음"
35523842,바다회사랑2호점생선회,회,,,그만큼 대기시간이 어마어마 했던 것이 아쉽지만.. 그래도 기다렸다 먹을 수 있을 만큼 맛있다며....
35523842,바다회사랑2호점생선회,회,,,근래 방문한 활어회집중에 가장 돈 아깝지않았고
35523842,바다회사랑2호점생선회,회,,,금요일 저녁7시에 왔는데 한 10분 기다리고 입장했습니다. 예전처럼 사람이 많지 않은지 덕분에 첫 방문 어렵지 않게 성공했습니다. 일단 방어는 맛있는데 다른 가게보다 맛있는지는 모르겠습니다. 회라는게 그런 음식인 것 같기도 합니다. 직원분은 친절하게 응대해 주셨는데 사실 아쉬운점은 백김치 리필 천 원 추가비용 받는것입니다. 김도 추가 비용 받는것 같았고...좀 아쉬운 부분입니다. 웨이팅 없으면 재방문 의사 있지만 웨이팅 해서 갈 정도는 아니긴 합니다. 맛있게 잘 먹었습니다.
35523842,바다회사랑2호점생선회,회,,,남자친구가 유명한 맛집이래서 가보자해서 방문했는데 이른 저녁시간에도 손님이 많았고 한 자리 남은거 겟했어요 ㅋㅋ 줄전갱이 먹으로 갔다가 하필 품절이라 잿방어랑 광어 먹었는데 맛있게 잘 먹었습니다!
35523842,바다회사랑2호점생선회,회,,,다른 곳에 없는 특이한 회가 있다해서 갔는데 하아.. 요즘도 유명하다고 이렇게 장사하는 곳이 있군요
35523842,바다회사랑2호점생선회,회,,,다른 곳에 없는 특이한 회가 있다해서 갔는데 하아.. 요즘도 유명하다고 이렇게 장사하는 곳이 있군요
35523842,바다회사랑2호점생선회,회,,,"대방어 소자 69,000원, 매운탕에 라면사리 추가 ! 소주 이리저리 해서 둘이 101,000원치 묵었어예 (최고) 기름장은 요청하면 주시구요 배가 썩 안 고파서 소자먹었는데 잘 먹었습니다ㅎㅎ 웨이팅은 할만하고요(주변 카페 고고)밑반찬들도 야무지게 나와서 좋아요 테이블간격은 오징어게임 침대 간격이라 졸라 따닥붙어있고 개시끄럽지만 (옆건물 별관기준) 저희도 같이 시끄러워지면 됨! 또는 이게 싫으면 포장 추천드립니다! 거의 대방어 막차였는데 꼬들하기보다는 약간 입에서 사라지는 식감에 더 가까웠구요 !! 굿 ! 화장실도 깨끗한 편이고여 다들 라면 마니 드시던데 라면사리가 드시고 싶으신 거면 매운탕에 라면사리 추가 추천드립니다 죤맛 ~!"
35523842,바다회사랑2호점생선회,회,,,"리뷰 1,321사진 2,711팔로워 37"
35523842,바다회사랑2호점생선회,회,,,무엇보다 회가 비리지않고 두툼해서 회를 좋아하는 않는 나도 진짜 맛있게 먹었다!!!!
35523842,바다회사랑2호점생선회,회,,,"바다회사랑은 방어가 되게 부드러운 편이더라구요. 일단 방어 자체는 너무 너무 신선해요 ! 부드러워서 씹히기도 잘 씹히고 고소해서 좋았는데, 전 개인적으로 방어 특유의 아삭아삭한 식감을 더 좋아해서 쪼오금 아쉬웠어요. (제 방어 원픽은 다른 곳입니다 하하)"
35523842,바다회사랑2호점생선회,회,,,밤에 방문예약 없이 이용대기 시간 10분 이내 친목친구
35523842,바다회사랑2호점생선회,회,,,밤에 방문예약 없이 이용대기 시간 바로 입장일상혼자
35523842,바다회사랑2호점생선회,회,,,밤에 방문예약 없이 이용대기 시간 바로 입장친목지인・동료
35523842,바다회사랑2호점생선회,회,,,밤에 방문예약 없이 이용대기 시간 바로 입장친목지인・동료
35523842,바다회사랑2호점생선회,회,,,언제가도 퀄리티와 양에 만족하고 오는 곳. 유일하게 명절 당일에는 웨이팅 없이 대방어를 먹을 수 있어 매년 설마다 방문하고 있어요. 역시나 방어는 기름기 꽉 차 탱글하고 연어도 부드럽고 맛있었습니다🤍
35523842,바다회사랑2호점생선회,회,,,여기 엄청 맛집이라서 손님들 겁나 겁나 많은데 그 많은 손님들 중에서 저를 알아봐주시다니...
35523842,바다회사랑2호점생선회,회,,,"여긴 줄설 가치가 있는 곳 이에요 정말 키오스크생기면서 순환이 더 좋은 것 같기도 하고?! 연어머리구이는 정말 추천이요,, 술이 술술 또가고싶어요"
35523842,바다회사랑2호점생선회,회,,,여러가지 먹을수 있는 모듬도 좋았는데 오늘은 비가와서 그런지 서더리탕이 굿
35523842,바다회사랑2호점생선회,회,,,여름에는 줄전갱이 먹으러 갑니다!! 참돔도 쫄깃하니 맛있는데 줄전갱이 식감이 방어같아서 더 맛있어요!
35523842,바다회사랑2호점생선회,회,,,여름에는 줄전갱이 먹으러 갑니다!! 참돔도 쫄깃하니 맛있는데 줄전갱이 식감이 방어같아서 더 맛있어요!
35523842,바다회사랑2호점생선회,회,,,"워낙 유명한 식당이라, 평일 2시 30분에 오픈런 했습니다. 다 먹고 나올때 시간이 4시였는데 대기하시는분들이 엄청 많네요."
35523842,바다회사랑2호점생선회,회,,,웨이팅이 말해주듯이 정말 맛있습니다! 숙성도 잘 되어서 식감도 좋고 확실히 회전율이 좋아 더 신선한거 같고 두께도 너무 과하지않도록 썰어주셔서 방어의 기름기를 충분히 느끼도록 해주십니다
35523842,바다회사랑2호점생선회,회,,,이 집은 방어와 초밥밥만으로도 맛을 내는 곳이라 스끼다시가 덜 나와도 괜찮을 것 같아요.
35523842,바다회사랑2호점생선회,회,,,"일요일 5시쯤 도착해서 캐치테이블 웨이팅 등록했더니 앞에 50팀 정도 있었고, 거의 100min 정도 대기 한거 같아요!!"
35523842,바다회사랑2호점생선회,회,,,작년에 줄전갱이가 너무 맛있어서 이번에도 또 줄전갱이 먹으러 갔는데 작년에 없던 붕장어회가 있어서
35523842,바다회사랑2호점생선회,회,,,"잔멸치 섞여 있는 막장 드디어 먹어봄ㅎㅎㅎ잿방어와 붕장어 2인분에 모둠멍게 주문함. 사실 이 날에 서러운 일이 있었어서 혼자 맛있는 거 먹겠다 하고 갔는데, 다른 테이블은 여럿이 온 사람들 많았는데 1인 테이블인 내 자리까지 직원분들이 너무 친절하게 응대해 주시고 계속 살펴보며 모자란 거 없나 챙겨주시고 그래서 괜히 먹다 울 뻔했음. 맛있는 거 배 터지게 먹고 기분 잘 풀었음. 다음에 또 갈 것임."
35523842,바다회사랑2호점생선회,회,,,저녁에 방문예약 없이 이용대기 시간 바로 입장데이트연인・배우자
35523842,바다회사랑2호점생선회,회,,,저녁에 방문예약 없이 이용대기 시간 바로 입장데이트연인・배우자
35523842,바다회사랑2호점생선회,회,,,저녁에 방문예약 없이 이용대기 시간 바로 입장데이트연인・배우자
35523842,바다회사랑2호점생선회,회,,,저녁에 방문예약 없이 이용대기 시간 바로 입장데이트연인・배우자
35523842,바다회사랑2호점생선회,회,,,저녁에 방문예약 없이 이용대기 시간 바로 입장데이트연인・배우자
35523842,바다회사랑2호점생선회,회,,,저녁에 방문예약 없이 이용대기 시간 바로 입장일상혼자
35523842,바다회사랑2호점생선회,회,,,저녁에 방문예약 없이 이용대기 시간 바로 입장친목지인・동료
35523842,바다회사랑2호점생선회,회,,,저녁에 방문예약 없이 이용대기 시간 바로 입장친목친구
35523842,바다회사랑2호점생선회,회,,,저녁에 방문예약 없이 이용대기 시간 바로 입장친목친구
35523842,바다회사랑2호점생선회,회,,,저녁에 방문예약 없이 이용대기 시간 바로 입장친목친구
