가게ID,가게명,업종,평점,날짜,리뷰내용
37556305,경성양꼬치 연남직영점,중식,,,N번째 방문입니댜 연남동에서 여기만큼 양꼬치 맛있는곳이 없어용!! 직원분들도 친절하시고 오늘도 맛있게 먹고 갑니다 🤤😊
37556305,경성양꼬치 연남직영점,중식,,,고기질이 좋아요! 다른매장에 비해서 양이 많습니다! 같이 나오는 양배추도 좋아용
37556305,경성양꼬치 연남직영점,중식,,,길가다 양꼬치집이 보여서 우연히 들어왔는데 고기 질이 너무 좋아요!!! 그리고 찐맛집이에요...고기도 큼직하고 부드럽고 꼬지에서 너무 잘빠져요 :)
37556305,경성양꼬치 연남직영점,중식,,,너무 친절하게 계속 저희 테이블 신경써주시고.. 덕분에 편안하게 먹어요 ㅎㅎ❤️ 창가쪽에 앉아서 밖 풍경 보면서 먹으니까 너무너무 좋네요😆 감사합니다 사장님 더더욱 번창하세요!!
37556305,경성양꼬치 연남직영점,중식,,,도톰함 고기가 다른 양고기집과 차별점도 있고 맛있어요!! 온면도 맛있어서 다음에도 또 방문할것 같습니다
37556305,경성양꼬치 연남직영점,중식,,,두번째 방문이에여! 여기 양꼬치 두툼햐서 더 맛있는거같어요 추천합니당!!
37556305,경성양꼬치 연남직영점,중식,,,또 먹고싶어요 사장님도 직원분들도 친절하시고 아주 만족하면서 먹고왔어요 >_<
37556305,경성양꼬치 연남직영점,중식,,,마라꼬치 너무 맛있습니다!!! 덕분에 행복한 데이트 였습니다:) 연남에서 즐기는 양꼬치
37556305,경성양꼬치 연남직영점,중식,,,배고파서 직장 근처라 홀린듯 들어왔는데 고기가 은근 두툼한편이고 질이 좋아보여요!! 매장도 청결하고 냄새도 안나구 직원분도 친절하세요
37556305,경성양꼬치 연남직영점,중식,,,양갈비 양꼬치 질이 너무 좋고 부드럽고 맛있습니다! 연남에서 양꼬치 드실때 여기로 오시면 될거같아요!
37556305,경성양꼬치 연남직영점,중식,,,"양꼬치 맛집 찾아서 친구와 방문했어요. 양꼬치와 마라양꼬치 기본으로 맛있구~ 양갈비도 촉촉해요. 냄새 안나게 환기도 잘되구, 여기저기 체안점도 많은 듯~ 점점 양꼬치를 즐기게 될꺼 같아요! 직원분들도 엄청 친절하세요. 😄"
37556305,경성양꼬치 연남직영점,중식,,,양꼬치 전문가인 동료의 추천으로 왔는데 정말 대박입니다! 홍대에서 양꼬치 먹을거면 무조건 여기!
37556305,경성양꼬치 연남직영점,중식,,,양꼬치 퀄이 너무 좋아요🥹🥹💕 넘 맛있구.. 물만두 맛있다고 해서 물만두도 시켜봤는데 후회없는 선택이에용… 낮부터 술을 부르는 맛이네용 담에 홍대와서 양꼬치 먹을 일 있으면 여기로 또 올거같아요!!!! 존맛 🤤
37556305,경성양꼬치 연남직영점,중식,,,양꼬치를 제가 처음 먹어봤는데 너무 맛있어서 부모님 데려왔어요 두 번째는 냄새가 약간 나더라구요 저는 그 향도 나쁘지 않았는데 부모님은 힘들어하셔서 나오는 날마다 다르니 향에 민감하면 좀 힘들 것 같아요 매장은 처음에는 괜찮았는데 술 마시니 많이 더웠어요
37556305,경성양꼬치 연남직영점,중식,,,언제와도 너무 맛있습니다 양꼬치 퀄리티 진짜 양꼬치 집 중에서 원탑입니다 그리고 여기 사이드 다먹어봤는데 얼큰만두국이 최고입니다 맵찔이시면 좀 매울수도 그런데 청양고추매움이라 청양고추 단련되신분들은 괜찮을듯요 양꼬치에 제일잘어울리고 느끼한거 잘잡아줍니다
37556305,경성양꼬치 연남직영점,중식,,,연남 경성양꼬치 다녀왔는데 가게 분위기가 깔끔하고 모임하기 좋았습니다.
37556305,경성양꼬치 연남직영점,중식,,,"연남동에서 양꼬치 먹게 될 때 항상 오는 곳이에요. 양꼬치, 옥수수국수 다 너무 맛있어요. 고기 퀄리티가 좋아서 물리지 않고 자꾸 먹게 돼요!"
37556305,경성양꼬치 연남직영점,중식,,,연남동에서 양꼬치 먹고싶으면 찾는 곳이에요ㅎㅎ 신선하고 맛있어요~~!👍🏻👍🏻
37556305,경성양꼬치 연남직영점,중식,,,오랜만에 양꼬치 땡겨서 먹으러 왔는데 넘 맛있었습니다~! 통창도 열려서 시원하고 좌석도 편해서 좋았어요👍👍 직원도 친절하십니다!
37556305,경성양꼬치 연남직영점,중식,,,오랜만에 왔는데 역시 넘나 맛있는… 홍대에서 양꼬치는 진짜 여기가 젤 맛있어요😭 맨날 여기만 옴 마라갈비도 특색있구 맛있음 고기 잡내두 없구 중국에서 먹었던 양꼬치 다음으로 젤 퀄리티 있음🥹 제발 여기를 오세요… 맥주맛이 100배는 좋아집니다😻😭😻😭😻😭
37556305,경성양꼬치 연남직영점,중식,,,잡내도 적고 맛있어요!!! 온면도 가성비 좋고 양배추도 입가심하기 넘 좋네용❤️
37556305,경성양꼬치 연남직영점,중식,,,저녁에 방문예약 없이 이용대기 시간 바로 입장가족모임기타
37556305,경성양꼬치 연남직영점,중식,,,저녁에 방문예약 없이 이용대기 시간 바로 입장데이트연인・배우자
37556305,경성양꼬치 연남직영점,중식,,,저녁에 방문예약 없이 이용대기 시간 바로 입장데이트연인・배우자
37556305,경성양꼬치 연남직영점,중식,,,저녁에 방문예약 없이 이용대기 시간 바로 입장데이트연인・배우자
37556305,경성양꼬치 연남직영점,중식,,,저녁에 방문예약 없이 이용대기 시간 바로 입장데이트연인・배우자
37556305,경성양꼬치 연남직영점,중식,,,저녁에 방문예약 없이 이용대기 시간 바로 입장데이트연인・배우자
37556305,경성양꼬치 연남직영점,중식,,,저녁에 방문예약 없이 이용대기 시간 바로 입장데이트연인・배우자
37556305,경성양꼬치 연남직영점,중식,,,저녁에 방문예약 없이 이용대기 시간 바로 입장데이트연인・배우자
37556305,경성양꼬치 연남직영점,중식,,,저녁에 방문예약 없이 이용대기 시간 바로 입장데이트연인・배우자
37556305,경성양꼬치 연남직영점,중식,,,저녁에 방문예약 없이 이용대기 시간 바로 입장데이트연인・배우자
37556305,경성양꼬치 연남직영점,중식,,,"저녁에 방문예약 없이 이용대기 시간 바로 입장친목, 데이트연인・배우자, 친구"
37556305,경성양꼬치 연남직영점,중식,,,저녁에 방문예약 없이 이용대기 시간 바로 입장친목지인・동료
37556305,경성양꼬치 연남직영점,중식,,,저녁에 방문예약 없이 이용대기 시간 바로 입장친목친구
37556305,경성양꼬치 연남직영점,중식,,,저녁에 방문예약 없이 이용대기 시간 바로 입장친목친구
37556305,경성양꼬치 연남직영점,중식,,,저녁에 방문예약 없이 이용대기 시간 바로 입장친목친구
37556305,경성양꼬치 연남직영점,중식,,,저녁에 방문예약 없이 이용대기 시간 바로 입장친목친구
37556305,경성양꼬치 연남직영점,중식,,,저녁에 방문예약 후 이용대기 시간 바로 입장데이트연인・배우자
37556305,경성양꼬치 연남직영점,중식,,,저녁에 방문예약 후 이용대기 시간 바로 입장일상친구
37556305,경성양꼬치 연남직영점,중식,,,점심에 방문예약 없이 이용대기 시간 바로 입장데이트연인・배우자
37556305,경성양꼬치 연남직영점,중식,,,"점심에 방문예약 없이 이용대기 시간 바로 입장친목친구, 지인・동료"
37556305,경성양꼬치 연남직영점,중식,,,제가 먹어본 양꼬치중 가장 깔끔하고 맛있습니다!! 양꼬치가 잡내도 전혀 안나고 실한데다가 고기맛도 풍부하고 좋습니다. 손질에 노하우가 장난없는듯요 그리고 양꼬치 찍어먹는 가루가 다른곳과 다르게 훨씬 신선한 느낌이라해야하나 맛자체가 싸구려가 아니라 고급입니다. 밑반찬도 상태 최상이고요 매장도 완전깔끔하고 넓습니다. 위생에 좀 민감해서 양꼬치 잘안먹는데 여긴 진짜 탑티어입니다! 사장님이 관리너무 잘해주시고 맛도 리얼입니다!
37556305,경성양꼬치 연남직영점,중식,,,집앞 양꼬치집 찾다가 왔는데 다른 양꼬치집 보다 크기가 크네요~ 그램수로 꼬치 주니까 꼬치의 갯수가 많지는 않지만 양이 많으니 전 이게 더 좋네요~ 경의선숲길도 바로 보이고 매장도 넓고 좋아요 :)
37556305,경성양꼬치 연남직영점,중식,,,찾아보고 첫번째로 나오는곳으로 왔는데 유명한가봐룡 사람도 많고 친절합니당 ㅎㅎ
37556305,경성양꼬치 연남직영점,중식,,,처음 와봤는데 고기가 크고 맛있어요 직원분들도 다 친절하셔서 편하게 밥먹었습니다! 냉면도 시켜서 먹었는데 같이 먹으면 조합이 좋아요
37556305,경성양꼬치 연남직영점,중식,,,평소에 양꼬치 좋아하는데 정말 맛있었어요 👍👍👍 다음에 기회가 된다면 또 방문하고 싶어요
37556305,경성양꼬치 연남직영점,중식,,,항상 너무 맛있습니다 4번오는동안 한번도 실망한적 없습니다. 양꼬치 비싼곳도 여러군데 가봤지만 여기가 원탑 고기자체가 너무맛있고 가게청결이나 반찬의 깔끔함도 완벽합니다!
37556305,경성양꼬치 연남직영점,중식,,,홍대 양꼬치 찾아보다가 들어왔는데 고기 퀄 너무 좋아요 엉엉 잘 먹고 갑니다아 !!
37556305,경성양꼬치 연남직영점,중식,,,홍대앞 가볍게 2차로도 좋은 곳 입니다. 분위기도좋고 너무시끄럽지도않아 대화하기 좋습니다. 김포서 와서 즐거운경험 하고갑니다.
37556305,경성양꼬치 연남직영점,중식,,,"회사 앞에 있어서 와봤는데, 지금까지 회사 앞에 이런 식당이 있는 줄을 몰랐다니. 저는 인생 절반을 손해보았습니다. 양꼬치가 이렇게 두툼하고 야무진 음식이었다니. 재방문 의사 400% 입니다. 결혼하고 손주 볼 때까지 올게요."
1753800653,그동네떡볶이 연남점종합분식,분식,,,#연남동맛집 #홍대맛집 #떡볶이맛집 #그동네떡볶이
1753800653,그동네떡볶이 연남점종합분식,분식,,,그동네 떡볶이 너무 오랜만에 맛있게 먹었어요! 매장도 넓고 밝은 분위기라 좋습니다!!
1753800653,그동네떡볶이 연남점종합분식,분식,,,김밥은 쏘쏘이고 전에 먹어봤는데 닭안심 튀김? 그게 진짜 맛도리에요!!
1753800653,그동네떡볶이 연남점종합분식,분식,,,너무 좋아하는 그동네 떡볶이!!!! 시간 지나면 떡볶이 맛 생각나요ㅠㅡㅠ 갓 튀교나온 안심튀김도 너무 맛있고 명란마요ㅠ김밥 존맛탱
1753800653,그동네떡볶이 연남점종합분식,분식,,,떡볶이가 불향이 나고 맛있어요 꽤 매움 탕수육도 엄청 바삭하고 고기도 실하고 맛있어요 떡볶이소스랑 탕수육 잘어울려요!
1753800653,그동네떡볶이 연남점종합분식,분식,,,떡볶이집답게 떡볶이가 너무 맛있어요!! 탕수육 소스도 맛있었구요 그리고 인테리어가 아기자기하게 생겨서 분위기 좋았습니다! 사람이 많아서 일찍와서 다행이라고 생각하고 맛있게 먹고갑니당
1753800653,그동네떡볶이 연남점종합분식,분식,,,또또또또또또또온집 홍대 연남 오면 무조건 그동네 옵니다 ㅠㅠ 요즘 안온지 너무 오래돼서 그리웠는데 다 채워지는 맛이에여 ㅜㅜ 너무 맛있어요 오래 장사해주세요
1753800653,그동네떡볶이 연남점종합분식,분식,,,라면 양도 많고 위에 올라가있는 치즈 토핑이 고급스러운 맛을 더해주는 것 같습니다!!
1753800653,그동네떡볶이 연남점종합분식,분식,,,맛있어요!! 친구 추천으로 왓는데 새로운 떠볶이가 있네요 맛도리입니다. 튀김맛집인듯요
1753800653,그동네떡볶이 연남점종합분식,분식,,,메뉴도 은근 다양하니까 골라 먹는 재미가 있어요~
1753800653,그동네떡볶이 연남점종합분식,분식,,,"명란김밥은 짭짤하고 고소해서 사이드로 딱 좋았어요 🍣 치즈폭포떡볶이는 이름처럼 치즈가 흘러내려서 매콤한 떡볶이랑 같이 먹으니 꽤 중독적이더라구요. 찹쌀 탕수육은 겉바속쫀이라 씹는 재미가 있었고, 소스도 과하지 않아 깔끔하게 먹기 좋았어요 🥢 전체적으로 다 만족!"
1753800653,그동네떡볶이 연남점종합분식,분식,,,명란이 흉내만 낸 게 아니라 꽤 크게 들어있어서 만족스러웠고 떡볶이는 적당히 매콤하고 맵기도 고를 수 있어서 좋았어요!!! 재방문의사 있습니다!
1753800653,그동네떡볶이 연남점종합분식,분식,,,양에 비해 가격도 저렴하고 맛도 정말 맛있습니다 홍대 떡볶이 맛집 인정합니다
1753800653,그동네떡볶이 연남점종합분식,분식,,,연남동 나들이 왔다가 떡볶이 먹고싶어서 검색하다가 리뷰 넘 좋아서 왔어요!! 일단 연어들어간 김밥 넘 맛나서 명란마요 바로 추가했고.... 후라이드 튀김옷이 장난아님!! 파삭파삭 넘 굿>.< 떡볶이도 면에 영념이 삭 베어서 진짜 맛집이었음다..... 잘 먹고 또 올랍니다!
1753800653,그동네떡볶이 연남점종합분식,분식,,,연남동 떡볶이 맛집 그동네떡볶이 평소에 혼밥하러도 종종왔었는데 오늘은 연남동 데이트로 방문했어용 ! 치즈폭포떡볶이 진짜 왕강추 ♥️♥️♥️
1753800653,그동네떡볶이 연남점종합분식,분식,,,연남동 맛집으로 지인들한테 듣고 처음 와봤는데 마늘기름떡볶이 진짜 맛있어요…그냥 아는 빨간 떡볶이는 아니지만 다른분들 먹는거보니까 다음엔 빨간 떡볶이도 먹어보려구요!! 여기 진짜 진짜 미친 맛집이네요ㅠㅠㅜ 짬뽕도 꼭 같이 드셔보세요! 둘이와서 다양하게 먹어보질 못해서 아쉬울 뿐이에오ㅠㅠ다음에 또 와서 다른것도 먹어보려구여ㅎㅎ
1753800653,그동네떡볶이 연남점종합분식,분식,,,연남동맛집 검색해서 왔는데 진짜 너무 맛있어요! 떡볶이 말고도 김밥이랑 튀김도 바삭바삭 맛있어요!!! 연어김밥 꼭 먹어야되요 넘 맛남😆
1753800653,그동네떡볶이 연남점종합분식,분식,,,오랜만에 또 방문했는데 닭안심후라이드 메뉴가 생겨서 같이 곁들였는데 역시 맛있습니당!! 튀김옷도 적당하구 바로 튀겨주셔서 더 맛있게 느껴지네용~!!!
1753800653,그동네떡볶이 연남점종합분식,분식,,,오랜만에 먹었는데 넘넘 맛있어요❤️❤️ 항상 번창하세요!!!!! 떡 넘 쫄깃해용
1753800653,그동네떡볶이 연남점종합분식,분식,,,와 연남점에서는 마늘기름떡볶이는 처음이에요! 짭쪼롬하니 고소하구 넘 맥주가 엄청 땡기는 감칠 맛입니다 ㅜㅜㅜㅜ유부초밥도 넘넘 맛있네요 달달하니 오늘 처음 시킨 조합도 성공이에요! 잘 먹었습니다❤️
1753800653,그동네떡볶이 연남점종합분식,분식,,,우리동네 떡볶이 맛있어요~ 조금 매콤해서 아이는 콘치즈 추가해서~ 낮에 맥주한잔마시며 즐거운 식사했습니다.
1753800653,그동네떡볶이 연남점종합분식,분식,,,이거 먹으러 연남동 또 올거 같아요! 재방문 의사 10000000%입니다!!
1753800653,그동네떡볶이 연남점종합분식,분식,,,자주 오는 달골집인데 가격도 착하고 맛도 좋아서 2차로 맥주한잔 하기에도 완전 굿굿 김밥은 처음먹는데 넘나 맛도리네요
1753800653,그동네떡볶이 연남점종합분식,분식,,,저녁에 방문예약 없이 이용대기 시간 바로 입장나들이친구
1753800653,그동네떡볶이 연남점종합분식,분식,,,"저녁에 방문예약 없이 이용대기 시간 바로 입장데이트, 나들이, 여행, 일상연인・배우자, 친구, 아이"
1753800653,그동네떡볶이 연남점종합분식,분식,,,저녁에 방문예약 없이 이용대기 시간 바로 입장데이트연인・배우자
1753800653,그동네떡볶이 연남점종합분식,분식,,,저녁에 방문예약 없이 이용대기 시간 바로 입장데이트연인・배우자
1753800653,그동네떡볶이 연남점종합분식,분식,,,저녁에 방문예약 없이 이용대기 시간 바로 입장여행아이
1753800653,그동네떡볶이 연남점종합분식,분식,,,저녁에 방문예약 없이 이용대기 시간 바로 입장일상혼자
1753800653,그동네떡볶이 연남점종합분식,분식,,,저녁에 방문예약 없이 이용대기 시간 바로 입장친목친구
1753800653,그동네떡볶이 연남점종합분식,분식,,,저녁에 방문예약 없이 이용대기 시간 바로 입장친목친척・형제
1753800653,그동네떡볶이 연남점종합분식,분식,,,점심에 방문예약 없이 이용대기 시간 바로 입장나들이친척・형제
1753800653,그동네떡볶이 연남점종합분식,분식,,,"점심에 방문예약 없이 이용대기 시간 바로 입장데이트, 일상연인・배우자"
1753800653,그동네떡볶이 연남점종합분식,분식,,,점심에 방문예약 없이 이용대기 시간 바로 입장데이트연인・배우자
1753800653,그동네떡볶이 연남점종합분식,분식,,,점심에 방문예약 없이 이용대기 시간 바로 입장일상연인・배우자
1753800653,그동네떡볶이 연남점종합분식,분식,,,점심에 방문예약 없이 이용대기 시간 바로 입장일상지인・동료
1753800653,그동네떡볶이 연남점종합분식,분식,,,"점심에 방문예약 없이 이용대기 시간 바로 입장친목연인・배우자, 지인・동료"
1753800653,그동네떡볶이 연남점종합분식,분식,,,지금까지 분식집 중에 제일 맛있어요. 치킨 너무 바삭하고 라볶이는 김밥이랑 조합이 너무 좋았습니다 ㅎㅎ
1753800653,그동네떡볶이 연남점종합분식,분식,,,집근처여서 춤연습하고 맥주땡겨서 왔는데 1인떡볶이인데도 양 겁나~ 많고 맥주도 겁나 싸고~ 크리미하고 탄산이 톡톡쓰는게 개마싯서요 오징어튀김도 머것는데 맛나네요;;
1753800653,그동네떡볶이 연남점종합분식,분식,,,쭉 늘어나는 치즈와 부드러운 연어까지 행복했습니당 ㅎㅎ
1753800653,그동네떡볶이 연남점종합분식,분식,,,참치김밥은 속 꽉 차서 한입에 먹기 좋고 담백해서 매콤한 라볶이랑 잘 어울려요 ㅎㅎ
1753800653,그동네떡볶이 연남점종합분식,분식,,,"치즈 아낌없이 듬뿍 넣어주셔서 정말 만족했어요! 떡볶이에 치즈가 쭉쭉 늘어나서 먹는 재미도 있고, 양도 푸짐해서 친구랑 배부르게 잘 먹었습니다. 다음에도 꼭 다시 올게요 👍"
1753800653,그동네떡볶이 연남점종합분식,분식,,,치즈가 엄청 많구 연어김밥도 맛잇구 떢복이도 진짜 맛잇어서 또 먹으러 왓어요 존맛😋
1753800653,그동네떡볶이 연남점종합분식,분식,,,치즈가 왕창 들어가서 엄청 맛있는 떡볶이와 큼지막한 김밥을 같이먹으면 진짜 기가 막히는 맛이에요
1753800653,그동네떡볶이 연남점종합분식,분식,,,치즈떡볶이도 사진엔 없지만 김치김밥도 너무 맛있어요!! 강추추추!!
1753800653,그동네떡볶이 연남점종합분식,분식,,,치킨은 오늘 처음 시켜봤는데 바삭바삭하고 고소해서 너무 맛있었습니다 떡볶이는 치즈 필수!!
1753800653,그동네떡볶이 연남점종합분식,분식,,,탕수육까지 같이먹어야 하는데 빵투어 하고와서 김밥에 떡볶이만 먹었어요 여전히 맛있네요♥️
1753800653,그동네떡볶이 연남점종합분식,분식,,,특히 탕수육 강추합니다 ㅋㅋㅋㅋ 탕수육집이라고 해도 될만큼 맛있어요 ㅎㅎ
1753800653,그동네떡볶이 연남점종합분식,분식,,,폭포떡볶이는 국물이 진짜 매콤달콤해서 자꾸 김밥 찍어 먹게 돼요🔥 특히 명란마요김밥은 짭짤한 명란이 톡톡 터지면서 마요의 고소함이 입안 가득 퍼져서 중독성 최고🥢 떡볶이랑 같이 먹으면 찐 조합! 😋
1753800653,그동네떡볶이 연남점종합분식,분식,,,항상 맛있게 먹던 곳이였는데 연남점이 생겨서 와봤어요! 오랜만에 왔더니 메뉴도 더 늘어나고 맛있어요!
1673141274,김막회,회,,,계절마다 제철회를 먹을 수 있어서 생각날때마다 계속 와요 연어육회는 처음 먹어봤는데 넘 맛있어요 !! 구성도 알차고 깔끔하게나와서 좋아요 존맛 오래오래있어주세용
1673141274,김막회,회,,,공덕에 이런 맛집이 있는지 몰랐다.... 세꼬시도 최대한 없는 뭉탱이 회 느낌이고 중간에 깻잎과 참기름 무친 회도 너무 맛있고 사이드중에서도 가자미 튀김이 너무너무 맛있어서 충격 ㅠㅠ 반찬 가짓수만 많고 구색을 맞춘 한상차림 아니고 진짜 다 맛있습니다... 튤립닭발이랑 짜파게티랑 명란치즈계란말이도 먹고시픈데 다음에 또 다시올게요 야장느낌나서 지금 날씨 최고의선택 !!!
1673141274,김막회,회,,,"깻잎 막회 한상차림 구성도 잘 나오고 가격대도 좋은 것 같습니다. 깻잎을 좋아해서 싸서 먹는 것도 맛있고, 잘게 짤라서 향도 더 살아나는 것 같네요. 깻잎을 이용한 하이볼도 특이하고 맛있었습니다. 이날은 밀치, 숭어, 광어 구성이었고 다 맛있었네요. 사람들도 많았습니다."
1673141274,김막회,회,,,막회먹고싶을땐 김막회방문!! 저번에 왔었는데 구성이 넘 알차고 맛나서 다시 들렷어용~ 이가격에 이구성 맞냐구요…ㅎㅎ 가시없는 막회 넘 좋아용!! 깻잎가득 깻잎하이볼 궁금해서 먹어봣는데 생각보다 넘 깔끔 ㅎ 함 드셔보세요!!
1673141274,김막회,회,,,미나리 무침도 상큼하고 감자고로케도 다 직접 만드신것 같고.. 가자미구이도 한입먹어보니 구이에 살짝 조림간장이 있어서 같이 곁들여 먹으니 맛있어요..
1673141274,김막회,회,,,"밤에 방문예약 없이 이용대기 시간 바로 입장데이트친구, 지인・동료"
1673141274,김막회,회,,,벌써 여러번 방문한 김막회!! 회가 엄청 신선하고 맛있어서 정말 놀랬어요 넓은편은 아니지만 메뉴도 여러가지 잘되있고 정말 맛있습니당 왼저누강추! 비린내 완전 없음!!
1673141274,김막회,회,,,사장님과 매니저님은 마감시간까지 왜이리 친절하신건지~~
1673141274,김막회,회,,,슬슬 회를 먹을 계절이 다가와서 찾았습니다. 여전히 맛있고 사이드로 나오는 메뉴들이 알차요. 특히 제가 감자를 좋아하는데 사이드로 해쉬브라운이 나와서 너무 좋아요. 회 말고도 탕도 맛있어서 여러 명이 함께 와서 다양한 메뉴를 먹으면 좋을 것 같습니다!
1673141274,김막회,회,,,앞으로도 항상 최고의 서비스와 맛으로 고객님이 다시 찾고 싶은 김막회가 될 수 있도록 성장하겠습니다! 🙇🏻‍♀️안녕하세요 님! 숙성회에 진심인 김막회를
1673141274,김막회,회,,,앞으로도 항상 최고의 서비스와 맛으로 고객님이 다시 찾고 싶은 김막회가 될 수 있도록 성장하겠습니다! 🙇🏻‍♀️안녕하세요 님! 숙성회에 진심인 김막회를
1673141274,김막회,회,,,앞으로도 항상 최고의 서비스와 맛으로 고객님이 다시 찾고 싶은 김막회가 될 수 있도록 성장하겠습니다! 🙇🏻‍♀️안녕하세요 님! 숙성회에 진심인 김막회를
1673141274,김막회,회,,,앞으로도 항상 최고의 서비스와 맛으로 고객님이 다시 찾고 싶은 김막회가 될 수 있도록 성장하겠습니다! 🙇🏻‍♀️안녕하세요 님! 숙성회에 진심인 김막회를
1673141274,김막회,회,,,앞으로도 항상 최고의 서비스와 맛으로 고객님이 다시 찾고 싶은 김막회가 될 수 있도록 성장하겠습니다! 🙇🏻‍♀️안녕하세요 님! 숙성회에 진심인 김막회를
1673141274,김막회,회,,,앞으로도 항상 최고의 서비스와 맛으로 고객님이 다시 찾고 싶은 김막회가 될 수 있도록 성장하겠습니다! 🙇🏻‍♀️안녕하세요 님! 숙성회에 진심인 김막회를
1673141274,김막회,회,,,앞으로도 항상 최고의 서비스와 맛으로 고객님이 다시 찾고 싶은 김막회가 될 수 있도록 성장하겠습니다! 🙇🏻‍♀️안녕하세요 님! 숙성회에 진심인 김막회를
1673141274,김막회,회,,,앞으로도 항상 최고의 서비스와 맛으로 고객님이 다시 찾고 싶은 김막회가 될 수 있도록 성장하겠습니다! 🙇🏻‍♀️안녕하세요 님! 숙성회에 진심인 김막회를
1673141274,김막회,회,,,야장 분위기 물씬 김막회에서 깻잎향 가득 막회랑 술한잔하면 하루 피로가 다 풀릴거같아요ㅋㅋㅋ마포역3번출구랑도 정말 가까워서 찾아가기 좋았어요~!!
