가게ID,가게명,평점,날짜,리뷰내용
1938100069,울릉집 용산생선회,,,일단 음식이 너무 신선해서 계속 계속 들어가는 맛이예요!! 밑반찬으로 주는 초고추장이 만능이라 술이 술술 들어가용
1938100069,울릉집 용산생선회,,,일단 인테리어가 예쁘구요! 음식도 독특한 메뉴들이 몇몇 있어요!! 가격은 강남하고 비슷한 수준!! 젊은 감성입니다. 연포탕 3인이 먹기에 적당하구요! 큰 낙지 두마리에 기타 조개류 들어갑니다. 야채가 다소 적어여!! 냄비도 좀 작은 편이에요!! 아마고 오징어회와 탕 안주를 같이 즐기라는 컨셉이 아닌가 싶네요!! 한번 가보시면 분위기는 괜찮습니다.. 가성비 생각하시면 안되요!! 갬성으로 접근하시기를..
1938100069,울릉집 용산생선회,,,저녁에 방문예약 없이 이용대기 시간 10분 이내 데이트연인・배우자
1938100069,울릉집 용산생선회,,,저녁에 방문예약 없이 이용대기 시간 바로 입장데이트연인・배우자
1938100069,울릉집 용산생선회,,,저녁에 방문예약 없이 이용대기 시간 바로 입장데이트연인・배우자
1938100069,울릉집 용산생선회,,,"저녁에 방문예약 없이 이용대기 시간 바로 입장일상, 회식혼자"
1938100069,울릉집 용산생선회,,,저녁에 방문예약 없이 이용대기 시간 바로 입장일상친구
1938100069,울릉집 용산생선회,,,저녁에 방문예약 없이 이용대기 시간 바로 입장친목지인・동료
1938100069,울릉집 용산생선회,,,저녁에 방문예약 없이 이용대기 시간 바로 입장친목친구
1938100069,울릉집 용산생선회,,,저녁에 방문예약 없이 이용대기 시간 바로 입장친목친구
1938100069,울릉집 용산생선회,,,저녁에 방문예약 없이 이용대기 시간 바로 입장친목친구
1938100069,울릉집 용산생선회,,,저녁에 방문예약 없이 이용대기 시간 바로 입장친목친구
1938100069,울릉집 용산생선회,,,저녁에 방문예약 없이 이용대기 시간 바로 입장친목친구
1938100069,울릉집 용산생선회,,,저녁을 먹고 간단하게 2차로 들렀다가 오징어 회가 너무 맛있어서 두 접시나 시켰네요 가격은 좀 있지만 술맛 나는 해산물 안주들이 많아서 종종 들르게 될 것 같습니다
1938100069,울릉집 용산생선회,,,"저희는 모둠회 중 사이즈와 물회를 주문했는데, 회가 정말 쫄깃하고 싱싱해서 첫 입부터 감탄이 절로 나왔습니다. 기본 스끼다시도 과하지 않고 깔끔하게 구성되어 있었고, 특히 물회 육수는 감칠맛이 살아있어 회 못지않게 인상깊었어요."
1938100069,울릉집 용산생선회,,,"좋은 점: 신용산역 인근이,,, 삼각지에 비해 먹거리가 아쉬운데,,, 새롭게,,, 바다 행복집이,,, 들어와서 좋았읍니다,,, 바로 건너편 울엄마,,,가 좀 애매해졌는데,,, 회,,, 제대로 즐길 수 있어서 만족했읍니다,, 도다리 뽈락 다 양도 많고,,, 행복,,, 매장도 넓고,, 분위기도 좋아서,,, 추천,,,"
1938100069,울릉집 용산생선회,,,채썬 오징어 시키신다음에 초장이랑 쌈장 같이 부어서 섞은다음에 공기밥 시키신다음 절반만 넣고 비벼드세여
1938100069,울릉집 용산생선회,,,친구들과 같이 신용산 미미옥 갔다가 2차로 간 울릉집. 오징어 튀김이 엄청 바삭하구요. 도다리회도 깻잎에 싸먹으니 완전 굿~^^ 친구 추천으로 갔는데 좋았습니다. 신용산 쪽은 첨 와봤는데 저녁엔 정말 복작복작 하네요. 요즘 핫플인듯요. 담에 다시 이 거리에 와봐야겠어요. 용산역 건너에 멋진 공원도 생겼네요
1938100069,울릉집 용산생선회,,,포뜬 오징어는 인생에서 처음봤어요. 양배추와 날치알과 어울려 나오는데 ㅎㅎ 맛있어요.
