가게ID,가게명,평점,날짜,리뷰내용
1344013517,물고기주택생선회,,,생각보다 양도 많고 마냥 비싸기만 한 집인줄 알았는데 퀄리티도 어마어마하게 좋고 신선하기도 하고 진짜 좋습니다. 소주를 먹었으나 다음에는 사케에 먹으러 재방문 할 예정입니다.
1344013517,물고기주택생선회,,,신선한 제철 모듬회를 즐길 수 있는 곳. 분위기도 좋고.
1344013517,물고기주택생선회,,,신선한 제철 모듬회를 즐길 수 있는 곳. 분위기도 좋고.
1344013517,물고기주택생선회,,,싱싱한 제철회를 마음껏 즐길수 있는 물고기주택! 주택모듬회 아주 만족스러웠고 메로구이도 최고였습니다. 인테리어도 좋고 술마시기에 정말 좋더라구요. 다만 종업원분들의 약간의 불친절함을 감수한다면~ 최고의 요리를 맛볼수 있는곳!! 가격은 조금 센편이지만 먹고나서는 맛도 양도 매우 만족스러웠어요.
1344013517,물고기주택생선회,,,아무리 마감 시간이 가까워도 손님이 계실 때는 조금만 더 배려해주시면 더 좋을 것 같아요
1344013517,물고기주택생선회,,,온리 회로 승부하는곳! 스끼다시 없어도 너무 맛있어요 대방어 신선하고 매운탕도 진짜 맛있었습니다!!!!
1344013517,물고기주택생선회,,,왜 그러신지 모르겠지만 자꾸 토닉워터 흔들어서 주셔서 토닉워터 샤워를 했네요😅
1344013517,물고기주택생선회,,,용리단길 회 맛집! 가격은 조금있지만 항상 맛있는곳..
1344013517,물고기주택생선회,,,"용리단길에서 제일 맛있고 신선한 횟집이라고 후배가 데려가준 물고기주택! 모듬회랑 도미머리구이, 새우튀김 주문해서 먹었는데 3개 다 너무 맛있었습니다♡ 가격도 괜찮고 퀄리티도 좋아서 자주 갈듯한! 식사시간이 3시간으로 정해져있으니 참고하세요~"
1344013517,물고기주택생선회,,,웨이팅할까봐 일~~~~찍부터 가서 먹기 🤭✨️💛
1344013517,물고기주택생선회,,,입장하자마자 바로 주문했고 기본 안주까지 30분 걸렸습니다…30분뒤에 나온 회는..어디서 랩핑해서 온 접시 랩핑만 제거하고 전달 주셨습니다..가격에 저렴한것도 아니고 회는 말랐고 왜 줄서서 먹는지 모르겠네요^^
1344013517,물고기주택생선회,,,입장하자마자 바로 주문했고 기본 안주까지 30분 걸렸습니다…30분뒤에 나온 회는..어디서 랩핑해서 온 접시 랩핑만 제거하고 전달 주셨습니다..가격에 저렴한것도 아니고 회는 말랐고 왜 줄서서 먹는지 모르겠네요^^
1344013517,물고기주택생선회,,,"저녁에 방문예약 없이 이용대기 시간 바로 입장나들이, 여행친구, 지인・동료"
1344013517,물고기주택생선회,,,저녁에 방문예약 없이 이용대기 시간 바로 입장데이트연인・배우자
1344013517,물고기주택생선회,,,저녁에 방문예약 없이 이용대기 시간 바로 입장데이트연인・배우자
1344013517,물고기주택생선회,,,저녁에 방문예약 없이 이용대기 시간 바로 입장일상지인・동료
1344013517,물고기주택생선회,,,저녁에 방문예약 없이 이용대기 시간 바로 입장일상지인・동료
1344013517,물고기주택생선회,,,저녁에 방문예약 없이 이용대기 시간 바로 입장일상지인・동료
1344013517,물고기주택생선회,,,"저녁에 방문예약 없이 이용대기 시간 바로 입장친목, 나들이, 일상친구, 지인・동료"
1344013517,물고기주택생선회,,,"저녁에 방문예약 없이 이용대기 시간 바로 입장친목, 일상친구, 지인・동료"
1344013517,물고기주택생선회,,,저녁에 방문예약 없이 이용대기 시간 바로 입장친목지인・동료
1344013517,물고기주택생선회,,,저녁에 방문예약 없이 이용대기 시간 바로 입장친목친구
1344013517,물고기주택생선회,,,저녁에 방문예약 없이 이용대기 시간 바로 입장친목친구
1344013517,물고기주택생선회,,,"저녁에 방문예약 없이 이용대기 시간 바로 입장친목친구, 지인・동료"
1344013517,물고기주택생선회,,,"저녁에 방문예약 없이 이용대기 시간 바로 입장친목친구, 지인・동료"
1344013517,물고기주택생선회,,,저녁에 방문예약 후 이용대기 시간 10분 이내 친목연인・배우자
1344013517,물고기주택생선회,,,저녁에 방문예약 후 이용대기 시간 10분 이내 친목연인・배우자
1344013517,물고기주택생선회,,,저녁에 방문예약 후 이용대기 시간 바로 입장친목지인・동료
1344013517,물고기주택생선회,,,저녁에 방문예약 후 이용대기 시간 바로 입장친목친구
1344013517,물고기주택생선회,,,저녁에 방문예약 후 이용대기 시간 바로 입장친목친구
1344013517,물고기주택생선회,,,"점심에 방문예약 없이 이용대기 시간 바로 입장일상연인・배우자, 친구, 지인・동료"
1344013517,물고기주택생선회,,,"점심에 방문예약 없이 이용대기 시간 바로 입장일상연인・배우자, 친구, 지인・동료"
1344013517,물고기주택생선회,,,"점심에 방문예약 없이 이용대기 시간 바로 입장친목연인・배우자, 지인・동료"
1344013517,물고기주택생선회,,,점심에 방문예약 없이 이용대기 시간 바로 입장친목지인・동료
1344013517,물고기주택생선회,,,점심에 방문예약 없이 이용대기 시간 바로 입장친목지인・동료
1344013517,물고기주택생선회,,,진짜 오랜만에 회로 배부르게 먹은곳. 저맨날 토하기전까지 배부르게 먹는 사람인데요 두명에서 소짜 시켰는데 진짜 회 미치게 두툼하고 정말 신선하고 양 진짜진짜 많아요.. 최고….ㅜㅜ 재방문의사 너무너무 있습니다
1344013517,물고기주택생선회,,,최악입니다 진짜 맛대가리도 없고 가격만 더럽게 비싸고 매운탕도 뭔 맛인지도 모르겠고 요리 할줄도 모르는 사람이 요리하는거 같아요 근데 진짜 요리실력과 비례해서 가격 좀 받아주세요 주문도 자기들이 실수로 받아서 가서 주문 잘못나왔다니까 어쩌라고 배째라는 식으로 말씀하시고 서비스도 별로고 추천 안드립니다~
1344013517,물고기주택생선회,,,"하나 더, 화장실에서 직원 분 만났는데 손 안씻고 그냥 나가심."
1344013517,물고기주택생선회,,,"핫한 용리단길 속 물고기주택🩵 가격대는 좀 있지만, 그만큼 양이 많고 회가 두툼하게 썰려나와요! 쫄깃하고 신선한 맛이 그대로 느껴졌어요. 매운탕은 진짜.. 너무 깔끔한 맛♥️ 두부까지 송송 썰어주셔서 배부르게 먹었습니다 :)"
1344013517,물고기주택생선회,,,"확인 요청을 드렸는데, 취소해드리겠단 얘기만 하고"
1344013517,물고기주택생선회,,,"회 두툼하고 너무 맛있고, 매운탕 미친 맛이니까 꼭 드세요!!"
1344013517,물고기주택생선회,,,회 진짜 맛있었어요 사이드는 조금 아쉬워서 다음에 오면 그냥 회 더 큰거 먹을거 같아요~!
1344013517,물고기주택생선회,,,회에 집중~! 노량진에서 직접 공수하니 신선함과 맛~! 인정입니다~ 용리단길 모임있을때 추천할만 하네요~👍
1006887521,살아있네생선회,,,가장 신선하고 맛있는 해산물과 회를 먹을 수있어요. 지난번에 먹었던 돌장어도 너무너무 맛있게 먹었어요.
1006887521,살아있네생선회,,,가장 신선하고 맛있는 해산물과 회를 먹을 수있어요. 지난번에 먹었던 돌장어도 너무너무 맛있게 먹었어요.
1006887521,살아있네생선회,,,거제도 자연산 회 전문점이라는 간판을 보고 들어갔는데 정말 맛있어요! 오늘의 회로 시켰는데 다양한 종류가 나와서 좋았어요~ 재료가 신선해서 비린내도 전혀 없어요!
1006887521,살아있네생선회,,,거제도 자연산 회 전문점이라는 간판을 보고 들어갔는데 정말 맛있어요! 오늘의 회로 시켰는데 다양한 종류가 나와서 좋았어요~ 재료가 신선해서 비린내도 전혀 없어요!
1006887521,살아있네생선회,,,거제도에서 직송온다는 해산물이 정말 믿어져요! 오늘의 회로 주문했는데 돔이 나왔는데 정말 달달하고 쫄깃했어요~ 해산물 3종도 모두 활어라서 식감이 남달랐구요 특히 전복이 쫄깃하면서도 부드러워서 인상깊었습니다! 훗카이도 성게알은 말할것도 없이 최고였고 뽈락구이도 담백하면서 고소해서 술안주로 완벽이었어요 용산구에서 이런 퀄리티 회집 찾기 힘든데 여기는 정말 괜찮은것 같습니다! 사장님도 친절하시고 매장도 깔끔해서 기분좋게 식사할 수 있었어요
1006887521,살아있네생선회,,,거제도에서 직송온다는 해산물이 정말 믿어져요! 오늘의 회로 주문했는데 돔이 나왔는데 정말 달달하고 쫄깃했어요~ 해산물 3종도 모두 활어라서 식감이 남달랐구요 특히 전복이 쫄깃하면서도 부드러워서 인상깊었습니다! 훗카이도 성게알은 말할것도 없이 최고였고 뽈락구이도 담백하면서 고소해서 술안주로 완벽이었어요 용산구에서 이런 퀄리티 회집 찾기 힘든데 여기는 정말 괜찮은것 같습니다! 사장님도 친절하시고 매장도 깔끔해서 기분좋게 식사할 수 있었어요
1006887521,살아있네생선회,,,그래서 다른 곳과다르게 너무나 신기한 횟감들이 많았고 덕분에 함께 간 가족들 너무 좋아했습니다
1006887521,살아있네생선회,,,"남영동 맛집으로 강력 추천합니다! 살아있네라는 이름처럼 정말 살아있는듯한 신선함이었어요~ 오늘의 해산물 3종 대자로 주문했는데 문어, 새우, 전복이 나왔는데 모두 달달하고 쫄깃해서 최고였습니다 훗카이도 성게알은 정말 별미중의 별미! 비린내 전혀 없고 크림처럼 부드러워서 입에서 사르르 녹아요~ 뽈락구이도 담백하면서 고소해서 소주 한잔하기에 딱이었구요 사장님이 직접 산지에서 엄선해서 가져온다고 하시는데 그 정성이 느껴졌어요!"
1006887521,살아있네생선회,,,"남영동 맛집으로 강력 추천합니다! 살아있네라는 이름처럼 정말 살아있는듯한 신선함이었어요~ 오늘의 해산물 3종 대자로 주문했는데 문어, 새우, 전복이 나왔는데 모두 달달하고 쫄깃해서 최고였습니다 훗카이도 성게알은 정말 별미중의 별미! 비린내 전혀 없고 크림처럼 부드러워서 입에서 사르르 녹아요~ 뽈락구이도 담백하면서 고소해서 소주 한잔하기에 딱이었구요 사장님이 직접 산지에서 엄선해서 가져온다고 하시는데 그 정성이 느껴졌어요!"
1006887521,살아있네생선회,,,남영동 맛집으로 인정! 해산물이 정말 싱싱하고 특별한 메뉴들이 많아서 좋아요
1006887521,살아있네생선회,,,남영동 맛집으로 인정! 해산물이 정말 싱싱하고 특별한 메뉴들이 많아서 좋아요
1006887521,살아있네생선회,,,"남영동 회집 중에서는 탑급인듯! 살아있네에서 오늘의 회로 주문했는데 방어가 나왔는데 지방이 적당히 올라서 고소하면서도 담백했어요~ 해산물 3종도 전복, 새우, 광어 모두 활어라서 쫄깃함이 장난 아니었구요! 훗카이도 성게알은 정말 압권이었는데 크리미하면서도 바다의 진한 맛이 그대로 느껴져서 한 숟가락 한 숟가락이 모두 행복이었어요 뽈락구이도 바삭하게 잘 구워져서 소주 안주로 완벽이었습니다! 사장님의 정성과 경험이 음식에 그대로 묻어나는 훌륭한 식당이에요"
1006887521,살아있네생선회,,,"남영동 회집 중에서는 탑급인듯! 살아있네에서 오늘의 회로 주문했는데 방어가 나왔는데 지방이 적당히 올라서 고소하면서도 담백했어요~ 해산물 3종도 전복, 새우, 광어 모두 활어라서 쫄깃함이 장난 아니었구요! 훗카이도 성게알은 정말 압권이었는데 크리미하면서도 바다의 진한 맛이 그대로 느껴져서 한 숟가락 한 숟가락이 모두 행복이었어요 뽈락구이도 바삭하게 잘 구워져서 소주 안주로 완벽이었습니다! 사장님의 정성과 경험이 음식에 그대로 묻어나는 훌륭한 식당이에요"
1006887521,살아있네생선회,,,"남영동에서 이런 보석같은 회집을 발견해서 너무 기뻐요! 살아있네라는 이름처럼 정말 살아있는듯한 신선함이었습니다~ 오늘의 회로 주문했는데 우럭이 나왔는데 쫄깃하면서도 달달해서 정말 맛있었어요! 해산물 3종도 전복, 새우, 문어 모두 활어라서 식감이 남달랐구요 특히 성게알이 훗카이도산이라서 그런지 크리미하고 달달해서 최고였어요~ 뽈락구이도 비린내 없이 담백하게 구워져서 완벽했습니다 사장님의 정성이 느껴지는 훌륭한 식당!"
1006887521,살아있네생선회,,,"남영동에서 이런 보석같은 회집을 발견해서 너무 기뻐요! 살아있네라는 이름처럼 정말 살아있는듯한 신선함이었습니다~ 오늘의 회로 주문했는데 우럭이 나왔는데 쫄깃하면서도 달달해서 정말 맛있었어요! 해산물 3종도 전복, 새우, 문어 모두 활어라서 식감이 남달랐구요 특히 성게알이 훗카이도산이라서 그런지 크리미하고 달달해서 최고였어요~ 뽈락구이도 비린내 없이 담백하게 구워져서 완벽했습니다 사장님의 정성이 느껴지는 훌륭한 식당!"
1006887521,살아있네생선회,,,남영동에서 횟집 찾다가 여기 왔는데 완전 맛집이에요! 오늘의 회로 시켰는데 양도 많고 회도 신선해서 만족했습니다~
1006887521,살아있네생선회,,,남영동에서 횟집 찾다가 여기 왔는데 완전 맛집이에요! 오늘의 회로 시켰는데 양도 많고 회도 신선해서 만족했습니다~
1006887521,살아있네생선회,,,"또 간집. 역시나 첫 방문의 감동은 잘 못 느낀게 아니었음. 재방문에도 역시나 찐한 감동이... 어딜가도 한자리에서 이정도 구성의 특수 어종 모듬은 먹기 힘들것. 저 한판의 모듬은 다양한 어종을 비교하며 맛볼수 있고 알고 먹으니 더욱 더 좋았음. 밑반찬으로 나오는 회, 회무침, 생선가스는 물론 번데기도 맛있음. 서더리탕까지 소주 3병 순삭하고 기분 좋게 취해서 귀가. 사장님도 친절하시고 잘 챙겨주심. 오픈한지 얼마 안 되었는데 피크타임에 벌써 웨이팅도 생기고 여기 찐입니다. 강추~"
1006887521,살아있네생선회,,,모듬회도 말할 것 없이 맛있는 맛이고 서비스로 주신 생선까스도..하ㅠㅋㅋ진짜 숙대쪽 왔는데 여기 안오면 손해임… 직원분들도 친절하시고 음식도 맛있고 다음에 또 올거임 주차는 좀 어려운데 옆에 비싼 유료주차장에 주차하고 와도 용서되는 맛입니다…
1006887521,살아있네생선회,,,"밤에 방문예약 없이 이용대기 시간 10분 이내 데이트, 일상연인・배우자"
1006887521,살아있네생선회,,,"밤에 방문예약 없이 이용대기 시간 10분 이내 데이트, 일상연인・배우자"
1006887521,살아있네생선회,,,"밤에 방문예약 후 이용대기 시간 바로 입장데이트, 친목, 나들이, 여행, 일상, 기념일, 회식, 가족모임, 비즈니스연인・배우자, 친구, 지인・동료, 혼자, 아이, 부모님, 반려동물, 친척・형제, 기타"
1006887521,살아있네생선회,,,"밤에 방문예약 후 이용대기 시간 바로 입장데이트, 친목, 나들이, 여행, 일상, 기념일, 회식, 가족모임, 비즈니스연인・배우자, 친구, 지인・동료, 혼자, 아이, 부모님, 반려동물, 친척・형제, 기타"
1006887521,살아있네생선회,,,사장님이 직접 통영까지가셔서 걍매로 구입해서 직접 가져오신데요!!!
1006887521,살아있네생선회,,,살아있네라는 이름이 딱 맞는것 같아요! 정말 살아있는듯한 신선함이었습니다 오늘의 회로 주문했는데 우럭이 나왔는데 쫄깃함이 장난 아니더라구요~ 뽈락구이도 비린내 전혀 없고 고소해서 소주랑 완전 잘 어울렸어요 매운탕은 시원하면서도 칼칼해서 마지막까지 깔끔하게 마셨습니다! 사장님이 매일 아침 직접 시장에서 좋은 생선만 골라온다고 하시는데 그 정성이 느껴져요 재방문 확정이에요!!
1006887521,살아있네생선회,,,살아있네라는 이름이 딱 맞는것 같아요! 정말 살아있는듯한 신선함이었습니다 오늘의 회로 주문했는데 우럭이 나왔는데 쫄깃함이 장난 아니더라구요~ 뽈락구이도 비린내 전혀 없고 고소해서 소주랑 완전 잘 어울렸어요 매운탕은 시원하면서도 칼칼해서 마지막까지 깔끔하게 마셨습니다! 사장님이 매일 아침 직접 시장에서 좋은 생선만 골라온다고 하시는데 그 정성이 느껴져요 재방문 확정이에요!!
1006887521,살아있네생선회,,,살아있네에서 오늘의 해산물 3종으로 주문했는데 정말 대만족이었어요! 회 하나하나가 모두 두툼하고 신선해서 씹을 때마다 바다의 달큰함이 느껴졌어요~ 특히 훗카이도 성게알이 정말 압권이었는데 비린내 전혀 없고 크리미해서 한 숟가락 먹고 바로 추가 주문했습니닼ㅋ 뽈락구이도 겉은 바삭하고 속은 촉촉해서 완벽했구요! 매장도 깔끔하고 사장님도 친절해서 전체적으로 만족스러운 식사였어요
1006887521,살아있네생선회,,,살아있네에서 오늘의 해산물 3종으로 주문했는데 정말 대만족이었어요! 회 하나하나가 모두 두툼하고 신선해서 씹을 때마다 바다의 달큰함이 느껴졌어요~ 특히 훗카이도 성게알이 정말 압권이었는데 비린내 전혀 없고 크리미해서 한 숟가락 먹고 바로 추가 주문했습니닼ㅋ 뽈락구이도 겉은 바삭하고 속은 촉촉해서 완벽했구요! 매장도 깔끔하고 사장님도 친절해서 전체적으로 만족스러운 식사였어요
1006887521,살아있네생선회,,,숙대입구역 근처 횟집 중에 여기가 제일 맛있는 것 같아요! 통영 거제도에서 직송한다는 자연산 회가 정말 싱싱하고 맛있어요~ 오늘의 회 주문했는데 양도 많고 가격도 합리적이에요! 친구들한테 추천했습니다 ㅎㅎ
1006887521,살아있네생선회,,,숙대입구역 맛집으로 인정! 오늘의 회가 매일 바뀌니까 올 때마다 새로운 재미가 있어요 어제는 농어였는데 오늘은 도미더라구요~ 둘다 엄청 신선하고 맛있었어요 매장도 깔끔하고 사장님도 친절하세요! 특히 훗카이도 성게알은 정말 꼭 드셔보세요 진짜 별미입니다 비린내 전혀 없고 달콤크리미해서 입에서 녹아요~ 뽈락구이도 바삭하게 잘 구워져서 술안주로 완벽했구요 다음에 친구들이랑 또 올게요!!
1006887521,살아있네생선회,,,숙대입구역 맛집으로 인정! 오늘의 회가 매일 바뀌니까 올 때마다 새로운 재미가 있어요 어제는 농어였는데 오늘은 도미더라구요~ 둘다 엄청 신선하고 맛있었어요 매장도 깔끔하고 사장님도 친절하세요! 특히 훗카이도 성게알은 정말 꼭 드셔보세요 진짜 별미입니다 비린내 전혀 없고 달콤크리미해서 입에서 녹아요~ 뽈락구이도 바삭하게 잘 구워져서 술안주로 완벽했구요 다음에 친구들이랑 또 올게요!!
1006887521,살아있네생선회,,,숙대입구역에서 가까워서 접근성도 좋고 음식도 맛있어서 자주 올것 같아요! 오늘의 회로 주문했는데 그날그날 들어온 싱싱한 생선으로 해주시니까 매번 다른 맛을 즐길 수 있어서 좋더라구요~ 오늘은 돔이었는데 살이 탱탱하고 달달해서 정말 맛있었어요 쏨뱅이 매운탕도 얼큰하고 시원해서 회랑 같이 먹으니까 딱이었습니다! 사장님도 친절하시고 매장도 깔끔해서 전체적으로 만족스러운 식사였어요
1006887521,살아있네생선회,,,숙대입구역에서 가까워서 접근성도 좋고 음식도 맛있어서 자주 올것 같아요! 오늘의 회로 주문했는데 그날그날 들어온 싱싱한 생선으로 해주시니까 매번 다른 맛을 즐길 수 있어서 좋더라구요~ 오늘은 돔이었는데 살이 탱탱하고 달달해서 정말 맛있었어요 쏨뱅이 매운탕도 얼큰하고 시원해서 회랑 같이 먹으니까 딱이었습니다! 사장님도 친절하시고 매장도 깔끔해서 전체적으로 만족스러운 식사였어요
1006887521,살아있네생선회,,,숙대입구역에서 도보로 5분? 정도 걸리는데 접근성 좋고 맛도 좋아요! 오늘의 회 시켰는데 다양한 종류가 나와서 재밌게 먹었어요~
1006887521,살아있네생선회,,,숙대입구역에서 도보로 5분? 정도 걸리는데 접근성 좋고 맛도 좋아요! 오늘의 회 시켰는데 다양한 종류가 나와서 재밌게 먹었어요~
1006887521,살아있네생선회,,,숙대입구역에서 도보로 금방이라 자주 올것 같아요~ 오늘의 회가 매일 바뀌니까 올 때마다 새로운 재미가 있더라구요! 오늘은 방어였는데 지방이 적당히 올라서 고소하면서도 담백했어요 해산물 3종도 모두 싱싱하고 양도 푸짐해서 만족스러웠구요~ 매장 인테리어도 모던하면서 깔끔해서 분위기가 좋았어요 사장님도 친절하시고 음식 설명도 자세히 해주셔서 믿고 먹을 수 있었습니다!
1006887521,살아있네생선회,,,쏨뱅이 매운탕이 진짜 시원하고 얼큰해요! 자연산으로 끓여서 국물 맛이 깊고 진해요~ 해장으로 최고!
1006887521,살아있네생선회,,,쏨뱅이 매운탕이 진짜 시원하고 얼큰해요! 자연산으로 끓여서 국물 맛이 깊고 진해요~ 해장으로 최고!
1006887521,살아있네생선회,,,와이프랑 요새 꽂혀서 또또 간집. 자연산 특수어종을 시키고 오늘은 어떤 조합의 고급회가 나올지 기대되고 맛을 보면 역시나 탁월한 선택임에 만족~ 너무 인기가 많아져 사람이 북적.
1006887521,살아있네생선회,,,우와~ 감동의 맛집. 우연히 나들이 길에 자연산 고급회라는 메뉴판과 다양하고 신선한 어종들이 가득한 수족관에 이끌려 방문했고 기대 이상의 감동을... 자연산 특수어종 주문하니 사진의 한꺼번에 보기 힘든 고급어종들이 이름표를 달고 나와 비교하며 회의 진정한 맛을 음미할 수 있어서 맛은 물론 재미까지 최고였음. 그때그때 준비중인 어종들이 달라질 수 있고 꼭 원하는 어종이 있으면 약간은 조절해 주신다고 하심. 단골집으로 저장했으니 또 방문 예정~
1006887521,살아있네생선회,,,"인근에 볼일이 있어 점심 먹을곳을 찾다가 들어갔는데 자연산회 전문점이네요. 젊은 직원분들이 운영하시는데 굉장히 친절하시네요. 자연산 회라 우리가 흔히 아는 광어, 우럭이 아니고 자연산 잡어 여러가지들을 주시는거같아요. 설명을 해주셨는데 무슨 회인지 다 까먹었어요ㅋ 점심 회정식도 있던데 가성비가 괜찮아보여서 시간 있을때 한번 오고싶네요!"
1006887521,살아있네생선회,,,"자연산 횟집. 저녁에만 왔었는데 점심 정식도 괜찮네요. 막회는 청어,놀래미,쑤기미 구성. 횟감은 그때그때 달라지는듯"
1006887521,살아있네생선회,,,점심에 방문예약 없이 이용대기 시간 바로 입장친목친구
1006887521,살아있네생선회,,,점심에 방문예약 없이 이용대기 시간 바로 입장친목친구
1006887521,살아있네생선회,,,"하나하나가 살아 있는 듯 신선하고, 씹을수록 감탄 나옵니다."
1006887521,살아있네생선회,,,"하나하나가 살아 있는 듯 신선하고, 씹을수록 감탄 나옵니다."
1006887521,살아있네생선회,,,해산물로 시켰는데 전복이랑 돌멍게 멍게 뿔소라 해삼 등등 신선하고 기본 찬도 너무 좋음!
1908938433,오성참치,,,"3. 맛있는 구성 죽, 버섯, 참치, 콘, 묵사발, 알밥, 매운창 등 알차고 푸짐한 한끼"
1908938433,오성참치,,,"가성비 있게 참치를 먹을 수 있고 구이, 튀김, 탕, 알밥, 콘치즈, 볶음우동 등 세트 구성이 다양해서 좋아요!"
1908938433,오성참치,,,"가성비 있게 참치를 먹을 수 있고 구이, 튀김, 탕, 알밥, 콘치즈, 볶음우동 등 세트 구성이 다양해서 좋아요!"
1908938433,오성참치,,,개별룸도 잘 돼있고 프라이빗하게 먹을 수 있어서 모임 데이트로도 좋네요:)
1908938433,오성참치,,,"남자친구랑 먹으러 왔는데 배부르게 참치 무한리필 먹을 수 있었고, 일단 사이드 메뉴들도 나와서 함께 배불리 먹을 수 있어서 가성비가 넘 좋구 기념일에 오기에 좋은 것 같아요💖"
1908938433,오성참치,,,남친통해서 첨으로 고급참치회맛집을 다녀와서 넘 기분좋게 맛나게 먹고 좋은 시간을 보냈어요🥰🥰💕💕
