가게ID,가게명,평점,날짜,리뷰내용
1796133699,푸글렌 서울,,,커피가 제스타일은 아니었어요. 브루잉커피(오늘의커피) hot으로 마셨는데 산미가 너무있었어요. 오히려 식고나서 다 마실때쯤 밸런스가 좋더라구요...정말 한모금 남았을때..
1796133699,푸글렌 서울,,,"푸글렌 아이스 커피(벤자민파즈), 오늘의 커피(엘레호) 두잔 마셨는데 푸글렌 아이스는 산미 살짝 있고 오늘의 커피는 발란스 좋았어요! 낮에는 카페로 저녁엔 바로 운영된다고 하는데 다음에는 낮에도 한번 방문해 보고 싶네요!"
1796133699,푸글렌 서울,,,"푸글렌 아이스 커피(벤자민파즈), 오늘의 커피(엘레호) 두잔 마셨는데 푸글렌 아이스는 산미 살짝 있고 오늘의 커피는 발란스 좋았어요! 낮에는 카페로 저녁엔 바로 운영된다고 하는데 다음에는 낮에도 한번 방문해 보고 싶네요!"
1796133699,푸글렌 서울,,,푸글렌서울! 제가 산미있는 커피를 좋아하는데 오늘의 커피가 산미있는 커피라 넘 만족했어요! 다만 주말토욜이라 사람이 많아서 자리선정이 좀 어려웠지만 커피가 맛있어서 만족하네요! 상수동 1번출구에서 가까우니 꼭 한번 들르셔서 커피한잔 하시길요! 추천함돠!
1796133699,푸글렌 서울,,,한국에 생겨서 어마어마한 웨이팅 때문에 오픈하고 안가다가 평일에는 역시나 많은 사람이 있지는 않아서 바로 방문! 맛있는 커피와 세련되면서도 고급스러운 분위기에서 즐기는 커피는 환상적 무엇보다 향긋하면서도 다양한 캐릭터를 느낄 수 있는 커피를 즐길 수 있어 꼭 가보시길 추천👍🏻
