가게ID,가게명,업종,평점,날짜,리뷰내용
11477316,청담골한식,한정식,,,마감시간 직전에 갔지만 마감전 식사 마치기전에 불끄고 난리.. ㅡ.ㅡ 늦은시간이라 가게앞 주차자리 있어서 주차하고 내렸더니 발렛이 기본이라고 차키받아 굳이 먼곳에 차 갖다놓고 발렛비 청구하는데.. . 거 참..
11477316,청담골한식,한정식,,,맛있고 든든한 백반 한상 너무 좋아요~! 맛있게 먹은 기억이 있어서 엄마랑 할머니 모시고 왔어요.
11477316,청담골한식,한정식,,,밤에 방문예약 없이 이용대기 시간 바로 입장일상혼자
11477316,청담골한식,한정식,,,오늘은 살코기 없는 비계 김치찌개가 나왔습니다. 그래도 새콤하니 맛은 나쁘지 않았어요. 나머지 반찬들은 오래 활용할 수 있는 반찬으로 구성되어 있어요.
11477316,청담골한식,한정식,,,"요즘 식당들 반찬 가짓수가 대부분 몇개 안되는데 반해 한상차림에 김치찌개, 콩나물무침, 우엉볶음, 김치, 계란찜, 장조림, 김, 어묵볶음 등 반찬이 푸짐해서 가정식백반의 정석을 보여주는 구성입니다."
11477316,청담골한식,한정식,,,장조림 어묵볶음 콩나물무침 멸치볶음 감자조림 참치김치찌개 등 기본 상차림 구성도 좋은데 고등어구이 계란말이 제육볶음 추가하면 더욱 푸짐하게 즐길 수 있답니당. 발렛도 되서 편하고 좋아요!!
11477316,청담골한식,한정식,,,저녁에 방문예약 없이 이용대기 시간 바로 입장데이트연인・배우자
11477316,청담골한식,한정식,,,저녁에 방문예약 없이 이용대기 시간 바로 입장데이트연인・배우자
11477316,청담골한식,한정식,,,저녁에 방문예약 없이 이용대기 시간 바로 입장친목지인・동료
11477316,청담골한식,한정식,,,저녁에 방문예약 없이 이용대기 시간 바로 입장친목친구
11477316,청담골한식,한정식,,,저녁에 방문예약 없이 이용대기 시간 바로 입장친목친구
11477316,청담골한식,한정식,,,"점심에 방문예약 없이 이용대기 시간 10분 이내 데이트, 일상연인・배우자"
11477316,청담골한식,한정식,,,점심에 방문예약 없이 이용대기 시간 바로 입장
11477316,청담골한식,한정식,,,"점심에 방문예약 없이 이용대기 시간 바로 입장가족모임연인・배우자, 부모님"
11477316,청담골한식,한정식,,,"점심에 방문예약 없이 이용대기 시간 바로 입장데이트, 친목, 나들이, 일상, 가족모임연인・배우자, 친구, 지인・동료, 부모님, 친척・형제"
11477316,청담골한식,한정식,,,점심에 방문예약 없이 이용대기 시간 바로 입장데이트연인・배우자
11477316,청담골한식,한정식,,,점심에 방문예약 없이 이용대기 시간 바로 입장일상지인・동료
11477316,청담골한식,한정식,,,점심에 방문예약 없이 이용대기 시간 바로 입장일상혼자
11477316,청담골한식,한정식,,,점심에 방문예약 없이 이용대기 시간 바로 입장일상혼자
11477316,청담골한식,한정식,,,점심에 방문예약 없이 이용대기 시간 바로 입장친목친구
11477316,청담골한식,한정식,,,처음방문인데 청담에서 한식 먹기 좋았습니다 기본 상에 가자미 고등어 등등 여러개 추가해서 먹으면 더 맛잇네요
11477316,청담골한식,한정식,,,청담동 근처에 일 있어 방문했다가 백반이 땡겨서 방문했는데 반찬도 다양하고 맛있어서 든든하게 식사 했어요!
11477316,청담골한식,한정식,,,하지만 추가로 시킨 갈비찜은 가격 대비 양과 질 면에서 비추입니다. 이게 갈비찜인가 장조림인가 하는 생각이 들더군요. 집에서 어머님이 해주신 갈비찜 생각하면 안될 것 같아요.
1377698986,청담그늘,초밥,,,"가격이 저렴한 편은 아니지만, 제가 받은 서비스에 비하면 이유있는 가격이라는 생각이 듭니다. 특별한 날 특별한 경험을 만들어 주셔서 감사합니다."
1377698986,청담그늘,초밥,,,남자친구랑 크리스마스때 갔었는데 그늘오합과 사케의 조합이 아주 좋았습니다 ㅎㅎ 근데 또 크림전복이 진짜 ... 기대 이상으로 너무너무 맛있어서 놀랐습니당 서비스로 주신 어묵도 약간 칼칼해서 중간에 맛있었고 티라미수케잌도 쵹쵹하게 잘 먹었습니당 시끄러운 분위기가 아니라 대화하며 먹고 마시기 괜찮았고 화장실 핸드워시 및 핸드크림도 브랜드별로 다양하게 있어서 대박임댱 특별한날 분위기내기 너무 좋은장소에용 🎄❣️
1377698986,청담그늘,초밥,,,"리뷰 1,596사진 3,187팔로워 101테마 90"
1377698986,청담그늘,초밥,,,맛있는 음식에 직원분들도 친절하게 응대해줘서 덕분에 좋은 시간 보냈습니다.
1377698986,청담그늘,초밥,,,맛있습니다. 룸은 예약 후 이용 가능하고요. 양이 너무 적은 게 단점이지만 그걸 상쇄할 만큼 맛있습니다. 그리고 직원분들 친절하세요.
1377698986,청담그늘,초밥,,,모든 메뉴가 맛있었고 플레이팅이 예뻐서 보는 재미도 있었습니다. 무엇보다 생일이벤트를 정성껏 준비해주셔서 너무 좋았습니다. 주류는 와인 or 사케 주문 필수라 논알콜 와인을 주문했습니다. 모든 직원분들이 친절하시고 셰프님께서도 많이 챙겨주셔서 좋은 추억 남기고 갑니다.
1377698986,청담그늘,초밥,,,생일기념♡ 분위기 너무 좋아요오♡ 대접받는 느낌이 최고에요! 재료가 신선해서 맛도 좋아요♡
1377698986,청담그늘,초밥,,,생일이어서 예약하고 갔는데 생일자 특별 메뉴도 주시고 음식 하나하나 다 맛있었어요. 가격이 좀 사악하지만 너무너무 좋은 시간이었습니다👍👍👍
1377698986,청담그늘,초밥,,,서비스도 너무 좋고 좋은날에 귀한 분들 모시고 가기 좋아요 ❤️ 내돈내산 80만원 결제하고 쓰는 후기입니다.. ❤️❤️
1377698986,청담그늘,초밥,,,"술도 필수라 보틀을 시켰는데 메뉴에는 가격이 7만9천원이었던 닷사이39가 계산할때는 21만원이어서 놀랬습니다. 전화해서 여쭤보니 하프보틀가격이 7만9천원이었네요.. 잘 물어보고 주문하셔야할 것 같아요. 그런데 하프가 79천원인데 1보틀이 21만원인게 아직 잘 이해는 안됩니다,,^^😅"
1377698986,청담그늘,초밥,,,술이 너무 다양하게 준비되어 있어서 고르는 재미도 쏠쏠 합니다.
1377698986,청담그늘,초밥,,,안주 양이 적은데 굳이 테이블당 와인1병이 필수여야 하는지..
1377698986,청담그늘,초밥,,,여자친구 생일기념으로 저녁 식사를 방문 했는데 너무 만족스러운 식사하고 갑니다 평소에 일식을 즐겨 먹는 펀은 아닌데 그럼에도 모든 메뉴가 맛있었고 직원들도 다들 친절하셔서 즐거운 시간 보냈습니다!
1377698986,청담그늘,초밥,,,예액할때 생일이라고 메모에 적고 예약했지만 당일에 확인을 못해서 놓치셨나봐요 이벤트란에 생일이라고 적었다고 직원분께 따로 말씀드렸고 이벤트 서비스를 받았습니다
1377698986,청담그늘,초밥,,,오마카세도 가끔 가지만 여긴.. 여자둘이 20만원 결제했는데 배부르게 먹을 생각 없었지만 기별이 안가서 2차로 식사러갔습니다.
1377698986,청담그늘,초밥,,,오픈하자마자 갔어요. 우리가 일빠였죠. 그래서 여유있게 즐겼답니다. 음식은 역시나 빠르게 나왔고요. 역시나 음식맛 좋고요. 다~~ 맛있어요. 시간이 금방 가는게 아쉬워요. 이 집은 시간 제한이 있거든요. 그것 빼고는 완벽한 집이랍니다. 생일이라고 미역국도 끓여주시고 아이스크림도 선물주셨는데 특히 미역국 진짜 맛있었답니다. 감사합니다.
1377698986,청담그늘,초밥,,,음식은 가격에 비해 양이 너무 적었습니다 ㅠㅠ 그리고 술값이 다른 가게들보다 좀 비쌌네요(바틀이 기본 10만원 이상^^;) 그래도 맛은 신선하고 괜찮았어요 분위기도 괜찮구요~
1377698986,청담그늘,초밥,,,음식이 하나하나 너무 맛있고 페어링해 먹으니 넘 행복했어요~
1377698986,청담그늘,초밥,,,이렇게 맛있는 미역국이랑 쌀 젤라또? 같은 것도 준비해주셔서 완벽하게 생일 기념 외식이 되었네욤ㅎㅎ
1377698986,청담그늘,초밥,,,일단 정신 없이 먹어서 사진은 어쩌다 못찍어서..별로 없지만.. 정말 친절하셨고 남자친구 전역 기념으로 예약하고 갔는데 진짜 잘 챙겨주셨어요..
1377698986,청담그늘,초밥,,,"재료들이 다 신선하고, 맛있었어요. 마침 제 생일 당일이라😬 서프라이즈로 생일상도 차려주셨어요."
1377698986,청담그늘,초밥,,,저녁에 방문예약 후 이용대기 시간 바로 입장
1377698986,청담그늘,초밥,,,저녁에 방문예약 후 이용대기 시간 바로 입장나들이친구
1377698986,청담그늘,초밥,,,저녁에 방문예약 후 이용대기 시간 바로 입장데이트연인・배우자
1377698986,청담그늘,초밥,,,저녁에 방문예약 후 이용대기 시간 바로 입장데이트친구
1377698986,청담그늘,초밥,,,저녁에 방문예약 후 이용대기 시간 바로 입장친목친구
1377698986,청담그늘,초밥,,,"주문한 메뉴 다 맛있었고 룸은 모임하기에 딱입니다. 기념일, 친구모임, 가족모임, 회식 등등 하기에 좋습니다. 메뉴 이름이 다 기억이 안나서 사진으로만 올려놓습니다. 개인적으론 옥돔구이 리조또가 제일 최애 메뉴였습니다. 생일이라고 요거트아이스크림이랑 미역국을 서비스로 주셨는데 미역국도 집에서 먹는 것처럼 맛있어요. 그밖에도 서비스도 좋고 매장도 청결하고 소품이나 세정도구 등도 고퀄이에요~ 재방문 의사 있습니다."
1377698986,청담그늘,초밥,,,집가야해서 어쩔 수 없이 무알콜 와인으로 먹었지만... 취하는 맛이였어요🫶 재료 너무 신선하고 분위기 좋고 셰프님께서 바로 앞에서 요리해주셔서 초대받은 기분이 들더라구요❤️ 서울 나들이 완벽했습니다⭐️
1377698986,청담그늘,초밥,,,"처음 결제실수로 기분이 매우 안 좋았는데, 나중에 남자 직원분이 계속 친절하게 마무리 잘해주셔서 기분 줗게 마시고 나왔습니다."
1377698986,청담그늘,초밥,,,"🍷 압구정의 숨은 보석 '청담그늘'! 아늑한 지하 공간에서 즐기는 와인과 해산물 요리가 일품이에요. 우니, 육사시미, 단새우가 어우러진 '그늘오합'은 와인과 함께하면 환상적입니다"
1691368632,청담동순도리 청담점,한식,,,"곱도리탕, 육개장, 얼큰순대국 시켜서 먹었는데 다 맛있어요~ 아이들도 잘 먹네요~^^ 여행에서 귀가 중 우연히 들렸는데 알고보니 맛집이에요. ㅎㅎ 8월 한달 소주 100원 행사도 하니 가성비 좋습니다!"
1691368632,청담동순도리 청담점,한식,,,"국물이 진하고 잡내 없어서 속 편하게 먹었어요. 깍두기랑 무생채도 잘 어울리고, 곱도리탕은 얼큰하면서도 푸짐해서 만족! 24시간이라 언제 가도 좋고, 발렛 주차도 돼서 편했어요. 혼밥도 가능하고, 해장·술안주 둘 다 추천입니다."
1691368632,청담동순도리 청담점,한식,,,순대 알차고 맛있어요~ 든든한 한끼 뚝딱입니다 추천해요
1691368632,청담동순도리 청담점,한식,,,저녁에 방문예약 없이 이용대기 시간 바로 입장일상혼자
1691368632,청담동순도리 청담점,한식,,,점심에 방문예약 없이 이용대기 시간 바로 입장일상부모님
1691368632,청담동순도리 청담점,한식,,,"점심에 방문예약 없이 이용대기 시간 바로 입장일상연인・배우자, 아이"
36410322,청담반점 강남구청점중식당,중식,,,기존에 중국집에서 접해보지 않았던 국물이 시원하고 칼칼했던 배추탕면과 잡채당면이 납작당면으로 되어있어 신선했어요
36410322,청담반점 강남구청점중식당,중식,,,네이버플레이스에 나와 있는 가격과 매장 가격은 다릅니다. 짜장면 만원입니다. 숟가락으로 소스 계속 먹어봐도 입 안에서 고기는 전혀 걸리지않네요. 고기 없이 이 맛을 낸게 신기합니다.
36410322,청담반점 강남구청점중식당,중식,,,"리뷰 1,429사진 619팔로워 54"
36410322,청담반점 강남구청점중식당,중식,,,삼선 짬뽕의 해물 그득한 맛을 기대했는데 건더기 양이 넘 적어 놀랐고 다른 테이블과 비교군이 없고 종업원들이 넘 바쁘고 질문에 답을 못하는게 한국인이 아닌거 같아요 다른 일반 중국집에 없는 메뉴라 다른 메뉴들도 궁금합니다만 가격은 비싸고 양은 그때 그때 다른건지 나오자마자 찍은 삼선짬뽕은 다시 먹을건 아닐거에요. 조미료가 많이 들어간 집은 아닌거 같아요.
36410322,청담반점 강남구청점중식당,중식,,,일단먼저 사과부터하고 어찌처리할지 얘기해도 모자를판에 홀에서 들어간거 같은데요?? 다시해드려요?? 이럼;; 어이상실 ;;; 끝끝내 미안하단 소리 안하고 그 짬뽕값만 빼고 계산됨. 부모님과 갔으니 그냥 나왔음.... 위생상태(벌레가 어디서 들어갔던) 종업원태도 최악임
36410322,청담반점 강남구청점중식당,중식,,,"저녁에 방문대기 시간 바로 입장일상연인・배우자, 아이"
36410322,청담반점 강남구청점중식당,중식,,,저녁에 방문예약 없이 이용대기 시간 바로 입장일상지인・동료
36410322,청담반점 강남구청점중식당,중식,,,점심에 방문예약 없이 이용대기 시간 바로 입장데이트연인・배우자
36410322,청담반점 강남구청점중식당,중식,,,점심에 방문예약 없이 이용대기 시간 바로 입장일상친척・형제
36410322,청담반점 강남구청점중식당,중식,,,점심에 방문예약 없이 이용대기 시간 바로 입장일상혼자
36410322,청담반점 강남구청점중식당,중식,,,점심에 방문예약 없이 이용대기 시간 바로 입장일상혼자
36410322,청담반점 강남구청점중식당,중식,,,점심에 방문예약 없이 이용대기 시간 바로 입장일상혼자
36410322,청담반점 강남구청점중식당,중식,,,점심에 방문예약 없이 이용대기 시간 바로 입장지인・동료
36410322,청담반점 강남구청점중식당,중식,,,점심에 방문예약 없이 이용대기 시간 바로 입장친목지인・동료
36410322,청담반점 강남구청점중식당,중식,,,점심에 방문예약 없이 이용대기 시간 바로 입장친목친구
36410322,청담반점 강남구청점중식당,중식,,,"짜장면 자체가 식물성 재료로만 만들어져서 비건도 먹을 수 있어요. 양파를 제대로 볶지 않으면 양파 냄새가 많이 나는데, 여기는 양파를 제대로 볶아주는데 흐물거리지는 않고.. 여하튼 여태 먹은 짜장면 중 양파가 제일 맛있는 짜장면이었어요."
36410322,청담반점 강남구청점중식당,중식,,,첫 방문이였는데 인생 짬뽕 먹었어요! 삼선짬뽕 육수가 너무 맛있고 매콤하니 맛있네요🥹 깐풍육도 양이 많고 맛있었어요 2인기준 깐풍육 남아서 포장해왔어요~ 짜사이도 맛있고 반찬 하나까지 맛있는집! 맛집 인정이예요 재방문의사 있어요❤️
36410322,청담반점 강남구청점중식당,중식,,,탕수육도 맛있고 거의 모든 메뉴가 맛있어요
1041740236,청담백송,고기집,,,240세트로 먹었는데 뭉티기도 너무 맛있고 고기도 너무 부드럽고 밑반찬도 전부 맛있어서 자주 올게요🥰 하나부터 열까지 다 좋았어용
1041740236,청담백송,고기집,,,240세트로 먹었는데 뭉티기도 너무 맛있고 고기도 너무 부드럽고 밑반찬도 전부 맛있어서 자주 올게요🥰 하나부터 열까지 다 좋았어용
1041740236,청담백송,고기집,,,6인이 회식할 곳을 찾고있었는데 분위기도 좋고 딱 인실 룸이 있어서 너무 좋았어요! 대화에 집중할 수 있게 고기도 설명 잘해주시고 잘 구워주셔서 너무 좋앗어요 분위기 좋고 밑반찬 깔끔해서 굉장히 만족스럽니다. 회식 장소로 매우 추천드려요
1041740236,청담백송,고기집,,,6인이 회식할 곳을 찾고있었는데 분위기도 좋고 딱 인실 룸이 있어서 너무 좋았어요! 대화에 집중할 수 있게 고기도 설명 잘해주시고 잘 구워주셔서 너무 좋앗어요 분위기 좋고 밑반찬 깔끔해서 굉장히 만족스럽니다. 회식 장소로 매우 추천드려요
1041740236,청담백송,고기집,,,n번째 재방문중이에요 너무 맛있어요 24시간했으면 새벽에도 와서먹었을듯 청담맛집인정
1041740236,청담백송,고기집,,,n번째 재방문중이에요 너무 맛있어요 24시간했으면 새벽에도 와서먹었을듯 청담맛집인정
1041740236,청담백송,고기집,,,n번째 재방문중이에요 너무 맛있어요 24시간했으면 새벽에도 와서먹었을듯 청담맛집인정
1041740236,청담백송,고기집,,,가족모임하러 왔는데 등심 입에서 살살 녹고 너무 맛있네요~ 청담맛집 검색해서 왔는데.. 정말 맛있고 친절해요!! 맛있는집 찾아왔다가 기분까지 좋아져서 돌아갑니다 ^^ 자주 올게요!!
1041740236,청담백송,고기집,,,고기도 너무너무 맛있어서 가족들과 즐거운 식사시간 보냈습니다🩷
1041740236,청담백송,고기집,,,고기도 너무너무 맛있어서 가족들과 즐거운 식사시간 보냈습니다🩷
1041740236,청담백송,고기집,,,고기도 너무너무 맛있어서 가족들과 즐거운 식사시간 보냈습니다🩷
1041740236,청담백송,고기집,,,고기도 직접 맛있게 구워 주시고 반찬들도 너무나 맛 깔스럽고
1041740236,청담백송,고기집,,,그동안 갔었던 한우집중에 최고로 맛있는 백송청담 적극 추천해요!
1041740236,청담백송,고기집,,,두번째 방문이예요~!! 저번에 너무 맛있게 먹구가서 또왔어요 ㅎㅎㅎ 고기질두 좋구 반찬도 하나하나 다 맛있어요우!! 단골예약!!!!#청담맛집#청담한우
1041740236,청담백송,고기집,,,또 먹고 싶다 가격 때가 있는 만큼 1++ 의미를 알거 같은 느낌.. 너무 맛있습니다 진짜 맛나는 소고기 먹고 싶으면 적극 추천..!!
1041740236,청담백송,고기집,,,맛있는데 퀄리티 좋은 고기를 직접 구워주시기까지 하니까 데이트할 때 무조건 방문하고 싶은 청담 맛집이에요! 고기도 맛있고 사이드메뉴도 하나하나 다 정성스러워서 친구들이랑 또 오고 싶은 집..👍
1041740236,청담백송,고기집,,,맛있는데 퀄리티 좋은 고기를 직접 구워주시기까지 하니까 데이트할 때 무조건 방문하고 싶은 청담 맛집이에요! 고기도 맛있고 사이드메뉴도 하나하나 다 정성스러워서 친구들이랑 또 오고 싶은 집..👍
1041740236,청담백송,고기집,,,"뭉티기부터 시작해 우리가족 다 좋아하는 안심으로 먹었습니다. 알맞게 너무 잘 구워주시고 아이들 같이왔다고 불고기(?)에 계란찜까지 너무 잘 챙겨주셔서 정말 감사했어요! 와인리스트에서 적당한거 시켜봤는데 아주 굳굳입니다!! 청담 맛집, 백송에서 불금~ 완벽했네요"
1041740236,청담백송,고기집,,,"백송240 세트메뉴가 양도 정말 푸짐하고(트러플 짜파게티, 뭉티기, 한우육개장 등) 다양하게 나와서 찐 추천드려요!!! n차 방문하는데 올때마다 넘 맛있네요😍😍"
1041740236,청담백송,고기집,,,"백송240 세트메뉴가 양도 정말 푸짐하고(트러플 짜파게티, 뭉티기, 한우육개장 등) 다양하게 나와서 찐 추천드려요!!! n차 방문하는데 올때마다 넘 맛있네요😍😍"
1041740236,청담백송,고기집,,,"백송240 세트메뉴가 양도 정말 푸짐하고(트러플 짜파게티, 뭉티기, 한우육개장 등) 다양하게 나와서 찐 추천드려요!!! n차 방문하는데 올때마다 넘 맛있네요😍😍"
1041740236,청담백송,고기집,,,"벌써 세 번째 방문인데 방문 할 때 마다 만족하고 가는 청담 맛집이에요! 1++ 최고급 한우라 고기 퀄리티가 우선 너무 좋구요, 반찬들도 정갈하니 맛있었어요. 백송 240 세트 구성 너무 알차서 다음에는 부모님 모시고 또 와보려고요! 잘 먹었습니다!!"
1041740236,청담백송,고기집,,,"벌써 세 번째 방문인데 방문 할 때 마다 만족하고 가는 청담 맛집이에요! 1++ 최고급 한우라 고기 퀄리티가 우선 너무 좋구요, 반찬들도 정갈하니 맛있었어요. 백송 240 세트 구성 너무 알차서 다음에는 부모님 모시고 또 와보려고요! 잘 먹었습니다!!"
1041740236,청담백송,고기집,,,"벌써 세 번째 방문인데 방문 할 때 마다 만족하고 가는 청담 맛집이에요! 1++ 최고급 한우라 고기 퀄리티가 우선 너무 좋구요, 반찬들도 정갈하니 맛있었어요. 백송 240 세트 구성 너무 알차서 다음에는 부모님 모시고 또 와보려고요! 잘 먹었습니다!!"
1041740236,청담백송,고기집,,,부모님 생신 기념으로 방문한 백송! 기대했던 만큼 고기도 너무 맛있고 신선하고 무엇보다 직원분들께서 친절하게 구워주셔서 편하고 즐거운 시간 보내고 왔습니다💕
1041740236,청담백송,고기집,,,분위기도 좋고 청담동에서 가성비 진짜 좋은 청담 맛집 입니다
1041740236,청담백송,고기집,,,분위기도 좋고 청담동에서 가성비 진짜 좋은 청담 맛집 입니다
1041740236,청담백송,고기집,,,분위기도 좋고 청담동에서 가성비 진짜 좋은 청담 맛집 입니다
1041740236,청담백송,고기집,,,"서대살 먹고 싶을땐 무조건 백송,,💘💘 언제와도 고기 퀄리티는 좋고 딱 먹기 좋게 구워주는 센스때문에도 매번 찾게 되는 집이에요! 오늘은 짝갈빗살도 함께 했는데 서대살 만큼 육즙 풍부하고 너무 만족합니다🤍😇"
1041740236,청담백송,고기집,,,"서대살 먹고 싶을땐 무조건 백송,,💘💘 언제와도 고기 퀄리티는 좋고 딱 먹기 좋게 구워주는 센스때문에도 매번 찾게 되는 집이에요! 오늘은 짝갈빗살도 함께 했는데 서대살 만큼 육즙 풍부하고 너무 만족합니다🤍😇"
1041740236,청담백송,고기집,,,"서대살 먹고 싶을땐 무조건 백송,,💘💘 언제와도 고기 퀄리티는 좋고 딱 먹기 좋게 구워주는 센스때문에도 매번 찾게 되는 집이에요! 오늘은 짝갈빗살도 함께 했는데 서대살 만큼 육즙 풍부하고 너무 만족합니다🤍😇"
1041740236,청담백송,고기집,,,서대살도 너무 맛있고 반찬도 잘 나와서 근방 올때마다 찾게 되네요 ~! 세번째 방문입니다 추천해요 :)
1041740236,청담백송,고기집,,,서대살도 너무 맛있고 반찬도 잘 나와서 근방 올때마다 찾게 되네요 ~! 세번째 방문입니다 추천해요 :)
1041740236,청담백송,고기집,,,서대살도 너무 맛있고 반찬도 잘 나와서 근방 올때마다 찾게 되네요 ~! 세번째 방문입니다 추천해요 :)
1041740236,청담백송,고기집,,,소고기 1++ no.9 최고등급 마블링 잘 되어서 입안에서 살살 녹습니다!! ㅠㅠ 고기도 맛있게 구워줘서 편하게 식사할 수 있고요
1041740236,청담백송,고기집,,,소고기 1++ no.9 최고등급 마블링 잘 되어서 입안에서 살살 녹습니다!! ㅠㅠ 고기도 맛있게 구워줘서 편하게 식사할 수 있고요
1041740236,청담백송,고기집,,,소고기 1++ no.9 최고등급 마블링 잘 되어서 입안에서 살살 녹습니다!! ㅠㅠ 고기도 맛있게 구워줘서 편하게 식사할 수 있고요
1041740236,청담백송,고기집,,,손님들과 함께 처음 방문해봤는데 너무너무 맛있고 서비스도 좋았어요! 꼭 추천합니다 🫶🏻
1041740236,청담백송,고기집,,,아이와 함께오면 아이 식사도 따로챙겨주고 너무좋네요. 맛있게 먹었습니다 또 방문할게요
1041740236,청담백송,고기집,,,암전이때문에 자궁적출수술예약하고 왔는데..기분꿀꿀해있었는데
1041740236,청담백송,고기집,,,암전이때문에 자궁적출수술예약하고 왔는데..기분꿀꿀해있었는데
1041740236,청담백송,고기집,,,암전이때문에 자궁적출수술예약하고 왔는데..기분꿀꿀해있었는데
1041740236,청담백송,고기집,,,여기 고기 너무 맛있고 친절하세요 다 구워주셔서 먹기 편해용~~~
1041740236,청담백송,고기집,,,여러부위를 주문할 수 있는 240 메뉴가 잘되어있는데 이번엔 단품으로 주문!
1041740236,청담백송,고기집,,,"예약하고 10분 일찍 도착했는데 바로 자리 안내해주셨고, 고기의 신선도도 좋고 맛있어요"
1041740236,청담백송,고기집,,,인테리어도 깔끔하고 주차 발렛도 가능하고 밑반찬도 맛있고 고기도 맛있네용! 딱 맛있게 구워주셔요😛
