가게ID,가게명,업종,평점,날짜,리뷰내용
18444969,맥도날드 구로디지털햄버거,양식,,,"구로디지털단지 쪽에서 점심을 해결하려고 맥도날드 구로디지털점에 들렀습니다. M오더로 **빅맥(0.5만원)**을 주문했더니 매장에 도착하자마자 바로 받아갈 수 있어 정말 편리했습니다. 오피스 건물 1층에 위치해 있어 찾기도 쉽고, 내부는 깔끔하게 관리되어 있었으며 좌석 간 간격이 넓어 혼밥도 부담 없었습니다."
18444969,맥도날드 구로디지털햄버거,양식,,,극강의 가성비 디저트 맥도날드 선데이입니다. 점심 마치고 기온도 좀 더 오르고 시원한 것이 땡겨 들렀습니다. 딸기도 맛있고 초코도 맛있고.
18444969,맥도날드 구로디지털햄버거,양식,,,다만 소스가 많아 먹다보면 햄버거 형태를 잃어버려요
18444969,맥도날드 구로디지털햄버거,양식,,,"리뷰 3,441사진 4,967팔로워 100"
18444969,맥도날드 구로디지털햄버거,양식,,,매장이 넓지만 항상 사람이 많아서 앱으로 오더해서 픽업해서 먹어요! 직원분들 다 너무 친절하시고 좋아요
18444969,맥도날드 구로디지털햄버거,양식,,,맥도날드 치즈버거 진짜 왜 존맛탱이지ㅡㅡ 넘맛잇어여
18444969,맥도날드 구로디지털햄버거,양식,,,"맥도날드는 치킨머핀, 맥플러리, 맥윙이 젤 맛있는것 같아요"
18444969,맥도날드 구로디지털햄버거,양식,,,"밤늦게 문연식당이 많지 않차나요,,여긴 24시라 너무 좋음 감튀 바로튀겨줬나봐여 너무 맛있음! 다이어트한다고 6개월만에 햄버거 먹는데..다이어트 망할삘.. 햄버거 소스도 넉넉히 들어있고 좋았어요 어디점은 진짜 찔끔 넣어주는데도 있거든요! 뭐든 적당히 좋아용😁😁😁잘먹고갑니다"
18444969,맥도날드 구로디지털햄버거,양식,,,밤에 방문예약 없이 이용대기 시간 바로 입장친목친구
18444969,맥도날드 구로디지털햄버거,양식,,,"송정역점 방문했었는데 M오더로 주문해서 그런가 다른지점으로 나오네요🥲 김포공항 첫비행기 밤샘하기 좋아요, 화장실도 깔끔하고 밤샘하시는 분들 많아 새벽에 어두울때 위험하게 혼자 공항 이동하지않아도 되구요 !"
18444969,맥도날드 구로디지털햄버거,양식,,,신제품 맥피즈 완전 시원하고 맛있어요!
18444969,맥도날드 구로디지털햄버거,양식,,,"아이스크림은 정말 맛있는데, 콘은 이렇게 맛없는 콘도 없는것 같아요. 불량식품 딱 그 느낌. 그래도 아이스크림이 맛있고 1,400원이라는 가성비가 너무 좋아 종종 들르는 편인데, 일행 얘기를 들어보니 예전엔 300원 했던적도 있다네요???? 도대체 언제 그랬는지 ㄷㄷㄷ"
18444969,맥도날드 구로디지털햄버거,양식,,,아침에 방문예약 없이 이용대기 시간 바로 입장데이트연인・배우자
18444969,맥도날드 구로디지털햄버거,양식,,,아침에 방문예약 없이 이용대기 시간 바로 입장데이트연인・배우자
18444969,맥도날드 구로디지털햄버거,양식,,,아침에 방문예약 없이 이용대기 시간 바로 입장일상아이
18444969,맥도날드 구로디지털햄버거,양식,,,아침에 방문예약 없이 이용대기 시간 바로 입장일상연인・배우자
18444969,맥도날드 구로디지털햄버거,양식,,,"아침에 방문예약 없이 이용대기 시간 바로 입장일상연인・배우자, 아이"
18444969,맥도날드 구로디지털햄버거,양식,,,아침에 방문예약 없이 이용대기 시간 바로 입장일상혼자
18444969,맥도날드 구로디지털햄버거,양식,,,아침에 방문예약 없이 이용대기 시간 바로 입장혼자
18444969,맥도날드 구로디지털햄버거,양식,,,아침에 방문예약 후 이용대기 시간 바로 입장일상연인・배우자
18444969,맥도날드 구로디지털햄버거,양식,,,야근할때마다 여기서 햄버거 🍔 먹고 열심히 일하고 있습니다 😀
18444969,맥도날드 구로디지털햄버거,양식,,,자주 점심 먹으러 와요 ㅎㅎ 디저트만 먹어도 행복합니다 👍🏼
18444969,맥도날드 구로디지털햄버거,양식,,,저녁에 방문예약 없이 이용대기 시간 바로 입장데이트연인・배우자
18444969,맥도날드 구로디지털햄버거,양식,,,저녁에 방문예약 없이 이용대기 시간 바로 입장데이트연인・배우자
18444969,맥도날드 구로디지털햄버거,양식,,,저녁에 방문예약 없이 이용대기 시간 바로 입장데이트연인・배우자
18444969,맥도날드 구로디지털햄버거,양식,,,저녁에 방문예약 없이 이용대기 시간 바로 입장데이트친구
18444969,맥도날드 구로디지털햄버거,양식,,,"저녁에 방문예약 없이 이용대기 시간 바로 입장여행, 일상"
18444969,맥도날드 구로디지털햄버거,양식,,,저녁에 방문예약 없이 이용대기 시간 바로 입장일상아이
18444969,맥도날드 구로디지털햄버거,양식,,,저녁에 방문예약 없이 이용대기 시간 바로 입장일상연인・배우자
18444969,맥도날드 구로디지털햄버거,양식,,,저녁에 방문예약 없이 이용대기 시간 바로 입장일상친구
18444969,맥도날드 구로디지털햄버거,양식,,,저녁에 방문예약 없이 이용대기 시간 바로 입장일상혼자
18444969,맥도날드 구로디지털햄버거,양식,,,저녁에 방문예약 없이 이용대기 시간 바로 입장친목친구
18444969,맥도날드 구로디지털햄버거,양식,,,저녁에 방문예약 후 이용대기 시간 바로 입장
18444969,맥도날드 구로디지털햄버거,양식,,,점심 마치고 일행들과 시원한 아이스크림을 먹고자 바로 근처의 맥도날드 구로디지털점에 들렀습니다. 맥도날드 소프트 아이스크림 가성비 좋은 것이야 두 말 하면 잔소리죠.
18444969,맥도날드 구로디지털햄버거,양식,,,점심에 방문예약 없이 이용대기 시간 30분 이내일상지인・동료
18444969,맥도날드 구로디지털햄버거,양식,,,점심에 방문예약 없이 이용대기 시간 바로 입장데이트연인・배우자
18444969,맥도날드 구로디지털햄버거,양식,,,점심에 방문예약 없이 이용대기 시간 바로 입장데이트연인・배우자
18444969,맥도날드 구로디지털햄버거,양식,,,점심에 방문예약 없이 이용대기 시간 바로 입장일상
18444969,맥도날드 구로디지털햄버거,양식,,,점심에 방문예약 없이 이용대기 시간 바로 입장일상지인・동료
18444969,맥도날드 구로디지털햄버거,양식,,,점심에 방문예약 없이 이용대기 시간 바로 입장일상친구
18444969,맥도날드 구로디지털햄버거,양식,,,점심에 방문예약 없이 이용대기 시간 바로 입장일상혼자
18444969,맥도날드 구로디지털햄버거,양식,,,점심에 방문예약 후 이용대기 시간 30분 이내데이트연인・배우자
18444969,맥도날드 구로디지털햄버거,양식,,,점심에 방문포장·배달 이용대기 시간 10분 이내 일상
18444969,맥도날드 구로디지털햄버거,양식,,,점심에 방문포장·배달 이용대기 시간 10분 이내 일상혼자
18444969,맥도날드 구로디지털햄버거,양식,,,"제가 맥날에서 쏠때는 가장 기본 콘 아이스크림으로, 얻어먹을땐 무려 오레오 맥플러리를 선택해 부끄러운 맘을 감출 수 없었지만, 달달하고 시원한 맥플러리를 한 입 먹자마자 그저 미소만 한 가득"
18444969,맥도날드 구로디지털햄버거,양식,,,창녕갈릭치킨버거 나와서 런치체트로 주문했습니다 맛있어요
18444969,맥도날드 구로디지털햄버거,양식,,,한입 물면 미늘향이 확 너요 맛있어요!!
18444969,맥도날드 구로디지털햄버거,양식,,,항상 친절하셔서 기분이 좋아요. 매장도 방문했던 맥날 중 가장 깨끗합니당
1028864818,브런치빈 구로항동점,양식,,,"가성비 맛집이에요, 아이 등원시키고 주3회는 와서 아침겸 브런치 먹고가는데 배불르고 좋아요ㅎㅎ"
1028864818,브런치빈 구로항동점,양식,,,고객님께서 주신 리뷰에 힘입어 더욱 열심히 조리하고 더욱 맛있는 음식을 보내드릴 수 있도록 노력하겠습니다.
1028864818,브런치빈 구로항동점,양식,,,고객님께서 주신 리뷰에 힘입어 더욱 열심히 조리하고 더욱 맛있는 음식을 보내드릴 수 있도록 노력하겠습니다.
1028864818,브런치빈 구로항동점,양식,,,고객님께서 주신 리뷰에 힘입어 더욱 열심히 조리하고 더욱 맛있는 음식을 보내드릴 수 있도록 노력하겠습니다.
1028864818,브런치빈 구로항동점,양식,,,고객님께서 주신 리뷰에 힘입어 더욱 열심히 조리하고 더욱 맛있는 음식을 보내드릴 수 있도록 노력하겠습니다.
1028864818,브런치빈 구로항동점,양식,,,고객님께서 주신 리뷰에 힘입어 더욱 열심히 조리하고 더욱 맛있는 음식을 보내드릴 수 있도록 노력하겠습니다.
1028864818,브런치빈 구로항동점,양식,,,고객님께서 주신 리뷰에 힘입어 더욱 열심히 조리하고 더욱 맛있는 음식을 보내드릴 수 있도록 노력하겠습니다.
1028864818,브런치빈 구로항동점,양식,,,"리코타샐러드는 처음 시켰는데 너무 맛있어 보여요 ㅎㅎ 파스타도 제일 맛있어요, 지인이랑 오기 너무 좋아서 자주 와요~"
1028864818,브런치빈 구로항동점,양식,,,병원이 근처라 병원다녀오고 아이들 스파게티생각나면 늘 오는곳이 여기에요
1028864818,브런치빈 구로항동점,양식,,,브런치빈 너무 좋아해요~ 항동점 처음 와봤는데 분위기도 좋구 메뉴들 다 맛있어요~ 아이들도 엄청 맛있다며 폭풍 먹방하고 갑니다
1028864818,브런치빈 구로항동점,양식,,,"브런치빈에서 점심으로 김치필라프와 들기름 참나물 파스타를 먹었어요. 김치필라프는 매콤하면서도 담백한 맛이 잘 어우러져 입맛을 돋웠고, 고슬고슬한 밥이 인상적이었어요. 들기름 참나물 파스타는 고소한 향이 입안 가득 퍼지며 부드럽고 깔끔했어요. 둘 다 자극적이지 않아 부담 없이 즐길 수 있었고, 분위기도 아늑해서 여유롭게 식사하기 좋았어요. 재방문 의사 있어요!"
1028864818,브런치빈 구로항동점,양식,,,브런치빈은 메뉴가 다양해서 여러 사람이 와서 하나씩 시켜서 나눠먹기에도 좋고 하나씩 도장깨기 하기에도 좋아요!
1028864818,브런치빈 구로항동점,양식,,,수목원 산책 하고 파스타 먹으러 온 곳. 브런치가게여서 11시에 와도 테이블이 반정도 차 있었다. 넓은창이 있어 매장이 넓고 시원해보였고 쉬림프 알리오올리오 파스타도 매콤하고 맛있었다~ 오늘은 혼자 였지만 동네친구와 한번 더 방문예정이다^^
1028864818,브런치빈 구로항동점,양식,,,아이와 먹을거라 파스타 안맵게 주문했는데 너무 맛있고 샐러드는 항상 푸짐하고 맛있습니다. 아이와 오기 너무좋아요.
1028864818,브런치빈 구로항동점,양식,,,아이와 방문했습니다. 파스타가 너무 맛있다고 혼자 다 흡입했네요. 매콤한 피자가 먹고 싶다해서 페퍼로니피자 주문했는데 느끼하지 않고 넘 맛나게 잘 먹었습니다^^
1028864818,브런치빈 구로항동점,양식,,,아침에 방문예약 없이 이용대기 시간 바로 입장데이트연인・배우자
1028864818,브런치빈 구로항동점,양식,,,아침에 방문예약 없이 이용대기 시간 바로 입장데이트연인・배우자
1028864818,브런치빈 구로항동점,양식,,,아침에 방문예약 없이 이용대기 시간 바로 입장데이트연인・배우자
1028864818,브런치빈 구로항동점,양식,,,아침에 방문예약 없이 이용대기 시간 바로 입장친목지인・동료
1028864818,브런치빈 구로항동점,양식,,,앞으로도 항상 최상의 맛과 서비스를 제공할 수 있도록 더욱 노력하겠습니다.
1028864818,브런치빈 구로항동점,양식,,,앞으로도 항상 최상의 맛과 서비스를 제공할 수 있도록 더욱 노력하겠습니다.
1028864818,브런치빈 구로항동점,양식,,,앞으로도 항상 최상의 맛과 서비스를 제공할 수 있도록 더욱 노력하겠습니다.
1028864818,브런치빈 구로항동점,양식,,,앞으로도 항상 최상의 맛과 서비스를 제공할 수 있도록 더욱 노력하겠습니다.
1028864818,브런치빈 구로항동점,양식,,,앞으로도 항상 최상의 맛과 서비스를 제공할 수 있도록 더욱 노력하겠습니다.
1028864818,브런치빈 구로항동점,양식,,,앞으로도 항상 최상의 맛과 서비스를 제공할 수 있도록 더욱 노력하겠습니다.
1028864818,브런치빈 구로항동점,양식,,,여기만한곳이 없습니다 ㅋ 시원하고 넓고 가성비 좋아요. 오늘은 오랫만에 치킨토스트!!
1028864818,브런치빈 구로항동점,양식,,,예약했더니 룸으로 안내해주시고 음식도 너무 맛있었습니다!
1028864818,브런치빈 구로항동점,양식,,,음식이 맛있고 특히 맵지않아 아이들과 먹기도 좋고 인테리어도 멋져 자주 옵니다!!♡
1028864818,브런치빈 구로항동점,양식,,,이전에 방문했을때 좋았어서 부모님 모시고 오랜만에 왔는데 여전히 좋았어요! 11시 반쯤 이른 시간에 방문했더니 대기도 없고 조용하고 주차도 편해서 좋았습니당 ㅎ.ㅎ
1028864818,브런치빈 구로항동점,양식,,,재 방문 시에도 소중한 리뷰 받을 수 있도록 더욱 발전하는 브런치빈이 되겠습니다.
1028864818,브런치빈 구로항동점,양식,,,재 방문 시에도 소중한 리뷰 받을 수 있도록 더욱 발전하는 브런치빈이 되겠습니다.
1028864818,브런치빈 구로항동점,양식,,,재 방문 시에도 소중한 리뷰 받을 수 있도록 더욱 발전하는 브런치빈이 되겠습니다.
1028864818,브런치빈 구로항동점,양식,,,재 방문 시에도 소중한 리뷰 받을 수 있도록 더욱 발전하는 브런치빈이 되겠습니다.
1028864818,브런치빈 구로항동점,양식,,,재 방문 시에도 소중한 리뷰 받을 수 있도록 더욱 발전하는 브런치빈이 되겠습니다.
1028864818,브런치빈 구로항동점,양식,,,재 방문 시에도 소중한 리뷰 받을 수 있도록 더욱 발전하는 브런치빈이 되겠습니다.
1028864818,브런치빈 구로항동점,양식,,,재 방문 시에도 소중한 리뷰 받을 수 있도록 더욱 발전하는 브런치빈이 되겠습니다.
1028864818,브런치빈 구로항동점,양식,,,재 방문시 에도 감사한 마음 잊지 않고 더 나은 맛과 서비스로 찾아뵐테니 자주 자주 찾아주세요!!
1028864818,브런치빈 구로항동점,양식,,,재 방문시 에도 감사한 마음 잊지 않고 더 나은 맛과 서비스로 찾아뵐테니 자주 자주 찾아주세요!!
1028864818,브런치빈 구로항동점,양식,,,재 방문시 에도 감사한 마음 잊지 않고 더 나은 맛과 서비스로 찾아뵐테니 자주 자주 찾아주세요!!
1028864818,브런치빈 구로항동점,양식,,,재 방문시 에도 감사한 마음 잊지 않고 더 나은 맛과 서비스로 찾아뵐테니 자주 자주 찾아주세요!!
1028864818,브런치빈 구로항동점,양식,,,재 방문시 에도 감사한 마음 잊지 않고 더 나은 맛과 서비스로 찿아뵐테니 자주 자주 찾아주세요!!
1028864818,브런치빈 구로항동점,양식,,,점심에 방문예약 없이 이용대기 시간 바로 입장가족모임부모님
1028864818,브런치빈 구로항동점,양식,,,점심에 방문예약 없이 이용대기 시간 바로 입장가족모임아이
1028864818,브런치빈 구로항동점,양식,,,점심에 방문예약 없이 이용대기 시간 바로 입장일상아이
1028864818,브런치빈 구로항동점,양식,,,점심에 방문예약 없이 이용대기 시간 바로 입장일상아이
1028864818,브런치빈 구로항동점,양식,,,점심에 방문예약 없이 이용대기 시간 바로 입장일상연인・배우자
1028864818,브런치빈 구로항동점,양식,,,"점심에 방문예약 후 이용대기 시간 바로 입장친목지인・동료, 아이"
1028864818,브런치빈 구로항동점,양식,,,추석 연휴때 부모님하고 브런치 먹으러 왔는데 너무 푸짐하고 맛있어요!! 두 분 다 너무 좋아하시고 매장 분위기도 쾌적해서 추천합니다!!👍🏻👍🏻👍🏻
1028864818,브런치빈 구로항동점,양식,,,"탱글한 새우가 넉넉하게 들어가 있었고, 마늘향이 진하게 퍼지는 오일 파스타! 살짝 매콤한 맛이 입맛을 돋워서 느끼함 없이 깔끔하게 먹었어요. 오일리한 파스타 좋아하시는 분께 강추"
1028864818,브런치빈 구로항동점,양식,,,플래터는 이것저것 다양해서 다이어트 하는 나로썬 왕만족👍
1440763500,브런치빈 신도림점,양식,,,가성비와 맛이 뛰어납니다 플래터와 바질페스토파스타 훌륭하고 치킨샐러드는 치킨 스테이크라 해도 무방. 다만 요리외 모든것이 셀프이며 번잡
1440763500,브런치빈 신도림점,양식,,,"가족끼리 와서, 정말 맛있게 먹었습니다. 엄마도 만족스러워 하셨어요. 또 올게요!"
1440763500,브런치빈 신도림점,양식,,,"가족끼리 와서, 정말 맛있게 먹었습니다. 엄마도 만족스러워 하셨어요. 또 올게요!"
1440763500,브런치빈 신도림점,양식,,,너무 맛있어서 자주 와요~~~ 가성비도 좋고 음식 맛도 좋습니다 ^*^
1440763500,브런치빈 신도림점,양식,,,"도림천 운동하고 브런치 먹으러 들어왔는데, 맛도 좋고 가성비도 좋고 주말 여유로운 식사로 딱 이예요~~"
1440763500,브런치빈 신도림점,양식,,,많은 지점을 가봤지만 브런치빈은 신도림점이 너무너무 좋아요~~💕
1440763500,브런치빈 신도림점,양식,,,많은 지점을 가봤지만 브런치빈은 신도림점이 너무너무 좋아요~~💕
1440763500,브런치빈 신도림점,양식,,,베트남에서 온 친구도 한국 와서 먹은 음삭 중 제일 맛있었단다.
1440763500,브런치빈 신도림점,양식,,,브런치빈 방문했어요~!! 파스타 넘 맛있고 단호박뇨끼도 달지않아 깔끔해서 조아용❤️ 점심 브런치로 완전 추천입니다~! 가격도 완전 가성비라 좋아요!!!
1440763500,브런치빈 신도림점,양식,,,브런치빈은 파주 본점 하나 있을 때 방문한 것을 계기로 모임 때 주기적으로 찾게되는 브랜드다.
1440763500,브런치빈 신도림점,양식,,,브런치인 만큼 가격대도 있기는 하지만 맛에서 결코 나쁘지 않는 가격이라고 할수 있겠어요.
1440763500,브런치빈 신도림점,양식,,,사람이 좀 많은 편이지만 웨이팅은 안했어요 역이랑 가까운 음식점 찾다다 왔는데 가성비가 좋고 맛도 좋아요! 라구는 면도 일반 스파게티 면을 무료로 바꾸는게 가능하더라구요 근처 오시면 들려보세용👍👍
1440763500,브런치빈 신도림점,양식,,,선택한 메뉴도 보기에도 먹음직하고 맛도 정말 좋아요~^^
1440763500,브런치빈 신도림점,양식,,,신도림 브런치빈 언제와도 음식이 맛있고 퀄리티가 좋아요!! 갓성비대박💜💜 n번째 방문하는 맛집입니다!!
1440763500,브런치빈 신도림점,양식,,,신도림 브런치빈 언제와도 음식이 맛있고 퀄리티가 좋아요!! 갓성비대박💜💜 n번째 방문하는 맛집입니다!!
1440763500,브런치빈 신도림점,양식,,,신도림역 브런치 카페 브런치빈 매우 맛있고 양도 푸짐합니다. 평소 많이 먹는 대식가인데 브런치 빈에서는 1인분도 넉넉하네요. 고기도 바삭하고 촉촉합니다. 또 와서 먹을 의사 100% 입니다.
1440763500,브런치빈 신도림점,양식,,,아이와 주말마다 자주 방문하는 곳입니다. 편하게 오기 좋고
1440763500,브런치빈 신도림점,양식,,,"아침에 방문예약 없이 이용대기 시간 바로 입장일상아이, 연인・배우자"
1440763500,브런치빈 신도림점,양식,,,"아침에 방문예약 없이 이용대기 시간 바로 입장친목, 일상아이, 친척・형제"
1440763500,브런치빈 신도림점,양식,,,"아침에 방문예약 없이 이용대기 시간 바로 입장친목부모님, 친구"
1440763500,브런치빈 신도림점,양식,,,"아침에 방문예약 없이 이용대기 시간 바로 입장친목부모님, 친구"
1440763500,브런치빈 신도림점,양식,,,아침에 방문예약 없이 이용대기 시간 바로 입장친목친구
1440763500,브런치빈 신도림점,양식,,,역 근처에 있어서 접근성이 좋고 메뉴가 진짜 다양해요!
1440763500,브런치빈 신도림점,양식,,,원래 다니던 곳이어서 음식은 알지만 인테리어는 신도림이 제일 좋네요
1440763500,브런치빈 신도림점,양식,,,자주 오는 브런치 카페예요. 양도 푸짐하고 맛도 있어요~ 특히 스파게티가 맛나요^^ 강추!!!!
1440763500,브런치빈 신도림점,양식,,,"저녁에 방문예약 없이 이용대기 시간 바로 입장기념일, 일상연인・배우자, 아이"
1440763500,브런치빈 신도림점,양식,,,저녁에 방문예약 없이 이용대기 시간 바로 입장일상아이
1440763500,브런치빈 신도림점,양식,,,저녁에 방문예약 없이 이용대기 시간 바로 입장일상아이
1440763500,브런치빈 신도림점,양식,,,저녁에 방문예약 없이 이용대기 시간 바로 입장친목친구
1440763500,브런치빈 신도림점,양식,,,적당한 가격대와 푸짐한 음식이 좋아요 여기근처에 이정도 퀄리티 브런치카페는 없는 것 같아요!
1440763500,브런치빈 신도림점,양식,,,점심에 방문예약 없이 이용대기 시간 10분 이내 가족모임친척・형제
1440763500,브런치빈 신도림점,양식,,,점심에 방문예약 없이 이용대기 시간 10분 이내 가족모임친척・형제
1440763500,브런치빈 신도림점,양식,,,점심에 방문예약 없이 이용대기 시간 바로 입장가족모임부모님
1440763500,브런치빈 신도림점,양식,,,"점심에 방문예약 없이 이용대기 시간 바로 입장가족모임부모님, 아이"
1440763500,브런치빈 신도림점,양식,,,점심에 방문예약 없이 이용대기 시간 바로 입장데이트연인・배우자
1440763500,브런치빈 신도림점,양식,,,점심에 방문예약 없이 이용대기 시간 바로 입장데이트친구
1440763500,브런치빈 신도림점,양식,,,점심에 방문예약 없이 이용대기 시간 바로 입장데이트친구
1440763500,브런치빈 신도림점,양식,,,점심에 방문예약 없이 이용대기 시간 바로 입장데이트친구
1440763500,브런치빈 신도림점,양식,,,점심에 방문예약 없이 이용대기 시간 바로 입장친목지인・동료
1440763500,브런치빈 신도림점,양식,,,점심에 방문예약 없이 이용대기 시간 바로 입장친목친척・형제
1440763500,브런치빈 신도림점,양식,,,점심에 방문예약 없이 이용대기 시간 바로 입장친목친척・형제
1440763500,브런치빈 신도림점,양식,,,점심에 방문예약 후 이용대기 시간 바로 입장나들이아이
1440763500,브런치빈 신도림점,양식,,,점심에 방문예약 후 이용대기 시간 바로 입장나들이아이
1440763500,브런치빈 신도림점,양식,,,종종 가족과 함께옵니다! 부모님과 함께와도 좋구요. 가격도 합리적이라 좋아요. 가격에 비해 음식의 퀄리티도 꽤 높은 것같아요. 주말에 오면 사람이 좀 많아요. 그래서 웨이팅이 종종 있는데 약간 점심 전후로 찾아오니 딱맞더라구요!! 신도림에서 영업 오래해서 편하게 방문할 수 있으면 좋겠어요!
1440763500,브런치빈 신도림점,양식,,,주기적으로 오는 브런치빈입니다~ 가격도 좋지만 음식이 너무 맛있어요^^ 메뉴 하나하나 다 맛있습니다 ㅎㅎㅎ
1440763500,브런치빈 신도림점,양식,,,체인점이지만 맛있는 개인브런치점과 다를바없이 맛있어요. 둘이 심플셋트 먹으면서 다음에는 또 뭐 시켜먹을지 메뉴판을 들추게하는 기대감을 주는 곳이예요.
1440763500,브런치빈 신도림점,양식,,,커피도 맛있고 해비하지 않으면서도 맛있는 다이어트용 음식도 있어서 좋아요♡♡특히 부리타샐러드파스타는 진리입니다
1440763500,브런치빈 신도림점,양식,,,"폭우에 비피해…심란도 하지만, 이미 정해진 모임, 친구가 드뎌 사위를 본다는 소식과 함께 밀린 이야기에 맛있는 음식들이 어울어져 행복한 시간을 보냈다."
1440763500,브런치빈 신도림점,양식,,,"폭우에 비피해…심란도 하지만, 이미 정해진 모임, 친구가 드뎌 사위를 본다는 소식과 함께 밀린 이야기에 맛있는 음식들이 어울어져 행복한 시간을 보냈다."
1440763500,브런치빈 신도림점,양식,,,플래터랑 파스터랑 다 너무 맛있어요 청모하기도 너무 좋은 곳이에용!!
