가게ID,가게명,평점,날짜,리뷰내용
1130071510,오비스트로,,,매장방문 정말 감사합니다 ㅎㅎ 다음에도 더맛있게준비할게요 ㅎㅎ 행복하세요😆😆
1130071510,오비스트로,,,몇년전에 맛집 알아보다 우연히 방문했는데 맛있게 먹었던 기억이 있어 짝꿍이라 다시 왔어요~ 골목에 위치해 있어 찾는 재미도 있고 시금치뇨끼가 베스트에요~ 살치살스테이크도 부드럽고 맛 좋아요😋
1130071510,오비스트로,,,방문주셔서 정말 감사해요 다음에도 더맛있게해드릴게요 행복한 날만 가득하세요🥰🥰
1130071510,오비스트로,,,분위기 너무 좋고 이쁜 곳이에요!! 음식두 넘 맛나고 데이트하고 기분내고 싶을 때 오기 너무 좋아요~~! 구로동에 이런 멋진 곳이 있어 정말 좋아요!!
1130071510,오비스트로,,,분위기 너무 좋구용 사장님이랑 직원분 너무 친절하세요!! 리가토니가 제일 맛있었어요 밥말아먹고싶은 맛☺️
1130071510,오비스트로,,,사진만 보고 어디가서든 볼 수 있는 양식 맛 정도라고 생각했던 저를 혼내고 싶습니다. 좀 더 업그레이드 된 맛을 느낄 수 있어요 ㅠㅠ 맛 하나하나 풍미 있고 깊이 있습니다.. 다음에도 다른 메뉴 먹으러 오고 싶어요!
1130071510,오비스트로,,,소중한 저녁 식사를 저희 가게와 함께해 주셔서 정말 감사해요 ^^
1130071510,오비스트로,,,스테이크도 따뜻할때 먹으니까 넘 맛있고 감자랑 버섯도ㅜㅜ 맛있었어요 양이 적을줄 알았는데 둘이 배부르게 먹었습니당
1130071510,오비스트로,,,시저샐러드 채소가 약간 시들거나 상한 끝부분 잘라내어 주셨으면 더 좋았을 것 같아요!ㅠ
1130071510,오비스트로,,,안녕하세요 오비스트로 입니다😀😀 마르게리따 랑 양송이리가토니 드셨네요 🙏사진도 너무 잘 찍어 주시고 맛있게 드셨다니 너무 다행이에요!! 다음에 오셨을 때도 더 맛있고 친절한 서비스로 보답 드릴게요 행복하세요😀😀🍀🍀
1130071510,오비스트로,,,양도 많고 재료를 아끼지않네요! 피자에 치즈도 두툼하고 도우 쫄깃하고 담백하니 너무 맛있어요 파스타도 느끼하지않고 담백한편이에요 맛있습니다
1130071510,오비스트로,,,언제오셔도 맛있게 준비하겠습니다 행복한 날만 가득하세요^^
1130071510,오비스트로,,,오비스트로에서 쉬림프 로제 파스타와 감자 트러플 피자를 먹었는데 정말 만족스러웠어요. 로제 파스타는 소스가 진하고 새우도 통통해서 풍미가 아주 좋았어요. 감자 트러플 피자는 부드러운 감자와 고소한 트러플 향이 어우러져 계속 손이 가더라고요. 매장 분위기도 깔끔하고 쾌적해서 식사 내내 기분이 좋았어요. 무엇보다 직원분들이 친절하게 응대해주셔서 더 기분 좋은 식사였습니다. 음식뿐만 아니라 서비스까지 신경 쓰는 게 느껴졌어요. 다음에는 다른 메뉴도 도전해보고 싶어요!
1130071510,오비스트로,,,와이프랑 방문해서 먹었는데 뇨끼 진짜 너무 맛있어요ㅠㅠ 다음에 오면 피자도 먹을래요...
1130071510,오비스트로,,,외관은 여느 양식집과 다를 게 없다고 느꼈으나 안으로 들어오니 아늑하고 포근한 느낌을 주는 인테리어가 눈을 끌었다.
1130071510,오비스트로,,,우선 구청근처에 이런 분위기좋은 장소가 있다는게 너무 좋은건 둘째치고 너무 맛있어요!!!재료도 신선하고 맛이 강하지않아서 더 좋은거 같아요!!!다음에는 부모님이랑 와서 식사하고 싶네요☺️☺️
1130071510,오비스트로,,,이사와서 처음 가봤는데 메뉴들이 다 너무 맛있어요~~특히 트러플 리조또 넘 맛나요 친절하고 가게도 예뻐요 다음에 또올게요!
1130071510,오비스트로,,,잠봉에그피자?랑 봉골레파스타 먹었는데 피자 치즈가 너무 맛있고 도우랑 피자 끝부분까지 쫀득해서 너무 맛있었어요!!! 잠봉에그피자는 슴슴한데 잠봉이 짭짤해서 맛있었고 봉골레파스타는 조개맛이 잘 나서 좋았어용 ~ 쪼오금만 더 걸쭉했으면 더 맛있었을 것 같아요!!!! 양도 많고 맛있었습니다 ㅎㅎ
1130071510,오비스트로,,,저녁에 방문예약 없이 이용대기 시간 바로 입장데이트연인・배우자
1130071510,오비스트로,,,저녁에 방문예약 없이 이용대기 시간 바로 입장일상연인・배우자
1130071510,오비스트로,,,저녁에 방문예약 후 이용대기 시간 바로 입장친목지인・동료
1130071510,오비스트로,,,저번에도 와서 맛있어서 또 왔는데 다른 메뉴들도 맛있어요! 주변에 양식집 많이 없는데 맛집 있어서 좋아요🥺🤍🤍사진은 못찍었는데 피자도 넘 맛있어요!
1130071510,오비스트로,,,점심에 방문대기 시간 바로 입장친목지인・동료
1130071510,오비스트로,,,"점심에 방문예약 없이 이용대기 시간 바로 입장데이트, 친목친구"
1130071510,오비스트로,,,점심에 방문예약 없이 이용대기 시간 바로 입장데이트연인・배우자
1130071510,오비스트로,,,점심에 방문예약 없이 이용대기 시간 바로 입장데이트연인・배우자
1130071510,오비스트로,,,점심에 방문예약 없이 이용대기 시간 바로 입장데이트연인・배우자
1130071510,오비스트로,,,점심에 방문예약 없이 이용대기 시간 바로 입장데이트연인・배우자
1130071510,오비스트로,,,점심에 방문예약 없이 이용대기 시간 바로 입장일상연인・배우자
1130071510,오비스트로,,,점심에 방문예약 없이 이용대기 시간 바로 입장친목친구
1130071510,오비스트로,,,점심에 방문예약 없이 이용대기 시간 바로 입장친목친척・형제
1130071510,오비스트로,,,정말 감사합니다 다음에도 더 맛있고 친절한 서비스로 보답 드리겠습니다 행복하세요 ^^
1130071510,오비스트로,,,"좋은 일, 축하할 일 있으면 시간내서 찾아오는 집 근처 맛있는 파스타집입니다. 잠봉뵈르 좋아해서 잠봉 에그 피자 도전했는데, 역시 맛있네요!"
1130071510,오비스트로,,,지인이 데려간 곳인데 이런 골목에 양식집이 있다고?! 셒었는데 진짜 있더라구요 심지어 사장님?인사해주는데 너무 친절하시더라구요 그리고 화덕피자라서 도우가 엄청 쫀쫀하니 소금빵같이 맛있어요 ㅠㅠㅠ 파스타도 맛있고 리조또도 말해 뭐해~양도 많아서 엄청 배부른데도 맛있어서 계속 들어가요 데이트나 소개팅할때 와도 좋은 구로맛집!
1130071510,오비스트로,,,직원분들께서도 너무 친절하셔서 덕분에 좋은 시간 보낼 수 있었습니다..
1130071510,오비스트로,,,"피자, 파스타 맛나요! 지인과 같이와도 다들 맛있다고 칭찬합니다ㅎ"
1130071510,오비스트로,,,"🙀 기대한 것보다 더 맛있고, 스테이크도 부드럽고 뇨끼도 쫀득해서 만족스러워요!!"
1204444725,크랩프트 신도림본점,,,개인적으로 정말 만족스럽네요. 분위기도 좋고 음식도 맛있어서 마음에 들었어요. 특히 사장님이 친절하셔서 더욱 좋았습니다.
1204444725,크랩프트 신도림본점,,,깔끔해요~ 펍 느낌 인테리어가 정말 좋았어요! 분위기 있어서 데이트하기 딱 좋더라구요. 음식들도 맛있고 맥주랑 잘 어울려서 만족스럽습니다. 사장님도 친절하시네요. 다음에 또 와야겠어요 ㅎㅎ
1204444725,크랩프트 신도림본점,,,너무 좋았어요! 분위기도 좋고 음식도 맛있어서 정말 만족스럽습니다. 특히 사장님이 친절하셔서 기분 좋게 식사했네요. 또 오고 싶어요.
1204444725,크랩프트 신도림본점,,,너무 좋았어요! 신도림역에서 걸어서 찾기도 쉽고 접근성이 정말 편리하네요. 분위기도 좋고 음식도 맛있어서 정말 만족스럽습니다. 또 오고 싶네요.
1204444725,크랩프트 신도림본점,,,너무 좋았어요! 펍 분위기의 인테리어가 정말 멋있더군요. 데이트 장소로는 완벽한 것 같아요. 분위기도 좋고 음식도 맛있어서 정말 만족스럽습니다. 또 오고 싶네요.
1204444725,크랩프트 신도림본점,,,다행히 신도림역에서 걸어서 갈 수 있는 거리라 접근성이 정말 좋았어요. 펍 스타일의 인테리어가 아늑하면서도 세련되어서 데이트 장소로 완전 만족이에요 ✨ 분위기도 좋고 음식도 맛있어서 다음에 또 오고 싶네요.
1204444725,크랩프트 신도림본점,,,다행히 신도림역에서 멀지 않은 곳에 이런 좋은 펍이 있네요! 인테리어가 정말 분위기 있어서 연인과 함께 오기 딱 좋은 것 같아요 😊 음식도 맛있고 맥주랑도 잘 어울려서 완전 만족했습니다 👍
1204444725,크랩프트 신도림본점,,,다행히 신도림역에서 멀지 않은 곳에 이런 좋은 펍이 있네요! 인테리어가 정말 분위기 있어서 연인과 함께 오기 딱 좋은 것 같아요 😊 음식도 맛있고 맥주랑도 잘 어울려서 완전 만족했습니다 👍
1204444725,크랩프트 신도림본점,,,만족스러운 곳이네요. 음식 맛도 좋고 분위기도 편안해서 추천할 만합니다. 특히 크랩프트 로제파스타 소스가 진하고 꾸덕해서 정말 좋았어요. 메뉴 구성이나 전반적인 퀄리티 모두 기대 이상이었습니다. 다시 방문하고 싶은 곳입니다.
1204444725,크랩프트 신도림본점,,,만족스러운 분위기에서 정말 좋았습니다. 맥주 한 잔 하기에 딱 좋은 곳이네요. 크랩 로제파스타 주문했는데 소스가 꾸덕하고 진해서 마음에 들었어요. 면과의 조합도 훌륭하고 잘 챙겨주시네요 😊 다음에도 또 올 것 같아요.
1204444725,크랩프트 신도림본점,,,만족스럽게 식사했습니다. 음식 퀄리티도 좋고 분위기도 편안해서 좋은 곳이네요. 특히 크랩프트 로제파스타는 소스가 진하고 꾸덕해서 정말 맛있었어요. 직원분들도 친절하시고 전체적으로 추천할 만한 곳입니다. 다음에도 또 방문하고 싶네요.
1204444725,크랩프트 신도림본점,,,만족합니다~ 펍 느낌의 인터리어가 정말 좋아서 데이트하기 딱이지요. 분위기도 아늑하고 음식도 맛있어서 좋았어요~ 다음에도 또 와야겠어요. 추천드려요~
1204444725,크랩프트 신도림본점,,,맛있는 음식과 좋은 분위기로 만족스러운 시간을 보냈어요. 펍 스타일의 인테리어가 정말 멋져서 연인과 함께 가기에 딱 좋더라고요. 음식도 맛있고 분위기도 좋아서 데이트 장소로 추천하고 싶습니다.
1204444725,크랩프트 신도림본점,,,매콤새콤한 크랩프트 로제파스타 주문했는데 소스가 진하고 꾸덕해요
1204444725,크랩프트 신도림본점,,,무엇보다 펍 같은 분위기가 마음에 들어서 데이트하기 정말 좋더라고요. 음식도 맛있고 특히 메뉴랑 맥주 조합이 잘 어울려서 만족스럽습니다. 사장님도 친절하셔서 기분 좋게 식사할 수 있었어요. 다음에도 또 올 것 같네요.
1204444725,크랩프트 신도림본점,,,베이컨과 양파 향이 잘 어울려 풍부한 맛이 났음
1204444725,크랩프트 신도림본점,,,분위기 정말 좋더라고요. 펍 느낌의 인터리어가 데이트하기에 딱이었어요. 음식도 맛있고 사장님도 친절하셔서 마음에 드네요.
1204444725,크랩프트 신도림본점,,,분위기 정말 좋더라고요. 펍 느낌의 인터리어가 데이트하기에 딱이었어요. 음식도 맛있고 사장님도 친절하셔서 마음에 드네요.
1204444725,크랩프트 신도림본점,,,"분위기가 좋았어서 친구들과 함께 즐거운 시간 보냈어요! 펍 느낌의 인테리어가 정말 멋지더라구요 ㅎㅎ 데이트하기에도 딱 좋은 분위기였고, 좋은 시간이었습니다^^"
1204444725,크랩프트 신도림본점,,,"분위기가 좋았어서 친구들과 함께 즐거운 시간 보냈어요! 펍 느낌의 인테리어가 정말 멋지더라구요 ㅎㅎ 데이트하기에도 딱 좋은 분위기였고, 좋은 시간이었습니다^^"
1204444725,크랩프트 신도림본점,,,솔직히 여기 너무 좋았어요! 펍 분위기 인테리어가 정말 멋있어서 데이트하기 딱이더라고요. 음식도 맛있고 분위기도 좋고 정말 만족스럽습니다. 또 오고 싶네요.
1204444725,크랩프트 신도림본점,,,솔직히 여기 너무 좋았어요! 펍 분위기 인테리어가 정말 멋있어서 데이트하기 딱이더라고요. 음식도 맛있고 분위기도 좋고 정말 만족스럽습니다. 또 오고 싶네요.
1204444725,크랩프트 신도림본점,,,쉬림프샐러드피자 정말 좋았어요! 새우가 탱글탱글하고 신선해서 한 입 먹자마자 맛있다는 생각이 들더라구요. 샐러드도 아삭아삭하니 깔끔해요. 친구들이랑 와서 나눠 먹기 딱 좋은 사이즈죠. 토핑들이 골고루 올라가 있어서 만족스럽습니다. 다음에 또 주문할 예정이에요.
1204444725,크랩프트 신도림본점,,,"스크린에서 나오는 영상 덕분에 눈도 즐겁고, 맛있는 음식 덕분에 입도 즐거운 완벽한 공간이에요."
1204444725,크랩프트 신도림본점,,,아늑한 분위기가 정말 마음에 드네요. 펍 느낌의 인터리어가 좋아서 연인과 함께 오기에 딱 좋더라고요. 음식도 맛있고 맥주와의 조합도 괜찮았어요. 사장님께서 친절하게 응대해주셔서 더욱 좋았습니다. 다음에도 또 방문하고 싶어요.
1204444725,크랩프트 신도림본점,,,여기는 정말 분위기가 좋더라구요. 조명도 은은하고 인테리어가 세련되게 잘 되어 있어서 마음에 들었어요. 음식도 맛있고 직원분들도 친절하시네요. 신도림 역에서 걸어가기 편한 위치라 접근성도 만족스럽습니다. 다음에 또 올 것 같아요.
1204444725,크랩프트 신도림본점,,,음식이 정말 맛있고 분위기도 좋아서 완전 만족입니다 😊 특히 크랩프트 로제파스타 소스가 진하고 꾸덕해서 너무 좋았어요! 메뉴와 맥주의 조합도 환상적이고 다음에도 재방문하고 싶네요 👍
1204444725,크랩프트 신도림본점,,,"저녁에 방문예약 없이 이용대기 시간 바로 입장가족모임, 친목아이, 친척・형제"
1204444725,크랩프트 신도림본점,,,저녁에 방문예약 후 이용대기 시간 바로 입장가족모임아이
1204444725,크랩프트 신도림본점,,,정말 만족스럽게 식사했어요. 분위기도 좋고 음식도 맛있더라고요. 특히 크랩프트 로제파스타는 소스가 진하고 꾸덕해서 정말 마음에 들었어요. 직원분들도 친절하시고 전체적으로 괜찮았습니다. 다음에 또 방문하고 싶네요.
1204444725,크랩프트 신도림본점,,,정말 만족스럽게 잘 먹었어요! 음식도 맛있고 분위기도 좋더라고요. 특히 크랩프트 로제파스타는 소스가 진하고 꾸덕해서 정말 마음에 들었습니다. 맥주와도 잘 어울리고요. 다음에 또 와서 다른 메뉴도 먹어보고 싶네요.
1204444725,크랩프트 신도림본점,,,정말 만족합니다~ 펍 느낌의 인터리어가 **정말** 멋져서 연인이랑 오기 딱 좋더라고요! 분위기 자체가 **완전** 로맨틱해서 데이트 코스로 **강력** 추천드려요~ 음식도 맛있고 직원분들도 **너무** 친절하셔서 기분 좋게 식사할 수 있었어요. 특히 조명이 **진짜** 예뻐서 사진도 **잘** 나와요 ㅎㅎ 좋았어요~
1204444725,크랩프트 신도림본점,,,정말 분위기 좋은 곳이네요! 펍 느낌의 인테리어가 정말 멋져서 데이트하기 딱 좋았어요 😊 음식도 맛있고 사장님도 친절하셔서 기분 좋게 먹고 왔습니다. 잘했네요
1204444725,크랩프트 신도림본점,,,정말 분위기 좋은 곳이네요! 펍 느낌의 인테리어가 정말 멋져서 데이트하기 딱 좋았어요 😊 음식도 맛있고 사장님도 친절하셔서 기분 좋게 먹고 왔습니다. 잘했네요
1204444725,크랩프트 신도림본점,,,정말 분위기 좋은 곳이에요. 음식도 맛있고 서비스도 만족스럽더라고요. 특히 사장님이 친절하셔서 기분 좋게 식사할 수 있었어요. 다음에도 또 방문하고 싶네요.
1204444725,크랩프트 신도림본점,,,정말 좋네요. 음식도 맛있고 분위기도 괜찮아서 만족스러워요. 특히 크랩프트 로제파스타 소스가 진하고 꾸덕해서 좋더라고요. 친구들이랑 또 오고 싶네요. 좋았어요.
1204444725,크랩프트 신도림본점,,,정말 좋았습니다! 메뉴와 맥주의 조합이 정말 잘 맞더라고요 😊 다양한 맥주와 함께 먹으니 더욱 맛있게 느껴졌어요. 사장님도 잘 챙겨주시네요. 마음에 들었어요.
1204444725,크랩프트 신도림본점,,,정말 좋았습니다! 메뉴와 맥주의 조합이 정말 잘 맞더라고요 😊 다양한 맥주와 함께 먹으니 더욱 맛있게 느껴졌어요. 사장님도 잘 챙겨주시네요. 마음에 들었어요.
1204444725,크랩프트 신도림본점,,,정말 좋았습니다! 사장님이 친절하셔서 처음 방문인데도 편안하게 식사할 수 있었어요. 잘 챙겨주시네요 덕분에 기분 좋은 시간 보냈습니다 잘했네요
1204444725,크랩프트 신도림본점,,,정말 좋았습니다! 사장님이 친절하셔서 처음 방문인데도 편안하게 식사할 수 있었어요. 잘 챙겨주시네요 덕분에 기분 좋은 시간 보냈습니다 잘했네요
1204444725,크랩프트 신도림본점,,,정말 좋았습니다. 음식도 맛있고 분위기도 마음에 들었어요. 크랩프트 로제파스타 소스가 진하고 꾸덕해서 정말 좋더라구요. 사장님이 잘 챙겨주시네요. 다음에 또 올 것 같아요!
1204444725,크랩프트 신도림본점,,,정말 좋았습니다. 음식도 맛있고 분위기도 마음에 들었어요. 크랩프트 로제파스타 소스가 진하고 꾸덕해서 정말 좋더라구요. 사장님이 잘 챙겨주시네요. 다음에 또 올 것 같아요!
1204444725,크랩프트 신도림본점,,,정말 좋았어요! 분위기도 깔끔하고 음식 퀄리티가 만족스럽습니다. 특히 크랩프트 로제파스타 소스가 진하고 꾸덕해서 좋더라구요. 파스타 좋아하시는 분들한테는 정말 추천드려요. 사장님도 친절하시고 전체적으로 깔끔한 느낌이라 또 오고 싶네요.
1204444725,크랩프트 신도림본점,,,정말 좋았어요! 음식도 맛있고 분위기도 좋아서 완전 만족이에요. 특히 크랩프트 로제파스타 소스가 진하고 꾸덕해서 정말 맛있더라고요 ✨ 파스타 좋아하시는 분들께 추천드리고 싶네요. 다음에 또 가고 싶습니다.
1204444725,크랩프트 신도림본점,,,진짜 괜찮더라구요! 펍 분위기라서 데이트하기 딱 좋은 곳이지요 ㅎㅎ 인테리어도 세련되고 음식도 맛있어서 분위기가 좋았어요. 사장님도 친절하시고 맥주랑 메뉴 조합도 완벽했습니다^^
1204444725,크랩프트 신도림본점,,,진짜 괜찮더라구요! 펍 분위기라서 데이트하기 딱 좋은 곳이지요 ㅎㅎ 인테리어도 세련되고 음식도 맛있어서 분위기가 좋았어요. 사장님도 친절하시고 맥주랑 메뉴 조합도 완벽했습니다^^
1204444725,크랩프트 신도림본점,,,"축구 경기 있는 날 일부러 예약하고 방문했는데, 대형 스크린으로 보니 현장감이 정말 대박이었어요! ⚽️ 소리도 빵빵하게 틀어주셔서 다 같이 응원하면서 보니 재미가 두 배! 맛있는 피맥과 함께 최고의 경기 관람이었습니다."
1204444725,크랩프트 신도림본점,,,페퍼로니 피자 짭짤한 맛이 맥주랑 찰떡이라 더 맛있게 즐겼어요 ⚽
1204444725,크랩프트 신도림본점,,,"회사 동료들 데리고 회식하러 왔는데, 다들 분위기 좋고 음식 맛있다고 칭찬 일색이었어요. 덕분에 제 어깨가 으쓱했네요. ㅎㅎ 피자, 파스타, 하이볼까지 뭐 하나 빠지는 게 없는 곳!"
