가게ID,가게명,평점,날짜,리뷰내용
1723070136,아베베 베이커리 서울베이커리,,,"제주에서 맛 볼수 있는 크림빵을 구매할 수 있다고 해서 방문했는데 줄이 길지는 않았지만 대기 시간은 좀 걸리더라고요.저는 건한라봉 얹어 있는 크림빵이랑 오메기떡이 들어간 소보로 도넛을 구매해서 미리 준비해간 냉팩에 포장해 왔어요.2,3층에는 막을 수 있는 카페가 있었는데 자리가 만석이라 포장해 왔어요.집에 와서 가족들과 먹어 봤는데 오메기 소보로도넛은 시부모님 입맛에 딱이었고 한라봉크림빵은 상큼하니 제 입맛에 딱이더라고요.다음엔 다른 빵도 먹어 보려고요."
1723070136,아베베 베이커리 서울베이커리,,,"조천 오메기 품은 단팥빵,한라산 1100고지 오메기떡 쑥 크림빵,금능 사과크림빵,가시리 흑임자 크림도너츠,제주 녹차 크림도너츠,남원 청귤 요거트 크림 도너츠😋"
1723070136,아베베 베이커리 서울베이커리,,,"조천 오메기 품은 단팥빵,한라산 1100고지 오메기떡 쑥 크림빵,금능 사과크림빵,가시리 흑임자 크림도너츠,제주 녹차 크림도너츠,남원 청귤 요거트 크림 도너츠😋"
1723070136,아베베 베이커리 서울베이커리,,,주말에만 와보다가 평일에 와서 그런지 인기있는 한라봉 크림빵 사기도 성공했어요.
1723070136,아베베 베이커리 서울베이커리,,,주말에만 와보다가 평일에 와서 그런지 인기있는 한라봉 크림빵 사기도 성공했어요.
1723070136,아베베 베이커리 서울베이커리,,,직원분들 모두 친절하고 질서있게 빵을 고를수 있어서 좋았습니다 👍 크림이 넉넉히 들어있어 달달하니 좋았고 떡이 들어있는 빵들은 개인적으로 더 맛있었어요 🙂
1723070136,아베베 베이커리 서울베이커리,,,직원분들 모두 친절하고 질서있게 빵을 고를수 있어서 좋았습니다 👍 크림이 넉넉히 들어있어 달달하니 좋았고 떡이 들어있는 빵들은 개인적으로 더 맛있었어요 🙂
1723070136,아베베 베이커리 서울베이커리,,,초가을 날씨덕분에 산책 겸 종로 광장시장왔어요 먼저 아베베부터 들러주고요- 세상에 이런 센스라니. 벌써 아베베는 도넛에 단풍을 담아냈지 모에요🧡퐁신퐁산한 도넛 안에 크림이 듬뿍😊☕️🥯제주 감성에 서울을 담아낸 달콤함이 한 가득이죠 살짝 흐린 날씨 덕분인지 대기 줄도 길지 않아서 다행이고요 2층 좌석도 마침 남아 있어서 편안하게 즐기는 아베베☕️🥯💯❣️🥤🤭 포장해 가시는분들도 양손 가득 사가는 아베베 도나스고요🤭다 먹을라구 했는데 말이죠 육회가 갑자기 먹고싶다고 해서 아쉽지만 또 기분 좋게 나서봅니다. 달달한 빵 가방 달랑달랑 흔들변서 관광객 많은 광장시장 안으로 가봅니다. 아베베는 달콤퐁신한 한 입 그 자체랍니다🤭🧡👍아베베×제주×서울❣️
1723070136,아베베 베이커리 서울베이커리,,,초가을 날씨덕분에 산책 겸 종로 광장시장왔어요 먼저 아베베부터 들러주고요- 세상에 이런 센스라니. 벌써 아베베는 도넛에 단풍을 담아냈지 모에요🧡퐁신퐁산한 도넛 안에 크림이 듬뿍😊☕️🥯제주 감성에 서울을 담아낸 달콤함이 한 가득이죠 살짝 흐린 날씨 덕분인지 대기 줄도 길지 않아서 다행이고요 2층 좌석도 마침 남아 있어서 편안하게 즐기는 아베베☕️🥯💯❣️🥤🤭 포장해 가시는분들도 양손 가득 사가는 아베베 도나스고요🤭다 먹을라구 했는데 말이죠 육회가 갑자기 먹고싶다고 해서 아쉽지만 또 기분 좋게 나서봅니다. 달달한 빵 가방 달랑달랑 흔들변서 관광객 많은 광장시장 안으로 가봅니다. 아베베는 달콤퐁신한 한 입 그 자체랍니다🤭🧡👍아베베×제주×서울❣️
1723070136,아베베 베이커리 서울베이커리,,,친구와함께 종로갔다가 N번째들리는 빵집.정~말 맛있어서 또 찾았는데 역시나👍
1723070136,아베베 베이커리 서울베이커리,,,친구와함께 종로갔다가 N번째들리는 빵집.정~말 맛있어서 또 찾았는데 역시나👍
1723070136,아베베 베이커리 서울베이커리,,,"크림이 정말 맛있고, 개인의 취향을 존중해서 각자 원하는 것으로 살 수 있어서 좋아요 ☺️"
1723070136,아베베 베이커리 서울베이커리,,,"크림이 정말 맛있고, 개인의 취향을 존중해서 각자 원하는 것으로 살 수 있어서 좋아요 ☺️"
1723070136,아베베 베이커리 서울베이커리,,,크림이 진짜 많이 들어가 있어서 하나만 먹어도 배불러요. 크림이 가벼운 느낌은 아니고 되게 묵직한 느낌? 그냥 먹어도 맛있구 얼려먹어도 맛있어요! 제주지점 포함해서 여러 종류 먹어봤는데 대부분 다 맛있었어요. 크림빵 하면 제일먼저 생각나는 곳 같아요 ☺️
1723070136,아베베 베이커리 서울베이커리,,,크림이 진짜 많이 들어가 있어서 하나만 먹어도 배불러요. 크림이 가벼운 느낌은 아니고 되게 묵직한 느낌? 그냥 먹어도 맛있구 얼려먹어도 맛있어요! 제주지점 포함해서 여러 종류 먹어봤는데 대부분 다 맛있었어요. 크림빵 하면 제일먼저 생각나는 곳 같아요 ☺️
1723070136,아베베 베이커리 서울베이커리,,,특히 한라봉크림빵은 느끼하지않고 상큼하고 말린 한라봉 한조각이 테코 되어 있는데 아주 구냥 딱 귀여움.ㅋ
1723070136,아베베 베이커리 서울베이커리,,,특히 한라봉크림빵은 느끼하지않고 상큼하고 말린 한라봉 한조각이 테코 되어 있는데 아주 구냥 딱 귀여움.ㅋ
1723070136,아베베 베이커리 서울베이커리,,,"한라산 1,100 고지 오메기떡 쑥 크림빵 세가지 구매했어요."
1723070136,아베베 베이커리 서울베이커리,,,"한라산 1,100 고지 오메기떡 쑥 크림빵 세가지 구매했어요."
1489824422,해운대달맞이빵 청계천점베이커리,,,가성비 좋은 빵이 종류별로 다양하게 구성되어 있어서 골라먹기 좋고 제빵 명인이 만든 빵이라 확실히 달라요.
1489824422,해운대달맞이빵 청계천점베이커리,,,"맛있는 빵이 가득! 빵, 케이크가격 저렴하고 좋아요! 2층 공간도 넓고 투명 유리라 청계천 바라보며 먹을"
1489824422,해운대달맞이빵 청계천점베이커리,,,맛있는 빵이 너무 많아서 몰 골라야 할지 고민되는 빵 맛집입니다! 대전 살아서 성심당도 자주 가지만 서울에서 눈과 입이 즐거운 베이커리예요.
1489824422,해운대달맞이빵 청계천점베이커리,,,맛있어 보이는 빵들이 너무 많아서 고르기 힘들었어요! 종류도 많고 하나하나 다 맛보고 싶어요. 다음에 다른 빵도 또 사러 와야 겠어요
1489824422,해운대달맞이빵 청계천점베이커리,,,매장도 청결하고 빵도 정말 맛있어요!! 직원분들도 너무 친절하고 커피도 맛있어서 주변에 추천하고 싶습니다🥰
1489824422,해운대달맞이빵 청계천점베이커리,,,바질토마토는 베스트1답게 정말 맛있고 무화과 타르트는 파이지가 촉촉하고 무화과가 달지않고 맛나여
1489824422,해운대달맞이빵 청계천점베이커리,,,밥먹고 청계천 걷기전에 사서가려고 들렸는데 빵도 많고 음료도 맛있어보여요
1489824422,해운대달맞이빵 청계천점베이커리,,,"빵도 많고 크기도 크고 완전 맛있어요!! 매장에 먹을 수 있는 공간이 있어 여기서 먹어도 좋지만, 빵 하나 사서 청계천에서 산책하며 먹는 것도 좋아요❤️ 맛은 완벽합니다!"
1489824422,해운대달맞이빵 청계천점베이커리,,,빵이 다 맛있고 직원분들도 친절하세요ㅎㅎㅎ 알바하는 언니 예뻐요☺️🩷
1489824422,해운대달맞이빵 청계천점베이커리,,,빵이 맛있고 신선합니다 특히 제 최애는 일반 추천과 다르게 파이만쥬!!
1489824422,해운대달맞이빵 청계천점베이커리,,,사실 지나가다가 맛집같아 지나치지 못하고 들어왔어요~! 그런데 빵 종류도 엄청 많고 음료도 많아 쉬고가기 정말 좋았습니다:) 응대도 넘 친절하세요!
1489824422,해운대달맞이빵 청계천점베이커리,,,"슬기콩임님, 해운대달맞이빵에 방문해 주셔서 정말 감사해요! 😊 다양한 빵과 카페 공간을 만족하게 느끼셨다니 너무 기뻐요! 2층에서의 멋진 뷰와 함께하는 커피 한 잔이 정말 좋죠? 다음에도 맛있는 빵과 좋은 시간 보내러 오세요! 또 만나요!💕"
1489824422,해운대달맞이빵 청계천점베이커리,,,시그니처음료 하나 기본 아아하나 주문해서 먹어봤는데 커피도 맛있고 이집의 대표인 것 같은 푸딩도 맛있네요
1489824422,해운대달맞이빵 청계천점베이커리,,,"써브웨이 샌드위치만 먹다가, 유명한 해운대 달맞이빵 샐러드 먹어봤습니다"
1489824422,해운대달맞이빵 청계천점베이커리,,,"안녕하세요, So4668님! 🌟 해운대달맞이빵에 오셔서 기분 좋은 경험을 하셨다니 정말 기뻐요! 빵 냄새로 기분을 좋게 해드릴 수 있어서 행복합니다. 화이트롤도 부드럽고 달콤해서 만족하셨다니, 저희도 너무 뿌듯하네요! 😍 앞으로도 맛있는 빵으로 찾아뵐게요! 감사합니다! 💖"
1489824422,해운대달맞이빵 청계천점베이커리,,,"안녕하세요, jhaha111님! 😊 해운대달맞이빵에 방문해 주셔서 정말 감사해요! 쫀득한 식감과 신선한 우유크림이 마음에 드셨다니 너무 기쁘네요! 앞으로도 항상 좋은 품질 유지할게요. 또 뵐 수 있기를 바라요! 💕"
1489824422,해운대달맞이빵 청계천점베이커리,,,"안녕하세요, mas****님! 🌟 해운대달맞이빵에 두 번이나 방문해 주셔서 정말 감사해요! 😊 맛있는 빵이 기억에 남았다니 너무 기쁘네요! 2층의 넓은 자리와 친절한 직원들 덕분에 편안하게 즐기셨길 바라요! 다음에도 꼭 다시 방문해 주세요! 감사합니다! 💖"
1489824422,해운대달맞이빵 청계천점베이커리,,,"안녕하세요, zxc8708님! 😊 해운대달맞이빵에 오셔서 맛있고 다양한 빵을 즐기셨다니 정말 기쁘네요! 추천해 주셔서 너무 감사해요! 앞으로도 더 맛있는 빵으로 찾아뵐게요! 🍞💕"
1489824422,해운대달맞이빵 청계천점베이커리,,,"안녕하세요, 나리나리9820님! 😊 해운대달맞이빵에 방문해 주셔서 정말 감사해요! 맛있는 빵 냄새가 마음에 드셨다니 너무 기쁘네요! 다음에는 꼭 매장에서 여유롭게 드셔보세요. 또 오실 거죠? 기다리고 있을게요! 🍞❤️"
1489824422,해운대달맞이빵 청계천점베이커리,,,"안녕하세요, 봄날햇살이님! 😊 해운대달맞이빵에 방문해 주셔서 정말 감사해요! 접근성과 친절한 서비스에 긍정적인 말씀을 해주셔서 너무 기쁘답니다! 앞으로도 다양한 빵을 한 번에 즐기실 수 있도록 최선을 다할게요. 언제든지 오세요! 🍞💕"
1489824422,해운대달맞이빵 청계천점베이커리,,,"안녕하세요, 해운대달맞이빵의 top0choi40님! 🍞✨ 저희 빵을 맛있게 즐겨주셔서 정말 기뻐요! 다음에 오시면 더 다양한 맛있는 빵들이 기다리고 있을 거예요! 꼭 다시 방문해 주세요. 감사합니다! 💖"
1489824422,해운대달맞이빵 청계천점베이커리,,,"안녕하세요, 해운대달맞이빵의 사장입니다! 😊 gan****님, 저희 빵의 신선함과 맛을 높이 평가해 주셔서 정말 감사드려요! 💖 가격이 비싸게 느껴지실 수 있지만, 저희는 항상 좋은 재료만을 사용해 최상의 맛을 내기 위해 노력하고 있답니다! 🍞 앞으로도 맛있고 신선한 빵으로 보답할게요! 감사합니다! 🙏"
1489824422,해운대달맞이빵 청계천점베이커리,,,"안녕하세요, 해운대달맞이빵입니다 😊 eeeeeeej님, 저희 빵과 음료를 맛있게 즐기셨다니 정말 기쁘네요! 앞으로도 자주 찾아주신다니 너무 기대돼요! 다음 방문 때도 특별한 맛을 준비해놓겠습니다. 감사합니다! 💖"
1489824422,해운대달맞이빵 청계천점베이커리,,,야끼소바빵을 항상 올때마다 없어서 못 먹러보다가 오늘 사러 들어왔습니다! 가격도 나쁘지 않고 맛있어보이네요☺️ 주말인데도 카페가 넓어서 앉을 곳도 많고 청계천 걷다가 빵 사먹으러 오기에 위치도 좋습니다!
1489824422,해운대달맞이빵 청계천점베이커리,,,여기 무슨 해운대 특산물 빵파는데 아니냐며 지나가기만 했는데 빵집으로 추천해줘서 간단히 끼니 해결하려고 들렀어요!
1489824422,해운대달맞이빵 청계천점베이커리,,,오눌운 모찌모찌빵을 처음 먹었는데 겉바속쫄이예요 쫄깃쫄깃 안에 크림치즈인가까지 너무 찰지고 맛있어요 맨날 새로운 빵 캐스트 깨는 재미에 살찌고 갑니다🤓
1489824422,해운대달맞이빵 청계천점베이커리,,,오늘은 비가 엄청 내려요ㅎㅎ 숙소로 가서 먹을 간식과 내일 브런치로 먹을 것까지 다 사서 갑니다 총총😊 아직 맛보진 않았지만 맛 보장하는 마음으로 리뷰 남겨요!
1489824422,해운대달맞이빵 청계천점베이커리,,,일요일 점심 때 달맞이빵 방문했어요! 날씨가 좋아서 청계천에서 산책하다 카페 발견해서 들리게 되었어요! 해운대에서는 못 갔는데 서울에서 발견해서 너무 좋았어요☺️ 분위기도 좋고 카페도 넓어서 커플이나 가족 단위에서 방문하면 좋을 것 같아요! 무엇보다 빵들 종류도 다양하고 저렴한데 맛도 최고최고!!! 음료 종류도 다양해서 빵과 함께 먹는다면 더 맛있어요~ 청계천 방문하시면 꼭 들러보면 좋을 것 같아요 짱짱 추천드려요❤️
1489824422,해운대달맞이빵 청계천점베이커리,,,"저녁에 방문예약 없이 이용대기 시간 바로 입장나들이아이, 부모님"
1489824422,해운대달맞이빵 청계천점베이커리,,,저녁에 방문예약 없이 이용대기 시간 바로 입장나들이혼자
1489824422,해운대달맞이빵 청계천점베이커리,,,저녁에 방문예약 없이 이용대기 시간 바로 입장데이트아이
1489824422,해운대달맞이빵 청계천점베이커리,,,저녁에 방문예약 없이 이용대기 시간 바로 입장일상지인・동료
1489824422,해운대달맞이빵 청계천점베이커리,,,"전자레인지도 있고, 소비자가 먹기 좋은 환경이라 빵집 자주 올 것 같아요!! 2층도 있고 쾌적해요"
1489824422,해운대달맞이빵 청계천점베이커리,,,점심에 방문예약 없이 이용대기 시간 바로 입장일상혼자
1489824422,해운대달맞이빵 청계천점베이커리,,,점심에 방문예약 없이 이용대기 시간 바로 입장친목지인・동료
1489824422,해운대달맞이빵 청계천점베이커리,,,점심에 방문예약 없이 이용대기 시간 바로 입장친목지인・동료
1489824422,해운대달맞이빵 청계천점베이커리,,,점심에 방문예약 없이 이용대기 시간 바로 입장친목친구
1489824422,해운대달맞이빵 청계천점베이커리,,,점심에 방문예약 없이 이용대기 시간 바로 입장친목친구
1489824422,해운대달맞이빵 청계천점베이커리,,,"지나가다가 우연히 제과기능장이랑 제과명인이 계시다고 해서 들러봤어요! 빵 종류도 많고 탐나는 것도 많았는데 저녁이라 맘모스랑 앙버터호두과자를 겟,, 담에 또 와서 오렌지롤케이크랑 달맞이빵도 먹어보고 싶어요!!!"
1489824422,해운대달맞이빵 청계천점베이커리,,,"진열된 빵 종류가 다채롭고 비주얼이 화려해서 손님들의 시선을 끌어모읍니다. 전반적으로 빵 퀄리티는 높은 편이구요. 개인적으로는 자색 고구마빵의 식감이 좋았습니다. 빵을 구입해서 2층에서 커피와 함께 즐기기에는 나쁘지 않은 선택인데, 제품들의 가격대가 전반적으로 높아서 빵이나 디저트를 포장해서 가는 방법은 가성비가 있는지 잘 모르겠네요."
1489824422,해운대달맞이빵 청계천점베이커리,,,청계천 걷다가 들른 빵집!! 아이들이 맛있는 거 많다고 좋아했어요^^ 빵 종류도 다양하고 2층까지 있어서 여유롭게 즐기기에 딱 입니다!
1489824422,해운대달맞이빵 청계천점베이커리,,,청계천 구경하고 근처 카페 왔는데 빵도 맛있고 커피도 맛있어요~~ 카페 안에서 청계천 내려다 볼수 있어서 좋아요 ㅎㅎ 청계천 구경하시고 여기 와보세요 ㅎㅎ 매장도 넓고 좋아요 ㅎ
1489824422,해운대달맞이빵 청계천점베이커리,,,청계천에 왔다가 들른 빵집!! 너무 맛있을거 같아요^^ 친절한 곳!! 또 올게요~~
1489824422,해운대달맞이빵 청계천점베이커리,,,청계천에서 일부러 찾아왔어요~ 빵종류가 많고 너무 맛있어 보여요! 저는 몽블랑을 샀어요😄 너무 기대되요^^
1489824422,해운대달맞이빵 청계천점베이커리,,,회사 근처라 자주 방문하는데 빵 종류도 다양하고 맛있어서 너무 좋아요! 2층도 넓어서 먹고 가기도 편해용❤
17898357,효자베이커리베이커리,,,1등이라 믿고 먹어봤는데~~ 진짜진짜 콘브래드 맛있어요!!!
17898357,효자베이커리베이커리,,,3년 만에 방문했던 효자베이커리! 여전히 친절하신 사장님과 맛있는 빵들로 가득찬 곳! 어니언크림치즈빵은 베이글이 아닌 원조의 폭신한 소보로빵이었는데 풍미 여전하고 넘 부드럽게 맛있네요. 콘브레드도 여전히 맛난데 개인적으로는 모양을 4개 정도로 줄여서 사각형태나 아님 10개 정도 대량으로 박스나 케이스 들어가는 형태도 편의성 면에서 좋을 것 같아요.
17898357,효자베이커리베이커리,,,3년 만에 방문했던 효자베이커리! 여전히 친절하신 사장님과 맛있는 빵들로 가득찬 곳! 어니언크림치즈빵은 베이글이 아닌 원조의 폭신한 소보로빵이었는데 풍미 여전하고 넘 부드럽게 맛있네요. 콘브레드도 여전히 맛난데 개인적으로는 모양을 4개 정도로 줄여서 사각형태나 아님 10개 정도 대량으로 박스나 케이스 들어가는 형태도 편의성 면에서 좋을 것 같아요.
17898357,효자베이커리베이커리,,,그냥 지나가다 들렀고 가볍게 호두과자를 사서 먹었는데 맛있었다. 역시 베이커리 명인 호칭이 붙을 만 하다. 다음에는 다른 베이커리 등도 사 먹어 보고 싶다.
17898357,효자베이커리베이커리,,,기본적으로 빵이 맛있어서 서촌에 다시 간다면 다른 빵도 먹어보고 싶네요. 특별한 맛은 아닌데 추억을 부르는 빵을 파는 곳 같아요.
17898357,효자베이커리베이커리,,,기본적으로 빵이 맛있어서 서촌에 다시 간다면 다른 빵도 먹어보고 싶네요. 특별한 맛은 아닌데 추억을 부르는 빵을 파는 곳 같아요.
17898357,효자베이커리베이커리,,,남편이랑 밥 먹고나서 후식으로 빵 샀어요 ㅋㅋㅋ 한입거리였는데 짱맛 ㅎ 콘브레드도 저번에 사 먹었는데 정말 맛있더라구요!
17898357,효자베이커리베이커리,,,남편이랑 밥 먹고나서 후식으로 빵 샀어요 ㅋㅋㅋ 한입거리였는데 짱맛 ㅎ 콘브레드도 저번에 사 먹었는데 정말 맛있더라구요!
17898357,효자베이커리베이커리,,,단골 빵집인데 오늘은 생일이라 케잌을 사왔어요. 주변 다른 빵집에 비해 저렴하고 맛도 있고 넘나 친절해요.
17898357,효자베이커리베이커리,,,단골 빵집인데 오늘은 생일이라 케잌을 사왔어요. 주변 다른 빵집에 비해 저렴하고 맛도 있고 넘나 친절해요.
17898357,효자베이커리베이커리,,,달지않고 고소한 호두가 가득한 호두 타르트랑 채소 필링이 가득한 옥수수빵. 묵직함에 놀랐던 초코파이. 자극적이지않아 부담없이 먹기 좋은 빵이예요. 왜 대표 메뉴인지 바로 납득!
17898357,효자베이커리베이커리,,,"동네 사람들(할아버지, 어머님 등) 와서 익숙한 듯 한두개씩 사고 서비스도 받고 돌아가는 풍경이 참 친절하게 느껴졌습니다~ 하루 방문객인 저는 못 받았음에도 따스함이 느껴져서 기분이 좋더라구요~ 빵에 대한 설명에서 자부심이 강하게 느껴졌고 유재영 명인님은 윗층에서 빵을 만드시고 아드님과 직원분이 홀을 맡고 계신데, 설명도 기똥차고 친절도는 최강!"
17898357,효자베이커리베이커리,,,두개 사려고 했는데 사장님께서 딱 하나 남은 마지막 콘브레드라고 친절하게 말씀해 주심~
17898357,효자베이커리베이커리,,,마치 짬짜면 같은거다. 떡뽂이가 먹고 싶은데 빵도 먹고 싶은…
17898357,효자베이커리베이커리,,,맛있어요. 서촌오면 항상 들릅니다. 빵도 비닐에 담겨서 위생적으로 판매하셔서 좋아요~
17898357,효자베이커리베이커리,,,맛있어요. 서촌오면 항상 들릅니다. 빵도 비닐에 담겨서 위생적으로 판매하셔서 좋아요~
17898357,효자베이커리베이커리,,,"명인분이 빵을 제작하시는 유명한 효자 베이커리입니다. 친절한 아들분들이 카운터에서 운영중이신데, 빵에대해서 잘 알려주셔서 좋았습니다."
17898357,효자베이커리베이커리,,,"몇년만에 방문하는지 모르겠어요 그럼에도 불구하고 고정확한 이 동네만의 분위기가 유지되고 있었고 그 안에서 북적이는 여기 효자 베이커리도 여전하더라고요 옛 느낌 날 품고 있는 이 곳, 언제 들려도 따뜻해집니다 빵맛도 굿!"
17898357,효자베이커리베이커리,,,"서촌방문하면 매번 사는 인기메류 콘브래드.양과자호두타르트,,어니언크림치즈를 구매했습니다.변하지않는 맛으로 친절한 직원까지 미소짓게하는 서초빵맛집.효자베이커리입니다."
17898357,효자베이커리베이커리,,,서촌에 가면 생각나는 효자베이커리입니다 콘브래드가 생각나서 오랜만에 방문이요 인기 1위인만큼 빵이 식을틈 없이 팔린데요 친구랑 하나씩 구매했어요 가끔씩 생각나는 콘브래드예요
17898357,효자베이커리베이커리,,,서촌에 갔다가 오랫만에 들른 효자베이커리 여전하네요. 셋이 한 봉지씩 사서 들고 왔어요
17898357,효자베이커리베이커리,,,아침에 방문예약 없이 이용대기 시간 바로 입장여행혼자
17898357,효자베이커리베이커리,,,아침에 방문예약 없이 이용대기 시간 바로 입장일상혼자
17898357,효자베이커리베이커리,,,엄청 오래된 동네 단골 빵집. 아몬드센베이 엄청 바삭 고소. 시나몬소보루는 밤이 콕콕 박혀있고 계피맛이 나는 특이한 맛. 사장님 넘나 친절하시구 꼭 안부 물어봐주시는 감동..저녁에 오니 역시 얼마 안남은 빵들...하지만 그들도 맛있다는거~^^*
17898357,효자베이커리베이커리,,,"옛날 빵집에서 팔았던 빵들이 많아서 반가운 마음. 너무 늦게 방문해서, 오랜만에 먹고 싶었던 콘브래드가 소진돼 아쉬웠지만ㅠ 미니만쥬가 맛있었어요..!"
17898357,효자베이커리베이커리,,,점심에 방문예약 없이 이용대기 시간 바로 입장
17898357,효자베이커리베이커리,,,점심에 방문예약 없이 이용대기 시간 바로 입장데이트친구
17898357,효자베이커리베이커리,,,점심에 방문예약 없이 이용대기 시간 바로 입장데이트친구
17898357,효자베이커리베이커리,,,점심에 방문예약 없이 이용대기 시간 바로 입장데이트혼자
17898357,효자베이커리베이커리,,,점심에 방문예약 없이 이용대기 시간 바로 입장데이트혼자
17898357,효자베이커리베이커리,,,점심에 방문예약 없이 이용대기 시간 바로 입장여행연인・배우자
17898357,효자베이커리베이커리,,,점심에 방문예약 없이 이용대기 시간 바로 입장일상
17898357,효자베이커리베이커리,,,"점심에 방문예약 없이 이용대기 시간 바로 입장일상지인・동료, 친구"
17898357,효자베이커리베이커리,,,점심에 방문예약 없이 이용대기 시간 바로 입장일상혼자
17898357,효자베이커리베이커리,,,점심에 방문예약 없이 이용대기 시간 바로 입장일상혼자
17898357,효자베이커리베이커리,,,정말 오랜만에 효자베이커리 콘브레드 먹었네요. 가격은 많이 올랐지만 빵맛은 그대로고 젊은 직원분들의 활기가 더 좋았습니다. 오래오래 남아주세요!
17898357,효자베이커리베이커리,,,처음 가봤어요! 빵들이 너무 좋아요. 추천해주신 빵들고 맛나게 잘 먹었숩다!!
