가게ID,가게명,평점,날짜,리뷰내용
1290150733,혜화돌쇠아저씨종합분식,,,"중학생아이랑 어른3명이 갔는데, 옆테이블을 보니 피자가 커보여서, 4명이 피자2판이 너무 많을까봐 먼저 3인세트를 주문해서 먹어보고 하나를 더 시키자 하고는 직원에게 메뉴주문을 했는데, 좀 이따 사장님께서 오셔선 4명이니까 4명메뉴를 시켜야 된다고 하시더라구요.."
1290150733,혜화돌쇠아저씨종합분식,,,직접 화덕에서 구워주는 고르곤졸라 맛있어요!!!
1290150733,혜화돌쇠아저씨종합분식,,,직접 화덕에서 구워주는 고르곤졸라 맛있어요!!!
1290150733,혜화돌쇠아저씨종합분식,,,치즈떡볶이랑 고르곤졸라 피자는 넘 좋은 콜라보죠~항상 맛있게 먹고 있습니다
1290150733,혜화돌쇠아저씨종합분식,,,피자 제외 다른것들 다 먹고 피자는 박스에 포장해오시는걸 추천 ! ㅎㅎ 고르곤졸라 피자는 바로 앞에서 만들고 구워주시는걸 볼 수 있어서 좋았고 가격 대비 양도 많았어요 ~~
1290150733,혜화돌쇠아저씨종합분식,,,피자 제외 다른것들 다 먹고 피자는 박스에 포장해오시는걸 추천 ! ㅎㅎ 고르곤졸라 피자는 바로 앞에서 만들고 구워주시는걸 볼 수 있어서 좋았고 가격 대비 양도 많았어요 ~~
1290150733,혜화돌쇠아저씨종합분식,,,"피자, 떡볶이 다 맛있습니다 피자 짱커요!"
1290150733,혜화돌쇠아저씨종합분식,,,화덕피자맛집으로 유명한곳이라 더워서 포장해서 집에서 친구들과 먹었어요~^
1290150733,혜화돌쇠아저씨종합분식,,,화로피자치즈와 콩나물 라면과 김치볶음밥이 환상의 궁합이네요 👍
