가게ID,가게명,업종,평점,날짜,리뷰내용
1198045151,도토리가든 안국점,카페,,,음료사진이 없는 이유는 음료가 맛이 없는데 비싸고 컵도 일회용잔에 주기 때문에 가격이 이게 맞나 싶긴해요. 인테리어는 귀엽습니다. 생각보다 좌석도 많아요. 사진많이 찍고 싶을 때 스튜디오가는 느낌으로 갈거면 괜찮을듯요.
1198045151,도토리가든 안국점,카페,,,인사동-안국 근처에 늦은 시간 까지 하는 카페가 없어서 부러 검색해서 왔는데 모두가 대만족! 마들렌은 평범하고 까눌레가 진짜 입니다! 유자바닐라까눌레 하나 남았길래 먹은건데 너무 맛있었어요. 그릭요거트 토핑도 너무 많고 맛있어 보였는데 쇼케이스에서 날파리 관리는 좀 하시는게 좋을거 같아요..
1198045151,도토리가든 안국점,카페,,,"자리부터 잡고 메뉴 주문 추천합니다!! 빵과 마들렌 종류는 입장 하자 왼쪽에 있고 거기서 줄을 따라서 그릭요거트 볼을 직접 커스터마이징 할 수 있고...그 다음에 결제를 합니다. 저는 비다민 샤워 주스를 주문히고 초코 마들렌 포장 했습니다. 주스는 주문이 들어올때 직접 만드는 것 같았어요, 주스는 맛있었스빈다."
1198045151,도토리가든 안국점,카페,,,"저녁에 방문예약 없이 이용대기 시간 바로 입장데이트, 친목친구"
1198045151,도토리가든 안국점,카페,,,저녁에 방문예약 없이 이용대기 시간 바로 입장데이트연인・배우자
1198045151,도토리가든 안국점,카페,,,저번에 먹고 너무 맛있어서 이번에 선물용으로 또 사러 왔네요~<! 여전히 컨셉 너무 예뻐요. 오래오래 장사 하시길.👍🏻👍🏻👍🏻👍🏻
1198045151,도토리가든 안국점,카페,,,전부터 와보고 싶었는데 매장 분위기가 숲속에 온 것 같아요! 아메리카노도 산미없이 고소하고 진해서 너무 맛있고 도토리 마들렌도 너무 귀엽고 맛있습니다 ㅎㅎ 다음에 다른 메뉴들도 먹어보고싶어요!
1198045151,도토리가든 안국점,카페,,,점심에 방문예약 없이 이용대기 시간 바로 입장데이트연인・배우자
1198045151,도토리가든 안국점,카페,,,"조용한 분위기 속에서 편안한 대화까지 나누셨다니, 저희도 참 뿌듯합니다."
1198045151,도토리가든 안국점,카페,,,지브리 스타일의 감성 그릭요거트 & 요거트 아이스크림 전문점. 다만 가격대가 너무 높아 아사히볼 추가하면 그릭요거트볼 1그릇에 2만 원이 넘는 마법(?)을 경험함. 그릭요거트는 묽은 편.
1198045151,도토리가든 안국점,카페,,,진짜 용산보다 카페가 더 이쁘고 직원들도 너무 친절하세요 짱짱❤️❤️🫶🏻
1198045151,도토리가든 안국점,카페,,,처음 마주한 공간의 분위기와 인테리어가 고객님의 눈길을 사로잡았다니 정말 기쁩니다.
1198045151,도토리가든 안국점,카페,,,"친구랑 국현미 갔다가 들렀는데, 장소가 너무 아늑하고 디저트들도 너무 귀여워요 🥺 데이트 장소나 친구들이랑 오기 좋은 것 같아요💕"
1198045151,도토리가든 안국점,카페,,,"친절한 직원들의 마음까지 알아봐 주셔서 감사드리며, 앞으로도 변함없이 따뜻하고 아늑한 분위기를 지켜가겠습니다. 다음 방문 때도 행복한 순간 가득하시길 바랍니다!"
1198045151,도토리가든 안국점,카페,,,"카페 분위기도 너무 아늑하고 숲 산장에 온 느낌이고, 테라스 좌석도 푸릇푸릇해서 더위 끝나고 방문하면 더더욱 좋을 곳 같아요! 디저트 종류도 다양하고 제가 좋아하는 그릭요거트도 판매해서 다양하게 먹을 수 있어서 좋았습니다~~!"
11819330,둘리네분식종합분식,분식,,,"혜화역근처 점심 먹을곳 찾다가 찾은 1989 노포 식당! 요즘 한끼에도 7.8000원 만원이상인데! 이렇게 착한 식당이 있다니.ㅠ.ㅠ 처음방문하여, 사장님깨 추천받았다 제육 먹어~ 그러시길래 제육 시켰다. 서울시내에서 이렇게 착한 가격에 핟끼를 먹을수있다는게. 너무 좋았고 재방문의사 높았다!"
1714447580,떡산 안국떡볶이,분식,,,가래떡 떡보끼집이고 매콤해요! 6천원에 한 8조각 넣어주시더라구여~ 튀김은 가격대가 있어서 못먹어봤구 직원분이 엄청 친절해요!!
1714447580,떡산 안국떡볶이,분식,,,가래떡 떡볶이가 말랑 부드러우면서 매콤하고 감칠맛 나는 양념에 잘 어우러져서 맛있게 잘 먹었어요😊 어디서도 먹어보지 못한 독특한 양념이었는데 맛있었어요! 그리고 오뎅 넙적한게 엄청 커서 이불같았는데 큼직하게 한 입 들어오니 너무너무 맛있구 좋았어요
1714447580,떡산 안국떡볶이,분식,,,가마솥에 있어서 먹음직스러워요. 튀김도 바삭바삭하고 맛있어요.
1714447580,떡산 안국떡볶이,분식,,,"간만에 이곳 가래떡 떡볶이가 먹고 싶어서 방문했어요! 단맛이 별로 없는 맵칼한 옛날느낌 떡볶이예요. 가래떡 진짜 쫀득 하구요,, 양념은 꾸덕해서 취향 저격이에요."
1714447580,떡산 안국떡볶이,분식,,,개인적으로 떡볶이가 조금 덜 달았으면 좋겠네요ㅎ 전반적으로 깔끔하고 맛이 좋았습니다:)
1714447580,떡산 안국떡볶이,분식,,,궁금해서 가봤는데 생각보다 평범한 맛이고.. 순대는 덜 삶아져서 뻑뻑하고 별로였다.
1714447580,떡산 안국떡볶이,분식,,,꾸덕하고 찐한 쏘스에 푹 절여진(?) 떡볶이와 신선로에 얹혀(?) 나오는 튀김들의 행진. 합격 ㅋㅋㅋ
1714447580,떡산 안국떡볶이,분식,,,남자친구랑 저랑 떡산 팬이에요!!!가래떡 쫀득하고 꾸덕한 국물이 옛날 가래떡 떡볶이 느낌이라 좋았어요. 튀김도 진짜 맛있어요 모둠 시키면 신선로같은 예쁜 그릇에 담아주시는데 양이 많아서 단품으로 제일 맛있었던 고추튀김이랑 김말이 시켰어요! 김밥을 두번 매진 끝에 시켰는데 겨자소스에 찍어먹으니 진짜 맛있었어요ㅠㅠㅠㅠ
1714447580,떡산 안국떡볶이,분식,,,너무 궁금했는데 완전 대만족! 서서 먹는 곳인 줄 몰랐지만 뭐 분식인데요 뭐 ㅎㅎㅎ
1714447580,떡산 안국떡볶이,분식,,,떡볶이 양념이 맛있고요 ㅎ 튀김 어묵 순대 다 맛있어요 ㅎ
1714447580,떡산 안국떡볶이,분식,,,"떡산 통가래 떡볶이, 부산미도어묵탕, 고기고추&김말이 튀김 먹었는데 전부 다 맛있었어요! 특히 떡볶이 쌀떡인데 꾸덕꾸덕한 양념 잘 배어서 👍!! 여자 직원분 넘 친절하셔요.🫶"
1714447580,떡산 안국떡볶이,분식,,,"떡산 통가래 떡볶이랑 야채 김밥 먹었습니당🩷 야채 김밥 겨자 소스에 찍어먹으니 코 끝이 찡, 톡 쏘는 게 넘 맛있었어요!"
1714447580,떡산 안국떡볶이,분식,,,매장 마감시간에 급하게 들렀는데도 친절히 응대해주셨던 모습이 기억에 남습니다. 서울 여행 중 먹어봤던 떡볶이 중에 최고👐
1714447580,떡산 안국떡볶이,분식,,,무조건 쌀떡파인데 너무 맵지도 않고 쫀득하니 맛있었어요! 튀김도 모듬 튀김이 비싼감은 있지만 맛있었는데 순대는 촉촉하지 않아서 아쉬웠어요😭
1714447580,떡산 안국떡볶이,분식,,,분식인데도 음식이 정갈하고 정성이 들어있는 느낌인 곳이네요
1714447580,떡산 안국떡볶이,분식,,,수요일 11시 15 분 전에 와서 줄 서면 그래도 대기없이 먹을 수 있어요
1714447580,떡산 안국떡볶이,분식,,,안국역 2번 출구로 나오면 도로변 오른쪽에 위치한 떡산 안국. 작은 가게 인데 회전율은 빨라요. 가마솥에 끓인 소스와 통가래떡이 너무 맛있어요. 좌석은 따로 없고 주변에 서서 먹는 테이블입니다. 포장도 가능해요. 간단한 요깃거리 또는 분식 먹고 싶을 때 추천해요.👍🏻
1714447580,떡산 안국떡볶이,분식,,,"안국역 2번 출구에서 런던베이글뮤지엄가는길 중간정도에 위치해 있습니다. 떡볶이7,000원, 어묵탕6,000원, 꼬마김밥6,000원 조합이 좋습니다. 김밥을 겨자에 찍어 드셔 보세요_맛있습니다_괴식 아닙니다(추천)"
1714447580,떡산 안국떡볶이,분식,,,여기 떡볶이 아주 맛있어요. 포장도 정갈하게 담아주셔서 매장은 좁길래 집에서 먹었는데 맛있어요. 막걸리랑 잘 어울리네요
1714447580,떡산 안국떡볶이,분식,,,연신내 떡산 방문후 안국점도 가봤는데 맛도 정말 똑같고 정말 쫄깃부드러운 가래떡에 꾸덕 자극 떡볶이 소스와 정말 잘어울렸어요 👍😋💯
1714447580,떡산 안국떡볶이,분식,,,오오 JMT!! 순대는 처음 먹었는데 소스가 특히 건강한 맛이라 잘 어울리네요! 잘 먹었습니다!
1714447580,떡산 안국떡볶이,분식,,,오픈하고 3번째 손님인데 떡볶이가 어제 남은 비주얼 (나올때 포장 손님꺼 끓이는 거랑 확실히 다르더라고요)
1714447580,떡산 안국떡볶이,분식,,,운좋게 웨이팅없이 먹었는데 너무 맛있어요👍🏻 정갈하고 맛있고 친절한 집
1714447580,떡산 안국떡볶이,분식,,,이번에도 4종류나 ㅋㅋㅋㅋ예전에 모듬튀김 시켰다가 완전 배불렀어요! 김밥은 주문하고 만들어주셔서 신선해서 좋았어요. 여직원분 엄청 세심하시고 친절하셔서 더더 맛있게 먹고갑니다!
1714447580,떡산 안국떡볶이,분식,,,저녁에 방문예약 없이 이용대기 시간 바로 입장나들이혼자
1714447580,떡산 안국떡볶이,분식,,,저녁에 방문예약 없이 이용대기 시간 바로 입장나들이혼자
1714447580,떡산 안국떡볶이,분식,,,저녁에 방문예약 없이 이용대기 시간 바로 입장친목지인・동료
1714447580,떡산 안국떡볶이,분식,,,저녁에 방문예약 없이 이용대기 시간 바로 입장친목친구
1714447580,떡산 안국떡볶이,분식,,,저녁에 방문예약 없이 이용대기 시간 바로 입장친목친구
1714447580,떡산 안국떡볶이,분식,,,저녁에 방문포장·배달 이용대기 시간 바로 입장나들이지인・동료
1714447580,떡산 안국떡볶이,분식,,,저녁에 방문포장·배달 이용대기 시간 바로 입장친목지인・동료
1714447580,떡산 안국떡볶이,분식,,,저는 신세계백화점 강남점 팝업에서 떡산 부산식 떡볶이와 고추튀김을 구매해서 먹었어요~
1714447580,떡산 안국떡볶이,분식,,,점심에 방문예약 없이 이용대기 시간 10분 이내
1714447580,떡산 안국떡볶이,분식,,,점심에 방문예약 없이 이용대기 시간 10분 이내 나들이혼자
1714447580,떡산 안국떡볶이,분식,,,점심에 방문예약 없이 이용대기 시간 10분 이내 데이트연인・배우자
1714447580,떡산 안국떡볶이,분식,,,점심에 방문예약 없이 이용대기 시간 10분 이내 데이트연인・배우자
1714447580,떡산 안국떡볶이,분식,,,점심에 방문예약 없이 이용대기 시간 10분 이내 일상지인・동료
1714447580,떡산 안국떡볶이,분식,,,점심에 방문예약 없이 이용대기 시간 10분 이내 일상친척・형제
1714447580,떡산 안국떡볶이,분식,,,점심에 방문예약 없이 이용대기 시간 10분 이내 일상혼자
1714447580,떡산 안국떡볶이,분식,,,점심에 방문예약 없이 이용대기 시간 30분 이내
1714447580,떡산 안국떡볶이,분식,,,점심에 방문예약 없이 이용대기 시간 30분 이내데이트연인・배우자
1714447580,떡산 안국떡볶이,분식,,,점심에 방문예약 없이 이용대기 시간 30분 이내친목친구
1714447580,떡산 안국떡볶이,분식,,,점심에 방문예약 없이 이용대기 시간 바로 입장일상
1714447580,떡산 안국떡볶이,분식,,,점심에 방문예약 없이 이용대기 시간 바로 입장일상연인・배우자
1714447580,떡산 안국떡볶이,분식,,,점심에 방문예약 없이 이용대기 시간 바로 입장친목친구
1714447580,떡산 안국떡볶이,분식,,,점심에 방문예약 없이 이용대기 시간 바로 입장친목친구
1714447580,떡산 안국떡볶이,분식,,,점심에 방문예약 없이 이용대기 시간 바로 입장친목친구
1714447580,떡산 안국떡볶이,분식,,,점심에 방문포장·배달 이용대기 시간 바로 입장나들이혼자
1714447580,떡산 안국떡볶이,분식,,,토요일 오후 2시쯤 방문 했는데 30분 정도 기다리고 들어간 것 같아요. 맛있었어요. 떡볶이도 맛있긴 했는데 어묵탕이 더더 맛있었어요!
1714447580,떡산 안국떡볶이,분식,,,포장하는 손님들은 바로 입장 후 주문이 가능했고 대기하는 손님들이 있긴 했지만 오래기다릴것 같지 않아서 포장 안하고 대기줄에 일단 기다려봤는데 매장에서 먹고 갈 공간이 넓지 않아서 20-30분은 기다린듯 합니다.
2094121275,또보겠지떡볶이집 파란파랑점,분식,,,"검색으로 찾아와 주시고, 이렇게 만족스러운 경험을 남겨주셔서 감사드립니다^^ 기다림마저 즐겁게 느끼셨다니 저희도 큰 힘이 되네요. 말씀처럼 꼭 다시 뵐 수 있길 기대하겠습니다💙💙🩵🩵"
2094121275,또보겠지떡볶이집 파란파랑점,분식,,,따뜻한 말씀 정말 감사합니다^^ 혜화에서도 즐거운 기억으로 남으셨다니 너무 기쁘네요! 또 자주 뵐 수 있길 바랍니다 💙
2094121275,또보겠지떡볶이집 파란파랑점,분식,,,"따뜻한 말씀과 즐거운 후기로 힘이 납니다^^ 음식, 분위기 모두 만족하셨다니 정말 기쁘네요! 함께해 주신 시간만큼 다음 방문도 즐거운 추억이 되도록 정성껏 준비하겠습니다💙💙🩵🩵"
2094121275,또보겠지떡볶이집 파란파랑점,분식,,,떡볶이는 매콤하면서도 감칠맛이 진해 중독성 있는 맛이었습니다! 떡은 쫄깃하고 어묵과 잘 어울렸어요 특히 버터갈릭 감자튀김은 고소하면서도 달콤한 맛이 떡볶이 소스와 의외로 잘 어울려 색다른 조합을 즐길 수 있었습니다. 식사의 마무리로 나오는 볶음밥도 소스와 어우러져 든든하게 마무리하기 좋았습니다.
2094121275,또보겠지떡볶이집 파란파랑점,분식,,,"또보겠지 혜화점은 새로 와봤는데, 컨셉이 너무너무 귀여워요! 파랑파랑 점이라는 이름에 걸맞게 바다, 하늘색 컨셉으로 꾸며져있는데 들어올 때부터 기분이 확 좋아졌어요 ㅠㅠ 기다리는 동안 충전하는 곳도 있는거보고 센스 대박이라구 생각했어용.. 음악두 잔잔한 인디 음악으로 기분 전환 최고입니당 맛은 말해 모해 존맛탱인데 다른 점보다 양이 많는 것 같아요!! 강추드립니다 제 최애 또보겠지 지점 될 것 같아용"
2094121275,또보겠지떡볶이집 파란파랑점,분식,,,맛있게 드셔주셔서 감사합니다^^ 다음에도 정성스런 음식으로 보답할게요💙
2094121275,또보겠지떡볶이집 파란파랑점,분식,,,매콤 달콤한 즉떡에 사리도 풍부해서 푸짐하게 먹었어요! 그리고 버갈튀도 진짜 넘 맛나서 먹으면서 사라지는게 아까웠답니다🥹 담에도 올게요!
2094121275,또보겠지떡볶이집 파란파랑점,분식,,,"매콤~하지만 맛있게, 남김없이 클리어!^^ 감튀랑 볶음밥까지 챙겨주셔서 감사합니다. 언제든 또 편하게 놀러와주세요!💙"
2094121275,또보겠지떡볶이집 파란파랑점,분식,,,멀리서 일부러 찾아와 주셔서 정말 감사합니다^^ 원하셨던 맛 그대로 만족하셨다니 저희도 큰 보람을 느껴요. 말씀처럼 언제 오셔도 변함없는 맛으로 맞이하겠습니다💙💙🩵🩵
2094121275,또보겠지떡볶이집 파란파랑점,분식,,,"버터갈릭튀김과 떡볶이의 조합, 저희도 늘 자신있게 추천드리는 메뉴랍니다! 앞으로도 늘 변함없이 맛있고 즐거운 시간 되실 수 있도록 노력하겠습니다💙💙🩵🩵"
2094121275,또보겠지떡볶이집 파란파랑점,분식,,,버터갈릭튀김은 마성의 메뉴죠… 한번 먹으면 꼭 또 시키게 되는 또떡의 시그니처랍니다^^ 맛있게 즐겨주셔서 저희가 더 행복합니다! 다음에도 든든하게 챙겨드릴게요💙
2094121275,또보겠지떡볶이집 파란파랑점,분식,,,벌써 세 번째 방문이라니 감동이에요 🥹 떡볶이와 버터갈릭감튀까지 잊지 않고 좋아해주셔서 감사합니다. 언제 오셔도 늘 정성 다하겠습니다💙💙
2094121275,또보겠지떡볶이집 파란파랑점,분식,,,"비 오는 날 따뜻한 떡볶이와 모짜렐라치즈 조합이라니, 듣기만 해도 완벽한 날이었을 것 같아요^^ 다음 방문 때도 기분 좋은 식사 경험이 되실 수 있도록 더 맛있게 준비하겠습니다💙💙"
2094121275,또보겠지떡볶이집 파란파랑점,분식,,,"아이들과 함께 연극 관람 후 방문해 주시고, 이렇게 정성 가득한 후기를 남겨주셔서 감사합니다^^ 다음에도 가족분들과 즐거운 식사 시간 되실 수 있도록 맛과 서비스 모두 정성껏 준비하겠습니다💙💙🩵🩵"
2094121275,또보겠지떡볶이집 파란파랑점,분식,,,어머님과 함께 소중한 시간을 저희 가게에서 보내주셨다니 정말 감사드립니다^^ 언제 방문해주셔도 맛있게 드실 수 있도록 늘 정성을 다하겠습니다💙
2094121275,또보겠지떡볶이집 파란파랑점,분식,,,"연극 끝나고 찾아와 주셔서 정말 감사드립니다^^ 맛과 양, 그리고 직원들의 마음까지 좋게 봐주셔서 힘이 나네요! 다음 방문 때도 만족하실 수 있도록 정성껏 준비해두겠습니다💙💙🩵🩵"
2094121275,또보겠지떡볶이집 파란파랑점,분식,,,"연극 보신 후 소중한 시간 내어 방문해 주시고, 이렇게 정성 가득한 리뷰까지 남겨주셔서 감사합니다^^ ‘역시 맛있다’는 말씀만큼 저희에게 큰 힘이 되는 말도 없는 것 같아요. 앞으로도 변함없이 좋은 맛과 친절함으로 보답드리겠습니다💙💙🩵🩵"
2094121275,또보겠지떡볶이집 파란파랑점,분식,,,오랜만에 방문해주셨는데 여전히 맛있게 드셨다니 너무 감사합니다^^ 다음에도 변함없이 맛있게 즐기실 수 있도록 늘 정성 다하겠습니다!💙
2094121275,또보겠지떡볶이집 파란파랑점,분식,,,오랜만에 즉석떡볶이 먹고 싶어서 또보겠지 혜화점 방문했어요 얼큰한 국물에 다양한 토핑까지 다 너무 맛있어요 혜화에서도 또떡 먹을 수 있어 좋네요!!
2094121275,또보겠지떡볶이집 파란파랑점,분식,,,"와, 저희 가게의 매력을 하나하나 짚어주셔서 감동이에요! 즉떡+볶음밥=완벽조합에 공감해주셔서 감사합니다. 다음번엔 더 맛있는 기억으로 보답드릴게요💙🩵"
2094121275,또보겠지떡볶이집 파란파랑점,분식,,,"와, 정성스러운 후기 정말 감사드립니다 💙 재방문까지 해주시고 친구분과 함께 즐거운 시간 보내셨다니 저희가 더 행복하네요^^ 다음에도 좋은 추억 남기실 수 있도록 정성껏 준비해두겠습니다💙🩵"
2094121275,또보겠지떡볶이집 파란파랑점,분식,,,임신하고 뭐 먹기가 어려웠는데 여기는 진짜 너무 개운하고 너무 맛잇어서 오랜만에 즐겁고 행복한 식사했네요 조만간 또 올예정🩷
2094121275,또보겠지떡볶이집 파란파랑점,분식,,,저희 바갈튀를 이렇게 사랑해 주시다니 정말 감사드려요^^ 떡볶이 양은 말씀 주신 부분 참고해서 더 만족하실 수 있도록 고민해 보겠습니다!
2094121275,또보겠지떡볶이집 파란파랑점,분식,,,"좋은 말씀 남겨주셔서 정말 감사드립니다 💙 기다리시는 동안 불편하실까 걱정했는데, 웃으며 즐겁게 식사하셨다니 저희도 기분이 너무 좋아요! 앞으로도 또 찾아오실 때마다 만족하실 수 있도록 최선을 다하겠습니다^^"
2094121275,또보겠지떡볶이집 파란파랑점,분식,,,처음 와봤는데 떡볶이가 너무 맛있어요! 버터갈릭감자튀김 먹고 물릴 때 떡볶이 국물 먹으면 조합 최고입니다! 한라봉에이드도 상큼하게 맛있어서 1인1 에이드 하면 최고일 것 같아요 그리고 알바생분이 너무 예쁘세요..🥹🥹
2094121275,또보겠지떡볶이집 파란파랑점,분식,,,첫 방문에서 이렇게 좋은 말씀 남겨주셔서 감사드립니다^^ 따뜻한 응원 덕분에 오늘도 힘내서 맛있는 음식 준비할 수 있을 것 같아요. 또 뵐 날 기다리겠습니다💙💙
2094121275,또보겠지떡볶이집 파란파랑점,분식,,,평소 좋아하던 떡볶이집인데 회사근처에 생겨서 너무좋아요! 매장 깔끔하구 직원분들도 넘넘 친절하시답니당💚 점심때 오면 웨이팅 생길수있는데 오늘은 바로 들어와서 행복하네용😊
2094121275,또보겠지떡볶이집 파란파랑점,분식,,,"혜화점 첫 방문이셨을 텐데, 맛있게 즐겨주셔서 기쁘고 감사한 마음뿐이에요^^ 다음에 연극 보러 오실 때도 꼭 들러주세요!!^^"
32892163,똥고집 혜화본점한식,치킨,,,#대학로맛집 #혜화맛집 10년 넘게 방문하고 있는 대학로에 독보적인 공간입니다. 시간이 흘러도 똥고집만이 가진 바이브는 대체하기 힘든 것 같아요. 오늘도 좋은 사람과 좋은 시간 보냈어요!
32892163,똥고집 혜화본점한식,치킨,,,갈 때마다 사장님도 직원분들도 늘 친절하셔서 자리 앉기 전부터 기분 좋아지는 곳! 오늘은 낮공과 밤공 사이 잠깐 들린 거라 공연맥주를 못 마시고 와서 아쉬웠지만 대신 빠르게 흡입하고 왔네요:P 5시간 반은 지난 것 같은데 아직도 배불러요ㅋㅋㅋㅋ큐ㅠㅠㅠㅠ 오늘도 너무 잘 먹고 갑니다!! 다음엔 와일드그레이맥주 다시 마시러 갈게요♡
32892163,똥고집 혜화본점한식,치킨,,,"공연 끝나고 늦은 시각에 방문했음에도 오랜 대기 없이 바로 입장 가능했고, 여러 공연들과 콜라보한 맥주가 있어 골라 시키는 재미가 있었어요! 직원분들도 너무너무 친절하시구 기분 좋게 즐기고 배부르게 잘 먹고 갑니다!!"
32892163,똥고집 혜화본점한식,치킨,,,공연보고난 후 친구들과 뒤풀이하기 더할나위 없는 곳이에요 . 정말 편하게 오기 너무 좋아서 늘 찾고있어요. 대학로 공연과 콜라보로 맥주도 있고 공연 보는 사람들에겐 딱인 곳 대학로 맛집! 음식두 맛있구 친절하시구 분위기도 좋아 대화하고 먹다보면 시간가는줄 몰라요!!
32892163,똥고집 혜화본점한식,치킨,,,그리고 이집의 '고추마늘치킨'도 이집만의 시그니처라고 생각해요. 비슷한 이름의 다른집 치킨을 먹어봐도 이집 맛이 안 나서 결국 또 똥고집을 찾게 되더라고요.오늘은 '어니언레몬크림사워치킨'을 먹어봤는데 이거도 좋았어요.
32892163,똥고집 혜화본점한식,치킨,,,"극 포스터로 만든 한정판 수제 캔맥주는 공연의 여운을 이어갈 수 있어 뒷풀이 자리에 더없이 잘 어울리고, 숲을 연상시키는 편안한 분위기 속에서 함께 즐기시면 더욱 특별한 시간이 되실 거예요!>_<"
32892163,똥고집 혜화본점한식,치킨,,,"다양한 이벤트 맥주와 함께 편안한 시간을 보내셨다니 더욱 힘이 나고, 개방감 있는 홀과 단체석이 마련되어 있어 관극 전후 모임이나 뒷풀이 자리로도 편히 이용하실 수 있습니다!"
32892163,똥고집 혜화본점한식,치킨,,,"닭똥집은 바삭한 튀김옷 속에 쫄깃한 식감이 살아 있어 언제 먹어도 만족스러운 메뉴이고, 떡볶이는 아낌없이 들어간 양배추 덕분에 은은한 달큰함이 더해져 색다른 매력을 느끼실 수 있습니다!"
32892163,똥고집 혜화본점한식,치킨,,,대학로 대표 맛집이에요! 극 보고 약속 있으면 항상 들리는 곳이에요! 오늘 라흐마니노프 봤는데 보고 라흐마니노프 맥주도 먹을 수 있으니까 너무 좋더라고요 ㅎㅎ
32892163,똥고집 혜화본점한식,치킨,,,대학로 대표맛집! 사장님과 직원분들 너무 친절하고 유쾌하세요. 짜장과 똥고집 존맛탱!!
32892163,똥고집 혜화본점한식,치킨,,,대학로 맛집! 똥고집! 알고는 있던곳이지만 늘 혼자라 갈일이 있을까싶었는데 공연포스팅된 맥주때문에 궁금증으로 처음 와봤는데 평일엔 혼밥도 가능하고 음식들도 정말 맛있었어요! 해물김치전먹었는데 진짜 넘 맛있었어요!! 맵찔이인데 맵지도않고! 딱 적당! 평일에 시간만 되면 몇번 더 오고싶어지네요!
32892163,똥고집 혜화본점한식,치킨,,,대학로 맛집이에요!! 혜화 맛집으로 너무 추천합니다 항상 짜파게티랑 치즈오믈렛 잘먹었어요💕
