가게ID,가게명,업종,평점,날짜,리뷰내용
37844910,부암동스코프베이커리,베이커리,,,"빵이면 빵, 음료면 음료... 다 사랑입니다... ㅠ"
37844910,부암동스코프베이커리,베이커리,,,선드라이드 스콘 정말 최애에요 하나 남아서 아쉬웠어요 소세지롤은 단맛만 줄이면 훨씬 더 맛있을거같아요 짭짤이 너낌으로 ㅎ 진저브레드 언제나 향긋 부드럽고요
37844910,부암동스코프베이커리,베이커리,,,스코프 포장했어요~ 스콘 맛있고 역시 레몬케이크 맛있어요. 부암동 매장한적하고 편안한 느낌이라 더 좋아요.
37844910,부암동스코프베이커리,베이커리,,,스코프 포장했어요~ 스콘 맛있고 역시 레몬케이크 맛있어요. 부암동 매장한적하고 편안한 느낌이라 더 좋아요.
37844910,부암동스코프베이커리,베이커리,,,스코프 포장했어요~ 스콘 맛있고 역시 레몬케이크 맛있어요. 부암동 매장한적하고 편안한 느낌이라 더 좋아요.
37844910,부암동스코프베이커리,베이커리,,,스코프 포장했어요~ 스콘 맛있고 역시 레몬케이크 맛있어요. 부암동 매장한적하고 편안한 느낌이라 더 좋아요.
37844910,부암동스코프베이커리,베이커리,,,스코프 포장했어요~ 스콘 맛있고 역시 레몬케이크 맛있어요. 부암동 매장한적하고 편안한 느낌이라 더 좋아요.
37844910,부암동스코프베이커리,베이커리,,,스콘 만드는데 자신있는 1인으로써 이곳은 찐입니다.🤩🤩🤩🤩🤩
37844910,부암동스코프베이커리,베이커리,,,스콘 만드는데 자신있는 1인으로써 이곳은 찐입니다.🤩🤩🤩🤩🤩
37844910,부암동스코프베이커리,베이커리,,,스콘 만드는데 자신있는 1인으로써 이곳은 찐입니다.🤩🤩🤩🤩🤩
37844910,부암동스코프베이커리,베이커리,,,스콘 만드는데 자신있는 1인으로써 이곳은 찐입니다.🤩🤩🤩🤩🤩
37844910,부암동스코프베이커리,베이커리,,,스콘 만드는데 자신있는 1인으로써 이곳은 찐입니다.🤩🤩🤩🤩🤩
37844910,부암동스코프베이커리,베이커리,,,스콘 맛집으로 유명해서 방문! 카페에서 먹고가는건 웨이팅이 있어서 포장해왔어요! 맛나요!
37844910,부암동스코프베이커리,베이커리,,,스콘이랑 브라우니 둘 다 맛있고 확실히 유명한 이유가 있네요!
37844910,부암동스코프베이커리,베이커리,,,시그니처 메뉴인 버터스콘<< 그저 흔한 스콘일 것 같아 별 기대 없었는데 진짜진짜 존맛… 자극적이지 않고 담백한게 가장 무서운 거 아시죠..?? 저희 집 앞에 있었으면 매일 갔을 것 같어요…🥹🥹
37844910,부암동스코프베이커리,베이커리,,,시그니처 메뉴인 버터스콘<< 그저 흔한 스콘일 것 같아 별 기대 없었는데 진짜진짜 존맛… 자극적이지 않고 담백한게 가장 무서운 거 아시죠..?? 저희 집 앞에 있었으면 매일 갔을 것 같어요…🥹🥹
37844910,부암동스코프베이커리,베이커리,,,시그니처 메뉴인 버터스콘<< 그저 흔한 스콘일 것 같아 별 기대 없었는데 진짜진짜 존맛… 자극적이지 않고 담백한게 가장 무서운 거 아시죠..?? 저희 집 앞에 있었으면 매일 갔을 것 같어요…🥹🥹
37844910,부암동스코프베이커리,베이커리,,,시그니처 메뉴인 버터스콘<< 그저 흔한 스콘일 것 같아 별 기대 없었는데 진짜진짜 존맛… 자극적이지 않고 담백한게 가장 무서운 거 아시죠..?? 저희 집 앞에 있었으면 매일 갔을 것 같어요…🥹🥹
37844910,부암동스코프베이커리,베이커리,,,아이싱이 달달해서 맛있었어요!! 단거잘 드시는 분은
37844910,부암동스코프베이커리,베이커리,,,아이싱이 달달해서 맛있었어요!! 단거잘 드시는 분은
37844910,부암동스코프베이커리,베이커리,,,아이싱이 달달해서 맛있었어요!! 단거잘 드시는 분은
37844910,부암동스코프베이커리,베이커리,,,아이싱이 달달해서 맛있었어요!! 단거잘 드시는 분은
37844910,부암동스코프베이커리,베이커리,,,아이싱이 달달해서 맛있었어요!! 단거잘 드시는 분은
37844910,부암동스코프베이커리,베이커리,,,아침에 방문예약 없이 이용대기 시간 바로 입장나들이친구
37844910,부암동스코프베이커리,베이커리,,,아침에 방문예약 없이 이용대기 시간 바로 입장나들이친구
37844910,부암동스코프베이커리,베이커리,,,아침에 방문예약 없이 이용대기 시간 바로 입장데이트연인・배우자
37844910,부암동스코프베이커리,베이커리,,,아침에 방문예약 없이 이용대기 시간 바로 입장데이트연인・배우자
37844910,부암동스코프베이커리,베이커리,,,"알게된지 7년정도 됐고 수십번은 드나들었습니다. 거의 전메뉴 다 먹어봤어요~ 제일 좋아하는 메뉴는 버터스콘에 클로티드크림, 코코넛마카룬 이건 갈때마다 꼭 사는거 같아요. 브라우니도 진짜 맛있습니다! 근데 착석한건 오늘이 처음이었는데 주말은... 비추 시장같아요 ㅠ 거기다 어떤 아줌마가 나보고 혼자왔냐면서 언제 나갈거냐고 눈치주니 진심 더워서 돌으셨나 싶었네요 ㅋㅋㅋ 40분도 못앉아있고 나왔어요. 담엔 그냥 하던대로 테이크아웃 할래요~"
37844910,부암동스코프베이커리,베이커리,,,"알게된지 7년정도 됐고 수십번은 드나들었습니다. 거의 전메뉴 다 먹어봤어요~ 제일 좋아하는 메뉴는 버터스콘에 클로티드크림, 코코넛마카룬 이건 갈때마다 꼭 사는거 같아요. 브라우니도 진짜 맛있습니다! 근데 착석한건 오늘이 처음이었는데 주말은... 비추 시장같아요 ㅠ 거기다 어떤 아줌마가 나보고 혼자왔냐면서 언제 나갈거냐고 눈치주니 진심 더워서 돌으셨나 싶었네요 ㅋㅋㅋ 40분도 못앉아있고 나왔어요. 담엔 그냥 하던대로 테이크아웃 할래요~"
37844910,부암동스코프베이커리,베이커리,,,"알게된지 7년정도 됐고 수십번은 드나들었습니다. 거의 전메뉴 다 먹어봤어요~ 제일 좋아하는 메뉴는 버터스콘에 클로티드크림, 코코넛마카룬 이건 갈때마다 꼭 사는거 같아요. 브라우니도 진짜 맛있습니다! 근데 착석한건 오늘이 처음이었는데 주말은... 비추 시장같아요 ㅠ 거기다 어떤 아줌마가 나보고 혼자왔냐면서 언제 나갈거냐고 눈치주니 진심 더워서 돌으셨나 싶었네요 ㅋㅋㅋ 40분도 못앉아있고 나왔어요. 담엔 그냥 하던대로 테이크아웃 할래요~"
37844910,부암동스코프베이커리,베이커리,,,"알게된지 7년정도 됐고 수십번은 드나들었습니다. 거의 전메뉴 다 먹어봤어요~ 제일 좋아하는 메뉴는 버터스콘에 클로티드크림, 코코넛마카룬 이건 갈때마다 꼭 사는거 같아요. 브라우니도 진짜 맛있습니다! 근데 착석한건 오늘이 처음이었는데 주말은... 비추 시장같아요 ㅠ 거기다 어떤 아줌마가 나보고 혼자왔냐면서 언제 나갈거냐고 눈치주니 진심 더워서 돌으셨나 싶었네요 ㅋㅋㅋ 40분도 못앉아있고 나왔어요. 담엔 그냥 하던대로 테이크아웃 할래요~"
37844910,부암동스코프베이커리,베이커리,,,"알게된지 7년정도 됐고 수십번은 드나들었습니다. 거의 전메뉴 다 먹어봤어요~ 제일 좋아하는 메뉴는 버터스콘에 클로티드크림, 코코넛마카룬 이건 갈때마다 꼭 사는거 같아요. 브라우니도 진짜 맛있습니다! 근데 착석한건 오늘이 처음이었는데 주말은... 비추 시장같아요 ㅠ 거기다 어떤 아줌마가 나보고 혼자왔냐면서 언제 나갈거냐고 눈치주니 진심 더워서 돌으셨나 싶었네요 ㅋㅋㅋ 40분도 못앉아있고 나왔어요. 담엔 그냥 하던대로 테이크아웃 할래요~"
37844910,부암동스코프베이커리,베이커리,,,"얼그레이 스콘 하나 만으로도 충분히 방문 가치가 있는 부암동 산자락 세련된 베이커리 카페... 다음날 먹어도 겉은 빠작, 속은 쫀쫀..너무 맛있다. 자하손만두에서 코스, 든든하게 먹고 배 뚜드리며 문 닫았을까봐서 급하게 뛰어가서 헐레벌떡 마감 중인 빵들 한보따리씩 포장했다. 다음날 회사에서 냉동시키려고 펼쳐보니 많이도 샀더라. 이것저것 손가락으로 찍어가며 정신없게 주문했는데도 직원분 끝까지 친절하게 잘 설명해 주시고 웃으며 포장해 주셔서 기분좋게 나왔다. .. 담엔 여유있게 굳즈까지 살펴보고 골라 봐야겠다."
37844910,부암동스코프베이커리,베이커리,,,일요일 오전에 점심 먹고 가끔 들르는 곳
37844910,부암동스코프베이커리,베이커리,,,저녁에 방문예약 없이 이용대기 시간 바로 입장
37844910,부암동스코프베이커리,베이커리,,,"저녁에 방문예약 없이 이용대기 시간 바로 입장나들이연인・배우자, 부모님"
37844910,부암동스코프베이커리,베이커리,,,"저녁에 방문예약 없이 이용대기 시간 바로 입장여행, 데이트부모님"
37844910,부암동스코프베이커리,베이커리,,,저녁에 방문예약 없이 이용대기 시간 바로 입장일상친구
37844910,부암동스코프베이커리,베이커리,,,저녁에 방문예약 없이 이용대기 시간 바로 입장일상친구
37844910,부암동스코프베이커리,베이커리,,,저녁에 방문예약 없이 이용대기 시간 바로 입장일상친구
37844910,부암동스코프베이커리,베이커리,,,저녁에 방문예약 없이 이용대기 시간 바로 입장일상친구
37844910,부암동스코프베이커리,베이커리,,,저녁에 방문예약 없이 이용대기 시간 바로 입장일상친구
37844910,부암동스코프베이커리,베이커리,,,저녁에 방문포장·배달 이용대기 시간 바로 입장데이트연인・배우자
37844910,부암동스코프베이커리,베이커리,,,"점심에 방문예약 없이 이용대기 시간 10분 이내 나들이, 일상친구"
37844910,부암동스코프베이커리,베이커리,,,점심에 방문예약 없이 이용대기 시간 바로 입장
37844910,부암동스코프베이커리,베이커리,,,점심에 방문예약 없이 이용대기 시간 바로 입장
37844910,부암동스코프베이커리,베이커리,,,점심에 방문예약 없이 이용대기 시간 바로 입장
37844910,부암동스코프베이커리,베이커리,,,점심에 방문예약 없이 이용대기 시간 바로 입장
37844910,부암동스코프베이커리,베이커리,,,점심에 방문예약 없이 이용대기 시간 바로 입장
37844910,부암동스코프베이커리,베이커리,,,"점심에 방문예약 없이 이용대기 시간 바로 입장나들이, 일상혼자, 친구"
37844910,부암동스코프베이커리,베이커리,,,"점심에 방문예약 없이 이용대기 시간 바로 입장나들이, 일상혼자, 친구"
37844910,부암동스코프베이커리,베이커리,,,점심에 방문예약 없이 이용대기 시간 바로 입장나들이연인・배우자
37844910,부암동스코프베이커리,베이커리,,,점심에 방문예약 없이 이용대기 시간 바로 입장나들이연인・배우자
37844910,부암동스코프베이커리,베이커리,,,점심에 방문예약 없이 이용대기 시간 바로 입장나들이지인・동료
37844910,부암동스코프베이커리,베이커리,,,점심에 방문예약 없이 이용대기 시간 바로 입장나들이친구
37844910,부암동스코프베이커리,베이커리,,,점심에 방문예약 없이 이용대기 시간 바로 입장나들이친구
37844910,부암동스코프베이커리,베이커리,,,점심에 방문예약 없이 이용대기 시간 바로 입장나들이친구
37844910,부암동스코프베이커리,베이커리,,,점심에 방문예약 없이 이용대기 시간 바로 입장나들이친구
37844910,부암동스코프베이커리,베이커리,,,점심에 방문예약 없이 이용대기 시간 바로 입장나들이친구
37844910,부암동스코프베이커리,베이커리,,,점심에 방문예약 없이 이용대기 시간 바로 입장나들이혼자
37844910,부암동스코프베이커리,베이커리,,,점심에 방문예약 없이 이용대기 시간 바로 입장나들이혼자
37844910,부암동스코프베이커리,베이커리,,,점심에 방문예약 없이 이용대기 시간 바로 입장나들이혼자
37844910,부암동스코프베이커리,베이커리,,,점심에 방문예약 없이 이용대기 시간 바로 입장나들이혼자
37844910,부암동스코프베이커리,베이커리,,,점심에 방문예약 없이 이용대기 시간 바로 입장나들이혼자
37844910,부암동스코프베이커리,베이커리,,,점심에 방문예약 없이 이용대기 시간 바로 입장데이트연인・배우자
37844910,부암동스코프베이커리,베이커리,,,점심에 방문예약 없이 이용대기 시간 바로 입장데이트연인・배우자
37844910,부암동스코프베이커리,베이커리,,,점심에 방문예약 없이 이용대기 시간 바로 입장일상부모님
37844910,부암동스코프베이커리,베이커리,,,점심에 방문예약 없이 이용대기 시간 바로 입장일상지인・동료
37844910,부암동스코프베이커리,베이커리,,,점심에 방문예약 없이 이용대기 시간 바로 입장일상지인・동료
37844910,부암동스코프베이커리,베이커리,,,점심에 방문예약 없이 이용대기 시간 바로 입장일상혼자
37844910,부암동스코프베이커리,베이커리,,,"점심에 방문예약 없이 이용대기 시간 바로 입장친목, 일상지인・동료"
37844910,부암동스코프베이커리,베이커리,,,"점심에 방문예약 없이 이용대기 시간 바로 입장친목친구, 지인・동료"
37844910,부암동스코프베이커리,베이커리,,,포장은 줄서지않고 살수있어서 포장해와서 먹었어요 ~~
37844910,부암동스코프베이커리,베이커리,,,포장은 줄서지않고 살수있어서 포장해와서 먹었어요 ~~
37844910,부암동스코프베이커리,베이커리,,,"피칸파이가가장 맛있어 보여서, 구매했다. 집에서 먹어보니, 내 입맛에는 파리바게트 호두파이가 더 나은듯 하다. 피칸으로 가득한게 아니라..사진의 피칸과 아래 크럼사이에 초코렛인지 카라멜인지 너무 단 잼같은 것이 있어서, 거의 뱉을뻔했다.,"
37844910,부암동스코프베이커리,베이커리,,,"피칸파이가가장 맛있어 보여서, 구매했다. 집에서 먹어보니, 내 입맛에는 파리바게트 호두파이가 더 나은듯 하다. 피칸으로 가득한게 아니라..사진의 피칸과 아래 크럼사이에 초코렛인지 카라멜인지 너무 단 잼같은 것이 있어서, 거의 뱉을뻔했다.,"
13016869,"불타는곱창 본점곱창,막창,양",고기,,,N번째 방문!! 회식하러 자주 왔었는데 너무 맛있어서 여자친구랑 같이 왔는데 여자친구도 너무 맛있다고 좋아하네요 ~간만에 점수땃습니다 ㅎㅎ
13016869,"불타는곱창 본점곱창,막창,양",고기,,,가게가 넓고 시원하고 양도 많고 서비스도 매장 청결도 빠지는게 없어요ㅠ 맛도 보장 최고최고
13016869,"불타는곱창 본점곱창,막창,양",고기,,,"가족끼리 저녁 먹으러 갔는데 아이들도 잘 먹을 정도로 잡내 하나 없었습니다. 사장님께서 정성껏 구워주셔서 부모님도 만족하시고, 정말 푸짐하게 잘 먹고 왔어요: )"
13016869,"불타는곱창 본점곱창,막창,양",고기,,,"같이나오는 부추무침이 느끼함을 잡아주시고, 곱도 신선하고 직접 구워주셔서 먹기만하면되요ㅎㅎㅎㅎ보끔밥도 필수"
13016869,"불타는곱창 본점곱창,막창,양",고기,,,"곱창 먹고 싶을때 마다 왔는데 이번에는 친구부부랑 왔는데, 부부도 여기 너무 맛있다고 동네에 생기면 좋겠다고하더라구요~? 뿌듯했습니다 ㅎㅎ"
13016869,"불타는곱창 본점곱창,막창,양",고기,,,곱창 별로 좋아하진 않는데 여기는 사람이 항상 많아서 와봤는데 너무 맛있었습니다! 양도 많았고 특히 볶음밥 너무 맛있었네요👍👍
13016869,"불타는곱창 본점곱창,막창,양",고기,,,"곱창 생각나면 오는집이에요 매번올때마다 친절하시고, 올떄마다 맛도 안변하고 양도 한결같습니다 그리고 밑반찬으로 나오는 부추랑 콩나물국도 최고에용"
13016869,"불타는곱창 본점곱창,막창,양",고기,,,곱창 생각날때마다 방문하다보니 어느덧 4년차 단골입니당 ㅎㅎ 사장님 너무 정겹고 친절하구 넘 좋으셔요 ! 곱창두 너무 맛있어요~~ 건강하시구 번창하세요!!!
13016869,"불타는곱창 본점곱창,막창,양",고기,,,곱창 정말 맛있어서 여기만 옵니다 볶음밥도 이쁘게 해주시네여 잘먹었습니다
13016869,"불타는곱창 본점곱창,막창,양",고기,,,곱창 처음 먹어보는 친구가 있어서 걱정했는데 한입 먹고 완전 반해서 다음 약속까지 잡고 나왔어요. 종로의 진짜 맛집이라니까요!
13016869,"불타는곱창 본점곱창,막창,양",고기,,,"곱창, 대창 너무 맛있구요…. 종로 맛집입니다.. 사진에 보시다시피 푸짐하고 곱도 많아서 맛있네요 다음에 또 오고싶어요!"
13016869,"불타는곱창 본점곱창,막창,양",고기,,,곱창은 너무 맛있었지만 부추나 고추 등 기본식 재료에 신선도가 많이 떨어졌어요. 특히 고추는 물러서 오래된 티가 팍팍 났습니다ㅠㅠ 개인적으로 넘 아쉽고. 바쁘셔서 그런거겠지만 사장님 알바생분 불친절하시고 뭐 하나 더달라고 하는것도 눈치보면서 먹었네요 ㅠㅠ 둘이가서 돈 10만원 우습게 쓰고왔는데 좋은 경험은 아니었습니다. 다신 안가도 될 것 같아요…
13016869,"불타는곱창 본점곱창,막창,양",고기,,,곱창이 안질기고 너무 맛있어요!!!매콤한 소스도 최고! 가족들이랑 왔는데 부모님께서 넘 좋아하시네요 ㅎㅎ 맛있는 음식 만들어주셔서 감사합니다😊
13016869,"불타는곱창 본점곱창,막창,양",고기,,,"남자친구가 맛있다고 데리고 와줬는데 진짜 맛있었어요!! 지금이라도와서 다행인거같구요,,, 사장님이 정말 친절하셔서 가게 나갈 때까지 기분 좋게 먹었어요~~ 담에 또 올게요!"
13016869,"불타는곱창 본점곱창,막창,양",고기,,,냄새안나고 너무 맛있는 막창집이에요!! 사장님이 딱 먹기 좋을때까지 구워주시고 반찬부터 메인까지 정성이 느껴집니다
13016869,"불타는곱창 본점곱창,막창,양",고기,,,너무 너무 맛있어요. 30년된곳이라그런지 확실히 맛이 달라요 다양한 곳 많이 가봤는데 여기가 참 맛나용
13016869,"불타는곱창 본점곱창,막창,양",고기,,,"데이트 코스로 갔는데 대성공이었어요! 곱창이 바삭하면서도 안에는 곱이 꽉 차 있고, 마지막에 먹은 볶음밥까지 완벽했습니다. 여자친구도 너무 만족해 해서 또 올 예정입니다~~"
13016869,"불타는곱창 본점곱창,막창,양",고기,,,"동네 최고 맛집이에요 솔직히 저만 먹고싶음,,, 더 유명해져서 웨이팅하면 속상할꺼같지만,,, 그래도 모두가 이 맛을 알았으면 좋겠는 마음으로 리뷰 씁니당 :)"
13016869,"불타는곱창 본점곱창,막창,양",고기,,,"동네있는 곱창집 다 다녀봤는데 여기가 최고입니다. 냄새 하나도 안 나고, 고기 질도 좋아서 입안 가득 고소한 맛이 퍼집니다. 볶음밥은 꼭 드셔야 해요!"
13016869,"불타는곱창 본점곱창,막창,양",고기,,,동생이랑 둘이 저녁 식사 겸 방문해서 먹었는데 역시나 언제 먹어도 맛있네요 :) 간이랑 천엽도 서비스로 주시고 사장님께서 곱창도 직접 구워주셔서 더 맛있었습니다!
13016869,"불타는곱창 본점곱창,막창,양",고기,,,모둠구이 시켜서 가족이랑 둘러앉아 먹었는데 각 부위마다 식감이 달라서 골라먹는 재미도 있더라고요. 초벌된 상태로 나오니까 오래 기다릴 필요 없어서 좋았고 다 먹고 나니 또 생각날 정도로 만족스러웠네요.
13016869,"불타는곱창 본점곱창,막창,양",고기,,,모둠구이에 소맥 한잔 딱 먹으니까 조합이 이렇게 잘 맞을 줄 몰랐어요. 남자친구랑 배 터지게 먹었는데 고소하고 쫀득해서 술이 계속 당겼네요. 기본 부추랑 양파 소스 곁들이면 느끼함도 싹 잡아줘서 마지막까지 물리지 않고 다 먹었어요. 재방문 확정입니다😊
13016869,"불타는곱창 본점곱창,막창,양",고기,,,모듬으로먹다가 곱창 추가하고 볶음밥까지 클리어 한 맛집! 무엇보다 사장님들 너무 친절하시구 맛있게 구워주시고 모든면에서 만족한 맛집 입니다!! 재방문 의사 100%! 잘 먹었습니다!
13016869,"불타는곱창 본점곱창,막창,양",고기,,,벌써 다섯번은 넘게 온 것 같아요 ㅜㅠ 동대문 곱창집은 여기로 정착 하셔야 되요!!! 친구들 놀러오면 무조건 데려옵니다… 술이 술술 들어가는 맛 ❤️
13016869,"불타는곱창 본점곱창,막창,양",고기,,,"벌써 몇번이나 방문했는데 맛이 변함없이 좋아요!!!!!!! 곱창에 곱 완전 실해서 고소하구 막창도 너무 부드러워용 같이 나온 소스만 3번 리필했는데, 친절하게 리필해주셔서 감사했습니다 ㅠ"
13016869,"불타는곱창 본점곱창,막창,양",고기,,,벌써 방문이 몇번쨔인지 ㅎㅎ 또간집입니당 곱창하면 여기!!
13016869,"불타는곱창 본점곱창,막창,양",고기,,,소곱창 좋아하는 친구랑 들렀는데 곱이 진짜 꽉 차 있어서 입안에서 고소함이 그대로 살아나요. 기본 상차림에 간이랑 천엽도 깔끔하게 나와서 시작부터 기분 좋아졌어요. 초벌이라 굽자마자 바로 먹을 수 있어서 술이랑도 찰떡이었고 친절하게 안내해주시는 덕분에 더 편하게 즐기다 왔어요.
13016869,"불타는곱창 본점곱창,막창,양",고기,,,술이 술술술~~~ 데이트 겸 방문했는데 정말 정말 맛있어서 눈이 띠용 했네요!!! 무조건 재방문 또간집 등극입니다~!
13016869,"불타는곱창 본점곱창,막창,양",고기,,,"양도 많고 곱창에는 곱이 꽉차있고 다 구워주시니 매번 올때마다 만족도가 너무 높아서 재방문 몇번째인지 모르겠어요,,, 종로 맛집입니다!!"
13016869,"불타는곱창 본점곱창,막창,양",고기,,,여기 벌써 몇번째 방문인지 모르겠어요 ㅎㅎㅎ 건강 생각 안하면 매일 왔을거 같아요 ㅎㅎ곱창 강추 입니다!!!!!!
13016869,"불타는곱창 본점곱창,막창,양",고기,,,여기는 촬영도 자주 오는지 내부 사진들도 많이 붙어있고 맛집 느낌이 제대로였어요. 직장동료랑 회식하러 갔는데 다들 음식이 깔끔하다고 칭찬을 아끼지 않았네요. 테이블도 깨끗하게 관리돼있어서 안심하고 즐길 수 있었어요. 역시 종로에서 빠질 수 없는 곳 같아요.
13016869,"불타는곱창 본점곱창,막창,양",고기,,,여자친구가 여기 근처 살아서 추천으로 와봤는데 종로에 맛집이 정말 많은 거 같아여. 특히 곱창 좋아해서 왔는데 곱이 진짜 신선하고 양파절임도 맛있어요
13016869,"불타는곱창 본점곱창,막창,양",고기,,,"역대급 신선하고 맛있는 곱창!!!! 너무 맛있습니다! 냄새 1도없고, 같이 나오는 부추랑 고추양파소스랑 같이먹으면 조합미칩니다,,, 재방문할수밖에없어요ㅠㅠㅠ"
13016869,"불타는곱창 본점곱창,막창,양",고기,,,"오늘첫방문이예요 지나가면서 보다가 가봐야지했었는데 오늘 드뎌왔네요!!! 곱창, 대창도 맛나서 술이 솔솔 들어갑니당"
13016869,"불타는곱창 본점곱창,막창,양",고기,,,"오랜만에 방문했는데 역시나 너무 맛있구요 함께주시는 고추양파 소스가 너무 맛있어요ㅠㅠ원래 곱창만 좋아했는데, 여기에서 양구이 접했는데 이것도 별밉니다^^"
13016869,"불타는곱창 본점곱창,막창,양",고기,,,"유튭에서 곱창 대창 먹방보고 검색 꼼꼼히 해보고왔는데,너무 맛있어서 술이 저절로 들어갔습니다."
13016869,"불타는곱창 본점곱창,막창,양",고기,,,잡내도 없고 직원분들께서 다 구워주고 양도 많고 너무 좋아요☺️👍👍👍👍 저는 데이트로왔는데 회식하시는 분들도 많았어요!!!
13016869,"불타는곱창 본점곱창,막창,양",고기,,,장소가 바뀌긴 했지만 20대 때 거래처 분들과 다니던 그곳이네요. 정말 오랜만에 방문했는데 여전히 맛있네요. 여기가 한 30년 됐나...? 너무 잘 먹고 와서 앞으로 자주 자주 가야겠어요.
13016869,"불타는곱창 본점곱창,막창,양",고기,,,저녁 데이트하러 나왔네요 너무 고소하고 맛있네요^^ 항상 손님이 항상 많아 매번 지나만 갔는데 오늘 시간이 잘 맞아서 맛나게 먹고 갑니다^^ 볶음밥도 꼭 드시길 추천드립니다^^
