가게ID,가게명,업종,평점,날짜,리뷰내용
1866541672,왕초바베큐 종로점,치킨,,,치즈가 위에만 얹어져있는게 아니라 계속 먹어도 부족하지않을 만큼 왕창 있구요 통마늘사리 추가해서 같이먹으면 물리지않고 계속 흡입되는 맛이에요🤤
1866541672,왕초바베큐 종로점,치킨,,,"콘마요 밑에 치즈 있죠, 음식 안에 통마늘 들어갔죠, 굳이 치즈나 통마늘 추가된 메뉴 보단 콘마요를 적극추천합니다.. 😋 볶음밥 볶을 때도 콘마요가 킥이에요 >.<"
1866541672,왕초바베큐 종로점,치킨,,,콘마요양념숯불바베큐 주문했습니다. 양도 많고 숯불향에 소스도 정말 맛있었어요. 콘마요맛은 여성분들이 정말 좋아하는 맛입니다. 다른 맛있는 안주도 많아서 재방문 의사 있습니다!
1866541672,왕초바베큐 종로점,치킨,,,토요일이좋아에 나왔던 곳이라서 그런지 너무 맛있고 저녁에 가볍게 먹기 좋았어요!! 치즈 장난아니었어요
1866541672,왕초바베큐 종로점,치킨,,,"👉🏻 왕십리 지점만 가봤는데 종로에도 있길래 방문했어요. 직원분들이 친절하셔서 좋았어요. 숯불 바베큐는 역시 왕초… 뜨끈뜨끈하고, 닭에 양념이 잘 베어서 너무 맛있게 먹었어요. 최고"
1718133788,육미안 혜화점,고기,,,두번째 방문인데 오늘은 부모님이랑 방문했어요 요즘 고기랑 명란이 먹고싶었는데 딱 여기 적당헌 메뉴가 있길래 선택했어요 역시 너무 맛있드라구요 허겁지겁먹느라 바빴네요 거의 흡입해서 나온지 얼마안돼서 다 순삭해버렸어요 혜화맛집인증합니당!
1718133788,육미안 혜화점,고기,,,두번째 방문인데 오늘은 부모님이랑 방문했어요 요즘 고기랑 명란이 먹고싶었는데 딱 여기 적당헌 메뉴가 있길래 선택했어요 역시 너무 맛있드라구요 허겁지겁먹느라 바빴네요 거의 흡입해서 나온지 얼마안돼서 다 순삭해버렸어요 혜화맛집인증합니당!
1718133788,육미안 혜화점,고기,,,두번째 방문인데 오늘은 부모님이랑 방문했어요 요즘 고기랑 명란이 먹고싶었는데 딱 여기 적당헌 메뉴가 있길래 선택했어요 역시 너무 맛있드라구요 허겁지겁먹느라 바빴네요 거의 흡입해서 나온지 얼마안돼서 다 순삭해버렸어요 혜화맛집인증합니당!
1718133788,육미안 혜화점,고기,,,엄마 생신 기념으로 대학로 맛집 찾다가 예전부터 너무 와보고싶었던 육미안으로 왔는데 오길 넘 잘했어요 ㅎㅎ 육회랑 고기가 진짜 맛있어용 다 먹으면 후식으로 티라미수도 주시는데 맛이 먼가 색다른데 맛있어요!!!!! 직원분들도 친절하셔서 식사하면서 기분 조앗어용 친구들한테도 추천해주려구여
1718133788,육미안 혜화점,고기,,,엄마 생신 기념으로 대학로 맛집 찾다가 예전부터 너무 와보고싶었던 육미안으로 왔는데 오길 넘 잘했어요 ㅎㅎ 육회랑 고기가 진짜 맛있어용 다 먹으면 후식으로 티라미수도 주시는데 맛이 먼가 색다른데 맛있어요!!!!! 직원분들도 친절하셔서 식사하면서 기분 조앗어용 친구들한테도 추천해주려구여
1718133788,육미안 혜화점,고기,,,엄마 생신 기념으로 대학로 맛집 찾다가 예전부터 너무 와보고싶었던 육미안으로 왔는데 오길 넘 잘했어요 ㅎㅎ 육회랑 고기가 진짜 맛있어용 다 먹으면 후식으로 티라미수도 주시는데 맛이 먼가 색다른데 맛있어요!!!!! 직원분들도 친절하셔서 식사하면서 기분 조앗어용 친구들한테도 추천해주려구여
1718133788,육미안 혜화점,고기,,,연극 보러 왔다가 대학로맛집이라고 해서 찾아왔어요! 고기가 부드럽고 서비스로 나오는 막국수도 맛있어요! 곁들여 먹는 사이드들이 다양하고 맛있어서 고기가 술술 들어가요! 트러플 육회도 트러플향 많이 나고 좋아요!!
1718133788,육미안 혜화점,고기,,,"연휴라 아이들이랑 연극보러 나왔다가, 혜화 맛집 검색해서 찾아왔어요. 아이들데리고 굽는고기집 번거롭고 힘들었는데, 다 구워져서 나오니 세상 편하네요ㅎㅎ 맛보기로나오는 막국수도 맛있구, 고기도 부들부들 맛나요. 대학로 맛집 알아갑니다😍"
1718133788,육미안 혜화점,고기,,,"예전에는 다양한 메뉴를 먹어서 만족했는데 오늘은 실속메뉴를 시켜서 고기에만 집중했는데 진짜 배 터질 것 같아요 3,4인 시키시면 기분 좋게 배부른 식사 하실 수 있을 것 같습니다☺️"
1718133788,육미안 혜화점,고기,,,인스타에서 찾아보고 방문했는데 금요일 7시쯤에 웨이팅은 없었고 세트로 시켜 먹었는데 양도 많고 진짜 맛있었어요👍 대학로 맛집입니다요 다들 꼭 오세요.. 그리고 솥밥이 진짜 고기랑 잘어울리니까 주문 필수!
1718133788,육미안 혜화점,고기,,,인스타에서 찾아보고 방문했는데 금요일 7시쯤에 웨이팅은 없었고 세트로 시켜 먹었는데 양도 많고 진짜 맛있었어요👍 대학로 맛집입니다요 다들 꼭 오세요.. 그리고 솥밥이 진짜 고기랑 잘어울리니까 주문 필수!
1718133788,육미안 혜화점,고기,,,인스타에서 찾아보고 방문했는데 금요일 7시쯤에 웨이팅은 없었고 세트로 시켜 먹었는데 양도 많고 진짜 맛있었어요👍 대학로 맛집입니다요 다들 꼭 오세요.. 그리고 솥밥이 진짜 고기랑 잘어울리니까 주문 필수!
1718133788,육미안 혜화점,고기,,,입 맛 까다로운 아이가 먹으면서도 맛있다며 엄지척 하는 대학로 맛집 육미안! 맨초밥도 참기름 향이 솔솔~ 고기의 육즙이 팡팡 터지는 육미안! 방문할 때 마다 기분 좋아지는 육미안!! 정말 맛있고 깔끔하고 친절하고 최고에요!!
1718133788,육미안 혜화점,고기,,,혜화 오랜만에 왔는데! 진짜 혜화맛집 찾았어요!! 막국수도 밑반찬으로 나오고 볶음밥이랑 찌개랑 다 맛있고요ㅠㅠㅠ역시 시그니처인 고기는 미쳤어요!! 2차로 다른거 먹어야는데 고기 추가했습니다!! 다들 여기 오세요🐥
1718133788,육미안 혜화점,고기,,,혜화 오랜만에 왔는데! 진짜 혜화맛집 찾았어요!! 막국수도 밑반찬으로 나오고 볶음밥이랑 찌개랑 다 맛있고요ㅠㅠㅠ역시 시그니처인 고기는 미쳤어요!! 2차로 다른거 먹어야는데 고기 추가했습니다!! 다들 여기 오세요🐥
1718133788,육미안 혜화점,고기,,,혜화 오랜만에 왔는데! 진짜 혜화맛집 찾았어요!! 막국수도 밑반찬으로 나오고 볶음밥이랑 찌개랑 다 맛있고요ㅠㅠㅠ역시 시그니처인 고기는 미쳤어요!! 2차로 다른거 먹어야는데 고기 추가했습니다!! 다들 여기 오세요🐥
1718133788,육미안 혜화점,고기,,,"혜화 올때마다 들리는 대학로 맛집이에용..! 오늘은 시그니처 세트 먹었는데 안창갈비랑 대창, 된찌랑 트러플 갈비솥밥, 육회까지 나오는 대박적인 구성이었습니다. 대창은 처음 시켜봤는데 통통하고 큰데도 질기지 않고 오히려 바삭했어요. 갈비도 양 꽤나 많았고 트러플 갈비솥밥도 향이 너무 좋아서 맛있게 먹었습니다. 명란 육회도 꼭시키시길..! 혜화 맛집 찾으시면 육미안 추천드립니당"
11627613,은성횟집생선회,회,,,2인분 3만원 곤이 많고 대구살은 큰덩이1개 작은찌그러기1개 알5개정도 들어있어요 민물새우들어가서 국물이 맛있어요
11627613,은성횟집생선회,회,,,2차가면 안됨 1차로 가야 맛있고 배부르게 먹을수 있음.
11627613,은성횟집생선회,회,,,공깃밥 시켰는데 수세미 털 들어있어서 새로 달라고 했어요.. 너무 맛있었지만 위생은 정말 최악이어서 재방문은 안 할 거 같아요
11627613,은성횟집생선회,회,,,공깃밥 시켰는데 수세미 털 들어있어서 새로 달라고 했어요.. 너무 맛있었지만 위생은 정말 최악이어서 재방문은 안 할 거 같아요
11627613,은성횟집생선회,회,,,"광장시장 대표 매운탕집! 광장시장 큰 길ㅡ스벅광장시장점바로 밑에 보임ㅡ에 있어 찾기쉬움! 생선을 손질하시며 냄비에 세팅해놓으셔서 입장과 동시에 인원수대로 바로 주문가능 (ex.2인3만 3인4만오천-3인시 2인분주문불가 라고 메뉴판에있음) 인원수대로 주문하고 공기밥추가! 아버님께서 뒷맛이 깔끔해서 ㅡ조미료거의안남ㅡ좋타고 하셨습니다:) 센불로 거의 익혀서 나와서 빨리먹을 수 있고 알,고니,생선 많이 들어있어요! 잘먹었습니다!"
11627613,은성횟집생선회,회,,,"광장시장 대표 매운탕집! 광장시장 큰 길ㅡ스벅광장시장점바로 밑에 보임ㅡ에 있어 찾기쉬움! 생선을 손질하시며 냄비에 세팅해놓으셔서 입장과 동시에 인원수대로 바로 주문가능 (ex.2인3만 3인4만오천-3인시 2인분주문불가 라고 메뉴판에있음) 인원수대로 주문하고 공기밥추가! 아버님께서 뒷맛이 깔끔해서 ㅡ조미료거의안남ㅡ좋타고 하셨습니다:) 센불로 거의 익혀서 나와서 빨리먹을 수 있고 알,고니,생선 많이 들어있어요! 잘먹었습니다!"
11627613,은성횟집생선회,회,,,광장시장 안에 있는 대구탕이 맛있는 집입니다. 친구들과 왔는데 맛있어서 가족들과 다시 오고싶은 곳이예요.
11627613,은성횟집생선회,회,,,광장시장에서 제일 맛있는 은성횟집!! 대구탕이 시원하규 정말 맛있어요
11627613,은성횟집생선회,회,,,두번째 방문입니다! 정말 술이 술술 들어가는 맛이에요 :) 다음번에는 포장해서 집에서 먹을려구요!
11627613,은성횟집생선회,회,,,"리뷰 1,492사진 3,034테마 2"
11627613,은성횟집생선회,회,,,"리뷰 750사진 2,180팔로워 30"
11627613,은성횟집생선회,회,,,"리뷰 750사진 2,180팔로워 30"
11627613,은성횟집생선회,회,,,말해뭐해요. 단골 대구탕집 ^^ 노보텔서 테라스방에 호텔팩 중에 걸어가서 먹고 왔어요
11627613,은성횟집생선회,회,,,말해뭐해요. 단골 대구탕집 ^^ 노보텔서 테라스방에 호텔팩 중에 걸어가서 먹고 왔어요
11627613,은성횟집생선회,회,,,맛있게 잘 먹었어요. 날 추워지면 포장 한번 해보고 싶어요
11627613,은성횟집생선회,회,,,맛있게 잘 먹었어요. 날 추워지면 포장 한번 해보고 싶어요
11627613,은성횟집생선회,회,,,맛있는대구! 깔끔한국물 그리고 신선한 내장! 친절한 사장님 오래된 노포지만 변치않는집!
11627613,은성횟집생선회,회,,,맞춰서 팔팔 끓는 동태탕이 따라들어온다 ㅋㅋㅋㅋㅋㅋㅋ난 만족~ 빨리빨리 민족에겐 아주 마음에 쏙 드는 속도 ㅋㅋㅋ아니 광장시장에서 여태 여길 왜 안갔지 싶은 ㅠㅠ;;; 진짜 맛있고 개운한 맛 ㅜ 대신 여름엔 땀 한바가지 흘릴 각오 해야댐 하지만 욘!맛!탱😁
11627613,은성횟집생선회,회,,,매운탕 많이 안좋아하는데 국물도 깔끔하니 맛있고 알곤이도 넉넉해서 맛있게 잘먹구 갑니다
11627613,은성횟집생선회,회,,,"소문난 집이라해서 처음으로 포장해 왔습니다. 대구 매운탕이라 신선한 대구를 기대했는데, 오히려 곤이가 지나치게 대부분이고 알 조금 있고, 신선미없는 뻑뻑한 대구만 몇 개 들어가 있네요. 대구매운탕이 아니라 정확히 곤이매운탕이라고 해야 맞을 것 같아요. 국물도 칼칼한 맛보다 고추가루 맛이 지배적인 텁텁한 맛이네요. 기대와는 전혀 다른 맛이라, 1번 구입으로 끝내야겠어요. 너무 곤이가 많아서 실망한 마음에 리뷰 남기고자 1/3쯤 식사 후 사진 남깁니다."
11627613,은성횟집생선회,회,,,어제맛있어서 먹고 올일있어서 세대주도 주려고 포장해갑니다
11627613,은성횟집생선회,회,,,오랜만에 방문했는데 역시나 최고의 대구매운탕입니다. 술을 부르는 국물과 알과 고니가 가득해서 너무 좋아요 잘 먹었습니다~
11627613,은성횟집생선회,회,,,오랜만이 왔는데 가게도 깔끔하게 리모델링 됐더라고요.
11627613,은성횟집생선회,회,,,오픈에 맞춰 고고~^^ 시원한 곳에서 번잡하지 않게 먹고 광장시장 구경했어요
11627613,은성횟집생선회,회,,,"웨이팅도 없으면서 사람 쫓아내는 가게는 처음입니다. 1.5시간만 머물고 있었고, 인원수대로 주문하고 술도 마셨습니다. 근데 나가라고요??"
11627613,은성횟집생선회,회,,,은성회집 대구탕은 광장시장 갈 때 마다 구입하는 아이템입니다. 포장해서 집에 와서 끓여 먹어도 넘 푸짐하고 맛있어요.
11627613,은성횟집생선회,회,,,저녁에 방문예약 없이 이용대기 시간 바로 입장데이트연인・배우자
11627613,은성횟집생선회,회,,,저녁에 방문예약 없이 이용대기 시간 바로 입장데이트연인・배우자
11627613,은성횟집생선회,회,,,저녁에 방문예약 없이 이용대기 시간 바로 입장데이트연인・배우자
11627613,은성횟집생선회,회,,,저녁에 방문예약 없이 이용대기 시간 바로 입장데이트연인・배우자
11627613,은성횟집생선회,회,,,저녁에 방문예약 없이 이용대기 시간 바로 입장친목친구
11627613,은성횟집생선회,회,,,저녁에 방문예약 없이 이용대기 시간 바로 입장친목친구
11627613,은성횟집생선회,회,,,저녁에 방문예약 없이 이용대기 시간 바로 입장친목친구
11627613,은성횟집생선회,회,,,저녁에 방문예약 없이 이용대기 시간 바로 입장친목친구
11627613,은성횟집생선회,회,,,"점심에 방문예약 없이 이용대기 시간 10분 이내 데이트, 여행연인・배우자"
11627613,은성횟집생선회,회,,,점심에 방문예약 없이 이용대기 시간 10분 이내 데이트연인・배우자
11627613,은성횟집생선회,회,,,점심에 방문예약 없이 이용대기 시간 바로 입장
11627613,은성횟집생선회,회,,,점심에 방문예약 없이 이용대기 시간 바로 입장
11627613,은성횟집생선회,회,,,점심에 방문예약 없이 이용대기 시간 바로 입장나들이연인・배우자
11627613,은성횟집생선회,회,,,점심에 방문예약 없이 이용대기 시간 바로 입장일상친구
11627613,은성횟집생선회,회,,,점심에 방문예약 없이 이용대기 시간 바로 입장일상친척・형제
11627613,은성횟집생선회,회,,,점심에 방문예약 없이 이용대기 시간 바로 입장일상친척・형제
11627613,은성횟집생선회,회,,,점심에 방문예약 없이 이용대기 시간 바로 입장친목지인・동료
11627613,은성횟집생선회,회,,,점심에 방문예약 없이 이용대기 시간 바로 입장친목지인・동료
11627613,은성횟집생선회,회,,,"주말에 가면 웨이팅을 길게 해야하는 매운탕 노포~ 광장시장 안에 있어서 중국,일본 관광객들도 많이 오더라고요. 전 평일에 가서 기다림없이 깔끔하게 착석~ 여기는 낮술이 제격인거같아요. 가게안의 바이브나 음식자체도 술을 부르는 비주얼 끝판왕ㅋ 예전에는 알,고니 추가가 있었던거 같은데 이제는 안보이네요."
11627613,은성횟집생선회,회,,,친구들이랑 처음 방문해서 먹었는데 알.곤이 너무 부드럽고 쫄깃해서 놀랬어요 ㅎㅎ
11627613,은성횟집생선회,회,,,"평일 점심 11시쯤 방문하니 자리가 있어 바로 먹었습니다. 맛있고요~ 반찬 두개, 공기밥1000원 별도입니다. 2명이서 32000원, 앞에 포장 가격도 가격은 같답니다!"
11627613,은성횟집생선회,회,,,포장 3만원 양이엄청나요..냄비 작은것뿐이라 두개나눠서 끓였어요🤣🤣 끓이면서 먹음 더 맛있을것 같아요!
1509981967,이명근떡볶이,분식,,,갈때 마다 맛있는 집 최애 떡볶이 집이에요!
1509981967,이명근떡볶이,분식,,,그냥 주문하세요. 고민만 늦출뿐입니다.
1509981967,이명근떡볶이,분식,,,떡볶이 튀김 다 너무 맛있어요! 눈꽃치즈도 다른 곳보다 많이 주셔서 좋아요 👍
1509981967,이명근떡볶이,분식,,,배달로 먹다가 너무 맛있어서 비오는날 너무 생각 나는거예요...떡볶이에 소주마시면 너무 좋겠다~
1509981967,이명근떡볶이,분식,,,사장님 순대에 내장이 없는데도 어쩜 꼬소하고 이렇게 맛있나요!!! 다시 돌아와주셔서 넘 감사할 따름입니다..
1509981967,이명근떡볶이,분식,,,"사장님 항상 진짜 완전 친절하시구, 시험기간에 든든히 먹으라구 못난이 만두도 세개나 서비스로 주셨어요,,🥹🩵"
1509981967,이명근떡볶이,분식,,,예약 없이 들어갔는데 직원분들도 친절하시고 음식도 엄청 맛있었어용
1509981967,이명근떡볶이,분식,,,저녁에 방문예약 없이 이용대기 시간 바로 입장
1509981967,이명근떡볶이,분식,,,저녁에 방문예약 없이 이용대기 시간 바로 입장일상아이
1509981967,이명근떡볶이,분식,,,저녁에 방문예약 없이 이용대기 시간 바로 입장일상아이
1509981967,이명근떡볶이,분식,,,저녁에 방문예약 없이 이용대기 시간 바로 입장일상연인・배우자
1509981967,이명근떡볶이,분식,,,저녁에 방문예약 없이 이용대기 시간 바로 입장일상연인・배우자
1509981967,이명근떡볶이,분식,,,저녁에 방문예약 없이 이용대기 시간 바로 입장일상연인・배우자
1509981967,이명근떡볶이,분식,,,저녁에 방문예약 없이 이용대기 시간 바로 입장일상연인・배우자
1509981967,이명근떡볶이,분식,,,저녁에 방문예약 없이 이용대기 시간 바로 입장일상연인・배우자
1509981967,이명근떡볶이,분식,,,저녁에 방문예약 없이 이용대기 시간 바로 입장일상연인・배우자
1509981967,이명근떡볶이,분식,,,"저녁에 방문예약 없이 이용대기 시간 바로 입장일상연인・배우자, 아이"
1509981967,이명근떡볶이,분식,,,저녁에 방문예약 없이 이용대기 시간 바로 입장친목친척・형제
1509981967,이명근떡볶이,분식,,,저녁에 방문포장·배달 이용대기 시간 10분 이내 친목부모님
1509981967,이명근떡볶이,분식,,,저녁에 방문포장·배달 이용대기 시간 30분 이내일상아이
1509981967,이명근떡볶이,분식,,,저녁에 방문포장·배달 이용대기 시간 30분 이내일상아이
1509981967,이명근떡볶이,분식,,,저녁에 방문포장·배달 이용대기 시간 30분 이내일상연인・배우자
1509981967,이명근떡볶이,분식,,,저녁에 방문포장·배달 이용대기 시간 바로 입장부모님
1509981967,이명근떡볶이,분식,,,저녁에 방문포장·배달 이용대기 시간 바로 입장연인・배우자
1509981967,이명근떡볶이,분식,,,저녁에 방문포장·배달 이용대기 시간 바로 입장일상아이
1509981967,이명근떡볶이,분식,,,저녁에 방문포장·배달 이용대기 시간 바로 입장회식부모님
1509981967,이명근떡볶이,분식,,,점심에 방문예약 없이 이용대기 시간 바로 입장일상혼자
1509981967,이명근떡볶이,분식,,,점심에 방문예약 없이 이용대기 시간 바로 입장친목친구
1509981967,이명근떡볶이,분식,,,"점심에 방문포장·배달 이용대기 시간 바로 입장일상혼자, 부모님"
1509981967,이명근떡볶이,분식,,,직접 먹어보니 남녀노소 즐길수 있게 덜매콤하고 달달한 국물 맛이라 너무 맛있네요! ㅎㅎ
1509981967,이명근떡볶이,분식,,,진짜 너무너무너무 맛있어요 갑자기 없어져서 슬펐었는데 다시 넓은 매장으로 돌아와서 너무 기뻐요!!! 사장님 진짜 너무 친절하시고 떡볶이 양도 많고 맛있습니다 번창하세요🩷
1509981967,이명근떡볶이,분식,,,친절한 주인 아저씨와 직원들.. 맛있는 음식... 깨끗한 내부... 누구나 좋아하는 떡뽁이를 즐겁게 먹을 수 있는 맛진 장소인 것 같아요...
1509981967,이명근떡볶이,분식,,,항상 맛있어요!!!! 사장님도 너무 친절하시고 신청곡도 받아주셔서 넘 조아요 이명근 떡볶이 최고~~~
1509981967,이명근떡볶이,분식,,,허겁지겁 먹느라 떡볶이를 못 찍었는데 즉떡중에 역대급이에요~!!사장님도 넘 친절하시고 볶음밥에 치즈 추가 꼭 하기 꼭..
1509981967,이명근떡볶이,분식,,,혜화동 떡볶이 1티어예요 정말정말 맛있어요! 건강한 맛이라서 엄마도 좋아하세요 ㅎㅎ
1307616706,인생횟집 종각본점,회,,,ㄹㅇ 개애ㅐㅐㅐㅐ맛잇어요 근래 먹은 회 중에서 젤 마싯는 거 같아요!
1307616706,인생횟집 종각본점,회,,,근데 17시쯤 가서 사람도 없었는데 역대급 불친절 저는 한국말 못하시는 줄 알았어요. 그리고 맛잇게 먹고 화장실가서 토할 뻔했습니다. 정말 냄새가 심해요...
1307616706,인생횟집 종각본점,회,,,"기본 스끼다시는 사진엔 없지만 콘치즈도 나오고요, 피카츄돈가스, 미역국, 생선구이 나왔던 것 같아요! 배부르게 너무 잘 먹고 왔습니다!! 후식으로 아이스크림까지 먹으니 완전 최고👍🏻👍🏻👍🏻"
1307616706,인생횟집 종각본점,회,,,나갈때 잘먹었다고 직원분께 영수증 후기 올리겠다..큰소리쳐서 언행일치 하려고 열심히 찰칵..찰칵..나름 전문가모드로 찍었는뎁..잘 나온건가..싶네여..담엔 젓가락들기전에 꼭 사진 찍으려고요..직원분 저 기억하심 반갑게 맞아주세용~~^^
1307616706,인생횟집 종각본점,회,,,너무 맛있고 재료도 신선해요 회무침이 너무 맛있어요
1307616706,인생횟집 종각본점,회,,,"너무 맛있어요!!! 회도 맛있고, 새우가 진짜 미쳤습니다! 구이를 주문하고 생으로 하나 먹고 구워먹어도 너무 맛이어요!!🍤🍤🦐🦐🦐🦐🍤🦐🍤"
1307616706,인생횟집 종각본점,회,,,둘이 먹다 배터질뻔~~ 셋이와도 충분할 양!! 너무좋아서 남자친구랑 여기는 메뉴판에 있는거 하나씩 다 먹으러와보쟈!!했어요~♡
1307616706,인생횟집 종각본점,회,,,마지막 하이라이트는 서더리탕이었는데 국물의 양이 어마어마하고 은근하게 매콤해서 마무리로 최고였어요🤭
1307616706,인생횟집 종각본점,회,,,말 한마디 한마디 손님을 대하는 직원도 불친절하고 음식도 소스만 여러개이지 기본적인 스끼다시도 안나와서 블로그에 나온 메뉴들이 안나오냐고 묻자 그제서야 다식어 딱딱해진 생선구이와 피카추돈까스를 내어주고..
1307616706,인생횟집 종각본점,회,,,맛도 있지만 직원들이 친절하시고 마시는동안 행복했어요💖 맛은 장담됩니다!!!‘
1307616706,인생횟집 종각본점,회,,,"맛보기 물회도 텁텁하지 않고 맛있었고, 직원 분 중 한 분이 너무 친절하셔서 기분 좋게 먹고 왔습니다. ㅎㅎ"
1307616706,인생횟집 종각본점,회,,,메뉴구성 너무 알차고 구이도 진짜맛있어요!!! 무엇보다 너무 친절하셔서 계속 방문하게됩니다! 회도 항상 신선하고 분위기도 좋습니다 종각역 최고의 집 👍👍👍👍👍👍🥺🥺🥺🥺
1307616706,인생횟집 종각본점,회,,,명절이라 간만에 왔어요! 양 너무 푸짐하고 리뷰 남기면 강아지고양이용 횟감도 포장해주세요!!!
1307616706,인생횟집 종각본점,회,,,"뭐 입소문나서 사람 많은건 이해가 가는데, 벨을 눌러도 직원은 오지도 않고 어쩌다 옆테이블 주문 받고 우리도 주문 받아달라고 말하니까 ""빨리 주문하세요"" 얼마나 장사가 잘되면 손님한테 빨리 주문하라고 명령을하냐ㅋㅋ"
1307616706,인생횟집 종각본점,회,,,밤에 방문예약 없이 이용대기 시간 바로 입장데이트연인・배우자
1307616706,인생횟집 종각본점,회,,,분위기도 좋구 회도 너무 맛있어용!! 사장님도 넘 친절하셔서 맛있게 먹구 갑니당 🥹🫶🏻💗
1307616706,인생횟집 종각본점,회,,,사장님들 너무 친절하시고 너무 맛있어요!!!!!!!!!!! 머니머니머ㅣㄴ해도 직원분들이 너무 좋아요! ㅋ곡와주새요!
1307616706,인생횟집 종각본점,회,,,생각보다 너무 맛있어서 놀랐어요! 회도 너무 쫄깃하고 비린 맛 안나고 탱탱해서 맛있게 먹었어요! 일반 술집이어서 기대 안했는데 퀄리티도 좋고 직원분들도 친절하시고 좋았어요! 세트로 시켰는데 같이 나온 매운탕도 칼칼하고 간도 잘되서 맛있게 먹었어요! 다음에 또 방문 하고 싶어요ㅎㅎ
1307616706,인생횟집 종각본점,회,,,스끼다시도 다양하고 양도 많아서 테이블이 작을정도예요!! 😂 야장으로 먹었는데 너무 좋았습니다!👍🏻👍🏻👍🏻
