가게ID,가게명,평점,날짜,리뷰내용
37724979,요비 건대입구본점,,,"서울 건대에서 찾은 간사이풍 오뎅 전문점, 전 좌석이 룸 형태라 프라이빗하게 즐기기 최고였어요. 주문한 간사이풍 오뎅라벨은 맑고 깊은 다시 국물이 일품! 멸치와 가쓰오부시 향이 은은하게 퍼지며 어묵, 무, 반숙 계란이 국물 속에서 진하게 맛을 머금어 한입마다 감탄이 나왔습니다. 담백하면서도 깊은 맛 덕에 술안주로도 완벽했고, 친구와 오붓하게 즐기기에도 딱 좋았어요. 건대에서 일본식 정통 오뎅을 찾는다면 강력 추천해용❤️"
37724979,요비 건대입구본점,,,역대급으로 아늑한 조명의 술집이네요 ㅋㅋㅋ 모든 테이블이 룸테이블로 나눠져 있는 게 킬링 포인트에요! ㅋㅋㅋ 1:1로 술 마시기 딱 좋음 ㅋㅋㅋ 썸남 썸녀랑 같이 가서 술 드세요 ㅋㅋㅋ 여기 안주 맛있고 분위기 좋아요 ☺️👍
37724979,요비 건대입구본점,,,역대급으로 아늑한 조명의 술집이네요 ㅋㅋㅋ 모든 테이블이 룸테이블로 나눠져 있는 게 킬링 포인트에요! ㅋㅋㅋ 1:1로 술 마시기 딱 좋음 ㅋㅋㅋ 썸남 썸녀랑 같이 가서 술 드세요 ㅋㅋㅋ 여기 안주 맛있고 분위기 좋아요 ☺️👍
37724979,요비 건대입구본점,,,오마카세 처음 먹어보는데 메뉴 다양하고 가성비 너무 좋은 거 같아요 !! 처음 나온 전복죽도 맛있구 회도 다 신선하고 우럭튀김도 안 먹어봤는데 넘 맛있드라구용 !! 마지막으로 나온 나베랑 사케도 너무 좋았습니당 ㅎㅎ 많이파세요🥰🥰
37724979,요비 건대입구본점,,,"인당 25,000원으로 오마카세 풀코스 즐겨주셨다니 ‘갓성비’ 칭호 제대로 챙겼네요✨ 숙성회 녹았다는 말에 저희 셰프님도 미소 중입니다😊 데이트 명소로 인정해주셔서 감사합니다! 또 뵙길 기다릴게요🍣"
37724979,요비 건대입구본점,,,"인당 25,000원으로 오마카세 풀코스 즐겨주셨다니 ‘갓성비’ 칭호 제대로 챙겼네요✨ 숙성회 녹았다는 말에 저희 셰프님도 미소 중입니다😊 데이트 명소로 인정해주셔서 감사합니다! 또 뵙길 기다릴게요🍣"
37724979,요비 건대입구본점,,,저녁에 방문예약 후 이용대기 시간 바로 입장데이트연인・배우자
37724979,요비 건대입구본점,,,저녁에 방문예약 후 이용대기 시간 바로 입장데이트연인・배우자
37724979,요비 건대입구본점,,,"저희는 나가사끼 짬봉과 닭껍질튀김, 살치살 타다기에 오랜만에 분위기 잡을 겸 일품진로 먹었어요 🫶🏻"
37724979,요비 건대입구본점,,,저희는 맥주와 함께 즐겼는데. 구성이 넘 좋아요. 특히나 다른 곳에서는 보기 힘든 메뉴인 통우럭튀김. 비주얼도 상당하고 맛도 좋습니다. 이후 이어지는 나베 구성으로 코스가 잘 만들어져 있어요. 제가 방문한 날 알바분도 얼마나 친절하시던지. 기분 좋은 경험이었습니다.
37724979,요비 건대입구본점,,,저희는 맥주와 함께 즐겼는데. 구성이 넘 좋아요. 특히나 다른 곳에서는 보기 힘든 메뉴인 통우럭튀김. 비주얼도 상당하고 맛도 좋습니다. 이후 이어지는 나베 구성으로 코스가 잘 만들어져 있어요. 제가 방문한 날 알바분도 얼마나 친절하시던지. 기분 좋은 경험이었습니다.
37724979,요비 건대입구본점,,,"친구 생일겸 오랜만에 같이 술한잔 하기 좋아서 갔어요. 정말 음식이 다양하게 끊이지 않고 나왔고 음식 프레젠테이션도 예뻐서 특별한 느낌이 들었어요. 특히 회가 물흐르는 소리나는 드라이아이스 플레이트 위에 나왔는데 요놈이 하이라이트였네요. 다만 예약할때 오마카세 2인으로 예약금 5천원과 레터링 아이스크림 디저트는 천원 선금이라고 해서 총 6천원을 미리결제했는데 계산할때는 예약금 5천원만 제외하고 결제해주셨어요ㅠ 알바분께 말씀드렸는데 잘 이해를 못하신거 같기도.. 이런부분만 깔끔하면 100점 장소였어요 :) 참참, 통우럭튀김 비주얼이 완전 압도적이였고 맛도리였음!"
37724979,요비 건대입구본점,,,테이블마다 프라이빗하게 커튼쳐져있어서 옆테이블 신경 안써도되고 메뉴도 다양해서 너무 좋았어요
