가게ID,가게명,평점,날짜,리뷰내용
1848549520,도른계,,,일본계랑 오징어 꿔바로우 먹었오요!!! 맛있어요 음식은 오래 안걸리구 바로 나오구요 존맛탱이에요 군자 맛집입니다~~~ 일본계 새콤달콤 맛있어요 담에 또 와서 다른맛 도전해보랴규용!!
1848549520,도른계,,,저녁에 방문예약 없이 이용대기 시간 10분 이내 데이트
1848549520,도른계,,,저녁에 방문예약 없이 이용대기 시간 바로 입장가족모임부모님
1848549520,도른계,,,저녁에 방문예약 없이 이용대기 시간 바로 입장데이트연인・배우자
1848549520,도른계,,,저녁에 방문예약 없이 이용대기 시간 바로 입장데이트연인・배우자
1848549520,도른계,,,저녁에 방문예약 없이 이용대기 시간 바로 입장데이트연인・배우자
1848549520,도른계,,,저녁에 방문예약 없이 이용대기 시간 바로 입장데이트연인・배우자
1848549520,도른계,,,저녁에 방문예약 없이 이용대기 시간 바로 입장데이트연인・배우자
1848549520,도른계,,,저녁에 방문예약 없이 이용대기 시간 바로 입장데이트연인・배우자
1848549520,도른계,,,저녁에 방문예약 없이 이용대기 시간 바로 입장데이트연인・배우자
1848549520,도른계,,,저녁에 방문예약 없이 이용대기 시간 바로 입장일상연인・배우자
1848549520,도른계,,,"저녁에 방문예약 없이 이용대기 시간 바로 입장친목, 일상친구"
1848549520,도른계,,,저녁에 방문예약 없이 이용대기 시간 바로 입장친목친구
1848549520,도른계,,,저녁에 방문예약 없이 이용대기 시간 바로 입장친목친구
1848549520,도른계,,,저녁에 방문예약 없이 이용대기 시간 바로 입장친목친구
1848549520,도른계,,,"직원분들 서비스도 너무 좋고 친절하시며 음식의 맛, 질도 훌륭하여 좋은 가족식사가 되었습니다. 다음에도 방문할게요~!!"
1848549520,도른계,,,진짜 너무 맛있었어요.. 퍽퍽살 싫어하는데 가슴살부위까지 부드럽고 양념이랑 너무 잘 어울리고 일본계 진짜 취향 ㅠㅠ 태국계랑 미국계도 너무 먹어보고 싶어요
1848549520,도른계,,,"처음 먹어보는 메뉴들이었는데 우선 일본계는 야끼소바가 있고 양념이 맛있어서 좋았고, 불닭볶음 콘치즈면은 매운 메뉴랑 같이 먹으면 좋을거 같아요!"
1848549520,도른계,,,처음 와봤는데 맛있어요 ㅎㅎ 분위기도 좋고 즐거운시간 이었어요!! 근처 오면 또 올듯요 ㅎㅎ
1848549520,도른계,,,처음와봤는데 맛있어용!!! 일본계 먹었는데 맛있습니당
1848549520,도른계,,,치킨의 신세계라고 할까? 치즈케잌 얹어 한입 먹으니 정말 맛있네요.
1848549520,도른계,,,친구 추천으로 미국계 불닭을 먹었는데 진짜 처음 먹어보는 신선한 조합인데 치킨도 너무 맛있고 구운치킨이라 껍질도 부드러워서 만족입니다!! 불닭은 말로 표현 안해도 모두가 아실만한 맛인데 치킨과 궁합이 너무 좋네요!!
1848549520,도른계,,,"특별한 메뉴도 너무 좋고, 먹기 좋게 현장에서 잘라주시는 친절함도 너무 좋았습니다."
1848549520,도른계,,,"특이한 치킨종류가 많아서 뭐 먹을지 고민하다가 미국계 주문했어요~ 나중에 일본계, 태국계, 한국계 하나씩 다 먹어보고 싶어요^^ 미국계 느끼할줄 알았는데 안느끼하네요~ 케익도 있고 메이플시럽도 뿌려주시는데 킥이네요~ 다음에 또 방문할게요^^ 직원분도 친절하세요^^"
1848549520,도른계,,,평범한 치킨먹다가 색다른 맛으로 먹으니 정말 새롭고 맛있었습니다 다음에 또 올예정!
1848549520,도른계,,,푸팟퐁커리 볶음밥도 버터의 고소함과 약간 매콤함까지 더해져서 조화롭게 맛있어요!! 근데 미국계도 크림인데 이 볶음밥도 크리미해서 미국계 말고 다른 거랑 먹으면 더 잘 어울릴 거 같았어요!
2029555199,충만식당 광장점,,,목살정식은 처음 시켜봤는데 역시 맛있습니다!무슨 메뉴를 시켜도 걱정이 안돼요ㅎㅎ다 맛있을거니까!
2029555199,충만식당 광장점,,,어떻게 하면 가성비 있게 그렇다고 품질은 떨어지지 않는 프리미엄 메뉴를 구성할까 늘 고민해요. 가성비맛집 충만식당 이름에 걸맞는 식당되려고 노력하겠습니다.
2029555199,충만식당 광장점,,,오늘의 메뉴 목살정식 올라온거보고 바로 달려왔네요 오늘도 맛있게 먹고 가요ㅎㅎ
2029555199,충만식당 광장점,,,오실때마다 충만데리야끼치킨정식을 시키시는 한결같은 우리 단골고객님~~^^ 리뷰 너무 감사드립니다~~담에 오시면 교촌치킨 12년 사장님의 닭요리의 진수 깐풍기를 서비스로 드리겠습니다~~^^
2029555199,충만식당 광장점,,,우와~~'너무 맛있는 집 발견'이란 문장에 도파민 뿜뿜입니다. 어떻게 하면 가성비있게 충만한 한끼를 내어드릴까? 항상 남편과 함께 고민합니다. 담에 들르시면 꼭 사례할께요. 아는 체 해주세요^^
2029555199,충만식당 광장점,,,음식이 맛있고 양도 많은데 사장님께서 너무 친절하셔서 자주 방문하고 있어요 ദ്ദിᐡ•͈ ·̫ •͈ᐡ ) 저는 편하고 든든히 먹고싶어서 한그릇 음식(덮밥류)을 자주 시켜먹어요! 전에 다른 친구가 주문한 음식도 함께 맛보았는데 덮밥류가 아니어도 맛있었어요 :)
2029555199,충만식당 광장점,,,자주 들르는 곳인데 너무너무 맛있고 사장님도 친절하세요! 오늘도 잘 먹고 갑니다😊
2029555199,충만식당 광장점,,,자주오는데 여기는 김치제육이 너무너무 맛있습니당 ㅜㅜ 사장님도 친절하셔서 항상 기분 좋게 먹어요!!! 든든하고 맛도 좋고 행복한 식사입니당😍😍
2029555199,충만식당 광장점,,,자주자주 갈 수 있을 것 같아요. 대중교통으로 이용해서 가야 하기 때문에 접근성도 좋고 회사나 학교 주변에 있으신 분들은 가서 함께 하시기 너무 좋습니다. 저녁까지 장사하신다고 하니 저녁에 퇴근할 때 포장해서 집에 가도 너무 좋을 것 같아요. 잘 먹었습니다.
2029555199,충만식당 광장점,,,저녁에 방문예약 없이 이용대기 시간 바로 입장일상혼자
2029555199,충만식당 광장점,,,점심에 방문예약 없이 이용대기 시간 바로 입장일상혼자
2029555199,충만식당 광장점,,,제 최애메뉴 [철판구이데리야끼치킨정식] 제일 맛있습니다
2029555199,충만식당 광장점,,,조용한 동네에 분위기좋은 밥집이에요! 모든 메뉴가 만원 이하로 저렴한데 너무 맛있어요 ㅎㅎ
2029555199,충만식당 광장점,,,짧은 리뷰지만 힘이 됩니다~ 교촌치킨 12년 경력 사장님의 치킨요리의 진수인 서비스 깐풍기를 드리겠습니다~~^^
2029555199,충만식당 광장점,,,첫 리뷰고객님이세요~~칭찬 리뷰 너무 감사합니다~~리뷰 보여주시면 음료 서비스 드릴께요~~담에 오시면 꼭 보여주세요~~^^
2029555199,충만식당 광장점,,,항상 맛있는 식사로 대접할 수 있게 노력할께요~~
