가게ID,가게명,평점,날짜,리뷰내용
1252860220,백일도,,,가족모임이 있어서 수산시장 횟집에서 포장할까하다 예전에 찜콩해놨던 백일도에 가기로하고 포장예약 미리해서 다행히 바로 픽업했는데 어느 정도길래 웨이팅이 이리심할까했는데... 방어랑 광어 참돔 선택모둠이랑 해산물 모둠 포장했는데 회 완젼 맛있어서 놀랬어요ㅜㅠ 밥이랑 초밥해먹어도 맛있고 와사비에 간장만 찍어도 맛있고..🤤 무조건 단골예정!! 매장식사보단 포장 추천드려요~ 종류도 다양해서 골라먹는재미도 있습니다 ㅎㅎ
1252860220,백일도,,,"겨울엔 대방어, 다른 계절에도 싱싱한 생선이랑 해산물로 늘 기분좋게 방문합니다!"
1252860220,백일도,,,기분좋은 맛있는 시간 만들어주신 사장님과 전종서보다 아름다우신 사모님께 감사드립니다~
1252860220,백일도,,,남편이 먼저 방문해서 물회 먹어보고 너무 맛있다고 해서 포장해서 집에서 먹어봤는데 중곡동임에도 불구하고 웨이팅이 있을 정도로 맛집이었네요. 회도 많이 들어있고 물회 소스도 맛있네요!
1252860220,백일도,,,"다양한 조합으로 먹을 수 있어 맛있고, 신선한 횟감을 쓰시는게 느껴집니다."
1252860220,백일도,,,대방어랑 광어랑 둘다 너무 신선 쫄깃 ! 반찬도 잘챙겨주시고 너무 맛있게 잘 먹었어요~ 역시 웨이팅이 긴 이유가 있는 맛집이였어요
1252860220,백일도,,,대방어철이 되고난후 웨이팅이 너무 길어서 못갔었는데 드디어 방문했어요!!!!!ㅠㅠ 얼마만인지ㅠㅠㅠ
1252860220,백일도,,,두툼하니 맛나게 썰어주셨네요. 오독오독 맛있게 먹었어요. 야채도 많이 주시고 너무 좋네요~
1252860220,백일도,,,"리뷰 1,376사진 1,529팔로워 67"
1252860220,백일도,,,"리뷰 1,376사진 1,529팔로워 67"
1252860220,백일도,,,"무엇보다 초데리밥 두 공기, 쌈채소, 날치알, 백김치 같이 주시는 구성이 다른데와 차별점이에요"
1252860220,백일도,,,바쁘신데 별도로 회 손질 법 까지 부탁드렸더니 기꺼이 해주셔서 정말 너무 감사하게 맛있게 행복하게 즐겁게 먹었습니다. 너무 고맙습니다!😎👍👍👍👍👍
1252860220,백일도,,,"방어 맛집이라고 해서 방문했는데 전화예약도 가능하다고 들었는데 바쁘신지 받으시질 않길래 21시에 포장픽업주문 하고 싶어서 17시에 방문했는데 어우,,, 사람들이 엄첟나게 많더라구요. 17시에 이미 최대한 빨리 받으려면 20시부터 포장픽업 할수있다고 하셨는데 저는 21시에 할거여서 주문 넣어놓고 볼일보고 여유롭게 21시에 다시 방문했는데 주문 시간대별로 메뉴가 나오고 있어서 21시 포장이였어도 21시30분넘어서 픽업했습니다. 포장주문도 엄청났지만 매장도 협소해서 더더 웨이팅이 심하더라구요"
1252860220,백일도,,,"사장님 내외분, 직원분들 늘 친절하세요. 다들 너무 바쁘신데 건강 챙기시고 오래 해주시길🍣"
1252860220,백일도,,,"시마아지, 참돔, 민어(부레, 껍질 포함). 소(1.5인분)+ 전어(사이드, 1만원)."
1252860220,백일도,,,신선하고 맛있고 친절하시고!! 정말 좋아하는 식당이에요!!👍👍👍👍👍👍👍👍
1252860220,백일도,,,올 한해 정말 방어 원없이 먹은 것 같아요. 항상 갈때마다 너무 친절하게 잘해주셔서 감사합니다. 사장님부부분들 너무 친절하고 감사합니다. 올 해 벌써 포장까지 함쳐서 5번 정도 간 것 같아요. 여기 스끼다시
1252860220,백일도,,,웨이팅 빡세다던 그 백일도 드디어가보았습니다...진짜마싯고 우니 사이드꼭드세요
1252860220,백일도,,,"웨이팅이 있긴 하지만 충분히 기다릴 만한 가치가 있고, 물회도 맛있는데!!! 추가 주문하면 주는 매운탕까지 완벽했어요."
1252860220,백일도,,,이번 겨울 방어는 여기서 nn번째 머것서요 그만큼 개꿀맛
1252860220,백일도,,,이번 겨울에 진짜 제 칭긔들 돌려가며 다 소개시켜줬어요
1252860220,백일도,,,저녁에 방문예약 없이 이용대기 시간 10분 이내 친목친구
1252860220,백일도,,,저녁에 방문예약 없이 이용대기 시간 30분 이내일상친척・형제
1252860220,백일도,,,저녁에 방문예약 없이 이용대기 시간 바로 입장데이트연인・배우자
1252860220,백일도,,,저녁에 방문예약 없이 이용대기 시간 바로 입장일상친구
1252860220,백일도,,,저녁에 방문예약 후 이용대기 시간 1시간 이상데이트연인・배우자
1252860220,백일도,,,저녁에 방문예약 후 이용대기 시간 2시간 이상일상연인・배우자
1252860220,백일도,,,저녁에 방문예약 후 이용대기 시간 2시간 이상일상연인・배우자
1252860220,백일도,,,"저녁에 방문예약 후 이용대기 시간 30분 이내데이트, 친목친구"
1252860220,백일도,,,저녁에 방문예약 후 이용대기 시간 30분 이상일상친척・형제
1252860220,백일도,,,저녁에 방문포장·배달 이용대기 시간 10분 이내 일상연인・배우자
1252860220,백일도,,,점심에 방문예약 없이 이용대기 시간 바로 입장일상기타
1252860220,백일도,,,점심에 방문예약 없이 이용대기 시간 바로 입장일상기타
1252860220,백일도,,,점심에 방문포장·배달 이용대기 시간 바로 입장일상연인・배우자
1252860220,백일도,,,주말에 캐치테이블로 2:30에 웨이팅 신청하고 8:30쯤 들어갔지만 너무 맛있었어요! 매운탕에 수제비 사리 꼭 추가해주세요.. ❤️ 방어 대자로 여자 4명이서 배불리 먹었습니다.
1252860220,백일도,,,중곡동에서 아마 가장 유명한 식당이지 않을까 싶어요. 주말에 오픈시간부터 명단 작성하러 갔는데 이미 순번이 30번대.. 😅 유독 방어철에 웨이팅 지옥인 곳 ㅠㅠ 그래도 포장은 대기가 짧으니 시간내서 오시는 분은 포장해서 드시는 걸 추천드려요. 방어가 다 거기서 거기지 않나 생각했지만 백일도 방어는 두툼하고 회전율이 좋아서인지 먹을 때마다 엄청 신선한 느낌이 들어서 확실히 독보적 맛집이라고 할만 합니다👍 저도 그렇고 같이 온 사람들도 모두 인생방어집이라고 극찬했어요 ^^ 무엇보다 같이 내어주는 초대리 밥.. 간이 예술입니다ㅋㅋ
1252860220,백일도,,,"중곡시장 신선한 횟집 ‘백일도’ 다양한 구성의 회와 해산물을 갓성비로 이용할 수 있는 곳이에요👍 도다리,참돔,우럭으러 구성된 1.5인 세트 구성은 혼술러에게 충분한 양이며 초대리밥과 묵은지,양념장을 곁들이고 위스키랑 페어링 하였네요."
1252860220,백일도,,,진짜 진짜 맛도 맛이지만 사장님이신지.. 직원 분이신지 여튼 백일도에서 일하시는 분들 모두 너무나 친절하십니다!!!!!!!!
1252860220,백일도,,,집근처에 있어서 미리 포장주문 전화하고 20분 뒤에 가면 바로 주세요~사장님 넘 친절하시고 회두 넘 맛있어서 자주 먹습니다.
1252860220,백일도,,,최고의 맛집 가성비 가심비 쵝오 최고! 회 맛도 완전 일품이에요 사장님도 직원분도 친절 하시고 콜키지 프리에다가 회가 어쩜 이리 달달 하다는걸~~~ 딱 회만 전문전 해산물도 맛나고 스끼다시로 배 채우는 집이 아니라는~~~ 너무너무너무 맛나요 가격도 착해소 요것저것 먹고 싶은거 위만 허락해준다면 다 들어감요
1252860220,백일도,,,추석연휴에 친구와 방어와 전어 돌멍게까지 알차게 잘 먹었어요~~❤️❤️
1252860220,백일도,,,추운날이 딱 좋은 대방어 맛집 입니다~~ 매장에서 먹어서 더 맛있게 먹었어요^^ 포장도 좋지만 역시 가서 먹는게 좋네요
1252860220,백일도,,,"캐치테이블 대기 해서 한시간 반 정도 기다렸다 들어갔어요, 가성비도 좋고 콜키지도 무료라 좋네요!"
1252860220,백일도,,,평일 낮에 웨이팅 명단 미리 작성해 놓고 저녁에 맞춰 들어갔습니다! 웨이팅은 빡세지만 대방어는 미쳤어요..
1252860220,백일도,,,항상 애용하는 횟집입니다~ 요즘 물가가 올라서 그런지 물회 안에 회는 쩜 줄었네요~ 그래도 육수가 맛나서 재방문 하려구요~~
1252860220,백일도,,,해산물 이렇게 먹을 수 있는 곳 여기밖에 없음
1252860220,백일도,,,"행복지수 153%,중곡시장 횟집🐟🍣 ‘백일도’에서만 느낄 수 있는 행복감이에요🤗 푸짐한 구성의 활어회들과 곁들여 먹는 샤리,날치알,묵은지 등으로 구성하는 D.I.Y 회김밥도 맛있어요~ 오늘 매운탕 대신 먹어본 전복라면은 이름만큼이나 풍부한 구성력을 자랑해요. 전복,황태,대파,청양고추,콩나물이 들어가 있고 해장도 되면서 양은 냄비 담음새로 푸짐하게 나오네요! 백일도와 함께 하는 봄날의 미식 운치 어떠세요?"
1252860220,백일도,,,회 도톰해서 식감미쳤고 신선하고 모든게 완벽해요ㅠㅠㅠㅠㅠ해산물도 싱싱 존맛탱 그 자체!!!!
1738768651,소랑도생선회,,,50분 정도 대기해서 들어갔습니다 ㅠ 근데 회가 거의 품절이라 간재미무침 시켜먹었습니다 ㅠㅠ 갓김치도 짜고 회무침도 너무 짜고 국도 짜고 같이 간 일행도 너무 짜다고 해서 아쉬웠습니다 ㅠ 좀만 간을 조절 했으면 좋겠습니다
1738768651,소랑도생선회,,,가게 이전 하기 전부터 왔었는데 이전하고나서 장소도 더 깔끔해지고 단체모임하기 더 좋아졌어요!
1738768651,소랑도생선회,,,가게 이전 후 처음 방문했는데 규모도 커지고 웨이팅도 심해졌네요ㅜ당연히 맛있다보니 어쩔수없는ㅜ오늘도 맛있게 잘먹었어요
1738768651,소랑도생선회,,,가오리와 삼치회는 여기 거의 시그니처급 메누에다가 겨울이라 그런지 더더욱 싱싱하고 고속하면서 쫄깃한 식감까지해서 완벽했구요.
1738768651,소랑도생선회,,,그런데 새로 이전한 가게에서 간재무 무침을 먹었는데 뼈가 너무 억세서 먹기 힒들었다
1738768651,소랑도생선회,,,"그런데 포장은 김치, 김, 간장과 쌈장, 마늘고추 외에 스키다시(다른 밑반찬) 없으니 매장이용 추천드릴게요:)"
1738768651,소랑도생선회,,,김에 싸 먹다보다 보니 중독성이 생기는맛이랄까(!?!)
1738768651,소랑도생선회,,,남은 회무침에 공깃밥 비벼먹으니 너무 맛있었습니다~ 횟집답게 회전율은 더뎠지만..
1738768651,소랑도생선회,,,"너무 지인추천으로 와보고 싶었는데 평일에 드디어 왔어요! 사장님, 직원분들도 너무 다 친절하시고 너무 쾌적하게 잘 먹었습니다!"
1738768651,소랑도생선회,,,노랑가오리회를 먹어보고 싶었는데 이날은 없어서 맛을 못봤습니다...다음엔 꼭 맛봐야 겠어요.
1738768651,소랑도생선회,,,대삼치회가 있어서 가봤습니다. 직원분들 손도 빠르시고 음식 맛있는 건 말해 뭐해요. 위스키 콜키지가 1.5만원이라 더 좋았습니다. 간재미무침 시키면 비벼먹으라고 밥도 주세요. 최고.
1738768651,소랑도생선회,,,"리뷰 2,111사진 1,056팔로워 81"
1738768651,소랑도생선회,,,"매장 이전 후 첫 방문인데, 훨씬 넓어지고 깔끔해서 좋아요"
1738768651,소랑도생선회,,,"먹고 싶은 메뉴가 있어 한참을 기다렸는데 재료가 떨어지면 떨어졌다 말을 하던가, 그런거 전혀 없이 무작정 기다리기만 하다 들어가서 재료들이 소진 된 걸 앎"
1738768651,소랑도생선회,,,"방문해서 바로 들어갔구요 늦게가서 병어회무침, 수육, 문어는 소진되었지만 붕장어회랑 삼치회시켰습니다. 붕장어회 살짝 세꼬시처럼 뼈있는데 세꼬시 좋아하면 다들 좋아할거같아요 초밥처럼 먹으려고 밥도 주문했는데 참기름에 깨소금 해주시고 ㅎㅎ 부족한거 같아 삼치회 시켰는데 방어나 참치 느낌이 전혀 아닙니다. 식감이 있는 회가 아니기에 이건 호불호가 있을거같아요~그래도 회좋아하는 저는 맛있게 양념장에 잘먹었구요 몇점없는 기름진 부위 지느러미쪽도 기름장에 먹으니 더 맛있어요 갓김치에 같이 먹으니 회가 더 맛있네요! 그리고 서비스 탕도 장어탕인가? 이름은 까먹었는데 맛있어요 가시가 아닌 뼈채 먹으니 맛있구요 12시까지라 부랴부랴먹었는데 부담안주셔서 넘 감사했어요 노랑가오리회,병어무침먹르러갈게요^^"
1738768651,소랑도생선회,,,"병어회는 식갑도 좋고, 갑오징어 숙회는 쫄깃하고, 준치회무침은새콤달콤매콩해서 좋았습니다. 된장국도 시원하고 쌈장도 맛있어서 오랜만에 힐링하고 왔어요"
1738768651,소랑도생선회,,,"살면서 먹어본 전어회랑 전어구이 중 제일 맛있었어요! 오픈시간인 3시에 맞추어 찾아갔더니 예약 없이도 바로 들어가서 먹을 수 있어 좋았고, 전어회와 세꼬시 어떻게 먹어도 고소하고 신선하니 맛있더라고요ㅎㅎ 전어구이도 뼈가 별로 거슬리지 않고 바삭고소 꿀맛이었습니다! 청하 마셨는데 술술 들어가서 조금 과음했네요🤣"
1738768651,소랑도생선회,,,"삼치회 : 부위별로 4pc 정도 나오고 신선했어요. 선어회 종류가 잘 물러지고 물맛 나기 쉬운데, 나름 깔끔했습니다. 다만, 선어회 자체가 살짝 취향타는 횟감이라 연어, 방어를 기대하고 먹는 분들이라면 엥? 하실 수 있습니다."
1738768651,소랑도생선회,,,삼치회를 너무 맛있게 먹었어요. 반찬도 잘 나오고. 다만 하나 아쉬운 점은 갓김치도 맛있긴 하지만 묵은지를 같이 먹으면 더 맛있는데... 친절하시고 깔끔하고 너무 좋았어요.
1738768651,소랑도생선회,,,"서울에서 먹기 힘든 회 전문점. 노랑가오리회,간재미무침(feat.덜미살수육),병어회,갑오징어숙회,서비스로 주신 삼치뱃살, 노랑가오리 애를 아껴먹고 있었는데 고소한 노랑가오리회의 애를 서비스로 이만큼 주시니... 감사할 따름. 잘 먹었습니다"
1738768651,소랑도생선회,,,소랑도에서 가을전어 개시하고 왔어요!! 신선한 재료를 사용해서 꼬숩고 맛있어요🤤 무침 먹고 꼭 밥 비벼드세요!!
1738768651,소랑도생선회,,,수육은 메뉴 2개시키면 시킬 수 있었던것 같은데 한정수량이라 먹어봤어요! 수육은 따뜻할때 맛있으니까 먼저 드세요!
1738768651,소랑도생선회,,,썩어도 준치라더니 ㅎㅎ 정말맛있구요~삼치회는 서울서 맛보기 힘든데 가까운곳에 소랑도가있다니 행운이네요♡
1738768651,소랑도생선회,,,여기오면 꼭 무침회를 시켜서 수육이랑 먹어야 별미입니다 이정도면 가성비 너무 좋고 회도 신선하고 배터지게 먹고와요🩵
1738768651,소랑도생선회,,,오며가며 볼때마다 사람 많아서 궁금했는데.. 헐랭… 겁나 맛있네요 ㅎㅎㅎ 굴 탱글탱글 싱싱하고 회무침도 간 딱 적절. 심지어 기본메뉴인 간재미탕만으로도 소주 한병 술술 들어갑니다 ㅎㅎ 이미 사람 많아서 더 많아지진 않으면 좋겠습니다만…… ㅎㅎ
1738768651,소랑도생선회,,,저녁에 방문예약 없이 이용대기 시간 10분 이내 친목지인・동료
1738768651,소랑도생선회,,,"저녁에 방문예약 없이 이용대기 시간 1시간 이상데이트, 친목, 기념일, 비즈니스연인・배우자, 친구, 지인・동료"
1738768651,소랑도생선회,,,저녁에 방문예약 없이 이용대기 시간 30분 이내데이트연인・배우자
1738768651,소랑도생선회,,,저녁에 방문예약 없이 이용대기 시간 30분 이내친목지인・동료
1738768651,소랑도생선회,,,저녁에 방문예약 없이 이용대기 시간 30분 이내친목친구
1738768651,소랑도생선회,,,저녁에 방문예약 없이 이용대기 시간 바로 입장나들이혼자
1738768651,소랑도생선회,,,"저녁에 방문예약 없이 이용대기 시간 바로 입장데이트, 가족모임부모님, 친척・형제"
1738768651,소랑도생선회,,,저녁에 방문예약 없이 이용대기 시간 바로 입장데이트연인・배우자
1738768651,소랑도생선회,,,저녁에 방문예약 없이 이용대기 시간 바로 입장데이트연인・배우자
1738768651,소랑도생선회,,,저녁에 방문예약 없이 이용대기 시간 바로 입장데이트연인・배우자
1738768651,소랑도생선회,,,저녁에 방문예약 없이 이용대기 시간 바로 입장일상연인・배우자
1738768651,소랑도생선회,,,저녁에 방문예약 없이 이용대기 시간 바로 입장친목
1738768651,소랑도생선회,,,저녁에 방문예약 없이 이용대기 시간 바로 입장친목지인・동료
1738768651,소랑도생선회,,,저녁에 방문예약 없이 이용대기 시간 바로 입장친목친구
1738768651,소랑도생선회,,,저녁에 방문예약 후 이용대기 시간 30분 이내데이트연인・배우자
1738768651,소랑도생선회,,,저녁에 방문예약 후 이용대기 시간 바로 입장데이트연인・배우자
1738768651,소랑도생선회,,,저녁에 방문포장·배달 이용대기 시간 30분 이내가족모임혼자
1738768651,소랑도생선회,,,점심에 방문예약 없이 이용대기 시간 바로 입장데이트연인・배우자
1738768651,소랑도생선회,,,점심에 방문예약 없이 이용대기 시간 바로 입장친목친구
1738768651,소랑도생선회,,,점심에 방문포장·배달 이용대기 시간 바로 입장가족모임부모님
1738768651,소랑도생선회,,,중곡에서 군자로 이사오고 첫 방문이에요! 여기가 여수입니다 ~~ 🙂🙂🙂🐽🐽🐽
1738768651,소랑도생선회,,,진짜진짜 신선하고 맛있어요! 무침은 꼭 밥이랑 비벼드세요🥹❤️ 사장님 직원분들 다 너무 친절하시고 매장도 깨끗해서 좋아요👍
1738768651,소랑도생선회,,,평일 6시반 가까스로 웨이팅 안하고 바로 들어가서 먹었어요..! 병어 처음 먹어보는데 넘 맛있고 전어회도 진짜 맛있어요 일단 비쥬얼이 미쳤자노아요??! 둘이서 욕심내서 두개 다 시켰더니 넘 많더라구요 ㅋㅋㅋㅋ큐ㅠㅠ
1738768651,소랑도생선회,,,항상 웨이팅이있길래 오늘 작정하고 가봤는데 역시나 맛있네요👍💕
1087762017,연참치 구의동생선회,,,구성도 알차고 음식도 맛있습니다!! 구의동 참치집 중에 제일 맛있는 것 같습니다!! 적극추천드려요!
1087762017,연참치 구의동생선회,,,구의 맛집 연참치! 간만에 혼술 할곳 없나하다 참치 땡겨서 왔는데 겨우 한자리 있어서 혼술 하네요!!
1087762017,연참치 구의동생선회,,,구의동에서 가장 맛있는 참치 가게인것같아요~~ 양도 엄청 푸짐하고 음식도 너무 맛있어요!!❤️❤️
1087762017,연참치 구의동생선회,,,남자 셋이서 인당 3만원꼴로 한판 가득한 혼마구로를 먹으면 이집 사장님은 뭐 남기시는건지 모르겠어요
1087762017,연참치 구의동생선회,,,동네에 맛있는 참치집이 있다는건 너무 행복한 일이죠😊항상 참치가 생각나면 오는 곳입니다
1087762017,연참치 구의동생선회,,,동네에 있어서 항상 오고 싶었는데 !! 드디어 왔네요! 친절하고 맛도 넘 좋네요~~~ 일단 참치 등장하자마자 눈 휘둥그레!!!!👍🏻 강추합니다
1087762017,연참치 구의동생선회,,,"레몬 슬라이스, 꽃 장식, 케일, 무순 등과 함께 나오는 구성도 매우 고급스럽고, 사진 찍기에도 완벽한 플레이팅이었습니다. 기본 미소 된장국과 곁들여져 있는 음료도 정성스러웠고, 전반적인 서비스와 분위기도 차분하고 만족스러웠어요."
1087762017,연참치 구의동생선회,,,맛있게잘먹었습니다 신선해요 화끈하게 김많이주셔서 좋아요 자꾸 뭐뭐 더 요청하는것도 힘든일이라서여 🤭 재방문의사있습니당
1087762017,연참치 구의동생선회,,,맛있는 거 먹고 싶을 때 동료들이랑 종종가요. 스페셜 a하면 배꼽살도 나오고 구성이 완전 최고 .. 이런 가성비 없는 듯 해요.
1087762017,연참치 구의동생선회,,,"매장이 깨끗하고, 직원분도 매우 친절해서 좋았어요. 생각보다 양도 정말 많아서 2명에서 오면 배부르게 먹을수 있어요. 그리구 무엇보다 맛도 있어서 맛집리스트에 넣었습니다😁"
1087762017,연참치 구의동생선회,,,무한리필보다는 이렇게 먹는게 훨씬 더 가성비도 그리고 만족도도 높아요🩷
1087762017,연참치 구의동생선회,,,밤에 방문예약 없이 이용대기 시간 바로 입장
1087762017,연참치 구의동생선회,,,밤에 방문예약 후 이용대기 시간 바로 입장가족모임부모님
1087762017,연참치 구의동생선회,,,부위별로 골고루 잘 나오고 해동이 알맞게 잘 됐어요. 양도 충분히 많고 친절히 안내해주시네요. 원래 가던곳이 없어져서 처음 와봤는데 여기로 바로 고정했습니다. 심지어 와사비마저 그냥 와사비만 먹어도 맛있어요.. 찐이네요.. 삿포로 생맥까지 😭🫶🏻
1087762017,연참치 구의동생선회,,,사장님도 너무친절하시고 참치도 좋은부위 위주로 너무 잘주세요 잘먹었습니다
1087762017,연참치 구의동생선회,,,생일겸해서 방문했는데 참치도 너무너무 맛있고 사장님도 친절하세요! 가격도 착하고 맛도 짱입니다요
1087762017,연참치 구의동생선회,,,서울 여행와서 처음으로 들른 곳인데 정말 너무 만족해요! 고급지고 너무너무 맛있습니다 !^^
1087762017,연참치 구의동생선회,,,소문듣고방문하게됬는데 맛있네요:) 입에서살살녹아요 ㅋㅋㅋㅋ 또 수제와사비가 너무맛있어요!!
1087762017,연참치 구의동생선회,,,신선하고 진짜 맛있어요! 그리고 사장님이 친절해요 ^-^!!앞으로 참치는 연참치만 올거같아요 !! 내돈내산!
1087762017,연참치 구의동생선회,,,신선한 참치회를 가성비 좋게 맛볼 수 있습니다. 부담없이 맛있게 즐기기에 딱입니다.
1087762017,연참치 구의동생선회,,,양도 엄청 푸짐하고 부위도 다양해서 다음에 또 재방문 예정이에요 😃
1087762017,연참치 구의동생선회,,,양도 적당하고 가격도 합리적입니다. 참치 생각날땐 여기로 와야 겠네요
1087762017,연참치 구의동생선회,,,저녁에 방문예약 없이 이용대기 시간 30분 이내친목지인・동료
1087762017,연참치 구의동생선회,,,"저녁에 방문예약 없이 이용대기 시간 바로 입장나들이, 가족모임연인・배우자, 부모님"
1087762017,연참치 구의동생선회,,,"저녁에 방문예약 없이 이용대기 시간 바로 입장데이트, 친목, 기념일, 회식, 가족모임친구, 연인・배우자"
1087762017,연참치 구의동생선회,,,저녁에 방문예약 없이 이용대기 시간 바로 입장데이트연인・배우자
1087762017,연참치 구의동생선회,,,저녁에 방문예약 없이 이용대기 시간 바로 입장데이트연인・배우자
1087762017,연참치 구의동생선회,,,저녁에 방문예약 없이 이용대기 시간 바로 입장데이트연인・배우자
1087762017,연참치 구의동생선회,,,"저녁에 방문예약 없이 이용대기 시간 바로 입장회식, 가족모임부모님"
1087762017,연참치 구의동생선회,,,"저녁에 방문예약 후 이용대기 시간 바로 입장데이트, 일상연인・배우자"
1087762017,연참치 구의동생선회,,,저녁에 방문예약 후 이용대기 시간 바로 입장데이트연인・배우자
1087762017,연참치 구의동생선회,,,좋게 봐주셔서 감사합니다 앞으로 잘 부탁드립니다 ~
1087762017,연참치 구의동생선회,,,좋게 봐주셔서 감사합니다 참치 생각드시면 언제든 방문해주세요 잘 모시겠습니다 ~ 참고로 부부는 아닙니다~^^
1087762017,연참치 구의동생선회,,,진짜 맛있어요!! 좋은 부위로 양도많고 사장님이 정말 친절하셔서 기분좋게 식사했어요><🍣
1087762017,연참치 구의동생선회,,,질 좋은 참치를 합리적인 가격에 즐길 수 있어서 앞으로 참치회 먹고싶으면 연참치 올 거 같아요
1087762017,연참치 구의동생선회,,,참치 맛도 기가막히게 맛있고 분위기도 한 잔하기에 딱이네요!^^ 방문하시면 만족스런 식사갈 될 것 같습니다!
1087762017,연참치 구의동생선회,,,참치 맛있는건 당연하구요! 메로구이도 너무 맛있어요. 사장님 너무 친절하세요!! 기분 좋게~ 참치 맛있게 먹고 싶은날 연참치 추천합니다!! 👍👍👍
1087762017,연참치 구의동생선회,,,참치 비린내가 하나도 안 나고 너무너무 신선하고 맛있어요👍 사장님도 먹는방법 친절하게 설명해주시구 재방문의사 완전 있습니다!! 번창하세요❤️
