가게ID,가게명,평점,날짜,리뷰내용
35425169,"늘봄해물찜&손칼국수 답십리본점아귀찜,해물찜",,,"크~ 올만에 답십리 올 일 있어서 왔다가 들렸어요!! 소자인데도 양이 정말 많고, 맵게도 가능해서 좋아요!!"
35425169,"늘봄해물찜&손칼국수 답십리본점아귀찜,해물찜",,,평일점심특선 낙지볶음할인행사를하고있어서 무조건시켜봅니다!와우~~~~~~^세상에 센스쟁이이과장도낙지볶음한솜씨하는데 늘봄 낙지볶음은 감탄사가나오네요!
35425169,"늘봄해물찜&손칼국수 답십리본점아귀찜,해물찜",,,포장으로 해물찜먹다 방문해서 낙지볶음 먹었습니다. 별도로 밥 주문할필요 없고 요청한대로 맵기 조절가능했고 계란찜이 기본으로 나왔습니다.
35425169,"늘봄해물찜&손칼국수 답십리본점아귀찜,해물찜",,,"푸짐한 양, 신선한 재료 가족 모임으로 안성맞춤입니다.맛있게 잘 먹었습니다."
1303073086,배꼽집 더 클래식,,,가격 대비 고기 질이 정말 좋아요 한우 갈비살 먹었는데 고소한 맛이 일품이네요 1인 상차림 비용 있어도 충분히 가치 있는 음식이었어요
1303073086,배꼽집 더 클래식,,,가격 대비 고기 질이 정말 좋아요 한우 갈비살 먹었는데 고소한 맛이 일품이네요 1인 상차림 비용 있어도 충분히 가치 있는 음식이었어요
1303073086,배꼽집 더 클래식,,,"가족 외식, 회식 장소로도 좋을 것 같아 추천드립니다."
1303073086,배꼽집 더 클래식,,,갈비탕에 고기가 많아요. 딱 등장했을 때부터 그 육향이 장난 아닙니다. 정말 맛있어요. 청량리 역에 생겨서 좋네요~
1303073086,배꼽집 더 클래식,,,고기 퀄리티 넘 좋아요 후식찌개도 너무너무 맛나요 다음에 또올예정!
1303073086,배꼽집 더 클래식,,,고기도 넘 맛있구 쌈채소도 셀프바에서 가져오눈거라 가성비 넘 좋아요!! 가족들이랑 오랜만에 모임이었는데 매장이 넓고 좌석도 편해서 좋았습니당ㅎㅎ 냉면이랑 된찌도 다 맛있구 좋아여
1303073086,배꼽집 더 클래식,,,"구울 때, 육즙 하나도 안 빠지고 노릇하게 익어서 넘 맛있게 먹었습니다 ^^"
1303073086,배꼽집 더 클래식,,,너무 맛있어서 동료들도 데려가고 친구들도 데려가고 널리널리 퍼뜨리고 있는 집.
1303073086,배꼽집 더 클래식,,,넓은 매장 친절한 직원들 다양한 메뉴 특히 고기가 맛있고 평양냉면도 맛있어요 강추 입니다
1303073086,배꼽집 더 클래식,,,"늘 밑반찬중에 아이가 먹을만한 콩장이나 장조림처럼 안매운 메뉴가 있었는데, 이번엔 어묵에 고추가 들어가 있어서 매콤해서 좀 아쉬웠네요ㅠ"
1303073086,배꼽집 더 클래식,,,다음엔 양곰탕이랑 우거지 갈비탕 꼭 먹어보고싶어요🩵
1303073086,배꼽집 더 클래식,,,다음엔 양곰탕이랑 우거지 갈비탕 꼭 먹어보고싶어요🩵
1303073086,배꼽집 더 클래식,,,동네에서 챶기힘든 평냉맛집이에요. 고기가 들어간 메뉴 다 좋습니다
1303073086,배꼽집 더 클래식,,,밑반찬도 하나하 다 맛있어요!! 편하게 먹고가기 너무 좋아요 😍
1303073086,배꼽집 더 클래식,,,밑반찬도 하나하 다 맛있어요!! 편하게 먹고가기 너무 좋아요 😍
1303073086,배꼽집 더 클래식,,,부모님 모시고 오게되었어요 매장도 넓고 단체로 먹기도 편하고 음식도 빨리나오네요 솥밥이 나오니 속도 든든해요
1303073086,배꼽집 더 클래식,,,시간이 남아서 들어왔는데 너무 맛있어용! 주변 보니까 불고기 많이 드시던데 다음엔 먹어보려구욤
1303073086,배꼽집 더 클래식,,,아이도 먹기 좋은 메뉴가 있어서 가족 끼리 자주 와요
1303073086,배꼽집 더 클래식,,,안동국밥이랑 평양냉면 먹었는데 맛았네요! 평양냉면이 맛있는 음식인줄 몰랐네여 ㅎㅎ.. 육수가 시원하고 담백해서 계속 손이 갔어여. 만족스러워요!
1303073086,배꼽집 더 클래식,,,안동국밥이랑 평양냉면 먹었는데 맛았네요! 평양냉면이 맛있는 음식인줄 몰랐네여 ㅎㅎ.. 육수가 시원하고 담백해서 계속 손이 갔어여. 만족스러워요!
1303073086,배꼽집 더 클래식,,,"양질의 소고기를 후다닥 구워 먹느라 사진을 못 찍었지만 등심,살치살,돼지양념갈비,냉면까지 먹었어요. 고기 퀄리티와 무제한 야채쌈 퀄리티는 좋네요!"
1303073086,배꼽집 더 클래식,,,"양질의 소고기를 후다닥 구워 먹느라 사진을 못 찍었지만 등심,살치살,돼지양념갈비,냉면까지 먹었어요. 고기 퀄리티와 무제한 야채쌈 퀄리티는 좋네요!"
1303073086,배꼽집 더 클래식,,,"오늘은 모듬으로 먹었는데 고기 육즙이 미쳤어용 !!! 부드럽고 하나도 안질기고 육향 솔솔,,😆😆"
1303073086,배꼽집 더 클래식,,,저녁에 방문예약 없이 이용대기 시간 바로 입장가족모임아이
1303073086,배꼽집 더 클래식,,,저녁에 방문예약 없이 이용대기 시간 바로 입장데이트연인・배우자
1303073086,배꼽집 더 클래식,,,저녁에 방문예약 없이 이용대기 시간 바로 입장데이트연인・배우자
1303073086,배꼽집 더 클래식,,,저녁에 방문예약 없이 이용대기 시간 바로 입장일상연인・배우자
1303073086,배꼽집 더 클래식,,,저녁에 방문예약 없이 이용대기 시간 바로 입장일상친구
1303073086,배꼽집 더 클래식,,,"저녁에 방문예약 없이 이용대기 시간 바로 입장친목, 가족모임부모님, 친척・형제"
1303073086,배꼽집 더 클래식,,,저녁에 방문예약 없이 이용대기 시간 바로 입장친목아이
1303073086,배꼽집 더 클래식,,,저녁에 방문예약 없이 이용대기 시간 바로 입장친목지인・동료
1303073086,배꼽집 더 클래식,,,저녁에 방문예약 없이 이용대기 시간 바로 입장친목친구
1303073086,배꼽집 더 클래식,,,"점심에 방문예약 없이 이용대기 시간 바로 입장가족모임연인・배우자, 부모님, 아이"
1303073086,배꼽집 더 클래식,,,점심에 방문예약 없이 이용대기 시간 바로 입장데이트부모님
1303073086,배꼽집 더 클래식,,,점심에 방문예약 없이 이용대기 시간 바로 입장데이트연인・배우자
1303073086,배꼽집 더 클래식,,,점심에 방문예약 없이 이용대기 시간 바로 입장데이트연인・배우자
1303073086,배꼽집 더 클래식,,,점심에 방문예약 없이 이용대기 시간 바로 입장데이트연인・배우자
1303073086,배꼽집 더 클래식,,,점심에 방문예약 없이 이용대기 시간 바로 입장일상부모님
1303073086,배꼽집 더 클래식,,,점심에 방문예약 없이 이용대기 시간 바로 입장일상부모님
1303073086,배꼽집 더 클래식,,,점심에 방문예약 없이 이용대기 시간 바로 입장일상부모님
1303073086,배꼽집 더 클래식,,,점심에 방문예약 없이 이용대기 시간 바로 입장일상부모님
1303073086,배꼽집 더 클래식,,,정갈하고 교통편도 편하고 고기도 마블링이 많아요. 그리고 여기 찐 평냉 맛집입니다. 정갈하고 감칠맛나는 육수. 거칠면서 탱탱 메밀향가득한 면발. 기차타기전에 먹는 평양냉면 너무 맛있어요
1303073086,배꼽집 더 클래식,,,주차도 편리하고 시설도 좋고 맛도 좋아서 자주 방문한답니다-^^
1303073086,배꼽집 더 클래식,,,주차도 편리하고 시설도 좋고 맛도 좋아서 자주 방문한답니다-^^
1303073086,배꼽집 더 클래식,,,진짜맛있어요한입먹자마자감탄이나오고입안가득행복이퍼지면서맛이깊고풍부해요계속생각나는맛이라또먹고싶게만드는매력이있고누구에게추천해도자신있을정도로지금까지먹어본것중최고예요먹는순간기분까지좋아져서한마디로진짜맛있는고기집이에요
1303073086,배꼽집 더 클래식,,,질이 좋은거겟죠?ㅋㅋㅋㅋ육회비빔밥 먹고 갑니다~ 매장이 매우 넓어서 모임하기 좋을거같아여!
1303073086,배꼽집 더 클래식,,,쾌적하고 넓은 공간이라 여러 사람이 함께 이용하기 좋은 한우 식당이에요. 단체 회식하기에도 충분한 규모라 부담 없이 다녀올 수 있어요. 안락한 분위기의 룸도 있어서 편안하게 식사할 수 있어 좋았어요.
1303073086,배꼽집 더 클래식,,,쾌적하고 넓은 공간이라 여러 사람이 함께 이용하기 좋은 한우 식당이에요. 단체 회식하기에도 충분한 규모라 부담 없이 다녀올 수 있어요. 안락한 분위기의 룸도 있어서 편안하게 식사할 수 있어 좋았어요.
1303073086,배꼽집 더 클래식,,,평냉 이렇게 맛있게 먹어본거 너무 오랜만이라 반가웠어요~!! 면발이 불지 않고 탱탱해서 좋았어요
1303073086,배꼽집 더 클래식,,,"항상 가족 모임할 때 예약하고 식사하는데 직원분들도 친절하시고, 잘 챙겨주셔서 벌써 4번째 방문합니다 !!"
1106712251,"순대실록 청량리점순대,순댓국",,,10살 아이가 순대실록을 정말 좋아해요❤️ 오랜만에 우리도 순대곱창볶음이 당기고 아이도 여기 순대를 좋아해서 방문했습니다. 오랜만에 매콤한거 먹으니 스트레스가 풀리네요~ 깨끗하고 맛있어 아이들 데리고 오기 너무 좋아요❤️❤️❤️
1106712251,"순대실록 청량리점순대,순댓국",,,"국밥도맛있는데, 막국수도 맛있어요. 4번째 방문입니다. 재방문 의사 있습니다~~!!"
1106712251,"순대실록 청량리점순대,순댓국",,,깍두기 넘 맛있고 자리에 리필해서 먹을수 있게 해두셔서 좋았어요🤗
1106712251,"순대실록 청량리점순대,순댓국",,,깨끗한순대국이에요. 우린 순대만있는 순대국으로 골라서 먹었는데 깔끔하고 시원했어요. 오늘같이 비오는날 딱 입니다~~
1106712251,"순대실록 청량리점순대,순댓국",,,남편이랑 일곱 살 딸이랑 와서 먹었는데 국물도 깔끔하고 깍두기도 맛있어요 강추입니다
1106712251,"순대실록 청량리점순대,순댓국",,,"내 인생 순대국밥으로 등극함. 시래기 들어간 순대국밥은 처음 먹어봤는데 너무 맛있다. 건더기도 푸짐함. 순댓국은 아니지만 부산에 놀러가서 해운대에서 돼지국밥먹고 누린내때문에 실망했었는데 여기는 누린내 전혀 안나고, 내장, 고기가 다 부드럽고, 뽀얀 국물은 엄청 헤비하지는 않은데 깊은 맛도 나고 담백하면서 고소하고 감칠맛이 난다. 완전 추천."
1106712251,"순대실록 청량리점순대,순댓국",,,"맛, 서비스, 위생 3박자가 완벽한 곳! 황태콩나물국밥과 순대국을 먹었는데 국물 맛이 깊고 깔끔해서 정말 만족스러웠습니다. 직원분들도 갈때마다 항상 친절하게 응대해주셔서 기분 좋았고, 매장도 위생적으로 관리가 잘 되어 있어 안심하고 식사할 수 있었어요. 강력 추천합니다!"
1106712251,"순대실록 청량리점순대,순댓국",,,맛도 있고 숫대볶음 시키면 서비스국물까지 주시니까 일석이조였어요
1106712251,"순대실록 청량리점순대,순댓국",,,맛있게 잘 먹고 갑니다 평일 오후 2시에도 손님도 많고 배달도 많네요 ㅎㅎ
1106712251,"순대실록 청량리점순대,순댓국",,,매우만족합니다! 순대스테이크 맛 환상적이네요!
1106712251,"순대실록 청량리점순대,순댓국",,,반찬정갈하구요 반찬은 가져다주시는거더라구요친절하구요 다음에 다른것도먹어보러올게요
1106712251,"순대실록 청량리점순대,순댓국",,,밤에 방문예약 없이 이용대기 시간 바로 입장일상지인・동료
1106712251,"순대실록 청량리점순대,순댓국",,,순대국집 생겨서 반가운 마음에 들렀는데 매장도 깨끗하고 시원하고 전통순대국이랑 곱창순대국 시켰는데 내용도 많이 들어있고 맛있어요! 특히 깍두기 너무 맛있어서 자주 올거 같아요
1106712251,"순대실록 청량리점순대,순댓국",,,순대실록 뜨끈한 국물 맛있어용ㅎㅎ 순대만 순댓국 있어서 좋아요!!! >_<
1106712251,"순대실록 청량리점순대,순댓국",,,순대실록 집근처라 종종 와요 늘 맛있어요ㅎ 순대국만 파는게 아니라 다양하게 팔아서 좋습니다 특히 콩나물국밥 맛있어요 ㅎㅎ 콩나물국밥에 들깨 가루 넣어먹음 맛있어요!
1106712251,"순대실록 청량리점순대,순댓국",,,순대실록~ 전통 슌대(순대)맛을 느낄수있는곳이랍니다~ 점심때 또는 여행앞두고 기차타기전에 들러서 먹기 좋은곳~~^^
1106712251,"순대실록 청량리점순대,순댓국",,,순대실록에서 🍲 얼큰 곱창국밥이랑 얼큰 순대국밥을 맛봤어요. 곱창국밥은 국물이 칼칼하고 깊어서 속이 확 풀리는 느낌👏 곱창은 잡내 없이 쫄깃하고 고소해서 숟가락이 계속 갔습니다. 순대국밥은 진~한 국물에 얼큰한 양념이 더해져서 느끼하지 않고 딱 깔끔한 맛👍 순대도 통통하고 탱글해서 국물이랑 같이 먹으니 조합이 최고였어요. 반찬도 정갈하게 나오는데 특히 김치가 국밥이랑 환상 궁합😍 푸짐한 양 덕분에 배까지 든든했답니다!! 국밥 좋아하신다면 꼭 추천해요✨
1106712251,"순대실록 청량리점순대,순댓국",,,"순대정식 시켜서 먹었어요. 순대국 나오기 전 부드러운 순대를 먹고, 순대국 얼큰하게 잘 먹었습니다. 순대가 너무 맛있고, 감칠맛 났어요^^"
1106712251,"순대실록 청량리점순대,순댓국",,,순댓국이 고소하고 맛있어요! 고기와 순대도 많이 들어 있어요ㅎㅎ 다음에 또 올게요~!!!
1106712251,"순대실록 청량리점순대,순댓국",,,아이와 오기 좋아요. 접근성이 좋아요. 청량리와 가까워요
1106712251,"순대실록 청량리점순대,순댓국",,,아침에 방문예약 없이 이용대기 시간 바로 입장친목연인・배우자
1106712251,"순대실록 청량리점순대,순댓국",,,양도 많고 든든해서 자주 와요 4000원 추가하면 육전 정식으로 먹을 수 잇는 것도 좋아요~~!! 매장 넓고 쾌적해요!
1106712251,"순대실록 청량리점순대,순댓국",,,여자친구뿐만아니라 저도 다른 지점보다는 훨씬 맛있다고 느끼는 부분 중에 몇 가지는 국물이 진하고 순대도 쫄깃하다는 점이다.
1106712251,"순대실록 청량리점순대,순댓국",,,오늘도 맛있게 먹고갑니다! 또 올게요!
1106712251,"순대실록 청량리점순대,순댓국",,,음식도 맛있고 가성비 좋고 빨리 나와요 늦게까지 영업해서 언제나 먹을수 있어서 좋아요 ♡ 메뉴도 다양해서 이것저것 시켜먹기 좋아용
1106712251,"순대실록 청량리점순대,순댓국",,,자주 오는 곳인데 여기 순대는 진짜 너무 맛있어요! 일반적인 찰순대하고는 다르게 고기맛이 느껴져요
1106712251,"순대실록 청량리점순대,순댓국",,,저녁에 방문예약 없이 이용대기 시간 바로 입장가족모임연인・배우자
1106712251,"순대실록 청량리점순대,순댓국",,,저녁에 방문예약 없이 이용대기 시간 바로 입장데이트연인・배우자
1106712251,"순대실록 청량리점순대,순댓국",,,저녁에 방문예약 없이 이용대기 시간 바로 입장데이트연인・배우자
1106712251,"순대실록 청량리점순대,순댓국",,,저녁에 방문예약 없이 이용대기 시간 바로 입장데이트연인・배우자
1106712251,"순대실록 청량리점순대,순댓국",,,저녁에 방문예약 없이 이용대기 시간 바로 입장데이트연인・배우자
1106712251,"순대실록 청량리점순대,순댓국",,,저녁에 방문예약 없이 이용대기 시간 바로 입장데이트연인・배우자
1106712251,"순대실록 청량리점순대,순댓국",,,저녁에 방문예약 없이 이용대기 시간 바로 입장일상친구
1106712251,"순대실록 청량리점순대,순댓국",,,저녁에 방문예약 없이 이용대기 시간 바로 입장일상혼자
1106712251,"순대실록 청량리점순대,순댓국",,,저녁에 방문예약 없이 이용대기 시간 바로 입장일상혼자
1106712251,"순대실록 청량리점순대,순댓국",,,점심에 방문예약 없이 이용대기 시간 바로 입장나들이부모님
1106712251,"순대실록 청량리점순대,순댓국",,,점심에 방문예약 없이 이용대기 시간 바로 입장나들이부모님
1106712251,"순대실록 청량리점순대,순댓국",,,점심에 방문예약 없이 이용대기 시간 바로 입장나들이부모님
1106712251,"순대실록 청량리점순대,순댓국",,,점심에 방문예약 없이 이용대기 시간 바로 입장나들이혼자
1106712251,"순대실록 청량리점순대,순댓국",,,점심에 방문예약 없이 이용대기 시간 바로 입장데이트부모님
1106712251,"순대실록 청량리점순대,순댓국",,,점심에 방문예약 없이 이용대기 시간 바로 입장데이트연인・배우자
1106712251,"순대실록 청량리점순대,순댓국",,,점심에 방문예약 없이 이용대기 시간 바로 입장데이트연인・배우자
1106712251,"순대실록 청량리점순대,순댓국",,,점심에 방문예약 없이 이용대기 시간 바로 입장여행연인・배우자
1106712251,"순대실록 청량리점순대,순댓국",,,점심에 방문예약 없이 이용대기 시간 바로 입장일상혼자
1106712251,"순대실록 청량리점순대,순댓국",,,점심에 방문예약 없이 이용대기 시간 바로 입장친목연인・배우자
1106712251,"순대실록 청량리점순대,순댓국",,,"지난 방문에는 콩나물국밥, 순대국, 비빔막국수 먹었고 이번 방문에는 순대국, 뼈해장국 시켰어요!!!!"
1106712251,"순대실록 청량리점순대,순댓국",,,청량리역 근처에 맛집이 많은데 순대국 블루리본은 처음입니다. 새로 오픈한 건물에 위치하고 있어서 식당도 깨끗하고 좋습니다. 키오스크로 되어 있어 주문하기 편하고 필요한 반찬은 직원 분한테 요청하면 바로 가져다 주시네요. 👏
1106712251,"순대실록 청량리점순대,순댓국",,,청량리역에서 일찍 기차를 타야해서 24시 식당을 찾다가 블루리본 맛집이라길래 와봤는데
1106712251,"순대실록 청량리점순대,순댓국",,,한잔하고 나면 마무리는 꼭 국밥으로 합니다~! 오늘도 든든하게 잘 먹고갑니다ㅎㅎ
1106712251,"순대실록 청량리점순대,순댓국",,,회사 동료랑 주말이라 맛있는거찾다가 왔는데 대박맛집이네요!!육전세트가있을줄이야 자주올것같아요 찐맛집 발견 기분이좋네요!!맛있어요~~~~~
11633940,"안흥갈비 본점육류,고기요리",,,"4살부터 먹기 시작해서 초등학교 졸업, 중학교 졸업, 생일마다 빠짐없이 여기서 먹었어요. 그냥 맛집이 아니라 인생의 한 조각 같은 곳. 힘들 때도, 기쁠 때도 항상 생각나는 양념갈비 맛… 다른 데는 눈에도 안 들어와요. 나의 인생맛집, 평생 갑니다."
11633940,"안흥갈비 본점육류,고기요리",,,8/21까지 갈비3+1 하고 있어서 가성비 좋게 먹었어요! 안흥갈비 장안점 맛있어용 강추입니다!
11633940,"안흥갈비 본점육류,고기요리",,,n번째 또또 온 집이에요 !! 가족끼리 식사하기 너무 좋고 고기 맛있고 직원분들도 친절하십니다 ~~ 고기 시키면 맛보기냉면 같이 나와서 너무 좋아용
11633940,"안흥갈비 본점육류,고기요리",,,"가족모임으로 부모님과 아이들이 같이왔어요. 고기도 질기지않아서 아이들 먹기도 좋고, 음식 간이 너무좋아요. 양도 많아서 부담없이 먹기좋아요. 특히 후식냉면 좋아요."
11633940,"안흥갈비 본점육류,고기요리",,,갈비 넘 맛있고 술 팍팍 들어가요! 인위적인 단맛이 아니라 진짜 깊은 단맛입니다. 넘 맛있어요♡
11633940,"안흥갈비 본점육류,고기요리",,,갈비는 잘 굽기 어려운데 친절하게 구워주셔서 더 맛있었답니다
11633940,"안흥갈비 본점육류,고기요리",,,갈비양념이 적당히 달아서 먹어도먹어도 질리지가안아요~~ 후식냉면 서비스로 나오네요
11633940,"안흥갈비 본점육류,고기요리",,,계장도 너무맛있어서 매번 두접시씩 ~후식으로 나오는 냉면도 맛있습니다.
11633940,"안흥갈비 본점육류,고기요리",,,고기도 부드럽고 살코기가 많아 맛있어요 후식냉면도 푸짐~~갈비본가답네요 너무 맛있네요
11633940,"안흥갈비 본점육류,고기요리",,,달에 두세번씩 방문하는 고깃집이에요. 사장님 직원분 친절하시고 고기 맛있어요. 냉면도 후식으로 나와요!! 밑반찬도 장안동 고깃집 중에서 으뜸 급 ㅋ
11633940,"안흥갈비 본점육류,고기요리",,,"대존-맛. 양게도 반찬으로 나오고 된장찌개,물냉,비냉도 서비스로 나와요 두명이서 갈비 2인분만 먹었는데도 배터지게 먹고 만족하고 가시는 중. 다음에 또 올게요옹 ˃̵͈̑ᴗ˂̵͈̑ ❤️❤️❤️❤️ 많이파세요 🫶🏻아니그리고 기름 없는 부분으로 달라고하니까 거의 다 살고기 ㅠ 나 이런 양념갈비 처음 먹어봐 ( ᵕ̩̩ㅅᵕ̩̩ ) 넘나리 좋다"
11633940,"안흥갈비 본점육류,고기요리",,,데이트로 와서 고기먹었는데 후식냉면도 서비스로 나오고 양도 적당해서 너뮤 맛있게 먹고 갑니다 ㅎㅎ 사실 자주오는 단골집이라 조만간 또 올 것 같네요 ! 맛있어요 추천~~
11633940,"안흥갈비 본점육류,고기요리",,,돼지갈비 먹었는데 고기질 좋고 양념이 과하지 않아 먹기 좋아요. 후식 냉면에 남은 고기 같이 먹으니 굿!
11633940,"안흥갈비 본점육류,고기요리",,,"반찬들도 다 맛있고, 여기는 쌈채소랑 고기랑 같이 먹기 좋은 야채들 골고루 많이 줘서 좋아요!"
11633940,"안흥갈비 본점육류,고기요리",,,배고파서 흡입했네요~ 생갈비 주말에는 먹기힘든데!오늘 잘먹고갑니다^^
11633940,"안흥갈비 본점육류,고기요리",,,본점답게 갈비 역시 맛있고요 써비스 된장찌개도 굿😄 냉면도 써비스~~ 아이스크림도 써비스~~
11633940,"안흥갈비 본점육류,고기요리",,,서비스도 많이 주시고 반찬도 다양해서 배부르게 잘 먹었어요 고기도 신선해서 맛있고 사장님도 친절해요:)
11633940,"안흥갈비 본점육류,고기요리",,,아이가 좋아해요. 갈비도 많이 달지 않고 삼겹살도 숯불냄새가 너무 맛있게 베어서 맛있어요!
11633940,"안흥갈비 본점육류,고기요리",,,안흥갈비 3+1 행사중이네요~둘이서 많지만 배불리 맛있게 잘먹었네요 밑반찬도 깔끔하니 맛나고 게장무침도 맛납니다. 된장찌게도 맛있어서 밥도먹게 되네요~~ 수시로 불판 갈아주시고 부족함이 없는지 친절하게 서빙해주셔서 좋았습니다.~
11633940,"안흥갈비 본점육류,고기요리",,,"양념게장이랑 절인 배추, 된 같은 된장찌개도 깊은 맛이 나서 밥 한 공기 그냥 뚝딱 했어요ㅋㅋ"
11633940,"안흥갈비 본점육류,고기요리",,,양념도 너무 달지 않고 맛있어요! 잘 먹고 가요 고기먹으면 냉면도 줘서 너무너무 만족스러운 식사 하고 가요!
11633940,"안흥갈비 본점육류,고기요리",,,양도 진짜 많고 맛있었어요!! 후식 냉면도 공짜로 대박!! 양념게장도 넘 맛있어용
11633940,"안흥갈비 본점육류,고기요리",,,엄마 생신이라 방문했습니다 갈비 맛있고 직원분이 구워주셔서 편하고 타지않고 맛있게 먹었습니다 오랜만에 돼지갈비 너무 맛있었습니다 밑반찬도 맛있고 된장찌개가 일품입니다
11633940,"안흥갈비 본점육류,고기요리",,,여름 이벤트 돼지갈비 3+1로 12인분에 3인분 서비스로 저렴하게 잘 먹었어요~~👍👍
11633940,"안흥갈비 본점육류,고기요리",,,영수증 리뷰가 불편해요 2층에서 먹는데 결제후 영수증하시라고하니 먹다가 영수증 챙겨옴ㅡㅡ 정작 1층에서는 영수증만주고 결제는 나중에 하셔도되요 이러니 참 잘돌아가네요 두번째 쿠폰받았으니 어떻게하나 볼려구요
11633940,"안흥갈비 본점육류,고기요리",,,오늘은 갈비탕과 한우국밥 먹었는데 쫄깃한 고기와 가슴 속까지 시원해지는 국물맛이 일품이에요.
11633940,"안흥갈비 본점육류,고기요리",,,이벤트해서 1인분 더 먹었네요 또 올거에요 ㅋㅋ
11633940,"안흥갈비 본점육류,고기요리",,,저녁에 방문예약 없이 이용대기 시간 10분 이내 가족모임연인・배우자
11633940,"안흥갈비 본점육류,고기요리",,,저녁에 방문예약 없이 이용대기 시간 10분 이내 데이트연인・배우자
11633940,"안흥갈비 본점육류,고기요리",,,저녁에 방문예약 없이 이용대기 시간 바로 입장가족모임부모님
11633940,"안흥갈비 본점육류,고기요리",,,"저녁에 방문예약 없이 이용대기 시간 바로 입장가족모임부모님, 기타"
