가게ID,가게명,평점,날짜,리뷰내용
11633940,"안흥갈비 본점육류,고기요리",,,"저녁에 방문예약 없이 이용대기 시간 바로 입장가족모임부모님, 아이, 연인・배우자"
11633940,"안흥갈비 본점육류,고기요리",,,저녁에 방문예약 없이 이용대기 시간 바로 입장데이트연인・배우자
11633940,"안흥갈비 본점육류,고기요리",,,저녁에 방문예약 없이 이용대기 시간 바로 입장데이트연인・배우자
11633940,"안흥갈비 본점육류,고기요리",,,저녁에 방문예약 없이 이용대기 시간 바로 입장데이트연인・배우자
11633940,"안흥갈비 본점육류,고기요리",,,저녁에 방문예약 없이 이용대기 시간 바로 입장데이트연인・배우자
11633940,"안흥갈비 본점육류,고기요리",,,저녁에 방문예약 없이 이용대기 시간 바로 입장데이트연인・배우자
11633940,"안흥갈비 본점육류,고기요리",,,저녁에 방문예약 없이 이용대기 시간 바로 입장데이트연인・배우자
11633940,"안흥갈비 본점육류,고기요리",,,"저녁에 방문예약 없이 이용대기 시간 바로 입장데이트연인・배우자, 친구"
11633940,"안흥갈비 본점육류,고기요리",,,"저녁에 방문예약 없이 이용대기 시간 바로 입장일상아이, 연인・배우자"
11633940,"안흥갈비 본점육류,고기요리",,,점심에 방문예약 없이 이용대기 시간 바로 입장데이트연인・배우자
11633940,"안흥갈비 본점육류,고기요리",,,점심에 방문예약 없이 이용대기 시간 바로 입장일상부모님
11633940,"안흥갈비 본점육류,고기요리",,,점심에 방문예약 없이 이용대기 시간 바로 입장일상연인・배우자
11633940,"안흥갈비 본점육류,고기요리",,,"점심에 방문예약 후 이용대기 시간 바로 입장가족모임부모님, 친척・형제"
11633940,"안흥갈비 본점육류,고기요리",,,"집 근처라 예전에 왔던 기억을 떠올리곤 오랜만에 왔는데요, LA갈비랑 돼지갈비 먹었는데 LA갈비가 저는 입맛에 더 맞았습니다😀 후식으로 무료 냉면도 주고 밑반찬도 잘 나옵니다! 2층 분위기는 다소 시끄럽지만 활기차고, 1층 분위기는 조용하네용ㅎㅎ 참고하세요!"
11633940,"안흥갈비 본점육류,고기요리",,,처음왔는데 후식냉면도 무료고 아이스크림도 있고 갈비도 넘 맛있오요 서비스가 넘 좋네요 친절하시고 다음에 또올게요
11633940,"안흥갈비 본점육류,고기요리",,,특유의 양념이 자극적이지 않고 은은하게 배어 있어서 밥이랑 같이 먹기 딱 좋습니다.
11633940,"안흥갈비 본점육류,고기요리",,,특히 배추속이랑 무채양념이 담백하고 칼칼하니 고기랑 너무 잘어울리고 친절하게 리필도 잘해주셔서
11633940,"안흥갈비 본점육류,고기요리",,,항상 가족들과 방문하는 가게입니다. 고기가 연하고 맛있어요. 그리고 후식 냉면으로 주시는 냉면까지 최고입니다 :)
1735251923,일번지정육식당 장한평점,,,가족 모임이나 친구 모임처럼 소중한 자리에서도 편안하게 즐기실 수 있도록 늘 최선을 다하겠습니다. 앞으로도 소한마리 맛집으로 오래 기억될 수 있도록 노력하겠습니다!
1735251923,일번지정육식당 장한평점,,,"가족들과 함께 가성비 있게 소고기를 즐기셨다니 저희도 정말 보람을 느낍니다. 주차도 간편하고 매장도 넓어 주말 가족 외식 장소로 안성맞춤이라는 말씀, 큰 힘이 됩니다."
1735251923,일번지정육식당 장한평점,,,가족들이랑 한번 오고 너무 맛있어서 이번에는 남자친구랑 왔어요! 가성비 너무 좋고 고기 질이 너무 좋아요 2인이서 작은소한마리 시키면 배터지게 먹을 수 있어용! 특히 같이 먹는 된장찌개도 넘 맛있어요!
1735251923,일번지정육식당 장한평점,,,가족분들과 즐거운 식사 시간 보내셨다니 저희도 보람을 느낍니다. 넓은 매장에서 단체 모임도 편하게 하실 수 있도록 항상 준비되어 있습니다.
1735251923,일번지정육식당 장한평점,,,"고기 질과 요청사항, 그리고 직원들의 친절함까지 만족해 주셔서 감사드리며, 앞으로도 장한평역 맛집으로 변함없이 가족분들과 즐거운 시간을 보내실 수 있도록 정성껏 준비하겠습니다. 또 뵙길 기다리겠습니다."
1735251923,일번지정육식당 장한평점,,,두 번째 방문에서도 고기 맛과 푸짐한 구성에 만족하셨다니 정말 기쁩니다. 항상 신선한 재료와 넉넉한 반찬으로 최고의 한 끼를 준비하고 있습니다.
1735251923,일번지정육식당 장한평점,,,둘이서 먹기엔 진짜 양이 많고 셋이서 작은 한판 드시면 인당 2만원으로 푸짐한 한끼 가능 ❤️‍🔥
1735251923,일번지정육식당 장한평점,,,"맛, 고기 질, 양, 가성비 모두 좋게 평가해 주셔서 감사드리며, 가족모임 장소로 추천해 주신 점도 큰 힘이 됩니다."
1735251923,일번지정육식당 장한평점,,,"맛과 가격, 고기 질 모두 만족해 주셨다니 큰 힘이 됩니다. 앞으로도 믿고 드실 수 있도록 최선을 다하겠습니다. 동대문구 맛집 찾으실 때 언제든 편하게 들러주세요."
1735251923,일번지정육식당 장한평점,,,매장이 진짜 넓고 깨끗해서 모임하기 좋은 고기집입니다~ 고기 질도 좋은데 소랑 돼지 착한 가격에 먹을 수 있어요! 된찌는 무한리필🧡 진짜 밥말아먹으면 완전 밥도둑입니다! 직원분들도 친절하셔서 기분좋게 고기먹고 갑니다~👍🏻😎
1735251923,일번지정육식당 장한평점,,,방문할때마다 늘 맛있고😋깔끔해서 항상 리뷰를 남겼었는데 이상하게도 일번지정육식당 장한평점만 리뷰노출이 안되더라구요 정성껏 작성했는데도 보이지 않길래 그 뒤로는 발길이 뚝~그러다 최근 된찌랑 소고기 신선한채소를 맘편히 먹고싶어서 신랑이랑 오랜만에 다시 방문했네요🥰역시나 기대를 저버리지않는 실망 없는 맛💯💯💯일번지정육식당 장한평점 최고라고👍👍👍다시 한번 느꼈네요 된찌는 몇번을 리필했는지 모르겠고😅신선한채소를 셀프로 무제한 가져다 먹을 수 있는 점도 정말 큰 장점인듯😚요즘 식당들 상추나 깻잎 더 달라고 하면 괜히 눈치보이는데 여기는 그런 부담없이 맘껏 즐길 수 있어서 넘 좋음🫶🫶🫶장안동쪽 소고기맛집도 몇군데 가봤지만 고기 맛이며 전체적인 만족도를 보면 무조건 일번지정육식당 장한평점이라고 자신 있게 말할 수 있을것
1735251923,일번지정육식당 장한평점,,,소고기 많이먹을땐 여기가 제일입니다. 직원분들도 친절하시고 아이들이랑 가도 편하게 먹을수있어서 좋습니다. 된장찌게 저희는 많이먹는데 리필되서 너무 좋네요!!
1735251923,일번지정육식당 장한평점,,,"소고기 맛뿐만 아니라 직원들의 친절함까지 좋게 봐주셔서 정말 큰 힘이 됩니다. 고객님의 한 끼가 더 맛있고 만족스러우셨다니, 저희도 그만큼 보람을 느낍니다."
1735251923,일번지정육식당 장한평점,,,소고기 맛집 소한마리는 언제나 가족 모두가 편안하고 만족하실 수 있는 공간이 되도록 정성과 품질 모두에 최선을 다하겠습니다.
1735251923,일번지정육식당 장한평점,,,소고기는 기름기 적은 부채살과 토시살부터 구워먹기 시작해서 등심 살치살 굽고 풍미가 강한 우삽겹과 갈비살은 마지막에 먹으연 한 마리를 제대로 먹을 수 있어요😋
1735251923,일번지정육식당 장한평점,,,"소고기의 부드러운 식감과 넉넉한 양, 그리고 정갈한 구성까지 모두 만족해주셔서 정말 기쁩니다. 셀프바도 부족함 없이 잘 이용하셨다니 준비한 보람을 느낍니다."
1735251923,일번지정육식당 장한평점,,,"소고기의 프리미엄 육질과 반찬, 된장찌개까지 만족해 주셔서 정말 기쁩니다. 직접 고기를 구우셔야 하는 번거로움에도 불구하고 불편함 없이 즐겨주셔서 다행입니다."
1735251923,일번지정육식당 장한평점,,,"소한마리의 가성비와 맛, 사이드 메뉴와 찌개까지 만족하셨다니 정말 기쁩니다. 말씀해주신 찌개 리필은 저희도 자랑하는 부분 중 하나인데, 느끼함을 잡는 데 도움이 되셨다니 뿌듯합니다."
1735251923,일번지정육식당 장한평점,,,"소한마리의 양과 질, 그리고 찌개와 파절임, 양파소스까지 만족하셨다니 정말 기쁩니다. 소고기의 풍부한 육즙을 제대로 느끼셨다니 저희도 보람을 느낍니다."
1735251923,일번지정육식당 장한평점,,,"식당이 넓어 주말에도 대기 없이 바로 자리 안내받아 편했고, 주차 공간도 넉넉해 가족 단위 방문에 딱이었어요. 고기 품질이 신선하고 육즙이 가득해 맛있었고, 상차림도 다양하고 푸짐하게 나와서 추가 주문 없이도 충분히 즐길 수 있었습니다. 가격대도 합리적이라 가성비 좋게 식사할 수 있어 만족스러웠어요."
1735251923,일번지정육식당 장한평점,,,아이들도 맛있게 드셨다니 무엇보다 기쁩니다. 항상 부드럽고 좋은 소고기를 합리적인 가격에 즐기실 수 있도록 정성을 다하겠습니다.
1735251923,일번지정육식당 장한평점,,,아이랑 쉬는날 방문했는데 아이도 고기가 너무 맛있다네요 소고기가 너무 먹고싶었는데 신랑이랑도 양껏 맛있게 먹고 갑니다 아이랑 같이 왔다고 서비스로 주신 음료도 너무 센스 있게 준비해주시고 행복한 저녁식사였습니다 다음에 또 방문 할게요👍😭
1735251923,일번지정육식당 장한평점,,,앞으로도 장한평역 맛집 소한마리에서 소중한 가족모임에 어울리는 편안하고 맛있는 식사 경험을 드리겠습니다.
1735251923,일번지정육식당 장한평점,,,"앞으로도 장한평역 맛집, 소한마리 맛집으로 변함없이 기분 좋은 식사 경험 드릴 수 있도록 노력하겠습니다."
1735251923,일번지정육식당 장한평점,,,야채 샐러드바도 먹고싶은만큼 계속 이용할수잇는것도 너무 좋아요!~~ 손님이 많은이유가 잇어요 ㅎㅎ
1735251923,일번지정육식당 장한평점,,,어떤 점이 좋은지 5개는 부족합니다. 고기도 부드럽고 갈 때마다 직원들 친절하시고 주차장 넓어서 주차 걱정 없이 편하게 다녀오는 곳이에요. 된장찌개 무한리필 짱이지요. 오늘도 푸짐하고 맛있게 잘 먹고 갑니다. 👍👍👍
1735251923,일번지정육식당 장한평점,,,요근래 먹은 소고기집 중 가장 만족했던곳! 우선 가성비가 말이 안됨 고기의 질도 너무 좋은데 가격도 좋음. 양도 너무 많아서 작은소한판 와이프랑 먹었는데 진짜 꽉꽉채워서 먹었음. 된장찌개도 맛있었고 사이드로시킨 구워먹는치즈도 넘 맛있었어요. 소고기 먹을땐 이제 여기다
1735251923,일번지정육식당 장한평점,,,일번지정육식당 장한평점 두번째 방문입니다. 지난번에방문할때 음식도 맛있고 특히 사장님과 직원분들이 너무 친절해서 감사하고 기억에 많이 남았는데 이번에도 엄청 친절하시네요. 부모님과 같이 왔는데 음식도 맛있고 가격도 합리적이고 너무 친절하십니다(특히 키큰 직원분 감사합니다👍🏻) 가족 모임시에는 무조건 일번지 정육식당으로 오겠습니다 감사합니다.
1735251923,일번지정육식당 장한평점,,,"장안동 맛집 소한마리, 앞으로도 편하게 오실 수 있는 동네 단골집으로 남을 수 있도록 늘 노력하겠습니다. 다음 방문도 기다리고 있겠습니다."
1735251923,일번지정육식당 장한평점,,,"장한평역 맛집 소한마리는 항상 고객님께 ""또 오고 싶은 곳""으로 기억될 수 있도록, 맛과 서비스는 물론 쾌적한 환경까지 신경 쓰고 있습니다."
1735251923,일번지정육식당 장한평점,,,"재오픈 이후에도 이렇게 기억해 주시고 다시 방문해 주신 마음이 큰 힘이 된답니다. 넓은 매장에서 편안하게 식사하셨다니 기쁘고, 친절하게 느껴주셔서 감사드립니다."
1735251923,일번지정육식당 장한평점,,,"저희 직영점에는 처음 방문해 주셨는데 고기의 질과 양, 된장찌개 맛까지 모두 만족하셨다니 정말 기쁩니다."
1735251923,일번지정육식당 장한평점,,,"젊은 직원들의 친절함까지 칭찬해 주셔서 감사드리며, 앞으로도 기분 좋은 식사 시간을 드릴 수 있도록 최선을 다하겠습니다."
1735251923,일번지정육식당 장한평점,,,"주차와 서비스, 고기 품질, 된장국까지 모두 만족하셨다니 정말 기쁩니다. 처음 방문이셨는데 좋은 인상 남기셨다니 더욱 감사드리며, 다음에는 일부러 찾아오고 싶은 곳으로 기억되길 바랍니다."
1735251923,일번지정육식당 장한평점,,,지인과 모임이 있어 방문 했습니다. 직원들 친절하시고 가성비 좋습니다. 소고기 먹고싶은날 방문해보세요. 장한평역 주변 모임 추천 합니다.
1735251923,일번지정육식당 장한평점,,,"특별한 메뉴까지 눈여겨봐 주셔서 감사드리며, 앞으로도 늘 신선하고 맛있는 고기로 보답드리겠습니다."
1735251923,일번지정육식당 장한평점,,,함께 나온 된장찌개와 밑반찬도 정갈하고 맛있어 고기와 잘 어울렸습니다. 깔끔한 분위기와 넓은 매장에 훌륭한 서비스까지 더해져 만족도가 높았던 방문이었습니다.
1735251923,일번지정육식당 장한평점,,,"항상 많은 분들이 찾아주셔도 넓은 매장에서 편하게 식사하실 수 있도록 준비하고 있으니, 언제든 장한평 맛집으로 찾아주시면 변함없이 정성껏 모시겠습니다. 또 뵐 날을 기다리겠습니다."
1534946045,"일품대패 장안동점육류,고기요리",,,네명이 배부르게먹구 술까지마셔도 4만원도 안나오는게 무슨일 모든게 만족입니다
1534946045,"일품대패 장안동점육류,고기요리",,,"리뷰 1,054사진 387팔로워 10"
1534946045,"일품대패 장안동점육류,고기요리",,,리뷰 839사진 621팔로워 2테마 3
1534946045,"일품대패 장안동점육류,고기요리",,,리뷰 839사진 621팔로워 2테마 3
1534946045,"일품대패 장안동점육류,고기요리",,,무한리필. 고기의 질이 나쁘지 않고 각종 채소들을 샐러드바 형식으로 본인이 원하는 만큼 가져가서 먹을수 있습니다. 계란찜 시키면 크게 나옵니다. 가성비 좋습니다.
1534946045,"일품대패 장안동점육류,고기요리",,,밤에 방문예약 없이 이용대기 시간 바로 입장나들이연인・배우자
1534946045,"일품대패 장안동점육류,고기요리",,,밤에 방문예약 없이 이용대기 시간 바로 입장데이트연인・배우자
1534946045,"일품대패 장안동점육류,고기요리",,,밤에 방문예약 없이 이용대기 시간 바로 입장일상연인・배우자
1534946045,"일품대패 장안동점육류,고기요리",,,밤에 방문예약 없이 이용대기 시간 바로 입장일상혼자
1534946045,"일품대패 장안동점육류,고기요리",,,삼겹살을 먹지만 각종 야채들과 곁들여 먹으니 건강식을 먹고 온 느낌이예용
1534946045,"일품대패 장안동점육류,고기요리",,,삼겹살을 먹지만 각종 야채들과 곁들여 먹으니 건강식을 먹고 온 느낌이예용
1534946045,"일품대패 장안동점육류,고기요리",,,"셀프바도 너무 좋은데 셀프바 이용료가 1인당 1,500원 있어요"
1534946045,"일품대패 장안동점육류,고기요리",,,손님이 들어왔는데도 응대하는 직원도 하나 없고ㅋㅋ 무인 식당인 줄 알았네요 전에 왔을 땐 기본찬이 나오고 이후 셀프 바 이용이었던 것 같은데 전부 셀프 바 이용으로 바뀌었네요 고기도 이전보다 더 얇아졌어요 밥이 오래됐는지 밥도 맛이 없네요 전에는 가성비 좋고 맛있었는데 실망이 큽니다
1534946045,"일품대패 장안동점육류,고기요리",,,아이들과 밥먹기 좋아요^^ 쌈도 다양하고 맛있어요~ 직원들도 친절해요~ 다 좋은데 주차 공간이 적어서 아쉬워요ㅠㅡㅠ
1534946045,"일품대패 장안동점육류,고기요리",,,아이들과 밥먹기 좋아요^^ 쌈도 다양하고 맛있어요~ 직원들도 친절해요~ 다 좋은데 주차 공간이 적어서 아쉬워요ㅠㅡㅠ
1534946045,"일품대패 장안동점육류,고기요리",,,아침에 방문예약 없이 이용대기 시간 바로 입장일상지인・동료
1534946045,"일품대패 장안동점육류,고기요리",,,요즘같은 경기에 말도안되는 가성비와 샐러드바 대박입니다!!
1534946045,"일품대패 장안동점육류,고기요리",,,요즘같은 경기에 말도안되는 가성비와 샐러드바 대박입니다!!
1534946045,"일품대패 장안동점육류,고기요리",,,장안동 대패삼겹살 성지. 무한 쌈채소 최고 소주한잔 짱
1534946045,"일품대패 장안동점육류,고기요리",,,저녁에 방문예약 없이 이용대기 시간 10분 이내 일상친구
1534946045,"일품대패 장안동점육류,고기요리",,,저녁에 방문예약 없이 이용대기 시간 10분 이내 일상친구
1534946045,"일품대패 장안동점육류,고기요리",,,저녁에 방문예약 없이 이용대기 시간 10분 이내 친목친구
1534946045,"일품대패 장안동점육류,고기요리",,,"저녁에 방문예약 없이 이용대기 시간 바로 입장가족모임연인・배우자, 아이, 부모님, 친척・형제"
1534946045,"일품대패 장안동점육류,고기요리",,,"저녁에 방문예약 없이 이용대기 시간 바로 입장나들이연인・배우자, 아이"
1534946045,"일품대패 장안동점육류,고기요리",,,저녁에 방문예약 없이 이용대기 시간 바로 입장데이트연인・배우자
1534946045,"일품대패 장안동점육류,고기요리",,,저녁에 방문예약 없이 이용대기 시간 바로 입장데이트연인・배우자
1534946045,"일품대패 장안동점육류,고기요리",,,저녁에 방문예약 없이 이용대기 시간 바로 입장일상연인・배우자
1534946045,"일품대패 장안동점육류,고기요리",,,저녁에 방문예약 없이 이용대기 시간 바로 입장일상연인・배우자
1534946045,"일품대패 장안동점육류,고기요리",,,저녁에 방문예약 없이 이용대기 시간 바로 입장일상연인・배우자
1534946045,"일품대패 장안동점육류,고기요리",,,저녁에 방문예약 없이 이용대기 시간 바로 입장일상연인・배우자
1534946045,"일품대패 장안동점육류,고기요리",,,저녁에 방문예약 없이 이용대기 시간 바로 입장친목지인・동료
1534946045,"일품대패 장안동점육류,고기요리",,,저녁에 방문예약 없이 이용대기 시간 바로 입장친목지인・동료
1534946045,"일품대패 장안동점육류,고기요리",,,저녁에 방문예약 없이 이용대기 시간 바로 입장친목친구
1534946045,"일품대패 장안동점육류,고기요리",,,저녁에 방문예약 없이 이용대기 시간 바로 입장친목친구
1534946045,"일품대패 장안동점육류,고기요리",,,"저녁에 방문예약 없이 이용대기 시간 바로 입장친목친구, 지인・동료"
1534946045,"일품대패 장안동점육류,고기요리",,,"점심에 방문예약 없이 이용대기 시간 바로 입장가족모임친구, 아이"
1534946045,"일품대패 장안동점육류,고기요리",,,"점심에 방문예약 없이 이용대기 시간 바로 입장가족모임친구, 아이"
1534946045,"일품대패 장안동점육류,고기요리",,,점심에 방문예약 없이 이용대기 시간 바로 입장데이트연인・배우자
1534946045,"일품대패 장안동점육류,고기요리",,,점심에 방문예약 없이 이용대기 시간 바로 입장데이트연인・배우자
1534946045,"일품대패 장안동점육류,고기요리",,,점심에 방문예약 없이 이용대기 시간 바로 입장데이트연인・배우자
1534946045,"일품대패 장안동점육류,고기요리",,,점심에 방문예약 없이 이용대기 시간 바로 입장데이트연인・배우자
1534946045,"일품대패 장안동점육류,고기요리",,,점심에 방문예약 없이 이용대기 시간 바로 입장일상연인・배우자
1534946045,"일품대패 장안동점육류,고기요리",,,점심에 방문예약 없이 이용대기 시간 바로 입장친목친구
1534946045,"일품대패 장안동점육류,고기요리",,,점심에 방문예약 없이 이용대기 시간 바로 입장친목친구
1534946045,"일품대패 장안동점육류,고기요리",,,"조카 두명 ,아들 두명 총 아이들 4명에 어른 2명이 갔고 테이블 두개에 앉았습니다.아이들이 많이 안먹기도 하고 얼마나 먹을지 몰라서 먹고 더 먹으려고 일단 한테이블에 8개 주문을 넣었더니 테이블에 5인분씩 시켜야한대서 그렇게 했고 계란찜,밥4개,소주맥주를 시켰습니다.벽에 테이블당 1회 리뷰를 쓰면 음료를 준다길래 당연히 리뷰 두개 썼고 음료 두개 달랬더니 한팀이라 한개만 된다고..그럼 한테이블로 주문 넣을땐 따로 넣으라고 하더니 왜 서비스 음료는 한팀이라 안된다고 하나요??고기도 2개2개 따로 더 시켰고 주문도 테이블 마다 따로 했는데..말이 안되는 운영이죠..주문은 따로 두개 하고 이벤트는 한개만 된다..동네장사 그렇게 하지마세요"
1534946045,"일품대패 장안동점육류,고기요리",,,팽이버섯이 색깔이 마니 변하고 상태가 안좋아보여가지고 아쉬웠다 (버섯팬으로서)
1534946045,"일품대패 장안동점육류,고기요리",,,"환기가 안됨. 들어가자마자 연기로 자욱. 불판이 코팅이 다 벗겨진 음식이 순식간에 탐. 긁어먹은 자국들이 선명하게 남아 토할거같음. 추가주문시 불판 닦아달라했더니 제대로 마무리해주지 않음. (물론 붓고 너무주걱으로 긁는데 제대로 빠지지않는 물기를,탄물이 밑에 꼬여서 흘려내려가지않은데 그냥 두고감). 머리 위 천장형 에어컨이 날개가 보는순간 역겨웠음. 시커멓게."
