가게ID,가게명,평점,날짜,리뷰내용
38331651,송학수산생선회,,,점심에 방문예약 없이 이용대기 시간 바로 입장
38331651,송학수산생선회,,,점심에 방문예약 없이 이용대기 시간 바로 입장가족모임부모님
38331651,송학수산생선회,,,점심에 방문예약 없이 이용대기 시간 바로 입장가족모임연인・배우자
38331651,송학수산생선회,,,점심에 방문예약 없이 이용대기 시간 바로 입장가족모임연인・배우자
38331651,송학수산생선회,,,점심에 방문예약 없이 이용대기 시간 바로 입장데이트연인・배우자
38331651,송학수산생선회,,,"점심에 방문예약 없이 이용대기 시간 바로 입장일상연인・배우자, 아이"
38331651,송학수산생선회,,,지인 추천으로 오후5시에 갔는데도 테이블 절반이 차있는 아주 유명한 집이었습니다. 2인셋트메뉴로 먹었는데 구성이 너무 알차서 성인남자 둘이서 배부르게먹었네요. 웨이팅하는집은 확실히 다른것같습니다.
38331651,송학수산생선회,,,진짜 근래 가본 횟집중 최고였어요~밑반찬부터 넘 맛있어요 대방어 넘맛있게 잘 먹었어요!!
38331651,송학수산생선회,,,찬류도 많이 나오고 깔끔한 매장에 좋아요
38331651,송학수산생선회,,,친목모임에서 가게되었는데 마침 비가오는날이라 손님이 적어서 사장님께서 특별히 푸짐하게 주셨다해서 잘 먹고왔습니다 감사합니다 또 올께요
38331651,송학수산생선회,,,해산물 뺀 송학특선 2인으로 주문했는데 회 많이 주시고 신선했어요👍 스끼다시도 다양하고 간이 세지 않아서 부모님 모시고 와도 좋을 것 같아요~ 매운탕에 수제비가 기본으로 들어있는 줄 모르고 수제비 추가했지만 반죽이 쫀득해서 좋았어요~
38331651,송학수산생선회,,,회 신선하고 밑반찬 다 맛있습니다 부모님이 연신 맛있다고 말씀하시면서 맛있게 드셨어요~♡♡
38331651,송학수산생선회,,,"회사직원 회식을 하기위해 12명 방문함, 셋팅이 끝나고 회를 기다리는중 종업원의 실수로 테이블옆에 비치된 화분이 넘어지면서 큰 소리의 울림이 진동했고 순간 흰자갈이 바닥에 쏟아짐ᆢ 먼지가루가 뿌옇게 흗날리는데ᆢ 여사장 미안하단 말 한마디도 없이 자갈만 주워담음ㅜ 셋팅한 음식을 바꿔달라고 하고 싶었지만 들어갔다 다시 그대로 나올까봐 포기함, 음식주문도 손님의 의향은 들어주지 않고 사장이 강요하는대로 주문해야 했고ᆢ 술병도 직원이 전부 모아놨는데 두병이 더 계산됨ᆢ장사가 잘된다는 이유로? 기본기를 무시하는 사장의 태도에 화가나고 회식모임중 최악의 기분으로 마무리함ㅜㅜ"
1094573560,오광수산,,,"광어 중 (활어회를 주문시 매운탕 서비스, 라면사리도 줌) 생새우회 주문시 우리가 머리를 따야하지만 머리튀겨줌 기본찬으로 생선까스랑 고등어구이 나와요!!!"
1094573560,오광수산,,,광어(중)시켜서 먹었는데 35000원에 정말 푸짐하고 맛있게 먹고 왔어요^^ 회가 싱싱하고 사장님도 엄청 친절하세요
1094573560,오광수산,,,내 뱃살만큼 두툼한 방어🤤🤪랑 우럭🥹🤤 비린내하나없는데 입안에서 향해하는 맛의 향연...후ㅠㅠ 타코야끼는 제가 만들었답니다❤️‍🔥
1094573560,오광수산,,,내 뱃살만큼 두툼한 방어🤤🤪랑 우럭🥹🤤 비린내하나없는데 입안에서 향해하는 맛의 향연...후ㅠㅠ 타코야끼는 제가 만들었답니다❤️‍🔥
1094573560,오광수산,,,너무 맛있게 먹었습니다. 회도 너무 신선하고 가격도 너무 착하네요!! 다음에 또 오겠습니다!!
1094573560,오광수산,,,너무 맛있게 먹었습니다. 회도 너무 신선하고 가격도 너무 착하네요!! 다음에 또 오겠습니다!!
1094573560,오광수산,,,대방어 가성비 있고 맛있어요 고등어구이 생선까스도 맛있고 매운탕도 얼큰하니 맛있게 마무리하니 좋았어요
1094573560,오광수산,,,"리뷰 2,414사진 1,349팔로워 60"
1094573560,오광수산,,,"리뷰 923사진 1,154팔로워 30테마 2"
1094573560,오광수산,,,리뷰로 본 거랑 다르게 모듬회에 방어가 안 나와서 사장님께 여쭤보니 숭어나 방어로 나온다 하시네요~ 방어로 바꿔달라고 요청 드렸는데 이미 나온 거라 어쩔 수 없다 하셔서 그냥 먹었어요 방어 먹고싶은 분들은 참고하세요 ㅎㅎ
1094573560,오광수산,,,리뷰로 본 거랑 다르게 모듬회에 방어가 안 나와서 사장님께 여쭤보니 숭어나 방어로 나온다 하시네요~ 방어로 바꿔달라고 요청 드렸는데 이미 나온 거라 어쩔 수 없다 하셔서 그냥 먹었어요 방어 먹고싶은 분들은 참고하세요 ㅎㅎ
1094573560,오광수산,,,먹다 찍어서 맛없어 보이네요ㅠㅠ 참돔이랑 도다리중짜 먹었고요~~회 굵기나 크기는 저한테 딱 맞는 사이즈였어요~아이들을 위한 새우튀김 돈가스 무난하게 맛있고요 새우튀김은 크기가 크더라고요~~산낙지도 싱싱하니 맛있더라고요~영업시간 전인데도 예약 받아주셔서 감사합니다~한가지 아쉬운점은 영업시간 전이라 그런지 스끼다시가 넘 부실한느낌이였어요~
1094573560,오광수산,,,모둠회 주문했습니다~ 회기 다 신선하고 매운탕 주시는데 매운탕이 킥이네요 밥 말아 먹으니까 너무 맛있더라구요~ 오징어물회도 같이 주문해봤는데 양도 많고 맛있습니다~~
1094573560,오광수산,,,모듬회 중 3만9천에 매운탕까지 잘 먹고왔다!!
1094573560,오광수산,,,모듬회 중 3만9천에 소주 5천 5병 뚝딱!! 깔끔하게 잘 나오고 매운탕도 있어서 술 마시고 마무리하기에 좋은 곳!!
1094573560,오광수산,,,밤에 방문예약 없이 이용대기 시간 바로 입장지인・동료
1094573560,오광수산,,,밤에 방문예약 없이 이용대기 시간 바로 입장친목지인・동료
1094573560,오광수산,,,밤에 방문예약 없이 이용대기 시간 바로 입장친목친구
1094573560,오광수산,,,배달도 빠르고 음식도 맛있네요. 요청사항도 잘 지켜주시고 자주 시키도록 해야겠네요.적극적으로 추천드려요.정말 대박이네요. 번창하시고 대박나세요.
1094573560,오광수산,,,배달도 빠르고 음식도 맛있네요. 요청사항도 잘 지켜주시고 자주 시키도록 해야겠네요.적극적으로 추천드려요.정말 대박이네요. 번창하시고 대박나세요.
1094573560,오광수산,,,배달도 빠르고 음식도 맛있네요. 요청사항도 잘 지켜주시고 자주 시키도록 해야겠네요.적극적으로 추천드려요.정말 대박이네요. 번창하시고 대박나세요.
1094573560,오광수산,,,배달도 빠르고 음식도 맛있네요. 요청사항도 잘 지켜주시고 자주 시키도록 해야겠네요.적극적으로 추천드려요.정말 대박이네요. 번창하시고 대박나세요.
1094573560,오광수산,,,부모님 모시고 회에 소주한잔 대접해드리며 이야기 꽃을 피우며 맛나게 잘 먹어습니다
1094573560,오광수산,,,사장님이 너무 신경 안 쓰셔갖고. . .
1094573560,오광수산,,,이날 모둠회+새우튀김 먹었는데 양도 많고 새우튀김 너무 바삭하고 맛있었어요~~~
1094573560,오광수산,,,저녁에 방문예약 없이 이용대기 시간 10분 이내 친목친구
1094573560,오광수산,,,저녁에 방문예약 없이 이용대기 시간 바로 입장가족모임부모님
1094573560,오광수산,,,저녁에 방문예약 없이 이용대기 시간 바로 입장가족모임부모님
1094573560,오광수산,,,저녁에 방문예약 없이 이용대기 시간 바로 입장데이트연인・배우자
1094573560,오광수산,,,저녁에 방문예약 없이 이용대기 시간 바로 입장비즈니스지인・동료
1094573560,오광수산,,,저녁에 방문예약 없이 이용대기 시간 바로 입장일상연인・배우자
1094573560,오광수산,,,저녁에 방문예약 없이 이용대기 시간 바로 입장일상연인・배우자
1094573560,오광수산,,,"저녁에 방문예약 없이 이용대기 시간 바로 입장친목연인・배우자, 친구"
1094573560,오광수산,,,저녁에 방문예약 없이 이용대기 시간 바로 입장친목지인・동료
1094573560,오광수산,,,저녁에 방문예약 없이 이용대기 시간 바로 입장친목지인・동료
1094573560,오광수산,,,저녁에 방문예약 없이 이용대기 시간 바로 입장친목친구
1094573560,오광수산,,,저녁에 방문예약 없이 이용대기 시간 바로 입장친목친구
1094573560,오광수산,,,저녁에 방문예약 없이 이용대기 시간 바로 입장친목친구
1094573560,오광수산,,,저녁에 방문예약 없이 이용대기 시간 바로 입장친목친구
1094573560,오광수산,,,저녁에 방문예약 없이 이용대기 시간 바로 입장친목친구
1094573560,오광수산,,,저녁에 방문포장·배달 이용대기 시간 30분 이내친구
1094573560,오광수산,,,저녁에 방문포장·배달 이용대기 시간 30분 이내친구
1094573560,오광수산,,,저녁에 방문포장·배달 이용대기 시간 바로 입장가족모임
1094573560,오광수산,,,저녁에 방문포장·배달 이용대기 시간 바로 입장가족모임
1094573560,오광수산,,,점심에 방문예약 없이 이용대기 시간 바로 입장데이트연인・배우자
1094573560,오광수산,,,"제가 먹은 회 중에 최악이였습니다. 회 상태도 영 아니였고, 돈이 너무 아까웠습니다. 사장님이 회에 대해 잘 아시는 분일텐데 이런 회를 내놓는게 부끄럽지 않으실까 합니다. 저희꺼만 그런거라면 다행일 것 같습니다. 다시는 오고싶지 않네여,,"
1094573560,오광수산,,,지인이 회 좋아해서 소개해주려고 데려갔는데 한시간이 다되도록 소주를 한병 다마셔도 회가 안나오고 우리보다 늦게온 옆테이블 먼저 회나오기에 주방에 가서 얘기하니 그제서야 직원의 실수로 누락이 되었다고.. 입장후 30분쯤 지났을때 회 아직이냐고 직원분께 물었을때 확인 했더라면 이렇게 늦게나오지는 않았을것같은데.. 지인분께 맛집이라고 모셔갔는데 굉장히 미안했답니다 매운탕도 미리달라고 요청했는데 지리로 주셔서 굉장히 맛없게 먹었답니다
1094573560,오광수산,,,"집이랑 가까워서 처음엔 편하게 자주 가던 단골 횟집이었습니다. 매운탕을 서비스로 주는 점도 좋았고, 전반적으로 만족해서 오랫동안 애용했어요. 한 번 배달했을 때 지느러미가 하나도 없어서 당황하긴 했지만, 그럴 수도 있겠다 싶어 그냥 넘겼습니다. 이후엔 매장에만 방문했는데, 갈수록 대우가 달라지는 게 느껴졌고 비싼 메뉴를 시킬 때만 신경 써주는 느낌이 들었습니다. 스키다시가 줄거나 아예 안 나오는 경우도 생기고, 무엇보다 직원들 태도가 점점 불친절해져서 단골로서 많이 아쉽고 실망스러웠습니다."
1094573560,오광수산,,,친구가 만나 동네 오광수산에서 대광어로 한잔고 왔습니다
37242230,오징어데이,,,B세트는 광어와 오징어회를 둘다 먹을 수있고 마지막에 매운탕까지 포함되어있어서 구성이 정말 알찼어요. 오징어가 제철이라 정말 싱싱하고 맛있었어요. 그리고 내부에 포차 분위기 굿👍
37242230,오징어데이,,,가성비 넘치는 세트메뉴들도 많아 다양하게 맛 볼 수 있을 거 같아요.
37242230,오징어데이,,,"가성비 미쳤어요 !! 7번 세트(55,000원) 주문했는데 오징어회 + 광어회 + 생선구이 + 새우튀김 + 매운탕까지 ,, 완전 푸짐하게 나옵니다 👍🏻 근데 하나하나 너무 맛있어서 다 먹었어요 ^^ 튀김도 막 튀겨서 주시니까 따끈해서 존마탱,, 새로 다래 판매중이길래 호기심에 주문했는데 예쁜 새로잔까지 주셨어요 (이벤트 중!) 🫶🏻"
37242230,오징어데이,,,갑자기 회가 땡겨 찾아보는 와중. 근래 귀한 오징어 회집 발견~ 근처 동네에 주말 늦게까지 하는 곳이 많이 없는데 핫플이네요. 가족모임으로 온 분들도 꽤 보였고 회 싱싱했어요. 광어는 작고 얇게 썰어나왔고 오징어는 이렇게 얇게 포뜬건 새롭네요. 세트로 매운탕까지 넘 맛잇게 먹었네요. 매운탕 칼칼하니 간이 죽입니다👍🏼
37242230,오징어데이,,,광어는 언제나 최고 신선하고 이날 오징어사시미도 너무 신선하고 오랜만에 먹으니까 정말 맛있었어요
37242230,오징어데이,,,광어회+오징어사시미+새우튀김+매운탕 까지 나오는 7번세트 먹었어용 회도 너무 맛있고 새우튀김도 매운탕도 아주 맛도리에요🫶 가성비 짱이라 자주 방문할 것 같아용💕
37242230,오징어데이,,,광어회에 해산물모듬+새우튀김이 같이 나오는 세트로 주문했어요 세트 구성이 다양해서 먹고 싶은 대로 골라서 주문하면 돼요!
37242230,오징어데이,,,동네 맛집이라 그런지 손님도 계속 꽉차있음!
37242230,오징어데이,,,바다로 여행갔지만 오징어데이에서 먹으려구 회는 꼭참구 바로 여독풀러 오데이로 왔습니다 광어 소자밖에 없어서 아쉬웠지만 우럭물회도 처음먹어보니 넘 맛있드라구용 소면사리 추가는 필수입니다 얼큰한게 진짜 맛나요
37242230,오징어데이,,,"밤에 방문예약 없이 이용대기 시간 바로 입장데이트, 일상연인・배우자"
37242230,오징어데이,,,밤에 방문예약 없이 이용대기 시간 바로 입장일상연인・배우자
37242230,오징어데이,,,분위기도 좋고 세트로 시켜먹으면 알차게 다양하게 먹을수있어요 회도 완전 싱싱하고 맛있어요 !!!
37242230,오징어데이,,,살살 녹는 오징어사시미 그냥 미쳤어여!!!! 얇고 쫀득한데 입에 넣자마자 사르르~ 이제 다른 집 오징어회는 못 먹는 몸이 되어버렸어 ㅠ
37242230,오징어데이,,,세트 시켜먹었는데 매운탕 콩나물 잔뜩이라 개운하고 맛나요..!! 광어도 두툼하고 완전 맛있구요 오징어 사시미 수족관에서 바로 잡아서 해주셔서 신선하고 살아 움직입니다!
37242230,오징어데이,,,신선한 회와 서비스 고등어 너무 맛있게 먹고 왔습니다!! 장안동횟집하면 여기죠~~~~~!! 넘 신선하고 조아요!
37242230,오징어데이,,,어버이날 겸사겸사 회 좋아하시는 엄마랑 데이트하러 방문했어요!!나름 오픈런 한다고 했는데 이미 드시고 있는 테이블도 있고..포장손님도 계시고..저랑 엄마는 B세트로 먹었는데 다른 횟집과 달리 접시에 천사채가 아닌 간 얼음플레이팅이라 다 먹을때까지 시원하고 신선하게 먹는 기분이였고 회 옆에 곁들여서 나오는 백김치...와!!!진짜 무슨일인가 싶을 정도로 회랑 궁합도 잘맞고 너무너무 좋인서 한번 더 리필 요청해서 먹었어요~좀 까다로우신 저희 엄마도 회 한점드시는 순간부터 연신 맛있다 감탄하시며 촉촉한 고등어까지 싹쓸이!!!다음번엔 저희 가족모두 방문해야겠다 하며 다짐하게 되는 맛집!!!정말 맛있게 잘먹었습니다!!
37242230,오징어데이,,,오늘은 오징어 대신 해산물모둠과 광어회 먹었는데요! 역시나 이 메뉴들도 맛있었습니다
37242230,오징어데이,,,"오징어 사시미, 해산물 모듬, 오징어 튀김 세트로 주문했는데 구성도 풍부하고 좋았어요. 특히 해산물을 골고루 맛볼 수 있어서 맛있게 잘 먹고 왔습니다^^"
37242230,오징어데이,,,오징어 사시미는 처음 먹어보는데 정말 식감이 미쳤더라고요! 쫀득쫀득하고 탱클탱글해요
37242230,오징어데이,,,"오징어데이에서 오징어사시미 + 광어회 + 매운탕 세트 먹었어요 가격 대비 구성 너무 좋고 회도 정말 신선해서 동생이랑 둘 다 만족도 100%!! 49,000원에 매운탕까지 푸짐하게 나와서 둘이 배부르게 먹고 나왔네요 어떻게 저 가격에 이걸 다 누릴 수 있는지💦 알바생들도 친절해서 담에 장한평역 갈 일 생기면 또 방문하려고요ㅎㅎ 확실히 맛집인지 사람이 많았어요~~@_@"
37242230,오징어데이,,,완성 가성비 넘치는 횟집이에요! 세트메뉴라 모듬회 작게 나오는 줄 알았는데 엄청 커서 놀랬어요🫢 신선해서 하나도 비리지도 않았고 다음에 부모님이랑 또 오고싶네요🤗
37242230,오징어데이,,,원래 오징어회 먹으러 갔는데 품절이라고 하셔서 우럭 소 사이즈 먹었어요.
37242230,오징어데이,,,일반적인 오징어회 모양이 아니라 오징어 포를 넙적하고 정말 얇게 뜬 건제 기술이 아주 좋으신 듯👍
37242230,오징어데이,,,입에서 사르르녹고 신선한지 비리지도 않은데 살점도 탱글하며 고소한게 오랫동안 씹어 먹어도 그 진가가 느껴지는 맛이었습니다
37242230,오징어데이,,,장안동에 오징어회 맛집이 있다니.. 이날 먹은 갑오징어 회가 진짜 쫀득하고 꼬들한게 식감이 예술이었습니다👍 광어회랑 세트로 시켰는데 오징어가 광어를 이기더라구요 ㅋㅋㅋㅋ
37242230,오징어데이,,,장안동에서 회먹고싶을때 가성비좋고 든든하게 맛보려면 오징어데이만한데가 없어요 신선하고 푸짐해서 너무 좋아요
37242230,오징어데이,,,저녁에 방문예약 없이 이용대기 시간 바로 입장
37242230,오징어데이,,,저녁에 방문예약 없이 이용대기 시간 바로 입장
37242230,오징어데이,,,"저녁에 방문예약 없이 이용대기 시간 바로 입장데이트, 일상연인・배우자"
37242230,오징어데이,,,"저녁에 방문예약 없이 이용대기 시간 바로 입장데이트, 일상연인・배우자"
37242230,오징어데이,,,"저녁에 방문예약 없이 이용대기 시간 바로 입장데이트, 일상연인・배우자"
37242230,오징어데이,,,"저녁에 방문예약 없이 이용대기 시간 바로 입장데이트, 일상연인・배우자"
37242230,오징어데이,,,"저녁에 방문예약 없이 이용대기 시간 바로 입장데이트, 일상연인・배우자"
37242230,오징어데이,,,"저녁에 방문예약 없이 이용대기 시간 바로 입장데이트, 일상연인・배우자"
37242230,오징어데이,,,저녁에 방문예약 없이 이용대기 시간 바로 입장데이트연인・배우자
37242230,오징어데이,,,저녁에 방문예약 없이 이용대기 시간 바로 입장데이트연인・배우자
37242230,오징어데이,,,저녁에 방문예약 없이 이용대기 시간 바로 입장데이트연인・배우자
37242230,오징어데이,,,저녁에 방문예약 없이 이용대기 시간 바로 입장데이트연인・배우자
37242230,오징어데이,,,저녁에 방문예약 없이 이용대기 시간 바로 입장일상기타
37242230,오징어데이,,,저녁에 방문예약 없이 이용대기 시간 바로 입장일상연인・배우자
37242230,오징어데이,,,저녁에 방문예약 없이 이용대기 시간 바로 입장일상친구
37242230,오징어데이,,,저녁에 방문예약 없이 이용대기 시간 바로 입장일상친구
37242230,오징어데이,,,저녁에 방문예약 없이 이용대기 시간 바로 입장일상친구
37242230,오징어데이,,,저녁에 방문예약 없이 이용대기 시간 바로 입장친목친구
37242230,오징어데이,,,저녁에 방문예약 후 이용대기 시간 바로 입장데이트부모님
37242230,오징어데이,,,저녁에 방문예약 후 이용대기 시간 바로 입장일상연인・배우자
37242230,오징어데이,,,저녁에 방문예약 후 이용대기 시간 바로 입장친목친구
37242230,오징어데이,,,점심에 방문예약 없이 이용대기 시간 바로 입장일상친구
37242230,오징어데이,,,해산물도 신선하고 오징어 회 예술이예요
43496909,왕도숯불갈비,,,"“너무 맛있게 잘 먹었다, 무조건 추천한다”는 말씀에 저희 마음까지 따뜻해집니다. 저희는 매일 새벽 마장동에서 직접 고기를 선별하고, 2대째 이어온 비법 양념에 하루 이상 숙성한 뒤 숯불로 초벌해 잡내 없이 불향만 가득 살려내고 있습니다. 손님께서 드신 한 점 한 점이 정직하고 정성스러운 맛으로 전해졌다는 게 가장 큰 기쁨입니다. 또한 반찬, 쌈장, 된장찌개까지 모두 직접 만들어 내드리며, 부족함 없는 식사가 되도록 늘 신경 쓰고 있습니다. 넉넉한 양으로 준비하기 때문에 배부르게 드시고도 만족하실 수 있도록 하는 것이 저희의 자부심입니다. 특별한 메뉴까지도 다양하게 준비해 두고 있으니, 올 때마다 색다른 즐거움을 느끼실 수 있을 겁니다. 손님께서 이렇게 적극적으로 추천까지 해주신 것은 저희 가게와 직원 모두에게 더 큰 힘과 책임으로 다가옵니다. 언제 다시 찾아주셔도 같은 자리에서 변함없는 맛과 친절함으로 보답드리겠습니다."
43496909,왕도숯불갈비,,,"“너무 맛있어서 일주일에 3번씩 온다”는 말씀을 보니 정말 감격스럽습니다. 이렇게 자주 찾아주신다는 건 저희가 지켜온 철학과 정성이 단골 손님께 진심으로 전해졌다는 의미라 더할 나위 없이 큰 자부심이 됩니다. 매일 새벽 마장동에서 고기를 선별하고, 비법 양념으로 하루 이상 숙성해 숯불 초벌로 감칠맛을 더해 내는 과정이 손님께 만족을 드리고 있다는 걸 확인할 수 있어 더욱 힘이 납니다. 또한 밑반찬과 쌈장, 된장찌개까지 모두 직접 준비해 한 끼가 부족하지 않도록 정성껏 차려내고 있습니다. 저희에게 단골 손님은 가장 큰 힘이자 자랑입니다. 매번 같은 자리에서 같은 정성으로 보답드리며, 언제 오셔도 변함없는 맛을 느끼실 수 있도록 지켜가겠습니다. “추천합니다 꼭 오세요”라는 말씀은 다른 분들께도 큰 신뢰로 이어질 것이고, 저희에게는 더 큰 책임으로 다가옵니다. 다시 찾아주시는 날까지 더 열심히 준비하겠습니다"
43496909,왕도숯불갈비,,,"“너무 맛있어서 일주일에 3번씩 온다”는 말씀을 보니 정말 감격스럽습니다. 이렇게 자주 찾아주신다는 건 저희가 지켜온 철학과 정성이 단골 손님께 진심으로 전해졌다는 의미라 더할 나위 없이 큰 자부심이 됩니다. 매일 새벽 마장동에서 고기를 선별하고, 비법 양념으로 하루 이상 숙성해 숯불 초벌로 감칠맛을 더해 내는 과정이 손님께 만족을 드리고 있다는 걸 확인할 수 있어 더욱 힘이 납니다. 또한 밑반찬과 쌈장, 된장찌개까지 모두 직접 준비해 한 끼가 부족하지 않도록 정성껏 차려내고 있습니다. 저희에게 단골 손님은 가장 큰 힘이자 자랑입니다. 매번 같은 자리에서 같은 정성으로 보답드리며, 언제 오셔도 변함없는 맛을 느끼실 수 있도록 지켜가겠습니다. “추천합니다 꼭 오세요”라는 말씀은 다른 분들께도 큰 신뢰로 이어질 것이고, 저희에게는 더 큰 책임으로 다가옵니다. 다시 찾아주시는 날까지 더 열심히 준비하겠습니다"
43496909,왕도숯불갈비,,,"“돼지갈비 안 좋아하는데 너무 맛있게 잘 먹었습니다”라는 말씀은 저희에게 정말 특별한 칭찬입니다. 돼지갈비를 평소 즐기지 않으시던 분께서 맛있게 드셨다니, 매일 새벽 직접 고기를 선별하고, 하루 이상 비법 양념에 숙성해 숯불 초벌로 정성껏 준비하는 저희 노력이 전해진 것 같아 무척 뿌듯합니다."
43496909,왕도숯불갈비,,,"갈비가 드시고 싶을 때 저희 매장을 찾아주셔서 감사드리고, “우리 동네에 이런 맛집이!”라는 말씀까지 남겨주셔서 정말 큰 힘이 됩니다. 매일 아침 마장동에서 직접 선별한 신선육을 정성껏 숙성하고 숯불 초벌로 내어드리는데, 그 맛을 좋게 평가해 주셔서 뿌듯합니다."
43496909,왕도숯불갈비,,,"구글 리뷰를 보고 방문해주셨다는 말씀, 그리고 기대 이상이었다는 표현에 저희가 지금까지 지켜온 원칙과 노력들이 보답받는 느낌이었습니다. 말씀해주신 대로 뼈가 거의 없는 고기를 넉넉하게 드리면서도 가격은 최대한 합리적으로 유지하려 애쓰고 있고, 고기뿐 아니라 매운 냉면과 매운 갈비 등 젊은 분들의 취향도 놓치지 않기 위해 메뉴 다양화에도 힘쓰고 있습니다."
