가게ID,가게명,평점,날짜,리뷰내용
1826026569,쿠히치 압구정점,,,여자친구랑 둘이 올때마다 절대 한주 한개만 시켜본적없을정도로 안주맛집이에요🥺
1826026569,쿠히치 압구정점,,,"역시나 기대를 저버리지 않고, 다양한 메뉴가 하나같이 맛있어서 재방문 의사 100%. 특히 후토마끼는 무조건 추천하고 싶을 정도로 맛있었고, 같이 간 직장 동료는 야키토리 파스타가 먹고 싶다고 해서 주문했는데 대성공🔥"
1826026569,쿠히치 압구정점,,,오늘 먹고 가는데 너무 즐거운 시간 보냈습니다. 그리고 여기 24 시간 이따 이. 대박!
1826026569,쿠히치 압구정점,,,"우니파스타하고 꽃전골나베 정말 맛있어요. 비주얼도 예술이었어요. 주차도 편하고, 단체룸이 있어서 프라이빗하게 먹기 좋네요. 안주 하나하나 퀄리티가 높아서 가격이 아깝지 않았습니다. 재방문 의사 100%!"
1826026569,쿠히치 압구정점,,,일단 나베는 먹기좋은놈이 맛도 있다고 넘 예쁘게 나왔는데 술이 쭉쭉 들어가는 맛 입니다👍👍👍👍
1826026569,쿠히치 압구정점,,,저녁에 방문예약 없이 이용대기 시간 바로 입장데이트연인・배우자
1826026569,쿠히치 압구정점,,,저녁에 방문예약 없이 이용대기 시간 바로 입장비즈니스친척・형제
1826026569,쿠히치 압구정점,,,저녁에 방문예약 없이 이용대기 시간 바로 입장친목지인・동료
1826026569,쿠히치 압구정점,,,저녁에 방문예약 없이 이용대기 시간 바로 입장친목친구
1826026569,쿠히치 압구정점,,,저녁에 방문예약 없이 이용대기 시간 바로 입장친목친구
1826026569,쿠히치 압구정점,,,저녁에 방문예약 없이 이용대기 시간 바로 입장친목친구
1826026569,쿠히치 압구정점,,,저녁에 방문예약 후 이용대기 시간 바로 입장친목지인・동료
1826026569,쿠히치 압구정점,,,회는 신선하고 탕은 맛있고 리뷰이벤트 서비스까지 너무 실하게 챙겨주셔서 넷이서 배부르게 먹었습니다
