가게ID,가게명,업종,평점,날짜,리뷰내용
1883493304,소크,술집,,,"지나가다 늘 가보고 싶었던 신당동 핫플 소크!🩵런치 오픈했다고 해서 점심시간에 방문💕라구파스타랑 트러플뇨끼 시켰는데 하나같이 맛있어서 리뷰에 칭찬 가득한거 인정이네요! 트러플 뇨끼는 트러플 향은 과하지 않게 은은하면서 부드럽게 녹아내리는 식감이 그야말로 예술이고 소스는 버터와 크림이 베이스로 트러플향을 방해하지 않으면서도 깊이 있게 받쳐주는 조합이라서, 천천히 음미하게 되는 맛이에요.라구파스타도 파스타 식감이 좋았고 제 입맛에 개운하게 느껴질 정도로 맛있었어요. 디저트 치즈케이크도 부드러운 식감에 넘 맛나 깜짝 놀라버림! 저녁에도 와보고 싶을 정도로 모던하고 쾌적한 세련된 인테리어하며 힙한 음악까지 완벽한 신당동 맛집입니다. 데이트 장소로도 좋고 꼭 가보시길💕"
1883493304,소크,술집,,,"카치오 에 페페는 후추향에 꾸덕꾸덕 짭짤한 치즈파스타, 와인이랑 찰떡에 시금치 파스타는 담백하고 향긋해서 부담스럽지 않아 좋았구요"
1883493304,소크,술집,,,"카치오 에 페페는 후추향에 꾸덕꾸덕 짭짤한 치즈파스타, 와인이랑 찰떡에 시금치 파스타는 담백하고 향긋해서 부담스럽지 않아 좋았구요"
1883493304,소크,술집,,,"카치오 에 페페는 후추향에 꾸덕꾸덕 짭짤한 치즈파스타, 와인이랑 찰떡에 시금치 파스타는 담백하고 향긋해서 부담스럽지 않아 좋았구요"
1883493304,소크,술집,,,카치오페페 잘하는것이 별로없는데.... 🥹 제 최애 파스타 집이에요 와인라인업도 너무 좋고 바치케 꼭 드셔보세료
1883493304,소크,술집,,,카치오페페 잘하는것이 별로없는데.... 🥹 제 최애 파스타 집이에요 와인라인업도 너무 좋고 바치케 꼭 드셔보세료
1883493304,소크,술집,,,카치오페페 잘하는것이 별로없는데.... 🥹 제 최애 파스타 집이에요 와인라인업도 너무 좋고 바치케 꼭 드셔보세료
1883493304,소크,술집,,,카치오페페 잘하는것이 별로없는데.... 🥹 제 최애 파스타 집이에요 와인라인업도 너무 좋고 바치케 꼭 드셔보세료
1883493304,소크,술집,,,"트러플 뇨끼랑 비프 타르타르, 카초에 페페, 소크 바스크 치즈 케이크 맛집입니다. 추천해주신 와인도 음식과 정말 잘 어울려서 좋았어요."
1883493304,소크,술집,,,"트러플 뇨끼랑 비프 타르타르, 카초에 페페, 소크 바스크 치즈 케이크 맛집입니다. 추천해주신 와인도 음식과 정말 잘 어울려서 좋았어요."
1883493304,소크,술집,,,"트러플 뇨끼랑 비프 타르타르, 카초에 페페, 소크 바스크 치즈 케이크 맛집입니다. 추천해주신 와인도 음식과 정말 잘 어울려서 좋았어요."
1883493304,소크,술집,,,"트러플뇨끼랑 크런치쉬림프, 스트라챠텔라 주문했는데 메뉴 다 맛있었고 와인과 찰떡일것같은 메뉴들이 정말 많더라구요"
1883493304,소크,술집,,,"트러플뇨끼랑 크런치쉬림프, 스트라챠텔라 주문했는데 메뉴 다 맛있었고 와인과 찰떡일것같은 메뉴들이 정말 많더라구요"
1883493304,소크,술집,,,"트러플뇨끼랑 크런치쉬림프, 스트라챠텔라 주문했는데 메뉴 다 맛있었고 와인과 찰떡일것같은 메뉴들이 정말 많더라구요"
1883493304,소크,술집,,,트리플 뇨끼의 감자는 입에서 녹는 느낌에 트리플의 향과 짭짤함이 더해져서 좋았고 버섯 등 들어가 있는 재료의 식감이 좋았어요~
1883493304,소크,술집,,,트리플 뇨끼의 감자는 입에서 녹는 느낌에 트리플의 향과 짭짤함이 더해져서 좋았고 버섯 등 들어가 있는 재료의 식감이 좋았어요~
1883493304,소크,술집,,,트리플 뇨끼의 감자는 입에서 녹는 느낌에 트리플의 향과 짭짤함이 더해져서 좋았고 버섯 등 들어가 있는 재료의 식감이 좋았어요~
1883493304,소크,술집,,,트리플 뇨끼의 감자는 입에서 녹는 느낌에 트리플의 향과 짭짤함이 더해져서 좋았고 버섯 등 들어가 있는 재료의 식감이 좋았어요~
35572039,수산룸포차,회,,,다른 요소인 지인들과 대화하기에는 좋은 환경이었고 5안이 룸에 들어거기는 다소 좁은 듯싶어서 홀을 이용했습니다
35572039,수산룸포차,회,,,"당일 식재료 관리와 조리 상태를 다시 한번 점검하고, 유사 사례가 발생하지 않도록 주방과 홀 모두 개선에 힘쓰겠습니다."
35572039,수산룸포차,회,,,모임 자리에서 안주와 분위기를 좋게 즐겨주셔서 감사드립니다. 특히 초밥까지 만족해 주셔서 큰 힘이 됩니다.
35572039,수산룸포차,회,,,본 리뷰는 가게로부터 식사권을 제공받아 체험하였으나 솔직한 개인평입니다.
35572039,수산룸포차,회,,,"사시미는 연어 뱃살로만 구성 되어 있는데, 기름기 잔뜩 올라와있고, 연어도 두툼하게 썰어져 나와서 식감도 좋았어요. 서비스로 유자샐러드와 김치전도 주셨는데… 김치전이 진짜 JMT…. 김치전만 다섯장 더 먹고싶었어요….. 다음에는 무한리필로 먹으러 올게요~~❤️ 많이 파세요"
35572039,수산룸포차,회,,,새우 처음에 너무 살아있는 아이들을 주셔서 당황했는데 저희 오도방정 떠는거 보시고 직접 손질해주시고 모리는 버터에 튀겨주심...ㅎ👍🏻
35572039,수산룸포차,회,,,생연어사시미회 맛집입니다! 저는 생연어 소자랑 오징어 튀김 주문했는데 많이 드실 분들은 무한리필 세트 주문하시면 너무 가성비 좋게 드실 수 있을 것 같아요! 연어회는 신선하고 탱글탱글해서 너무 맛있게 먹었고요 오징어튀김도 엄청 양 많고 바삭바삭해서 진짜 맛있었어요! 내부도 넓어서 단체 모임하기도 좋을 것 같더라구요 굳굳!
35572039,수산룸포차,회,,,셀프초밥간도 딱 맞구 해물라면은 너무 시원하고 얼큰해서 좋았습니당 ㅜㅜ 석화도 시켯는데 이가격에 이렇게 많이 나올줄 몰랐어용 사장님도 넘 친절하심!! 담에는 다른 회도 무거봐야겟어용!
35572039,수산룸포차,회,,,앞으로도 기분 좋은 시간을 드릴 수 있도록 준비하겠습니다.
35572039,수산룸포차,회,,,양 푸짐하고 정말 맛있었어요!! 숭어회 사진은 깜빡하고 먹는 중간에 찍었는데 양도 푸짐해서 되게 좋았습니다!
35572039,수산룸포차,회,,,양도 맛도 만족해 주시고 친절함과 매장 청결까지 좋게 봐주셔서 감사드립니다. 앞으로도 편안하고 즐거운 자리 되실 수 있도록 정성껏 준비하겠습니다.
35572039,수산룸포차,회,,,엥 저 연어만 시켰는데요??!?!?….. 튀김이랑 김치전이랑 연어튀김이 나왓음..🥺🥹 심지어 메인메뉴 못지않게 진짜 대박 맛있음..그리고 연어리필.?리필이 아니라 그냥 새로 갖다주신게 분명함 너무너무 만족스러오요…그리고 연어왕국이 연어왕국인 이유
35572039,수산룸포차,회,,,"연어와 함께 곁들임, 샐러드, 장국까지 꼼꼼히 즐겨주셔서 감사합니다."
35572039,수산룸포차,회,,,연어의 신선한 비주얼까지 좋게 평가해 주셔서 감사드립니다. 식욕을 돋워드렸다는 말씀에 저희도 큰 보람을 느낍니다.
35572039,수산룸포차,회,,,연포탕이랑 숭어연어 시켰는데 너무 싱싱하고 소주랑 잘어울리는 시원한국물 최고예요!!!!!! 매장도 넓고 좌석간격이 커서 모임하기에 딱이었어요:) 무엇보다 연어가 너무너무너무 탱글탱글하고 맛나요!!!!!!
35572039,수산룸포차,회,,,예약때 살짝 시간이 밀렸지만 회가 너무 맛있고 사이드로 나오는 음식들도 넘 맛있었어요 다음번에도 다시 방문하려고 합니다~~
35572039,수산룸포차,회,,,오랜만에 연어먹고싶어서 방문했습니다 ㅎㅎ 부위도 잘 주시고 숙성도 잘 된것 같아요. 김치전도 맛있고 초밥도 맛있게 잘 먹었습니다!
35572039,수산룸포차,회,,,우럭회를 2만원대에 먹을수있다니 놀랍습니다. 주문후 바로 생물을 잡아주시고 정말 신선합니다 바닷가갈핗요없디 신선한 회를 먹을수있다니 감동입니다👍 게다가 해물라면 얼큰한게 딱 소주안주구요 ㅎ 야채초장무침 반찬 대박이에요 어찌나 깔끔한지 입가심하기 딱👍배달도 되는 맛집이러 우리동네있었음 좋겠어요 무려 따끈한 김치전이 기본반찬입니다 👍
35572039,수산룸포차,회,,,이전에 부모님 모시고 한 번 왓엇는데 넘 맛잇게 먹었던 기억이 있어서 친한 언니랑 연어 먹으러 또 왔어요!!! 그때나 지금이나 넘 친절하시구 음식도 맛잇어서 대만족하구 갑니당. 다음에 또 올게요❤️❤️
35572039,수산룸포차,회,,,저녁에 방문예약 없이 이용대기 시간 바로 입장데이트연인・배우자
35572039,수산룸포차,회,,,저녁에 방문예약 후 이용대기 시간 바로 입장데이트연인・배우자
35572039,수산룸포차,회,,,저녁에 방문예약 후 이용대기 시간 바로 입장데이트친구
35572039,수산룸포차,회,,,"저희 수산룸포차를 찾아주셔 진심으로 감사드리며, 앞으로 더 좋은 모습 보여드릴 수 있게 밤낮없이 노력하겠습니다 :)"
35572039,수산룸포차,회,,,"좋은 인상 남겨주셔서 감사드리며, 만족스러운 시간이 되셨길 바랍니다."
35572039,수산룸포차,회,,,진짜 맛있어요~!~~!! 회 한점한점 싹싹 다 최고입니다 완전 추천해요!!! 특히 방어 이즈 최고~!~!~!~
35572039,수산룸포차,회,,,편안한 분위기에서 맛있는 연어회로 식사하셨다니 기쁜 마음입니다.
35572039,수산룸포차,회,,,"회 먹을 땐 왕십리맛집 연어왕국에 와요. 횟감이 싱싱하고 두툼해서 씹는 맛이 너무 좋고,,, 소스도 다양하게 주셔서 입맛대로 물리지 않게 다양히 먹을 수 있어요. 서비스로 나오는 김치전은 진짜 바삭하고 심지어 쫀득해요☺️ 룸도 있고 아늑한 분위기에서 수다 떨기 좋고 다음에 회식하러 오고 싶어요!"
1641857896,스시 히나타,초밥,,,"9일에 생일이라 방문했었는데, 정말 친절하게 메뉴별로 특징이나 생선종류 등 알려주시고 가끔 농담도 해주시고 너무 편안한 분위기에서 먹었습니다!!👍 총 3분의 쉐프님들이 4~5명씩 맡아서 해주셔서 더 빠르고 좋았던 것 같아요! 맛있고 분위기도 좋고 동생은 본인이 다녀본 오마카세 스시집 중 최고라고 할 정도였어요! 다음에 생선이 바뀔 즈음해서 또 오고싶네요😀"
1641857896,스시 히나타,초밥,,,네이버 예약이나 캐치테이블로 예약 꼭 필수였고 저는 점심 런치를 예약해서 갔어요. 39000원으로 가성비 갑이였고 다양한 종류의 초밥이 나와 진짜 넘 좋았어요🥹
1641857896,스시 히나타,초밥,,,디너보다 30분 짧은 코스지만 알찬 메뉴 구성으로 맛있게 먹었습니다 :) 친절함과 맛있는 음식으로 기분 좋은 시간 보냈습니다 ☺️
1641857896,스시 히나타,초밥,,,런치 4만원 언더에 츠마미가 이만큼 나오는 곳도 처음 봤고 양이 상당히 많이 나와서 너무 만족했습니다!!👍
1641857896,스시 히나타,초밥,,,런치로 가서 그런지 코스 자체는 좀 짧은 느낌인데
1641857896,스시 히나타,초밥,,,맛있게 먹느라 스시 사진은 못 찍었지만 청어를 좋아하지 않는데 오늘 청어가 유독 하나도 비리지 않고 부드럽고 상큼하고 정말 맛있었어요! 다른 스시와 소면까지 모두 맛있게 잘 먹었습니다^^샤베트는 딸기보다 바질이 가장 맛있어요ㅎㅎ다음에 또 방문하겠습니다:)
1641857896,스시 히나타,초밥,,,밤에 방문예약 후 이용대기 시간 바로 입장일상연인・배우자
1641857896,스시 히나타,초밥,,,"분위기가 좋고 공간도 넓고 깔끔해요. 음식이 하나하나 다 너무 맛있고 밥이랑 와사비, 간장 양까지 다 신경 써주셔서 너무 좋았어요! 스시가 모두 다 맛있고 특이해서 특히 더 좋았어요! 기념일에 가보는 것 추천합니다! 다음에 또 방문하고 싶은 곳이에요~"
1641857896,스시 히나타,초밥,,,성게에 열을 가하면 달아진다고 말씀주셨는데 달달하게 너무 만족하며 식사했습니다.
1641857896,스시 히나타,초밥,,,엄마 생신이라 집 근처 가성비 좋다는 오마카세 추천받아 방문했습니다!
1641857896,스시 히나타,초밥,,,엄마 생일이라고 애들이 예약한집~~스시가 부드럽고 불향이 좋은맛도 있고 디저트도 맛있는집이예요 가짓수가 많아 배는 부른데 기분좋은 배부름~~셰프의 친절함도 한몫했어요~~좋은날 또 가고 싶네요~^^
1641857896,스시 히나타,초밥,,,오랜만에 엄마랑 데이트하려고 런치 예약하고 방문했는데 5분 전에 대기 순서대로 입장 안내해 주셨고 음식 하나하나 나올 때마다 자세하게 친절하게 설명해 주셔서 좋았어요! 다른 메뉴들도 스시도 비린 것 하나 없이 다 맛있게 먹었오요🍣 식당도 깔끔하고 깨끗하고 조용조용하게 대화 나누면서 식사할 수 있어서 좋았어요🫶🏻
1641857896,스시 히나타,초밥,,,이날 원픽은 전갱이에 파페스토.. 등푸른생선 특유의 고소함에다가 특유의 향은 향긋한 파페스토가 잡아줘요!
1641857896,스시 히나타,초밥,,,일단 인테이어 합격 이정도 퀄에 이 가격이면 가성비 맛집 처음부터 끝까지 맛없는게 없음 쉐프님의 진심이 느껴짐 동생 생일여서 갓는데 되게 좋아함 또 방문예정
1641857896,스시 히나타,초밥,,,"일단 정말 맛있고, 코스 구성 자체가 엄청 알차더라구요ㅎㅎ 후토마키가 포함된 코스라니,, 사시미도 사실 더 제공해주셨는데 제가 깜빡하고 사진을 한 장밖에 못찍은거라(ㅠ) 그만큼 다채롭게 식사했던 코스였어요😋 초밥은 퀄리티 좋은 회들 도톰하게 썰어 올려주시구요 (참고로 새우 엄청 큽니다•• 제가 먹어본 새우초밥 중 가장 도톰한 새우초밥이었어요🦐) + 그리고 식전, 식후 요리들 다 하나같이 입맛 돋게 넘 맛나요! 요리 하나하나에 얼마나 많은 공을 들이시는지 느껴졌습니다ㅜㅜ 그리고 셰프님 엄청 세심하시고 친절하십니다ㅎㅎ 먹는 내내 디테일한 부분들까지 신경쓰시며 손님들 의사 여쭤보시고 세밀하게 다 맞춰주시려고 하시더라구요🥹(최고!) 덕분에 너무 맛있고 행복한 점심이었습니다- 감사합니다🙏🖤"
1641857896,스시 히나타,초밥,,,"저녁에 방문예약 후 이용대기 시간 10분 이내 데이트, 일상, 기념일연인・배우자"
1641857896,스시 히나타,초밥,,,저녁에 방문예약 후 이용대기 시간 바로 입장데이트연인・배우자
1641857896,스시 히나타,초밥,,,저녁은 모르겠지만 점심 오마카세는 가성비 괜찮다고 생각해요^^ 꼭 한번가보세요 ㅋ
1641857896,스시 히나타,초밥,,,저렴한 가격에 퀄리티도 좋고 넘 맛있었어요🤍🤍 앞으로도 런치 찾을때 방문할것같아요 ㅎㅎ
1641857896,스시 히나타,초밥,,,"전에 디너로 먹어보고 런치로 재방문했어요! 가격대비 구성 좋고 깔끔해요. 저는 양이 적은 편이라 밥양 줄여달라고 말씀 드리니 조절해시더라구요, 보이는 곳들이 다 깔끔해서 좋았습니다!!"
1641857896,스시 히나타,초밥,,,"점심에 방문예약 후 이용대기 시간 10분 이내 일상, 나들이혼자"
1641857896,스시 히나타,초밥,,,점심에 방문예약 후 이용대기 시간 바로 입장
1641857896,스시 히나타,초밥,,,점심에 방문예약 후 이용대기 시간 바로 입장데이트부모님
1641857896,스시 히나타,초밥,,,점심에 방문예약 후 이용대기 시간 바로 입장데이트연인・배우자
1641857896,스시 히나타,초밥,,,점심에 방문예약 후 이용대기 시간 바로 입장데이트연인・배우자
1641857896,스시 히나타,초밥,,,점심에 방문예약 후 이용대기 시간 바로 입장일상연인・배우자
1641857896,스시 히나타,초밥,,,"정신없이 먹느라 스시 사진이없지만, 찐 가성비 스시오마카세입니다. 전체적으로 20가지정도 되는것같고 1시간40분정도 끝없이 먹기만했던 기억밖에 없네요ㅎㅎ. 전체메뉴가 다 맛나지만 그중 귀하다는 금태와 5일간 숙성시킨 전어초밥은 최고였어요. 여기보다 두배이상 비쌌던 강남 오마카세에 비해서도 퀄리티와 맛이 뒤지지 않아요. 장어솥밥까지 찐하고 정성듬뿍. 완전 추천합니다~👍👍"
1641857896,스시 히나타,초밥,,,주말 저녁 69000원에 이 정도 퀄러티라니! 급하게 가까운 곳으로 찾아 갔다가 너무 만족스럽게 식사하고 왔습니다. 강남 비싼 오마카세 대비 전혀 부족하지 않네요. 가성비 찐 맛집으로 강추합니다!! 재방문 의사 100%입니다. 자발적 찐 리뷰입니다. 곧 엄마 생신인데
1641857896,스시 히나타,초밥,,,"진짜 구성이 너무 알차요, 이 가격에 이런 구성이 나올 수 있다니...🤤 왕십리 자랑입니다!!!"
1641857896,스시 히나타,초밥,,,처음방문했는데요 코스순서 너무 좋았고 음식의 양과 질 모두 최고입니다. 재방문 예정입니다.
1110533140,스시노칸도 왕십리비트플렉스점,초밥,,,가성비 좋네요 초밥이 진짜 다양해서 좋아요 레일에 없는건 큐알코드로 주문 가능하니 세상 편해요 구운 새우가 최애!
1110533140,스시노칸도 왕십리비트플렉스점,초밥,,,가성비도 좋고 초밥도 맛나고 종류도 많아서 좋습니다. 물론 맛도 좋아요~먹고싶은 초밥은 테이블에 있는 QR코드를 찍어 주문할 수 있어요.
1110533140,스시노칸도 왕십리비트플렉스점,초밥,,,개별 주문을 qr로 하라고 하는데 핸드폰 베터리가 없으면 어떡하죠?ㅠ 그리고 qr 사용 못하는 어른들은요ㅠ 종이나 사람이 주문 받았으면 좋겠습니다.
1110533140,스시노칸도 왕십리비트플렉스점,초밥,,,"너무 맛있어요!! 직원분들도 친철하시구, 모든접시 가격이 동일 하다니ㅎㅎ 초밥도 신선하고 맛있어서 많이 먹었습니다!ㅎㅎ 종류도 다양해서 너무 좋아요~담에또 방문하겠습니다!"
1110533140,스시노칸도 왕십리비트플렉스점,초밥,,,동네 맛집인데 주말엔 웨이팅이 길어서 평일에 초등학생 아이와 갔어요~골라먹는 재미도 있고 맛있어서 아이도 좋아해요~
1110533140,스시노칸도 왕십리비트플렉스점,초밥,,,"리뷰 1,711사진 1,223팔로워 77테마 1"
1110533140,스시노칸도 왕십리비트플렉스점,초밥,,,막상 주문하면 레일에 없는것만 주문하라고 찾아보면 다 있다고 그렇게 사람 무안하게 큰소리를 내셔야하는지 의문이네요 찾는 메뉴도없고 레일에 올라와있는 초밥에서 비린내 나니까 주문하지 만족스러웠으면 했겠나요 있으면 알아서 먹고 나갔겠죠ㅋㅋ여러모로 불쾌하네요
1110533140,스시노칸도 왕십리비트플렉스점,초밥,,,먹고 싶은 초밥이 없으면 테이블에 있는 QR 코드로 주문도 가능합니다.
1110533140,스시노칸도 왕십리비트플렉스점,초밥,,,"보통 고급이 아닌 가성비로 밀고나가는 회전초밥집은 잘못가면 레일에 단가 싼것만 잔뜩 돌아가는 경우가 많은데, 스시노칸도는 2번의 방문동안 정말 골고루 레일에 올라가있었어요."
1110533140,스시노칸도 왕십리비트플렉스점,초밥,,,사장님도 너무 친절하시구 왕십리점이 오래오래 안없어지고 있었르면 좋겠어요!!!
1110533140,스시노칸도 왕십리비트플렉스점,초밥,,,아플때마다 생각나서 먹는곳인데 항상 먹어도 마싰구 재료도 신선하구 여러가지를 먹을수있어서 너무좋아요ㅠㅠ 직원분들도 친절하시구 ~~
1110533140,스시노칸도 왕십리비트플렉스점,초밥,,,"여기 가성비 대박 스시맛집이에요. 활어회뿐 아니라 다양한 초밥에 롤에 디저트도 다양하고 푸짐해서 오마카세 갈 필요가 없다랄까요! 프리미엄 초밥이 모두 한접시 2,200원이라 실컷 먹어도 부담이 없어요. 식사 든든하게 하고도 가격 부담없어서 굿! 스시노칸도는 가성비를 넘어선 갓성비 왕십리 초밥맛집 입니다!"
1110533140,스시노칸도 왕십리비트플렉스점,초밥,,,오랫만에 아이와 방문했는 데 신선한 초밥과 서비스에 만족했습니다. 잘 먹었습니다 ㅎㅎ
1110533140,스시노칸도 왕십리비트플렉스점,초밥,,,이번주 주말에 갈때는 좀 실망했어요. 저희가 7시반 웨이팅 잡아두고 8시되서 들어갔는데 먹을것도 없었구 따로 시켜먹어야 했는데 이랬으면 사장님이 시간을 보고 웨이팅을 막아두던지 했으면 좋았을거같아요;; 30분넘게 기다리면서 저희 차례가 되니까 그제서야 마감이 얼마안남았는데 괜찮겠냐고 하시고 조금 기분이 안좋았어요 다른손님도 기분나쁘셨는지 얼마 안드시고 나가시더라구요.
1110533140,스시노칸도 왕십리비트플렉스점,초밥,,,저녁에 방문예약 없이 이용대기 시간 10분 이내 데이트연인・배우자
1110533140,스시노칸도 왕십리비트플렉스점,초밥,,,"전 메뉴 2,200원 균일가라 이 정도 입지에 가성비 면에서는 경쟁력 있는 건 확실. 그러나 전반적인 신선도나 맛은 평균 수준이라 큰 기대를 하면 다소 실망할 수 있음. 감태 스시, 묵은지 참치, 새우 초밥 등 메뉴 구성은 다양하지만 특출난 시그니처 메뉴가 있는 편은 아님."
1110533140,스시노칸도 왕십리비트플렉스점,초밥,,,절대 가지 마세요. 같이 간 일행이랑 여기서 먹고 식중독 걸려서 엄청 고생했어요. 초밥이나 육회가 그리 신선하지 않은 것 같아요
1110533140,스시노칸도 왕십리비트플렉스점,초밥,,,점심시간에도 많이 안붐벼서 혼밥하기도 괜찮겠어요. 빨간접시는 데워달라고 해야하는 건데 요청하면 바로 데워주시는것도 나쁘지 않은듯. 다 먹고나서야 런치세트의 존재를 알게 되었는데 골라먹기엔 회전 단품도 나쁘진 않은듯요
1110533140,스시노칸도 왕십리비트플렉스점,초밥,,,점심에 방문예약 없이 이용대기 시간 바로 입장데이트연인・배우자
1110533140,스시노칸도 왕십리비트플렉스점,초밥,,,점심에 방문예약 없이 이용대기 시간 바로 입장일상혼자
1110533140,스시노칸도 왕십리비트플렉스점,초밥,,,점심에 방문예약 없이 이용대기 시간 바로 입장일상혼자
1110533140,스시노칸도 왕십리비트플렉스점,초밥,,,점심에 방문예약 없이 이용대기 시간 바로 입장친목아이
1110533140,스시노칸도 왕십리비트플렉스점,초밥,,,"점심에 방문예약 후 이용대기 시간 10분 이내 친목연인・배우자, 아이"
1110533140,스시노칸도 왕십리비트플렉스점,초밥,,,점심에 방문예약 후 이용대기 시간 바로 입장데이트부모님
1110533140,스시노칸도 왕십리비트플렉스점,초밥,,,초밥귀신인데 종류도 다양하고 신선하더라구요! 계속 손이가는 매직~~ 금액도 접시별로 다 같아서 취향껏 먹어도되서 부담없었어요 ㅎㅎ
1110533140,스시노칸도 왕십리비트플렉스점,초밥,,,타 회전초밥집에 비하면 맛에비해 가격이 괜찮은 편인것 같아요. 광어지느러미 여러번 시켜먹었는데 퀄리티도 나쁘지 않고 다른 초밥도 횟감 얇지않고 적당히 씹는맛 있는 두께여서 좋았습니다. 미니우동도 3천원인가 그러던데 작은 그릇이아니라 큰 그릇에 주셔서 놀랐네요.
1110533140,스시노칸도 왕십리비트플렉스점,초밥,,,"한접시 2,200 균일가. 가볍게 초밥 먹고 싶을 때 부담없이 오는 곳이에요!! 사장님이 정말 친절하셔서 가게 분위기도 전체적으로 좋아요 모든 직원분들이 친절해요 😊😊 올 때마다 기분이 좋네요. 초밥도 너무 맛있어요!"
1110533140,스시노칸도 왕십리비트플렉스점,초밥,,,항상 본점서만 먹다가 왕십리점에 와봤어요~~맛은 본점과 같네요 굿ㅇ빈디ㅏ~~~한접시당 2200원 넘 저렴하고 다양한맛을 가성비 있게 즐길수 있어서 좋았어요
