가게ID,가게명,업종,평점,날짜,리뷰내용
1379819785,왕십리 수상한막창 본점,한식,,,처음 와봤는데 5시전에 왔더니 웨이팅 없이 입장했어요 !! 사장님이 중간중간 와서 구워주시고 소스도 다양해서 좋았어요 ㅎㅎ !! 5시 되니깐 사람들이 점점 몰리더라구요 ~!! 왕십리에 이거 먹으러 또 와야겠어요 🫶🏻🫶🏻
1379819785,왕십리 수상한막창 본점,한식,,,처음 와봤는데 5시전에 왔더니 웨이팅 없이 입장했어요 !! 사장님이 중간중간 와서 구워주시고 소스도 다양해서 좋았어요 ㅎㅎ !! 5시 되니깐 사람들이 점점 몰리더라구요 ~!! 왕십리에 이거 먹으러 또 와야겠어요 🫶🏻🫶🏻
1379819785,왕십리 수상한막창 본점,한식,,,"친구들이랑 수상한막창 다녀왔어요! 소금구이랑 양념구이 둘 다 시켰는데 비린내도 전혀 안 나고 쫄깃쫄깃 고소해서 진짜 맛있었어요 😋. 막창은 굽는 데 시간이 조금 걸리긴 하지만 기다린 보람이 있더라구요. 사람들이 많아서 웨이팅까지 했는데, 인기 있는 이유가 있었어요. 소금구이는 소주랑 찰떡이고, 양념구이는 달콤하면서 맥주랑 너무 잘 어울려서 술이 술술 들어갔답니다 🍻💕"
1379819785,왕십리 수상한막창 본점,한식,,,항상 웨이팅이 있어서 궁금했는데 운 좋게 웨이팅이 없는 순간에 왔어요! 앉자마자 바로 웨이팅 시작되는데 2호점도 있나보더라구요ㅎㅎ
1379819785,왕십리 수상한막창 본점,한식,,,항상 웨이팅이 있어서 궁금했는데 운 좋게 웨이팅이 없는 순간에 왔어요! 앉자마자 바로 웨이팅 시작되는데 2호점도 있나보더라구요ㅎㅎ
1519043808,왕십리누룽지통닭구이,치킨,,,“맛있다”라는 말만으로도 저희 통닭집 팀원들 모두 힘이 난답니다. 통닭 껍질 바삭함과 누룽지의 고소한 향이 잘 전해진 것 같아 다행이에요.
1519043808,왕십리누룽지통닭구이,치킨,,,“맛있다”라는 말만으로도 저희 통닭집 팀원들 모두 힘이 난답니다. 통닭의 부드러움과 누룽지의 고소한 향이 잘 전해진 것 같아 다행이에요.
1519043808,왕십리누룽지통닭구이,치킨,,,“어디 가볼까?” 고민 끝에 저희를 찾아주신 발걸음이 정말 소중합니다. 첫 만남이니만큼 더 좋은 기억 남으셨길 바라요 앞으로 오실 때마다 “여긴 믿고 간다!” 하실 수 있도록 최선을 다하겠습니다. 또 뵐 수 있길 기다리고 있겠습니다♡
1519043808,왕십리누룽지통닭구이,치킨,,,누룽지 콘치즈닭 완전 강강강추!! 치즈도 많고 치킨도 넘 맛있어요~ 생맥에 누룽지 통닭 딱 먹으니까 너무 좋다.. 요새 날씨도 넘 좋아서 다음 번에는 야장 자리에서 먹고 싶네용
1519043808,왕십리누룽지통닭구이,치킨,,,누룽지통닭 먹고 싶어서 근처에서 온건데 넘 맛있어요!! 통닭도 양 많고 맛있고 콘치즈 최고로 맛나료😍 파 올라간거 완벽하고 조합이 좋아요! 같이 주시는 소스들도 너무 맛있고 술 먹기 넘 좋은 쾌적한 공간에 친구들이랄 즐거운 시간 보냈습니다...♡ 모임식사나 2차에 넘 강추에요!!
1519043808,왕십리누룽지통닭구이,치킨,,,다음에 다시 찾아주신다면 이번보다 더 따뜻한 서비스와 한층 깊어진 맛으로 보답드리겠습니다.
1519043808,왕십리누룽지통닭구이,치킨,,,"두 번, 세 번 다시 찾아주시는 발걸음이 저희에게는 최고의 칭찬이자 응원입니다 앞으로 오실 때마다 늘 새롭고 맛있는 경험을 드릴 수 있도록 열심히 준비하겠습니다. “맛도 굿! 분위기도 굿! 서비스도 굿!” 삼박자를 다 갖춘 매장으로 기억될 수 있도록 노력할게요 다음 방문에도 든든하게 챙겨드리겠습니다♡"
1519043808,왕십리누룽지통닭구이,치킨,,,또 방문해주실 때 이번보다 더 큰 만족 드릴 수 있도록 노력하겠습니다♡
1519043808,왕십리누룽지통닭구이,치킨,,,"많은 선택지 중 저희를 선택해주신 것만으로도 큰 힘이 되고, 더욱 정성스럽게 준비해야겠다는 마음을 다잡게 됩니다. 오늘의 한 끼가 고객님께 좋은 추억이 되셨기를 바라며, 앞으로도 언제 오셔도 만족하실 수 있도록 변함없는 맛과 따뜻한 서비스로 보답드리겠습니다. 다음에 다시 찾아주실 때는 한층 더 편안하고 즐거운 시간이 되실 수 있도록 최선을 다해 준비하겠습니다♡"
1519043808,왕십리누룽지통닭구이,치킨,,,먼저 저희 누룽지통닭을 찾아주셔서 감사드려요 그리고 ‘맛있다’는 한마디로 소중한 마음을 전해주셔서 정말 기쁩니다.
1519043808,왕십리누룽지통닭구이,치킨,,,배부른 상태로 2차왔는데 너무 맛있게 먹었습니다!! 누통 먹을 수 있는 곳이 잘 없는데 간만에 잘먹었습니다!!
1519043808,왕십리누룽지통닭구이,치킨,,,부드럽게 구워낸 통닭과 누룽지의 고소함이 입안에서 잘 어울렸길 바랍니다. 저희가 추구하는 바로 그 맛을 느끼셨다니 너무 기뻐요!
1519043808,왕십리누룽지통닭구이,치킨,,,부드럽게 구워낸 통닭과 누룽지의 고소함이 입안에서 잘 어울렸길 바랍니다. 저희가 추구하는 바로 그 맛을 느끼셨다니 너무 기뻐요!
1519043808,왕십리누룽지통닭구이,치킨,,,앞으로 오실 때마다 늘 새롭고 맛있는 경험을 드릴 수 있도록 열심히 준비하겠습니다. “맛도 굿! 분위기도 굿! 서비스도 굿!” 삼박자를 다 갖춘 매장으로 기억될 수 있도록 노력할게요!!! 다음 방문에도 든든하게 챙겨드리겠습니다♡
1519043808,왕십리누룽지통닭구이,치킨,,,앞으론 지금보다 더 맛있고 따뜻한 한 끼 드실 수 있도록 늘 정성과 노력을 더할게요.
1519043808,왕십리누룽지통닭구이,치킨,,,양도 완전 많구 고소하니 넘 맛있어요!! 왕십리역 근처에서 꼭 와볼만한 곳인거같아요:)
1519043808,왕십리누룽지통닭구이,치킨,,,완전 왕맛입니다.. 반반되는 것도 너무 좋고 누룽지가 너무 바삭하니 진짜 그냥 편안하게 먹고 놀기 너무 좋구 다들 친절해서 좋아요!!
1519043808,왕십리누룽지통닭구이,치킨,,,저희 왕십리누룽지통닭구이는 늘 ‘오늘 처음 오신 손님이 내 가족이다’라는 마음으로 음식을 준비합니다.
1519043808,왕십리누룽지통닭구이,치킨,,,제 인생치킨입니다 누룽지통닭 생각나서 한 달에 한번은 꼭 오는 거 같아요! 치킨이 퍽퍽하지도 않고 너무 부드러워요~ 콘치즈에 누룽지까지 먹으면 진짜 맛있습니다!!!
1519043808,왕십리누룽지통닭구이,치킨,,,주말 끝자락이 아쉬워서 생맥한잔하러 감. 생맥맛집이라고 짝꿍이 좋아하는집이지만 누룽지통닭이 제대로인곳. 뚝배기라면은 생각지도않게 취저메뉴였음. 누룽지도 정말 내스타일로 바삭바삭! 잡내하나없는 닭고기는 열무김치랑 궁합이 넘 좋아서 생맥주를 더마시게 함. 친절함은 기본인 집이라 지인들이 다~ 좋아하는곳!
1519043808,왕십리누룽지통닭구이,치킨,,,"처음 방문해주셨을 때의 그 인연이 이렇게 다시 이어져서 너무나 기쁘고 힘이 됩니다. 고객님께서 드신 한 끼가 만족스러우셨다는 뜻이기에 저희에게는 더 큰 보람이 됩니다. 앞으로도 늘 변함없이 정성과 마음을 담아 준비하여, 오실 때마다 “역시 오길 잘했다 ”라는 생각이 드실 수 있도록 하겠습니다. 언제든 또 편하게 들러주세요, 늘 기다리고 있겠습니다 ♡"
1519043808,왕십리누룽지통닭구이,치킨,,,"처음 방문해주셨을 때의 그 인연이 이렇게 다시 이어져서 너무나 기쁘고 힘이 됩니다. 고객님께서 드신 한 끼가 만족스러우셨다는 뜻이기에 저희에게는 더 큰 보람이 됩니다. 앞으로도 늘 변함없이 정성과 마음을 담아 준비하여, 오실 때마다 “역시 오길 잘했다”라는 생각이 드실 수 있도록 하겠습니다. 언제든 또 편하게 들러주세요, 늘 기다리고 있겠습니다♡"
1519043808,왕십리누룽지통닭구이,치킨,,,"친구들과 누룽지 양념통닭, 누룽지 파 콘치즈닭 먹었어요 ! 매장도 넓어서 대기없이 들어갔고, 치킨과는 다른 매력이 있어서 너무 맛있었어요 ㅎㅎ 다음에 또 방문할게요!"
1519043808,왕십리누룽지통닭구이,치킨,,,콘치즈러버인데 취저입니다ㅜㅠㅠㅠ넘 맛있어요 닭도 너무 부드럽고 맛나여 다음에 또 올거예여 꼭꼭!!!!!
1519043808,왕십리누룽지통닭구이,치킨,,,한 끼가 기분 좋은 시간이 되실 수 있도록 매일같이 정성과 마음을 담아 음식을 준비하고 있습니다. 고객님의 응원이 저희에게는 큰 원동력이 됩니다. 다음 방문 때도 “역시 잘 왔다”라는 생각이 드실 수 있도록 늘 변함없이 노력하겠습니다♡
1519043808,왕십리누룽지통닭구이,치킨,,,"항상 처음 마음 그대로, 정직한 재료와 정성으로 준비하고 있으니"
1519043808,왕십리누룽지통닭구이,치킨,,,"항상 처음 마음 그대로, 정직한 재료와 정성으로 준비하고 있으니"
1519043808,왕십리누룽지통닭구이,치킨,,,"항상 처음 마음 그대로, 정직한 재료와 정성으로 준비하고 있으니"
1545773559,왕십리막회,회,,,"“유명한 이유가 있다”는 말씀에 감동이고, 다음에도 시원하고 맛있는 한 끼로 보답드리겠습니다. 꼭 또 뵐게요~! 💙💙💙"
1545773559,왕십리막회,회,,,골목에 있었을 때 부터 왔던 곳인데 넓운 곳으로 이사해서 넘 좋아요! 음식은 여전히 맛있습니다 ㅎㅎ 제철 회로 막회를 먹을 수 았어서 좋아요
1545773559,왕십리막회,회,,,"남자친구가 지난번에 왕십리에서 맛있는 막회를 먹었다고 같이 가자길래 방문했어요!! 주문하자마자 바로 금방 나오고, 야채도 진짜 많이 주세요! 그리고 막회 시키면 나오는 떡 튀김!?강정!?도 맛있어요!!(남자친구꺼 제가 다 먹었어요...ㅎㅎ)가격이 좀 있을법도 한데 진짜 저렴해요! 위치도 정말 찾기 쉬워요🙂 다들 어떻게 아시는지 매장이 큰 데 사람도 많더라고요...!?양도 은근 많아서 다들 꼭 왕십리에서 회 먹을 일 있으시면 방문해보세요!!"
1545773559,왕십리막회,회,,,"넓어진 매장, 여전히 맛있는 막회, 그리고 직원들 친절함까지 좋게 봐주셔서 큰 힘이 됩니다 😊 앞으로도 추천받을 수 있는 가게가 되도록 늘 정성껏 준비하겠습니다. 또 놀러오세요❤️❤️"
1545773559,왕십리막회,회,,,"넓어진 새 매장까지 좋게 봐주시고, “왕십리 막회집은 이곳이 최고”라는 말씀에 큰 힘이 납니다 😋"
1545773559,왕십리막회,회,,,동네에 있는 횟집 찾다가 오늘 처음 왔는데 완전 대만족입니다! 다음에 또 올 집이에요! 회 드실라면 꼭 방문하세요🤤
1545773559,왕십리막회,회,,,막회를 김에 싸 드신 색다른 방식도 멋지네요! 가족·데이트·직장인 모임까지 추천해주셔서 큰 힘이 됩니다. 언제든 편하게 또 들러주세요~!
1545773559,왕십리막회,회,,,"맛, 구성, 서비스, 친절까지 이렇게 과분한 칭찬 주셔서 큰 힘이 됩니다! 말씀해주신 대로 ‘왕십리 맛집’으로 늘 기억될 수 있도록 신선하고 든든하게 준비해두겠습니다. 언제든 편하게 또 들러주세요❤️"
1545773559,왕십리막회,회,,,신선하게 드셔주셔서 감사합니다 🙏 맛있게 즐기셨다니 기쁘네요! 다음 방문도 환영합니다~ 항상 정성껏 준비해두겠습니다😊
1545773559,왕십리막회,회,,,"신선한 회, 깔끔한 매장, 친절함까지 좋게 봐주셔서 힘이 나네요 😊 ‘왕십리 주민 맛집’이라 말씀해주시니 더없이 뿌듯합니다! 다음에도 회 생각나실 때 꼭 들러주세요~ 항상 기다리고 있겠습니다!"
1545773559,왕십리막회,회,,,"싱싱한 회와 미나리의 조화, 그리고 양념 맛까지 이렇게 세심하게 표현해주셔서 정말 감사합니다!"
1545773559,왕십리막회,회,,,앞으로도 늘 맛과 분위기 모두 만족하실 수 있도록 정성 다하겠습니다. 또 뵐게요~!
1545773559,왕십리막회,회,,,"역시 맛있다고 해주셔서 기쁘네요 😊 비 오는 날 드시는 막회, 물회는 또 특별한 맛이 있죠~ 다음에도 언제든 편하게 들러주세요"
1545773559,왕십리막회,회,,,왕십리에서 막회랑 물회 맛있게 드셨다니 너무 기쁘네요 😊 늘 신선하게 준비해서 언제 오셔도 만족하실 수 있도록 하겠습니다. 또 놀러오세요~
1545773559,왕십리막회,회,,,이렇게 강력 추천해주셔서 감사합니다 🙏 언제든 편하게 들러주시기 좋게 신선한 회와 좋은 분위기 준비해두겠습니다😊 1차든 2차든 늘 환영이에요~!
1545773559,왕십리막회,회,,,"이전 후 첫 방문부터 이렇게 따뜻한 리뷰 남겨주셔서 감사합니다 🙏 넓어진 매장과 창가 자리 분위기까지 좋게 봐주시니 더 힘이 나네요. 막회와 미나리, 떡꼬치까지 맛있게 즐겨주셔서 기쁩니다 😊 함께 오신 친구분께도 감사 전해드리고 싶네요. 언제 오셔도 만족하실 수 있도록 늘 정성 다하겠습니다~!"
1545773559,왕십리막회,회,,,저녁에 방문예약 없이 이용대기 시간 바로 입장친목친구
1545773559,왕십리막회,회,,,저녁에 와 봤는데 대기 없이 바로 들어와서 맛있게 잘 먹었어요! 회도 야채도 신선하고 양도 많고 아주 만족스러운 식사였어요! 생각나는 맛이라서 또 올 예정입니다.
1545773559,왕십리막회,회,,,주류도 저렴하구요. 서비스로 떡튀김도 주십니다. 꼭 와서 드세요. 특히 회사원들 저렴히 술 회식 좋습니다
1545773559,왕십리막회,회,,,주중에 퇴근 후 막회에 맥주 한잔하기 최고네요 ㅎㅎ 막회 너무 맛있어요..! 가격도 너무 착한데 생선 퀄리티까지 신선해서 술이 쭉쭉 들어갑니다 ㅋㅋ 같이 시킨 해물라면까지 존맛탱~!! 왕십리 가성비 횟집으로 이만한 곳이 없는 것 같아요 😍👍👍
1545773559,왕십리막회,회,,,"착한 가격과 맛, 거기에 미역된장국까지 소주 안주로 좋게 봐주셔서 힘이 납니다 😊 다음 방문 때도 더 맛있게 준비해놓고 기다리겠습니다. 꼭 또 들러주세요~!"
1545773559,왕십리막회,회,,,"찾아와 주셔서 감사합니다 🙏 기다려서 와주신 만큼 만족하셨다니 기쁘네요. 직원들 친절하게 봐주신 것도 감사드리고, 푸짐한 양까지 잘 즐겨주셔서 힘이 납니다 😊 언제든 편하게 또 들러주세요~"
1545773559,왕십리막회,회,,,"친절하게 봐주셔서 감사합니다 🙏 기본 가래떡 안주부터 막회, 해물라면까지 맛있게 즐겨주셔서 정말 기쁘네요 😊 언제 오셔도 신선하고 맛있게 대접드릴 수 있도록 늘 정성껏 준비하겠습니다~"
1545773559,왕십리막회,회,,,한입 먹자마자 왕십리 근처 사는 모든 친구 지인에게 소개했어요!! 바로 단골 등극하고 싶은 맛집입니다ㅠㅠ 자주 올게요!
1545773559,왕십리막회,회,,,확장 이전 후 첫 방문인데 막회는 여전히 너무 신선하고 맛있고 넓찍한 매장이 엄청 쾌적해요! 라면도 아주 맛있어요! 생각나는 맛여서 조만간 또 갈듯해요 ㅎ
1545773559,왕십리막회,회,,,"확장 이전한 매장도 좋게 봐주시고, 막회 맛까지 여전히 만족해주셔서 큰 힘이 됩니다 😊 앞으로도 늘 신선하고 맛있게 준비해서 오래도록 단골로 모실 수 있도록 하겠습니다. 또 편하게 들러주세요~!"
1545773559,왕십리막회,회,,,회가 너무 신선하구 맛있어요!! 장소를 옮겼는데 이전 느낌도 좋았지만 옮기고 나서 더 쾌적해지고 깔끔해진것 같아요!! 가격도 대학가 앞이니만큼 부담이 없어서 더 자주올것 같습니다!! 2차 장소로 완전 추천!!!
1545773559,왕십리막회,회,,,"회도 분위기도 떡튀김까지 맛있게 즐겨주셔서 감사합니다 🙏 요즘 시원한 날씨에 매장 분위기까지 좋게 봐주셔서 기쁘네요. 다음 방문도 환영합니다, 늘 정성껏 준비해두겠습니다~!"
11619623,왕십리맛나곱창,한식,,,너무 맛있었어요~ 담백하면서도 쫄깃한 식감이 일품이었고 특히 곱창구이가 정말 강추에요! ㅎㅎ
11619623,왕십리맛나곱창,한식,,,너무 맛있었어요~ 담백하면서도 쫄깃한 식감이 일품이었고 특히 곱창구이가 정말 강추에요! ㅎㅎ
11619623,왕십리맛나곱창,한식,,,밤에 방문예약 없이 이용대기 시간 바로 입장나들이친척・형제
11619623,왕십리맛나곱창,한식,,,소곱창구이 먹었는데 진짜 맛있어요 직원분들도 모두 친절하게 대해 주셔서 좋았네요
11619623,왕십리맛나곱창,한식,,,소곱창구이 진짜 맛나게 먹었어요 ㅎㅎ 속이 든든해지고 굽기도 딱 적당해서 좋았네요
11619623,왕십리맛나곱창,한식,,,소곱창에 염통 부추 양파 버섯 감자 이조합이 진짜 찐이네요 대박
11619623,왕십리맛나곱창,한식,,,소곱창에 염통 부추 양파 버섯 감자 이조합이 진짜 찐이네요 대박
11619623,왕십리맛나곱창,한식,,,소곱창전골이 정말 일품이에요 매콤한게 딱 좋고 곱창이 쫄깃쫄깃해서 식감이 좋네요 ㅎㅎ 다음에 또 먹으러 오고 싶어요^^
11619623,왕십리맛나곱창,한식,,,소곱창전골이 정말 일품이에요 매콤한게 딱 좋고 곱창이 쫄깃쫄깃해서 식감이 좋네요 ㅎㅎ 다음에 또 먹으러 오고 싶어요^^
11619623,왕십리맛나곱창,한식,,,"소금과 야채 곱창 먹고, 양념막창 추가해서 먹었어요."
11619623,왕십리맛나곱창,한식,,,"소금과 야채 곱창 먹고, 양념막창 추가해서 먹었어요."
11619623,왕십리맛나곱창,한식,,,완전 만족스러웠어요 소곱창구이는 정말 쫄깃하고 특유의 식감이 일품이네요
11619623,왕십리맛나곱창,한식,,,"완전 실한 곱창 맛집입니다!! 염통도 쫄깃하고 너무 맛있어요🤤 직접 구워주시고 잘라주셔서 편리하기까지 합니다!! 감자, 부추, 버섯, 양파, 마늘까지 한판에 있어서 골라먹는 재미까지 갖춘곳👍🏻 매장도 넓고 직원분들도 엄청 친절하세요♥️ 왕십리에서 곱창 생각나신다면 꼬옥 들려보세요✨"
11619623,왕십리맛나곱창,한식,,,"완전 실한 곱창 맛집입니다!! 염통도 쫄깃하고 너무 맛있어요🤤 직접 구워주시고 잘라주셔서 편리하기까지 합니다!! 감자, 부추, 버섯, 양파, 마늘까지 한판에 있어서 골라먹는 재미까지 갖춘곳👍🏻 매장도 넓고 직원분들도 엄청 친절하세요♥️ 왕십리에서 곱창 생각나신다면 꼬옥 들려보세요✨"
11619623,왕십리맛나곱창,한식,,,왕십리곱창 3대장 맛나곱창에 처음 방문했어요. 평일이고 무더운 날씨인데도 사람들이 많았어요. 시그니처 야채곱창이 정말 맛있었어요~ 다른 사람들은 소곱창을 많이 먹던데 다음에 저도 소곱창 먹으러 다시 가야겠어요~
11619623,왕십리맛나곱창,한식,,,음식 맛이 너무 기대 이상이었어요. 소곱창구이 먹었는데 쫄깃하면서도 부드러운 식감이 좋았어요. 고소한 맛이 일품이었고 잘 구워져서 나왔더라고요 ㅎㅎ
11619623,왕십리맛나곱창,한식,,,저녁에 방문예약 없이 이용대기 시간 바로 입장데이트연인・배우자
11619623,왕십리맛나곱창,한식,,,저녁에 방문예약 없이 이용대기 시간 바로 입장데이트연인・배우자
11619623,왕십리맛나곱창,한식,,,"점심에 방문예약 없이 이용대기 시간 30분 이상친목, 일상친구"
11619623,왕십리맛나곱창,한식,,,"점심에 방문예약 없이 이용대기 시간 30분 이상친목, 일상친구"
11619623,왕십리맛나곱창,한식,,,정말 깔끔하고 맛있게 먹었어요. 소곱창전골 특유의 깊은 맛이 일품이라 다음에도 또 찾게 될 것 같네요.
11619623,왕십리맛나곱창,한식,,,정말 만족했었어요. 음식도 좋고 넉넉한 양에 가격도 합리적이었어요. 소곱창전골 맛있더라고요.
11619623,왕십리맛나곱창,한식,,,정말 만족했었어요. 음식도 좋고 넉넉한 양에 가격도 합리적이었어요. 소곱창전골 맛있더라고요.
11619623,왕십리맛나곱창,한식,,,정말 맛있는 곱창이에요 주변 곱창집들 다 먹어봤는데 맛나곱창이 제일 맛있어요 소곱창구이도 좋고 신선하고 질도 좋아요
11619623,왕십리맛나곱창,한식,,,정말 맛있는 곱창이에요 주변 곱창집들 다 먹어봤는데 맛나곱창이 제일 맛있어요 소곱창구이도 좋고 신선하고 질도 좋아요
11619623,왕십리맛나곱창,한식,,,정말 맛있는 곱창집이에요 주변 곱창집들 다 먹어봤는데 맛나곱창이 제일 맛있어요 소곱창구이 먹었는데 쫄깃하고 부드러워서 좋았어요
11619623,왕십리맛나곱창,한식,,,직원분들이 다들 친절하게 응대해주셔서 좋았어요 소곱창구이 먹었는데 참 맛있고 좋네요
11619623,왕십리맛나곱창,한식,,,직원분들이 다들 친절하게 응대해주셔서 좋았어요 소곱창구이 먹었는데 참 맛있고 좋네요
11619623,왕십리맛나곱창,한식,,,집에서도 고소한 향과 쫄깃한 식감 즐길 수 있어 자주 이용할 듯
11619623,왕십리맛나곱창,한식,,,집에서도 고소한 향과 쫄깃한 식감 즐길 수 있어 자주 이용할 듯
31029000,왕십리조개창고조개요리,회,,,7~9년전에 부모님이랑 같이 먹고 다음에 또 먹고싶어 기억하고 저장한 곳 입니다 변함없이 맛있고 신선하고 매장이 청결하고 분위기 좋습니다 제주도에서 친구랑 전국대회때문에 내려와서 끝나고 뭐 먹지 하다가 기억이나 왔습니다. 너무 잘먹었고 사장님도 친절해 조개구이가 먹고싶다하면 와보면 매우 좋겠습니다🤠🤠
31029000,왕십리조개창고조개요리,회,,,가끔오는데 재료도 신선하고 최고입니다!!
31029000,왕십리조개창고조개요리,회,,,고기도 소고기 돼지고기 다 있고 종류가 너무 많아서 다 못먹어서 아쉬워요 다음에 다 먹으러 또 방문할게요🥰
31029000,왕십리조개창고조개요리,회,,,"고기류는 목살, 삼겹살 외에 껍데기, 돼지갈비, 오리훈제, 막창도 구비하고 있고 핵심인 조개류의 경우 키조개, 가리비, 백합, 새우, 오징어, 전복 등에 개불, 홍게까지 구비되어 있었다. 그 외 맥주, 소주 그리고 라면이나 아이스크림도 있었는데 착석 시 따로 주시는 바구니에다 담으면 그만큼 추가 요금을 지불하는 방식이다."
31029000,왕십리조개창고조개요리,회,,,고기보단 역시 조개 위주로 먹게 되는데.. 그게 더 가성비 있고 좋은 것 같습니당 비린내 안 나구 맛있어요 ㅎㅎ!!! 직원분들도 친절하시고 식당 특성 상 지하에 있고 구워먹는 곳이라 좀 많이 더워요! 참고하시길
31029000,왕십리조개창고조개요리,회,,,곳곳에 정겨운 물건들도 디피되어있는데 추억팔이 하기도 좋구요~ 인천 놀러 못가도 여기오면 딱 어디 여행온 기분이 들어서 늘 자주 찾게되는 조개창고는 보물창고입니다^^♡ 늘 싱싱한 조개들과 고기들 신경써주셔서 감사합니다~!!!!
31029000,왕십리조개창고조개요리,회,,,너무나 푸짐하고 맛있게 잘먹었습니다😍 조개도 고기도 좋아하는 저한테는 천국이나 다름없던곳이자~ 무엇보다 육해공이 다양하게 준비되어 있다보니 해산물 잘못먹는 일행이 있어도 아무걱정없이 갈 수 있는 식당이라 완전붐업~!!
31029000,왕십리조개창고조개요리,회,,,두 번째 방문하는 곳 이번에는 당근 마켓 10% 할인쿠폰까지 적용되서 내생애 최애 식당 1위
31029000,왕십리조개창고조개요리,회,,,매장도 엄~~청 큰데 에어컨도 엄청 빵빵!!해서 먹을때 더운느낌 하나도 없이 조개먹었어요!!
31029000,왕십리조개창고조개요리,회,,,명절에 영업 해주셔서 조개에 고기까지 원없이 먹고 갈 수 있어서 좋았어요~!
31029000,왕십리조개창고조개요리,회,,,보통 조개구이집은 키조개가 통으로 있는데 여기는 까놓으셔서 가져다 구우면 되서 편하고 넘 좋네요
31029000,왕십리조개창고조개요리,회,,,"부모님 생신에 가족 모임을 했는데, 사장님께서 정성가득하신 초코파이 케익도 해주시고 와인도 서비스로 주시고 너무 분위기도 좋고 조개도 신선하고 맛있습니다. 촤고입니다~~"
