가게ID,가게명,평점,날짜,리뷰내용
1165635472,브라운팟,,,"확실히 맛있어요 전체적으로 다 빵 맛있을거같은데 ,저녁을 먹어야해서 샌드위치만 간단히 먹어서 아쉬웠어요 ㅡ"
1221454158,스타벅스 왕십리역9번출구점,,,2층 유리벽 쪽에 앉아서 커피 한잔하면 마치 호텔에 온듯한 느낌도 듭니다.
1221454158,스타벅스 왕십리역9번출구점,,,아침에 방문예약 없이 이용대기 시간 바로 입장일상혼자
1221454158,스타벅스 왕십리역9번출구점,,,왕십리역 9번출구의 스타벅스. 깨끗하고 대화하기 좋은 곳. 그나저나 빵과 케잌류 가격이 너무 비싼건 아닌지~~
1221454158,스타벅스 왕십리역9번출구점,,,요청사항도 잘 들어주시고 프라푸치노 이벤트로 맛있게 잘 먹었습니다. 추천합니다.
1221454158,스타벅스 왕십리역9번출구점,,,저녁에 방문예약 없이 이용대기 시간 바로 입장일상부모님
1221454158,스타벅스 왕십리역9번출구점,,,저녁에 방문예약 없이 이용대기 시간 바로 입장일상친구
1221454158,스타벅스 왕십리역9번출구점,,,저녁에 방문예약 없이 이용대기 시간 바로 입장일상혼자
1221454158,스타벅스 왕십리역9번출구점,,,저녁에 방문예약 없이 이용대기 시간 바로 입장일상혼자
1221454158,스타벅스 왕십리역9번출구점,,,"점심에 방문예약 없이 이용대기 시간 10분 이내 친목친구, 연인・배우자"
1221454158,스타벅스 왕십리역9번출구점,,,점심에 방문예약 없이 이용대기 시간 바로 입장데이트연인・배우자
1221454158,스타벅스 왕십리역9번출구점,,,점심에 방문예약 없이 이용대기 시간 바로 입장일상친구
1221454158,스타벅스 왕십리역9번출구점,,,점심에 방문예약 없이 이용대기 시간 바로 입장일상혼자
1221454158,스타벅스 왕십리역9번출구점,,,점심에 방문예약 없이 이용대기 시간 바로 입장일상혼자
1221454158,스타벅스 왕십리역9번출구점,,,점심에 방문예약 없이 이용대기 시간 바로 입장일상혼자
1221454158,스타벅스 왕십리역9번출구점,,,점심에 방문예약 없이 이용대기 시간 바로 입장일상혼자
1221454158,스타벅스 왕십리역9번출구점,,,점심에 방문예약 없이 이용대기 시간 바로 입장친목지인・동료
1221454158,스타벅스 왕십리역9번출구점,,,친구랑 밥먹고 수다떨러 감. 디저트배는 따로 있으니 내가 좋아하는것들로 주문. 과일생크림 케이크는 예전에 먹던거랑 좀 달라진듯… 그래서 가격이 좀 오른듯함. 가나슈9케이크는 진한맛땜에 커피와 같이먹기 넘 좋음. 친절한 직원의 응대가 좋았음.
1221454158,스타벅스 왕십리역9번출구점,,,친구랑 수다떨러 감. 사람들이 많아서 좋은자리 날땨까지 좀 기다림.
1221454158,스타벅스 왕십리역9번출구점,,,친구랑 커피마시며 수다떨러 감. 당충전위해 샤인머스켓 케이크도 같이 먹음. 주차가 안되는곳이라 좀 불편하지만 매장이 넓어서 찾게되는곳. 오늘은 사람이 많지 않아서 좋았음. 케이크는 넘 달아서 쫌…
1221454158,스타벅스 왕십리역9번출구점,,,혼자만의 시간 깊은생각에 잠기고 싶을때 친구와의 수다가 필요할때..
1971388854,어폴 Coffee Store,,,"매장에서 직접 로스팅한 커피, 그리고 정성스레 매일 준비하는 디저트는 많은 분들께 “커피가 맛있어요”, “디저트가 맛있어요” 키워드로도 자주 사랑받고 있답니다."
1971388854,어폴 Coffee Store,,,무화과 토스트 맛있게 드셨다니 정말 다행이에요! 😊 아이도 맛있게 먹었다니 너무 뿌듯하네요! 저희 어폴 Coffee Store 메뉴들이 남녀노소 누구나 좋아할 수 있도록 항상 노력하고 있거든요. 🙇‍♀️ 다음에 또 오셔서 맛있는 메뉴 드시고 가세요! ❤️👍
1971388854,어폴 Coffee Store,,,"안녕하세요! 고객님, 저희 어폴 Coffee Store의 게이샤 커피와 프렌치토스트를 맛있게 드셨다니 정말 기뻐요! 😊 꽃차처럼 향긋한 게이샤 커피의 매력을 알아봐 주셔서 감사합니다. 저희는 스페셜티 원두를 다양하게 준비해 놓고 있는데, 커피를 사랑하시는 분들께 저희 어폴이 좋은 공간으로 기억된다니 정말 뿌듯합니다. 프렌치토스트도 한정 수량으로 판매하고 있는데, 고객님께서 맛있게 드셨다니 정말 다행이에요! 부드럽고 촉촉한 식감에 만족하셨다니 제가 다 기분이 좋네요. 🥹"
1971388854,어폴 Coffee Store,,,"안녕하세요! 😊 고객님, 저희 어폴 Coffee Store 라떼와 프렌치토스트 맛있게 드셔주셔서 정말 감사합니다! 👍🤍💛 단짠 조합, 정말 최고죠? 🙇‍♀️ 저희 메뉴들을 좋게 봐주셔서 너무 감동이에요! 앞으로도 맛있는 메뉴로 고객님들을 행복하게 해드릴 수 있도록 노력할게요! ❤️"
1971388854,어폴 Coffee Store,,,"안녕하세요! 😊 더폴라떼 맛있게 드셨다니 정말 기뻐요! 왕십리 맛집이라는 칭찬까지, 너무 감사합니다! 저희 어폴 Coffee Store의 깔끔한 인테리어와 고소쌉쌀한 라떼의 조화가 좋았나 봐요! 앞으로도 맛있는 커피와 함께 좋은 시간 보내실 수 있도록 노력할게요. 🙇‍♀️ 저희 어폴 Coffee Store 많이 사랑해주세요! 👍❤️"
