가게ID,가게명,평점,날짜,리뷰내용
11727216,명화당 명동1호점종합분식,,,저녁에 방문예약 없이 이용대기 시간 바로 입장일상혼자
11727216,명화당 명동1호점종합분식,,,"전에 계시던 사장님 때부터 변함없는 맛집, 근데 1인석을 꼭 문 앞에 둬야 하나요 …. 맛을 재대로 즐길 수가 없어요. 창가를 마주하개식당들처럼 1인석들을 배치하면 더 좋은 경험이 될듯요"
11727216,명화당 명동1호점종합분식,,,"점심에 방문예약 없이 이용대기 시간 10분 이내 일상연인・배우자, 아이"
11727216,명화당 명동1호점종합분식,,,점심에 방문예약 없이 이용대기 시간 10분 이내 일상혼자
11727216,명화당 명동1호점종합분식,,,점심에 방문예약 없이 이용대기 시간 바로 입장데이트연인・배우자
11727216,명화당 명동1호점종합분식,,,점심에 방문예약 없이 이용대기 시간 바로 입장데이트연인・배우자
11727216,명화당 명동1호점종합분식,,,점심에 방문예약 없이 이용대기 시간 바로 입장데이트연인・배우자
11727216,명화당 명동1호점종합분식,,,점심에 방문예약 없이 이용대기 시간 바로 입장데이트연인・배우자
11727216,명화당 명동1호점종합분식,,,점심에 방문예약 없이 이용대기 시간 바로 입장아이
11727216,명화당 명동1호점종합분식,,,점심에 방문예약 없이 이용대기 시간 바로 입장일상
11727216,명화당 명동1호점종합분식,,,점심에 방문예약 없이 이용대기 시간 바로 입장일상부모님
11727216,명화당 명동1호점종합분식,,,"점심에 방문예약 없이 이용대기 시간 바로 입장일상연인・배우자, 아이"
11727216,명화당 명동1호점종합분식,,,점심에 방문예약 없이 이용대기 시간 바로 입장일상지인・동료
11727216,명화당 명동1호점종합분식,,,점심에 방문예약 없이 이용대기 시간 바로 입장일상지인・동료
11727216,명화당 명동1호점종합분식,,,점심에 방문예약 없이 이용대기 시간 바로 입장일상혼자
11727216,명화당 명동1호점종합분식,,,점심에 방문예약 없이 이용대기 시간 바로 입장일상혼자
11727216,명화당 명동1호점종합분식,,,주인아저씨는 친절한대 아주머니중 한분이 좀 불친절하세욯ㅎㅎ바쁘셔서 그런가 표정도 인상쓰고 계시고 뭘 부탁드리기가 불편했네요
11727216,명화당 명동1호점종합분식,,,쫄면 군만두 너어무 맛있었고 초밥같은 김밥도 독특하고 밥알이 쫄깃하니 맛있었어요!
11727216,명화당 명동1호점종합분식,,,쫄면은 집에서 만든맛이에요~^^ 모든 음식이 맛있었고 남자 사장님 정말 친절하세요~^^ 기분좋게 먹고 나왔어요!
11727216,명화당 명동1호점종합분식,,,쫄면은 참기름이 많이 들어 향이 강한데 양념장의 감칠맛과 어울려 진한 맛이 남. 고명 중 시금치는 데쳐서 수분을 뺀 형태인데 꼬들거리는 식감이 먹기 좋음. 오이와 콩나물이 굉장히 신선함.
11727216,명화당 명동1호점종합분식,,,"참기름과 양념으로 기본간을 한 밥으로 말은 김밥이 특징인 명화당 김밥과 달달한 쌀떡볶이, 멸치국물이 시원한 냄비국수 3종셋트를 둘이서 맛있게 먹었어요. 한명이 더있으면 쫄면까지 4종세트로 먹어야합니다^^35년넘게 다니고 있는 애정하는 곳입니다."
11727216,명화당 명동1호점종합분식,,,🌐 더 자세한 리뷰는 인스타그램 @4sik9.story 에서 확인하실 수 있어요
1278578897,병아리김밥 명동점,,,Anna1848님 저희 매장을 이용해주셔 감사합니다. 아이들과 같이 먹기 좋은 병아리김밥 다음에도 또 찾아주세요 ~~
1278578897,병아리김밥 명동점,,,HelloChoco님 저희 매장을 찾아주셔 감사합니다 .간단하고 빠르게 먹기 좋은 병아리김밥 다음에도 찾아주세요 ㅎㅎ
1278578897,병아리김밥 명동점,,,LIM14님 저희 매장을 찾아주셔 감사합니다. 옛날 학교 앞에 팔던 달달한 떡볶이를 생각하며 레시피를 만들었습니다. 다음에도 또 찾아주세요 ~ 감사합니다.
1278578897,병아리김밥 명동점,,,SH2093님 저희 매장을 찾아주셔 감사합니다. 앞으로도 변함없는 맛과 서비스로 보답하는 병아리김밥 명동점이 되도록 하겠습니다 ~
1278578897,병아리김밥 명동점,,,abajesus님 저희 매장을 찾아주셔 감사합니다. 그 시절에는 대부분 분식점에서 초록색 컵을 사용했죠 ㅎㅎ 그 추억을 가지고 인테리어를 했답니다 ~~ 다음에도 또 찾아주세요 ~~
1278578897,병아리김밥 명동점,,,cra****님 저희 매장을 찾아주셔 감사합니다. 앞으로도 초심을 잃지 않고 노력하는 매장이 되겠습니다. 다음에 또 찾아주세요 ~~
1278578897,병아리김밥 명동점,,,ddoki님 저희 매장을 찾아주셔 감사합니다. 늘 최선을 다해 노력하는 병아리김밥 명동점이 되도록 하겠습니다. 다음에도 또 찾아주세요 ~~
1278578897,병아리김밥 명동점,,,goodmihee님 저희 매장을 이용해주셔 감사합니다. 앞으로도 변함없는 맛과 서비스로 보답하는 병아리김밥 명동점이 되도록 하겠습니다. 다음에 또 찾아주세요~~
1278578897,병아리김밥 명동점,,,in6017님 저희 매장을 찾아주셔 감사합니다. 저희 매장은 아침부터 영업을 하기 때문에 아침을 가볍게 먹기 딱 좋답니다. 다음에도 또 찾아주세요 ~~
1278578897,병아리김밥 명동점,,,luna0307님 저희 매장을 이용해주셔 감사합니다. 늘 최선을 다해 노력하는 병아리김밥 명동점이 되도록 하겠습니다. 다음에도 또 찾아주세요 ~~
1278578897,병아리김밥 명동점,,,oyh0002님 저희 매장을 찾아주셔 감사합니다. 저희 매장은 타 매장과 달리 특별한 비법을 추가해 더 맛있는 김밥을 만들고 있답니다 ~~ 다음에도 또 찾아주세요 ~~
1278578897,병아리김밥 명동점,,,rj0****님 저희 매장을 찾아주셔 감사합니다. 저희 매장은 아이들도 같이 멋을 수 있게 다양한 메뉴가 있다는 게 장점입니다. 다음에도 또 찾아주세요~~
1278578897,병아리김밥 명동점,,,shn98091님 저희 매장을 찾아주셔 감사합니다. 늘 좋은 음식과 서비스를 위해 노력하는 병아리김밥 명동점이 되도록 하겠습니다. 감사합니다~
1278578897,병아리김밥 명동점,,,sss****님 저희 매장을 찾아주셔 감사합니다. 앞으로도 변함없는 맛과 서비스로 보답하는 병아리김밥 명동점이 되도록 하겠습니다. 감사합니다~
1278578897,병아리김밥 명동점,,,tkfkdg님 저희 매장을 찾아주셔 감사합니다. 앞으로도 변함없는 맛과 서비스를 위해 노력하는 병아리김밥 명동점이 되도록 하겠습니다. 감사합니다~
1278578897,병아리김밥 명동점,,,wnwnwnm님 저희 매장을 찾아주셔 감사합니다. 앞으로도 변함없는 맛과 서비스로 보답하는 병아리김밥 명동점이 되도록 하겠습니다. 감사합니다.
1278578897,병아리김밥 명동점,,,xhdehf20님 저희 매장을 찾아주셔 감사합니다. 항상변함없는 맛과 서비스로 보답하는 병아리김밥이 되겠습니다 ~ 감사합니다 ~~
1278578897,병아리김밥 명동점,,,yoon 0731님 저희 매장을 찾아주셔 감사합니다. 늘 최선을 다해 노력하는 병아리김밥 명동점이 되도록 하겠습니다. 다음에 또 찾아주세요 ㅎㅎ
1278578897,병아리김밥 명동점,,,znr****님 저희 매장을 찾아주셔 감사합니다. 늘 좋은 음식과 서비스를 위해 노력하는 병아리김밥 명동점이 되도록 하겠습니다. 다음에도 또 찾아주세요 ㅎㅎ
1278578897,병아리김밥 명동점,,,강희원8866님 저희 매장을 찾아주셔 감사합니다. 항상 청결한 매장을 위해 오픈 미들 마감때마다 청소를 하고 있답니다. 또한 모든 직원들이 똑같은 맛을 낼수 있도록 엄격하게 교육하고 있답니다~ 다음에도 또 찾아주세요
1278578897,병아리김밥 명동점,,,개굴이소녀님 저희 매장을 찾아주셔 감사합니다. 항상 최선을 다해 노력하는 매장이 되겠습니다. 다음에도 또 찾아주세요 ~~
1278578897,병아리김밥 명동점,,,고삽님 저희 매장을 찾아주셔 감사합니다. 앞으로도 변함없는 맛과 서비스로 보답하는 병아리김밥 명동점이 되도록 하겠습니다. 감사합니다 ~
1278578897,병아리김밥 명동점,,,굿굿굿^^양도 많고 유뷰초밥에 불맛 굿~~간도 맞아서 맛있습니다~~물오뎅 사진은 순삭해서 없네용
1278578897,병아리김밥 명동점,,,다희5459님 저희 매장을 찾아주셔 감사합니다. 항상 좋은 음식을 위해 노력하고 있답니다. 앞으로도 더 좋은 음식을 제공해드리겠습니다. 감사합니다 ~
1278578897,병아리김밥 명동점,,,도움이되는사람님 저희 매장을 이용해주셔 감사합니다. 저희 매장은 저렴한 가격에 알찬 구성으로 고객분들께 많은 사랑을 받고 있답니다 ~다음에도 또 찾아주세요 ㅎㅎ
1278578897,병아리김밥 명동점,,,밤에 방문예약 없이 이용대기 시간 바로 입장데이트아이
1278578897,병아리김밥 명동점,,,밤하늘의별처럼너를사랑해님 저희 매장을 찾아주셔 감사합니다. 늘 최선을 다해 노력하는 병아리김밥 명동점이 되도록 하겠습니다. 다음에도 또 찾아주세요~~
1278578897,병아리김밥 명동점,,,"밥 대신 계란·단백질로 만들어서 탄수화물 적고 포만감 높음, 깔끔하고 담백한 맛입니다"
1278578897,병아리김밥 명동점,,,봄비5289님 저희 매장을 찾아주셔 감사합니다. 늘 초심을 잃지 않고 노력하는 병아리김밥 명동점이 되도록 하겠습니다. 다음에도 또 찾아주세요 ~~
1278578897,병아리김밥 명동점,,,서울 살람님 저희 매장을 찾아주셔 감사합니다. 명동 혼밥 맛집은 병아리김밥 명동점 이랍니다 ㅎㅎ ~~ 다음에도 또 찾아주세요
1278578897,병아리김밥 명동점,,,세트메뉴가 있어서 너무 좋아요 떡볶이랑 김밥 유부초밥 다 푸짐하고도 적당하게 먹을 수 있어서 좋아요 그리고 떡볶이 국물 멈 맛있어요 귀여워요 병아리인테리어도 혼밥하기좋음요
1278578897,병아리김밥 명동점,,,숲속샘34님 저희 매장을 찾아주셔 감사합니다. 최대한 깔끔한 맛을 내도록 노력하고 있답니다 ㅎㅎ 또 다양한 맛의 김밥이 있으니 드시러 오세요 ~~
1278578897,병아리김밥 명동점,,,슈1513님 저희 매장을 찾아주셔 감사합니다. 항상 신선한 김밥을 제공하고자 노력하고 있답니다. 분식류도 미리 만들지 않고 주문 즉시 조리를 해 더 맛있게 드실 수 있답니다~ 감사합니다. 다음에도 또 찾아주세요 ~~
1278578897,병아리김밥 명동점,,,야잇호잇님 저희 매장을 찾아주셔 감사합니다. 앞으로도 변함없는 맛과 서비스로 보답하는 병아리김밥이 되겠습니다. 다음에도 또 찾아주세요 ~~
1278578897,병아리김밥 명동점,,,우리들은 친구님 저희 매장을 찾아주셔 감사합니다. 저희 매장은 불맛을 위해 유부를 한번 구운다음에 제공하고 있답니다 ~~ 다음에도 또 찾아주세요 ㅎㅎ
1278578897,병아리김밥 명동점,,,울럭방아리님 저희 매장을 찾아주셔 감사합니다. 앞으로도 변함없는 맛과 서비스로 보답하는 병아리김밥 명동점이 되도록 하겠습니다. 다음에 또 찾아주세요 ~~
1278578897,병아리김밥 명동점,,,유형자0님 저희 매장을 늘 찾아주셔 감사합니다. 항상 초심을 잃지 않고 더 노력하는 병아리김밥이 되도록 하겠습니다. 다음에 또 찾아주세요 ~~
1278578897,병아리김밥 명동점,,,주변탐방하는 틴트님 저희 매장을 찾아주셔 감사합니다. 늘 최선을 다하는 병아리김밥 명동점이 되도록 하겠습니다. 감사합니다.
1278578897,병아리김밥 명동점,,,즐겁다15님 저희 매장을 이용해주셔 감사합니다 ~ 다음에도 변한없는 맛으로 보답하는 병아리김밥이 되겠습니다~~
1278578897,병아리김밥 명동점,,,지나가다 우연히 알게 되었는데 떡볶이도 맛나고 음식이 맛있네요 명동서 이런곳 찾기 어려운데 분식 혼밥하고 싶을때 오면 딱이네요~ 강추합니다~
1278578897,병아리김밥 명동점,,,탱구39님 저희 매장을 이용해주셔 감사합니다. 늘 최선을 다해 노력하는 병아리김밥 명동점이 되도록 하겠습니다. 다음에도 또 찾아주세요 ~~
1278578897,병아리김밥 명동점,,,탱구39님 저희 매장을 찾아주셔 감사합니다. 저희 매장은 정말 다양한 메뉴가 있어 취향에 맞게 골라먹기 좋답니다 ~~ 다른 종류의 다양한 김밥이 있으니 다음에 오셔서 도전해 보세요 ㅎㅎ
1278578897,병아리김밥 명동점,,,하나82님 저희 매장을 찾아주셔 감사합니다. 아이들과 같이 먹기 좋은 병아리김밥 명동점 다시 또 찾아주세요 ㅎㅎ
1278578897,병아리김밥 명동점,,,하얀나비6149님 저희 매장을 찾아주셔 감사합니다. 저희 매장 떡볶이 소스는 자극적인 맛보다는 달달한맛과 감칠맛을 더 살린 소스랍니다. ~~ 다음에도 또 찾아주세요 ㅎㅎ
11579245,삼대할먼네 본점떡볶이,,,1. 2인기본 먹었어요. 라면.쫄면 둘다 양이 많아요 ㅎㅎ 남편 왈 라면 2인분 들어간거 같다고 양 무지 많대요 ㅋㅋㅋ 쫄면도 양 만족스럽게 많이 먹었어요
11579245,삼대할먼네 본점떡볶이,,,너무너무 맛있고 직원분이 친절하게 설명해주시고 챙겨주셔서 너무 감사한 마음으로 식사를 마쳤네요!! 떡볶이 때문에 왔지만 닭발이랑 주먹밥이랑 먹으니까 너무너무 맛있네요 ㅠㅠㅠ 조합이 최고입니다!!❤️
11579245,삼대할먼네 본점떡볶이,,,너무너무 맛있고 직원분이 친절하게 설명해주시고 챙겨주셔서 너무 감사한 마음으로 식사를 마쳤네요!! 떡볶이 때문에 왔지만 닭발이랑 주먹밥이랑 먹으니까 너무너무 맛있네요 ㅠㅠㅠ 조합이 최고입니다!!❤️
11579245,삼대할먼네 본점떡볶이,,,"달큰하니 맛있어요 :) 가게 앞에 주차도 가능하고, 맛도 맛있지만 양도 푸짐해요! 오랜만에 먹으니 더 맛있게 잘 먹었습니다 !"
11579245,삼대할먼네 본점떡볶이,,,"달큰하니 맛있어요 :) 가게 앞에 주차도 가능하고, 맛도 맛있지만 양도 푸짐해요! 오랜만에 먹으니 더 맛있게 잘 먹었습니다 !"
11579245,삼대할먼네 본점떡볶이,,,떡볶이 거리중에서 제일 유명한곳이라서 들어왔는데 왜 검색 1위인지 알겠음ㅎ
11579245,삼대할먼네 본점떡볶이,,,"떡볶이를 좋아해서 이곳저곳 다 먹어봤는데 여기가 가장 맛있는 것 같더라구요🙂 그리고 친절하기도 하고, 주차도 척척 다 잘해주셔서 차 가져와도 너무 편하게 먹을 수 있어서 좋습니다☺️"
11579245,삼대할먼네 본점떡볶이,,,맛있는 삼대할먼네 첫 방문..‼️ 2인을 먹어도 3인정도의 푸짐한 양이에요..ㅎㅎ 볶음밥도 필수고 구성도 너무나 알찬 구성입니다..‼️ 맛있게 먹고 신당동 떡볶이골목 에서는 이길 자가 없네요😝
11579245,삼대할먼네 본점떡볶이,,,매장 진짜시원 ㅠ 화력 짱 쎈 떡볶이인데 하나도 덥지않앗어요 오늘은 닭발못먹엇지만 다음에오면 꼭 먹을꺼에요🙏
11579245,삼대할먼네 본점떡볶이,,,맵기 중간맛은 마라탕 1-1.5 먹는 분들도 헥헥거리면서 맛있게 먹을 수 있을 정도??
11579245,삼대할먼네 본점떡볶이,,,멍멍이랑 카페갔다가 배고파서 신당동떡보끼먹구싶은데 멍멍이 때문에 여러군데 전화했다가 동반입장이 가능하다고 해서 같이왔어요!!! 멍멍이랑 같이 맛있는거 먹으러 올 수 있어서 더 좋구 당연히 맛있서요ㅠ!!
11579245,삼대할먼네 본점떡볶이,,,명절 당일도 영업하셔서 참 맛있게 추억의 맛을 느낍니다. 특히 닭발 예술👍👍👍
11579245,삼대할먼네 본점떡볶이,,,밤에 방문예약 없이 이용대기 시간 바로 입장데이트연인・배우자
11579245,삼대할먼네 본점떡볶이,,,밤에 방문예약 없이 이용대기 시간 바로 입장데이트연인・배우자
11579245,삼대할먼네 본점떡볶이,,,밤에 방문예약 없이 이용대기 시간 바로 입장데이트연인・배우자
11579245,삼대할먼네 본점떡볶이,,,밤에 방문예약 없이 이용대기 시간 바로 입장데이트연인・배우자
11579245,삼대할먼네 본점떡볶이,,,밤에 방문예약 없이 이용대기 시간 바로 입장데이트연인・배우자
11579245,삼대할먼네 본점떡볶이,,,밤에 방문예약 없이 이용대기 시간 바로 입장데이트연인・배우자
11579245,삼대할먼네 본점떡볶이,,,밤에 방문예약 없이 이용대기 시간 바로 입장데이트연인・배우자
11579245,삼대할먼네 본점떡볶이,,,밤에 방문예약 없이 이용대기 시간 바로 입장데이트연인・배우자
11579245,삼대할먼네 본점떡볶이,,,새벽에 급 떡볶이가 너무 먹고 싶어서 왔는데 역시 맛집은 남달라요!! 닭발도 너무 맛있고 떡볶이도 너무 맛있어요!! 핵 존맛!!! 완전 추천!!!
11579245,삼대할먼네 본점떡볶이,,,"신당동 떡볶이 타운에서 후기가 제일 좋아서 방문했어요! 양도 넉넉하고, 중독성 있는 맛이어서 너무 맛있게 먹었습니다~ 또 방문할게요🤗"
11579245,삼대할먼네 본점떡볶이,,,신당동 하면 떡볶이로 유명해서 꼭 한번 먹어보고싶었어요! 둘이서 와서 배터지게 먹고 갑니다~!
11579245,삼대할먼네 본점떡볶이,,,양도 많고 맛있어용ㅎㅎ 주차자리도 괜찮습니다. 사람 많은거 괜찮으면 추천해요
11579245,삼대할먼네 본점떡볶이,,,여기 줄서는데만 다녔었는데 꼭 그럴필요 없을 것 같아요 삼대 할먼네도 넘 맛있었네요^^
11579245,삼대할먼네 본점떡볶이,,,"이제는 해외에 살다보니, 한국 와서 예전 생각에 아이들 데리고 와서 맛있는 떡복이 먹으며 지난 추억을 생각나게 한 하루였네요"
11579245,삼대할먼네 본점떡볶이,,,임신하고 입맛없었는데 갑자기 생각났어요 ㅠㅠ 오랜만에와도 너무 맛있고 오뎅은 비싼걸 쓰신다고 먼저 먹으라고 하시네요! ㅋㅋ 주말엔 사람많으니 일부러 평일에 방문했어요❤️ 늘 친절하세요! 삼대할먼네 최고오🌝👍🏻
11579245,삼대할먼네 본점떡볶이,,,저녁에 방문예약 없이 이용대기 시간 바로 입장나들이아이
11579245,삼대할먼네 본점떡볶이,,,저녁에 방문예약 없이 이용대기 시간 바로 입장데이트연인・배우자
11579245,삼대할먼네 본점떡볶이,,,저녁에 방문예약 없이 이용대기 시간 바로 입장데이트연인・배우자
11579245,삼대할먼네 본점떡볶이,,,저녁에 방문예약 없이 이용대기 시간 바로 입장데이트연인・배우자
11579245,삼대할먼네 본점떡볶이,,,저녁에 방문예약 없이 이용대기 시간 바로 입장데이트연인・배우자
11579245,삼대할먼네 본점떡볶이,,,저녁에 방문예약 없이 이용대기 시간 바로 입장데이트연인・배우자
11579245,삼대할먼네 본점떡볶이,,,저녁에 방문예약 없이 이용대기 시간 바로 입장친목연인・배우자
11579245,삼대할먼네 본점떡볶이,,,저녁에 방문예약 없이 이용대기 시간 바로 입장친목연인・배우자
11579245,삼대할먼네 본점떡볶이,,,점심에 방문예약 없이 이용대기 시간 바로 입장가족모임부모님
11579245,삼대할먼네 본점떡볶이,,,점심에 방문예약 없이 이용대기 시간 바로 입장가족모임아이
11579245,삼대할먼네 본점떡볶이,,,"점심에 방문예약 없이 이용대기 시간 바로 입장나들이, 여행연인・배우자, 아이"
11579245,삼대할먼네 본점떡볶이,,,점심에 방문예약 없이 이용대기 시간 바로 입장나들이연인・배우자
11579245,삼대할먼네 본점떡볶이,,,점심에 방문예약 없이 이용대기 시간 바로 입장데이트연인・배우자
11579245,삼대할먼네 본점떡볶이,,,점심에 방문예약 없이 이용대기 시간 바로 입장데이트연인・배우자
11579245,삼대할먼네 본점떡볶이,,,점심에 방문예약 없이 이용대기 시간 바로 입장데이트연인・배우자
11579245,삼대할먼네 본점떡볶이,,,점심에 방문예약 없이 이용대기 시간 바로 입장데이트연인・배우자
11579245,삼대할먼네 본점떡볶이,,,점심에 방문예약 후 이용대기 시간 바로 입장데이트연인・배우자
11579245,삼대할먼네 본점떡볶이,,,즉석떡볶이 먹을때 항상 여기로 오는데 진짜 너무 맛있어요!
11579245,삼대할먼네 본점떡볶이,,,즉석떡볶이 먹을때 항상 여기로 오는데 진짜 너무 맛있어요!
11579245,삼대할먼네 본점떡볶이,,,직원분들도 다 너무 친절하시고 너무 맛있어요 진짜로ㅠㅠ 신당동 올때마다 여기로 와야겟어요🤍🤍
11579245,삼대할먼네 본점떡볶이,,,직원분들도 다 너무 친절하시고 너무 맛있어요 진짜로ㅠㅠ 신당동 올때마다 여기로 와야겟어요🤍🤍
11579245,삼대할먼네 본점떡볶이,,,처음 먹는데 떡도 부드럽고 기본에 충실한 맛입니다! 직원분들도 친절하세요👍
11579245,삼대할먼네 본점떡볶이,,,평소 떡볶이를 그렇게 좋아하지 않는데 삼대할먼네는 국물부터 너무 맛있어요! 친절하시고 또 서빙도 엄청 빠르게 해주셔서 더 만족스럽게 먹었습니다~
1192169754,신세계떡볶이떡볶이,,,"1인분에 홀 떡 10개, 포장 떡 9개였어요..😭(리뷰 보고 개수 세서 먹어봄ㅋㅋㅋ) 현금, 카드 결제에 따라 개수가 다른 건지 아니면 포장이랑 홀이랑 다른 건지… 모르겠지만😭 아무튼 튀김은 3개를 잘라서 주신 거 같고 어묵국물은 서비스로 주셨어요! 어묵 국물 엄~청 칼칼하고 떡볶이는 예상한 맛! 마늘 듬뿍 들어간 풍미 넘치는 매콤 달달 옛날쌀떡볶이!!🧄🌶️ 양은 남성분이시거나 여성분 중에 내가 대식가다 싶으면 2인분이상에 사이드 꼭 시키세요! 사장님이랑 사모님 친절하시고 생각보다 홀 회전율 빠르고 실제로 다들 혼밥하고 계셨어요🍽️ 자리는 협소해서 감안해야 합니다ㅠㅠ = 💸 떡볶이 1인분 5,000원 / 튀김 1인분 4,000원"
1192169754,신세계떡볶이떡볶이,,,"✔️ 카드,현금,계좌이체 동일한 가격 / 여기 떡볶이 생각나더라고요!!!! 이 더위에 명동까지 갈줄은… 마늘 듬뿍 들어간 매콤 달달한 쌀 떡볶이🌶️🧄 1인분에 떡 10개 들어가있고, 파도 아삭하니 맛있어요! 이번 포장은 각 1인분씩 10개 다 들어있었어요🍽️ 주문하면 어묵국물은 서비스로 주십니다ㅎㅎ 자리가 협소하지만 에어컨인지 선풍기인지 시원한 바람도 나와서 좋았어요! 오늘은 여사장님과 따님분도 계셨는데 두분 다 친절하셨답니다☺️"
1192169754,신세계떡볶이떡볶이,,,"리뷰 1,295사진 10,048팔로워 567테마 9"
1192169754,신세계떡볶이떡볶이,,,마늘맛이 듬뿍 나는 신세계떡볶이! 달달한 맛이 매력적이었어요!!! 순대랑 오뎅국물 서비스까지 완벽했어요
1192169754,신세계떡볶이떡볶이,,,만두튀김도 시켰는데 주문후 튀겨놓으신걸 그대로 주시는게 아닌 다시 튀기신다음에 주셔서 따뜻하고 바삭하게 먹을 수 있어 좋았습니다
1192169754,신세계떡볶이떡볶이,,,만두튀김도 시켰는데 주문후 튀겨놓으신걸 그대로 주시는게 아닌 다시 튀기신다음에 주셔서 따뜻하고 바삭하게 먹을 수 있어 좋았습니다
1192169754,신세계떡볶이떡볶이,,,명동에서 제일 유명한 떡볶이집을 왔는데 확실히 48년의 세월 노하우가 있어서 다른 떡볶이집하고는 양념부터가 달랐어요! 양념에서 진한마늘의 풍미가 느껴졌는데 걸쭉하면서도 계속 손이 가더라구요!! 군만두도 바삭하니 너무 좋았습니다! 가격도 괜찮고 다음에 명동에 갈일있으시면 꼭한번 들려서 드셔보세요!
1192169754,신세계떡볶이떡볶이,,,명동에서 제일 유명한 떡볶이집을 왔는데 확실히 48년의 세월 노하우가 있어서 다른 떡볶이집하고는 양념부터가 달랐어요! 양념에서 진한마늘의 풍미가 느껴졌는데 걸쭉하면서도 계속 손이 가더라구요!! 군만두도 바삭하니 너무 좋았습니다! 가격도 괜찮고 다음에 명동에 갈일있으시면 꼭한번 들려서 드셔보세요!
