가게ID,가게명,업종,평점,날짜,리뷰내용
477813652,서강쇠떡볶이 남부터미널점,분식,,,그자리에서 직접 싸주는 김밥이라 청양고추가 아삭하고 신선함이 느껴져 좋았습니다!!!
477813652,서강쇠떡볶이 남부터미널점,분식,,,길다란 가래떡 뚝뚝 잘라주시는데 쫄깃하고 튀김 순대 모두 군더더기없이 존맛입니다 분식계 오리지널 ~🙇‍♀️🙋🏻‍♀️🫡
477813652,서강쇠떡볶이 남부터미널점,분식,,,남부터미널 분식을 평정할 최강자 서강쇠떡볶이입니다! 저는 여기 오래 다녔구요. 쫄깃한 방앗간 스타일 쌀떡 하며 고소하고 맛있는 찰순대에 바로 말아주시는 김밥까지! 뭐 빼고 시키려고 해도 그럴 수가 없는 맛도리 천국이에요 ㅠㅠ💗
477813652,서강쇠떡볶이 남부터미널점,분식,,,남부터미널 최고의 분식집 ❤️가성비 너무 좋고 떡볶이 먹고 싶을 때 자주 들려요 ㅎㅎ
477813652,서강쇠떡볶이 남부터미널점,분식,,,남부터미널역에서 분식먹을 때 가는 곳이에요~ 쌀떡볶이이라서 쫀득해요~떡볶이 양념이 너무 달고짠거 싫어하는데 서강쇠는 딱 좋아요
477813652,서강쇠떡볶이 남부터미널점,분식,,,너무 맛있어요! 떡이 쫄깃해요ㅎㅎ 사장님께서 떡을 매일 새로 받아오시는데 떡이 너무 맛있어서 떡만 따로 사가는 손님도 있을 정도라고 하셨어요!! 소스도 이 근방에서 가장 맛있습니다. 강추드립니다!
477813652,서강쇠떡볶이 남부터미널점,분식,,,떡 쫀득하고 맛있고 김밥도 너무 맛있어요!! 떡볶이 많이 맵지 않아서 아이들도 즐길 수 있어서 좋습니당
477813652,서강쇠떡볶이 남부터미널점,분식,,,떡볶이 무슨일이져. 너무 맛있어.......떡튀순에 오뎅추가하고 쫄면까지 야무지게 먹고 갑니다. 이 더운날 불 앞에서 쌀떡볶이 만들어주시는 사장님! 감사합니댜
477813652,서강쇠떡볶이 남부터미널점,분식,,,"떡볶이 사랑하는 사람으로서 서강쇠 떡볶이는 양념 때문이 아니라 떡 때문에 포기 못해요. 쫄깃한 쌀떡의 맛과 식감. 개인적인 취향으로는 양념이 더 끈적하고 더 맵고 조금 덜 짜고 덜 달았으면 하지만 이런 사소한 불만따위 무화시키는 훌륭한 쌀떡의 위엄! 떡의, 떡에 의한, 떡순이를 위한 떡볶이 💕"
477813652,서강쇠떡볶이 남부터미널점,분식,,,떡볶이 존맛탱 부산에서 파는 듯한 쫜득쫜득 가래떡 떡볶이가 제 최앱니당.. 참치김밥도 속이 꽉차고 맛있었어여!!! 떡순튀류만 파는게아니라 라면 쫄면 같은 분식류도 있는데 여기 주위 회사원 분들도 많이오시고 맛있어용 남부터미널 주변 맛집 중 가성비 맛집으로 최고🫶🏽
477813652,서강쇠떡볶이 남부터미널점,분식,,,"떡볶이는 가래떡인데, 주문하면 싹뚝싹뚝 잘라주십니다. 가래떡이라 완전 쫄깃. 떡볶이랑 순대, 튀김이 같이 나오는 세트가 있어 주문했는데, 오! 순대도 맛있고 튀김도 맛있었어요. 떡볶이 소스에 푹 찍어 먹으니 굿굿. 참치 김밥 좋아해서 요것도 주문했는데, 분식 완전 땡기는 날 여기 한 번 가보시길 추천!"
477813652,서강쇠떡볶이 남부터미널점,분식,,,떡볶이는 자극적이지 않아서 좋았고 튀김은 너무 바삭했고 순대 내장도 너무 맛있었습니다
477813652,서강쇠떡볶이 남부터미널점,분식,,,떡순튀 세트 구성도 알차고 거기에 김밥까지 추가 하니까 둘이 먹기에 딱 좋네요 저장해놓고 이동네 가면 자주 갈게요👍🏻👍🏻
477813652,서강쇠떡볶이 남부터미널점,분식,,,떡순튀 세트에 떡볶이 1인분 추가해서 포장주문했어요! 맵지 않은 달달한 떡볶이 좋아하는데 서강쇠 떡볶이가 딱 제가 좋아하는 맛이에요 ㅎㅎ 떡도 쫄깃하구요! 사장님도 늘 친절하세요😄
477813652,서강쇠떡볶이 남부터미널점,분식,,,떡이 가래떡이라 그런지 식감이 너무 좋고 맛있게 먹었습니당
477813652,서강쇠떡볶이 남부터미널점,분식,,,"떡튀순 세트는 만 원에 떡볶이, 튀김, 순대, 오뎅 국물까지 한 번에 즐길 수 있어요. 혼자 와도 푸짐하게, 둘이 와도 종류별로 나눠 먹을 수 있어 가성비 최고였고 맛도 기대 이상이라 아주 만족스러웠습니다! 자주 방문할게요~^^"
477813652,서강쇠떡볶이 남부터미널점,분식,,,맛있습니다. 가래떡이라 진짜쫀득하고 어린학생들도 먹을 수 있는 달콤매운맛이예요. 튀김도 깨끗하고 순대도 촉촉합니다 :)
477813652,서강쇠떡볶이 남부터미널점,분식,,,사장님 넘 친절하시고 가래떡이 엄청 쫀득하고 달달하고 매콤하면서 딱 좋아요
477813652,서강쇠떡볶이 남부터미널점,분식,,,서강쇠떡볶이남부터미널점 첫방문 떡튀순과 소고기김밥까지 든든하게 잘먹었습니다
477813652,서강쇠떡볶이 남부터미널점,분식,,,쌀떡파는 여기로 정착했습니다ㅎㅎ 쫀득쫀득한 가래떡이라 너무 맛있구 튀김도 찍먹하기 딱 좋아요! 다음엔 김밥먹으러 재방문 하겠습니다~~
477813652,서강쇠떡볶이 남부터미널점,분식,,,아는사람은 아는 분식 맛집이죠~ 오늘은 포장해서 먹었는데 쌀떡이라 먹어도 속이 더부룩하지 않고 쫀득한 순대랑 고소한 김밥도 맛나요!
477813652,서강쇠떡볶이 남부터미널점,분식,,,어렸을때 먹었던 추억의 떡볶이 맛이였습니다! 가래떡 떡볶이로 이런 추억을 느껴보네요 정말 맛있었습니다!
477813652,서강쇠떡볶이 남부터미널점,분식,,,어린 시절 생각나는 분식집이에요! 오래 졸여진 쌀떡볶이 취향인데 요즘 이런 곳 만나기 진~~~짜 어렵거든요! 곧 10년이 되신다는데.. 제가 남부터미널 주근 탐방을 구 했어야했나봅니다. 이제에라도 알게되어 기쁜 곳 ㅡㅠㅡ 다양한 메뉴 먹어봤읔 좋았을텐데 혼밥하러 가서는 아담한 식사하고 왔어요 ㅜㅠ 그래도 떡반 어묵 반 반반 메뉴가 있어 그 중 다얀하게 먹을 수 있었네요. 튀김도 1인분 주문하여 종류별로 맛 보았고요. 주위 근무하시는 분들이 단골포스 뽐내며 등장하시던데.. 옆에 껴서 김밥이랑 순대랑 막 다 먹고 싶었습니다! 오래오래 장사해주세요~~~
477813652,서강쇠떡볶이 남부터미널점,분식,,,예술의 전당 전시보고 나와서 우연하게 찾은 집인데 가성비 훌륭합니다. 떡볶이와 참치김밥 맛있게 잘먹었습니다.
477813652,서강쇠떡볶이 남부터미널점,분식,,,"예전 반원초등학교 트럭떡볶이 향수를 못잊어 다녀왓네요 너무 맛잇어요,, 국물떡볶이 탑티어👍"
477813652,서강쇠떡볶이 남부터미널점,분식,,,요즘 세상 물가에 김밥이4000원대 진짜 저렴하고 맛있어여 떡볶이는 어릴 때 그 맛 그대로네요
477813652,서강쇠떡볶이 남부터미널점,분식,,,요즘 쌀떡볶이 많이 없는데 가래떡 떡볶이 너무 맛있어요! 오뎅을 좋아해 섞어로 주문했는데 가래떡이 두툼해서 2줄도 떡 양이 많더라고요. 순대도 잡내없이 완전 통통하구 간도 맛있었어요! 그리고 김밥 종류가 다양한 이유가 있더라고요! 4천원대 전혀 믿기지 않는 완전 뚱뚱한 김밥이라 너무 맛있게 먹었어요! 직원분도 너무 친절하세요>.< 회사근처라 자주방문할게요!
477813652,서강쇠떡볶이 남부터미널점,분식,,,음식이 깔끔하고 가성비가 좋아서 점심에 손님들이 정말 많았어요 맛있는 분식 원하시는 분들에게 추천드리는 곳입니다!
477813652,서강쇠떡볶이 남부터미널점,분식,,,"일딴 떡이 쌀떡인데 너무너무 부드럽게 입에서 살살 녹고요. 맵고 자극적인 프랜차이즈 떡볶이들에 질리던 요즘 학생때 자주 먹던 매콤달콤한 떡볶이 파는 곳이 없어서 찾아헤맸었는데 집근처에 있었다니 ,, ,"
477813652,서강쇠떡볶이 남부터미널점,분식,,,저녁에 방문예약 없이 이용대기 시간 바로 입장데이트연인・배우자
477813652,서강쇠떡볶이 남부터미널점,분식,,,저녁에 방문예약 없이 이용대기 시간 바로 입장데이트연인・배우자
477813652,서강쇠떡볶이 남부터미널점,분식,,,저녁에 방문예약 없이 이용대기 시간 바로 입장친목친구
477813652,서강쇠떡볶이 남부터미널점,분식,,,저녁에 방문예약 후 이용대기 시간 10분 이내 친목친구
477813652,서강쇠떡볶이 남부터미널점,분식,,,점심에 방문예약 없이 이용대기 시간 바로 입장데이트부모님
477813652,서강쇠떡볶이 남부터미널점,분식,,,점심에 방문예약 없이 이용대기 시간 바로 입장일상아이
477813652,서강쇠떡볶이 남부터미널점,분식,,,점심에 방문예약 없이 이용대기 시간 바로 입장일상혼자
477813652,서강쇠떡볶이 남부터미널점,분식,,,점심에 방문예약 없이 이용대기 시간 바로 입장일상혼자
477813652,서강쇠떡볶이 남부터미널점,분식,,,"점심에 방문예약 없이 이용대기 시간 바로 입장친목, 일상혼자"
477813652,서강쇠떡볶이 남부터미널점,분식,,,좋아하는 곳이에요 ㅋㅋ 원래 본점에서 먹다가 남터점 알게돼서 너뮤 행복했어요 집근처거든요 ㅋㅋㅋ 쌀떡 좋아하시는 분들 완전 추천합니다 사이드 김밥 순대 다 맛있어요!
477813652,서강쇠떡볶이 남부터미널점,분식,,,추억의 맛이네요 ㅎㅎ 김밥도 사장님이 주문하면 즉시 말아주셔서 진짜 맛있어요 ㅎㅎ 어묵도 맛있고 전체적으로 다 맛있어요!! 거기다가 가성비까지 짱입니다!
477813652,서강쇠떡볶이 남부터미널점,분식,,,프랜차이즈 떡볶이 먹다가 진짜 오랜만에~ 동네 떡볶이집에서 먹는 이 추억의 맛!! 너무 맛있어요~ 달달하고 매콤하면서 가래떡이라 엄청 쫀득하고!!! 프랜차이즈 떡볶이집에서는 흉내낼 수 없는 맛이에요 ㅎㅎ 최고!!
477813652,서강쇠떡볶이 남부터미널점,분식,,,한가인 떡볶이집 세군데 중에 제일 맛있었어요😍❤️ 사장님도 넘넘 친절하시고 강남 쪽 떡볶이 비싼데 가성비도 좋습니다~ 서초김밥 맛집 아는데 없는데 여기 김밥도 댕맛있어요ㅠㅠㅠㅠ 재방문의사 200% 예술의전당맛집👍🏻👍🏻👍🏻
1915464369,서울주막 강남역본점,치킨,,,ㅋㅋ 아니 잔 깨져있는 거 너무 당황스러웠네요. 관리좀 해주시길 바랍니다. 그리고 테이블 들어가자마자 약간 끈적거려서 여기서부터 기분이 별로였어요(위생관리 제대로 안되어있는 느낌) 그리고 시스템이 너무 불편한데 이건 어쩔 수 없는 부분인 것 같고 안주랑 음식들은 무난 하네요. 재방문 의사는 없어요. 위생 청결 관리 시급함
1915464369,서울주막 강남역본점,치킨,,,강남 올때마다 조용히 대화하고 싶을 때 많이와요~~ 평일엔 제한 없어서 너무 좋아요!!
1915464369,서울주막 강남역본점,치킨,,,금요일 예약없이 오후6시 좀 넘어왔는데 룸은 다 풀이었구 홀로 안내받았어요. 홀 처음 앉아봤는데 얘기하기에 괜찮았어요! 피자는 존맛이에여
1915464369,서울주막 강남역본점,치킨,,,덕분에 맛있는 식사를 즐기다 왔습니다~~!!! 매콤하고 알싸했던 고추의 진한 국물 맛과 치즈가루가 솔솔 뿌려진 뿌링클 치킨 그리고 마무리 패스츄리 피자까지!!! 완벽하게 맛있었어요~~ 양도 푸짐하게 듬뿍 담아 주셔서 알차게 먹고 왔네요~~~ 하이볼이랑도 같이 주문했는뎅 역시 잘 어울렸고 조화가 최고였어요!! 서빙도 로봇이 해줘서 편했었고 규모가 큰데도 회전 속도가 빨랐어요~~ 룸도 프라이빗하게 꾸며져 있어서 소수나 다수의 모임 전부 수용할 수 있게 되어 있었어요! 다음에 파티나 행사 있을 때 또 올게요~~❤️❤️
1915464369,서울주막 강남역본점,치킨,,,룸으로 예약했는데 직원분이 안 오시고 로봇으로 음식 가져다주시더라구요 필요한게 좀 있어서 카운터 갔더니 접시나 물티슈 이런거는 직접 가져가라고 하시고 완전 불친절하세요. 딱 봐도 일하기 싫다라는 표정으로 손님 대하시는데 이게 맞아요? 룸 옮겼는데 에어컨이 잘 나오지도 않고 여러모로 별로였습니다. 다신 안 올거에요.
1915464369,서울주막 강남역본점,치킨,,,룸으로 예약했는데 직원분이 안 오시고 로봇으로 음식 가져다주시더라구요 필요한게 좀 있어서 카운터 갔더니 접시나 물티슈 이런거는 직접 가져가라고 하시고 완전 불친절하세요. 딱 봐도 일하기 싫다라는 표정으로 손님 대하시는데 이게 맞아요? 룸 옮겼는데 에어컨이 잘 나오지도 않고 여러모로 별로였습니다. 다신 안 올거에요.
1915464369,서울주막 강남역본점,치킨,,,룸이 너무 쾌적하고 아늑해요!! 다음에도 강남 올일 있으면 또 올 것 같아요! 안주도 맛있고 나오는 속도도 빨라요! 추천합니다!
1915464369,서울주막 강남역본점,치킨,,,"매장이 커서 단체모임이든 소규모 모임이든 데이트든 다 가능해요! 음식도 다양하고 맛있는데, 로봇이 서빙해줘서 더 신기하고 분위기 좋아서 다음에 또 오려구요!!"
1915464369,서울주막 강남역본점,치킨,,,"먼저 인테리어가 전통 감성인데도 세련되게 꾸며져 있어서, 사진 찍기 딱 좋은 포토존 같아요. 조명도 은은해서 얼굴이 예쁘게 나오더라구요! 메뉴도 다양해서 안주 고를 때 행복한 고민했어요. 특히 치즈 짜파게티랑 파스타는 꼭 시켜보세요, 술이 술술 들어가는 맛이에요. 🍶"
1915464369,서울주막 강남역본점,치킨,,,"먼저 인테리어가 전통 감성인데도 세련되게 꾸며져 있어서, 사진 찍기 딱 좋은 포토존 같아요. 조명도 은은해서 얼굴이 예쁘게 나오더라구요! 메뉴도 다양해서 안주 고를 때 행복한 고민했어요. 특히 치즈 짜파게티랑 파스타는 꼭 시켜보세요, 술이 술술 들어가는 맛이에요. 🍶"
1915464369,서울주막 강남역본점,치킨,,,밤에 방문예약 없이 이용대기 시간 바로 입장친목지인・동료
1915464369,서울주막 강남역본점,치킨,,,밤에 방문예약 없이 이용대기 시간 바로 입장친목지인・동료
1915464369,서울주막 강남역본점,치킨,,,밤에 방문예약 후 이용대기 시간 바로 입장친목친구
1915464369,서울주막 강남역본점,치킨,,,밤에 방문예약 후 이용대기 시간 바로 입장회식친구
1915464369,서울주막 강남역본점,치킨,,,밤에 방문예약 후 이용대기 시간 바로 입장회식친구
1915464369,서울주막 강남역본점,치킨,,,"생일파티 겸 모였는데, 케이크는 들고 들어올수있고 너무 좋았어요~~!! 크크크 분위기 넘 도란도란 하구 좋아용"
1915464369,서울주막 강남역본점,치킨,,,생파룸이 따로있는 강남역룸술집이에요!! 여기 그리고 파스타 맛집임다..! 진짜 양도 푸짐하고 맛도 있는 곳 ㅋㅋ 왜파스타가 맛있지 ㅋㅋ 조용하게 좋은 시간 보내기 좋아요!!👍👍
1915464369,서울주막 강남역본점,치킨,,,서울주막 강남 본점에 와봤는데 인테리어도 이쁘고 프라이빗한 룸도 있어서 선택하기 좋았습니다. 서빙 로봇도 있어서 신기했고 무엇보다 매장이 넓어서 구경하기도 좋았습니다. 음식도 맛있었고 무엇보다 직원분들 모두 친절하게 안내해주고 잘생겼어요!
1915464369,서울주막 강남역본점,치킨,,,안주 좀 비싼 듯하나 강남역 물가 생각하면 가격대비 양 나쁘지 않았고 심지어 맛있었음! 다만 자동로봇 서버가 방 앞까지만 오고 방문열구 줄 수는 없다보니 미어캣모드로 보고 있어야 함. 강남역 금토저녁 조용하게 술마시긴 조음
1915464369,서울주막 강남역본점,치킨,,,"안주는 기본적으로 전통 주점 느낌을 살린 메뉴라 술이랑 궁합이 딱 맞습니다. 제가 먹은 해물파전은 바삭하면서 속은 촉촉했고, 도토리묵무침도 새콤달콤하니 입맛 돋우기 좋았어요. 분위기는 조용하면서도 따뜻한 느낌이라 데이트, 회식, 친구 모임 모두 무난하게 어울리는 곳 같습니다."
1915464369,서울주막 강남역본점,치킨,,,여기 분위기 너무 좋아서 시간 가는 줄 몰랐어요! 🍻 음식도 맛있고 직원분들 서비스까지 최고였습니다.
1915464369,서울주막 강남역본점,치킨,,,역시나 룸 개수 진짜 많아서 대기도 안해도 되고 생일파티 할 수 있게 가랜드도 있고 예쁘게 잘 꾸며져 있어서 깜짝파티 잘 하고 왔어요🩷
1915464369,서울주막 강남역본점,치킨,,,"우선 개별룸이 있어서 아늑하게 친구랑 생일축하도 하고 편하게 먹고 즐겼어요♥️ 치킨, 짜파게티, 짬뽕탕 다 시켰는데 음식이 전부 맛있고 양도 많아서 만족했습니다! 사진도 잘나오고 추억쌓기좋아서 룸술집 찾으시는 분들에게 강추드려요!"
1915464369,서울주막 강남역본점,치킨,,,저녁에 방문예약 없이 이용대기 시간 바로 입장데이트연인・배우자
1915464369,서울주막 강남역본점,치킨,,,저녁에 방문예약 없이 이용대기 시간 바로 입장데이트연인・배우자
1915464369,서울주막 강남역본점,치킨,,,저녁에 방문예약 없이 이용대기 시간 바로 입장친목친구
1915464369,서울주막 강남역본점,치킨,,,저녁에 방문예약 없이 이용대기 시간 바로 입장친목친구
1915464369,서울주막 강남역본점,치킨,,,저녁에 방문예약 없이 이용대기 시간 바로 입장친목친구
1915464369,서울주막 강남역본점,치킨,,,저녁에 방문예약 없이 이용대기 시간 바로 입장친목친구
1915464369,서울주막 강남역본점,치킨,,,"저녁에 방문예약 후 이용대기 시간 바로 입장데이트, 일상친구"
1915464369,서울주막 강남역본점,치킨,,,"저녁에 방문예약 후 이용대기 시간 바로 입장친목, 데이트연인・배우자, 친구"
1915464369,서울주막 강남역본점,치킨,,,"저녁에 방문예약 후 이용대기 시간 바로 입장친목, 일상친구"
1915464369,서울주막 강남역본점,치킨,,,"저녁에 방문예약 후 이용대기 시간 바로 입장친목, 일상친구"
1915464369,서울주막 강남역본점,치킨,,,"저녁에 방문예약 후 이용대기 시간 바로 입장친목연인・배우자, 친구"
1915464369,서울주막 강남역본점,치킨,,,저녁에 방문예약 후 이용대기 시간 바로 입장친목친구
1915464369,서울주막 강남역본점,치킨,,,저녁에 방문예약 후 이용대기 시간 바로 입장친목친구
1915464369,서울주막 강남역본점,치킨,,,저녁에 방문예약 후 이용대기 시간 바로 입장친목친구
1915464369,서울주막 강남역본점,치킨,,,저녁에 방문예약 후 이용대기 시간 바로 입장친목친구
1915464369,서울주막 강남역본점,치킨,,,저녁에 방문예약 후 이용대기 시간 바로 입장친목친구
1915464369,서울주막 강남역본점,치킨,,,저녁에 방문예약 후 이용대기 시간 바로 입장친목친구
1915464369,서울주막 강남역본점,치킨,,,저녁에 방문예약 후 이용대기 시간 바로 입장친목친구
1915464369,서울주막 강남역본점,치킨,,,직원분들도 너무 친절하시고 메뉴도 다양해서 좋았습니다 인테리어도 너무 고급스럽고 화려하네요✨ 홀 이용하면서 시끄럽지도 않고 다같이 재밌게 놀다가네요~!!
1915464369,서울주막 강남역본점,치킨,,,직원분들도 너무 친절하시고 메뉴도 다양해서 좋았습니다 인테리어도 너무 고급스럽고 화려하네요✨ 홀 이용하면서 시끄럽지도 않고 다같이 재밌게 놀다가네요~!!
1915464369,서울주막 강남역본점,치킨,,,직원분들도 너무 친절하시고 음식이 너무맛있어요!! 생일파티하러 오기 좋은 것 같아요❤️
1915464369,서울주막 강남역본점,치킨,,,"직원분들이 친절하게 메뉴 추천도 해주고, 음식 나오는 속도도 빨라서 기다림이 없었어요. 가격대도 합리적이라 가성비가 괜찮다고 느꼈습니다."
1915464369,서울주막 강남역본점,치킨,,,"짬뽕탕 진짜 맛있고, 치킨도 바삭하고 맥주도 시원합니다. 고등학교 친구들과 함께 왔는데 만족스럽습니다."
1915464369,서울주막 강남역본점,치킨,,,"짬뽕탕 진짜 맛있고, 치킨도 바삭하고 맥주도 시원합니다. 고등학교 친구들과 함께 왔는데 만족스럽습니다."
1915464369,서울주막 강남역본점,치킨,,,친구들이랑 단체로 강남역에서 술마시는데 시끄러운 술집은 싫고 마침 룸이있는 곳이 있다고 해서 왔는데 메뉴도 너무 다양하고 매장도 쾌적해서 너무 잘 놀다갑니다! 그리고 치킨이 진짜 맛있어요~~!😻앞으로도 친구들이랑 올때는 여기로 올것같아요!
1915464369,서울주막 강남역본점,치킨,,,퇴근하고 들르기 좋은 서울주막 강남점 !! 분위기도 깔끔하고 자리도 편해서 하루 마무리로 딱이네요~ 안주도 술이랑 잘 어울리고 직원분들도 친절해서 기분 좋게 먹고 왔습니다. 강남역 근처에서 편하게 한잔하기 좋아요! 룸사용료도 없어서 넘 좋아요 ~~~~ 💗💗💗 벌써 재재방문인데 또 올거임 ㅎ
1915464369,서울주막 강남역본점,치킨,,,퇴사파티 때문에 예약했었는데 메뉴도 생각보다 적어서 1차보다는 2차로 오기 좋은 곳 같습니다! 다만 예약하고 가기도 했고 사람도 많아 보이진 않았는데 룸 상태랑 식기류 상태가 안 좋아서 좀 그랬습니다..
19896363,서호김밥김밥,분식,,,"김밥 맛있어요. 유부김밥, 서호김밥 모두 맛나요. 다음엔 참치김밥 먹어봐야지~ 가까우면 자주 방문할텐데 ㅠㅠ"
19896363,서호김밥김밥,분식,,,"김밥 맛있어요. 유부김밥, 서호김밥 모두 맛나요. 다음엔 참치김밥 먹어봐야지~ 가까우면 자주 방문할텐데 ㅠㅠ"
19896363,서호김밥김밥,분식,,,김밥 속재료도 중요하지만 밥과 김의 맛을 더 중요하게 생각하는데 김밥 밥이 맛있어서 좋았어요.
19896363,서호김밥김밥,분식,,,"김밥은 딱히 특별하다는맛은 못느꼈는데 여기 수제비,라볶이 유명하다는 소릴들었는데 같이못먹어서 아쉬워요"
19896363,서호김밥김밥,분식,,,김치수제비는 약간 김치국에 수제비 넣은 스타일인데 가볍게 먹기 좋은 맛이에요!
19896363,서호김밥김밥,분식,,,동네 김밥 맛집! 서호김밥 맛있어요~
19896363,서호김밥김밥,분식,,,"모임이 있어서 서호김밥, 유부김밥, 다시마김밥 세줄 사서 접시에 담아 먹었어요~^^"
19896363,서호김밥김밥,분식,,,"서초구 방배동 ""서호김밥"" 업무중간에 간단하게 먹으러 들어갔다 신박한 맛을 보았습니다. 주문리스트는 서호,참치김밥,계란라면,치즈라면! 김밥도 맛있지만 치즈라면 ㅋㅋ 슬라이스체다치즈와 모짜렐라치즈 두가지가 들어있네요 저도 암니다 불닭면이나 매콤한 음식에 모짜랠라 잘 어울리는거... 그런대 치즈라면에 체다와 모짤랠라? 둘이 너무 잘 어울려서 놀랬네요 ㅋㅋ 아시죠 먹선수들은 치즈라면에 체다치즈 그대로 떠서 먹는거~ 집에 가서 공쥬들에게 치즈라면 한그릇씩 조공올려 사랑받아야 겠습니다. 사장님 잘 먹고 감니다~ #한국페이결제 #pure09 #치즈라면 #서호김밥 #김밥맛집"
19896363,서호김밥김밥,분식,,,서호김밥 언제 먹어도 맛있게 먹을 수 있는 김밥입니다. 진짜 맛있어요~^^
19896363,서호김밥김밥,분식,,,서호김밥 언제 먹어도 맛있게 먹을 수 있는 김밥입니다. 진짜 맛있어요~^^
19896363,서호김밥김밥,분식,,,"서호김밥에서 다시마김밥을 시켜 포장해 먹었습니다. 소고기김밥보다 담백, 고소하고 감칠맛이 느껴져서 개인적으로는 다시마김밥이 더 맛있었어요!"
19896363,서호김밥김밥,분식,,,"서호김밥의 가격은 5,500원으로 조금 비싼 편이고 맛은 ​​매우 담백하며 시금치 향이 뚜렷합니다. 첫 맛은 평범해 보이지만, 먹으면 먹을수록 맛있습니다."
19896363,서호김밥김밥,분식,,,아침에 방문예약 후 이용대기 시간 바로 입장나들이연인・배우자
19896363,서호김밥김밥,분식,,,잘라서 종이 케이스에 비스듬히 넣어주시니 하나씩 꺼내먹기 편해요
19896363,서호김밥김밥,분식,,,저녁에 방문예약 없이 이용대기 시간 바로 입장나들이혼자
19896363,서호김밥김밥,분식,,,저녁에 방문예약 없이 이용대기 시간 바로 입장데이트연인・배우자
