가게ID,가게명,평점,날짜,리뷰내용
1106010383,바오로차이나 사당점,,,"사당맛집 바오로차이나 다녀왔습니다. 버터 소스 탕수육은 두툼하고 바삭해 독특하면서도 깊은 맛이 났고, 냉짬뽕은 시원하고 해산물 풍미가 진해 여름 별미로 최고였어요. 새우볶음밥도 탱글한 새우와 꼬들한 밥알 덕분에 만족스러웠습니다. 넓은 공간과 프라이빗 룸, 발렛 서비스까지 갖춘 모임 장소로 강력 추천합니다."
1106010383,바오로차이나 사당점,,,"사당맛집 바오로차이나사당점에 다녀왔어요😍 사당역 12·13번 출구 도보 3분 거리, 2시간 무료 주차와 넓은 홀·프라이빗 룸 덕분에 모임, 회식, 가족외식 모두 완벽한 장소예요! 메뉴는 짜장면, 짬뽕부터 유린기, 게살볶음밥, 우육탕면까지 다양해 취향대로 골라 먹기 좋아요👍 저희는 고추유린기, 해물짬뽕, 게살볶음밥을 주문했는데, 고추유린기는 닭다리살에 매콤한 고추와 파채, 간장소스가 어우러져 감칠맛 대박! 해물짬뽕은 해물과 야채가 풍성하고 국물은 얼큰하고 시원했어요. 게살볶음밥은 XO소스와 반숙 계란후라이, 게살이 듬뿍 올라가 퀄리티와 맛 모두 최고였답니다. 방배동에서 가성비 좋은 중식당 찾는다면 강력 추천해요!"
1106010383,바오로차이나 사당점,,,"사당맛집 정도가 아니라 서울맛집, 대한민국 맛집이네요!! 탕수육이 이렇게 부드러울수있나요!!! 진짜 꼭 추천하고픈 진짜 최고의 사당중국집 입니다!!"
1106010383,바오로차이나 사당점,,,"사당역 중식 맛집 킹정👍 짜장면도 깊고, 탕수육은 사이즈 미쳤고🌭 감태 전복해물누룽지탕은 숟가락 멈출 수가 없네요. 특히 호두크림새우… 탱글탱글+부드러운 크림 조합은 단골 예약,,🦐✨ 다음에 가족모임으로 갈게요"
1106010383,바오로차이나 사당점,,,사당역 중식당 바오로차이나. 짜장면 진한 맛이 거의 간짜장 수준으로 맛있습니다. 볶음밥은 긴쌀 사용한점이 특별했어요. 짜장면 볶음밥 맛있는 바오로차이나 👍
1106010383,바오로차이나 사당점,,,"소고기안심우육탕면, 호두크림새우, 새우볶음밥 맛 보았는데~"
1106010383,바오로차이나 사당점,,,실내 쾌적하고(기름 냄새 안나요) 요리들이 조미료 많이 안쓰신 거 같아요 깔끔 담백합니다. 요리 나오는 속도도 빨랐어요!
1106010383,바오로차이나 사당점,,,알짬뽕 처음인데 알고니 듬뿍 면발도 탱글해서 굿굿. 해물잡탕밥이랑 탕수육도 맛있어요. 사당역 중국집 손님도 엄청 많네요.
1106010383,바오로차이나 사당점,,,여름별미인 냉짠뽕도 꼭 드셔보세요~ 매콤하고 시원한 국물이 일품이고 쫄깃하고 통통한 면발도 맛있어서 제대로 된 여름별미를 맛볼 수 있어요. 요일별 점심 특선은 가성비까지 좋아 점심맛집으로 추천합니다.
1106010383,바오로차이나 사당점,,,여자 친구와 오랜만에 사당역 데이트를 즐기고 저녁을 먹으러 사당 중식 맛집 바오로 차이나 사당점을 방문했어요.
1106010383,바오로차이나 사당점,,,"와~ 사당역 중국집, 사당맛집 찾았네여. 간이 딱 좋고요, 어향가지새우 맛있어여. 짬뽕도 불향가득~ 매장 넓고, 룸도 많고. 정지선세프 추천 고량주, 송화강주도 1주년 행사로 가성비있게 먹었어여; 룸 보시는 남성매니저분 잘생겼~~^^"
1106010383,바오로차이나 사당점,,,"요리메뉴 드시는 분들이 많던데, 다음에 다른 요리메뉴도 먹어보러 재방문해야겠어요"
1106010383,바오로차이나 사당점,,,음식이 하나하나 전반적으로 다 맛있고 식당도 깨끗해요
1106010383,바오로차이나 사당점,,,저녁에 방문예약 후 이용대기 시간 바로 입장친목친구
1106010383,바오로차이나 사당점,,,점심에 방문예약 후 이용대기 시간 바로 입장데이트연인・배우자
1106010383,바오로차이나 사당점,,,"점심에 방문예약 후 이용대기 시간 바로 입장연인・배우자, 아이"
1106010383,바오로차이나 사당점,,,"점심에 방문예약 후 이용대기 시간 바로 입장일상연인・배우자, 아이"
1106010383,바오로차이나 사당점,,,점심에 방문예약 후 이용대기 시간 바로 입장친목친구
1106010383,바오로차이나 사당점,,,"직원분들 모두 친절하시고, 오픈 키친으로 위생도 좋았습니다. 훌륭한 식사 했습니다~~ 사당맛집 또 방문할게요!!"
1106010383,바오로차이나 사당점,,,차돌짬뽕 국물 진짜 진하고 차돌도 많이 들어가서 넘 맛있어요 ㅠㅠ 고추유린기도 짱!!
1106010383,바오로차이나 사당점,,,차돌짬뽕 나왔는데 고기가 엄청 푸짐해서 좋았어요!! 간짜장 이미 드셔서 소스 그릇만 찍었는데 ㅋ 꾸덕꾸덕하고 맛있습니다♡ 사장님도 직원분들도 다 친절하시구 매장이랑 화장실 깨끗해서 좋아요!! 또올께요~
1106010383,바오로차이나 사당점,,,"탕수육은 두툼한 고기에 달콤한 소스, 유산슬의 재료들은 하나하나 잘 어우러져서 최고의 맛이었어요. 짜장, 짬뽕은 일반 중화요리집에서 보다 훨씬 맛있어요~"
1106010383,바오로차이나 사당점,,,탕수육이랑 짜장 시켰는데 탕수육 바삭함이 살아있네욤ㅎㅎ 넘 맛있어욥!!!!! 사당에서 맛집투어 하는데 좋네용 앞으로 사당중국집은 요기로!!!♥️♥️
1106010383,바오로차이나 사당점,,,"평일 점심에 방문해서 세트 메뉴로 주문했어요 ! 유산슬, 탕수육 짜장 짬뽕 이렇게 나오는데 다 너무 맛있었어요☺️ 탕수육 고기 소스 다 맛있고 짜장 짬뽕 면도 쫄깃해요>.< 유산슬 처음 먹어봤는데 찐맛이네요🤎 다음에 또 방문할게요!"
1106010383,바오로차이나 사당점,,,"호두 크림 새우, 고추 유린기, 전가복, 가지튀김, 탕수육, 차돌짬뽕, 쟁반짜장 시켜서 먹었는데 너무너무 맛있어서 다른 지인들도 만족했어요!!!👍👍👍 예약 후 방문 추천드려요"
1106010383,바오로차이나 사당점,,,회사 근처에 밥 먹을만한곳 찾다가 리뷰가 좋아서 와봤어요. 분위기 좋고 음식도 정갈하니 맛있네요.
1106010383,바오로차이나 사당점,,,회사에서 중요한 미팅 자리 때문에 사당룸식당을 찾다가 발견한 사당맛집💕 진짜 룸까지 있어서 중요한 미팅자리나 혹은 분위기 있는 데이트까지 가능해서 저만 알고 싶지만 ㅋㅋ 좋은 건 유노윤호가 부릅니다 -레슨- 함께 알면 좋을 것 같기에🥹ㅋㅋ 진짜 맛고 메뉴도 다양해서 호불호 없이 먹고 즐기기 좋을 것 같아요🩷🧡💛💚💙💜
1865662429,월량,,,"가족 생일 기념으로 방문했습니다. 직원분들이 너무 친절하셨고, 런치 코스도 맛있었어요. 또 방문하겠습니다!"
1865662429,월량,,,곧 입대하는 동생 생일 기념으로 가족과 함께 다녀왔습니다. 미리 예약한 어향동고 특별히 맛있었고 칠리새우 깐풍기 팔보채 등도 다 맛있네요.. 부모님께서 짜장짬뽕도 맛있다며 남김없이 다 드셔서 예약한 보람이 있었습니다. 가족과 좋은 시간 보낼수있게 해주셔서 감사합니다~!!
1865662429,월량,,,"깐풍기, 유린기, 회과육, 멘보샤까지 다양하게 즐겨주셔서 기쁘고, 짜장면까지 특별히 맛있다고 해주시니 더욱 힘이 납니다."
1865662429,월량,,,깐풍기는 이렇게 달가슴살로만 만든 맛없는 깐풍기는 첨 봐요. 비싸게 받는 만큼 재료는 좋게 써야하지 않나 싶은데.. 가슴살 100프로로 퍼석퍼석하게 줄줄이야.. 첨엔 화가 났는데 뭐 어쩌겠어요..
1865662429,월량,,,다들 맛있다고 합니다! 얘기 들어보니 지인 거래처 분들도 모시고 온다고 하네요.
1865662429,월량,,,"다만 영업시간이 조금 아쉬우셨군요 고객님 말씀처럼 “아쉬워서 더 생각나는 집”이 되는 것도 나쁘지 않지만, 다음엔 천천히 즐기실 수 있도록 더 여유 있는 시간으로 찾아뵐게요."
1865662429,월량,,,"다만 영업시간이 조금 아쉬우셨군요 고객님 말씀처럼 “아쉬워서 더 생각나는 집”이 되는 것도 나쁘지 않지만, 다음엔 천천히 즐기실 수 있도록 더 여유 있는 시간으로 찾아뵐게요."
1865662429,월량,,,다시 찾아주셨을 때는 예전처럼 맛있는 한 그릇으로 보답드릴 수 있도록 더 신경 쓰겠습니다. 소중한 의견 감사합니다.
1865662429,월량,,,다음 방문도 편안하고 만족스러운 식사 되실 수 있도록 늘 정성 다하겠습니다. 감사합니다! 😊
1865662429,월량,,,다음에 근처에 오실 때는 새로운 시즌 메뉴나 하이볼 한 잔과 함께 더 여유로운 시간 보내세요🍸
1865662429,월량,,,다음에도 만족하실 수 있도록 정성껏 준비하겠습니다.
1865662429,월량,,,다음에도 변함없는 맛과 정성으로 모시겠습니다. 좋은 하루 보내세요! 😊
1865662429,월량,,,단품요리 위주로 그동안 먹었는데 오늘은 처음으로 가족들과 코스를 주문했는데 최고였어요. 해파리냉채 유산슬 칠리새우 깐풍기 탕수육 … 하나하나 너무 맛있고 재료가 신선해서 모두 장소 선택 잘했다고 칭찬하는 분위기 였고~ 마지막 식사는 짜장면과 짬뽕 선택 이었는데 짬뽕의 호흥도가 더 좋았어요. 다음에도 또 모임 하려고해요 👌
1865662429,월량,,,단품요리 위주로 그동안 먹었는데 오늘은 처음으로 가족들과 코스를 주문했는데 최고였어요. 해파리냉채 유산슬 칠리새우 깐풍기 탕수육 … 하나하나 너무 맛있고 재료가 신선해서 모두 장소 선택 잘했다고 칭찬하는 분위기 였고~ 마지막 식사는 짜장면과 짬뽕 선택 이었는데 짬뽕의 호흥도가 더 좋았어요. 다음에도 또 모임 하려고해요 👌
1865662429,월량,,,"동네 맛집으로 기억해 주신 마음에 보답할 수 있도록, 늘 한결같은 맛과 정성으로 찾아뵙겠습니다."
1865662429,월량,,,들어오는 입구가 조금 헷갈렸는데 치킨집 말고 그 옆 계단 타고 내려와야 가기 좋은거같아요
1865662429,월량,,,만족스럽지 못한 경험을 드린 점 깊이 사과드리고 싶습니다. 말씀하신 부분에 대해선 저희 셰프들과 함께 즉시 개선하겠습니다.
1865662429,월량,,,만족스럽지 못한 경험을 드린 점 깊이 사과드리고 싶습니다. 말씀하신 부분에 대해선 저희 셰프들과 함께 즉시 개선하겠습니다.
1865662429,월량,,,맛 분위기 모두 좋아서 재방문했는데 지난번엔 일하시는 서버분중 여자분 한분이 너무 퉁명스러워서 기분이 안좋았는데 오늘은 서버분들 다들 친절하셔서 다행히 잘먹고 왔네요:)
1865662429,월량,,,맛 분위기 모두 좋아서 재방문했는데 지난번엔 일하시는 서버분중 여자분 한분이 너무 퉁명스러워서 기분이 안좋았는데 오늘은 서버분들 다들 친절하셔서 다행히 잘먹고 왔네요:)
1865662429,월량,,,"모임 자리로도 잘 어울렸다고 하니 더없이 기쁘고요, 다음에도 즐거운 식사 되실 수 있도록 맛과 분위기 모두 신나게 준비해두겠습니다!"
1865662429,월량,,,"모임할때 가는 최애 중식당, 재료도 신선하고 감칠맛나게 맛있어요. 저의 최애픽은 양장피 추천합니다. 👍"
1865662429,월량,,,"신선한 재료와 깔끔한 매장 관리에도 좋은 인상 남겨주셔서 감사드리며, 다음 방문에도 정성 가득한 한 끼로 모시겠습니다!"
1865662429,월량,,,"앞으로도 한 분 한 분의 식사에 진심을 담아, 다시 찾고 싶은 월량이 되겠습니다."
1865662429,월량,,,"앞으로도 한 분 한 분의 식사에 진심을 담아, 다시 찾고 싶은 월량이 되겠습니다."
1865662429,월량,,,양장피 버무리기 전 사진을 못 찍어서 비주얼 별로지만 찍었네요. 카톡 친구 추가 후 망고 샤베트 상큼달콤하니 잘 먹었습니다.
1865662429,월량,,,"영업시간은 아쉽게 느껴지실 수 있지만, 그 안에 더 알차고 맛있는 시간 드릴 수 있도록 항상 노력하겠습니다. 다음 모임도 환영이에요! 🙌"
1865662429,월량,,,왜 고소허지..? 뭐지?? 진짜 잡내 일도 없고 간장찍어먹으면 더 맛있고... 다 먹을 때 까지 고소함 그자체
1865662429,월량,,,원래 중식당 가면 요리 다양하게 먹는거 좋아하는데 이 날은 유독 클래식이 땡겨서 탕수육+짜장면으로 시켰어요. 탕수육은 부먹 찍먹 가능하게 소스 따로 주시지만 저는 부먹파라 소스 다 부어서 촉촉하게 먹었고 짜장면도 면 얇고 넘 맛있더라구요 담에 다른 메뉴 먹으러 또 방문하고 싶어요
1865662429,월량,,,"월량 최고,, 🤍👍 짬뽕은 불향 가득, 국물 진하고, 면발탱글, 해산불도 푸짐~ 무엇보다 탕수육은 꼭 주문하세요 진짜 맛있습니다✨️✨️✨️✨️"
1865662429,월량,,,"월량은 제가 예전 작은 가게 시절부터 줄곧 애정해온 단골집입니다. 셰프님의 진심이 담긴 요리 덕분에 자주 찾게 되었고, 특히 짬뽕은 얼큰하면서도 깊은 국물 맛이 일품이라 제 인생 짬뽕으로 자리 잡았어요. 그런데 이번에는 지인의 추천으로 처음 해물덮밥을 주문해봤는데, 첫 숟갈부터 깜짝 놀랐습니다. 신선한 해물과 감칠맛 나는 소스, 고슬고슬한 밥이 어우러져 정말 고급진 한 끼였어요. 마치 중식 오마카세처럼 정성과 실력이 느껴지는 맛이었습니다. 월량은 시간이 지나도 맛이 변하지 않고, 오히려 더 깊어지는 느낌이라 늘 믿고 찾게 돼요. 이수·사당·방배 부근에서 이렇게 꾸준히 맛과 품질을 유지하는 곳은 정말 드뭅니다. 저에겐 이 동네 최고의 중식당, 아니 최고의 맛집이라 해도 과언이 아니에요. 조용하고 따뜻한 분위기"
1865662429,월량,,,음식이 너무 맛있어서 주변 사람들과 함께 가서 먹기 너무 좋아요!! 아이들도 잘 먹어서 또 방문하고 싶어요^^
1865662429,월량,,,"이렇게 든든한 응원 정말 감사합니다! 어버이날 가족 모임 장소로 저희 월량을 선택해주신 것도 감사한데, 세대불문 모두 만족하셨다니 더할 나위 없이 기쁩니다. “베스트 오브 베스트”라는 말, 진짜 가슴에 저장해두겠습니다. 다음 방문에도 변함없이 맛있고 편안한 자리로 보답드릴 수 있도록 더 열심히 준비하겠습니다. 늘 환영합니다! 🙏😊"
1865662429,월량,,,"이렇게 든든한 응원 정말 감사합니다! 어버이날 가족 모임 장소로 저희 월량을 선택해주신 것도 감사한데, 세대불문 모두 만족하셨다니 더할 나위 없이 기쁩니다. “베스트 오브 베스트”라는 말, 진짜 가슴에 저장해두겠습니다. 다음 방문에도 변함없이 맛있고 편안한 자리로 보답드릴 수 있도록 더 열심히 준비하겠습니다. 늘 환영합니다! 🙏😊"
1865662429,월량,,,이수역 맛집 중식당 월량. 곰실표고깐풍은 표고버섯 튀겨 깐풍소스로 볶아 맛있고 바삭한 식감 일픔 이예요.볶음밥도 퀄러티 아주 좋아요 😀.생강향 좋은 짜장면도 아주 만족스러운 점심 이었어요
1865662429,월량,,,인테리어가 독특하니 매력있어요. 짬뽕은 좀 짜지만 느끼하지 않고 깔끔해요. 짜장면은 달아요. 전체적으로 면이 두껍지 않아 좋아요.
1865662429,월량,,,인테리어가 독특하니 매력있어요. 짬뽕은 좀 짜지만 느끼하지 않고 깔끔해요. 짜장면은 달아요. 전체적으로 면이 두껍지 않아 좋아요.
1865662429,월량,,,인테리어와 서비스까지 좋게 봐주셔서 감사드립니다! 고객님의 다음 식사 시간도 만족으로 가득 채워드리겠습니다 🙏💕
1865662429,월량,,,재방문 ☻ 사당이수 근처에서 맛있게 모임하려면 이곳에 와야합니다 ! ☻ 오이무침 필수💚
1865662429,월량,,,좋은 음식과 멋진 분위기 속에서 편하게 이야기 나누실 수 있는 공간이 되길 늘 바라고 있습니다.
1865662429,월량,,,"중국식 냉면과 군만두, 거기에 와이키키 하이볼까지 — 완벽한 조합이네요🍸✨"
1865662429,월량,,,즈란닭날개 짜장면 맛있어요! 카카오 친추하면 망고샤베트 받을 수 있어요!
1865662429,월량,,,"짜장면부터 볶음밥, 버섯우육탕면까지 다양하게 즐겨주시고, 재료 하나하나의 풍성함까지 알아봐 주셔서 정말 감사드립니다."
1865662429,월량,,,"친구와 약속으로 처믐 가보았는데 분위기도 참신하고 예약(한번 변겡하였는데 친절하게 문자, 전화로 응대해주심)등 서비스도 안정되고 음식도 적절한 가격에 맛있고 정갈하였습니다, 그래서인지 금욜저녁 젊은 손님들로 만석이더군요, 담에 또 여기서 보기로 했습니다. 간만에 편안하고 깔끔한 중국요리 즐겼습니다, 감사합니다 ~"
1865662429,월량,,,"친구와 약속으로 처믐 가보았는데 분위기도 참신하고 예약(한번 변겡하였는데 친절하게 문자, 전화로 응대해주심)등 서비스도 안정되고 음식도 적절한 가격에 맛있고 정갈하였습니다, 그래서인지 금욜저녁 젊은 손님들로 만석이더군요, 담에 또 여기서 보기로 했습니다. 간만에 편안하고 깔끔한 중국요리 즐겼습니다, 감사합니다 ~"
1865662429,월량,,,"탄탄멘이랑 이것저것 시켰는데, 탄탄멘이 제일 맛있었습니다! 다른 메뉴들도 내용물이 알차서 2~3시간 먹으면서 대화하기 알맞았어요. 다음에 또 갈게요!"
1865662429,월량,,,혼자 또는 소규모로 오시는 분들도 편히 식사하실 수 있도록 내부적으로도 고민해보겠습니다.
32255935,중국성 반포본점,,,귀한 발걸음 감사합니다. 재방문하시면 더 깊은 맛과 정성으로 모시겠습니다.
32255935,중국성 반포본점,,,귀한 발걸음 고맙습니다. 다음 번엔 더욱 깊은 정성으로 대접하겠습니다.
32255935,중국성 반포본점,,,귀한 발걸음 고맙습니다. 다음 번엔 더욱 깊은 정성으로 대접하겠습니다.
32255935,중국성 반포본점,,,귀한 발걸음 해주셨는데 실망을 안겨드려서 죄송합니다. 다음 번엔 더욱 깊은 정성으로 대접하겠습니다!
32255935,중국성 반포본점,,,깔끔하고 맛있는 중식 맛집! 찹쌀탕수육은 찹쌀튀김옷이 완전 쫄깃! 해산물 가득 들어간 얼큰 시원한 짬뽕도 너무 좋았구요~ 살짝 매콤한 스타일의 잡채밥은 간이 좋고 당면이랑 소고기 부들부들하게 갓 볶아서 나와 너무 맛있어요! 고속터미널 중국집 짬뽕 맛집입니당
32255935,중국성 반포본점,,,난자완스 정말 맛있고 나중에 밥 비벼 드시면 두끼 해결 가능합니다
32255935,중국성 반포본점,,,동네 식당인데 유아 식기도 제공이 안되는 것은 아쉬웠습니다.
32255935,중국성 반포본점,,,"딴딴면이 특이합니다. 눈물 나게 매운데, 자꾸 먹게 돼요. 첫 맛은 놀랄 만큼 맵지만 끝 맛이 묘하게 달아서. 파, 샐러리에서 나는 단 맛."
32255935,중국성 반포본점,,,"메뉴들 다 너무 맛있고 양도 많아요,, 특히 삼선짬뽕 진짜 맛있더라구요 ˙ᵕ˙"
32255935,중국성 반포본점,,,모든 메뉴가 다 맛있어요. 특히 울면은 다른곳가면 싱겁거나 아무맛도 안 날 때가 많은데 중국성은 울면도 진하고 맛있어요.
32255935,중국성 반포본점,,,배달 시켜 먹었는데 난자완스 대자 양이 많아 도시락 싸와 다음날 점심으로 먹었습니다. 삼선짜장 소스도 조금ㅈ남겨 같이 먹었네요. 삼선짜장 강추 삼선짬뽕도 추천입니다. 반포 1티어 중식당 입니다
32255935,중국성 반포본점,,,"삼선짬뽕이 얼큰하고 진하니 해물,야채 가득해서 개운했고 찹쌀 탕수육 소자인데도 양 많고 적당히 달달새콤하니 술술 들어갔어요 ㅎㅎ"
32255935,중국성 반포본점,,,예전에 엄마모시고 왔었는데 역시 반포찐맛집이라 그런지 여전히 저녁되니 손님이 몰리네요. 짬뽕에 해물 아끼지 않고 넣으셔서 엄청 시원하고 찹쌀 탕수육은 쫄깃합니다. 둘이 궁합이 잘맞아서 엄청 맛있게 잘 먹었어요. 곱배기 시키면 3인이 탕수육이랑 먹어도 딱 좋겠다싶게 양이 많더라고요.
32255935,중국성 반포본점,,,"왕새우탕면은 새우가 어마어마하게 크고 나가사키 짬뽕처럼 깊은 국물맛에 새우 단맛이 우러나와 진한 맛이었어요. 삼선누룽지탕은 누룽지와 해산물이 만나 고소함이 배가 되면서 특별했고, 사천탕수육은 일반 탕수육과 완전히 다른 얼얼한 매운맛이 중독적이더라구요. 크림새우는 레몬향이 은은하게 나면서 상큼했어요."
32255935,중국성 반포본점,,,"잠원동 맛집 평 듣고 먹어봤는데 찹쌀탕수육 완전 예술이에요! 찹쌀옷이 바삭거리면서 사르륵 녹고, 고기 육질도 아주 좋아요. 짜장면에서도 불맛이 진하게 나고 남은 양념까지 맛있어서 싹싹 긁어 먹었어요!"
32255935,중국성 반포본점,,,잠원동에서 중국집에서 모임할 때 가는 집~ 오래된 맛집!
32255935,중국성 반포본점,,,저녁에 방문예약 없이 이용대기 시간 바로 입장데이트친구
32255935,중국성 반포본점,,,저녁에 방문예약 없이 이용대기 시간 바로 입장일상혼자
32255935,중국성 반포본점,,,"저녁에 방문예약 없이 이용대기 시간 바로 입장친목, 기념일친구"
32255935,중국성 반포본점,,,저녁에 방문예약 후 이용대기 시간 바로 입장데이트연인・배우자
32255935,중국성 반포본점,,,저녁에 방문포장·배달 이용대기 시간 30분 이내일상부모님
32255935,중국성 반포본점,,,점심에 방문예약 없이 이용대기 시간 바로 입장데이트연인・배우자
32255935,중국성 반포본점,,,점심에 방문예약 없이 이용대기 시간 바로 입장친목지인・동료
32255935,중국성 반포본점,,,점심에 방문예약 없이 이용대기 시간 바로 입장친목친구
32255935,중국성 반포본점,,,점심에 방문예약 없이 이용대기 시간 바로 입장친목친구
32255935,중국성 반포본점,,,점심에 방문예약 없이 이용대기 시간 바로 입장친목친구
32255935,중국성 반포본점,,,점심에 방문포장·배달 이용대기 시간 30분 이내가족모임부모님
32255935,중국성 반포본점,,,중국 냉면 깔끔하니 맛있어요. 직원분들이 매우 친절 하시네요.
32255935,중국성 반포본점,,,중국성 반포본점에 와주셔서 큰 힘이 됩니다. 좋은 음식으로 보답할게요.
32255935,중국성 반포본점,,,중국성 반포본점은 메뉴 하나하나 다 맛이 기가막힙니다. 진짜 맛있고 기본이 탄탄합니다. 그리고 큰 룸이 있어서 단체모임에도 적합한 곳이었고 외부내부 인테리어도 멋진 곳이었습니다 재방문 예정입니다 :)
32255935,중국성 반포본점,,,중국성 반포본점을 방문해 주셔서 고맙습니다. 오늘도 행복한 하루 보내세요.
32255935,중국성 반포본점,,,중국성 반포본점을 방문해 주셔서 진심으로 감사합니다.
32255935,중국성 반포본점,,,중국성 반포본점을 방문해 주셔서 큰 기쁨입니다. 더 맛있게 준비하겠습니다.
32255935,중국성 반포본점,,,중국성 반포본점을 찾아주셔서 고맙습니다. 건강하고 행복한 하루 되세요!
32255935,중국성 반포본점,,,중국성 반포본점을 찾아주셔서 고맙습니다. 다음엔 한층 더 깊은 맛으로 보답드리겠습니다.
32255935,중국성 반포본점,,,중국성 반포본점을 찾아주셔서 오늘 하루가 더욱 빛났습니다. 고맙습니다.
32255935,중국성 반포본점,,,중국성 반포본점을 찾아주신 덕분에 하루가 즐거웠습니다. 다음에 오시면 더 풍성한 맛을 준비하겠습니다.
32255935,중국성 반포본점,,,중국성 반포본점을 찾아주신 덕분에 힘이 납니다. 다음엔 더 만족스러운 메뉴로 뵙겠습니다.
32255935,중국성 반포본점,,,중국성 반포본점을 찾아주신 모든 분들께 늘 감사드립니다.
32255935,중국성 반포본점,,,집앞이라 자주 시켜먹어요. 신속한 배달과 맛이 좋아 자주 먹게됩니다. 종종 가서 먹기도 하는데 배달시켜먹어도 맛있어요~
