가게ID,가게명,평점,날짜,리뷰내용
32255935,중국성 반포본점,,,"차돌짬뽕 곱배기 15,000원 !! 지난주에 큰아이 여행에서 돌아와 먹고싶다하여 곱배기 주문해서 둘이 나눠먹었어요~ 역시 곱배기 양도 많고 차돌도 많이 들었구나~ 오늘도 차돌짬뽕 곱배기! 근데 일반양이었습니다. 안 먹어봤음 모르겠으나 지난주에 먹었기때문에 잘 알죠~근데 자꾸만 곱배기가 배달된거라 하시네요… 면도 면이지만 차돌이 일반에 들어있는 양입니다. 쥔장님 손님 말좀 믿으시죠"
32255935,중국성 반포본점,,,탕수육도 맛있었지만 크림새우 사이즈가 크고 튀김옷이 시간이 지나도 엄청 바삭하네요~크림 소스도 전혀 느끼하지 않아요! 무엇보다 차돌짬뽕이 불맛 가득해서 맛있게 먹었습니다😄
1617515432,중화백반 교대점중식당,,,"갓짜장 후라이 계란 후라이가 위에 올라가 있네요. 기본 단무지, 김치, 특히 파김치가 함께 제공되는데 너무 맛있어요."
1617515432,중화백반 교대점중식당,,,계란 후라이 올려지는 간짜장 최고 이구요!! 탕수육도 두툼한 고기가 부드럽네요!!
1617515432,중화백반 교대점중식당,,,"교대에서 중식이 땡길 때 가기 좋은 집이었습니다. 생등심 탕수육은 고기가 두툼하고 튀김이 바삭해서 소스랑 잘 어울렸습니다. 갓 짜장과 후라이는 기본이지만 맛이 깔끔했고, 진 마파두부밥은 매콤하면서도 밥이랑 먹기 좋아 만족스러웠습니다. 전반적으로 재료가 신선하고 양도 넉넉해서 가격 대비 만족도가 높았어요. 분위기도 편안해서 데이트 코스로도 괜찮습니다."
1617515432,중화백반 교대점중식당,,,근데 양이 진짜 많아요 1.5인분 아닌가요?!!
1617515432,중화백반 교대점중식당,,,"기다리며 기대기대… 대망의 탕수육… 진짜 말잇못,, 너무 맛있어요 정말 ㅠㅠㅠ 목화솜같은 느낌에 쫄깃쫄깃하고 고기도 크고 한입 먹자마자 아이도 저도 우와 했슴다,,. ㅋㅋㅋㅋㅋㅋ그리고 해물볶음밥은 해물이 한가득!!! 정말 강추입니다!! 재방문 하고싶어요!!"
1617515432,중화백반 교대점중식당,,,너무 맛있어요. 혼술하려고왔는데 짬뽕맛에 감동하고 갑니다. 특히 불맛 정말 최고예요!
1617515432,중화백반 교대점중식당,,,넘 맛있어요 교대 오면 또 들릴 것 같습니다 ~
1617515432,중화백반 교대점중식당,,,대부분 요리가 실패 없습니다.. 베스트는 등심탕수육이라 꼭 시켜보시고 짜장면도 안 짜고 넘 맛있습니다!!
1617515432,중화백반 교대점중식당,,,두부 부들해서 너무 맛있고 마라맛 약간 나서 호불호없이 모두 좋아할것같아요!!
1617515432,중화백반 교대점중식당,,,마파 면으로 바꿔 먹었믄데 너무 맛있어요!!
1617515432,중화백반 교대점중식당,,,마파두부는 저번 방문 때보다 덜매워서 살짝 아쉬웠지만 맛있게 먹었습니다~
1617515432,중화백반 교대점중식당,,,맛이 좋습니다! 맛집이라고 봐서 왔는데 정말 맛집이에요ㅎㅎ
1617515432,중화백반 교대점중식당,,,맛있어서 또 온 중화백반!! 칼칼한 국물과 짜장이 또 생각나는 맛이예요!!
1617515432,중화백반 교대점중식당,,,면 다 먹고 밥도 비벼 먹었는데 공깃밥도 양이 많아서 놀랐어요!! 찾아가서 먹길 잘한것 같아여 후회 없었습니다👍
1617515432,중화백반 교대점중식당,,,술 마신 다음날 해장으로도 꼭 찾게 되는 곳이다. 마파두부밥이 일품이지만 다른 메뉴들이 늘 선택을 괴롭힌다.
1617515432,중화백반 교대점중식당,,,시험중인 울딸 힘내라고 맛난 중국요리 먹으러 중화객잔 다녀왔어요 파채유린기가 정말 맛나기가 이루 말할수없네요
1617515432,중화백반 교대점중식당,,,엄청 맛있습니다. 직원분들도 친절하고 기분좋게 먹었습니다.
1617515432,중화백반 교대점중식당,,,영업시간 남았는데 마감한다고 해서 남기고 온 탕수육 넘나 아까울따름... 힝🥲
1617515432,중화백반 교대점중식당,,,"와.. 짜장면은 너무 자극적이지 않고 간 딱 맞았어요! 비비는데 침부터 고였다는,,, 🤤 그리고 대망의 탕수육… 진짜 말잇못,, 너무 맛있어요 정말 ㅠㅠㅠ 쫄깃쫄깃하고 고기도 크고 한입 먹자마자 육성으로 우와 했슴다,,. ㅋㅋㅋㅋㅋㅋ 또 올래요 그때는 마파두부도 >,<🤍"
1617515432,중화백반 교대점중식당,,,"요리마다 들어가는 해산물도 신선하고 아이들과 함께 주문한 요리 전부 맛있게 먹었습니다. 탕수육은 상당히 두껍게 나오는데, 겉은 바삭 속은 육즙도 있고 고기가 부드럽습니다. 간장에 식초 넣고 고기튀김으로만 드셔도 아주 맛납니다."
1617515432,중화백반 교대점중식당,,,용대리황태백짬뽕 시켰는데 국물이 시원하고 담백해서 해장용으로 딱! 재료도 푸짐하고 깔끔하게 맛있었어요. 👍
1617515432,중화백반 교대점중식당,,,"인스타에서 보고 방문한 곳인데 마파두부랑 황태국 짬뽕도 너무 맛있고, 유린기도 괜찮더라구요! 자리도 생각보다 넓고 파김치, 단무지, 김치도 야무지게 먹었습니당! 4명에서 3개 시켰는데 배부르게 먹었어요 히히"
1617515432,중화백반 교대점중식당,,,저녁에 방문예약 없이 이용대기 시간 바로 입장
1617515432,중화백반 교대점중식당,,,"저녁에 방문예약 없이 이용대기 시간 바로 입장일상, 나들이혼자"
1617515432,중화백반 교대점중식당,,,"저녁에 방문예약 없이 이용대기 시간 바로 입장친목, 가족모임친척・형제"
1617515432,중화백반 교대점중식당,,,저녁에 방문예약 없이 이용대기 시간 바로 입장친목지인・동료
1617515432,중화백반 교대점중식당,,,저녁에 방문예약 없이 이용대기 시간 바로 입장친목친구
1617515432,중화백반 교대점중식당,,,저녁에 방문예약 없이 이용대기 시간 바로 입장친목친구
1617515432,중화백반 교대점중식당,,,저녁에 방문예약 없이 이용대기 시간 바로 입장친목친척・형제
1617515432,중화백반 교대점중식당,,,"저는 탕수육에 반했어요, 마파두부밥도 맵콤하고 맛있어요, 짜장면은 부산식 계란후라이가 올라가 있는 ㅎㅎ 맛있어요"
1617515432,중화백반 교대점중식당,,,"점심에 방문예약 없이 이용대기 시간 바로 입장나들이연인・배우자, 아이"
1617515432,중화백반 교대점중식당,,,점심에 방문예약 없이 이용대기 시간 바로 입장데이트연인・배우자
1617515432,중화백반 교대점중식당,,,점심에 방문예약 없이 이용대기 시간 바로 입장데이트연인・배우자
1617515432,중화백반 교대점중식당,,,점심에 방문예약 없이 이용대기 시간 바로 입장데이트연인・배우자
1617515432,중화백반 교대점중식당,,,점심에 방문예약 없이 이용대기 시간 바로 입장데이트연인・배우자
1617515432,중화백반 교대점중식당,,,점심에 방문예약 없이 이용대기 시간 바로 입장데이트연인・배우자
1617515432,중화백반 교대점중식당,,,점심에 방문예약 없이 이용대기 시간 바로 입장데이트연인・배우자
1617515432,중화백반 교대점중식당,,,점심에 방문예약 없이 이용대기 시간 바로 입장일상친구
1617515432,중화백반 교대점중식당,,,중화국밥 국물이 정말 맛있고 마파두부면도 마라맛이 너무 맵지도 않고 딱 맛있게 매워요!
1617515432,중화백반 교대점중식당,,,짜장면 너무 맛있고 황태 백짬뽕이 시원하면서 배콤해서 너무 맛있네요 해장용으로 먹으면 끝내줄것 같아요
1617515432,중화백반 교대점중식당,,,짜장이 너무 맛있어요. 제 입맛에는 단맛이 강하게 나지 않아서 더 맛있게 먹었습니다
1617515432,중화백반 교대점중식당,,,짬뽕은 사실.. 예전에 양가식탁이었을때가 더 맛있었어요 ㅜㅜ 좀 깊은맛이 부족한 느낌 아쉽네요
1617515432,중화백반 교대점중식당,,,처음방문인데 너무맛있어요.왜 소문난지 알겠네요.주말 잘 먹고갑니다.또 올게요.
1617515432,중화백반 교대점중식당,,,첫방문인데 음식들이 너무 취향저격 ㅠㅠ 마파두부는 마라맛이 좀 있고 짬뽕은 불향이 강해서 좋네요 담엔 여러명이랑 와서 다양하게 시켜봐야겠어요!!😋
1617515432,중화백반 교대점중식당,,,추천받아서 왔는데 기대대로 맛있네요! 군만두는 너무 맛있어보여서 하나 먹고 사진을 찍었네요. ㅎㅎㅎ 바삭한데 육즙 가득하고 마파두부는 마라맛있어요. 갓짜장도 맛있고 오늘 성공! 다음에 와서 요리 먹어볼래요!
1617515432,중화백반 교대점중식당,,,탕수육도 꽉찬고기 바삭 달콤한데 고기가 질기제 않고 기분까지 좋아지는 맛이에요
1617515432,중화백반 교대점중식당,,,특이한 메뉴들이 있어서 찾아왔는데 맛있어요 마파두부는 밥대신 면으로 바꿔서 먹었는데 좋아요 군만두도 완전 바삭 좋아요~
1617515432,중화백반 교대점중식당,,,파채유린기 넘 맛있어요 바삭바삭하고 튀김 넘 잘하는집인거 같아요 소스도 정말 맛있어요 반찬으로 파김치 나오는데 이것도 넘 맛있네요 저는 유린기 소스에 찍어서 야채랑 곁들여 먹는거 좋아하는데 그릇이 너무 작아서 뭘 어찌할 여지가 없어요.. ㅠㅠㅠ 테이블이 작아서 그릇을 작은거 쓰시는것 같아요 그리고 다른데보다 양배추 양이 너무 작네요 유린기에 양배추 좋아하는데.. 맛은 정말 맛있었어요
1617515432,중화백반 교대점중식당,,,하도 유명하다해서 왔는데 짬뽕파도 짜장면 시켜야할 맛 입니다!!!!!! 다른것도 다 맛잇어요 추천 ~!
1617515432,중화백반 교대점중식당,,,황태백짬뽕 완전 칼칼하니 쌀쌀해지는 날씨에 딱이에요!! 그리고 건더기도 풍부해요!
