가게ID,가게명,평점,날짜,리뷰내용
18219589,만다린중식당,,,저녁에 방문예약 없이 이용대기 시간 바로 입장데이트연인・배우자
18219589,만다린중식당,,,저녁에 방문예약 없이 이용대기 시간 바로 입장데이트연인・배우자
18219589,만다린중식당,,,저녁에 방문예약 없이 이용대기 시간 바로 입장일상부모님
18219589,만다린중식당,,,저녁에 방문예약 없이 이용대기 시간 바로 입장일상부모님
18219589,만다린중식당,,,저녁에 방문예약 없이 이용대기 시간 바로 입장일상혼자
18219589,만다린중식당,,,저녁에 방문예약 없이 이용대기 시간 바로 입장친목부모님
18219589,만다린중식당,,,저녁에 방문예약 후 이용대기 시간 바로 입장친목
18219589,만다린중식당,,,점심에 방문예약 없이 이용대기 시간 10분 이내 나들이친구
18219589,만다린중식당,,,점심에 방문예약 없이 이용대기 시간 10분 이내 나들이친구
18219589,만다린중식당,,,점심에 방문예약 없이 이용대기 시간 10분 이내 데이트연인・배우자
18219589,만다린중식당,,,점심에 방문예약 없이 이용대기 시간 10분 이내 일상지인・동료
18219589,만다린중식당,,,점심에 방문예약 없이 이용대기 시간 30분 이내일상연인・배우자
18219589,만다린중식당,,,점심에 방문예약 없이 이용대기 시간 30분 이내일상연인・배우자
18219589,만다린중식당,,,점심에 방문예약 없이 이용대기 시간 바로 입장가족모임아이
18219589,만다린중식당,,,점심에 방문예약 없이 이용대기 시간 바로 입장데이트연인・배우자
18219589,만다린중식당,,,점심에 방문예약 없이 이용대기 시간 바로 입장데이트연인・배우자
18219589,만다린중식당,,,점심에 방문예약 없이 이용대기 시간 바로 입장데이트연인・배우자
18219589,만다린중식당,,,점심에 방문예약 없이 이용대기 시간 바로 입장일상연인・배우자
18219589,만다린중식당,,,점심에 방문예약 없이 이용대기 시간 바로 입장일상연인・배우자
18219589,만다린중식당,,,점심에 방문예약 없이 이용대기 시간 바로 입장친목부모님
18219589,만다린중식당,,,점심에 방문예약 없이 이용대기 시간 바로 입장친목연인・배우자
18219589,만다린중식당,,,점심에 방문예약 없이 이용대기 시간 바로 입장친목친구
18219589,만다린중식당,,,"점심에 방문예약 후 이용대기 시간 바로 입장가족모임연인・배우자, 부모님, 친척・형제"
18219589,만다린중식당,,,점심에 방문예약 후 이용대기 시간 바로 입장비즈니스지인・동료
18219589,만다린중식당,,,점심에 방문예약 후 이용대기 시간 바로 입장친목
18219589,만다린중식당,,,점심에 방문예약 후 이용대기 시간 바로 입장친목
18219589,만다린중식당,,,"제가 재차 따지자 CCTV를 확인하더니 “충격이 있는 건 보이지만 원래 그랬는지 알 수 없다”, “다시 왔다 갔다 하다 또 긁히면 그때 보상해주겠다”라는 식으로 대응하더군요."
18219589,만다린중식당,,,주차는 건물 앞에 하시면 되는데 따로 발렛비는 없어요. 음식 맛있고 직원분들 친절하세요! 다음에는 짬뽕 먹으러 오려구요 ㅎㅎ
18219589,만다린중식당,,,친절하고 맛나고 깨끗하고.. 방배동에서 갈만한 중국집입니다. 저희 부모님이 가장 잘가시던 중국집입니다.
18219589,만다린중식당,,,탕수육 달달끈적강정맛 간짜장 꾸덕 맛있고 전복잡탕밥해물 완전신선맛있네요 마지막 후식 수박 아주 입가심 최고
18219589,만다린중식당,,,"탕수육 소스가 끝판왕, 식어도 맛있어요"
18219589,만다린중식당,,,탕수육 소스가 부어진 상태로 나왔는데 눅눅하지 않고 맛있었습니다 평일 저녁 7시반에 가니 주차공간도 여유 있었습니다
18219589,만다린중식당,,,탕수육 정말 너무 맛있네요! 리뷰에 탕수육이 맛있다고 했는데 정말 그말이 맞아요 옛날 탕수육 느낌인데 적절한 튀김과 고기의 조화가 너무 잘 맞아요! 간짜장도 면이 부드럽고 너무 맛있게 먹었어요^^
37086581,모던눌랑 센트럴시티점,,,"10년도 넘은 인연의 지인들과의 모임 자리로 언제 와도 실패 없는 모던 눌랑으로 선택. 사람 붐비는 금요일 저녁 이었는데 좋은 분들과 모임인 걸 어떻게 아셨는지 전망 좋은 안쪽 창가자리로 예약해 주셔서 감동. 전복 연두부찜이랑 해물볶음, 게살볶음, 난자완스, 갈릭페퍼 슈림프까지 먹고 독주가 좀 남아서 중국식으로 맛나게 볶은 비타민 볶음 그리고 마지막으로 어향가지를 곁들인 양주식 볶음밥에 고수 좀 청해서 비우고 배뻥 ㅋㅋ 셋이서 샴페인 두병에 귀한 52도짜리 서봉주까지 같이 마셨는데 맛있다고 안주빨을 심하게 세워서 그런지 그런지 직전에 마신 깨ㅅ깡의 힘인지 생각보다 숙취없이 다음날도 멀쩡. 언제 와도 너무나 맛있고 즐거운 추억을 남기는 곳"
37086581,모던눌랑 센트럴시티점,,,15만원 이상 먹어야 3시간 가능한 점은 좀 아쉽지만 그래도 꼭 오는집!
37086581,모던눌랑 센트럴시티점,,,"7번째 방문 예약을 진행하면서 매번 방문자 이름을 수정하고 요청사항에 실제 방문자 성함으로 에약명 변경 부탁드린다는 메시지를 남기는데 늘 반영되지 않고 있네요. 같은 문제가 반복되어 불편함을 겪었습니다. 다른 네이버 예약을 받는 곳들은 방문자 정보 수정과 요청사항 반영이 잘 이루어지는 것 같은데, 모던눌랑에서는 이를 확인하지 않는 듯합니다. 예약 시스템이 더욱 정확하게 작동할 수 있도록 개선이 필요할 것 같습니다."
37086581,모던눌랑 센트럴시티점,,,가족과 함께 외식왔어요 분위기 좋고 다들 친절하시고 맛있습니다^^
37086581,모던눌랑 센트럴시티점,,,"게살수프, 냉채, 팔보채, 민트라임 슈림프, 블랙페퍼 안심스테이크, 식사, 후식으로 구성됐네요. 모든 요리들이 일반적인 중국집에서 접해보지 않은 새로운 맛입니다. 👍👍👍 팔보채도 여타 다른 중식요리집과 다르게 맛 자체가 고급(?)스럽네요. 🤩🤩🤩(심지어 짜샤이까지 맛있어요🤭🤭🤭)슈림프도 바삭함은 기본이고 소스가 향이 좋고 특이합니다. 스테이크는 후추향이 은은하니, 안심이이라 너무 부드러워요. 😍후식 자장면까지 맛있으니. 🥰🥰🥰"
37086581,모던눌랑 센트럴시티점,,,결론은 다시 좋아짐! 서비스도 착착 체계적이고 식사량이나 맛도 다시 예전으로 돌아온듯~ 중식 안 좋아하던 남편도 여기는 가자고하면 따라옴ㅎ
37086581,모던눌랑 센트럴시티점,,,"단체모임 하기 좋습니다! 음식맛도 좋았고, 친절했습니다😊"
37086581,모던눌랑 센트럴시티점,,,동파육 번에 싸먹는것도 맛있어요!! 이 두개는 무조건 드셔야 합니다
37086581,모던눌랑 센트럴시티점,,,"리뷰 1,498사진 1,628팔로워 44"
37086581,모던눌랑 센트럴시티점,,,맛도 좋고 직원분들 친절하시고 천장이 높은데다 매장 혼잡하지 않아서 모임하기 딱 좋았습니다. 가격이 싸진 않지만 깔끔하고 충분히 맛있었구요. 다음에 또 가게될것 같아요.
37086581,모던눌랑 센트럴시티점,,,"모임으로 두번째 방문하였는데, 첫번째때는 코스로 이번에는 먹고싶은 메뉴로 단품으로 먹었는데, 탁월한 선택이었습니다! 음식 모두 맛있었어요!^^"
37086581,모던눌랑 센트럴시티점,,,모임하기 좋은 것 같아요. 음식 종류도 다양하고 맛도 있고요.
37086581,모던눌랑 센트럴시티점,,,"모임하기 좋은 분위기예요. 미처 예약을 하지 못하고 갔는데,"
37086581,모던눌랑 센트럴시티점,,,부모님과 두번째 방문했어요 올때마다 맛있게 먹었어요! 가격대비 양은 조금 적지만 맛있어요
37086581,모던눌랑 센트럴시티점,,,부산에서 간만에 올라오시는 분께서 다들 얼굴이나 한번 보고 싶다 하여 만들어진 오랜 지인들과의 저녁 식사 자리... 대전에서도 먼걸음 해주신 분도 계셔서 즐겁게 먹었음. 종종 가는지라 지배인님이람 매니저님께서 좋은 자리로 주셔서 더 좋았다. 모던눌랑 요리는 간이 너무 자극적이지 않아서 와인이랑 페어링 하기 너무 좋은데 오늘도 코스 대신 들고 간 와인에 맞춰서 요리들을 주문했는데 다들 맛있다고 해 주셔서 더 기뻤음. 오늘의 베스트는 게 다릿살이 듬뿍든 저 대게살볶음이었음. 2025년에도 와인 모임하러 종종 오게될 듯 ㅎㅎ
37086581,모던눌랑 센트럴시티점,,,분위기 좋고 음식의 풍미 훌륭한 모던눌랑 반포 강력히 추천해요. 좋은 분들과 특별한 시간을 보내기에 안성맞춤입니다.
37086581,모던눌랑 센트럴시티점,,,분위기도 고급스럽고 역이랑 가까워서 약속장소로 잡기 좋았어요 코스도 가격 괜찮고 음식 맛있었어요
37086581,모던눌랑 센트럴시티점,,,"세팅과 서비스, 인테리어 모두 깔끔하고 고급져서 모임 갖기 좋았어요. 런치코스 먹었는데 음식도 맛있었어요. 다만 양은 좀 아쉬웠습니다. 잘먹었습니다~~"
37086581,모던눌랑 센트럴시티점,,,수분 터지는 아스파라거스는 노벨평화상 주고 싶네요~🤭
37086581,모던눌랑 센트럴시티점,,,"식사 메뉴 다 맛있어요! 홍콩 살다온 사람으로 중식 많이 먹었는데 완전 로컬 맛 보다는 한국인들이 좋아하게 딱 잘 만든 것 같아요👍🏻 전체적으로 음식 너무 맛있았구요, 튀김요리인데도 너무 기름지지 않았어용. 양이 적다는 말이 있는데 보기에는 좀 그렇지만 생각보다 배가 좀 불러요!"
37086581,모던눌랑 센트럴시티점,,,"아내와 장모님을 모시고 다녀왔는데, 기대 이상으로 분위기도 맛도 일품이었다."
37086581,모던눌랑 센트럴시티점,,,아빠 생신이라 모시고 갔던 모던눌랑 맛나게 드셔서 예약하길 잘했다고 생각했어요 ㅎㅎ 분위기도 좋습니다!
37086581,모던눌랑 센트럴시티점,,,"양가 부모님 모시고 젠더리빌 파티 하려고 일주일 전 전화 예약 시 풍선 종이 파티클이 날릴텐데 빗자루 부탁한다고 여쭤보고 가능하다고 해서 1:30분 예약하고 4시 전까지 이용 할 수 있다고 안내 받았어요~ 파미에 주차장에 주차하고 무빙워크 중간 계단으로 올라가니 바로 모던눌랑이어서 편했어요~ 처음 식사 주문 받으신 분이 예약 통화하셨던 분이셨고 다시 빗자루 부탁했더니 편하게 사용하고 가라고 해주셔서 고맙다고 시어머님께서 팁을 주셨어요~ 6만원 코스였고 대체적 음식은 맛있었는데, 양이 부족해서 식사로 나오는 짬뽕은 2젓가락 컷이었기에 양이 제대로 나오면 좋겠다는 생각을 했습니다~ 어른 모시고 하는 파티 장소로 만족했습니다~"
37086581,모던눌랑 센트럴시티점,,,양이 아주 많지 않은데다 이야기하며 먹으니 소화가 좀 돼서 너무 배부르지 않고 딱 좋네요~
37086581,모던눌랑 센트럴시티점,,,언제 가도 음식 맛있고 친절함에 기분 좋아지는 곳. 오랜 와인 모임 지인들과 간만에 방문했는데 한분이 가져오신 카시오페아 피노누아 2016 매그넘이 아주 멋지게 열렸는데 마침 같이 서빙된 자연송이 안심과 너무 잘맞아 메인 사진으로 남겨본다. 누구에게나 호평 받을 수 있는 맛집 강추함. ㅋ
37086581,모던눌랑 센트럴시티점,,,오랫동안 애정하는 곳이에요. 좋은 사람들과 만날 때 여기를 찾아요. 오늘도 분위기 좋고 맛있는 이곳에서 좋은 사람들과 행복한 시간을 보낼 것 갑니다. 직원분의 주문 실수는 있으셨지만 지배인님이 워낙에 친절하세요. 가지요리가 오늘은 특히 더 맛있었습니다. 매콤한 마라향이 참 좋았어요.
37086581,모던눌랑 센트럴시티점,,,"음식도 추천대로 시그니처로 상하이롤 플래터, 민트 라임 슈림프,동파육, 비빔탄탄면 그리고 볶음면시켜 먹었는데 완전 맛있었어요!! 제 원픽은 ""비빔탄탄면"", 엄마와 선생님 원픽은 마지막 사진에 나오는 볶음밥인데 메뉴이름이 생각이 안나네요ㅠ전부 단품으로 시켜 먹었는데 네이버메뉴판에서 이름을 못찾았어요..😂"
37086581,모던눌랑 센트럴시티점,,,음식이 맛있고 직원분들이 친절하십니다. 코스를 이용하거나 35만원 이상 결제시 룸 예약이 가능했어요. 분리된 룸이라 편하게 잘 먹고 왔습니다.
37086581,모던눌랑 센트럴시티점,,,"자주 다니다가 이번에는 몇달만에 방문했는데, 같은 런치B코스요리가 양이 넘넘 줄어서 놀랐네요. 원래 제가 양이 적은편이라 항상 코스요리 좀 남기거나 포장해와서 먹었는데,이번엔 진짜 부족해서ㅜ 카페가서 빵으로 배채우고 귀가ㅜ 옆테이블에 먼저 오신 단체손님들이 코스드시고 부족한데 식사 더 시킬까..뭐 그런 소리하길래, 뭔 소린가했더니..극 공감. 물가가 워낙올라서 이해는 해보려고해요. 그래도 코스먹고 배고픈건 좀 아쉬워서.."
37086581,모던눌랑 센트럴시티점,,,저녁에 방문예약 후 이용대기 시간 바로 입장
37086581,모던눌랑 센트럴시티점,,,"저녁에 방문예약 후 이용대기 시간 바로 입장가족모임연인・배우자, 부모님, 아이"
37086581,모던눌랑 센트럴시티점,,,저녁에 방문예약 후 이용대기 시간 바로 입장데이트연인・배우자
37086581,모던눌랑 센트럴시티점,,,저녁에 방문예약 후 이용대기 시간 바로 입장친목지인・동료
37086581,모던눌랑 센트럴시티점,,,저녁에 방문예약 후 이용대기 시간 바로 입장친목친구
37086581,모던눌랑 센트럴시티점,,,전가복/동파육/어향가지/민트라임슈림프/짜장면/해물짬뽕 다 너무 맛있어여.. 매일 가고 싶습니다 ㅠㅠㅠ
37086581,모던눌랑 센트럴시티점,,,점심에 방문예약 후 이용대기 시간 바로 입장
37086581,모던눌랑 센트럴시티점,,,"점심에 방문예약 후 이용대기 시간 바로 입장일상연인・배우자, 아이"
37086581,모던눌랑 센트럴시티점,,,"점심에 방문예약 후 이용대기 시간 바로 입장일상연인・배우자, 아이"
37086581,모던눌랑 센트럴시티점,,,점심에 방문예약 후 이용대기 시간 바로 입장친목친구
37086581,모던눌랑 센트럴시티점,,,점심에 방문예약 후 이용대기 시간 바로 입장친목친구
37086581,모던눌랑 센트럴시티점,,,점심에 방문예약 후 이용대기 시간 바로 입장친목친구
37086581,모던눌랑 센트럴시티점,,,주말 점심 코스로 나오는 음식 먹느라 사진을 못찍었네요. 나오는 음식 하나하나 다 특색있고 맛있어요. 째즈풍 음악이 흘러나와 전체적 분위기는 양식 코스요리집 같고 모던해요. 고급스럽고 모임하기 좋은 곳입니다.
37086581,모던눌랑 센트럴시티점,,,"주방에 계신 분들의 솜씨가 어마무시한 거 같고, 챙겨주시는 서버분들의 불편하지 않게하는 접객 또한 완벽했습니다."
37086581,모던눌랑 센트럴시티점,,,직원분들 다들 친절하시고 테이블 주의깊게 살피시면서 필요한게 보이면 바로바로 채워주세요. 코스 요리도 알맞은 타이밍에 착착 진행되니 가격대는 다소 있어도 잘 대접받는 느낌이라 만족스러웠습니다. 기념일에 부모님 모시고 가도 좋을 것 같아요.
37086581,모던눌랑 센트럴시티점,,,춘권 먹자마자 이제까지 먹어왔던 춘권과 다른 퀄리티에 다른 요리들이 엄청 기대 되더라구요
37086581,모던눌랑 센트럴시티점,,,춘권을 좋아해서 에피타이져로 시켰는데 삼각버섯고기춘권?? 찐 맛있어요 그리고 짜장면이 예술! 그릇 나눠서 주시니깐 서로 덜어먹는 불편함이 줄어서 좋았어요
37086581,모던눌랑 센트럴시티점,,,층고가 있어 소리가 울릴 거라 생각했는데 생각보다 소음이 심하지 않아서 만족스럽습니다.
37086581,모던눌랑 센트럴시티점,,,코스 주문 하려다 그냥 먹고 싶은 메뉴들 단품으로 여러개 주문해서 먹었어요
37086581,모던눌랑 센트럴시티점,,,특히 전 전가복을 원래도 제일좋아하기도하지만 모던눌랑 전기복 추천합니다.전복도 많고 양도푸짐하고 만족이에요!!!!글고 제일마지막 주문한 후식도 꼭 드시고 나오세요.푸딩안좋아하는데 어쩜 이리맛좋았던지. 푸딩안좋아하셔도 꼭 드시고오세요.담에 또 갈께요!!!
1106010383,바오로차이나 사당점,,,"""호두크림새우, 간짜장, 마파두부 모두 신선한 맛과 푸짐한 양이 만족스러웠고, 독립룸에서 가족과 조용히 즐길 수 있어 특별한 시간을 보낼 수 있었어요. 직원 응대도 친절했고, 영수증 이벤트로 즐거움도 더했습니다. 재방문 의향 있어요."""
1106010383,바오로차이나 사당점,,,"#내돈내산 근처 지나가다가 우연히 들린곳인데 아이 식기와 음료수도 준비해주시고 짜장면, 짜장볶음밥 둘다 너무 맛있었어요. 매장도 깔끔하고 룸도 있고 직원분들도 친절하셔서 기회 된다면 다시 들리고 싶은 곳입니다. 맛있게 잘 먹었습니다~^^"
1106010383,바오로차이나 사당점,,,"#협찬 바오로차이나사당점은 사당역 13번 출구에서 도보 3분 거리로 접근성이 뛰어나고, 매장 앞 발렛주차까지 지원되어 편리합니다. 내부는 110석 규모로 프라이빗 룸 8개까지 보유, 가족 외식, 회식, 데이트 장소로 모두 적합합니다. 메뉴는 짜장면, 고기볶음밥, 차돌짬뽕, 고추유린기, 탕수육 등 다양하며, 특히 고기볶음밥과 차돌짬뽕은 강력 추천! 점심 만원 메뉴도 운영되어 가성비도 좋습니다."
1106010383,바오로차이나 사당점,,,https://m.blog.naver.com/posesionra23/224037259395
1106010383,바오로차이나 사당점,,,고추유린기도 맛있고 볶음밥도 고슬고슬 해서 식감이 아주 좋아요 유육면도 고기가 야들야들 하니 맛있어요 가게도 깨끗하고 친절하시고요 이날먹은 병맥주도 음식하고 잘어울렸습니다
1106010383,바오로차이나 사당점,,,"고추유린기와 탕수육, 중국냉면 모두 바오로차이나에서 특히 많은 사랑을 받는 메뉴예요! 탕수육은 국내산 생등심을 사용해 두툼하고 바삭하게 튀겨낸 게 특징이죠!"
1106010383,바오로차이나 사당점,,,남편이랑 탕수육이 너무먹고싶어서 찾던중에 후기가 너무좋아서 와봤는데 여기 꼭!!드세요! 사당에서 먹은 중국집중에 제일 맛있는거같아요ㅎㅎ탕수육 양도많고 쟁반짜장 정말맛있습니다 사당맛집 인정👍🏻
1106010383,바오로차이나 사당점,,,냉짬뽕도 진짜 처음 먹어보는 맛인데 새콤하니 맛있더라구요!! 분위기도 고급져서 가족외식이나 상견례 장소로도 추천드립니다!!❤️
1106010383,바오로차이나 사당점,,,너무 맛있네요. 중화요리 코스를 점심특선으로 가성비 넘치게 맛볼수 있어 체곱니닷👍 재료들도 큼직큼직해서 식감도 풍성하고 식당이 깔끔하고 넓어서 모임이나 단체로 와도 괜찮겠어요. 룸도 있어서 좋더라구요
1106010383,바오로차이나 사당점,,,다른곳과 다른점은 국내산 돼지 생등심으로 두툼하게 튀겨내서 가위로 잘라 먹어야 합니다. 물론 그냥 먹어도 됩니다. 소스는 따로 내어줍니다. 가격대가 있어요.
1106010383,바오로차이나 사당점,,,"달콤 고소한 호두크림새우는 전혀 느끼하지 않고 입안 가득 풍성하며, 새우볶음밥은 밥알이 살아있는 듯한 감촉이 신기하게 맛있었습니다."
1106010383,바오로차이나 사당점,,,룸도 있지만 우린 매장에사 먹었지만 오랜만에 만난 친구들과 얘기하기도 괜찮았어요
1106010383,바오로차이나 사당점,,,매일와도 행복할 사당맛집 아니 서울맛집입니다! 인생탕수육이라고 말할수있는 맛에 빈틈이 없는 등심탕수육이였어요! 거대하고 안에 꽉찬 두꺼운고기가 이렇게 부드럽고 연하다니@@ 놀랐습니다! 고기에도 밑간이 잘되어있고 튀김옷도 맛있어서 감칠맛이 열배~ 탕수육소스의 정석에 치즈가 킥이였네요! 백짬뽕은 해장필수 메뉴! 냉동오징어에서는 절대 나올수 없는 진한국물과 부드러운 오징어식감에 완전 감동했답니다! 건더기도 푸짐하고 당면에 밥을 더하니까 푸짐해서 좋았어요! 불고기 잡채밥도 푸짐하고 고기의 질이 좋고 고기와 잡채 모두에 양념이 잘 베어있어서 끝까지 맛있었답니다^^룰렛이벤트 참여해서 맥주한잔까지 완벽한 저녁식사였네요!!아낌없이 들어간 좋은 재료에 정성이 들어가 자꾸만 생각나는 맛집! 재방문의사 100000000000%
1106010383,바오로차이나 사당점,,,매장 넓고 중식 종류도 다양해서 좋아요. 사천 탕수육은 살짝 매콤한데 고기 크고 맛있어요. 짜장면도 완전 깔끔하고 기름 지지않아서 좋습니다!!
1106010383,바오로차이나 사당점,,,매장도 너무 깔끔하고 요리는 가격대가 좀 있긴한데 그만큼 양이 많아서 비싸단 생각은 안들었습니다
1106010383,바오로차이나 사당점,,,면이 정말 얇고 너무 맛있어요.. 면을 직접 뽑으시는지.. 여지껏 먹은 어떤 중식당보다 면이 얇고 쫄깃하고 맛있어요. 얇은 면 좋아하시면 차돌짬뽕 추천합니다.
1106010383,바오로차이나 사당점,,,바오로차이나는 20년 넘게 중식만 연구해 온 주방장의 손에서 탄생한 요리들 덕분에 고급지고 깊이 있는 맛으로 많은 분들께 사랑받고 있어요! 차돌 짬뽕이나 해물짬뽕 모두 불향이 은은하게 배어 있는 얼큰하고 진한 국물이 정말 매력적이죠!
1106010383,바오로차이나 사당점,,,"바오로차이나에서 런치코스를 즐겼는데, 특히 어향가지와 탕수육이 정말 인상 깊었어요. 어향가지는 가지 특유의 부드러움에 깊은 양념 맛이 배어 있어 밥이 절로 당기고, 탕수육은 겉은 바삭하고 속은 촉촉해 소스와의 조화가 완벽했어요. 코스 전체가 깔끔하고 세련되게 구성되어 점심시간에 부담 없이 즐기기 좋았고, 합리적인 가격에 고급스러운 중식의 매력을 느낄 수 있어 만족스러웠습니다."
1106010383,바오로차이나 사당점,,,"바오로차이나의 여름 신메뉴 냉짬뽕은 말씀해 주신 것처럼 시원한 살얼음 육수에 탱글한 왕새우와 고소한 편육, 그리고 쫄깃한 면발까지 더해져 무더위를 확 날려주는 최고의 여름 별미예요! 👍"
1106010383,바오로차이나 사당점,,,"바오로차이나의 유린기는 신선한 닭다리살을 바삭하게 튀긴 뒤, 특제 간장 소스를 곁들여 상큼하고 감칠맛 나는 맛을 자랑해요! 군만두는 리뷰 이벤트 돌림판을 통해 받아보셨군요! 재미 요소까지 함께 즐겨주셔서 더욱 감사한 마음입니다!"
1106010383,바오로차이나 사당점,,,"사당 모임하기 좋은 식당이에요! 매장 자체도 넓은데 반 이상이 룸으로 되어 있어요! 고추유린기 처음먹어봤는데 닭안심을 사용하시는건지 지인짜 부드럽고, 고추도 듬뿍 있어서 하나씩 곁들여 먹으니깐 전혀 느끼하지 않고 맛있었어요."
1106010383,바오로차이나 사당점,,,사당 중식당 맛집으로 바오로차이나 추천해요 차돌짬뽕에 차돌 많이 올라가고 불맛 은은하게 나면서 면도 얇아서 국물이 잘 베어잇어 존맛탱이더라구요. 탕수육은 튀김옷이 얇고 바삭한데다 양이 많아서 술안주로도 좋고 열심히 먹다가 남아서 포장해갔네요ㅋㅋ 룸도 많고 예약도 네이버로 편하게 할 수 있어서 사당 단체모임으로 추천합니당 홀도 넓어서 쾌적했어요. 음식도 빨리나오고 평일 점심엔 요일이벤트도 잇어서 직장인들 식사로도 추천해요. 담엔 간짜장먹으러 가야겟어요!
1106010383,바오로차이나 사당점,,,사당 중식당 바오로차이나 사당점! 요리도 식사도 전부 맛있네요. 가성비도 좋아서 만족! 룸도 많아서 회식하기 좋은 사당 룸식당으로 추천이요~
