가게ID,가게명,평점,날짜,리뷰내용
1098338064,마틸다 바베큐 치킨 본점,,,오리지널도 살짝 매콤하니 매운거 못먹는 아기는 주의해주세용 로제 기본맛은 후추정도라 안매워요ㅎㅎ
1098338064,마틸다 바베큐 치킨 본점,,,이번에는 양념바베큐치킨을 도전해 봤습니다. 양념은 케찹베이스가 아닌 고추장베이스라 느끼하지않고 간이 잘 베어있어 맛있네요.
1098338064,마틸다 바베큐 치킨 본점,,,저녁에 방문예약 없이 이용대기 시간 10분 이내 데이트연인・배우자
1098338064,마틸다 바베큐 치킨 본점,,,저녁에 방문예약 없이 이용대기 시간 30분 이내친목친구
1098338064,마틸다 바베큐 치킨 본점,,,저녁에 방문예약 없이 이용대기 시간 바로 입장가족모임친척・형제
1098338064,마틸다 바베큐 치킨 본점,,,"저녁에 방문예약 없이 이용대기 시간 바로 입장데이트, 친목, 일상, 가족모임연인・배우자"
1098338064,마틸다 바베큐 치킨 본점,,,저녁에 방문예약 없이 이용대기 시간 바로 입장데이트연인・배우자
1098338064,마틸다 바베큐 치킨 본점,,,"저녁에 방문예약 없이 이용대기 시간 바로 입장친목, 데이트지인・동료, 친구"
1098338064,마틸다 바베큐 치킨 본점,,,저녁에 방문예약 없이 이용대기 시간 바로 입장친목지인・동료
1098338064,마틸다 바베큐 치킨 본점,,,저녁에 방문예약 없이 이용대기 시간 바로 입장친목친구
1098338064,마틸다 바베큐 치킨 본점,,,"저녁에 방문예약 후 이용대기 시간 10분 이내 친목, 일상친구"
1098338064,마틸다 바베큐 치킨 본점,,,저녁에 방문예약 후 이용대기 시간 바로 입장친목지인・동료
1098338064,마틸다 바베큐 치킨 본점,,,저녁에 방문예약 후 이용대기 시간 바로 입장친목친구
1098338064,마틸다 바베큐 치킨 본점,,,점심에 방문예약 후 이용대기 시간 바로 입장친목부모님
1098338064,마틸다 바베큐 치킨 본점,,,주변 지인의 추천으로 방문하게 된 곳인데~ 1차방문 때는 대기가 너무 길어서 시도못하고 2차방문 때 오픈런~ 성공했네요! 지인이 로제랑 갈몬드 맛있다 그중에서 먼저 갈몬드 먹어봐라했는데 근본인 기본먼저 먹어봤습니다!! 너무 맛있어요 다음에 갈몬드 먹으러 또 재방문 예정입니당 ㅎㅎㅎ
1098338064,마틸다 바베큐 치킨 본점,,,지난번에 정보없이 왔다가 오픈 전이라 슬펐는데 오늘 드디어 입장했어요.
1098338064,마틸다 바베큐 치킨 본점,,,퇴근하고 왔어요! 주말이라 사람도 많이 없어 자리가 많았어요! 평일에는 자리 없는데 다행이었어요ㅎㅎ치킨은 여전히 맛있었어요!
1098338064,마틸다 바베큐 치킨 본점,,,특히 오리지널치킨과 비타민(곁들이는 야채)가 맛있고요. 애들은 로제치킨(파스타) 를 좋아합니다.
1915464369,서울주막 강남역본점,,,ㅋㅋ 아니 잔 깨져있는 거 너무 당황스러웠네요. 관리좀 해주시길 바랍니다. 그리고 테이블 들어가자마자 약간 끈적거려서 여기서부터 기분이 별로였어요(위생관리 제대로 안되어있는 느낌) 그리고 시스템이 너무 불편한데 이건 어쩔 수 없는 부분인 것 같고 안주랑 음식들은 무난 하네요. 재방문 의사는 없어요. 위생 청결 관리 시급함
1915464369,서울주막 강남역본점,,,강남 올때마다 조용히 대화하고 싶을 때 많이와요~~ 평일엔 제한 없어서 너무 좋아요!!
1915464369,서울주막 강남역본점,,,금요일 예약없이 오후6시 좀 넘어왔는데 룸은 다 풀이었구 홀로 안내받았어요. 홀 처음 앉아봤는데 얘기하기에 괜찮았어요! 피자는 존맛이에여
1915464369,서울주막 강남역본점,,,덕분에 맛있는 식사를 즐기다 왔습니다~~!!! 매콤하고 알싸했던 고추의 진한 국물 맛과 치즈가루가 솔솔 뿌려진 뿌링클 치킨 그리고 마무리 패스츄리 피자까지!!! 완벽하게 맛있었어요~~ 양도 푸짐하게 듬뿍 담아 주셔서 알차게 먹고 왔네요~~~ 하이볼이랑도 같이 주문했는뎅 역시 잘 어울렸고 조화가 최고였어요!! 서빙도 로봇이 해줘서 편했었고 규모가 큰데도 회전 속도가 빨랐어요~~ 룸도 프라이빗하게 꾸며져 있어서 소수나 다수의 모임 전부 수용할 수 있게 되어 있었어요! 다음에 파티나 행사 있을 때 또 올게요~~❤️❤️
1915464369,서울주막 강남역본점,,,룸으로 예약했는데 직원분이 안 오시고 로봇으로 음식 가져다주시더라구요 필요한게 좀 있어서 카운터 갔더니 접시나 물티슈 이런거는 직접 가져가라고 하시고 완전 불친절하세요. 딱 봐도 일하기 싫다라는 표정으로 손님 대하시는데 이게 맞아요? 룸 옮겼는데 에어컨이 잘 나오지도 않고 여러모로 별로였습니다. 다신 안 올거에요.
1915464369,서울주막 강남역본점,,,룸으로 예약했는데 직원분이 안 오시고 로봇으로 음식 가져다주시더라구요 필요한게 좀 있어서 카운터 갔더니 접시나 물티슈 이런거는 직접 가져가라고 하시고 완전 불친절하세요. 딱 봐도 일하기 싫다라는 표정으로 손님 대하시는데 이게 맞아요? 룸 옮겼는데 에어컨이 잘 나오지도 않고 여러모로 별로였습니다. 다신 안 올거에요.
1915464369,서울주막 강남역본점,,,룸이 너무 쾌적하고 아늑해요!! 다음에도 강남 올일 있으면 또 올 것 같아요! 안주도 맛있고 나오는 속도도 빨라요! 추천합니다!
1915464369,서울주막 강남역본점,,,"매장이 커서 단체모임이든 소규모 모임이든 데이트든 다 가능해요! 음식도 다양하고 맛있는데, 로봇이 서빙해줘서 더 신기하고 분위기 좋아서 다음에 또 오려구요!!"
1915464369,서울주막 강남역본점,,,"먼저 인테리어가 전통 감성인데도 세련되게 꾸며져 있어서, 사진 찍기 딱 좋은 포토존 같아요. 조명도 은은해서 얼굴이 예쁘게 나오더라구요! 메뉴도 다양해서 안주 고를 때 행복한 고민했어요. 특히 치즈 짜파게티랑 파스타는 꼭 시켜보세요, 술이 술술 들어가는 맛이에요. 🍶"
1915464369,서울주막 강남역본점,,,"먼저 인테리어가 전통 감성인데도 세련되게 꾸며져 있어서, 사진 찍기 딱 좋은 포토존 같아요. 조명도 은은해서 얼굴이 예쁘게 나오더라구요! 메뉴도 다양해서 안주 고를 때 행복한 고민했어요. 특히 치즈 짜파게티랑 파스타는 꼭 시켜보세요, 술이 술술 들어가는 맛이에요. 🍶"
1915464369,서울주막 강남역본점,,,밤에 방문예약 없이 이용대기 시간 바로 입장친목지인・동료
1915464369,서울주막 강남역본점,,,밤에 방문예약 없이 이용대기 시간 바로 입장친목지인・동료
1915464369,서울주막 강남역본점,,,밤에 방문예약 후 이용대기 시간 바로 입장친목친구
1915464369,서울주막 강남역본점,,,밤에 방문예약 후 이용대기 시간 바로 입장회식친구
1915464369,서울주막 강남역본점,,,밤에 방문예약 후 이용대기 시간 바로 입장회식친구
1915464369,서울주막 강남역본점,,,"생일파티 겸 모였는데, 케이크는 들고 들어올수있고 너무 좋았어요~~!! 크크크 분위기 넘 도란도란 하구 좋아용"
1915464369,서울주막 강남역본점,,,생파룸이 따로있는 강남역룸술집이에요!! 여기 그리고 파스타 맛집임다..! 진짜 양도 푸짐하고 맛도 있는 곳 ㅋㅋ 왜파스타가 맛있지 ㅋㅋ 조용하게 좋은 시간 보내기 좋아요!!👍👍
1915464369,서울주막 강남역본점,,,서울주막 강남 본점에 와봤는데 인테리어도 이쁘고 프라이빗한 룸도 있어서 선택하기 좋았습니다. 서빙 로봇도 있어서 신기했고 무엇보다 매장이 넓어서 구경하기도 좋았습니다. 음식도 맛있었고 무엇보다 직원분들 모두 친절하게 안내해주고 잘생겼어요!
1915464369,서울주막 강남역본점,,,안주 좀 비싼 듯하나 강남역 물가 생각하면 가격대비 양 나쁘지 않았고 심지어 맛있었음! 다만 자동로봇 서버가 방 앞까지만 오고 방문열구 줄 수는 없다보니 미어캣모드로 보고 있어야 함. 강남역 금토저녁 조용하게 술마시긴 조음
1915464369,서울주막 강남역본점,,,"안주는 기본적으로 전통 주점 느낌을 살린 메뉴라 술이랑 궁합이 딱 맞습니다. 제가 먹은 해물파전은 바삭하면서 속은 촉촉했고, 도토리묵무침도 새콤달콤하니 입맛 돋우기 좋았어요. 분위기는 조용하면서도 따뜻한 느낌이라 데이트, 회식, 친구 모임 모두 무난하게 어울리는 곳 같습니다."
1915464369,서울주막 강남역본점,,,여기 분위기 너무 좋아서 시간 가는 줄 몰랐어요! 🍻 음식도 맛있고 직원분들 서비스까지 최고였습니다.
1915464369,서울주막 강남역본점,,,역시나 룸 개수 진짜 많아서 대기도 안해도 되고 생일파티 할 수 있게 가랜드도 있고 예쁘게 잘 꾸며져 있어서 깜짝파티 잘 하고 왔어요🩷
1915464369,서울주막 강남역본점,,,"우선 개별룸이 있어서 아늑하게 친구랑 생일축하도 하고 편하게 먹고 즐겼어요♥️ 치킨, 짜파게티, 짬뽕탕 다 시켰는데 음식이 전부 맛있고 양도 많아서 만족했습니다! 사진도 잘나오고 추억쌓기좋아서 룸술집 찾으시는 분들에게 강추드려요!"
1915464369,서울주막 강남역본점,,,저녁에 방문예약 없이 이용대기 시간 바로 입장데이트연인・배우자
1915464369,서울주막 강남역본점,,,저녁에 방문예약 없이 이용대기 시간 바로 입장데이트연인・배우자
1915464369,서울주막 강남역본점,,,저녁에 방문예약 없이 이용대기 시간 바로 입장친목친구
1915464369,서울주막 강남역본점,,,저녁에 방문예약 없이 이용대기 시간 바로 입장친목친구
1915464369,서울주막 강남역본점,,,저녁에 방문예약 없이 이용대기 시간 바로 입장친목친구
1915464369,서울주막 강남역본점,,,저녁에 방문예약 없이 이용대기 시간 바로 입장친목친구
1915464369,서울주막 강남역본점,,,"저녁에 방문예약 후 이용대기 시간 바로 입장데이트, 일상친구"
1915464369,서울주막 강남역본점,,,"저녁에 방문예약 후 이용대기 시간 바로 입장친목, 데이트연인・배우자, 친구"
1915464369,서울주막 강남역본점,,,"저녁에 방문예약 후 이용대기 시간 바로 입장친목, 일상친구"
1915464369,서울주막 강남역본점,,,"저녁에 방문예약 후 이용대기 시간 바로 입장친목, 일상친구"
1915464369,서울주막 강남역본점,,,"저녁에 방문예약 후 이용대기 시간 바로 입장친목연인・배우자, 친구"
1915464369,서울주막 강남역본점,,,저녁에 방문예약 후 이용대기 시간 바로 입장친목친구
1915464369,서울주막 강남역본점,,,저녁에 방문예약 후 이용대기 시간 바로 입장친목친구
1915464369,서울주막 강남역본점,,,저녁에 방문예약 후 이용대기 시간 바로 입장친목친구
1915464369,서울주막 강남역본점,,,저녁에 방문예약 후 이용대기 시간 바로 입장친목친구
1915464369,서울주막 강남역본점,,,저녁에 방문예약 후 이용대기 시간 바로 입장친목친구
1915464369,서울주막 강남역본점,,,저녁에 방문예약 후 이용대기 시간 바로 입장친목친구
1915464369,서울주막 강남역본점,,,저녁에 방문예약 후 이용대기 시간 바로 입장친목친구
1915464369,서울주막 강남역본점,,,직원분들도 너무 친절하시고 메뉴도 다양해서 좋았습니다 인테리어도 너무 고급스럽고 화려하네요✨ 홀 이용하면서 시끄럽지도 않고 다같이 재밌게 놀다가네요~!!
1915464369,서울주막 강남역본점,,,직원분들도 너무 친절하시고 메뉴도 다양해서 좋았습니다 인테리어도 너무 고급스럽고 화려하네요✨ 홀 이용하면서 시끄럽지도 않고 다같이 재밌게 놀다가네요~!!
1915464369,서울주막 강남역본점,,,직원분들도 너무 친절하시고 음식이 너무맛있어요!! 생일파티하러 오기 좋은 것 같아요❤️
1915464369,서울주막 강남역본점,,,"직원분들이 친절하게 메뉴 추천도 해주고, 음식 나오는 속도도 빨라서 기다림이 없었어요. 가격대도 합리적이라 가성비가 괜찮다고 느꼈습니다."
1915464369,서울주막 강남역본점,,,"짬뽕탕 진짜 맛있고, 치킨도 바삭하고 맥주도 시원합니다. 고등학교 친구들과 함께 왔는데 만족스럽습니다."
1915464369,서울주막 강남역본점,,,"짬뽕탕 진짜 맛있고, 치킨도 바삭하고 맥주도 시원합니다. 고등학교 친구들과 함께 왔는데 만족스럽습니다."
1915464369,서울주막 강남역본점,,,친구들이랑 단체로 강남역에서 술마시는데 시끄러운 술집은 싫고 마침 룸이있는 곳이 있다고 해서 왔는데 메뉴도 너무 다양하고 매장도 쾌적해서 너무 잘 놀다갑니다! 그리고 치킨이 진짜 맛있어요~~!😻앞으로도 친구들이랑 올때는 여기로 올것같아요!
1915464369,서울주막 강남역본점,,,퇴근하고 들르기 좋은 서울주막 강남점 !! 분위기도 깔끔하고 자리도 편해서 하루 마무리로 딱이네요~ 안주도 술이랑 잘 어울리고 직원분들도 친절해서 기분 좋게 먹고 왔습니다. 강남역 근처에서 편하게 한잔하기 좋아요! 룸사용료도 없어서 넘 좋아요 ~~~~ 💗💗💗 벌써 재재방문인데 또 올거임 ㅎ
1915464369,서울주막 강남역본점,,,퇴사파티 때문에 예약했었는데 메뉴도 생각보다 적어서 1차보다는 2차로 오기 좋은 곳 같습니다! 다만 예약하고 가기도 했고 사람도 많아 보이진 않았는데 룸 상태랑 식기류 상태가 안 좋아서 좀 그랬습니다..
1953700911,투홀릭치킨 서초양재시민의숲역점,,,"가족들이나 친구들, 동료들이랑 가서 맛있게 치킨 즐기면서 경기도 즐길 수 있는 맛집이에요!!!"
1953700911,투홀릭치킨 서초양재시민의숲역점,,,경기 열릴때 마다 여기서 치킨 먹으면서 경기를 즐길 예정! 슬슬 재밌는 일상이 기대됨!
1953700911,투홀릭치킨 서초양재시민의숲역점,,,경기 이벤트가 자주 있어서 친구들이랑 오면 더 즐거움이 커져요
1953700911,투홀릭치킨 서초양재시민의숲역점,,,고객님 너무 예쁜 사진과 디테일한 설명까지 너무나 감사드려요!!☺️ 소중하게 적어주신 리뷰가 저희에게 너무나 큰 힘이 됩니다!! 더욱 더 맛있는 식사가 되실 수 있도록 앞으로도 열심히 노력하겠습니다! 오늘 하루도 즐거운 일만 가득하시길 바래요😍
1953700911,투홀릭치킨 서초양재시민의숲역점,,,너무 맛있고 친절하십니다-! 야구 보기도 딱 좋고요 진짜 짱이에용 각 자리마다 야구 볼 수 있게 돼있고 큰 스크린도 있고요… 그냥 짱입니다 진작 이 가게를 알았어야 하는데…!!! 무엇보다 왕 친절하세요 정말 좋아용 담에 또 가겠어요 ㅎㅎ리뷰같은 거 잘 안 쓰는데 넘 조아서 씁니다 번창하세용
1953700911,투홀릭치킨 서초양재시민의숲역점,,,"단체로 가도 분위기 좋고, 즐거운 시간 보냈어요. 다음에는 사이드 메뉴도 먹어봐야겠어요!"
1953700911,투홀릭치킨 서초양재시민의숲역점,,,단체로 모여서 우르르 치킨 먹으니까 대화도 잘 되고 진짜 행복한 순간이었어요!
1953700911,투홀릭치킨 서초양재시민의숲역점,,,리뉴얼 후 분위기가 더 좋아졌어요 😍 모든 구단 야구경기를 한번에 볼 수 있어서 더워서 직관가기 어려운 요즘같은 날씨에 딱이에요!
1953700911,투홀릭치킨 서초양재시민의숲역점,,,"바베큐도 치킨도 전부 다 맛있었고, 무엇보다 대형스크린을 통해 스포츠 경기를 관람하며 후끈 달아오른 분위기를 다같이 느낄 수 있어 좋았습니다. 직원분들이 너무 친절해서 기분이 더 좋아졌구요."
1953700911,투홀릭치킨 서초양재시민의숲역점,,,반반으로 골라 먹을 수 있고 순살로도 선택 가능해서 먹기 편함
1953700911,투홀릭치킨 서초양재시민의숲역점,,,반반치킨으로 후라이드의 고소함과 양념의 감칠맛을 동시에 즐기니 행복함
1953700911,투홀릭치킨 서초양재시민의숲역점,,,밤에 방문예약 없이 이용대기 시간 바로 입장일상지인・동료
1953700911,투홀릭치킨 서초양재시민의숲역점,,,뼈치킨이든 순살이든 원하는 대로 골라 먹을 수 있어서 편하고 좋아요
1953700911,투홀릭치킨 서초양재시민의숲역점,,,사장님과 직원분들 다들 텐션 넘치시고 너무 친절하셔서 좋았어요. 무엇보다 이벤트도 많고 자기가 응원하는 팀이 홈런을 칠때마다 맥주나 음료수를 서비스로 주는 이벤트 등등 이벤트도 많고 치킨이 정말 맛있습니다. 잡내 하나도 없고 부드러워요. 그리고 야구 좋아하시면 여기 강추!! 1등으로 예약해서 가시면 제일 큰 스크린화면과 자리를 선점할수 있어요ㅋㅋㅋ 티관응원 너무 잘하고 갑니다! 또 갈께요! 아 그리고 야구공모양에 맥주잔 어디서 파시는건지… 너무 탐나네요.. 어디서 살수있는지 알려주시면 안될까요ㅠㅠ 갠적으로 갖고싶어요 ㅠㅠㅋㅋㅋㅋ진짜루ㅜㅜ 알려주시면 안될까요ㅠㅠㅋㅋㅋ 저에게 파세요 사장님 ㅠㅠㅋㅋㅋㅋㅋ
1953700911,투홀릭치킨 서초양재시민의숲역점,,,스모크치킨 포함 다양한 선택지 덕분에 골라 먹는 재미가 쏠쏠해요
1953700911,투홀릭치킨 서초양재시민의숲역점,,,스포츠 응원도 치킨과 함께하면 더 신나요! 여긴 스팟이구나!
1953700911,투홀릭치킨 서초양재시민의숲역점,,,스포츠경기 직관맛집으로 치맥하면서 즐기기에 딱인 양재시민의숲역점치맥맛집이 투홀릭치킨양재시민의숲역점! 150인치의 대형스크린으로 생중계직관하면서 오랜만에 LG팀 응원하면서 경기장대신 요기서 응원과 수다타임으로 즐거운 시간을 가졌는데 이벤트도 있었는데 이날 키움의 승으로 ㅜㅜ 생맥득템은 못했네요 ㅎㅎ
1953700911,투홀릭치킨 서초양재시민의숲역점,,,야구 경기별로 다 틀어주는거 호감이에요!!! 치킨도 너무맛잇습니다👍👍
1953700911,투홀릭치킨 서초양재시민의숲역점,,,야구보러온건데 치킨이 진짜 맛있어요! 응원팀이 홈런 치면 야구공잔에 생맥 주십니다⚾️💙 기본안주 팝콘도 맛있엉요
1953700911,투홀릭치킨 서초양재시민의숲역점,,,"언제나 믿고 드실 수 있도록 식자재 선정 부터 조리,포장까지 세심한 노력을 기울이고 있습니다!"
1953700911,투홀릭치킨 서초양재시민의숲역점,,,여기 스포츠 중계 쩔어서 집중하는 내 자신ㅋㅋ 진짜 경기장에서 즐기는 것 같았음!
1953700911,투홀릭치킨 서초양재시민의숲역점,,,여기 치킨 진짜 예술ㅇㅇ 원래 취미가 야구보는건디 치킨먹으면서 보니까 세상 좋음 ㅜㅜ
1953700911,투홀릭치킨 서초양재시민의숲역점,,,역시 바베큐 치킨 너무 맛있게 잘 먹고왔어요.♡ 적당히 맵고 기본은 그냥먹어도 맛있어요~ 깨알 이벤트도 잘 즐기고 왔답니다 ㅋㅋ
1953700911,투홀릭치킨 서초양재시민의숲역점,,,요즘 회식은 다 여기서 하자! 치킨말고도 메뉴 다양해서 2차 필수인 듯!
1953700911,투홀릭치킨 서초양재시민의숲역점,,,"우선 저희 “투홀릭치킨 양재시민의숲역점” 을 이렇게 애정해 주셔서 감사할 따름이에요☺️ 매장을 방문해주시고 바로 저녁에 리뷰&예쁜사진까지 올려주시다니 무한감동이에요~~어렵게 방문주셨는데 매장에서 좋은 기억을 담아 가져가신것 같아 너무 기쁘네요! 더욱 더 맛있는 식사가 되실 수 있도록 앞으로도 열심히 노력하겠습니다! 자주 방문해주시고, 오늘 하루도 즐거운 일만 가득하시길 바래요😍"
1953700911,투홀릭치킨 서초양재시민의숲역점,,,이벤트도 많고 대형 스크린도 있어 야구 보며 맥주 마시기 좋아요!
1953700911,투홀릭치킨 서초양재시민의숲역점,,,일반 스포츠펍들은 맛은 포기하고 가야하는데 여긴 시도한 모든 메뉴 다 성공이에요!!!!!
1953700911,투홀릭치킨 서초양재시민의숲역점,,,저녁에 방문예약 없이 이용대기 시간 10분 이내 가족모임연인・배우자
1953700911,투홀릭치킨 서초양재시민의숲역점,,,"저녁에 방문예약 없이 이용대기 시간 10분 이내 여행부모님, 연인・배우자"
1953700911,투홀릭치킨 서초양재시민의숲역점,,,저녁에 방문예약 없이 이용대기 시간 바로 입장데이트연인・배우자
1953700911,투홀릭치킨 서초양재시민의숲역점,,,저녁에 방문예약 없이 이용대기 시간 바로 입장데이트연인・배우자
1953700911,투홀릭치킨 서초양재시민의숲역점,,,"저녁에 방문예약 없이 이용대기 시간 바로 입장여행, 나들이아이"
1953700911,투홀릭치킨 서초양재시민의숲역점,,,저녁에 방문예약 없이 이용대기 시간 바로 입장친목연인・배우자
1953700911,투홀릭치킨 서초양재시민의숲역점,,,저녁에 방문예약 후 이용대기 시간 바로 입장친목친구
1953700911,투홀릭치킨 서초양재시민의숲역점,,,"점심에 방문예약 없이 이용대기 시간 바로 입장나들이, 여행연인・배우자"
1953700911,투홀릭치킨 서초양재시민의숲역점,,,정말 제가 돈 많이 벌면 투홀릭 가맹점 내고싶을 만큼 넘나 맛있어유ㅠㅠㅠ
1953700911,투홀릭치킨 서초양재시민의숲역점,,,직원분들 친절하고 감자튀김 같은 사이드가 술안주로 훌륭해서 여러 메뉴 시켜서 돌려먹기 좋았어요
1953700911,투홀릭치킨 서초양재시민의숲역점,,,직원분들도 친절하시고 매장도 엄청 깔끔하고 무엇보다 치킨이 개맛도리입니다..😋 다들 치킨은 투홀릭에서 드세요!!
1953700911,투홀릭치킨 서초양재시민의숲역점,,,"치맥을 즐기면서 좋아하는 구단의 야구 경기를 볼 수 있어용 ~ 매장도 쾌적하고 치킨도 맛있고 , , 완전 짱짱이에용 집 근처에 이런 곳이 있는 줄 몰랐는데 앞으로 종종 치맥하러 오려구용 ㅎㅅㅎ"
1953700911,투홀릭치킨 서초양재시민의숲역점,,,"치킨 튀김옷이 바삭하면서도 기름지지 않고, 고기는 속까지 촉촉하게 잘 익어서 한 입 먹을 때마다 육즙이 터져 나와요. 양념도 과하지 않고 딱 적당해서 끝까지 물리지 않네요. 특히 양이 정말 푸짐해서 둘이 먹어도 남을 정도예요. 보통 치킨집 가면 양이 아쉬울 때가 많은데, 여기는 그런 걱정이 전혀 없습니다."
1953700911,투홀릭치킨 서초양재시민의숲역점,,,치킨은 소스가 잘 배어있고 튀김이 바삭해서 맥주랑 찰떡이었음 🙌
1953700911,투홀릭치킨 서초양재시민의숲역점,,,치킨은 스모크맛도 있고 감자튀김 서비스도 줘서 기분 좋았음
1953700911,투홀릭치킨 서초양재시민의숲역점,,,치킨은 식감이 살아있고 양념맛이 균형있게 잡혀있어 계속 리필하게 돼요
1953700911,투홀릭치킨 서초양재시민의숲역점,,,치킨은 후라이드의 바삭함과 바비큐의 달콤짭조름함이 조화로워서 계속 손이 감
1953700911,투홀릭치킨 서초양재시민의숲역점,,,"테이블별로 각자 tv볼수도 있도, 대형스크린으로 다같이 볼수도있어서 축구경기, 야구경기 있을때 예약하거나 대관해서 치맥하기 딱 좋은 곳이에요!!!"
1953700911,투홀릭치킨 서초양재시민의숲역점,,,퇴근하고 동료랑 와서 경기보며 치맥했는데 대형 스크린 덕에 집중도 200%
1953700911,투홀릭치킨 서초양재시민의숲역점,,,투홀릭 치킨에서 친구들끼리 겁나 재밌게 야구 응원했어요! 완전 개꿀타임이었음!
1953700911,투홀릭치킨 서초양재시민의숲역점,,,"항상 초심잃지않고 고객님들께서 계속 만족하실수 있게 더욱더 노력하는 “투홀릭치킨 양재시민의숲역점” 되겠습니다. 앗! 그리고, 프로젝터 영상 문의 주셨던 것도 기억하고 있어요~방문하시는 날 네이버로 예약 주시거나 매장으로 전화주시면 당일 원하시는 경기로 맞춰드릴수 있게 도와드릴게요!! 오늘 하루도 행복한 하루 보내세요😍"
1953700911,투홀릭치킨 서초양재시민의숲역점,,,후라이드는 크리스피한 튀김옷이 포인트고 바비큐는 육즙과 불향이 살아있어 맛있어요
