가게ID,가게명,평점,날짜,리뷰내용
1953700911,투홀릭치킨 서초양재시민의숲역점,,,"후라이드랑 스모크치킨이 반반이라 너무 맛있게 먹었어요! 메뉴 구성 너무 좋아요🥰 치킨이 주인공이라는 듯 스포트라이트 해놓은것도 센스있고, 가게 벽면마다 야구프로그램이 틀어져있어서 퇴근 후 즐기기 좋은데 내부는 시끄럽지 않아서 대화하기 괜찮아요😆 감자튀김 서비스도 주시고 사장님 알바님도 다 친절해서 다시 오고싶어용😇"
1663980405,피자페이스오프 교대점,,,3번째 방문입니다. 너무 맛있어서 가족이랑 왔어요!! 번창하세요!!
1663980405,피자페이스오프 교대점,,,같이주문한 크림파스타도 너무 맛있어서 바닥까지 싹싹긁어먹었습니다. 힙한 매장에서 좋은 식사한끼하고 왔습니다!
1663980405,피자페이스오프 교대점,,,교대 피자맛집이에요! 특히 치즈가제일! 이것때문에오는 이유도있어요 강추
1663980405,피자페이스오프 교대점,,,교대역 매콤한 피자가 있는 피자페이스오프입니다. 맵기선택을 할 수 있는 피자가 새롭고 토핑도 듬뿍 치즈도 듬뿍올라가있어서 정말 맛있었어요 ㅎㅎ 점심시간에 방문하기에도 너무 좋을 것 같아요 !!
1663980405,피자페이스오프 교대점,,,교대역 피자맛집이에요!! 특히 치즈가 치즈크러스트무조건 추가하시는거 잊지마세요
1663980405,피자페이스오프 교대점,,,교대역 피자맛집이에요!! 특히 치즈가 치즈크러스트무조건 추가하시는거 잊지마세요
1663980405,피자페이스오프 교대점,,,기본 페이스오프 피자 먹었는데 정말 밸런스가 잘잡히고 한국인이 좋아할 정도의 매콤한 맛이어서 맛있어요! 치즈맛도 훌륭하고 방문포장하면 20프로 할인해줘서 다음에 또 올려구요! 맛있게 잘먹었습니다🥰
1663980405,피자페이스오프 교대점,,,너무 맛있고 특색있는 피자집이었습니다~! 배경도 한적하고 너무 즐겁게 먹고 갑니다.
1663980405,피자페이스오프 교대점,,,너무 맛있고 특색있는 피자집이었습니다~! 배경도 한적하고 너무 즐겁게 먹고 갑니다.
1663980405,피자페이스오프 교대점,,,느끼한거 많이 목먹는데 크림파스타도 매콤함이 있어서 느끼하지 않게 목을 수 있었어요!
1663980405,피자페이스오프 교대점,,,맛있어요! 비슷한 종류의 프랜차이즈 피자 중에 제일 괜찮아요. 도우가 확실히 바삭하고 덜 쫄깃 해서 더 맛있는 느낌? 오븐 파스타도 맛있어요
1663980405,피자페이스오프 교대점,,,매쉬드 포테이토 진짜 너무 부드럽고 두꺼워서 더먹고싶었지만.. 조절해야죠
1663980405,피자페이스오프 교대점,,,매장 분위기도 너무 힙하고 사장님도 너무 친절하셨어요!! 그리거 치즈가 되게 임실치즈마냥 쫀득하고 아주 맛있게 먹고갑니다🍕🍕🍕 피자러버 뛰어.
1663980405,피자페이스오프 교대점,,,"매장 분위기도 아늑하고 데이트 장소로 좋을 것 같아요. 직원분들도 친절하시고, 포장 할인 이벤트까지 있어서 만족했습니다. 👍"
1663980405,피자페이스오프 교대점,,,맵기조절도 되서 피자 특유의 느끼함이 없어서 싹싹 다 먹을수 있었어요~
1663980405,피자페이스오프 교대점,,,사이드인 파스타랑 시그니처피자 모두 너무 맛있었습니다 재방문의사200%입니다!!! 너무 잘먹었습니다
1663980405,피자페이스오프 교대점,,,아이와 함께 평일 방문했어요. 로제파스타도 맛있고 피자도우도 쫄깃하네요~~♡
1663980405,피자페이스오프 교대점,,,아이와 함께 평일 방문했어요. 로제파스타도 맛있고 피자도우도 쫄깃하네요~~♡
1663980405,피자페이스오프 교대점,,,오늘 남편이랑 방문했는데 너무 만족하고 갑니다~~ 특히 매운맛 좋아하시는 분들 꼭꼭 드세요 제발 ~~~입맛이 확 도는게 진짜 맛있네요!! 치즈도 잔뜩 들어 있어서 남편이랑 흡입했네요 ㅋㅋㅋ 저흰 생맥주도 같이 마셨는데 찰떡이에요! 피맥 꼭 하시길 바랍니다 :)🐽 배달도 되니까 배달로도 시켜먹을거 같아요 !!! 번창하세요!!
1663980405,피자페이스오프 교대점,,,"우선 피자 사이즈가 R와 L로 선택할 수 있어서 좋았어요! 왜냐면 페이스오프에는 사이드 메뉴가 다양해서 버팔로윙, 치킨텐더같은 튀김뿐만 아니라 “오븐파스타”를 꼬옥 같이 먹고싶었거든요!! 그러기에 라지는 큰데 레귤러 사이즈가 있어서 사이드와 즐기기 넘 좋았어요"
1663980405,피자페이스오프 교대점,,,저녁에 방문예약 없이 이용대기 시간 바로 입장데이트연인・배우자
1663980405,피자페이스오프 교대점,,,저녁에 방문예약 없이 이용대기 시간 바로 입장데이트연인・배우자
1663980405,피자페이스오프 교대점,,,저녁에 방문예약 없이 이용대기 시간 바로 입장데이트연인・배우자
1663980405,피자페이스오프 교대점,,,저녁에 방문예약 없이 이용대기 시간 바로 입장데이트연인・배우자
1663980405,피자페이스오프 교대점,,,저녁에 방문예약 후 이용대기 시간 바로 입장데이트연인・배우자
1663980405,피자페이스오프 교대점,,,저녁에 방문예약 후 이용대기 시간 바로 입장데이트연인・배우자
1663980405,피자페이스오프 교대점,,,저녁에 방문예약 후 이용대기 시간 바로 입장데이트연인・배우자
1663980405,피자페이스오프 교대점,,,"점심에 방문예약 없이 이용대기 시간 10분 이내 일상, 친목친구"
1663980405,피자페이스오프 교대점,,,점심에 방문예약 없이 이용대기 시간 30분 이내친목지인・동료
1663980405,피자페이스오프 교대점,,,점심에 방문예약 없이 이용대기 시간 바로 입장일상지인・동료
1663980405,피자페이스오프 교대점,,,점심에 방문예약 없이 이용대기 시간 바로 입장일상지인・동료
1663980405,피자페이스오프 교대점,,,점심에 방문예약 없이 이용대기 시간 바로 입장친목친구
1663980405,피자페이스오프 교대점,,,점심에 방문예약 후 이용대기 시간 바로 입장데이트연인・배우자
1663980405,피자페이스오프 교대점,,,점심에 방문예약 후 이용대기 시간 바로 입장데이트연인・배우자
1663980405,피자페이스오프 교대점,,,점심에 방문예약 후 이용대기 시간 바로 입장친목친구
1663980405,피자페이스오프 교대점,,,지나가다 들어왔는데 매장 깔끔하고 인테리어 이쁘고 완전 맛있어요!!
1663980405,피자페이스오프 교대점,,,지나가다 들어왔는데 매장 깔끔하고 인테리어 이쁘고 완전 맛있어요!!
1663980405,피자페이스오프 교대점,,,집앞인데 맨날 지나가기만 하다가 처음 와봤어요! 피자 베스트 메뉴 시켰는데 적당히 매워서 좋았고 파스타 맛있었어요 또 올게요 ㅎㅎㅎ
1663980405,피자페이스오프 교대점,,,짜지않고 맛있게 매콤한 페이스오프랑 브드럽고 고소한 메쉬포테이토 조합 진짜 추천입니당>< 담엔 다른메뉴 ㄱㄱ!
1663980405,피자페이스오프 교대점,,,처음 와봤는데 회사 근처라 자주 올 거 같아요 조용해서 좋고 음식도 너무 맛있어요!! 토핑 가득 매운맛도 선택 가능해서 맥주 땡길 때도 너무 좋을 거 같아요 스파게티도 짱추천임니다❤️
1663980405,피자페이스오프 교대점,,,특히 치즈크러스트 꼭 추가하세요! 빵이 빵실한게 너무 맛있음..ㅠ 갈릭소스도 꼭 시키세용
1663980405,피자페이스오프 교대점,,,파스타 맛집입니다. 파스타 꼭 사이드로 추가하세요 피자도 넘맛있으요❤️
1663980405,피자페이스오프 교대점,,,페이스오프 피자! 피자 중 최고에요.. 토마토 소스 부터 다릅니다. 치즈 크러스트 꼭 추가하세요. 치즈도 우유의 고소하고 식어도 부드러워요 🤤🤤🍕 넘 맛있어요!! 교대의 최고 피자집이에요! 배달도 되는데 직접가서 먹으니 또 맛있네요 👏👏
1663980405,피자페이스오프 교대점,,,"페이스오프 피자는 역시 시그니처답게 맛이 확실했어요. 도우는 얇고 바삭한 스타일인데, 토핑은 아주 풍성해요! 페퍼로니, 베이컨, 체다·모짜렐라 치즈가 듬뿍 올라가 있고, 치즈가 쭉 늘어나면서 고소함이 정말 폭발합니다..😁토마토 소스도 새콤하지 않고 진해서 전체적인 밸런스가 좋아요👍"
1663980405,피자페이스오프 교대점,,,피자 맵기 조절도 할 수 있고 두명이서 적당한 양에 맛있게 먹을 수 있어서 좋았어요 ㅎㅎ 무엇보다 피자에 있는 치즈가 정말 맛있었습니다!! 모임과 데이트로 식사하기에도 좋은 곳이라서 추천합니당👍
1663980405,피자페이스오프 교대점,,,피자 페이스오프 & 몬스터 비비큐 & 베이컨 매쉬 포테이토 셋다 강추합니다 ㅎㅎ
1663980405,피자페이스오프 교대점,,,"피자랑 파스타가 먹고싶어서 우연히 찾아보고 왔는데 너무 맛있네요! 파스타도 치즈 엄청 많이주시고, 피자도 토핑이 많아서 식감도 맛도 최고였어요!"
1663980405,피자페이스오프 교대점,,,피자와 로제파스타 너무 맛있어서 처음 부터 끝까지 맛있다 소리만 하면서 먹었어요!!!! 너무 맛있고 공간도 깔끔하고 쾌적하고 너무 좋아요~~~ 분당에도 어서 피자페이스오프 가게가 생겼으면 좋겠어용!! 맛집 인정입니더~~
1663980405,피자페이스오프 교대점,,,피자와 로제파스타 너무 맛있어서 처음 부터 끝까지 맛있다 소리만 하면서 먹었어요!!!! 너무 맛있고 공간도 깔끔하고 쾌적하고 너무 좋아요~~~ 분당에도 어서 피자페이스오프 가게가 생겼으면 좋겠어용!! 맛집 인정입니더~~
1663980405,피자페이스오프 교대점,,,피쟈 치즈 짱 맛있어요!!!!!! 씹으면 소스가 퐝하고 터지구 도우도 빠삭해요
18272769,"한신치킨호프치킨,닭강정",,,(무한리필이라 음식나오기전에 계속 먹을수있으니 주의바랍니다. 팝콘 넘 맛있어서 멈출수없어요. ㅋㅋ)
18272769,"한신치킨호프치킨,닭강정",,,"금요일 저녁 6시쯤 가니 사람들이 몰려오기 시작했어요ㅎㅎ 다행히 웨이팅 없이 들어갔는데, 먹고 나오니 웨이팅이 있더라구요"
18272769,"한신치킨호프치킨,닭강정",,,기다려야 하고 시끄럽지만 야장 분위기 좋고 음식 밋있어요 ㅎㅎ
18272769,"한신치킨호프치킨,닭강정",,,동네 맛집을 넘어섰으니 변하지 않고 계속 이대로 이어지길 바래봅니다
18272769,"한신치킨호프치킨,닭강정",,,"리뷰 2,142사진 1,711팔로워 67"
18272769,"한신치킨호프치킨,닭강정",,,명불허전 한신치킨! 오랜만에 왔더니 키오스크 주문으로 싹 바뀌었네요?! 치킨도 치킨인데 여긴 항아리 수제비 먹으러 오는 곳이랍니다 살짝 몸살기운이 있어서인지 뜨듯한 수제비 국물이 자꾸 생각나더라구요 한입 떠먹고 소주한잔 마시니 좀 낫는 것 같은 🫣😆ㅋㅋㅋ 야들야들한 수제비 반죽 최고! 🥹🤭
18272769,"한신치킨호프치킨,닭강정",,,반포에서 치맥하면 한신치킨! 근데 의외의 메뉴들도 많고 맛나다!
18272769,"한신치킨호프치킨,닭강정",,,반포에서 치맥하면 한신치킨! 근데 의외의 메뉴들도 많고 맛나다!
18272769,"한신치킨호프치킨,닭강정",,,밤에 방문예약 없이 이용대기 시간 바로 입장데이트연인・배우자
18272769,"한신치킨호프치킨,닭강정",,,"밤에 방문예약 없이 이용대기 시간 바로 입장친목, 일상연인・배우자"
18272769,"한신치킨호프치킨,닭강정",,,"밤에 방문예약 없이 이용대기 시간 바로 입장친목, 일상연인・배우자"
18272769,"한신치킨호프치킨,닭강정",,,"밤에 방문예약 없이 이용대기 시간 바로 입장친목, 일상연인・배우자"
18272769,"한신치킨호프치킨,닭강정",,,"밤에 방문예약 없이 이용대기 시간 바로 입장친목, 일상연인・배우자"
18272769,"한신치킨호프치킨,닭강정",,,밤에 방문예약 없이 이용대기 시간 바로 입장친목지인・동료
18272769,"한신치킨호프치킨,닭강정",,,샐러드 무 반찬은 셀프바에서 추가로 이용 가능한데 사모님인지 직원인지 여자분 ㅋㅋ 우리가 가져갈때마다 에휴 에휴 한숨 쉬심 ;; 그렇게 눈치 줄거면 셀프바를 없애시던가요.. 많이 갖다먹는것도 아닌데 기분이 확 나빠지더라고요? 후라이드는 빠삭하니 진짜 맛있었습니다.
18272769,"한신치킨호프치킨,닭강정",,,샐러드 무 반찬은 셀프바에서 추가로 이용 가능한데 사모님인지 직원인지 여자분 ㅋㅋ 우리가 가져갈때마다 에휴 에휴 한숨 쉬심 ;; 그렇게 눈치 줄거면 셀프바를 없애시던가요.. 많이 갖다먹는것도 아닌데 기분이 확 나빠지더라고요? 후라이드는 빠삭하니 진짜 맛있었습니다.
18272769,"한신치킨호프치킨,닭강정",,,수제비랑 치킨이랑 조합이 잘어울려서 맥주 무한대로 들어가요!!
18272769,"한신치킨호프치킨,닭강정",,,아침에 방문예약 없이 이용대기 시간 10분 이내 나들이친척・형제
18272769,"한신치킨호프치킨,닭강정",,,안좋은 리뷰도 많앗지만 그래도 가보자해서 도전했지만 리뷰그대로입니당 불친절은 기본
18272769,"한신치킨호프치킨,닭강정",,,"역시 믿고 가는 치킨 찐맛집! 치킨과 수제비 조합 한신치킨 국룰이죠~! 주문 즉시 튀겨주시기에 너무너무 바삭한 치킨의 맛,, 최고👍🏻"
18272769,"한신치킨호프치킨,닭강정",,,"역시 믿고 가는 치킨 찐맛집! 치킨과 수제비 조합 한신치킨 국룰이죠~! 주문 즉시 튀겨주시기에 너무너무 바삭한 치킨의 맛,, 최고👍🏻"
18272769,"한신치킨호프치킨,닭강정",,,음식은 여전히 같은맛에 매장이 넓어져서 많은 인원 수용 가능
18272769,"한신치킨호프치킨,닭강정",,,"자전거 타고~ 벚꽃 구경하고~ 맛점했어요! 날 더 좋아지면 사람 많아질 텐데, 오늘은 다행히 여유로와 느긋하게 식사할 수 있었네요. 잘 먹었습니당! 🥰"
18272769,"한신치킨호프치킨,닭강정",,,저녁에 방문예약 없이 이용대기 시간 바로 입장
18272769,"한신치킨호프치킨,닭강정",,,저녁에 방문예약 없이 이용대기 시간 바로 입장데이트연인・배우자
18272769,"한신치킨호프치킨,닭강정",,,저녁에 방문예약 없이 이용대기 시간 바로 입장데이트연인・배우자
18272769,"한신치킨호프치킨,닭강정",,,저녁에 방문예약 없이 이용대기 시간 바로 입장데이트연인・배우자
18272769,"한신치킨호프치킨,닭강정",,,저녁에 방문예약 없이 이용대기 시간 바로 입장일상
18272769,"한신치킨호프치킨,닭강정",,,저녁에 방문예약 없이 이용대기 시간 바로 입장일상기타
18272769,"한신치킨호프치킨,닭강정",,,"저녁에 방문예약 없이 이용대기 시간 바로 입장일상연인・배우자, 아이"
18272769,"한신치킨호프치킨,닭강정",,,저녁에 방문예약 없이 이용대기 시간 바로 입장친목친구
18272769,"한신치킨호프치킨,닭강정",,,저녁에 방문예약 없이 이용대기 시간 바로 입장친목친구
18272769,"한신치킨호프치킨,닭강정",,,저녁에 방문포장·배달 이용대기 시간 10분 이내 일상아이
18272769,"한신치킨호프치킨,닭강정",,,전어 먹고 싶어서 갔는데 이번년도엔.. 전어는 없었고 (10/13 기준) 오징어 볶음 시켰는데 소면까지 있어서 엄청 배불렀네요... 🫶🏻 😋
18272769,"한신치킨호프치킨,닭강정",,,점심에 방문예약 없이 이용대기 시간 바로 입장가족모임연인・배우자
18272769,"한신치킨호프치킨,닭강정",,,점심에 방문예약 없이 이용대기 시간 바로 입장일상부모님
18272769,"한신치킨호프치킨,닭강정",,,점심에 방문예약 없이 이용대기 시간 바로 입장일상부모님
18272769,"한신치킨호프치킨,닭강정",,,점심에 방문예약 없이 이용대기 시간 바로 입장일상친척・형제
18272769,"한신치킨호프치킨,닭강정",,,점심에 방문예약 없이 이용대기 시간 바로 입장친목친구
18272769,"한신치킨호프치킨,닭강정",,,점심에 방문예약 없이 이용대기 시간 바로 입장친목친구
18272769,"한신치킨호프치킨,닭강정",,,점심에 방문예약 없이 이용대기 시간 바로 입장친목친구
18272769,"한신치킨호프치킨,닭강정",,,좁은 공간에 너무 많은 사람이 있어 시끄러웠던 게 아쉬웠습니다. 테이블 간격이 너무 좁아요.
18272769,"한신치킨호프치킨,닭강정",,,"치킨 말해뭐해~ 너무 맛있었고, 수제비도 다들 맛있게 먹었습니다! 제육도 시켰는데 맛도리🥹"
18272769,"한신치킨호프치킨,닭강정",,,치킨이 맛잇고 수제비는 진짜 그닥.. 여기 친절도 제로예요 ..술집을 가도 친절함에 사람마음이 흔들리는데
18272769,"한신치킨호프치킨,닭강정",,,평소에는 밖에 대기줄이 엄청 길지만 평일 늦은밤시간이라 바로 착석했습니다. 하지만 대화소리가 안들릴정도로 시끄러워요. 음식은 맛있었고 양도 푸짐합니다.
18272769,"한신치킨호프치킨,닭강정",,,평소에는 밖에 대기줄이 엄청 길지만 평일 늦은밤시간이라 바로 착석했습니다. 하지만 대화소리가 안들릴정도로 시끄러워요. 음식은 맛있었고 양도 푸짐합니다.
18272769,"한신치킨호프치킨,닭강정",,,"후라이드, 양념 우열 가릴 수 없이 맛있는 치킨에 수제비까지 꼭 먹어줘야 해요."
18272769,"한신치킨호프치킨,닭강정",,,"후라이드, 양념 우열 가릴 수 없이 맛있는 치킨에 수제비까지 꼭 먹어줘야 해요."
1858789843,효도치킨 강남고속버스터미널점,,,2번째 방문입니다. 양도 많고 양념이랑 멸치치킨?이 맛있어요! 매장안도 깔끔하고 넓어요 또 방문할게요!
1858789843,효도치킨 강남고속버스터미널점,,,3시전에 방문했어서 생맥주도 저렴히 먹을 수 있아서 좋아여
1858789843,효도치킨 강남고속버스터미널점,,,가게가 아주 깔끔하고 직원분이 친절하십니다 !! 치킨 맛은 말해 뭐 합니까 !! 꽈리고추치킨 추천 !!
1858789843,효도치킨 강남고속버스터미널점,,,고터에 밥 먹을 곳이 마땅치 않았는데 이런 식당이 있었네요!
1858789843,효도치킨 강남고속버스터미널점,,,고터오면 2번에 1번은 오는 효도치킨! 오늘은 교회 끝나고 여자친구랑 교회 형님이랑 같이 왔는데 여전히 너무 맛있네요 잘 먹고 갑니다☺️
1858789843,효도치킨 강남고속버스터미널점,,,"꽈리고추멸치, 흑임자 같은 건강메뉴가 있어서 죄책감을 덜어줍니다. 효도 메뉴인데 맛있는것도 치트키! 집앞이라 자주옵니당~"
1858789843,효도치킨 강남고속버스터미널점,,,늦게까지 하는 고터 식당 중에 한 군데 골라간 건데 치킨 맛집이에요!!! 진짜 먹고 맛있어서 박수 쳤습니다. 매장도 넓고 깔끔하고 치킨도 진짜 맛있어서 다음에 또 올 것 같습니다!!!
1858789843,효도치킨 강남고속버스터미널점,,,"들깨가루 좋아해서 와봤어요. 볼일보고ㅡ 고터에서 한끼먹으려고 메뉴가 특이해서 찾아와봤는데, 들깨치킨도 괜찮은데 꽈리고추멸치가 정말 맛있어요!! 굿굿"
1858789843,효도치킨 강남고속버스터미널점,,,매번 맛있는 효도치킨. 저희 아이 영양간식 아빠의 술안주!
1858789843,효도치킨 강남고속버스터미널점,,,매번 치킨먹을때마다 여기 치킨이 제일 바삭바삭하고 깔끔해서 너무 맛있게 잘 먹어요!! 추천합니다👍
1858789843,효도치킨 강남고속버스터미널점,,,매주 한의원 다니느라 이곳에서 점심 식사하는데 음식이 입맛에 맞아서 늘 오게되네요.
1858789843,효도치킨 강남고속버스터미널점,,,멸추치킨 강추입니다~~ 본점에서 먹다 가까운 고터에 생겨서 넘 좋네요~ 매장도 크고 깔끔해서 좋습니다~
1858789843,효도치킨 강남고속버스터미널점,,,반반치킨으로 후라이드 양념 꼭 둘 다 드세요! 바삭바삭 맛있어요
1858789843,효도치킨 강남고속버스터미널점,,,백화점 들렀다가 치킨먹고 싶어서 들린곳인데 잘한 선택이었어요!ㅋㅋㅋ 맛있습니당ㅎㅎ 메뉴도 특이한게 많아서 와볼만한것같아요!
1858789843,효도치킨 강남고속버스터미널점,,,연근이랑 멸치가 들어가있어서 넘 독특했는데 순살도 닭다리살이라 넘 맛있었어요 :)
1858789843,효도치킨 강남고속버스터미널점,,,오랜만에 와이프랑 반반차 내고 데이트 처음 와 보는 곳인데 시간이 일러서 그런지 사람도 우리만 있고 좋네요.
1858789843,효도치킨 강남고속버스터미널점,,,원래 광화문점 갓는데 한강 러닝하고 치킨먹으러 왔어요 ㅎㅎㅎ 역시나 맛있습니다!!!
1858789843,효도치킨 강남고속버스터미널점,,,"일요일 저녁에 방문했는데, 좌석 널널해서 좋았어요~ 궁금했었는데, 드디어 왔네요. 아직 치킨이 안나와서 맛은 모르겠지만,, 매장 깔끔해요-!"
1858789843,효도치킨 강남고속버스터미널점,,,자주 오는 고터 효도치킨!! 점바점 있는지 여기가 너무 맛나더라구요!! 여자친구가 치킨 먹을때면 매번 여기만 옵니다 . 치마호크? 이것더 개꿀맛
1858789843,효도치킨 강남고속버스터미널점,,,작년에 서울성모병원 입원시 야식으로 시켜 먹었었어요 너무 맛있어서 또 먹어봐야지 기다리다 드디어 방문해서 먹어보네요 역시 맛있어요!!
1858789843,효도치킨 강남고속버스터미널점,,,"저녁에 방문예약 없이 이용대기 시간 30분 이내회식, 일상지인・동료"
1858789843,효도치킨 강남고속버스터미널점,,,"저녁에 방문예약 없이 이용대기 시간 바로 입장가족모임, 일상연인・배우자, 아이"
1858789843,효도치킨 강남고속버스터미널점,,,저녁에 방문예약 없이 이용대기 시간 바로 입장가족모임아이
1858789843,효도치킨 강남고속버스터미널점,,,저녁에 방문예약 없이 이용대기 시간 바로 입장데이트연인・배우자
1858789843,효도치킨 강남고속버스터미널점,,,저녁에 방문예약 없이 이용대기 시간 바로 입장데이트연인・배우자
1858789843,효도치킨 강남고속버스터미널점,,,저녁에 방문예약 없이 이용대기 시간 바로 입장데이트연인・배우자
1858789843,효도치킨 강남고속버스터미널점,,,"저녁에 방문예약 없이 이용대기 시간 바로 입장친목, 가족모임연인・배우자"
1858789843,효도치킨 강남고속버스터미널점,,,저녁에 방문예약 없이 이용대기 시간 바로 입장친목친구
1858789843,효도치킨 강남고속버스터미널점,,,저녁에 방문예약 없이 이용대기 시간 바로 입장친목친구
1858789843,효도치킨 강남고속버스터미널점,,,점심에 방문예약 없이 이용대기 시간 바로 입장가족모임부모님
1858789843,효도치킨 강남고속버스터미널점,,,점심에 방문예약 없이 이용대기 시간 바로 입장가족모임친척・형제
1858789843,효도치킨 강남고속버스터미널점,,,점심에 방문예약 없이 이용대기 시간 바로 입장나들이혼자
1858789843,효도치킨 강남고속버스터미널점,,,점심에 방문예약 없이 이용대기 시간 바로 입장나들이혼자
1858789843,효도치킨 강남고속버스터미널점,,,점심에 방문예약 없이 이용대기 시간 바로 입장나들이혼자
1858789843,효도치킨 강남고속버스터미널점,,,점심에 방문예약 없이 이용대기 시간 바로 입장데이트연인・배우자
1858789843,효도치킨 강남고속버스터미널점,,,점심에 방문예약 없이 이용대기 시간 바로 입장데이트연인・배우자
1858789843,효도치킨 강남고속버스터미널점,,,점심에 방문예약 없이 이용대기 시간 바로 입장일상아이
1858789843,효도치킨 강남고속버스터미널점,,,점심에 방문예약 없이 이용대기 시간 바로 입장일상아이
1858789843,효도치킨 강남고속버스터미널점,,,점심에 방문예약 없이 이용대기 시간 바로 입장친목연인・배우자
1858789843,효도치킨 강남고속버스터미널점,,,"점심에 방문예약 없이 이용대기 시간 바로 입장친목지인・동료, 아이"
1858789843,효도치킨 강남고속버스터미널점,,,점심에 방문예약 없이 이용대기 시간 바로 입장친목친구
1858789843,효도치킨 강남고속버스터미널점,,,점심에 방문예약 후 이용대기 시간 바로 입장친목지인・동료
