가게ID,가게명,평점,날짜,리뷰내용
1858789843,효도치킨 강남고속버스터미널점,,,직원분은 엄청 친절했는데 치킨은 너무 짜서ㅠㅠ 아쉬웠어요ㅠㅠ 짜도너무짜서 아쉬웠습니더ㅠㅠ
1858789843,효도치킨 강남고속버스터미널점,,,진짜 바삭하고 짭쪼롬해서 맛있어요 서울에만 있어서 서울올때마다 먹어요 ^^ 친절하시고 좋습니다
1858789843,효도치킨 강남고속버스터미널점,,,추천맛집이라고 왔는데 꽈리멸치킨 별미네요. 튀김옷 바삭하고 기름 깨끗하네요. 멸치 완전바삭~ 꽈리꼬추는 조금 맵고요. 담엔 연근튀김들어간 양념치킨도 먹어보려고요.
1858789843,효도치킨 강남고속버스터미널점,,,터미널왔다가지나가는길에 유리넘어치킨을보고들어왔는데 맛도좋고 언니와 수다떨고 좋왔습니다...^^
1858789843,효도치킨 강남고속버스터미널점,,,특별한 메뉴의 치킨들이 있어서 근처 올일있을때 굳이 찾아왔어요!!! 넘 맛있어요!!! 팝콘 기본제공에 런치타임엔 컵라면도 무료제공이라니.. 치킨 계속 들어갈거 같아요ㅋㅋㅋ
1858789843,효도치킨 강남고속버스터미널점,,,효도치킨 좋아하는 아이들과 같이 방문했는데 아주 만족해요~느끼함을 잡아줄 떡볶이와 먹는것 추천드려요~
1858789843,효도치킨 강남고속버스터미널점,,,후라이드반 멸치고추간장치킨 반 먹었는데요 후라이드는 덭바속촉이고 멸치고추간장치킨도 안 느끼하고 좋아요 ㅎㅎㅎ 넘 맛있게 먹느라 사진도 못찍었어요^^
