가게ID,가게명,평점,날짜,리뷰내용
2046665158,사과당 창동역점,,,저녁에 방문예약 없이 이용대기 시간 바로 입장
2046665158,사과당 창동역점,,,저녁에 방문예약 없이 이용대기 시간 바로 입장데이트연인・배우자
2046665158,사과당 창동역점,,,저녁에 방문예약 없이 이용대기 시간 바로 입장데이트연인・배우자
2046665158,사과당 창동역점,,,저녁에 방문예약 없이 이용대기 시간 바로 입장일상아이
2046665158,사과당 창동역점,,,점심에 방문예약 없이 이용대기 시간 바로 입장데이트연인・배우자
2046665158,사과당 창동역점,,,점심에 방문예약 없이 이용대기 시간 바로 입장일상아이
2046665158,사과당 창동역점,,,점심에 방문예약 없이 이용대기 시간 바로 입장친목
2046665158,사과당 창동역점,,,점심에 방문포장·배달 이용대기 시간 바로 입장일상혼자
2046665158,사과당 창동역점,,,종류도 많고 맛있어보여서 방문했습니다ㅎㅎ매장도 귀엽고 쾌적해서 자주올거같습니다!!
2046665158,사과당 창동역점,,,직장동료들에게도 줬는데 맛있다고 담에 또 사오라고 하네여 ㅎㅎ
2046665158,사과당 창동역점,,,진짜 상큼한 맛에 기분이 좋아지는 느낌이었어요. 페스츄리는 바삭하면서도 달콤했고 사과밀크티에는 실제 사과가 들어있어서 상큼함이 살아있는 것 같았어요.
2046665158,사과당 창동역점,,,"최근에 생긴 매장이라 그런지 전체적으로 깔끔하고 정돈된 분위기가 좋았어요. 애플파이와 음료를 테이크아웃했는데, 애플파이는 겹겹이 쌓인 페스츄리가 겉은 바삭하고 속은 촉촉해 부드럽게 녹아들며 애플필링이 적당히 달콤해서 음료랑 잘 어울렸어요. 사과는 맛없어하는 과일중 하나인데 여기 애플파이는 정말 맛있네요!"
2046665158,사과당 창동역점,,,크림이 느끼하지 않고 입안에서 담백하게 어우러지는 맛이었어요 페스츄리의 바삭한 식감도 좋았고 사과밀크티는 달달하면서도 상큼한 느낌이 특별했던 것 같아요
2046665158,사과당 창동역점,,,페스츄리 맛이 있고 사과밀크티도 괜찮네요 이색 메뉴로 애플히비스커스도 있어 좋았어요
2046665158,사과당 창동역점,,,페스츄리 식감이 정말 좋네요 바삭함과 부드러움이 공존해서 한 입 베어 물면 고소한 풍미가 입안에 퍼져요 사과밀크티도 달콤한 맛이 일품이라 완벽한 조합이었어요
2046665158,사과당 창동역점,,,페스츄리 식감이 정말 좋네요 부드러우면서도 바삭해서 한입에 쏙쏙 들어가요 사과밀크티도 달달하고 시원해서 페스츄리랑 먹으니 환상적인 조합이었어요
2046665158,사과당 창동역점,,,페스츄리가 정말 부드럽고 달콤하면서도 크림이 느끼하지 않고 맛있어요 사과밀크티도 깔끔한 맛이라 자주 찾게 되네요
2046665158,사과당 창동역점,,,후렌치파이가 입맛에 맞더라구요 음료도 사과관련 음료가 많아서 사과좋아하는 분들한텐 천국일듯요
1033146766,스타벅스 도봉로DT점,,,"넖고 자리 간격도 좋네요. 직원들 대응도 좋아요. 그런데 앞손님들이 바닥을 지저분하게 사용했는데, 청소가 약간 미비하네요. 다른 부분은 모두 Good 입니다."
1033146766,스타벅스 도봉로DT점,,,"넖고 자리 간격도 좋네요. 직원들 대응도 좋아요. 그런데 앞손님들이 바닥을 지저분하게 사용했는데, 청소가 약간 미비하네요. 다른 부분은 모두 Good 입니다."
1033146766,스타벅스 도봉로DT점,,,"드라이브스루 이용했고,친절하세요 ㅎㅎ"
1033146766,스타벅스 도봉로DT점,,,드라이브스루 항상 이용하기 편해요!!
1033146766,스타벅스 도봉로DT점,,,"드라이브스루로 편하게 이용했고,빠릅니다!!"
1033146766,스타벅스 도봉로DT점,,,"리뷰 563사진 1,061팔로워 16"
1033146766,스타벅스 도봉로DT점,,,"리뷰 563사진 1,061팔로워 16"
1033146766,스타벅스 도봉로DT점,,,바닐라크림 콜드브루와 아아 얼음 가득을 주문했는데 아이스 바닐라라떼과 얼음이 중간 까지 밖에 없는 아아가 나왔네요
1033146766,스타벅스 도봉로DT점,,,바닐라크림 콜드브루와 아아 얼음 가득을 주문했는데 아이스 바닐라라떼과 얼음이 중간 까지 밖에 없는 아아가 나왔네요
1033146766,스타벅스 도봉로DT점,,,사람이 많아서 자리가 많지는않았지만 좋았음. 밀크티 맛이 별로 진하진 않았음. 매장이 이쁘다!
1033146766,스타벅스 도봉로DT점,,,시원하고 맛있게 커피와 음료 먹고 갑니다.주문시 친절히 안내해주어 감사합니다
1033146766,스타벅스 도봉로DT점,,,시원하고 맛있게 커피와 음료 먹고 갑니다.주문시 친절히 안내해주어 감사합니다
1033146766,스타벅스 도봉로DT점,,,신랑이랑 애용하는 매장이에요.그런데 오늘 자리가 꽉차서 테이크아웃 했네요 슬펐어요
1033146766,스타벅스 도봉로DT점,,,신랑이랑 애용하는 매장이에요.그런데 오늘 자리가 꽉차서 테이크아웃 했네요 슬펐어요
1033146766,스타벅스 도봉로DT점,,,"음료 정리대에는 필요한 품목을 문의하라는 멘트가 적혀있지만, 도봉로 dt점에는 적용 안되는 내용인가봄."
1033146766,스타벅스 도봉로DT점,,,"음료 정리대에는 필요한 품목을 문의하라는 멘트가 적혀있지만, 도봉로 dt점에는 적용 안되는 내용인가봄."
1033146766,스타벅스 도봉로DT점,,,저녁에 방문예약 없이 이용대기 시간 바로 입장데이트연인・배우자
1033146766,스타벅스 도봉로DT점,,,저녁에 방문예약 없이 이용대기 시간 바로 입장일상부모님
1033146766,스타벅스 도봉로DT점,,,저녁에 방문예약 없이 이용대기 시간 바로 입장일상지인・동료
1033146766,스타벅스 도봉로DT점,,,저녁에 방문예약 없이 이용대기 시간 바로 입장일상지인・동료
1033146766,스타벅스 도봉로DT점,,,저녁에 방문예약 없이 이용대기 시간 바로 입장일상친구
1033146766,스타벅스 도봉로DT점,,,저녁에 방문예약 없이 이용대기 시간 바로 입장일상친구
1033146766,스타벅스 도봉로DT점,,,저녁에 방문예약 없이 이용대기 시간 바로 입장일상친구
1033146766,스타벅스 도봉로DT점,,,저녁에 방문예약 없이 이용대기 시간 바로 입장일상혼자
1033146766,스타벅스 도봉로DT점,,,저녁에 방문예약 없이 이용대기 시간 바로 입장회식지인・동료
1033146766,스타벅스 도봉로DT점,,,저녁에 방문예약 없이 이용대기 시간 바로 입장회식지인・동료
1033146766,스타벅스 도봉로DT점,,,점심에 방문대기 시간 10분 이내 일상혼자
1033146766,스타벅스 도봉로DT점,,,점심에 방문대기 시간 10분 이내 일상혼자
1033146766,스타벅스 도봉로DT점,,,점심에 방문예약 없이 이용대기 시간 10분 이내 일상혼자
1033146766,스타벅스 도봉로DT점,,,점심에 방문예약 없이 이용대기 시간 10분 이내 일상혼자
1033146766,스타벅스 도봉로DT점,,,점심에 방문예약 없이 이용대기 시간 바로 입장데이트연인・배우자
1033146766,스타벅스 도봉로DT점,,,점심에 방문예약 없이 이용대기 시간 바로 입장데이트연인・배우자
1033146766,스타벅스 도봉로DT점,,,점심에 방문예약 없이 이용대기 시간 바로 입장데이트연인・배우자
1033146766,스타벅스 도봉로DT점,,,점심에 방문예약 없이 이용대기 시간 바로 입장데이트연인・배우자
1033146766,스타벅스 도봉로DT점,,,점심에 방문예약 없이 이용대기 시간 바로 입장데이트연인・배우자
1033146766,스타벅스 도봉로DT점,,,점심에 방문예약 없이 이용대기 시간 바로 입장데이트연인・배우자
1033146766,스타벅스 도봉로DT점,,,점심에 방문예약 없이 이용대기 시간 바로 입장일상혼자
1033146766,스타벅스 도봉로DT점,,,점심에 방문예약 없이 이용대기 시간 바로 입장일상혼자
1033146766,스타벅스 도봉로DT점,,,점심에 방문예약 없이 이용대기 시간 바로 입장일상혼자
1033146766,스타벅스 도봉로DT점,,,"주말마다 와서 공부도하고 독서도 하는 우리동네 스벅♡ 어느새 매주 오게되는 최애장소가 되었다. 첨엔 깨끗하고(특히 화장실은 넓고 깨끗ㅡ요즘 사람이 많아져서 예전만하진 못해도 깨끗, 바닥도 예전같진 않지만 그래도 괜츈) 조용하고, 음악도 공부하기 좋아서 자주왔는데, 단골인걸 아는지 사이렌오더 하면 늘 달라고 했던 물과 물티슈를 알아서 챙겨놔주는 센~~~스있는 스텝들에게 반함💗👍친절한 스텝도 즐겨찾는 이유중 하나♡가 되었네요^^"
1033146766,스타벅스 도봉로DT점,,,"주말마다 와서 공부도하고 독서도 하는 우리동네 스벅♡ 어느새 매주 오게되는 최애장소가 되었다. 첨엔 깨끗하고(특히 화장실은 넓고 깨끗ㅡ요즘 사람이 많아져서 예전만하진 못해도 깨끗, 바닥도 예전같진 않지만 그래도 괜츈) 조용하고, 음악도 공부하기 좋아서 자주왔는데, 단골인걸 아는지 사이렌오더 하면 늘 달라고 했던 물과 물티슈를 알아서 챙겨놔주는 센~~~스있는 스텝들에게 반함💗👍친절한 스텝도 즐겨찾는 이유중 하나♡가 되었네요^^"
1033146766,스타벅스 도봉로DT점,,,"집근처에 스벅이 생기고 평일은 출근을 해서 못오지만 주말은 공부하고 책읽으러 자주 이용해요. 공간분리도 잘 되어있고, 아늑하고, 깨끗해요. 우리동네 도봉로DT점은 문화공간 같아서 정감가고 좋아요."
1033146766,스타벅스 도봉로DT점,,,"집근처에 스벅이 생기고 평일은 출근을 해서 못오지만 주말은 공부하고 책읽으러 자주 이용해요. 공간분리도 잘 되어있고, 아늑하고, 깨끗해요. 우리동네 도봉로DT점은 문화공간 같아서 정감가고 좋아요."
1033146766,스타벅스 도봉로DT점,,,"평일 근무하고 주말만 오다가 시험, 실습 준비로 매일 오게 되는데, 나에게는 편안한 공간이다"
1033146766,스타벅스 도봉로DT점,,,"평일 근무하고 주말만 오다가 시험, 실습 준비로 매일 오게 되는데, 나에게는 편안한 공간이다"
1178024981,스타벅스 창동역점카페,,,라떼 부드럽고 맛있어요 30분뒤 one more coffee 쿠폰도 받을수 있는것도 좋아요
1178024981,스타벅스 창동역점카페,,,"매장 규모는 작은 편. 위치가 좋아서 사람 무지하게 많습니다. 인테리어는 예쁘나 불편한 의자(높은 의자)가 좀 있고, 좌석간 간격이 매우 좁은 편입니다."
1178024981,스타벅스 창동역점카페,,,밥먹고 스벅~사진박물관 갔다가 오픈 시간이 안되어 밥먹고 차마시며 대기하다 들어감.커피나 디저트는 언제나 아는 그맛을 선호하게 됨.아쉽다면 옆 좌석과 거리가 너무 가까워서 남의 사생활도 본의 아니게 듣게 된다는 사실~
1178024981,스타벅스 창동역점카페,,,사진박물관 근처에있어요.좌석구도 좋고 햇살이 믾이 들어와서 밝아요. 좋아요
1178024981,스타벅스 창동역점카페,,,서울시립 사진박물관 방문하러가다가 스타벅스가 보여서 들어왔어요. 북적북적.... 주문하는 분들이 많네요. 시간 걸린다고 친절히 안내... 오래간만에 닉네임 불러주네요.
1178024981,스타벅스 창동역점카페,,,서울시립사진미술관 근처에 있습니다. 같은 건물 3층 거궁에서 점심 먹고 들렀어요. 창동역과 미술관 사이에 있어서 교통이 편리해요.
1178024981,스타벅스 창동역점카페,,,아이스도 작은 사이즈 있으면 좋겠다요
1178024981,스타벅스 창동역점카페,,,아침에 방문예약 없이 이용대기 시간 바로 입장일상지인・동료
1178024981,스타벅스 창동역점카페,,,아침에 방문예약 없이 이용대기 시간 바로 입장일상친구
1178024981,스타벅스 창동역점카페,,,아침에 방문예약 없이 이용대기 시간 바로 입장일상혼자
1178024981,스타벅스 창동역점카페,,,아침에 방문포장·배달 이용대기 시간 바로 입장일상혼자
1178024981,스타벅스 창동역점카페,,,여기매장 남자직원은 엄청친절하신데 여자직원분 정말 어이가없어서 망고만 자주 사먹는데 저번에도 음료제조후 바로 주지않구 믹서기부터 세척하구 물뚝뚝떨어진 손으로 뚜껑닫아 줬어요 당연히 물묻은채로 받았어요 뚜껑닫으면서 손에 물이 내용물에 떨어질수 있는데 찝찝하지만 그냥받았어요 근데또 오늘도 똑같은 상황으로 주길래 원래믹서기부터 세척후에 음료주는게 룰이냐고 물었더니 그런건 아니래요
1178024981,스타벅스 창동역점카페,,,여긴 노트북 하기 좋은데 충전 가능한 자리 찾기 어려워요! 시간대는 일정 하진 않고 운 좋으면 바로 앉을 수 있어요! 5시 이후로는 널널한편! 점심시간 대는 그냥 사람이 너무 많음!
1178024981,스타벅스 창동역점카페,,,오랜만에 아메리카노를 마셨습니다. 시원하고 기분이 좋네요. 또 마시고 싶습니다.
1178024981,스타벅스 창동역점카페,,,저녁에 방문예약 없이 이용대기 시간 바로 입장비즈니스혼자
1178024981,스타벅스 창동역점카페,,,"저녁에 방문예약 없이 이용대기 시간 바로 입장일상아이, 연인・배우자"
1178024981,스타벅스 창동역점카페,,,저녁에 방문예약 없이 이용대기 시간 바로 입장일상지인・동료
1178024981,스타벅스 창동역점카페,,,저녁에 방문예약 없이 이용대기 시간 바로 입장일상지인・동료
1178024981,스타벅스 창동역점카페,,,저녁에 방문예약 없이 이용대기 시간 바로 입장일상지인・동료
1178024981,스타벅스 창동역점카페,,,저녁에 방문예약 없이 이용대기 시간 바로 입장일상혼자
1178024981,스타벅스 창동역점카페,,,저녁에 방문예약 없이 이용대기 시간 바로 입장친목친구
1178024981,스타벅스 창동역점카페,,,저녁에 방문포장·배달 이용대기 시간 바로 입장
1178024981,스타벅스 창동역점카페,,,저녁에 방문포장·배달 이용대기 시간 바로 입장
1178024981,스타벅스 창동역점카페,,,점심에 방문예약 없이 이용대기 시간 바로 입장나들이지인・동료
1178024981,스타벅스 창동역점카페,,,점심에 방문예약 없이 이용대기 시간 바로 입장데이트연인・배우자
1178024981,스타벅스 창동역점카페,,,점심에 방문예약 없이 이용대기 시간 바로 입장데이트연인・배우자
1178024981,스타벅스 창동역점카페,,,점심에 방문예약 없이 이용대기 시간 바로 입장여행친척・형제
1178024981,스타벅스 창동역점카페,,,"점심에 방문예약 없이 이용대기 시간 바로 입장연인・배우자, 아이"
1178024981,스타벅스 창동역점카페,,,점심에 방문예약 없이 이용대기 시간 바로 입장일상친구
1178024981,스타벅스 창동역점카페,,,점심에 방문예약 없이 이용대기 시간 바로 입장일상친구
1178024981,스타벅스 창동역점카페,,,점심에 방문예약 없이 이용대기 시간 바로 입장일상친구
1178024981,스타벅스 창동역점카페,,,점심에 방문예약 없이 이용대기 시간 바로 입장일상혼자
1178024981,스타벅스 창동역점카페,,,점심에 방문예약 없이 이용대기 시간 바로 입장일상혼자
1178024981,스타벅스 창동역점카페,,,점심에 방문예약 없이 이용대기 시간 바로 입장친구
1178024981,스타벅스 창동역점카페,,,"점심에 방문예약 없이 이용대기 시간 바로 입장친목, 나들이친구"
1178024981,스타벅스 창동역점카페,,,점심에 방문예약 없이 이용대기 시간 바로 입장친목지인・동료
1178024981,스타벅스 창동역점카페,,,점심에 방문예약 없이 이용대기 시간 바로 입장친목친구
1178024981,스타벅스 창동역점카페,,,점심에 방문예약 없이 이용대기 시간 바로 입장친목친구
1178024981,스타벅스 창동역점카페,,,점심에 방문예약 후 이용대기 시간 바로 입장일상혼자
1178024981,스타벅스 창동역점카페,,,점심에 방문포장·배달 이용대기 시간 바로 입장
1178024981,스타벅스 창동역점카페,,,점심에 방문포장·배달 이용대기 시간 바로 입장
1178024981,스타벅스 창동역점카페,,,창동에서 식사하고 갔어요! 항상 사람이 많아요. 그래도 직원이 친절합니다. 커피에 샷 추가 하니 더 맛있었어요!
1178024981,스타벅스 창동역점카페,,,"치킨브레스트 샌드위치 안에 베이컨, 계란, 닭가슴살햄 구성 베이컨 때문에 조금 짜게 느껴짐"
1178024981,스타벅스 창동역점카페,,,커피가 너무 맛있고 케잌도 부드럽고 달콤해 커피랑 비오는날 딱이예요
1178024981,스타벅스 창동역점카페,,,항상 사람이 많아요. 라떼아트 해 주셨네요. 좋아여
1178024981,스타벅스 창동역점카페,,,화장실이 미로 처럼 한참을 찾아 갔다와야 함 ㅋㅋㅋ
1970712453,탐앤탐스 창동본점,,,3층까지 단독건물이라 넓고 조용한 카페예요. 조용해서 대화나누기도 책읽기도 좋아요. 커피 맛있고 주차할수 있는 점도 좋아요. 한가지 많이 아쉬운 점은 화장실인데 건물이 오래됐는지 화장실이 좀 많이 낡아서 솔직히 볼일 보러 가고 싶은 마음이 안들어요. 카페의 인테리어나 분위기랑 너무 안 맞아서 며칠 문 닫더라도 깔끔하게 공사하시는 게 더 나을거 같아요. 특히 여자손님들은 화장실이 매우 중요한데 다른 좋은 점들이 화장실 하나로 다 가려진다는 생각입니다.
1970712453,탐앤탐스 창동본점,,,넓은 책상 있어서 팀플이나 공부하기 좋을것같아요! 주차공간도 있고 늦게까지 해서 좋음 👍
1970712453,탐앤탐스 창동본점,,,"다른거 다 좋은데, 알바분 불쌍해 죽겠어요. 공휴일 가장 바쁜 점심 이후 2-3시 인데 혼자 일하고 계시더라구요,, 1,2,3층 모두 만석이 주문 대기열도 길게 늘어져 있는데 진짜 죽어라 음료만 만들고 계시고 손님들 눈치보랴 주문 받으랴 몸이 열개라도 부족한 느낌이었어요,, 한 분이 이 많은 손님들 다 받고 음료 만드는거 너무 대단하게 느껴졌는데 한편으로는 사장님이 너무 악덕하다는 생각이 들게 되더군요,, ㅠ 운영비 절감이 그토록 절실했나요.. ㅎㅎ 알바분들 힘내시구.. 다른 곳으로 튀튀 하심이 좋을 듯 싶네요.."
1970712453,탐앤탐스 창동본점,,,딸기라떼는 먹을때마다 씹히는 딸기 과육이 너무 달지도 않고 맛있었어요! 딸기 과육이 정말 진해서 너무 맛있었습니당!
1970712453,탐앤탐스 창동본점,,,레몬 생강차 맛나요~~ 조용하고 좋아요 일찍열어서 더 좋은듯 해요~^^
1970712453,탐앤탐스 창동본점,,,"몇번 올때마다 느끼는건데 재떨이 청소 좀 하면 좋겠네요.. 흡연실 있는것과 자정까지 영업하는게 그나마 장점인 곳인데, 매시간 할수는 없다해도 두세시간에 한번씩만 청소하면 저정도로 쌓이지않습니다. 직원 숫자가 부족한것도 아니고 돌아가면서 한번씩 하면 좋겠네요"
1970712453,탐앤탐스 창동본점,,,밤늦게까지 하는 카페가 다 없어지는 이 시국에 넘나리 고마운 곳 주차도 편하고 매장도 넓어서 편해요!
1970712453,탐앤탐스 창동본점,,,아침 일찍 가서 모닝커피와 베이글 먹었어요. 넓진 않지만 몇대라도 주차할수 있는 곳이라 좋았어요. 건물 하나 통째로 3층까지 있어 넓어요. 따뜻한 베이글이 좋았고 체다치즈 베이글 정말 맛있어요. 의자가 엄청 편하지는 않은데 좌석간 간격이 넓어서 좋아요. 인테리어가 엄청 예쁘지는 않지만 넓고 흡연실이 따로 있고 공간도 넓어서 답답하지 않아요. 벽에 화가의 작품이 걸려있어요.
1970712453,탐앤탐스 창동본점,,,아침에 방문예약 없이 이용대기 시간 바로 입장데이트연인・배우자
1970712453,탐앤탐스 창동본점,,,아침에 방문예약 없이 이용대기 시간 바로 입장비즈니스
1970712453,탐앤탐스 창동본점,,,아침에 방문예약 없이 이용대기 시간 바로 입장일상지인・동료
1970712453,탐앤탐스 창동본점,,,아침에 방문예약 없이 이용대기 시간 바로 입장일상혼자
1970712453,탐앤탐스 창동본점,,,아침에 방문예약 없이 이용대기 시간 바로 입장일상혼자
1970712453,탐앤탐스 창동본점,,,아침에 방문예약 없이 이용대기 시간 바로 입장일상혼자
1970712453,탐앤탐스 창동본점,,,아침에 방문예약 없이 이용대기 시간 바로 입장친목친구
1970712453,탐앤탐스 창동본점,,,아침에 방문예약 없이 이용대기 시간 바로 입장친목친구
1970712453,탐앤탐스 창동본점,,,오랜만에 예전에 가보고 몇년만에 왔는데 커피맛이 마악 나쁘지는 않아요.. 잘마시고 갑니다 일찍열어서 좋네요~
1970712453,탐앤탐스 창동본점,,,"이번에 새로나온 딸기 시즌 메뉴 중 베리애플파이와 베리 크림치즈파이, 딸기라떼와 블루베리 요거트 스무디를 먹었는데요! 상큼달콤한 딸기 파이와 과일음료를 같이 먹으니 정말 잘어울리고 과일로 당충전을 한 느낌이었어요! ❤️ 파이 반죽도 고소하고 안에 들어있는 필링이 너무 맛있어서 계속 먹고싶은 맛이에요!"
1970712453,탐앤탐스 창동본점,,,"저녁에 방문예약 없이 이용대기 시간 바로 입장데이트, 친목친구"
1970712453,탐앤탐스 창동본점,,,저녁에 방문예약 없이 이용대기 시간 바로 입장일상
1970712453,탐앤탐스 창동본점,,,"저녁에 방문예약 없이 이용대기 시간 바로 입장일상, 가족모임친척・형제"
1970712453,탐앤탐스 창동본점,,,저녁에 방문예약 없이 이용대기 시간 바로 입장일상혼자
1970712453,탐앤탐스 창동본점,,,저녁에 방문예약 없이 이용대기 시간 바로 입장친목지인・동료
1970712453,탐앤탐스 창동본점,,,저녁에 방문예약 없이 이용대기 시간 바로 입장친목친구
1970712453,탐앤탐스 창동본점,,,점심에 방문예약 없이 이용대기 시간 바로 입장
1970712453,탐앤탐스 창동본점,,,점심에 방문예약 없이 이용대기 시간 바로 입장나들이부모님
1970712453,탐앤탐스 창동본점,,,점심에 방문예약 없이 이용대기 시간 바로 입장데이트연인・배우자
1970712453,탐앤탐스 창동본점,,,"점심에 방문예약 없이 이용대기 시간 바로 입장데이트연인・배우자, 아이"
1970712453,탐앤탐스 창동본점,,,점심에 방문예약 없이 이용대기 시간 바로 입장일상지인・동료
1970712453,탐앤탐스 창동본점,,,점심에 방문예약 없이 이용대기 시간 바로 입장일상친구
1970712453,탐앤탐스 창동본점,,,점심에 방문예약 없이 이용대기 시간 바로 입장일상친구
1970712453,탐앤탐스 창동본점,,,점심에 방문예약 없이 이용대기 시간 바로 입장일상친구
1970712453,탐앤탐스 창동본점,,,점심에 방문예약 없이 이용대기 시간 바로 입장일상혼자
1970712453,탐앤탐스 창동본점,,,점심에 방문예약 없이 이용대기 시간 바로 입장일상혼자
1970712453,탐앤탐스 창동본점,,,점심에 방문예약 없이 이용대기 시간 바로 입장일상혼자
1970712453,탐앤탐스 창동본점,,,점심에 방문예약 없이 이용대기 시간 바로 입장일상혼자
1970712453,탐앤탐스 창동본점,,,점심에 방문예약 없이 이용대기 시간 바로 입장일상혼자
1970712453,탐앤탐스 창동본점,,,점심에 방문예약 없이 이용대기 시간 바로 입장일상혼자
1970712453,탐앤탐스 창동본점,,,"종종 갔던 탐탐 창동본점, 오랜만에 방문하여 이런 리뷰 쓰는 것이 어떻게든 스스로 아침부터 탐탐 창동본점을 방문하여 망친 기분, 너무 기분 나쁜 하루의 시작에 대한 대응입니다. 입구 들어가자마자 일하는 분에게 인사를 했지만, 너무 불친절한 대응 뿐이고, 요즘은 그럴 수 있다거나 피곤하겠지 생각했지만 너무 도가 지나쳐 글을 남깁니다. 영수증 받을 때 마저 왜 이렇게 시비를 거는 것인가 생각이 들었어요."
