가게ID,가게명,평점,날짜,리뷰내용
1970712453,탐앤탐스 창동본점,,,주차 공간도 좀 있고🤓 내부 공간이 넓어서 반드시 자리가 있을 거라는 확신을 주는 카페죠.😄👍🏻 건물 안에 엘리베이터가 있어서 위아래로 이동하기도 좋고요.🤗 그렇지만 1층에도 테이블이 충분히 여유로워서🤩 굳이 올라갈 생각을 하지 않고 적당히 자리 잡고 앉아😎 커피☕ 한 잔과 함께... 여유롭게 이야기 나누고 왔습니다.😘
1970712453,탐앤탐스 창동본점,,,책읽으러 자주 오는 곳입니다 작업하거나 책읽으러 오기 좋아요
1970712453,탐앤탐스 창동본점,,,크림치즈 프레즐과 페퍼로니 프레즐 먹었는데 둘 다 너무 맛있었어용!! 체다치즈 소스랑 갈릭디핑 소스랑 너무 잘어울려요! 비쥬얼 최고 맛도 최고..!! 출출할때 탐탐 프레즐만한게 없는것같아용! 창동본점은 자주 방문하는데 올때마다 매장이 넓고 쾌적해서 너무 좋아요!💕
1970712453,탐앤탐스 창동본점,,,탐앤탐스의 신메뉴인 떡꼬치 프레즐과 떡꼬치 도그 프레즐을 먹었습니다! 떡꼬치 프레즐은 이름과 같이 쫀득쫀득한 프레즐과 매콤달콤한 떡꼬치 소스가 정말 잘 어우러지는 맛이었어요! 🥨❤️
1970712453,탐앤탐스 창동본점,,,"허니자몽 얼그레이 맛있어요! 3층까지 있어서 좋고, 공부하기 좋습니다!"
1764135520,프롬더하트,,,"감사한 분께 답례로 선물세트 고민하고 있었는데 딱 해결!! 포장 너무 깔끔해서 만족스러움 ❤️ 사장님 정말 스윗 친절하시고, 진짜 리뷰대로 호두파이 맛있네요!!! 선물 외로 특히 호두파이 먹어보고 싶었는데 다 나가서 아쉬웠던 찰나 사장님께서 냉장고에서 꺼내주심 🥹 아껴먹으려고 했는데 집가는 길에 한입 두입 먹다가 멈추지 못하고 다 먹어버렸어요.. 호두파이 그리고 다른 애들(?)도 먹으러 또 갈껍니다.!!! + 에그스콘 꿀맛.."
1764135520,프롬더하트,,,감사합니다 쌀가루를 사용해 만든 디저트라 어른들 드시기도 참 좋아요 항상 정성을 다하겠습니다^^
1764135520,프롬더하트,,,급하게 당일 주문으로 부탁드렸는데 너무 예쁘고 먹음직스럽게 만들어주셨어요! ㅎㅎㅎ 진짜 금손이신 사장님 서비스 포춘쿠키까지 감사합니다🙂 다음에 또 이용할거에요>.<
1764135520,프롬더하트,,,다른 어느곳과도 비교불가한 프롬더하트 호두파이에요
1764135520,프롬더하트,,,답례품 포장 고급스럽게 잘해주시고 구성도 깔끔하고 좋아요 서비스 주신 오란다 넘 맛있어요!
1764135520,프롬더하트,,,도봉구 맘카페에서 앙금케이크 예쁘게 해주는 집으로 유명하다길래 팔로우하고 있었는데 마침 크리스마스 딸기 생크림 케이크도 예약 주문 받으시길래 냉큼 주문했어요. 크리스마스때 외부 행사와 여행계획이 있기도 하고 가족 생일도 있어서 겸사겸사 미리 케이크 주문해서 먹었는데 역시는 역시. 딸기가 너~무 많아요! 🍓 먹어도 먹어도 계속 나오고 시트 사이에도 딸기가 가득가득. 딸기 좋아하는 저희 아이들 딸기 원없이 먹었어요.♥️ 해피해피
1764135520,프롬더하트,,,"떡케이크는 처음인데 모양도 예쁘고, 맛도 자극적이지않고 좋았어요 💛"
1764135520,프롬더하트,,,맞춤 떡케이크로 기념일이 더욱 빛났어요. 떡도 맛있었어요.
1764135520,프롬더하트,,,매장이 너무 청결하고 사장님 진짜 친절하시구 무엇보다 케이크 퀄리티가 대박입니다!!!또 올 의사있어요!!!!
1764135520,프롬더하트,,,사장님 친절하시고 가게도 예뻐요. 가격도 합리적이고요. 선물하기에 좋네요^^~~
1764135520,프롬더하트,,,"사장님께서 이런저런 피드백을 주셨어요. 정성스런 상담에 믿음10000퍼ㅠㅠ다른 가게들보다는 훨씬 저렴한 가격에 원하는 디자인으로 잘 나왔습니다..당일날 아침에도 왕관을 올릴지말지 카톡으로 연락을주시고, 제가 말씀드리지않은 사소한 부분까지 다 챙겨주셨어요. 행사일정도 세심하게 체크해주시고..그냥 친이모가 운영하는 케이크가게에서 구매한느낌이랄까. 재방문재구매의사1000퍼 번창하세요사장님!"
1764135520,프롬더하트,,,"시간이 없어서 자세한건 묻지도 않고 일단 주문부터 했었는데여,, 케잌 받고 무게부터 뭔가 다르다..? 했거든요 한입 드셔보시더니 일반 빵케잌은 아니다, 특이하다, 평소 먹던 케잌에 비해 훨 맛있다고 극찬을 하섰습니당!"
1764135520,프롬더하트,,,아 그리고 제가 워낙 뭘 결정할 때 고민 많이 하고 결정하는 편인데 사장님께서 친절하게 상담해 주셔서 도움이 많이 되었어요 ꯁ 덕분에 특별한 날 더 의미 있게 보낼 수 있었네용 감사합니다! 다음에 꼭 재주문 할게요 🤎
1764135520,프롬더하트,,,아버지 칠순기념 가족행사에 2단 케이크 주문했습니다~ 너무 예쁘게 만들어 주셔서 가족행사를 잘 마칠수 있었습니다~~^^ 식구들 모두 너무 잘했다고 칭찬도 받았네요~~^^ 프롬더하트 사장님 덕분에 행복했습니다~ 감사합니다!!!
1764135520,프롬더하트,,,아침에 방문예약 후 이용대기 시간 바로 입장기념일
1764135520,프롬더하트,,,아침에 방문예약 후 이용대기 시간 바로 입장기념일아이
1764135520,프롬더하트,,,"아침에 방문예약 후 이용대기 시간 바로 입장기념일연인・배우자, 아이"
1764135520,프롬더하트,,,"여기 단골인데요 리뷰는 처음 쓰네요. 작년에 친정엄마 생신때 떡케이크 주문하면서 알게 된 곳입니다. 그러면서 호두파이랑 오란다, 마들렌 이것저것 간식들을 먹어봤는데 일단 다~너무너무 맛있어요. 사진엔 없지만 떡케이크 떡도 쫀득하니 적당히 달달해서 어린 조카 아이도 맛있다면서 너무 잘먹더라구요. 쌀찜?인가 암튼 캐릭터 케이크도 예쁘고 맛있어요."
1764135520,프롬더하트,,,오늘 아빠환갑맞이해서 미리예약하고 왔는데 너무이브게 잘해주셔서 대만족합니당 ㅎㅎㅎㅎ
1764135520,프롬더하트,,,임신중인데 또생각나서 선물용들이랑 같이 주문했는데도 빠른시일내에 만들어주셔서감사합니다사장님!!
1764135520,프롬더하트,,,저녁에 방문예약 없이 이용대기 시간 바로 입장아이
1764135520,프롬더하트,,,저녁에 방문예약 후 이용대기 시간 바로 입장데이트연인・배우자
1764135520,프롬더하트,,,점심에 방문예약 없이 이용대기 시간 바로 입장일상혼자
1764135520,프롬더하트,,,점심에 방문예약 없이 이용대기 시간 바로 입장일상혼자
1764135520,프롬더하트,,,제가 에그타르트 페스츄리보다 스콘으로 만들걸 더 좋아하는데 근처에 파는데가 생각보다 없더라구요ㅠ 근데 가까운곳에 있을줄이야ㅋㅋㅋ매일 판매하는건 아니라 먹고 싶을때 미리 문의하고 자주 사러 가야겠어요~~ㅎㅎㅎ 아 포춘쿠키도 너무 맛있다능~~
1764135520,프롬더하트,,,제가 원한 도넛과 음료로 상자에 리본까지 예쁘게 묶어 주신 정성에 감동했습니다!!
1764135520,프롬더하트,,,"주문의뢰 연락 때부터 사장님이 너무 친절하셔서 믿고 주문했는데, 픽업당일 케이크 가지러 갔을 때 기대이상으로 케이크가 너무너무 마음에 들고 예뻐서 기분이 너무 좋았어요! 맛도 사장님이 자부하신만큼 너무 맛있었고요!🌸 다음에 또 주문할거에요! 오란다도 짱짱!"
1764135520,프롬더하트,,,지난번 떡케이크 이후 두번째 주문인데 오늘도 너무 이쁘게 잘 만들어주셔서 만족 ♥
1764135520,프롬더하트,,,친절하게 안내 잘 해주시고 무엇보다 케이크가 예뻐요. 가족 모두 좋아했어요.감사합니다
1764135520,프롬더하트,,,"케이크 주문 이전에도 디저트들을 먹어보고, 선물도 했었는데 선물 받은 지인들도 다들 맛있다고 좋아하셨어요! 선물용으로 추천합니다 포장도 예쁘게 해주셔요🫶"
1764135520,프롬더하트,,,케이크도 예쁘게 나와서 아주 좋아요 ! 영수증 리뷰 한다고 말씀드려서 서비스 하나 주시는 줄 알았는데 안하셔도 하나 드리려 했다고 하시면서 호두파이 두개 받았습니당 혜자로운 사장님~~~
1764135520,프롬더하트,,,케이크도 이쁘고 사장님도 친절하시구 엄마가 너무 좋아하실거같아요~ 다음에 또 주문할께용👍👍
1764135520,프롬더하트,,,호두랑 콩고물 세트로 시켜서 답례품으로 선물했는데 건강하고 고소한맛이라고 좋아하시네요^^ 주문친절하게 잘받아주셔서 만족해요!!!
