가게ID,가게명,평점,날짜,리뷰내용
1517232276,"도봉관카페,디저트",,,#부드러운 버터크림라떼 #맛좋음 #분위기있는곳 #뷰맛카페 #다 떠나서 사장님이 친절해요🤭💕
1517232276,"도봉관카페,디저트",,,3번 왔던 곳인데 올때마다 친절하시고 치즈케이크 정말 맛있습니다 :) 인테리어도 너무 이쁘고 커피도 항상 일정하게 추출해주시는 것 같아요. 근처에 이런 카페가 없어서 오래 오래 해주셨으면 좋겠네요 ! 잘먹고갑니다.
1517232276,"도봉관카페,디저트",,,3층짜리 건물에 테라스까지 있어서 조용하고 아늑한 느낌의 카페였어요. 화장실도 청결하고 무엇보다 층고도 높아서 확 트인 뷰를 느낄 수 있었습니다!
1517232276,"도봉관카페,디저트",,,가족들과 함께 밥 먹고 디저트 먹으러 왔는데 음료도 맛있고 치즈케이크 맛과 식감도 예술이네요^^
1517232276,"도봉관카페,디저트",,,가족들과 함께 밥 먹고 디저트 먹으러 왔는데 음료도 맛있고 치즈케이크 맛과 식감도 예술이네요^^
1517232276,"도봉관카페,디저트",,,개방감 있는 루프탑이라 여름에는 해질녘에 루프탑에서 커피 하시기 좋은듯해요♡(해쨍이라 뷰만보고 내려왔네요ㅋㅋ)
1517232276,"도봉관카페,디저트",,,근처 드라이브왔다가 평이 좋아서 와봤는데 가게 분위기도 좋고 인테리어 너무 멋있어요. 바빠서 포장해가서 아쉽! 커피 맛도 맛있고 직원분들도 되게 친절하세요. 창동고 근처오시면 잠깐 쉬어가세요 ^^
1517232276,"도봉관카페,디저트",,,근처에 있는 루프탑 카페여서 왔는데 생각보다 너무 좋았어요~ 혹시 더울까봐 선풍기도 챙겨주시는 센스!! 예쁜 하늘과 적당히 시원하고 더운날 빙수 하니 먹으니 천국이 따로 없네요. 데이트하기도 딱 좋을 것 같고 혼자도 딱 좋고 친구들과 오기도 딱이에요!
1517232276,"도봉관카페,디저트",,,달달하고 크리미한 치즈케이크에 고소한 아메리카노 한잔🫶🏻 분위기도 맛도 좋은 도봉관💚 사장님이 너무 친절하셔서 먹기 전부터 기분이 좋아졌어요. 연하게 주믄했더니 남는 샷을 샷잔에 담아주시는 센스!!! 앞으로 제 카페는 여깁니다 ㅡㅡ (진지)
1517232276,"도봉관카페,디저트",,,도봉에 있는 치즈케이크 맛집 이예요♡ 꾸덕하고 달콤햐맛~매장도 깔끔하고 아기자기합니다♡
1517232276,"도봉관카페,디저트",,,루프탑도 있어올라가 봣는데 선선한 저녁에 너무 좋을거 같아요 아이가 먹고싶다는 팥빙수도 너무 예쁘네요 👍🏻 재방문해야겠어용 !!
1517232276,"도봉관카페,디저트",,,"마침 아이가 바스크치즈케이크를 먹고 싶다고 해서 방문은 처음인데,"
1517232276,"도봉관카페,디저트",,,많이 달지도 않은데 초코맛이 맛잇도 치즈맛도 세지않으먀 잘 어울립니당
1517232276,"도봉관카페,디저트",,,바닐라아이스크림이 있어 달달하면서 아몬드가 들어가 고소해요!
1517232276,"도봉관카페,디저트",,,"바스크도 맛있고, 스위트 블라썸도 향기가 너무 좋고 뷰 맛집이에요^^"
1517232276,"도봉관카페,디저트",,,바치케 종류가 다양한데 그릇도 플레이팅듀 너무이쁘고 블루베리바치케 향이나 맛도 넘 맛있고 치즈맛 많이 안강해서 좋아요><
1517232276,"도봉관카페,디저트",,,부모님 모시고 가족들과 생일축하겸 디저트 먹으려고 왔는데 수제 케이크 홀로 사서 생파도 하고 좋았어요
1517232276,"도봉관카페,디저트",,,사장님이 친절하시구 여기는 2층 통창이 답답함없이 공간을 이용할수있게 해주는거같아요
1517232276,"도봉관카페,디저트",,,"쌍문역근처에 가끔 오는데 드디어 취저 카페 발견 ㅠㅠ 전망좋고 층고높은~~ 조금 선선해지면 루프탑 오고싶네요*.* 주말오후에 창가 바 좌석에서 혼자 책 읽으며 좋은시간보냈습니다 대화하기에도 혼자 오기에도 아늑하고 분위기 좋습니다. 통창인데도 에어컨 빵빵해서 추울정도에요. 주차공간도 충분하고 사장님, 직원분들 모두 친절하시고 열심이 느껴지시네요! 바스크치즈케이크 궁금해서 포장해갑니당 ㅎㅎ"
1517232276,"도봉관카페,디저트",,,여자친구가 치케덕후인데 먹어 본 치케 중에 제일 맛있다네요 ㅎㅎㅎ 두번 세번 추천합니다.👍
1517232276,"도봉관카페,디저트",,,오래 전에 오픈 즈음에 오고 정말 오랜만에 왔는데 더 맛있어지고 분위기도 좋아졌네용~~ 친정 동네에 이런 감각있는 카페가 있어서 넘 다행입니당. 같이 온 가족들도 너무 좋아하셨어요.
1517232276,"도봉관카페,디저트",,,오래 전에 오픈 즈음에 오고 정말 오랜만에 왔는데 더 맛있어지고 분위기도 좋아졌네용~~ 친정 동네에 이런 감각있는 카페가 있어서 넘 다행입니당. 같이 온 가족들도 너무 좋아하셨어요.
1517232276,"도봉관카페,디저트",,,"원래 치즈맛을 느끼하다고 생각해서 좋아하지 않는 편인데, 여기 바스트 치즈케이크는 느끼하지도 않고 너무 맛있어서 자주 먹어요. 인테리어나 소품 하나까지 다 신경쓰신 것이 느껴지고 루프탑 뷰가 아주 멋있는 카페입니다!"
1517232276,"도봉관카페,디저트",,,인스타에서 촉촉한 바스크케이크로 유명해서 저장해둔 곳이에요!! 케이크 종류도 많아서 도장깨기 하는 재미가 있을것같아요!! 알바생분도 정말 넘 친절하시고 공간도 예뻐서 또 올것같아요 ~!~~! 1004😇 알바생분 넘 감사해요 🥺 사장님 보너스 많이 주세용 ㅎㅎ
1517232276,"도봉관카페,디저트",,,"저녁에 방문예약 없이 이용대기 시간 바로 입장친목, 나들이, 데이트친구, 연인・배우자, 지인・동료"
1517232276,"도봉관카페,디저트",,,"점심에 방문예약 없이 이용대기 시간 바로 입장데이트, 친목, 나들이연인・배우자"
1517232276,"도봉관카페,디저트",,,점심에 방문예약 없이 이용대기 시간 바로 입장데이트연인・배우자
1517232276,"도봉관카페,디저트",,,점심에 방문예약 없이 이용대기 시간 바로 입장데이트연인・배우자
1517232276,"도봉관카페,디저트",,,점심에 방문예약 없이 이용대기 시간 바로 입장데이트지인・동료
1517232276,"도봉관카페,디저트",,,점심에 방문예약 없이 이용대기 시간 바로 입장일상혼자
1517232276,"도봉관카페,디저트",,,점심에 방문예약 없이 이용대기 시간 바로 입장친목아이
1517232276,"도봉관카페,디저트",,,직원분이 엄청 친절하세요! 차를 처음 시켜서 몰랐는데 구성이 너무예뻐요. 얼음도 시럽도 각각 나눠서 넣을 수 있어서 농도를 맞출 수 있어서 좋아요👏🏻👏🏻
1517232276,"도봉관카페,디저트",,,직원분이 엄청 친절하세요! 차를 처음 시켜서 몰랐는데 구성이 너무예뻐요. 얼음도 시럽도 각각 나눠서 넣을 수 있어서 농도를 맞출 수 있어서 좋아요👏🏻👏🏻
1517232276,"도봉관카페,디저트",,,차 종류가 있어서 좋아요! 차분하고 자리가 다양해서 추천합니다! 케이크랑 커피랑 잘어울려요~
1517232276,"도봉관카페,디저트",,,차 종류가 있어서 좋아요! 차분하고 자리가 다양해서 추천합니다! 케이크랑 커피랑 잘어울려요~
1517232276,"도봉관카페,디저트",,,차 종류도 이렇게 다양하고 정성스럽게 진열해놓은 것 처음봅니다 최근 간 카페 중에 가장 만족스러운 것 같아요 무설탕 무밀가루 케이크도 꼭꼭 드셔보세요 진짜 맛있음 .ᐟ .ᐟ .ᐟ
1517232276,"도봉관카페,디저트",,,차 종류도 이렇게 다양하고 정성스럽게 진열해놓은 것 처음봅니다 최근 간 카페 중에 가장 만족스러운 것 같아요 무설탕 무밀가루 케이크도 꼭꼭 드셔보세요 진짜 맛있음 .ᐟ .ᐟ .ᐟ
1517232276,"도봉관카페,디저트",,,"차분하고 아늑한 분위기여서 작업할때도 좋을 것 같고, 대화할 때도 좋은 분위기 였습니다 케이크도 맛있고 직원분도 친절하셔서 모두 만족합니다 !!"
1517232276,"도봉관카페,디저트",,,"차분하고 아늑한 분위기여서 작업할때도 좋을 것 같고, 대화할 때도 좋은 분위기 였습니다 케이크도 맛있고 직원분도 친절하셔서 모두 만족합니다 !!"
1517232276,"도봉관카페,디저트",,,창동에 아늑한 카페가 있네요~~ 가성비도 좋고 맛있습니다~~ 데이트하기 좋은 감성카페 **
1517232276,"도봉관카페,디저트",,,창동에 아늑한 카페가 있네요~~ 가성비도 좋고 맛있습니다~~ 데이트하기 좋은 감성카페 **
1517232276,"도봉관카페,디저트",,,치즈케이크 맛집이라 하여 평상시에 어떤 곳인지 궁금했는데 부드러우면서 치즈 풍미가 좋았고
1517232276,"도봉관카페,디저트",,,캐익을 좋아하는 사람으로써 여러 케익을 먹어봤지만 여기가 탑 오브 탑이에요. 이런 쫀득한 케익은 첨이라 완전 추천합니다!
1517232276,"도봉관카페,디저트",,,커피도 맛나고 통창으로 차도 보고있으면 멍때리기 좋아요 조용하고 아늑하고 직원분 넘 친절하셔요:)
1517232276,"도봉관카페,디저트",,,커피도 맛나고 통창으로 차도 보고있으면 멍때리기 좋아요 조용하고 아늑하고 직원분 넘 친절하셔요:)
1517232276,"도봉관카페,디저트",,,케이크가 너무 맛있어서 기념일 케이크는 이곳에서 예약하여 홀케이크로 먹고 있어요.
1517232276,"도봉관카페,디저트",,,케이크와 차가 예쁜 그릇/잔에 담겨 나와서 기분이 좋았고 조용하고 편안한 분위기여서 힐링하기 좋았습니다.
1517232276,"도봉관카페,디저트",,,특히! 노밀가루 노슈가인 바스크 치즈 케이크는 커피랑 정말 잘 어울립니다! 너무 맛있게 먹어서 재재재방문 했어요 ㅎㅎ 커피도 맛있고 차도 향이 좋아요~ 직원분도 친절하셔서 기분 좋아지는 카페였습니다☺️
1517232276,"도봉관카페,디저트",,,특히! 노밀가루 노슈가인 바스크 치즈 케이크는 커피랑 정말 잘 어울립니다! 너무 맛있게 먹어서 재재재방문 했어요 ㅎㅎ 커피도 맛있고 차도 향이 좋아요~ 직원분도 친절하셔서 기분 좋아지는 카페였습니다☺️
1517232276,"도봉관카페,디저트",,,편안한 플레이리스트와 통창으로 탁 트인 시야까지 집중하기 너무 좋아요! 음료도 자극적이지 않고 맛있어요!!ㅎㅎ
1298308940,블랙캥거루,,,날씨가 좋아서 오늘은 꼭 맛있는 커피를 먹고 싶었어요! 저의 커피리스트에 있던 곳이라 거리가 꽤 있지만 찾아가서 시그니처 메뉴 두개 때렸습니다~ 비엔나와 아이스크림라떼라 스타일이 꽤 다르지만 둘 다 비교가 어려울 정도로 맛있어요. 취향따라 선택하시면 좋을 것 같아요!
1298308940,블랙캥거루,,,동네에 좋아하는 카페라서 자주가는데 샌드위치는 처음 먹어봤어요. 커피메뉴들은 원래 맛있는거 알고있었었고 모든 디저트들 직접 반죽해서 맘드시는거 알고있었는데 샌드위치도 주문즉시 만들어 주시더라고요. 샌드위치 진짜 맛있네요 재료때문에 샌드위치가 빵빵합니다.
1298308940,블랙캥거루,,,사장님은 친절 스타일은 아닌것 같지만 음료가 맛있어서 가끔가요^^
1298308940,블랙캥거루,,,샌드위치 쿠키 타르트 휘낭시에 커피 거를타선없이 다 맛있어요 👍
1298308940,블랙캥거루,,,샌드위치도 판매한다고 해서 시켜봤는데 너무 맛있었어요 ! 점심대용으로 먹었는데 채소도 싱싱하고 달걀도 푸짐해서 배가 부르더라고요😊 거기다 아삭하게 씹히는 피클도 너무 맛있었어요💜💚💛
1298308940,블랙캥거루,,,시켜먹었눈데 .... ㅠㅠㅠㅠㅠ 고급진치즈케이크느낌이랄까 ? 너무 부드러워요
1298308940,블랙캥거루,,,아늑하고 커피맛있어요. 시그니처 마카다미아 크림 비엔나 드세요~~^^
1298308940,블랙캥거루,,,야채러번데 아삭한 야채가득이라 제 입맛 제대로 저격했습니다ㅋㅋㅋ 스크램블도 엄청 두꺼워서 포만감까지🙌
1298308940,블랙캥거루,,,에그타르트가 너무 맛있어요 포르투갈에서 먹었던걸랑 비슷한 느낌이에요 그리고 라떼 광인인데 마카다미아 라떼가 달지도 않고 고소하니.. 죽입니다. 청귤 에이드도 상큼하니 좋아요!
1298308940,블랙캥거루,,,우이천 벚꽃길을 구경하기에 딱 좋은 카페입니다~ 야외테라스가 있어서 날씨좋은날 꽃구경하며 커피한잔하기 넘넘좋아요 달콤한 디저트들도 있어서 가족들과 오기에도 딱이에요!
1298308940,블랙캥거루,,,우이천 산책하다 있는 카페인데 분위기좋고 좋아요~😊
1298308940,블랙캥거루,,,음악도 분위기도 좋고 이 동네에 전무후무한 카페입니다
1298308940,블랙캥거루,,,인테리어도 분위기있고 조용히 이야기하기 너무좋아요 야외에 자리도 마련되어있어서 오늘같이 벚꽃피고
1298308940,블랙캥거루,,,"자주 찾아올 것 같은 카페이고, 가벼운 작업하러 방문하기도 좋을 것 같아요 추천해요!"
1298308940,블랙캥거루,,,저녁에 방문예약 없이 이용대기 시간 바로 입장데이트연인・배우자
1298308940,블랙캥거루,,,저녁에 방문포장·배달 이용대기 시간 바로 입장일상혼자
1298308940,블랙캥거루,,,"점심에 방문대기 시간 30분 이내나들이연인・배우자, 아이"
1298308940,블랙캥거루,,,점심에 방문예약 없이 이용대기 시간 30분 이내일상친구
1298308940,블랙캥거루,,,점심에 방문예약 없이 이용대기 시간 30분 이상일상지인・동료
1298308940,블랙캥거루,,,점심에 방문예약 없이 이용대기 시간 바로 입장나들이아이
1298308940,블랙캥거루,,,"점심에 방문예약 없이 이용대기 시간 바로 입장나들이연인・배우자, 친구"
1298308940,블랙캥거루,,,점심에 방문예약 없이 이용대기 시간 바로 입장데이트연인・배우자
1298308940,블랙캥거루,,,점심에 방문예약 없이 이용대기 시간 바로 입장데이트친구
1298308940,블랙캥거루,,,점심에 방문예약 없이 이용대기 시간 바로 입장일상
1298308940,블랙캥거루,,,"점심에 방문예약 없이 이용대기 시간 바로 입장일상연인・배우자, 친척・형제"
1298308940,블랙캥거루,,,점심에 방문예약 없이 이용대기 시간 바로 입장일상지인・동료
1298308940,블랙캥거루,,,점심에 방문예약 없이 이용대기 시간 바로 입장일상지인・동료
1298308940,블랙캥거루,,,점심에 방문예약 없이 이용대기 시간 바로 입장일상지인・동료
1298308940,블랙캥거루,,,점심에 방문예약 없이 이용대기 시간 바로 입장일상혼자
1298308940,블랙캥거루,,,점심에 방문예약 없이 이용대기 시간 바로 입장친목친구
1298308940,블랙캥거루,,,점심에 방문예약 없이 이용대기 시간 바로 입장친목친구
1298308940,블랙캥거루,,,점심에 방문예약 없이 이용대기 시간 바로 입장친목친구
1298308940,블랙캥거루,,,점심에 방문예약 없이 이용대기 시간 바로 입장친목친구
1298308940,블랙캥거루,,,점심에 방문예약 없이 이용대기 시간 바로 입장친목친구
1298308940,블랙캥거루,,,점심에 방문예약 없이 이용대기 시간 바로 입장친목친척・형제
1298308940,블랙캥거루,,,"점심에 방문예약 후 이용대기 시간 바로 입장기념일, 일상, 나들이연인・배우자"
1298308940,블랙캥거루,,,점심에 방문포장·배달 이용대기 시간 바로 입장여행부모님
1298308940,블랙캥거루,,,집 근처에 이런 카페가 있어서 너무 좋아요 아기랑 가족이랑 자주 방문 합니다
1298308940,블랙캥거루,,,추석 연휴도 오픈해주셔서 가족들과 즐거운 시간을 보냈어요! 커피도 너무 맛있고 인테리어도 예뻐서 잘 놀다 가요^^
1298308940,블랙캥거루,,,친구 생일 기념으로 초당옥수수바스크치즈케이크 주문했어요~!! 수유 바스크치즈케이크 찾아보다가 초당옥수수 올라간 케이크라 디자인도 예쁘고 맛있을 것 같아서 예약했어요ㅎㅎ 사장님께서 너무너무 친절하세요!!! 예쁜 초랑 보냉백도 꼼꼼하게 챙겨주시고ㅠㅠ 사진도 제대로 못 찍고 바로 먹을 정도로 너무 맛있었습니당!!😋 생일인 친구도 너무 좋아하고 잘 먹었네용💛 다음에 또 방문할게요!! 사장님 감사해용ㅎㅎ
1298308940,블랙캥거루,,,친정 올때마다 들르는 최애 까페에요~ 너무 깔끔하고 맛있어요:) 공간 구석구석 센스가 넘쳐요.
1298308940,블랙캥거루,,,커피 맛있어서 오는 집인데 샌드위치 먹으러 재방문 할거 같습니다.
1298308940,블랙캥거루,,,커피 원두 선택도 가능하고 작은 구움과자들이 다양하게 있어서 같이 곁들이면 좋을 것 같아요🩷
1298308940,블랙캥거루,,,커피가 맛있어요!! 진짜 맛있어요ㅎㅎ 샌드위치는 무난한 맛이지만 안에 재료가 푸짐하게 들어가 있어 끼니 때우기에 괜찮을 듯해요!!
1298308940,블랙캥거루,,,커피가 맛있어요. 우이천길 운동하다 비가와서 따듯한 ☕️커피마시러 들어왔는데 음악도 좋고 야외테이블도 예뻐요!! 커피도 맛있고 분위기 아늑해서 너무 좋아요🩷빵도 포장해서 갑니다 🍞
1298308940,블랙캥거루,,,커피랑 샌드위치 함께 먹으면서 수다 타임 잘 즐겼어요^^ 사장님 친절하시고 커피도 맛있어요😊
1298308940,블랙캥거루,,,크리스마스 분위기나고 좋아요! 음악도 좋고 쿠키와 뱅쇼도 맛있습니다. 우이천 산책길에 몸녹이기 좋네요^^
1298308940,블랙캥거루,,,"특히, 저 계란이 큼지막하게 들어간 샌드위치 제발 안 먹어본 사람 없게 해주세요😭 (집에 3개정도 더 사갈까 고민함...)"
1298308940,블랙캥거루,,,회사가 근처라서 자주 오는데 디져트 언제나 맛있고 카페인 뿜뿜 커피도 넘 맛있어요 🧤 이번에 겨울시즌 맞아 딸기 케익들 나왔길래 정말 너무 기뻐요 ㅠ . ㅠ 진짜 맛있으니까 꼭 드셔보새오 !!
2046665158,사과당 창동역점,,,6가지 포장해 왔는데 남은 건 냉장고 보관했다가 에프에 3분 데워 먹었어요 겉바속촉으로 달달해서 아.아랑 먹으면 너무 맛있어요 저는 오리지널 사과파이가 제일 좋네요
2046665158,사과당 창동역점,,,가봐야지 하다 생겨서 가보게 되었는데 들어가자마자 달콤한 파이냄새가 좋았습니다
2046665158,사과당 창동역점,,,간식 땡겨서 들어갔는데 페스츄리가 진짜 맛있어요 크림이 느끼하지 않고 맛있어 한입 먹자마자 바로 행복감이 올라와요 든든하게 먹고 갈 수 있어 좋네요
2046665158,사과당 창동역점,,,남자친구와 왔는데 창동역에도 사과당이라니!?!?여기 애플파이 너무 맛있습니다 단점이라면 살이 급속도로 찔 수있다는거...~?하지만 끊을 수 없네요...💗
2046665158,사과당 창동역점,,,너무 맛있게 잘 먹고 왔어요 페스츄리가 바삭하고 크림이 느끼하지 않고 맛있어요 사과밀크티도 달달하니 좋네요
2046665158,사과당 창동역점,,,너무 상큼하고 달달한 사과밀크티 짱이에요 진짜 실제 사과가 들어있어서 그런지 상큼함이 살아있어요 페스츄리도 바삭하니 함께 먹으니 완벽해요
2046665158,사과당 창동역점,,,"드디어 왔습니다. 사과당 애플파이, 후렌치파이 바삭하고 달콤해요. 애플파이 귀신 아이가 좋아합니다."
2046665158,사과당 창동역점,,,들어가자마자 실제 사과가 들어간 음료들이 눈에 띄었어요 사과밀크티 한 잔 시켜봤는데 정말 상큼함이 가득 느껴졌어요 페스츄리와 궁합도 좋아서 간식으로 딱인 것 같아요
2046665158,사과당 창동역점,,,"리뷰 4,012사진 17,382팔로워 439테마 12"
2046665158,사과당 창동역점,,,맛있는 페스츄리를 먹었어요. 부드러운 크림이 느끼하지 않고 달콤해서 좋았네요. 사과밀크티랑 같이 먹으니 환상의 조합이었어요.
2046665158,사과당 창동역점,,,맛있는 페스츄리와 사과밀크티에 반했네요 크림이 느끼하지 않아서 더 맛있게 먹었어요
2046665158,사과당 창동역점,,,밤 9시쯤 방문해서 수량은 오리지널 제외하곤 몇 개 안남았는데요...ㅠㅠ 오리지날은 늦게가도 수량 많습니다😊 생긴지 얼마 안되서 엄청 깔끔하구요!!! 특히 후렌치파이를 진짜 만들어서 팔아주시다니 ㅋㅋ 최고에요 .. (상상만 했던 그 맛) 꼭 방문해보세요🍎
2046665158,사과당 창동역점,,,비쥬얼과 냄새에 이끌려 들어왔어요. 기대 이상 맛이었습니다. 고소하고~ 바삭하고 풍미가 !!! 또 와서 사먹고 싶어요.
2046665158,사과당 창동역점,,,사과당 생겨서 좋아요 ♡ 맛있어서 좋아해요 ㅎㅎ
2046665158,사과당 창동역점,,,사과밀크티를 맛보고 정말 만족스러웠어요. 달콤함이 적절해서 질리지 않고 깔끔한 맛이었습니다. 페스츄리도 함께 사서 가족들과 나눠 먹었는데 생각보다 훨씬 맛있었어요.
2046665158,사과당 창동역점,,,사과파이 오리지널도 맛있는데 소문대로 유유크림 사과파이 맛있어요!!!사과과육이 씹히고 파이겹겹이 부드러워요~♡
2046665158,사과당 창동역점,,,사과파이를 직접구워서 파는곳입니다 추천해요~
2046665158,사과당 창동역점,,,사과파이맛있는곳입니다 데어먹으면 더 맛있다고하네요
2046665158,사과당 창동역점,,,사과향 가득한 속이랑 파이가 퍽퍽하지 않고 바삭하고 고소해요! 크림이 기름지지 않고 부드러워요 당떨어질때 최고입니다. 재방문 의사 100%!
2046665158,사과당 창동역점,,,사과향이 진하게 나는 사과밀크티가 정말 맛이 좋더라고요 ㅎㅎ 페스츄리도 적당한 단맛과 바삭함이 느껴졌어요 가족들이랑 나눠 먹기 좋은 양이었어요
2046665158,사과당 창동역점,,,사장님 제가 오리지널두개다 다이렇습니다 하나는 먹던거라 싫어하는 슈크림 억지로 먹었는데 다른것도 이렇습니다 사과쨈은 어디있나요? 제가 오리지널만 먹습니다 더는 못먹겠어서 지퍼백에 포장해서 환불요청예정입니다 애플파이 정말 좋아해서 힘든 월요일 저녁 디저트로 산건데 너무 허무합니다 이건 정말 아니에요 저 이건 참 싫어해요 주문한거 먹고싶어요 애플쨈이 들어간걸로 속이 지금 너무 느끼합니다 하루의 마감을 망쳤어요 ㅠㅠ 실수하신건 알지만 이거 메뉴가 이상합니다 슈크림만 너무 느끼하게 감싸져있어요 사과쨈도 없이 ..이거 애플파이가 아닙니다 크림빵입니다 저는 슈크림빵을 사고싶지 않습니다
2046665158,사과당 창동역점,,,상큼한 맛이에요 사과밀크티 마셨는데 실제 사과가 들어있어서 더 좋네요 ㅎㅎ 차가운 음료에 달콤하면서도 상큼함이 어우러져서 기분까지 좋아져요 다음에 페스츄리도 함께 먹어봐야겠어요~
2046665158,사과당 창동역점,,,새로생긴 곳이라 매장도 되게 깨끗하고 직원분들도 굉장히 친절하십니다! 커피도 싸요 ㅎ 추천추천
2046665158,사과당 창동역점,,,새로생긴 사과파이집이에요 커피할인 이벤트중입니다
2046665158,사과당 창동역점,,,새로오픈한곳입니다 커피할인 이벤트하고있고 사과파이 맛집이에요
2046665158,사과당 창동역점,,,"속이 꽉 찬 사과 필링이 상큼하면서도 달콤하고, 파이 겉면은 바삭한 식감이 살아 있어요."
2046665158,사과당 창동역점,,,여기 페스츄리 진짜 맛있어요~ 사과밀크티랑 같이 먹으니 더 맛있네요 애플히비스커스는 상큼하고 달달해서 좋더라구요
2046665158,사과당 창동역점,,,역시 사과밀크티는 이 집이 최고네요 진짜 사과가 듬뿍 들어있어서 너무 상큼하고 달콤해요 페스츄리도 바삭하고 달달해서 같이 먹으니 조화가 딱 좋았어요
2046665158,사과당 창동역점,,,역시 이런 페스츄리는 가족들이랑 즐기기에 너무 좋은 것 같아요. 사과밀크티도 달달하니 느껴졌어요.
2046665158,사과당 창동역점,,,예산시장 갈때마다 줄서서 사왔던 사과당이 창동에 생기다니!! 대박이에요 넘 좋아요 ㅠㅠㅠ
2046665158,사과당 창동역점,,,예산시장에서 먹던 사과파이를 가까이에서도 먹을 수 있다니 넘 좋네요♡
2046665158,사과당 창동역점,,,완전 기본에 충실한 클래식 사과파이..많이안달고 넘모 맛있습니다!! 지나가다가 맨날 들를거같아요 ㅠㅠ
